user_input,retrieved_contexts,response,reference,faithfulness,answer_relevancy,context_precision,context_recall
What business activities is the Saudi Arabian Oil Company engaged in?,"[""seeks to support local content and develop Aramco extended the reach of its STEM education initiatives to innovative opportunities for the future. Europe, the Americas, and Asia through programs that aimed to, among others, develop the capability of STEM educators and iktva and national champions enhance access to resources needed to support effective STEM Aramco believes its commitment and investment in training, skills education, including infrastructure and teaching materials, development, and nurturing of in-Kingdom partnerships has involving teachers especially from predominately low-income and contributed to the development of the labor force in Saudi Arabia, underserved school districts and schools in less developed areas.\nwhile adding robustness to the Company’s supply chain through localization. Aramco’s citizenship initiatives in 2024 demonstrated a deep commitment to community engagement and societal development.\nDuring 2024, Aramco continued to play a role in the localization of Key highlights include employee donation campaigns, such as the the supply chain and developing a Saudi-based energy ecosystem.\nBlueBox Campaign and Ramadan Donation Campaign that provided The Company’s iktva program is an ongoing success, and through food, along with social, educational, and medical support to it the local component of the Company’s overall expenditure across underprivileged families. The Company also led impactful micro- its supply chain now stands at 67.0%, with a target to grow to industry projects like the Saudi Coffee Development Center,\n70.0% by the end of 2025. This program retained billions of dollars\nfostering local economic growth. Aramco’s outreach efforts in economic activity within Saudi Arabia, thereby serving the celebrated cultural milestones like the Saudi National Day Company’s interest while supporting the local economy. In 2024, with orphans and people with disabilities, while educational partnerships like the STEM Challenge and World Robotics Olympiad\nestimated value of ﷼ 65.7 billion ($17.5 billion) to strengthen the\nempowered future innovators. Aramco's Energy Access Program local supply chain ecosystem for strategic commodities and enhance distributed over 20,000 cooking stoves, benefiting more than the manufacturing landscape within the Kingdom. In addition, 153,000 people in India. Volunteering activities, such as blood\nAramco signed 145 agreements and Memoranda of Understanding donation campaigns, home renovation projects, and collaborations\nvalued at around ﷼ 33.75 billion ($9.0 billion) at the 2025 iktva\nwith people with disabilities care centers showcased Aramco's Forum and Exhibition. The Company has also launched the Supplier dedication to inclusion and community welfare.\nESG Program, aimed at embedding ESG principles across its supply chain.\niktva1,2\n\n63.0 65.0 67.0\n57.5 59.0\n2020 2021 2022 2023 2024\n1. Percentage of total procurement expenditures locally sourced.\n2. Applies to the Saudi Arabian Oil Company (the Company).\n\n5 . O RGANIZATIONAL 6. A DDITIONAL STRUCTURE AND FINANCIAL 7. C ONSOLIDATED\n\nAND STRATEGY PERFORMANCE 3. SUSTAINABILITY 4. RISK GOVERNANCE INFORMATION STATEMENTS Ithra, Aramco’s flagship citizenship initiative, has grown to be a Aramco also fosters a culture of volunteerism among both leading stakeholder in the Kingdom’s arts and culture sector by employees and community members. In 2024, it introduced a driving engaging and relevant programs for cultural sector unified global volunteer program called “Energy for You” uniting development, innovation, education, and entrepreneurship. Since employees across local and international offices under a shared opening, Ithra has welcomed around five million visitors who have mission and brand. Aramco has also significantly expanded its engaged in thousands of offerings. School visits and special visits, employee volunteer program while facilitating a well-established organized as part of Ithra's community engagement efforts, volunteer program for the public at Ithra. Further reinforcing its continue to enrich children's cultural knowledge, benefiting more efforts on impactful and innovative community service, Aramco,\nthan 120,000 children over the years. In 2024, there was a together with its partners, also offers training and certification for\ncompelling series of programs, exhibitions, performances, volunteer practitioners and leaders in public education with the aim workshops, events, and other various initiatives. These world-class of enhancing the curation of volunteer activities. Additionally, the experiences bring together culture, innovation, and knowledge, Company provides volunteering impact awareness sessions and and are carefully designed to engage diverse communities. curated courses for public education students.\nKing Abdulaziz Center for World Culture (Ithra), Dhahran, Saudi Arabia\n\n5 . O RGANIZATIONAL 6. A DDITIONAL STRUCTURE AND FINANCIAL 7. C ONSOLIDATED\n\nAND STRATEGY PERFORMANCE 3. SUSTAINABILITY 4. RISK GOVERNANCE INFORMATION STATEMENTS Risk management:"", 'can be no assurance that at the date the reserve estimates are made. guidance. Any material reduction in the quantity areas from third-party providers in excess of the Aramco can continue to renew its existing levels There can be no assurance that the or value of Aramco’s proved reserves could coverage provided through Stellar. of coverage on commercially acceptable terms, or interpretations, assumptions and judgments adversely affect Aramco’s business and Aramco does not insure against all risks and its at all. As a result, it could incur significant losses utilized by Aramco to estimate proved reserves, reputation.\nfrom uninsured risks or risks for which its insurance may not protect it against liability from insurance does not cover the entire loss. Any such all potential events, particularly catastrophic losses could have a material adverse effect on Future epidemics or Future epidemics or pandemics may have a chemicals products which had a direct impact on events such as major crude oil spills, Aramco’s business, financial position and results pandemics and their impact widespread impact on business and economic Aramco’s business. In addition, an epidemic or environmental disasters, terrorist attacks or acts of operations. on business and economic conditions and, in particular, on Aramco’s pandemic may result in volatility in global capital of war. In addition, it does not maintain business conditions may have negative business, including on the demand for crude oil, markets and investor sentiment, which may affect effects on Aramco’s business. natural gas, refined and chemicals products. For the availability, amount and type of financing Terrorism and armed conflict Aramco’s facilities have been targeted by terrorist Furthermore, in both May and August 2019, the example, public health authorities and available to Aramco.\nmay materially and adversely and other attacks. In March 2022, a storage East-West pipeline and the Shaybah field, governments at local, national and international Furthermore, if a significant percentage of affect Aramco. facility in Jeddah was subject to attack by respectively, were targeted by unmanned aerial levels implemented various measures to respond Aramco’s workforce is unable to work, or if unmanned aerial vehicles and missiles and, in vehicle attacks. These attacks resulted in a brief to the COVID-19 pandemic, including restrictions Aramco is required to close facilities because of\nMarch 2021, the Riyadh refinery was subject to shutdown of the pipeline and fires and damage on travel, voluntary and mandatory quarantines, illness or government restrictions, Aramco’s an attack by unmanned aerial vehicles. In to the processing and cogeneration infrastructure workforce reductions of personnel who are operations and business may be negatively addition, in September 2019, the Abqaiq facility at the Shaybah NGL facility. deemed to be nonessential and restrictions on affected.\nand the Khurais processing facility were subject business activities. These measures led to lower to attack by unmanned aerial vehicles and Additional terrorist or other attacks or armed demand for crude oil, natural gas, refined and conflict could impact Aramco’s operations and missiles. As a result of the attacks on the Abqaiq have a material adverse effect on Aramco’s facility and the Khurais processing facility, crude business, financial position and results of Aramco may not realize Aramco has engaged in, and may continue to difficulties could impact Aramco’s ongoing oil production and associated gas production operations, could cause Aramco to expend some or all of the expected engage in, acquisitions of businesses, business, distract its management and employees were temporarily reduced and Aramco took a significant funds and could impact the market benefits of recent or future technologies, services, products and other assets and increase its expenses which could, in turn, number of actions to minimize the impact of price of its shares. acquisitions. from time to time. Any such acquisition entails have a material adverse effect on its business, lower Arabian Light and Arabian Extra Light various risks, including that Aramco may not be financial position and results of operations.\nproduction by tapping into Aramco’s inventories able to accurately assess the value, strengths and\nlocated outside of the Kingdom and swapping weaknesses of the acquisition or investment On June 16, 2020, Aramco acquired the PIF’s 70%\ncrude oil grades of deliveries to Arabian Medium targets, effectively integrate the purchased equity interest in SABIC for total consideration of\nand Arabian Heavy. businesses or assets, achieve the expected SAR 259.1 billion ($69.1 billion). For the\nintegration of the acquisition to be successful for synergies or recover the purchase costs of the Aramco, it will need to continue to manage its acquired businesses or assets. Aramco may also ownership stake in SABIC in a manner which incur unanticipated costs or assume unexpected supports the optimization of SABIC’s liabilities and losses in connection with any performance. The realization of such benefits business or asset it acquires, including in relation may be affected by a number of factors, many of to the retention of key employees, legal which', ""’s historic and Government forgoing its rights to such anticipated earnings and cash flow, It is the intention of the Board, in its dividend as follows, the Government the Company’s financial obligations and discretion, to deliver sustainable dividends will forgo its right to receive the portion capital requirements, general economic to its shareholders. The Company’s of cash dividends on its ordinary shares and market conditions and other factors Dividend Distribution Policy states that equal to the amount necessary to enable deemed relevant by the Board. The dividends may be declared from net the Company to first pay the minimum Company’s expectations in connection profits only after the Company has: quarterly cash dividend amount described with these factors are subject to above to holders of ordinary shares other\n• ensured that dividends are capable numerous assumptions, risks and than the Government. The remaining of being distributed by the Company uncertainties, which may be beyond amount of the declared dividend as with reference to its most current the Company’s control. determined by the Board in its discretion financial statements;\nwill be paid to the Government.\nThe Company pays dividends to non- • established any reserves to meet Government shareholders in SAR and contingencies as determined from time In addition, dividends forgone will to the Government in U.S. Dollars. to time at the discretion of the Board; not accrue or otherwise be paid to the All shares have the same entitlement and Government and the waiver applies to any dividends declared by the to all ordinary shares not held by the\n• taken into consideration its working Board and any dividends are and will Government from time to time and capital requirements, near-term be distributed in compliance with held from 2020 to 2024.\nliquidity and any other factors or applicable tax laws.\nconsiderations that may be relevant In 2020, no shareholder of the Company in this regard, including but not limited has waived any rights to dividends.\nto the implications of any dividend distributions on the Company’s capital Punishments and penalties structure, credit ratings and publicly The Company is committed to the highest communicated gearing targets.\nstandards of governance and complies with applicable laws and regulations.\nThe Company is not aware of any penalty, precautionary procedure or preventative measure imposed on it by any authority, supervisory, regulatory or judicial body in 2020.\nBoard of Directors’ report The information contained in Sections 1 – 7 of this Annual Report constitutes the Board of Directors’ report.\n\nCompliance with CMA Corporate Governance Regulations The Company has implemented all the provisions contained in the Corporate Governance Regulations issued by the CMA that can be found publicly on the CMA website, except the provisions noted below:\nArticle No. Provision of the Article Justification\n20(c)(10) (c) By way of example, the following negate the The Company acknowledges that one of its independent\nindependence requirement for an Independent Directors has served on the Board for more than nine Director: years. While this provision remains a Guiding Article until the end of this Director's current term (his term started (10) if he/she served for more than nine years, prior to January 1, 2019), the Company evaluates the consecutive or inconsecutive, as a Board member independence of each of its independent Directors of the Company. annually and has determined that all are able to perform the duties and exercise the independent judgment required of the role.\n46(3) Without prejudice to Article (72) of the Companies Law No current Board members of the Company have\nand other relevant provisions in these regulations, if a expressed a desire to “engage in a competitive business”\nmember of the Board desires to engage in a business or activity in 2020. Notwithstanding this fact, the that may compete with the Company or any of its Company is aware of the regulatory requirement to activities, the following shall be taken into account: maintain a set of “competition standards” by which to assess potential future requests of this nature, if any.\n(3) the chairman of the Board informing the Ordinary To that end, the Company has implemented a process General Assembly, once convened, of the competing to develop such competition standards, and expects businesses that the member of the Board is engaged to present the same to its shareholders at the Company’s in, after the Board assesses the board member's 2021 AGM for approval. As a result, the Company expects competition with the Company's business or if he/she to be in compliance with this CGR by the end of 2021.\nis in competition with one of the branch activities that it conducts in accordance with the standards issued by the Ordinary General Assembly upon a proposal from the Board and published on the Company’s website, provided that such businesses are assessed on annual basis.\n(Guiding Article) it shall assign to it the competences (sic) stipulated in the Nomination Committee, formed pursuant to the Article (94) of these Regulations. Such committee shall Company Bylaws, with the responsibility of overseeing oversee any matters relating to the implementation of and making recommendations to the Board with respect governance, and shall provide the Board with its to the Company's corporate governance policies and reports and"", 'materially and adversely unmanned aerial vehicles. In addition, in respectively, were targeted by unmanned aerial affect Aramco. September 2019, the Abqaiq facility and the vehicle attacks. These attacks resulted in a brief shutdown of the pipeline and fires and damage to Khurais processing facility were subject to attack the processing and cogeneration infrastructure at by unmanned aerial vehicles and missiles. As a the Shaybah NGL facility.\nresult of the attacks on the Abqaiq facility and the Khurais processing facility, crude oil production Additional terrorist or other attacks or armed and associated gas production were temporarily conflict could impact Aramco’s operations and reduced and Aramco took a number of actions to have a material adverse effect on Aramco’s minimize the impact on lower Arabian Light and business, financial position, and results of Arabian Extra Light production by tapping into operations, could cause Aramco to expend Aramco’s inventories located outside of the significant funds and could impact the market price of the shares.\nAramco’s reserve estimates conform to the estimate proved reserves will prove to be Hydrocarbon SPE-PRMS definitions and guidelines, which are appropriate or accurate. Any significant deviation reserves internationally recognized industry standards from these interpretations, assumptions, or promulgated by the Society of Petroleum judgments could materially affect the estimated Estimates of proved Engineers, the World Petroleum Council, the quantity or value of Aramco’s proved reserves. In hydrocarbon reserves depend American Association of Petroleum Geologists, the addition, these estimates could change due to new on significant interpretations, Society of Petroleum Evaluation Engineers, the information from production or drilling activities, assumptions, and judgments. Society of Exploration Geophysicists, the Society of future adjustments to MSC, changes in economic Any significant deviation or Petrophysicists and Well Log Analysts, and the factors, including changes in the price of changes in existing economic European Association of Geoscientists and hydrocarbons, changes to laws, regulations, or the and operating conditions Engineers. Reserve estimation is an inherently terms of the Concession or other events. Further, could affect the estimated complex process that principally relies on a declining hydrocarbon prices may cause certain quantity and value of combination of knowledge, experience, and proved reserves to no longer be considered Aramco’s proved reserves. judgment. Aramco’s estimates of the quantity of commercially viable, which could result in Aramco’s proved hydrocarbon reserves depend on downward adjustments to Aramco’s estimates of its significant interpretations, assumptions, and proved reserves, impairment of its assets, or changes judgments relating to available geological, to its capital expenditures and production plans.\ngeophysical, engineering, contractual, economic, Moreover, proved reserve estimates are subject to and other information, and take into account change due to errors in the application of existing economic and operating conditions and published rules and changes in guidance. Any commercial viability as at the date the reserve material reduction in the quantity or value of estimates are made. Aramco’s proved reserves could adversely affect Aramco’s business and reputation.\nThere can be no assurance that the interpretations, assumptions, and judgments utilized by Aramco to\n\nAramco overview Results and Sustainability Risk Organizational structure Additional financial Consolidated and strategy performance and corporate governance and legal information financial statements Future epidemics or pandemics may have a crude oil, natural gas, refined and chemicals Epidemics and widespread impact on business and economic products, which had a direct impact on Aramco’s pandemics conditions and, in particular, on Aramco’s business, business. In addition, an epidemic or pandemic including on the demand for crude oil, natural gas, may result in volatility in global capital markets Future epidemics or refined and chemicals products. For example, in and investor sentiment, which may affect the pandemics and their impact 2020, public health authorities and governments at availability, amount, and type of financing on business and economic local, national, and international levels available to Aramco.\nconditions may have negative implemented various measures in response to the effects on Aramco’s business. COVID-19 pandemic, including restrictions on Furthermore, if a significant percentage of Aramco’s workforce is unable to work, or if travel, voluntary and mandatory quarantines, Aramco is required to close facilities because of reductions of nonessential personnel reporting illness or government restrictions, Aramco’s into workplaces, and restrictions on business operations and business may be negatively activities. These measures led to lower demand for affected.\nAramco has engaged in, and may continue to contingencies (such as, contractual, financial, Acquisition benefits engage in, acquisitions of businesses, technologies, regulatory, environmental, or other obligations and integration services, products, and other assets from time to and liabilities) and risks related to the acquired time. Any such acquisition entails various risks, business, and the maintenance and integration of Aramco may not realize some including that Aramco may not be able to procedures, controls, and quality standards. These or all of the expected benefits accurately assess the value, strengths', '(396)\nNet cash used in financing activities (48,134) (73,064) (12,836) (19,483)\nNet increase (decrease) in cash and cash equivalents 58,291 (4,222) 15,544 (1,126)\nCash and cash equivalents at beginning of the period 299,579 207,232 79,888 55,262\nCash and cash equivalents at end of the period 357,870 203,010 95,432 54,136\n*Supplementary information is converted at a fixed rate of U.S. dollar 1.00 = SAR 3.75 for convenience only.\nAmin H. Nasser Ziad T. Al Murshed Bassam M. Asiri Director, Chief Financial Officer & Controller President & Chief Executive Officer Senior Vice President First quarter interim report 2022 All amounts in millions of Saudi Riyals unless otherwise stated Notes to the condensed consolidated interim financial report 1.General information The Saudi Arabian Oil Company (the “Company”), with headquarters located in Dhahran, Kingdom of Saudi Arabia (the “Kingdom”), is engaged in prospecting, exploring, drilling and extracting hydrocarbon substances (“Upstream”) and processing, manufacturing, refining and marketing these hydrocarbon substances (“Downstream”). The Company was formed on November 13, 1988 by Royal Decree No. M/8; however, its history dates back to May 29, 1933 when the Saudi Arabian Government (the “Government”) granted a concession to the Company’s predecessor the right to,\namong other things, explore the Kingdom for hydrocarbons. Effective January 1, 2018, Council of Minister’s Resolution No. 180, dated 1/4/1439H\n(December 19, 2017), converted the Company to a Saudi Joint Stock Company with new Bylaws.\nOn December 11, 2019, the Company completed its Initial Public Offering (“IPO”) and its ordinary shares were listed on the Saudi Stock Exchange\n(“Tadawul”). In connection with the IPO, the Government, being the sole owner of the Company’s shares at such time, sold an aggregate of 3.45 billion ordinary shares, or 1.73% of the Company’s share capital.\nOn February 13, 2022, the Government transferred 8 billion ordinary shares, or 4% of the Company’s share capital, to the Public Investment Fund\n(“PIF”), the sovereign wealth fund of the Kingdom. Following the transfer, the Government remains the Company’s largest shareholder, retaining a 94.19% direct shareholding.\nThe condensed consolidated interim financial report of the Company and its subsidiaries (together “Saudi Aramco”) was approved by the Board of\nDirectors on May 13, 2022.\n2.Basis of preparation and other significant accounting policies\nThe condensed consolidated interim financial report has been prepared in accordance with International Accounting Standard 34 (“IAS 34”),\nInterim Financial Reporting, that is endorsed in the Kingdom, and other standards and pronouncements issued by the Saudi Organization for Chartered and Professional Accountants (“SOCPA”). This condensed consolidated interim financial report is consistent with the accounting policies and methods of computation and presentation set out in Saudi Aramco’s consolidated financial statements for the year ended December\n31, 2021, except for new and amended standards disclosed below.\nThe results for the interim periods are unaudited and include all adjustments necessary for a fair presentation of the results for the periods presented. This condensed consolidated interim financial report should be read in conjunction with the consolidated financial statements and\nrelated notes for the year ended December 31, 2021, which have been prepared in accordance with International Financial Reporting Standards\n(“IFRS”) that are endorsed in the Kingdom, and other standards and pronouncements issued by SOCPA. The consolidated financial statements for the year ended December 31, 2021 are also in compliance with IFRS as issued by the International Accounting Standards Board (“IASB”).\nTranslations from SAR to USD presented as supplementary information in the Condensed Consolidated Statement of Income, Condensed Consolidated Statement of Comprehensive Income, Condensed Consolidated Balance Sheet, Condensed Consolidated Statement of Changes in\nEquity, and Condensed Consolidated Statement of Cash Flows at March 31, 2022 and December 31, 2021 and for the three-month periods ended\nMarch 31, 2022 and 2021, are for convenience and were calculated at the rate of USD 1.00 = SAR 3.75 representing the exchange rate at the\nbalance sheet dates.\nThe global economy continued to experience a strong recovery in the first quarter of 2022, reflecting increased mobility and the resumption of business activities. The global energy demand remained robust which resulted in a steady increase in crude oil prices. Given that crude oil sales account for a substantial portion of the Company’s revenue, the increased prices']","The Saudi Arabian Oil Company is engaged in prospecting, exploring, drilling, and extracting hydrocarbon substances (referred to as ""Upstream""), as well as processing, manufacturing, refining, and marketing these hydrocarbon substances (referred to as ""Downstream"").","Saudi Aramco is engaged in prospecting, exploring, drilling, and extracting hydrocarbons upstream, as well as processing, manufacturing, refining, and marketing them downstream.",1.0,0.9370431004262173,0.19999999998,1.0
When was Saudi Aramco converted into a Saudi Joint Stock Company?,"['”), with headquarters located in Dhahran, Kingdom of Saudi Arabia (the “Kingdom”), is engaged in prospecting, exploring, drilling and extracting hydrocarbon substances (“Upstream”) and processing, manufacturing, refining and marketing these hydrocarbon substances (“Downstream”). The Company was formed on November 13, 1988 by Royal Decree No. M/8; however, its history dates back to May 29, 1933 when the Saudi Arabian Government (the “Government”) granted\na concession to the Company’s predecessor the right to, among other things, explore the Kingdom for hydrocarbons.\nOn December 20, 2017, Royal Decree No. M/37 dated 2/4/1439H was issued approving the Hydrocarbons Law which applies to the\nKingdom’s hydrocarbons and hydrocarbon operations. Under the Hydrocarbons Law, all hydrocarbon deposits, hydrocarbons and hydrocarbon resources are the property of the Kingdom until ownership is transferred at the well head or when extracted. Further, the Hydrocarbons Law codifies the Government’s sole authority to set the maximum amount of hydrocarbons production by the Company and the maximum sustainable capacity that the Company must maintain.\nAll natural resources within the Kingdom, including hydrocarbons, are owned by the Kingdom. Through a concession in 1933, the Government granted the Company the exclusive right to explore, develop and produce the Kingdom’s hydrocarbon resources,\nexcept in certain areas. As of December 24, 2017, the Company’s original concession agreement was replaced and superseded by\nan amended concession agreement (the “Concession Agreement”) which provides the Company the exclusive right to explore, drill, prospect, appraise, develop, extract, recover, and produce hydrocarbons in the concession area. The Company is also provided the exclusive right to market and distribute hydrocarbons, petroleum products and liquid petroleum gas (“LPG”) in the Kingdom along with the non-exclusive right to manufacture, refine, and treat production and to market, sell, transport and export such production.\nThe initial term of the Concession Agreement is for 40 years which shall be extended by the Government for 20 years unless the\nCompany does not satisfy certain conditions commensurate with its then current operating practices. In addition, the Concession\nAgreement may be amended and extended for an additional 40 years beyond the original 60-year period subject to the Company\nand the Government agreeing on the terms of such extension.\nEffective January 1, 2018, Council of Minister’s Resolution No. 180, dated 1/4/1439H (December 19, 2017) converted the Company to\na Saudi Joint Stock Company with new Bylaws. The Company’s 1988 Articles were cancelled as of January 1, 2018 pursuant to Royal\nDecree No. M/36, dated 2/4/1439H (December 20, 2017). The Company’s share capital has been set at Saudi Riyal (“SAR”) 60,000,\nis fully paid and is divided into 200 billion ordinary shares with equal voting rights without par value. The Company’s Commercial Registration Number is 2052101150.\nOn December 11, 2019, the Company completed its Initial Public Offering (“IPO”) and its ordinary shares were listed on the Saudi\nStock Exchange (“Tadawul”). In connection with the IPO, the Government, being the sole owner of the Company’s shares at such time,\nsold an aggregate of 3.45 billion ordinary shares, or 1.73% of the Company’s share capital. In addition, concurrent with the IPO, the\nCompany acquired 117.2 million of its ordinary shares from the Government for a cash payment of SAR 3,750, and classified them as\ntreasury shares (Note 16). These shares are being used by the Company for its employee share plans (Note 17).\nOn February 13, 2022, the Government transferred 8 billion ordinary shares, or 4% of the Company’s share capital, to the Public\nInvestment Fund (“PIF”), the sovereign wealth fund of the Kingdom. Following the transfer, the Government remains the Company’s largest shareholder, retaining a 94.19% direct shareholding.\nThe consolidated financial statements of the Company and its subsidiaries (together “Saudi Aramco”) were approved by the Board\nof Directors on March 18, 2022.\n2. Summary of significant accounting policies, judgments and estimates The principal accounting policies applied in the preparation of these consolidated financial statements are set out below. The consolidated financial statements provide comparative information in respect of the previous period.\n(a) Basis of preparation The consolidated financial statements have been prepared in accordance with International Financial Reporting Standards (“IFRS”), that are endorsed in the Kingdom, and other standards and pronouncements issued by the Saudi Organization for Chartered and Professional Accountants (“SOCPA”). The consolidated financial statements are also', ') (73,170) (58,000)\nDividends paid to non-controlling interests (36) (902) (10) (240)\nInterest paid (5,715) (2,748) (1,524) (733)\nAcquisition of treasury shares 16 (3,750) – (1,000) –\nProceeds from borrowings 51,960 11,660 13,856 3,109\nRepayments of borrowings (12,902) (11,096) (3,440) (2,959)\nNet cash used in financing activities (244,831) (220,586) (65,288) (58,823)\nNet (decrease) increase in cash and cash equivalents (5,446) 101,910 (1,453) 27,176\nCash and cash equivalents at beginning of the year 183,152 81,242 48,841 21,665\nCash and cash equivalents at end of the year 177,706 183,152 47,388 48,841\n* Supplementary information is converted at a fixed rate of U.S. dollar 1.00 = SAR 3.75 for convenience only.\nH.E. Yasir O. Al-Rumayyan Amin H. Nasser Khalid H. Al-Dabbagh Chairman of the Board President & Chief Executive Officer Senior Vice President, Finance, Strategy & Development\nAll amounts in millions of Saudi Riyals unless otherwise stated consolidated financial statements for the year ended December 31, 2019 14\nNotes to the consolidated financial statements 1. General information The Saudi Arabian Oil Company (the “Company”), with headquarters located in Dhahran, Kingdom of Saudi Arabia (the “Kingdom”), is engaged in prospecting, exploring, drilling and extracting hydrocarbon substances (“Upstream”) and processing, manufacturing, refining and marketing these hydrocarbon substances (“Downstream”). The Company was formed on November 13, 1988 by Royal Decree No. M/8; however, its history dates back to May 29, 1933 when the Saudi Arabian Government (the “Government”) granted a concession to the Company’s predecessor the\nright to, among other things, explore the Kingdom for hydrocarbons.\nOn December 20, 2017, Royal Decree No. M/37 dated 2/4/1439H was issued approving the Hydrocarbons Law which applies to the Kingdom’s\nhydrocarbons and hydrocarbon operations. Under the Hydrocarbons Law, all hydrocarbon deposits, hydrocarbons and hydrocarbon resources are the property of the Kingdom until ownership is transferred at the well head or when extracted. Further, the Hydrocarbons Law codifies the Government’s sole authority to set the maximum amount of hydrocarbons production by the Company and the maximum sustainable capacity that the Company must maintain.\nAll natural resources within the Kingdom, including hydrocarbons, are owned by the Kingdom. Through a concession in 1933, the Government granted the Company the exclusive right to explore, develop and produce the Kingdom’s hydrocarbon resources, except in certain areas. As of\nDecember 24, 2017, the Company’s original concession agreement was replaced and superseded by an amended concession agreement (the\n“Concession Agreement”) which provides the Company the exclusive right to explore, drill, prospect, appraise, develop, extract, recover, and produce hydrocarbons in the concession area. The Company is also provided the exclusive right to market and distribute hydrocarbons, petroleum products and liquid petroleum gas (“LPG”) in the Kingdom along with the non-exclusive right to manufacture, refine, and treat production and to market, sell, transport and export such production.\nThe initial term of the Concession Agreement is for 40 years which shall be extended by the Government for 20 years unless the Company does\nnot satisfy certain conditions commensurate with its then current operating practices. In addition, the Concession Agreement may be amended\nand extended for an additional 40 years beyond the original 60-year period subject to the Company and the Government agreeing on the terms\nof such extension.\nEffective January 1, 2018, Council of Minister’s Resolution No. 180, dated 1/4/1439H (December 19, 2017) converted the Company to a Saudi\nJoint Stock Company with new Bylaws. The Company’s 1988 Articles were cancelled as of January 1, 2018 pursuant to Royal Decree No. M/36,\ndated 2/4/1439H (December 20, 2017). The Company’s share capital has been set at Saudi Riyal (“SAR”) 60,000, is fully paid and is divided into\n200 billion ordinary shares with equal voting rights without par value. The Company’s Commercial Registration Number is 2052101150.\nOn December 11, 2019, the Company completed its Initial Public', 'of Saudi Riyals unless otherwise stated 181 Notes to the consolidated financial statements 1. General information The Saudi Arabian Oil Company (the “Company”), with headquarters located in Dhahran, Kingdom of Saudi Arabia (the “Kingdom”), is engaged in prospecting, exploring, drilling and extracting hydrocarbon substances (“Upstream”) and processing, manufacturing, refining and marketing these hydrocarbon substances (“Downstream”). The Company was formed on November 13, 1988 by Royal\nDecree No. M/8; however, its history dates back to May 29, 1933 when the Saudi Arabian Government (the “Government”) granted a concession to the Company’s predecessor the right to, among other things, explore the Kingdom for hydrocarbons.\nOn December 20, 2017, Royal Decree No. M/37 dated 2/4/1439H was issued approving the Hydrocarbons Law which applies to the\nKingdom’s hydrocarbons and hydrocarbon operations. Under the Hydrocarbons Law, all hydrocarbon deposits, hydrocarbons and hydrocarbon resources are the property of the Kingdom until ownership is transferred at the well head or when extracted. Further, the Hydrocarbons Law codifies the Government’s sole authority to set the maximum amount of hydrocarbons production by the Company and the maximum sustainable capacity that the Company must maintain.\nAll natural resources within the Kingdom, including hydrocarbons, are owned by the Kingdom. Through a concession in 1933, the Government granted the Company the exclusive right to explore, develop and produce the Kingdom’s hydrocarbon resources,\nexcept in certain areas. As of December 24, 2017, the Company’s original concession agreement was replaced and superseded by\nan amended concession agreement (the “Concession Agreement”) which provides the Company the exclusive right to explore, drill, prospect, appraise, develop, extract, recover, and produce hydrocarbons in the concession area. The Company is also provided the exclusive right to market and distribute hydrocarbons, petroleum products and liquid petroleum gas (“LPG”) in the Kingdom along with the non-exclusive right to manufacture, refine, and treat production and to market, sell, transport and export such production.\nThe initial term of the Concession Agreement is for 40 years which shall be extended by the Government for 20 years unless the\nCompany does not satisfy certain conditions commensurate with its then current operating practices. In addition, the Concession\nAgreement may be amended and extended for an additional 40 years beyond the original 60-year period subject to the Company\nand the Government agreeing on the terms of such extension.\nEffective January 1, 2018, Council of Minister’s Resolution No. 180, dated 1/4/1439H (December 19, 2017) converted the Company to\na Saudi Joint Stock Company with new Bylaws. The Company’s 1988 Articles were cancelled as of January 1, 2018 pursuant to Royal\nDecree No. M/36, dated 2/4/1439H (December 20, 2017). The Company’s share capital has been set at Saudi Riyal (“SAR”) 60,000,\nis fully paid and is divided into 200 billion ordinary shares with equal voting rights without par value. The Company’s Commercial Registration Number is 2052101150.\nOn December 11, 2019, the Company completed its Initial Public Offering (“IPO”) and its ordinary shares were listed on the Saudi\nStock Exchange (“Tadawul”). In connection with the IPO, the Government, being the sole owner of the Company’s shares at such time,\nsold an aggregate of 3.45 billion ordinary shares, or 1.73% of the Company’s share capital. In addition, concurrent with the IPO, the\nCompany acquired 117.2 million of its ordinary shares from the Government for a cash payment of SAR 3,750, which are being\nclassified as treasury shares (Note 17). These shares are for use by the Company for its employee share plans (Note 18).\nThe consolidated financial statements of the Company and its subsidiaries (together “Saudi Aramco”) were approved by the Board\nof Directors on March 18, 2021.\n2. Summary of significant accounting policies, judgments and estimates The principal accounting policies applied in the preparation of these consolidated financial statements are set out below.\nThe consolidated financial statements provide comparative information in respect of the previous period.\n(a) Basis of preparation The consolidated financial statements have been prepared in accordance with International Financial Reporting Standards (“IFRS”), that are endorsed in the Kingdom, and other standards and pronouncements issued by the Saudi Organization for Certified Public Accountants (“SOCPA”). The consolidated financial statements are also in compliance with IFRS as issued by the International Accounting Standards Board (“IASB”). Amounts and balances relating to Shari’a compliant financial instruments of the Company, its subsidiaries and investments are disclosed separately. All other relevant', 'Executive Officer Executive Vice President & Chief Financial Officer 5 . O RGANIZATIONAL 6. A DDITIONAL STRUCTURE AND FINANCIAL 7. CONSOLIDATED\n\nAND STRATEGY PERFORMANCE 3. SUSTAINABILITY 4. RISK GOVERNANCE INFORMATION STATEMENTS Notes to the consolidated financial statements All amounts in millions of Saudi Riyals unless otherwise stated 1. General information The Saudi Arabian Oil Company (the “Company”), with headquarters located in Dhahran, Kingdom of Saudi Arabia (the “Kingdom”), is engaged in prospecting, exploring, drilling and extracting hydrocarbon substances (“Upstream”) and processing, manufacturing, refining\nand marketing these hydrocarbon substances (“Downstream”). The Company was formed on November 13, 1988, by Royal Decree No.\nM/8; however, its history dates back to May 29, 1933, when the Saudi Arabian Government (the “Government”) granted a concession to\nthe Company’s predecessor for the right to, among other things, explore the Kingdom for hydrocarbons.\nOn December 20, 2017, Royal Decree No. M/37 dated 2/4/1439H was issued approving the Hydrocarbons Law, which applies to the\nKingdom’s hydrocarbons and hydrocarbon operations. Under the Hydrocarbons Law, all hydrocarbon deposits, hydrocarbons and hydrocarbon resources are the property of the Kingdom until ownership is transferred at the well head or when extracted. Further, the Hydrocarbons Law codifies the Government’s sole authority to set the maximum amount of hydrocarbons production by the Company and the maximum sustainable capacity that the Company must maintain.\nAll natural resources within the Kingdom, including hydrocarbons, are owned by the Kingdom. Through a concession in 1933, the Government granted the Company’s predecessor the exclusive right to explore, develop and produce the Kingdom’s hydrocarbon\nresources, except in certain areas. As of December 24, 2017, the original concession agreement was replaced and superseded by an\namended concession agreement (the “Concession Agreement”) which provides the Company the exclusive right to explore, drill, prospect, appraise, develop, extract, recover, and produce hydrocarbons in the concession area. The Company is also provided the exclusive right to market and distribute hydrocarbons, petroleum products and liquid petroleum gas (“LPG”) in the Kingdom along with the non-exclusive right to manufacture, refine, and treat production and to market, sell, transport and export such production.\nThe initial term of the Concession Agreement is for 40 years, which shall be extended by the Government for 20 years unless the Company\ndoes not satisfy certain conditions commensurate with its then current operating practices. In addition, the Concession Agreement may be\namended and extended for an additional 40 years beyond the original 60-year period, subject to the Company and the Government\nagreeing on the terms of such extension.\nEffective January 1, 2018, Council of Ministers Resolution No. 180, dated 1/4/1439H (December 19, 2017) converted the Company to a Saudi\nJoint Stock Company with new Bylaws. The Company’s 1988 Articles were cancelled as of January 1, 2018, pursuant to Royal Decree No.\nM/36, dated 2/4/1439H (December 20, 2017). The Company’s Commercial Registration Number is 2052101150. The Company’s share capital\nwas set at Saudi Riyals (“SAR” or “﷼”) 60,000, divided into 200 billion fully paid ordinary shares with equal voting rights without par value.\nOn May 12, 2022 and May 8, 2023, after obtaining necessary approvals from the competent authorities in relation to the issuance of bonus\nshares, the Extraordinary General Assembly (“EGA”) approved the increases in the Company’s share capital by ﷼ 15,000 and ﷼ 15,000,\nrespectively, and the commensurate increase in the number of the Company’s issued ordinary shares by 20 billion and 22 billion,\nrespectively. The Company’s share capital after these increases is ﷼ 90,000, divided into 242 billion fully paid ordinary shares with equal\nvoting rights without par value (Note 36).\nOn December 11, 2019, the Company completed its Initial Public Offering (“IPO”) and its ordinary shares were listed on the Saudi\nExchange. In connection with the IPO, the Government, being the sole owner of the Company’s shares at such time, sold an aggregate\nof 3.45 billion ordinary shares, or 1.73% of the Company’s share capital. In addition, concurrent with the IPO, the Company acquired\n117.2 million of its ordinary shares from the Government for a cash payment of ﷼ 3,750, and classified them', '623)\nNet cash used in financing activities (510,869) (382,675) (136,232) (102,047)\nNet decrease in cash and cash equivalents (27,074) (73,532) (7,220) (19,609)\nCash and cash equivalents at beginning of the year 226,047 299,579 60,279 79,888\nCash and cash equivalents at end of the year 198,973 226,047 53,059 60,279\n* This supplementary information is converted at a fixed rate of U.S. dollar 1.00 = SAR 3.75 for convenience only, and is presented in millions of U.S. dollars.\nHH: EE: YYaassiirr OO: AAll--RRuummaayyyyaann AAmmiinn HH: NNaasssseerr ZZiiaadd TT: AAll MMuurrsshheedd CChhaaiirrmmaann ooff tthhee BBooaarrdd PPrreessiiddeenntt && CChhiieeff EExxeeccuuttiivvee OOffffiicceerr EExxeeccuuttiivvee VViiccee PPrreessiiddeenntt && CChhiieeff FFiinnaanncciiaall OOffffiicceerr 11666 SSAAUUDDII AARRAAMMCCOO | |A CNONNUSAOLL RIDEAPOTERDT F2I0N2A3NCIAL STATEMENTS 2023 6. A DDITIONAL FINANCIAL 7. CONSOLIDATED\n\nAND STRATEGY PERFORMANCE 3. SUSTAINABILITY 4. R ISK GOVERNANCE INFORMATION STATEMENTS Notes to the consolidated financial statements All amounts in millions of Saudi Riyals unless otherwise stated 1. General information The Saudi Arabian Oil Company (the “Company”), with headquarters located in Dhahran, Kingdom of Saudi Arabia (the “Kingdom”), is engaged in prospecting, exploring, drilling and extracting hydrocarbon substances (“Upstream”) and processing, manufacturing,\nrefining and marketing these hydrocarbon substances (“Downstream”). The Company was formed on November 13, 1988, by Royal\nDecree No. M/8; however, its history dates back to May 29, 1933, when the Saudi Arabian Government (the “Government”) granted\na concession to the Company’s predecessor for the right to, among other things, explore the Kingdom for hydrocarbons.\nOn December 20, 2017, Royal Decree No. M/37 dated 2/4/1439H was issued approving the Hydrocarbons Law, which applies to the\nKingdom’s hydrocarbons and hydrocarbon operations. Under the Hydrocarbons Law, all hydrocarbon deposits, hydrocarbons and hydrocarbon resources are the property of the Kingdom until ownership is transferred at the well head or when extracted. Further, the Hydrocarbons Law codifies the Government’s sole authority to set the maximum amount of hydrocarbons production by the Company and the maximum sustainable capacity that the Company must maintain.\nAll natural resources within the Kingdom, including hydrocarbons, are owned by the Kingdom. Through a concession in 1933, the Government granted the Company the exclusive right to explore, develop and produce the Kingdom’s hydrocarbon resources, except\nin certain areas. As of December 24, 2017, the Company’s original concession agreement was replaced and superseded by an amended\nconcession agreement (the “Concession Agreement”) which provides the Company the exclusive right to explore, drill, prospect, appraise, develop, extract, recover, and produce hydrocarbons in the concession area. The Company is also provided the exclusive right to market and distribute hydrocarbons, petroleum products and liquid petroleum gas (“LPG”) in the Kingdom along with the non-exclusive right to manufacture, refine, and treat production and to market, sell, transport and export such production.\nThe initial term of the Concession Agreement is for 40 years, which shall be extended by the Government for 20 years unless the\nCompany does not satisfy certain conditions commensurate with its then current operating practices. In addition, the Concession\nAgreement may be amended and extended for an additional 40 years beyond the original 60-year period, subject to the Company\nand the Government agreeing on the terms of such extension.\nEffective January 1, 2018, Council of Ministers Resolution No. 180, dated 1/4/1439H (December 19, 2017) converted the Company to a\nSaudi Joint Stock Company with new Bylaws. The Company’s 1988 Articles were cancelled as of January 1, 2018, pursuant to Royal\nDecree No. M/36, dated 2/4/1439H (December 20, 2017). The Company’s Commercial Registration Number is']","Saudi Aramco was converted into a Saudi Joint Stock Company on January 1, 2018.","The company was converted into a Saudi Joint Stock Company effective January 1, 2018. This change was made under Council of Ministers Resolution No. 180.",1.0,0.9999996795324225,0.99999999998,1.0
How much of Saudi Aramco did the Government sell in the IPO?,"['by international crude oil supply in the price at which Aramco sells its methods, including hydraulic fracturing and demand and the price at which crude oil could have a material adverse or “fracking”;\neffect on Aramco’s results of operations it sells crude oil.\n• capital investments of oil and gas and cash flow.\ncompanies relating to the exploration, Sales of crude oil are the largest development and production of crude International crude oil prices have component of Aramco’s consolidated oil reserves; fluctuated significantly in the past and revenue and other income related to may remain volatile. Between January\nsales, accounting for 56.5%, 56.4% and • the impact of climate change on the 2016 and February 2020, Brent prices\n57.3% for the years ended December 31, demand for, and price of, hydrocarbons generally fluctuated between $40.0 and\n2017, 2018 and 2019, respectively, and (see risk — Climate change concerns $65.0 per barrel. However, most recently,\n49.1% for the year ended December 31, and impacts could reduce global Brent prices fell below $23.0 per barrel in\n2020. Accordingly, Aramco’s results of demand for hydrocarbons and mid-March 2020 and generally fluctuated\noperations and cash flow are significantly hydrocarbon-based products and could between $30.0 and $50.0 per barrel\nimpacted by the price at which it sells cause Aramco to incur costs or invest through December 31, 2020, in response\ncrude oil. additional capital); to the COVID-19 pandemic and its impact\n• changes to environmental or other on worldwide demand for oil and International crude oil supply and regulations or laws applicable to crude economic activity as well as other supply demand and the sales price for crude oil oil and related products or the energy and demand factors. Because the are affected by many factors that are industry (see risk — Aramco’s consequences and duration of these beyond Aramco’s control, including: operations are subject to environmental events are uncertain, Aramco is not able\n• markets’ expectations with respect to protection, health and safety laws and to predict the full extent and impact future supply of petroleum and regulations and increased concerns lower oil prices will have on Aramco’s petroleum products, demand and price regarding the safe use of chemicals and results of operations and cash flow.\nchanges, including future demand for plastics and their potential impact on petroleum products in Asia; the environment have resulted in more restrictive regulations and could lead to new regulations);\n\nThe COVID-19 pandemic and its Aramco is not able to predict how long factors affecting competition for refined impact on business and economic the COVID-19 pandemic will persist or products and chemicals. Accordingly, if\nhow long the measures that have been the operating efficiencies and production conditions could negatively affect introduced to respond to it will be in costs of Aramco’s refineries are not Aramco’s business, financial place. Aramco also cannot predict how sufficiently competitive in the geographies position, cash flow, results of long the effects of COVID-19 and the they serve, Aramco’s business, financial operations and price of its efforts to contain it will continue to position and results of operations could securities. impact its business after the pandemic be materially and adversely impacted.\nis under control or if additional, more restrictive measures to combat the Climate change concerns and The COVID-19 pandemic and measures taken to combat it are having a pandemic will be implemented. These impacts could reduce global impacts could result in a worsening of the widespread impact on business and demand for hydrocarbons and effects of the pandemic on Aramco’s economic conditions, including on the hydrocarbon-based products and business, cash flows, results of operations demand for crude oil, natural gas, refined and price of its securities. The extent to could cause Aramco to incur costs products and petrochemicals. Public which COVID-19 could impact Aramco’s or invest additional capital.\nhealth authorities and governments at business depends on future developments local, national and international levels that are highly uncertain and are outside have announced various measures to Climate change concerns manifested in of Aramco’s control, including new respond to the pandemic, including public sentiment, government policies, information which may quickly emerge restrictions on travel, voluntary or laws and regulations, international concerning the severity of the virus, mandatory quarantines, workforce agreements and treaties and other actions the scope of the pandemic and actions reductions of personnel who are deemed may reduce global demand for to contain the virus or treat its impact to be non-essential and the full closure of hydrocarbons and propel a shift to lower and the efficacy of such actions, business activities deemed to be non- carbon intensity fossil fuels such as gas or among others.\nessential. These measures have severely alternative energy sources. In particular, impacted economic activity and led to increasing pressure on governments to Aramco operates in a highly lower demand for', 'could lead to new regulations);\ngeopolitical events, including any that impact\n• Prices and availability of alternative energies, international trade (including trade routes);\nincluding renewable energy;\n• Decisions regarding production levels by the\n• The electrification of transportation, Kingdom or other producing states (the technological developments in the cost or Kingdom is a member country of OPEC);\nendurance of fuel cells for electric vehicles,\n• The impact of natural disasters and public and changes in transportation-mode health pandemics or epidemics (such as preferences, including ride-sharing;\nCOVID-19) on supply and demand for crude oil,\n• Weather conditions affecting supply general economic conditions, and the ability and demand;\nto deliver crude oil;\n• Fluctuations in the value of the U.S. dollar,\n• The development of new crude oil the currency in which crude oil is priced exploration, production and transportation globally; and methods or technological advancements in existing methods; • Crude oil trading activities.\n• Capital investments of oil and gas companies relating to the exploration, development and production of crude oil reserves;\n\nRisk factors\n\nContinued International crude oil prices have fluctuated $128 per barrel in the first half of 2022.\nsignificantly in the past and may remain volatile. On October 5, 2022, OPEC+ decided to cut oil Aramco’s results of Between January 2016 and February 2020, Brent production quotas by two million barrels per day\noperations and cash\nprices generally fluctuated between $40 and starting in November 2022. As of December 31,\nflow are significantly\n$65 per barrel. Brent prices fell below $23 per 2022, the Brent price was $85.9 per barrel.\nimpacted by barrel in mid-March 2020 in response to the international crude oil Fluctuations in the price at which Aramco sells COVID-19 pandemic and other supply and supply and demand crude oil could cause its results of operations demand factors, and did not recover to above and the price at which and cash flow to vary significantly. In addition,\n$60 per barrel until February 2021. Since then,\nit sells crude oil. decreases in the price at which Aramco is able Brent prices have increased and rose significantly to sell its crude oil could have a material adverse in February 2022 in response to the Russia- effect on Aramco’s results of operations and Ukraine conflict, related international sanctions cash flow.\nand other macroeconomic factors, reaching Aramco operates in The sale of crude oil outside the Kingdom is very geographies into which they sell refined products a highly competitive competitive. Aramco’s primary competitors for or petrochemicals. Competitors include, but are environment. the sale of crude oil outside the Kingdom include not limited to, refining and petrochemical plants Competitive pressure national and international oil companies, many located in, or in close proximity to, relevant could have a material of which have substantial crude oil reserves and markets, and in the case of refining and adverse impact on financial resources. The primary factors affecting petrochemical plants that are net importers, the price at which it competition are the price, reliability, quantity, from other international producers. Operating sells crude oil and quality and geographic location of crude oil efficiencies and production costs are key factors other products. produced. Increased competitive pressures could affecting competition for refined products and have a material adverse impact on prices at chemicals. Accordingly, if the operating which Aramco can sell crude oil and its regional efficiencies and production costs of Aramco’s and global market share. refineries are not sufficiently competitive in the geographies they serve, Aramco’s business, In addition, outside the Kingdom, refining and financial position and results of operations could petrochemical plants in Aramco’s downstream be materially and adversely impacted.\nsegment are subject to competition in the Climate change Climate change concerns manifested in public countries that have ratified the Paris Agreement concerns and impacts sentiment, government policies, laws and are adopting domestic measures to meet their could reduce global regulations, international agreements and goals, which include reducing their use of fossil demand for treaties, lawsuits against energy companies, fuels and increasing their use of alternative hydrocarbons and company net-zero ambition and other energy sources. The landscape of GHG related hydrocarbon-based commitments, investor pressure, fossil fuel laws and regulations has been in a state of products and could divestment campaigns and other actions may constant reassessment and it is difficult to predict cause Aramco to reduce global demand for hydrocarbons and with certainty the ultimate impact GHG related incur costs or invest hydrocarbon-based products and propel a shift laws, regulations and international agreements additional capital. toward lower carbon intensity fossil fuels, such as will have on Aramco. In addition, jurisdictions in gas, or alternative energy sources. In particular, which Aramco operates or its products are sold increasing pressure on governments, businesses, that are not currently subject to GHG regulation organizations and individuals to reduce GHG may become regulated and existing GHG emissions has led to', 'of internal control systems\n\nRisk Principal risk categories Risks related to macroeconomic Risks related to Aramco, environment and external factors its operations and industry Read more Read more\non page 88 on page 91\nLegal and regulatory risks Risks related to the Kingdom Read more Read more\non page 95 on page 99\nManagement-level oversight of the This includes the escalation, as Risk factors ERM framework is provided by the appropriate, of risk ownership through The following risks, which are identified Management Committee, chaired by Aramco’s organizational levels, resulting as material, do not necessarily comprise the President and CEO. He also chairs the in a hierarchy of risks from individual all the risks affecting Aramco. There may HSSE Committee, which oversees health, departmental risks to corporate risks.\nbe additional risks that Aramco is currently safety, security, and environmental risk Annually, the Management Committee not aware of, or that Aramco currently management; the Strategy Council, which reviews the composition of the top risks, believes are immaterial, which may in the reviews matters of strategic risk; and the taking into consideration risks reported future become material or affect Aramco’s Conflicts of Interest and Business Ethics from the businesses and a top-down business, financial position and results of Committee. Various other management- scan for new and emerging risks. The operations, or the market price of the level committees oversee specific Management Committee is updated shares. As a result of these and other risk-related topics, such as the quarterly on individual risks, and every risks, the forward-looking events and Sustainability Steering Committee year several risks are presented in detail circumstances discussed in this Annual and the Information Security Risk to the Management Committee and the Report might not occur in the way Aramco Management Steering Committee. Board’s Risk and HSE Committee.\nexpects, or at all. All forward-looking statements in this Annual Report should be Business risk assessment Decision-making considered in light of these explanations.\nThe process by which individual To reduce planning uncertainty and organizations identify, assess, mitigate, help manage the variability of outcomes, The risks described in this section are monitor and report risks to achieve Aramco has embedded risk assessment not presented in order of priority based business objectives is integrated into into its strategic and investment planning. on their importance or expected effect Aramco’s annual planning cycle through Strategic scenarios are stress-tested, and on Aramco.\na system based on ISO 31000 principles the investment portfolio is optimized and guidelines. using stochastic risk modeling. Individual projects and investments pass through a gated decision process that includes risk assessments and value assurance reviews.\nRisk factors Understanding risks Risks related to macroeconomic environment and external factors Aramco’s results of operations and cash flow are significantly impacted by international crude oil supply and demand, and the price at which it sells crude oil.\nSales of crude oil are the largest • Capital investments of oil and gas International crude oil prices have component of Aramco’s consolidated companies relating to the exploration, fluctuated significantly in the past and revenue and other income related to development and production of crude may remain volatile. Between January\nsales, accounting for 49.1% and 47.0% oil reserves; 2016 and December 2021, Brent prices\nfor the years ended December 31, 2020, generally fluctuated between $40.0 and\n• The impact of climate change on the\nand 2021, respectively. Accordingly, $70.0 per barrel. However, Brent prices\ndemand for, and price of, hydrocarbons Aramco’s operations and cash flow fell below $20.0 per barrel in mid-March (see risk — Climate change concerns results are significantly impacted by 2020 in response to the impact of the and impacts could reduce global the price at which it sells crude oil. COVID-19 pandemic on worldwide\ndemand for hydrocarbons and demand for oil and economic activity, hydrocarbon-based products and International crude oil supply and as well as other supply and demand could cause Aramco to incur costs demand and the sales price for crude factors, and did not recover to above or invest additional capital);\noil are affected by many factors that $60.0 per barrel until February 2021.\nare beyond Aramco’s control, including: • Changes to environmental or other Fluctuations in the price at which Aramco regulations or laws applicable to crude is able to sell crude oil have previously,\n• Markets’ expectations with respect oil and related products or the energy and could in the future, cause Aramco’s to future supply of petroleum and industry (see risk — Aramco’s results of operations and cash flow to vary petroleum products, demand and operations are subject to environmental significantly. In addition, decreases in the price changes; protection, health and safety laws and price at which Aramco is able to sell its\n• Global economic and political conditions regulations, and increased concerns crude oil could have a material adverse and geopolitical events, including any regarding the safe use of chemicals and effect on', ""ging the SAR to the U.S. Dollar were to change cash to fund its SAR denominated dividends. Such in the future and the SAR were to become changes could have a material adverse effect on stronger relative to the U.S. Dollar, Aramco may Aramco’s financial position.\nexperience an increase in the SAR denominated\n\n5 . O RGANIZATIONAL 6. A DDITIONAL STRUCTURE AND FINANCIAL 7. C ONSOLIDATED\n\nAND STRATEGY PERFORMANCE 3. SUSTAINABILITY 4. RISK GOVERNANCE INFORMATION STATEMENTS The Government has directed, and may in the commercial basis and, on September 5, 2019, Government projects future direct, Aramco to undertake projects or Aramco and the Government entered into a The Government may direct provide assistance for initiatives outside Aramco’s framework agreement to govern the furnishing of Aramco to undertake core business in furtherance of the Government’s services by Aramco to the Government. While projects or provide assistance macroeconomic, social or other objectives, these projects and initiatives have generally been for initiatives outside leveraging Aramco’s know-how, resources, and of national importance to the Kingdom and in Aramco’s core business, operational capabilities. For instance, the Aramco’s long-term commercial interests, they which may not be consistent Government has previously directed Aramco to have often been outside of Aramco’s core with Aramco’s immediate develop and construct large infrastructure businesses and have not always been consistent commercial objectives. projects and provide management, logistical, and with its immediate commercial objectives. If the other technical assistance for certain Government Government directs Aramco to undertake future initiatives. The Concession requires that all projects other than on a commercial basis, Aramco contracts with any Government agency or Aramco’s financial position and results of any arrangement for the furnishing of operation may be materially and adversely hydrocarbons, services, or otherwise shall be on a affected.\n\n5 . O RGANIZATIONAL 6. A DDITIONAL STRUCTURE AND FINANCIAL 7. C ONSOLIDATED\n\nAND STRATEGY PERFORMANCE 3. SUSTAINABILITY 4. RISK GOVERNANCE INFORMATION STATEMENTS structure and corporate governance Organizational structure: 88 Board of Directors: 90\nSenior Executives: 98 Board structure: 102\nAudit Committee report: 107 Sustainability, Risk and HSE Committee report: 109\nNomination Committee statement: 110 Compensation Committee statement: 111\nCompensation and other interests: 112 Governance, risk and compliance: 116\nStrategic integration Qatif Bulk Plant, Qatif, Saudi Arabia Aramco's Board of Directors provide strategic leadership and oversight to Company management, ensuring the CEO and Senior Executives pursue the Company's strategic goals while aligning with its vision, mission, and values.\nThrough its dedicated system of domestic and international refineries and petrochemical complexes, the Company strategically integrates its Upstream and Downstream businesses, capturing additional value across the hydrocarbon value chain.\nSenior Executives: 98\n\nAudit Committee report: 107 | | | | | | | | | | | | Sustainability, Risk and HSE Committee report: 109\nNomination Committee statement: 110\n\nCompensation and other interests: 112 | | | | | | | | | | | | Governance, risk and compliance: 116\n\nAramco's Board of | | | ti Di | f, Saudi Arabia rectors provide strategic leadership |\n\nand Senior Executiv | | | m\n\n| | | | | | | while aligning with Through its dedicat | | | it\n\nhydrocarbon value | | | | ng\n\nOrganizational structure Evolving shareholder profile\nShareholding structure1 On June 11, 2024, the Government completed a secondary public\nThe Company completed its IPO on December 11, 2019, listing its offering, selling approximately 1.7 billion shares, representing 0.7%\nordinary shares on the Saudi Exchange, with the Government selling of the Company’s issued shares. Following these transactions, the\n3.45 billion ordinary shares, or 1.73% of the Company's share Government continues to remain the Company’s largest shareholder,\ncapital. Subsequent share transfers include 4% to PIF on February holding an 81.48% direct shareholding.\n13, 2022, 4% to Sanabil Investments Company on April 16, 2023,\nand an additional 8% to PIF's wholly-owned companies on March 7, 2024.\nNo. of Shares Percent Share capital Shareholder (millions) ownership amount (millions)\nGovernment 197,191 81.48% 73,332\nPublic 5,944 2.46% 2,214\nCompany Treasury2 145 0.06% 54\nOther3 38,720 16.00%"", '”), with headquarters located in Dhahran, Kingdom of Saudi Arabia (the “Kingdom”), is engaged in prospecting, exploring, drilling and extracting hydrocarbon substances (“Upstream”) and processing, manufacturing, refining and marketing these hydrocarbon substances (“Downstream”). The Company was formed on November 13, 1988 by Royal Decree No. M/8; however, its history dates back to May 29, 1933 when the Saudi Arabian Government (the “Government”) granted\na concession to the Company’s predecessor the right to, among other things, explore the Kingdom for hydrocarbons.\nOn December 20, 2017, Royal Decree No. M/37 dated 2/4/1439H was issued approving the Hydrocarbons Law which applies to the\nKingdom’s hydrocarbons and hydrocarbon operations. Under the Hydrocarbons Law, all hydrocarbon deposits, hydrocarbons and hydrocarbon resources are the property of the Kingdom until ownership is transferred at the well head or when extracted. Further, the Hydrocarbons Law codifies the Government’s sole authority to set the maximum amount of hydrocarbons production by the Company and the maximum sustainable capacity that the Company must maintain.\nAll natural resources within the Kingdom, including hydrocarbons, are owned by the Kingdom. Through a concession in 1933, the Government granted the Company the exclusive right to explore, develop and produce the Kingdom’s hydrocarbon resources,\nexcept in certain areas. As of December 24, 2017, the Company’s original concession agreement was replaced and superseded by\nan amended concession agreement (the “Concession Agreement”) which provides the Company the exclusive right to explore, drill, prospect, appraise, develop, extract, recover, and produce hydrocarbons in the concession area. The Company is also provided the exclusive right to market and distribute hydrocarbons, petroleum products and liquid petroleum gas (“LPG”) in the Kingdom along with the non-exclusive right to manufacture, refine, and treat production and to market, sell, transport and export such production.\nThe initial term of the Concession Agreement is for 40 years which shall be extended by the Government for 20 years unless the\nCompany does not satisfy certain conditions commensurate with its then current operating practices. In addition, the Concession\nAgreement may be amended and extended for an additional 40 years beyond the original 60-year period subject to the Company\nand the Government agreeing on the terms of such extension.\nEffective January 1, 2018, Council of Minister’s Resolution No. 180, dated 1/4/1439H (December 19, 2017) converted the Company to\na Saudi Joint Stock Company with new Bylaws. The Company’s 1988 Articles were cancelled as of January 1, 2018 pursuant to Royal\nDecree No. M/36, dated 2/4/1439H (December 20, 2017). The Company’s share capital has been set at Saudi Riyal (“SAR”) 60,000,\nis fully paid and is divided into 200 billion ordinary shares with equal voting rights without par value. The Company’s Commercial Registration Number is 2052101150.\nOn December 11, 2019, the Company completed its Initial Public Offering (“IPO”) and its ordinary shares were listed on the Saudi\nStock Exchange (“Tadawul”). In connection with the IPO, the Government, being the sole owner of the Company’s shares at such time,\nsold an aggregate of 3.45 billion ordinary shares, or 1.73% of the Company’s share capital. In addition, concurrent with the IPO, the\nCompany acquired 117.2 million of its ordinary shares from the Government for a cash payment of SAR 3,750, and classified them as\ntreasury shares (Note 16). These shares are being used by the Company for its employee share plans (Note 17).\nOn February 13, 2022, the Government transferred 8 billion ordinary shares, or 4% of the Company’s share capital, to the Public\nInvestment Fund (“PIF”), the sovereign wealth fund of the Kingdom. Following the transfer, the Government remains the Company’s largest shareholder, retaining a 94.19% direct shareholding.\nThe consolidated financial statements of the Company and its subsidiaries (together “Saudi Aramco”) were approved by the Board\nof Directors on March 18, 2022.\n2. Summary of significant accounting policies, judgments and estimates The principal accounting policies applied in the preparation of these consolidated financial statements are set out below. The consolidated financial statements provide comparative information in respect of the previous period.\n(a) Basis of preparation The consolidated financial statements have been prepared in accordance with International Financial Reporting Standards (“IFRS”), that are endorsed in the Kingdom, and other standards and pronouncements issued by the Saudi Organization for Chartered and Professional Accountants (“SOCPA”). The consolidated financial statements are also']","The Government sold 3.45 billion ordinary shares, which represented 1.73% of Saudi Aramco's share capital, in the IPO.","In the IPO completed on December 11, 2019, the Government sold 3.45 billion ordinary shares. That represented 1.73% of the company's share capital.",1.0,0.92545012248809,0.32499999998375,1.0
What are the main assumptions used in Saudi Aramco's impairment tests for non-financial assets?,"[') – – (1,655) (14) (4,687)\nDecember 31, 2023 101,010 20,013 24,982 21,701 4,233 3,876 175,815\nAccumulated amortization\nJanuary 1, 2023 – – (2,559) (3,362) (4,066) (1,521) (11,508)\nCharge for the year – – (254) (1,118) (302) (309) (1,983)\nCurrency translation differences – – (2) (2) (10) (28) (42)\nTransfers and adjustments – – 20 17 42 380 459\nTransfer to assets held for sale – – – – – 146 146\nRetirements and write offs – – – – 1,655 12 1,667\nDecember 31, 2023 – – (2,795) (4,465) (2,681) (1,320) (11,261)\nIntangible assets – net, December 31, 2023 101,010 20,013 22,187 17,236 1,552 2,556 164,554\n1. C ash used for exploration and evaluation operating activities in 2024 was ﷼ 6,227 (2023: ﷼ 6,398) and expenditures for investing activities were ﷼ 8,649 (2023: ﷼ 6,918).\n2. O ther intangible assets with a net book value of ﷼ 2,865 as at December 31, 2024 (2023: ﷼ 2,556) comprise processing and offtake agreements, licenses, technology, usage rights,\npatents and intellectual property.\nSAUDI ARAMCO | CONSOSLAIDUADTI EADR AFIMNACONC | IAANL NSTUAATLE RMEEPNOTRST 2 2002244 3 4187\nNotes to the consolidated financial statements continued All amounts in millions of Saudi Riyals unless otherwise stated 6. Intangible assets continued\nSaudi Aramco performed an annual impairment test for the goodwill of ﷼ 99,116 at December 31, 2024 and 2023, which was acquired as part\nof the Saudi Basic Industries Corporation (“SABIC”) acquisition and allocated to the Downstream segment. The recoverable amount of the Downstream segment was determined based on VIU calculations which require use of certain assumptions. The calculations used cash flow projections for a period of 10 years based on financial plans approved by management. Cash flows were discounted and aggregated with a terminal value. Management’s estimate for the cash flows is based on past performance and management’s expectation of the future. This\nincludes management’s forecast for prices and margins for the downstream operations. The growth rate of 2.25% (2023: 2.25%) used in the\nterminal value calculation represents the long-term inflation forecast. The pre-tax discount rate for the VIU calculations was 11.0% (2023:\n9.9%). As a result of the analysis, management did not identify any impairment of goodwill related to the SABIC acquisition.\nSaudi Aramco also performed an annual impairment test for the brand acquired as part of the SABIC acquisition, which has been determined\nto have an indefinite useful life, amounting to ﷼ 18,140 at December 31, 2024 and 2023. The impairment test was performed by aggregating\nthe relevant cash-generating units. Cash flows were calculated in the same way as for the goodwill impairment test. The pre-tax discount rate\nfor the VIU calculations was 10.1% (2023: 9.1%). As a result of the analysis, management did not identify any impairment.\nPre-tax discount rates of 11.8% and 13.4% in the VIU calculations for the goodwill and the brand, respectively, would result in the recoverable\namounts to be equal to the carrying amounts used in the annual impairment tests. Further, management believes that a 1% decrease in the growth rate, or a reasonable range of increase or decrease in any of the other assumptions used for cash flow projections, individually, would not change the outcome of the impairment analysis for the goodwill or the brand.\n7. Investments in joint ventures and associates Carrying Carrying Equity amount at amount at\nownership Principal place December 31, December 31,\nCompany 2024/2023 of business Nature of activities 2024 2023 Joint ventures\nSaudi Yanbu Petrochemical Company (“Yanpet”)1 50% Saudi Arabia Petrochemicals 9,320 9,943\nAl-Jubail Petrochemical Company (""Kemya"")1 50% Saudi Arabia Petrochemical', '3,018) – – (1,655) (14) (4,687)\nDecember 31, 2023 101,010 20,013 24,982 21,701 4,233 3,876 175,815\nAccumulated amortization\nJanuary 1, 2023 – – (2,559) (3,362) (4,066) (1,521) (11,508)\nCharge for the year – – (254) (1,118) (302) (309) (1,983)\nCurrency translation differences – – (2) (2) (10) (28) (42)\nTransfers and adjustments – – 20 17 42 380 459\nTransfer to assets held for sale – – – – – 146 146\nRetirements and write offs – – – – 1,655 12 1,667\nDecember 31, 2023 – – (2,795) (4,465) (2,681) (1,320) (11,261)\nIntangible assets – net, December 31, 2023 101,010 20,013 22,187 17,236 1,552 2,556 164,554\n1. C ash used for exploration and evaluation operating activities in 2024 was ﷼ 6,227 (2023: ﷼ 6,398) and expenditures for investing activities were ﷼ 8,649 (2023: ﷼ 6,918).\n2. O ther intangible assets with a net book value of ﷼ 2,865 as at December 31, 2024 (2023: ﷼ 2,556) comprise processing and offtake agreements, licenses, technology, usage rights,\npatents and intellectual property.\nNotes to the consolidated financial statements continued All amounts in millions of Saudi Riyals unless otherwise stated 6. Intangible assets continued\nSaudi Aramco performed an annual impairment test for the goodwill of ﷼ 99,116 at December 31, 2024 and 2023, which was acquired as part\nof the Saudi Basic Industries Corporation (“SABIC”) acquisition and allocated to the Downstream segment. The recoverable amount of the Downstream segment was determined based on VIU calculations which require use of certain assumptions. The calculations used cash flow projections for a period of 10 years based on financial plans approved by management. Cash flows were discounted and aggregated with a terminal value. Management’s estimate for the cash flows is based on past performance and management’s expectation of the future. This\nincludes management’s forecast for prices and margins for the downstream operations. The growth rate of 2.25% (2023: 2.25%) used in the\nterminal value calculation represents the long-term inflation forecast. The pre-tax discount rate for the VIU calculations was 11.0% (2023:\n9.9%). As a result of the analysis, management did not identify any impairment of goodwill related to the SABIC acquisition.\nSaudi Aramco also performed an annual impairment test for the brand acquired as part of the SABIC acquisition, which has been determined\nto have an indefinite useful life, amounting to ﷼ 18,140 at December 31, 2024 and 2023. The impairment test was performed by aggregating\nthe relevant cash-generating units. Cash flows were calculated in the same way as for the goodwill impairment test. The pre-tax discount rate\nfor the VIU calculations was 10.1% (2023: 9.1%). As a result of the analysis, management did not identify any impairment.\nPre-tax discount rates of 11.8% and 13.4% in the VIU calculations for the goodwill and the brand, respectively, would result in the recoverable\namounts to be equal to the carrying amounts used in the annual impairment tests. Further, management believes that a 1% decrease in the growth rate, or a reasonable range of increase or decrease in any of the other assumptions used for cash flow projections, individually, would not change the outcome of the impairment analysis for the goodwill or the brand.\n7. Investments in joint ventures and associates Carrying Carrying Equity amount at amount at\nownership Principal place December 31, December 31,\nCompany 2024/2023 of business Nature of activities 2024 2023 Joint ventures\nSaudi Yanbu Petrochemical Company (“Yanpet”)1 50% Saudi Arabia Petrochemicals 9,320 9,943\nAl-Jubail Petrochemical Company (""Kemya"")1 50% Saudi Arabia Petrochemicals 5,575 6,108\nSinopec SABIC Tianjin Petrochemical Company Limited\n(“SSTPC”)1 50% China Petrochemicals 4,658 5,', '2022 – – (2,559) (3,362) (4,066) (1,521) (11,508)\nIntangible assets – net,\nDecember 31, 2022 100,603 17,971 20,171 16,285 1,788 2,510 159,328\n1. Cash used for exploration and evaluation operating activities in 2023 was SAR 6,398 (2022: SAR 5,531) and expenditures for investing activities were SAR 6,918 (2022: SAR 5,054).\n2. Other intangible assets with a net book value of SAR 2,556 as at December 31, 2023 (2022: SAR 2,510) comprise processing and offtake agreements, licenses, technology, usage rights,\npatents and intellectual property.\n3. In 2022, Saudi Aramco recognized a write-down on certain other intangible assets of SAR 330.\nSaudi Aramco performed an annual impairment test for the goodwill acquired as part of the SABIC acquisition, amounting to\nSAR 99,116 at December 31, 2023 and 2022, which is allocated to the Downstream segment. The recoverable amount of the\nDownstream segment was determined based on VIU calculations which require use of certain assumptions. The calculations used cash flow projections for a period of 10 years based on financial plans approved by management. Cash flows were discounted and aggregated with a terminal value. Management’s estimate for the cash flows is based on past performance and management’s expectation of the future. This includes management’s forecast for prices and margins for the downstream operations. The growth rate\nof 2.25% (2022: 2.25%) used in the terminal value calculation represents the long-term inflation forecast. The pre-tax discount rate\nfor the VIU calculations was 9.9% (2022: 11.1%). As a result of the analysis, management did not identify any impairment of goodwill\nrelated to the SABIC acquisition.\nSaudi Aramco also performed an annual impairment test for the brand acquired as part of the SABIC acquisition, which has been\ndetermined to have an indefinite useful life, amounting to SAR 18,140 at December 31, 2023 and 2022. The impairment test was\nperformed by aggregating the relevant cash-generating units. Cash flows were calculated in the same way as for the goodwill\nimpairment test. The pre-tax discount rate for the VIU calculations was 9.1% (2022: 10.9%). As a result of the analysis, management\ndid not identify any impairment.\nPre-tax discount rates of 10.9% and 11.7% in the VIU calculations for the goodwill and the brand, respectively, would result in the\nrecoverable amounts to be equal to the carrying amounts used in the annual impairment tests. Further, management believes that a 1% decrease in the growth rate, or a reasonable range of increase or decrease in any of the other assumptions used for cash flow projections, individually, would not change the outcome of the impairment analysis for the goodwill or the brand.\n13888 SSAAUUDDII AARRAAMMCCOO | |A CNONNUSAOLL RIDEAPOTERDT F2I0N2A3NCIAL STATEMENTS 2023\n\n6. A DDITIONAL FINANCIAL 7. CONSOLIDATED\n\nAND STRATEGY PERFORMANCE 3. SUSTAINABILITY 4. R ISK GOVERNANCE INFORMATION STATEMENTS All amounts in millions of Saudi Riyals unless otherwise stated 7. Investments in joint ventures and associates Carrying Carrying Equity amount at amount at\nownership Principal place of December 31, December 31,\nCompany 2023/2022 business Nature of activities 2023 2022 Joint ventures\nSaudi Yanbu Petrochemical Company (“Yanpet”)1 50% Saudi Arabia Petrochemicals 9,943 10,362\nAl-Jubail Petrochemical Company (""Kemya"")1 50% Saudi Arabia Petrochemicals 6,108 6,438\nSinopec SABIC Tianjin Petrochemical Company\nLimited (“SSTPC”)1 50% China Petrochemicals 5,481 6,251\nEastern Petrochemical Company (“Sharq”)1 50% Saudi Arabia Petrochemicals 4,758 5,235\nSadara Chemical Company (“Sadara”)2,3 65% Saudi Arabia Petrochemicals 1,139 3,769\nOther 6,811 4,646\n34,240 36,701\nClariant AG (“Clariant”)1,4 31.5% Switzerland Specialty chemical 7,522 7,968\nRefining/ marketing/\nHyundai Oilbank Co. Ltd. (""Hyundai Oil', ') (5,480) (2,065) (1,543) (11,893)\nIntangible assets - net, December 31, 2024 101,225 20,904 21,926 16,145 1,516 2,865 164,581\n1. Cash used for exploration and evaluation operating activities in 2025 was ﷼ 6,151 (2024: ﷼ 6,227) and expenditures for investing activities were ﷼ 6,025 (2024: ﷼ 8,649).\n2. Other intangible assets with a net book value of ﷼ 3,175 as at December 31, 2025 (2024: ﷼ 2,865) comprise processing and offtake agreements, licenses, technology, usage rights, patents and\nintellectual property.\nNotes to the consolidated financial statements continued All amounts in millions of Saudi Riyals unless otherwise stated 6. Intangible assets continued\nSaudi Aramco performed an annual impairment test for the goodwill of ﷼ 99,116 at December 31, 2025 and 2024, which was acquired as\npart of the Saudi Basic Industries Corporation (“SABIC”) acquisition and allocated to the Downstream segment. The recoverable amount of the Downstream segment was determined based on VIU calculations which require use of certain assumptions. The calculations used cash flow projections for a period of 10 years based on financial plans approved by management. Cash flows were discounted and aggregated with a terminal value. Management’s estimate for the cash flows is based on past performance and management’s expectation of the future.\nThis includes management’s forecast for prices and margins for the downstream operations. The growth rate of 2.25% (2024: 2.25%) used in\nthe terminal value calculation represents the long-term inflation forecast. The pre-tax discount rate for the VIU calculations was 10.5% (2024:\n11.0%). As a result of the analysis, management did not identify any impairment of goodwill related to the SABIC acquisition.\nSaudi Aramco also performed an annual impairment test for the brand acquired as part of the SABIC acquisition, which has been determined\nto have an indefinite useful life, amounting to ﷼ 18,140 at December 31, 2025 and 2024. The impairment test was performed by aggregating\nthe relevant cash-generating units. Cash flows were calculated in the same way as for the goodwill impairment test. The pre-tax discount rate\nfor the VIU calculations was 10.1% (2024: 10.1%). As a result of the analysis, management did not identify any impairment.\nPre-tax discount rates of 12.3% and 12.6% in the VIU calculations for the goodwill and the brand, respectively, would result in the\nrecoverable amounts to be equal to the carrying amounts used in the annual impairment tests. Further, management believes that a 1% decrease in the growth rate, or a reasonable range of increase or decrease in any of the other assumptions used for cash flow projections, individually, would not change the outcome of the impairment analysis for the goodwill or the brand.\n7. Investments in joint ventures and associates Carrying Carrying Equity amount at amount at\nownership Principal place December 31, December 31,\nCompany 2025/2024 of business Nature of activities 2025 2024 Joint ventures\nSaudi Yanbu Petrochemical Company (“Yanpet”)1 50% Saudi Arabia Petrochemicals 8,514 9,320\nAl-Jubail Petrochemical Company (""Kemya"")1 50% Saudi Arabia Petrochemicals 5,221 5,575\nEastern Petrochemical Company (“Sharq”)1 50% Saudi Arabia Petrochemicals 4,131 4,364\nSinopec SABIC Tianjin Petrochemical Company Limited\n(“SSTPC”)1 50% China Petrochemicals 3,747 4,658\nOther 11,627 7,712\n33,240 31,629\nAssociates Rabigh Refining and Petrochemical Company\n(“Petro Rabigh”)2,3,4,5 (Note 36(b)(i)) 57.6%/37.5% Saudi Arabia Refining/petrochemicals 6,807 2,649\nClariant AG (“Clariant”)1,4 31.5% Switzerland Specialty chemical 4,607 5,690\nHuajin Aramco Petrochemical Co., Ltd. (HAPCO) 30% China Refining/petrochemicals 4,043 3,410\nMa’aden Phosphate Company (“MPC”)1 30% Saudi Arabia Agri-nutrients 3,533 3,550\nRefining/marketing/\nHyundai Oilbank Co., Ltd', 'audit addressed the Key audit |\n\n| goodwill and brand recognised as part of the | | | | | | | | | | |\n\n| International Accounting Standard (“IAS”) 36 | | | | | | | | | | Our procedures included the following: | | ‘Impairment of Assets’, that is endorsed in the Kingdom | | | | | | | | | | ● We considered the appropriateness of | | of Saudi Arabia, requires goodwill and intangible assets | | | | | | | | | | |\n\n| that have indefinite useful lives to be tested annually for | | | | | | | | | | | | | | | | | | | | | | Downstream operating segment and brand to the |\n\n| | | | | | | | | | | aggregation of the relevant CGUs, based on the |\n\n| of the goodwill and brand (determined to have an | | | | | | | | | | | | | | | | | | | | | | values of the assets and liabilities considered as part | | indefinite useful life) recognised as part of the SABIC | | | | | | | | | | | | | | | | | | | | | | of the impairment tests for both goodwill and |\n| acquisition during the year ended December 31, 2020. | | | | | | | | | | |\n\n| The | | carrying amounts of these assets were SAR 99.1 | | | | | | | | | | billion and SAR 18.1 billion, respectively, as at | | | | | | | | | | ● With input from internal valuation experts, where |\n| December 31, 2023. | | | | | | | | | | considered necessary, we performed the following |\n\n| Goodwill has been allocated to the Downstream | | | | | | | | | | deemed appropriate: | | operating segment. Therefore, the goodwill impairment | | | | | | | | | | - Considered the consistency of certain | | test was performed at the Downstream operating | | | | | | | | | | unobservable inputs underlying the 10-year cash | | segment level. The brand test was performed based on | | | | | | | | | | flows such as expected product volumes and costs | | an aggregation of the relevant Cash-Generating Units | | | | | | | | | | with approved financial plans; |\n\n| | | | | | | | | | | and margins underlying the 10-year cash flows to | | The recoverable amounts were determined based on | | | | | | | | | | |\n\n| value-in-use derived using discounted cash flow models. | | | | | | | | | | | | Each of the models were based on the most recent | | | | | | | | | | - Evaluated the reasonableness of approved | | approved financial plans and included 10-year | | | | | | | | | | financial plans by comparison to historical | | projection periods with terminal values assumed | | | | | | | | | | results; | | thereafter. | | | | | | | | | | - Assessed the reasonableness of the approach and | | | | | | | | | | | | inputs used to determine the terminal values; | | The exercise performed by management supported the | | | | | | | | | | - Evaluated the reasonableness of the pre-tax | | goodwill and brand carrying values and did not identify | | | | | | | | | | discount rates used by cross-checking the | | the need for any impairment charges to be recognised. | | | | | | | | | | underlying assumptions against observable |\n\n| We considered this to be a key audit matter given the | | | | | | | | | | | | | | | | | | | | | | - Tested the mathematical accuracy and logical |\n\n| determining recoverable amounts and the uncertainty | | | | | | | | | | | | inherent in the underlying forecasts and assumptions. | | | | | | | | | | - Tested management’s sensitivity analyses that | | The key inputs to the recoverable amounts included the: | | | | | | | | | | considered the impact of changes in assumptions | | ● Cash flows during the 10-year projection periods | | | | | | | | | | on the outcome of the impairment assessments. | | | including commodity prices, margins and other | | | | | | | | | ● We considered the reasonableness of the | | | underlying assumptions; | | | | | | | | | movements in the recoverable amounts during the | | ● Terminal values; and | | | | | | | | | | year ended December 31, 2023 in view of the |\n| ● Pre-tax discount rates. | | | | | | | | | | changes in']","The main assumptions used in Saudi Aramco's impairment tests for non-financial assets include:

1. **Cash Flow Projections**: These are based on financial plans approved by management and cover a period of 10 years.
2. **Growth Rate**: A growth rate of 2.25% is used in the terminal value calculation, representing the long-term inflation forecast.
3. **Discount Rate**: The pre-tax discount rates are specifically mentioned as follows:
   - For goodwill: 11.0% for 2024, 9.9% for 2023, and 10.5% for 2025.
   - For the brand: 10.1% for the current and previous years, and 10.1% for 2025.
4. **Forecast for Prices and Margins**: Management's expectation regarding future prices and margins for downstream operations is also a critical assumption.
5. **Sensitivity to Changes**: Management believes that a 1% decrease in the growth rate or reasonable changes in the other assumptions individually would not change the impairment analysis outcomes.","The key assumptions include forecasted oil, gas, refined product and chemical prices, expected production volumes, future operating and development costs, refining and petrochemical margins, and discount rates. These assumptions affect recoverable amounts and any impairment calculations.",1.0,0.9999996448645309,0.99999999998,1.0
What does Saudi Aramco's lease accounting policy say about right-of-use assets?,"[""recognized for the amount by which the asset’s carrying amount exceeds its recoverable amount. The recoverable amount is the higher of an asset’s fair value less costs of disposal or value in use (“VIU”). The fair value less costs of disposal calculation is based on either, post-tax discounted cash flow models or available data from binding arm’s length sales transactions for similar assets, or observable market prices less incremental costs of disposing of the asset. The VIU calculation is based on a post-tax risk adjusted discounted cash flow model. The use of post-tax discount rates in determining VIU does not result in a materially different determination of the need for, or the amount of, impairment that would be required if pre-tax discount rates had been used.\nImpairment losses are recognized as a component of net income and are presented within depreciation and amortization in the consolidated statement of income. If, in a subsequent period, the amount of a non-goodwill impairment loss decreases, a reversal of the previously recognized impairment loss is recognized in net income.\nSignificant accounting judgments and estimates Impairment tests are undertaken on the basis of the smallest identifiable group of assets (cash-generating unit), or individual assets, for which there are largely independent cash inflows. The key assumptions used to determine the different cash-generating units involves significant judgment by management.\nFor the purposes of determining whether impairment of non-financial assets has occurred, and the extent of any impairment or its reversal, the key assumptions management uses in estimating future cash flows for its VIU calculations are forecasted future oil, gas, refined product and chemical prices, expected production volumes, future operating and development costs, refining and petrochemical margins and changes to the discount rate used for the discounted cash flow model. There is an inherent uncertainty over forecasted information and assumptions. Changes in these assumptions and forecasts could impact the recoverable amounts of assets and any calculated impairment and reversals thereof.\n(i) Leases Saudi Aramco’s portfolio of leased assets mainly comprises land and buildings, drilling rigs, marine vessels, industrial facilities, equipment, storage and tanks, aircraft and vehicles. The determination of whether the contract is, or contains, a lease is based on the substance of the contract at the inception of the lease. A contract is, or contains, a lease if the contract conveys the right to control the use of an identified asset for a period of time in exchange for consideration.\nSaudi Aramco recognizes right-of-use assets and lease liabilities at the lease commencement date. Right-of-use assets are initially measured at cost, which comprises lease liabilities at initial measurement, any initial direct costs incurred, any lease payments made at or before the commencement date, and restoration costs less any lease incentives received. Subsequent to initial recognition the right-of-use assets are measured at cost less accumulated depreciation and accumulated impairment losses, if any, and adjusted for any remeasurement of the lease liability. Right-of-use assets are depreciated over the shorter of the asset's useful life and the lease term on a straight-line basis unless the lease transfers ownership of the underlying asset by the end of the lease term or if the cost of the asset reflects the exercise of the purchase option, in which case right-of-use assets are depreciated over the useful life of the underlying asset. Depreciation expense is recorded in the consolidated statement of income. Right-of-use assets are included under property, plant and equipment (Note 5).\n\n5 . O RGANIZATIONAL 6. A DDITIONAL STRUCTURE AND FINANCIAL 7. CONSOLIDATED\n\nAND STRATEGY PERFORMANCE 3. SUSTAINABILITY 4. RISK GOVERNANCE INFORMATION STATEMENTS All amounts in millions of Saudi Riyals unless otherwise stated 2. Material accounting policy information and significant judgments and estimates continued (i) Leases continued Lease liabilities are initially measured at the present value of lease payments. Lease payments include fixed lease payments, variable lease payments that depend on an index or rate, amounts payable for guaranteed residual values and payments to be made under extension or purchase or termination options, where applicable. The lease payments are discounted using the interest rate implicit in the lease. If that rate cannot be readily determined, which is generally the case, the lessee’s incremental borrowing rate is used, being the rate that the individual lessee would have to pay to borrow the funds necessary to obtain an asset of similar value to the right-of-use asset in a similar economic environment with similar terms, security and conditions. Subsequent to initial recognition, the lease liabilities are measured by increasing the carrying amount to reflect interest on the lease liability, reducing the carrying amount to reflect the lease payments made and adjusted for remeasurement to reflect any reassessments or lease modifications. Lease liabilities are included under borrowings (Note 20). Lease payments are allocated between the principal and finance costs. Finance costs are recorded as an expense in the consolidated statement of income over the lease period so as to produce a constant periodic rate of interest on the remaining balance of the liability.\nSaudi Aramco has elected not to recognize right-of-use assets"", 'IFRS 16, Leases from the We performed the following procedures:\nmandatory adoption date of January 1, 2019. This standard superseded the requirements of IAS 17, • Gained an understanding of management’s\nLeases. IFRS 16 introduced a single lease implementation plan and the processes and accounting model, requiring lessees to recognise, controls introduced as part of the IFRS 16\nin most cases, a right-of-use asset and a lease adoption;\nliability. • Tested completeness of management’s lease register by considering the reconciliation of the As part of the adoption exercise, management: lease liabilities recognised as at January 1, 2019 to the operating lease commitments as at\n• Performed an extensive exercise to identify and December 31, 2018, as disclosed in the assess significant lease arrangements. This was consolidated financial statements;\ninherently complex given the large number of • Obtained the detailed lease schedules contracts in place and the diverse nature of the underlying the transitional adjustments underlying terms and conditions; recorded as at January 1, 2019 and the lease\n• Implemented system changes and set up new balances recognised as at December 31, 2019 processes and controls to deal with the new and tested their mathematical accuracy; and lease accounting methodology; and • For samples selected from both the above-\n• Determined the appropriate transitional mentioned schedules, tested the following, as adjustments and the disclosures required to be appropriate:\nincluded in the consolidated financial statements. (a) Management’s assessment of whether or not the contracts contained leases;\nThe Group adopted IFRS 16 using the modified (b) Appropriateness of the practical retrospective approach and did not restate expedients applied;\ncomparative figures. A number of practical (c) Calculations of the right-to-use assets and expedients were applied and there was no impact the corresponding lease liabilities as at on opening retained earnings. Right-of-use assets January 1, 2019 and December 31, 2019 and corresponding lease liabilities amounting to and the movements during the year;\nSAR 26.1 billion were recognised as at January 1, (d) Appropriateness of the key judgments\n2019 for arrangements previously classified as underlying the determination of lease\noperating leases. terms; and (e) Reasonableness of the discount rates used We considered this to be a key audit matter as: (a) with reference to incremental borrowing contracts within the scope of IFRS 16 may not be rates.\nappropriately identified or included in the transitional impact calculations; and (b) We also considered the appropriateness of the determination of the right-of-use assets and the accounting policies and disclosures included in the corresponding lease liabilities involves complex consolidated financial statements in relation to computations and significant management IFRS 16.\njudgment relating to the lease terms.\nRefer to Note 2(c)(i), Note 2(i), Note 5 and Note 19 to the consolidated financial statements for further information.\n\nIndependent auditor’s report to the shareholders of Saudi Arabian Oil Company (continued)\nOther information The Board of Directors is responsible for the other information. The other information comprises the Annual Report but does not include the consolidated financial statements and our auditor’s report thereon.\nOur opinion on the consolidated financial statements does not cover the other information and we do not express any form of assurance conclusion thereon.\nIn connection with our audit of the consolidated financial statements, our responsibility is to read the other information identified above and, in doing so, consider whether the other information is materially inconsistent with the consolidated financial statements or our knowledge obtained in the audit, or otherwise appears to be materially misstated.\nIf, based on the work we have performed, we conclude that there is a material misstatement of this other information, we are required to report that fact. We have nothing to report in this regard.\nResponsibilities of the Board of Directors and those charged with governance for the consolidated financial statements The Board of Directors is responsible for the preparation and fair presentation of the consolidated financial statements in accordance with International Financial Reporting Standards, that are endorsed in the Kingdom of Saudi Arabia and other standards and pronouncements issued by SOCPA, and the applicable requirements of the Regulations for Companies and the Company’s Bylaws, and for such internal control as they determine is necessary to enable the preparation of consolidated financial statements that are free from material misstatement, whether due to fraud or error.\nIn preparing the consolidated financial statements, the Board of Directors is responsible for assessing the Group’s ability to continue as a going concern, disclosing, as applicable, matters related to going concern and using the going concern basis of accounting unless the Board of Directors either intends to liquidate the Group or to cease operations, or has no realistic alternative but to do so.\nThose charged with governance are responsible for overseeing the Group’s financial reporting process.\nAuditor’s responsibilities for the audit of the consolidated financial statements Our objectives are to obtain reasonable assurance about whether the consolidated financial statements as a whole are free from material mis', ""of disposal or value in use (“VIU”). The fair value less costs of disposal calculation is based on either, post-tax discounted cash flow models or available data from binding arm’s length sales transactions for similar assets, or observable market prices less incremental costs of disposing of the asset. The VIU calculation is based on a post-tax risk adjusted discounted cash flow model. The use of post-tax discount rates in determining VIU does not result in a materially different determination of the need for, or the amount of, impairment that would be required if pre-tax discount rates had been used.\nImpairment losses are recognized as a component of net income. If, in a subsequent period, the amount of a non-goodwill impairment loss decreases, a reversal of the previously recognized impairment loss is recognized in net income.\nSignificant accounting judgments and estimates Impairment tests are undertaken on the basis of the smallest identifiable group of assets (cash-generating unit), or individual assets, for which there are largely independent cash inflows. The key assumptions used to determine the different cash-generating units involves significant judgment by management.\nFor the purposes of determining whether impairment of items of property, plant and equipment has occurred, and the extent of any impairment or its reversal, the key assumptions management uses in estimating future cash flows for its VIU calculations are forecasted future oil, gas, refined product and chemical prices, expected production volumes, future operating and development costs, refining and petrochemical margins and changes to the discount rate used for the discounted cash flow model. There is an inherent uncertainty over forecasted information and assumptions. Changes in these assumptions and forecasts could impact the recoverable amounts of assets and any calculated impairment and reversals thereof.\n(i) Leases Saudi Aramco’s portfolio of leased assets mainly comprises land and buildings, drilling rigs, marine vessels, industrial facilities, equipment, storage and tanks, aircraft and vehicles. The determination of whether the contract is, or contains, a lease is based on the substance of the contract at the inception of the lease. A contract is, or contains, a lease if the contract conveys the right to control the use of an identified asset for a period of time in exchange for consideration.\nSaudi Aramco recognizes right-of-use assets and lease liabilities at the lease commencement date. Right-of-use assets are initially measured at cost, which comprises lease liabilities at initial measurement, any initial direct costs incurred, any lease payments made at or before the commencement date, and restoration costs less any lease incentives received. Subsequent to initial recognition the right-of-use assets are measured at cost less accumulated depreciation and accumulated impairment losses, if any, and adjusted for any remeasurement of the lease liability. Right-of-use assets are depreciated over the shorter of the asset's useful life and the lease term on a straight-line basis unless the lease transfers ownership of the underlying asset by the end of the lease term or if the cost of the asset reflects the exercise of the purchase option, in which case right-of-use assets are depreciated over the useful life of the underlying asset.\nDepreciation expense is recorded in the consolidated statement of income. Right-of-use assets are included under property, plant and equipment (Note 5).\n12722 SSAAUUDDII AARRAAMMCCOO | |A CNONNUSAOLL RIDEAPOTERDT F2I0N2A3NCIAL STATEMENTS 2023\n\n6. A DDITIONAL FINANCIAL 7. CONSOLIDATED\n\nAND STRATEGY PERFORMANCE 3. SUSTAINABILITY 4. R ISK GOVERNANCE INFORMATION STATEMENTS All amounts in millions of Saudi Riyals unless otherwise stated 2. Material accounting policy information and significant judgments and estimates continued (i) Leases continued Lease liabilities are initially measured at the present value of lease payments. Lease payments include fixed lease payments, variable lease payments that depend on an index or rate, amounts payable for guaranteed residual values and payments to be made under extension or purchase or termination options, where applicable. The lease payments are discounted using the interest rate implicit in the lease. If that rate cannot be readily determined, which is generally the case, the lessee’s incremental borrowing rate is used, being the rate that the individual lessee would have to pay to borrow the funds necessary to obtain an asset of similar value to the right-of-use asset in a similar economic environment with similar terms, security and conditions. Subsequent to initial recognition, the lease liabilities are measured by increasing the carrying amount to reflect interest on the lease liability, reducing the carrying amount to reflect the lease payments made and adjusted for remeasurement to reflect any reassessments or lease modifications. Lease liabilities are included under borrowings (Note 20). Lease payments are allocated between the principal and finance costs. Finance costs are recorded as an expense in the consolidated statement of income over the lease period so as to produce a constant periodic rate of interest on the remaining balance of the liability.\nSaudi Aramco has elected not to recognize right-of-use assets and lease liabilities for short-term and low-value"", 'reserve life is approximately equal to or less than the estimated useful lives of the underlying assets. Depletion rates are calculated on the basis of a group of wells or fields with similar characteristics based on proved developed reserves. The estimation of expected reserve lives reflects management’s assessment of proved developed reserves and the related depletion strategy on a field-by-field basis. Depreciation expense on all other assets is calculated using the straight-line method to allocate the cost less residual values over the estimated useful lives. Depreciation expense is recorded in the consolidated statement of income.\nDepreciation expense is calculated after determining an estimate of an asset’s expected useful life and the expected residual value at the end of its useful life. The useful lives and residual values are determined by management at the time the asset is initially recognized and are reviewed annually for appropriateness or when events or conditions occur that impact capitalized costs, hydrocarbon reserves, residual values or estimated useful lives.\n\nNotes to the consolidated financial statements continued All amounts in millions of Saudi Riyals unless otherwise stated 2. Material accounting policy information and significant judgments and estimates continued (g) Property, plant and equipment continued The estimated useful lives or, for right-of-use assets the lease term, if shorter (Note 2(i)), in years, of principal groups of depreciable assets is as follows:\nLand and land improvements 3 to 54 Buildings 5 to 50\nOil and gas properties 15 to 35\nPlant, machinery and equipment 2 to 52 Depots, storage tanks and pipelines 4 to 30\nFixtures, IT and office equipment 2 to 20 Gains and losses on disposals of depreciable assets are recognized in net income.\n(h) Impairment of non-financial assets At each reporting date, Saudi Aramco assesses, whether there are any indications that a non-financial asset with a definite life might be impaired. Assets with indefinite useful lives, such as goodwill and brands acquired on acquisition of certain subsidiaries, are reviewed for impairment on an annual basis. If an indication of impairment exists, or when annual impairment testing for an asset is required, the asset’s recoverable amount is estimated. An impairment loss is recognized for the amount by which the asset’s carrying amount exceeds its recoverable amount. The recoverable amount is the higher of an asset’s fair value less costs of disposal or value in use (“VIU”). The fair value less costs of disposal calculation is based on either, post-tax discounted cash flow models or available data from binding arm’s length sales transactions for similar assets, or observable market prices less incremental costs of disposing of the asset. The VIU calculation is based on a post-tax risk adjusted discounted cash flow model. The use of post-tax discount rates in determining VIU does not result in a materially different determination of the need for, or the amount of, impairment that would be required if pre-tax discount rates had been used.\nImpairment losses are recognized as a component of net income and are presented within impairment and held for sale remeasurement losses in the consolidated statement of income. Impairment losses for 2024, previously recognized within depreciation and amortization, have been reclassified to conform to the current year presentation. If, in a subsequent period, the amount of a non-goodwill impairment loss decreases, a reversal of the previously recognized impairment loss is recognized in net income.\nSignificant accounting judgments and estimates Impairment tests are undertaken on the basis of the smallest identifiable group of assets (cash-generating unit), or individual assets, for which there are largely independent cash inflows. The key assumptions used to determine the different cash-generating units involves significant judgment by management.\nFor the purposes of determining whether impairment of non-financial assets has occurred, and the extent of any impairment or its reversal, the key assumptions management uses in estimating future cash flows for its VIU calculations are forecasted future oil, gas, refined product and chemical prices, expected production volumes, future operating and development costs, refining and petrochemical margins and changes to the discount rate used for the discounted cash flow model. There is an inherent uncertainty over forecasted information and assumptions. Changes in these assumptions and forecasts could impact the recoverable amounts of assets and any calculated impairment and reversals thereof.\n(i) Leases Saudi Aramco’s portfolio of leased assets mainly comprises land and buildings, drilling rigs, marine vessels, industrial facilities, equipment, storage and tanks, aircraft and vehicles. The determination of whether the contract is, or contains, a lease is based on the substance of the contract at the inception of the lease. A contract is, or contains, a lease if the contract conveys the right to control the use of an identified asset for a period of time in exchange for consideration.\nSaudi Aramco recognizes right-of-use assets and lease liabilities at the lease commencement date. Right-of-use assets are initially measured at cost, which comprises lease liabilities at initial measurement, any initial direct costs incurred, any lease payments made at or before the commencement date, and restoration costs less any lease incentives received', 'able amount is the higher of an asset’s fair value less costs of disposal or value in use (“VIU”).\nThe fair value less costs of disposal calculation is based on either, post-tax discounted cash flow models or available data from binding arm’s length sales transactions for similar assets, or observable market prices less incremental costs for disposing of the asset. The VIU calculation is based on a post-tax risk adjusted discounted cash flow model. The use of post-tax discount rates in determining VIU does not result in a materially different determination of the need for, or the amount of, impairment that would be required if pre-tax discount rates had been used.\nImpairment losses are recognized as a component of net income. If, in a subsequent period, the amount of a non-goodwill impairment loss decreases, a reversal of the previously recognized impairment loss is recognized in net income.\nSignificant accounting judgments and estimates Impairment tests are undertaken on the basis of the smallest identifiable group of assets (cash-generating unit), or individual assets, for which there are largely independent cash inflows. The key assumptions used to determine the different cash- generating units involves significant judgment from management.\nFor the purposes of determining whether impairment of items of property, plant and equipment has occurred, and the extent of any impairment or its reversal, the key assumptions management uses in estimating future cash flows for its VIU calculations are forecasted future oil, gas, refined product and chemical prices, expected production volumes, future operating and development costs, refining and petrochemical margins and changes to the discount rate used for the discounted cash flow model. There is an inherent uncertainty over forecasted information and assumptions. Changes in these assumptions and forecasts could impact the recoverable amounts of assets and any calculated impairment and reversals thereof.\n(j) Leases Saudi Aramco’s portfolio of leased assets mainly comprises land and buildings, drilling rigs, marine vessels, industrial facilities, equipment, storage and tanks, aircraft and vehicles. The determination of whether the contract is, or contains, a lease is based on the substance of the contract at the inception of the lease. A contract is, or contains, a lease if the contract conveys the right to control the use of an identified asset for a period of time in exchange for consideration.\nSaudi Aramco recognizes right-of-use assets and lease liabilities at the lease commencement date. Right-of-use assets are initially measured at cost, which comprises lease liabilities at initial measurement, any initial direct costs incurred, any lease payments made at or before the commencement date, and restoration costs less any lease incentives received. Subsequent to initial recognition the right-of-use assets are measured at cost less accumulated depreciation and accumulated impairment losses, if any, and adjusted for any remeasurement of the lease liability. Right-of-use assets are depreciated over the shorter of the asset’s useful life and the lease term on a straight-line basis unless the lease transfers ownership of the underlying asset by the end of the lease term or if the cost of the asset reflects the exercise of the purchase option, in which case right-of-use assets are depreciated over the useful life of the underlying asset. Depreciation expense is recorded in the consolidated statement of income. Right-of-use assets are included under property, plant and equipment (Note 5).\n\nNotes to the consolidated financial statements continued All amounts in millions of Saudi Riyals unless otherwise stated\n\n2. Summary of significant accounting policies, judgments and estimates continued (j) Leases continued Lease liabilities are initially measured at the present value of lease payments. Lease payments include fixed lease payments, variable lease payments that depend on an index or rate, amounts payable for guaranteed residual values and payments to be made under extension or purchase or termination options, where applicable. The lease payments are discounted using the interest rate implicit in the lease. If that rate cannot be readily determined, which is generally the case, the lessee’s incremental borrowing rate is used, being the rate that the individual lessee would have to pay to borrow the funds necessary to obtain an asset of similar value to the right-of-use asset in a similar economic environment with similar terms, security and conditions.\nSubsequent to initial recognition, the lease liabilities are measured by increasing the carrying amount to reflect interest on the lease liability, reducing the carrying amount to reflect the lease payments made and adjusted for remeasurement to reflect any reassessments or lease modifications. Lease liabilities are included under borrowings (Note 20). Lease payments are allocated between the principal and finance costs. Finance costs are recorded as an expense in the consolidated statement of income over the lease period so as to produce a constant periodic rate of interest on the remaining balance of the liability.\nSaudi Aramco has elected not to recognize right-of-use assets and lease liabilities for short-term and low-value leases. Lease payments under short-term and low-value leases are recorded as an expense in the consolidated statement of income on a straight-line basis over the lease term.\nSignificant accounting judgments and estimates In determining the lease term, management considers all facts and circumstances that create an economic incentive to exercise an extension option, or']","Saudi Aramco's lease accounting policy states that right-of-use assets are recognized at the lease commencement date and are initially measured at cost. This cost includes lease liabilities at initial measurement, any initial direct costs incurred, any lease payments made at or before the commencement date, and restoration costs less any lease incentives received. After initial recognition, right-of-use assets are measured at cost less accumulated depreciation and accumulated impairment losses, if any, and adjusted for any remeasurement of the lease liability. Right-of-use assets are depreciated over the shorter of the asset's useful life and the lease term on a straight-line basis unless the lease transfers ownership of the underlying asset by the end of the lease term or if the cost reflects the exercise of a purchase option, in which case they are depreciated over the useful life of the underlying asset. Depreciation expense is recorded in the consolidated statement of income, and right-of-use assets are included under property, plant, and equipment.","Right-of-use assets are recognized at lease commencement and initially measured at cost. They are later depreciated over the shorter of the asset's useful life and the lease term, unless ownership transfers or a purchase option is effectively certain.",1.0,0.9952784073999826,0.99999999998,1.0
What was Saudi Aramco's target for sales gas production capacity by 2030?,"['Upstream highlights Aramco demonstrated ongoing safe, reliable, and efficient The Company advanced the following increment projects to\noperations, while achieving total hydrocarbon production of 13.3 support its ability to maintain MSC at 12.0 mmbpd, while\nmmboed in the third quarter of 2025. strengthening its unique ability to respond swiftly to changing market conditions:\nDuring the quarter, Aramco increased its sales gas production capacity growth target from more than 60% to approximately • Construction activities continued for the Marjan and Berri crude 80%1. With this anticipated growth, Aramco also expects an oil increments, which are on track for completion in 2025 and\nincrease of more than one mmbpd in high value associated liquids expected to provide additional crude oil production capacity of\nproduction. As a result, the Company anticipates total gas and 300 mbpd and 250 mbpd, respectively;\nassociated liquids of approximately six mmboed by 2030. • Procurement and construction activities progressed for the Zuluf crude oil increment, which is expected to process 600 mbpd of\nAramco also progressed several developments to support its gas crude oil from the Zuluf field through a central facility in 2026;\nexpansion strategy: and,\n• Engineering, procurement, and construction activities continued for phase two of the Dammam development project, which is\n• Phase one of the Jafurah Gas Plant, part of the Jafurah expected to add 50 mbpd of crude oil production capacity when unconventional gas field development, continued construction completed in 2027.\nactivities and is on track for completion in 2025. Production is expected to reach a sustainable sales gas rate of 2.0 bscfd by\n2030, in addition to significant volumes of ethane, NGL, and Gas growth target increased condensate;\n• The Tanajib Gas Plant, part of the Marjan development program, progressed construction activities and is on track for completion\nin 2025, with the expected addition of 2.6 bscfd of raw gas ~80\nprocessing capacity from the Marjan and Zuluf fields; % sales gas production\n• The Fadhili Gas Plant expansion, which is expected to increase capacity1\nraw gas processing capacity of 1.5 bscfd by 2027, continued with\nengineering, procurement, and construction activities; and,\n• In October, the Company closed a transaction to lease and lease back the development and usage rights to the Jafurah Field Gas Plant and the Riyas NGL Fractionation Plant to its subsidiary, Jafurah Midstream Gas Company, for a period of 20 years. As part of the transaction, Aramco sold a 49% equity interest in the subsidiary to a consortium of international investors led by funds managed by Global Infrastructure Partners, a part of\nBlackRock, for upfront sale proceeds of ﷼ 41.8 billion ($11.1\nbillion) in cash. During the 20-year lease period, the subsidiary will receive quarterly volume-based tariff payments from Aramco, backed by minimum volume commitments. Aramco +60\nwill at all times retain title and full operational control of the\n\nfacilities, and the transaction will not impose any restrictions on sales gas production its production volumes.\ncapacity1 1. Over 2021 production levels by 2030 subject to domestic demand and inclusive of pre-FID projects not yet announced.\nAll amounts in millions unless otherwise stated Downstream performance 3rd quarter 2nd quarter 3rd quarter Nine months Nine months\n2025 2025 2024 2025 2024\nEBIT: SAR 5,079 2,112 (6,675) 9,096 (3,041) | USD 1,355 563 (1,780) 2,426 (811)\nAdjusting items1: SAR 4,696 7,610 10,544 14,574 8,744 | USD 1,252 2,029 2,812 3,886 2,332\nAdjusted EBIT: SAR 9,775 9,722 3,869 23,670 5,703 | USD 2,607 2,592 1,032 6,312 1,521\nCapital expenditures - cash basis: SAR 11,654 10,527 9,466 30,788 23,841 | USD 3,108 2,807 2,524 8,210 6,358\nSupply reliability % 99.9% 100% 99.8% 99.9% 99.7%\nDownstream utilization of Aramco’s crude oil\nproduction2 % 54% 54% 53% 54% 53%\n1. Refer to the Non-IFRS measures reconciliations', 'largest liquids-rich shale\n\nnatural gas in the Kingdom and its gas gas play in the Middle East. 17,000km portfolio is rich in liquids, demonstrated by the production of both NGL and unblended condensate. \uf098 Gas field Bahrain Expected high-value liquids \uf098 Oil field and condensates by 2030 Aramco’s nonassociated gas fields vary widely in reservoir properties, depths, pressures, and w ar Qatar 630 mbpd\ncompositions. In general, the southern area Saudi Arabia h a Jafurah around the Ghawar field has rich gas at G moderate depths and permeability, while the Expected sales gas production by 2030 northern offshore fields (Karan, Arabiyah, and Hasbah) have leaner gas in deeper reservoirs with high permeability. In support of its plan to develop its unconventional resources, the Company is developing the Jafurah field, which began production in\n2025 and will gradually increase gas\ndeliveries through 2030, while adding incremental high-value liquid and condensate Highlights and developments production. Additionally, Aramco’s crude oil production provides a base load of associated Jafurah Gas Plant Jafurah Midstream Gas Company gas, which is rich in liquids. Aramco’s primary Phase one of the Jafurah Gas Plant, part The Company closed a transaction to natural gas processing and fractionation of the Jafurah unconventional gas field lease and lease back the development facilities are located in Ghawar and the development, was completed and began and usage rights to the Jafurah Field Gas northern and western areas of the Kingdom. production in December. Jafurah is the Plant and the Riyas NGL Fractionation The Company’s facilities are strategically largest nonassociated gas field in the Plant to its subsidiary, JMGC, for a period located near its fields to reduce transportation Kingdom and the largest liquids-rich of 20 years. As part of the transaction,\nand pipeline compression costs, as well as the shale gas play in the Middle East. Spread Aramco sold a 49% equity interest in the time required to deliver gas products to over 17,000 km2, it is estimated to contain subsidiary to a consortium of\nmarket. 229 tscf of raw gas and 75 bstb of international investors led by funds\ncondensate. Production is expected to managed by Global Infrastructure In 2025, Aramco’s average gas production progressively ramp up to 2 bscfd of sales Partners, a part of BlackRock, for\nwas approximately 11.4 bscfd (2024: 10.8\ngas, 420 mmscfd of ethane, and 630 upfront sale proceeds of ﷼ 41.8 billion\nbscfd) of natural gas and ethane. As at\nmbpd of high-value liquids and ($11.1 billion) in cash. During the 20-year\nDecember 31, 2025, the total conventional\ncondensates by 2030. lease period, the subsidiary will receive and unconventional raw gas processing quarterly volume-based tariff payments\ncapacity was 19.6 bscfd (2024: 19.1 bscfd), Fadhili Gas Plant\nfrom Aramco, backed by minimum which primarily feeds into the MGS, an The Fadhili Gas Plant expansion volume commitments. Aramco will at all extensive network of pipelines that connects completed engineering and progressed times retain title and full operational the Company’s key gas production and construction activities. The plant is control of the facilities, and the processing sites with demand centers expected to provide additional raw gas transaction will not impose any throughout the Kingdom and is currently processing capacity of 1.5 bscfd restrictions on its production volumes.\nundergoing expansion. Aramco has increased (approximately 1.15 bscfd of sales gas its sales gas production capacity target to production capacity) by 2027. Tanajib Gas Plant\napproximately 80% by 2030 from 2021 The Tanajib Gas Plant, part of the Marjan production levels, subject to domestic development program, commenced demand and inclusive of pre-FID projects 1.5 bscfd operations in December. It is expected to\nnot yet announced. Fadhili Gas Plant expected raw gas provide 2.6 bscfd of raw gas processing processing capacity capacity (approximately 0.65 bscfd of\nThe Company sells natural gas to power sales gas production capacity) from the generation plants primarily pursuant to LNG offtake agreement Marjan and Zuluf fields.\nlong-term contracts and to customers in the Aramco signed a 20-year SPA with Kingdom’s industrial sector. The supply of NextDecade for offtake of 1.2 mmtpa of\nnatural gas to domestic customers is 2.6 bscfd LNG from liquefaction Train 4 of its Rio regulated by the Energy Supply', 'trading, to grow through capacity expansions in the Kingdom, increased distribution, retail, base oils, lubricants and power generation. ownership positions in affiliates and new investments, with net Aramco is also developing renewables, undertaking projects to chemical production capacity1 of 57.62 million tons per year as at\ncapture emissions from its own facilities and the facilities of others, December 31, 2024, (2023: 59.6 million tons per year).\nand has ambitions to develop new fuels and products, including blue Aramco’s Downstream business also includes its crude oil marketing hydrogen and blue ammonia.\nand product sales, distribution, retail, lubricants, and trading Aramco’s downstream investments diversify its revenue and integrate operations. These operations support Aramco’s upstream and its oil and gas operations to optimize value across the hydrocarbon downstream operations by enabling it to optimize crude oil sales chain, supporting crude oil and gas demand and facilitating the and product placement through its significant infrastructure placement of its crude oil. This crude oil placement provides network of pipelines and terminals and access to shipping and significant benefits to Aramco operations, offering a secure and logistics resources.\nreliable supply of high-quality crude oil, which helps to ensure a The Downstream segment launched a transformation program in secure and reliable supply of refined products to its downstream 2021, seeking to realize incremental value from its portfolio through customers. Aramco intends to continue the strategic integration yield enhancements, stream integration, optimization, and cost of its Upstream and Downstream business, coupled with future reductions. The ongoing transformation program has delivered downstream investment, to facilitate the placement of the Company’s\nestimated incremental EBIT of over ﷼ 15.0 billion ($4.0 billion)\ncrude oil. In 2024, the crude oil utilized by Aramco’s downstream in 2024.\noperations accounted for 53% (2023: 47%) of the Company’s crude\noil production. In addition, Aramco intends to continue to grow its Outlook for 2025 liquids-to-chemicals business, with a goal to increase its capacity in Aramco’s Downstream segment is expected to continue its strategic petrochemical producing complexes to up to four million barrels per expansion and integration across the hydrocarbon value chain. The\nday by 2030. By the end of 2024, Aramco achieved approximately segment aims to capitalize on the potential of its products to meet\n45% of its target, with further capacity additions under development. the anticipated demand for chemical products and expand its business in key global markets.\nThe integration of Aramco’s refining and chemicals manufacturing assets provides an opportunity to capture additional value and To create additional value, the Downstream segment plans to continue the shift of its product portfolio to improve the balance of increase refining capacity in strategic location, grow its liquids-to- fuels and chemicals production. Through its June 2020 acquisition chemicals business, expand trading activities, increase its marketing of a majority interest in SABIC, a globally diversified chemicals business for retail and lubricants, and leverage the Downstream company with manufacturing in the Americas, Europe, the Middle transformation program to further enhance its earning potential.\n1. Excludes SABIC Agri-Nutrients business for 2024 and SABIC Agri-Nutrients and Metals (Hadeed) businesses for 2023 and includes only ZPC’s net chemical production capacity through our investment in Rongsheng.\n2. The reduction in net chemicals production capacity is due to the termination of operations of three assets related to SABIC mainly in Europe.\n\n5 . O RGANIZATIONAL 6. A DDITIONAL STRUCTURE AND FINANCIAL 7. C ONSOLIDATED\n\nAND STRATEGY PERFORMANCE 3. SUSTAINABILITY 4. RISK GOVERNANCE INFORMATION STATEMENTS Downstream operations B usiness Model page 12 Integrated value chain page 16\nRefining page 50 Chemicals page 52\nBase oils and lubricants page 53 Retail operations page 53\nP ipelines, distribution, and terminals page 54 Supply and trading page 54\nPower page 55 Competitive strengths Captive downstream system Large global refining and Large downstream capital projects Ability to monetize upstream production chemical portfolio Ability to execute some of the world’s into a high-quality external customer Scale advantage with one of the largest downstream capital projects.\nbase and through a captive largest refining and chemical Premium branded base oils and downstream system. portfolios globally.\nlubricants products Reliable supplier Globally integrated trading Strong integrated base oils and lubricants Strong track record of supply reliability1. Globally integrated trading operation, driven by global presence, activities, optimize product supply significant production capacity, strategic Major integrated refiner to maximize returns. acquisitions, and ability to produce Major integrated refiner and base oils and premium branded base oils and lubricants lubricants producer with a global network World-class partners products.\nof complex, reliable assets in key regional World-class partners provide access to markets and', 'metrics: 28 CFO’s message: 30\nAramco in the capital markets: 32 Financial performance: 34\nUpstream: 42 Downstream: 48\nCorporate: 56 Growing gas production capacity Jafurah Gas Plant, Jafurah unconventional gas field, Saudi Arabia Aramco is investing to increase its sales gas production capacity by more than 60% to meet growing domestic demand and reduce liquids\nburning in power generation.\nPhase one of the Jafurah Gas Plant is expected to commence production in 2025, and production from the Jafurah field is expected to reach a\nsustainable sales gas rate of 2.0 bscfd by 2030, in addition to significant\nvolumes of ethane, NGL, and condensate.\nAND STRATEGY PERFORMANCE 3. SUSTAINABILITY 4. RISK\n\n2 | | Results and | performance | Key 2024 metrics: 28 | CFO’s message: 30\nAramco in the capital markets: 32 | Financial performance: 34\nUpstream: 42 | Downstream: 48\nCorporate: 56\n\nGrowing ga Jafurah Gas Plant, Jafura Aramco is investing to in more than 60% to meet burning in power gener Phase one of the Jafura in 2025, and production\nsustainable sales gas rat volumes of ethane, NGL\n\nKey 2024 metrics Financial highlights Net income EBIT * Free cash flow* (billion) (billion) (billion)\n\n398 772 320\n$106 $206 $85\n2023: $121 2023: $231 2023: $101\nNet cash provided by Capital expenditures1 ROACE* operating activities (billion) (%)\n(billion)\n\n509 189 20.2\n$136 $50 2023: 22.5\n2023: $143 2023: $42\nDividends paid Dividends paid per share Gearing* (billion) (%)\n\n466 1.93 4.5\n$124 $0.51 2023: (6.3)\n2023: $98 2023: $0.41\nEarnings per share Average realized crude oil price 1. Capital expenditures do not include external investments.\n* Non-IFRS measures: refer to “Non-IFRS measures (basic and diluted) ($/barrel)\nreconciliations and definitions” for further details.\n\n1.63 80.2\n$0.43 2023: 83.6\n2023: $0.50 HHaawwiiyyaahh GGaass SSttoorraaggee,, SSaauuddii AArraabbiiaa\n\n5 . O RGANIZATIONAL 6. A DDITIONAL STRUCTURE AND FINANCIAL 7. C ONSOLIDATED\n\nAND STRATEGY PERFORMANCE 3. SUSTAINABILITY 4. RISK GOVERNANCE INFORMATION STATEMENTS Operational highlights Total hydrocarbon production2 Total liquids production2 Total gas production2 (mmboed) (mmbpd) (bscfd)\n12.4 10.3 10.8\n\nNet refining capacity Net chemicals production capacity3 Reliability5 (mmbpd) (million tons per year) (%)\n\n4.1 57.6 99.7\n\nUpstream carbon intensity6 Flaring intensity6 Total recordable case rate6 (kg of CO e/boe) (scf/boe) (per 200,000 work hours)\n\n9.7 6.07 0.046\n\n2. Refer to Section 2: Results and performance – Upstream.\n3. Excludes SABIC Agri-Nutrients business for 2024 and SABIC Agri-Nutrients and Metals (Hadeed) businesses for 2023 and includes only ZPC’s net chemical production capacity through our investment in Rongsheng.\n4. The reduction in net chemicals production capacity is due to the termination of operations of three assets related to SABIC mainly in Europe.\n5. Applies to Saudi Arabian Oil Company (the Company).\n6. Refer to Section 3: Sustainability for further information.\n7. 2023 figure has been revised to reflect the market-based calculation methodology.\nRefer to Section 3: Sustainability for further information.\n\nCFO’s message “ In 2024 we maintained our exceptional financial strength, including world-leading profitability and cash flows. Our focus remains firmly on capturing growth opportunities and providing long-term value to shareholders with resilience through business cycles.”\nDear shareholders, Attracting additional investment\nIn 2024, we grew our business and continued our commitment to a During 2024, Aramco was involved in three separate capital markets\nsustainable and progressive dividend for our shareholders while transactions that attracted considerable investor interest and also maintaining', '.5 bscfd. places a strong emphasis on improving the offset the use of crude oil for power generation.\nconnects its key gas production and processing sites This program is expected to provide up to 2.0 bscfd operational performance of its drilling activities by Highlights and developments\n\nHaradh gas increment program, was successfully well integrity.\nThe Company sells natural gas to power generation commissioned and brought onstream, increasing the plants primarily pursuant to long-term contracts and plant’s raw gas processing capacity by 800 mmscfd to customers in the Kingdom’s industrial sector. The which includes approximately 750 mmscfd of natural\nsupply of natural gas to domestic customers is gas capacity.\nregulated by the Energy Supply Law (which\n• Commissioning activities for the gas compression projects at the Haradh and Hawiyah fields were completed, with nine plants commissioned and \uf071 Hawiyah Gas Storage brought fully onstream in 2023. \uf071 Autonomous seismic acquisition device Saudi Arabia Dhahran, Saudi Arabia\n• Aramco announced its first international investment in LNG by signing definitive agreements to acquire a strategic minority stake in MidOcean Energy for SAR\n1.88 billion ($0.5 billion). The agreements include the\noption for Aramco to increase its shareholding and associated rights in MidOcean Energy in the future.\nCompletion of the transaction is subject to closing conditions which include regulatory approvals.\n• Aramco successfully produced the first unconventional tight gas from its South Ghawar operational area two months ahead of schedule with a raw gas processing capacity of 300 mmscfd and 38 mbpd of condensate processing capacity.\nbscfd Planned additional processing capacity fro Tanajib Gas Plant, expe onstream by 2025. | m the cted\n\n5. ADDITIONAL FINANCIAL 6. CONSOLIDATED\n\nAND STRATEGY PERFORMANCE 3. SUSTAINABILITY 4. RISK GOVERNANCE INFORMATION STATEMENTS Downstream \uf070 Ras Tanura \uf070 Polypropylene viscosity experiment \uf070 Arabian Gulf Saudi Arabia S-OIL, South Korea Saudi Arabia Downstream competitive strengths Captive Reliable supplier Major integrated refiner Large global refining & World-class partners Globally Large downstream downstream system Strong track record of Major integrated refiner and base petrochemical portfolio World class partners that integrated trading capital projects Ability to monetize upstream supply reliability1. oils and lubricants producer with a Scale advantage with one provide access to additional Globally integrated trading Ability to execute some of the production into a high-quality global network of complex, of the largest refining and geographies, technological activities, which optimizes world’s largest downstream external customer base and reliable assets in key regional petrochemicals portfolios expertise, operational product supply to maximize capital projects.\nthrough a captive downstream markets and hubs. globally. know-how, and marketing returns.\nsystem. capabilities.\n7.9 4.1 6.8\nmmbpd mmbpd mmbpd of gross refining capacity as at of net refining capacity as at average crude oil and refined\nDecember 31, 2023 December 31, 2023 products traded\n47 99.8 4.4 59.6 4.7\n% % million tons million tons million tons of the Company’s crude oil of delivery obligations fulfilled of base oils sold per year of net chemicals of liquid chemical products traded production was utilized by within 24 hours of the scheduled production capacity2 as at Aramco’s downstream time in 2023 December 31, 2023\noperations in 2023 1. Applies to Saudi Arabian Oil Company 2. Excludes SABIC Agri-Nutrients (the Company). and Metals (Hadeed) businesses.\n\n5. ADDITIONAL FINANCIAL 6. CONSOLIDATED\n\nAND STRATEGY PERFORMANCE 3. SUSTAINABILITY 4. RISK GOVERNANCE INFORMATION STATEMENTS Downstream continued\nAramco has a large and growing, strategically four million barrels per day by 2030. In 2023, the crude Aramco’s Downstream business also includes its\nDownstream integrated global Downstream business that provides oil utilized by Aramco’s downstream operations crude oil marketing and product sales, distribution,\nopportunities to secure and de-risk liquids demand to accounted for 47% (2022: 44%) of the Company’s retail, and trading operations. These operations\ncapture incremental value from the hydrocarbon crude oil production. At December 31, 2023, Aramco’s support Aramco’s upstream and downstream\nsupply chain by selling to its dedicated system of net refining capacity was 4.1 mmbpd (2022: 4.1 operations by enabling it to optimize crude oil sales\ndomestic and international refineries and mmbpd), while the gross refining capacity at and product placement through its significant\noverview petrochemical plants. The Downstream segment’s December 31, 2023 was 7.9 m']",Saudi Aramco's target for sales gas production capacity by 2030 was approximately 80%.,Aramco plans to increase its sales gas production capacity by more than 60% by 2030 compared with 2021 levels. The plan also includes expanding unconventional gas resources and related infrastructure.,1.0,0.9887695316813904,0.8874999999778125,1.0
What was the recoverable amount approach used for the SABIC goodwill impairment test?,"['audit addressed the Key audit |\n\n| goodwill and brand recognised as part of the | | | | | | | | | | |\n\n| International Accounting Standard (“IAS”) 36 | | | | | | | | | | Our procedures included the following: | | ‘Impairment of Assets’, that is endorsed in the Kingdom | | | | | | | | | | ● We considered the appropriateness of | | of Saudi Arabia, requires goodwill and intangible assets | | | | | | | | | | |\n\n| that have indefinite useful lives to be tested annually for | | | | | | | | | | | | | | | | | | | | | | Downstream operating segment and brand to the |\n\n| | | | | | | | | | | aggregation of the relevant CGUs, based on the |\n\n| of the goodwill and brand (determined to have an | | | | | | | | | | | | | | | | | | | | | | values of the assets and liabilities considered as part | | indefinite useful life) recognised as part of the SABIC | | | | | | | | | | | | | | | | | | | | | | of the impairment tests for both goodwill and |\n| acquisition during the year ended December 31, 2020. | | | | | | | | | | |\n\n| The | | carrying amounts of these assets were SAR 99.1 | | | | | | | | | | billion and SAR 18.1 billion, respectively, as at | | | | | | | | | | ● With input from internal valuation experts, where |\n| December 31, 2023. | | | | | | | | | | considered necessary, we performed the following |\n\n| Goodwill has been allocated to the Downstream | | | | | | | | | | deemed appropriate: | | operating segment. Therefore, the goodwill impairment | | | | | | | | | | - Considered the consistency of certain | | test was performed at the Downstream operating | | | | | | | | | | unobservable inputs underlying the 10-year cash | | segment level. The brand test was performed based on | | | | | | | | | | flows such as expected product volumes and costs | | an aggregation of the relevant Cash-Generating Units | | | | | | | | | | with approved financial plans; |\n\n| | | | | | | | | | | and margins underlying the 10-year cash flows to | | The recoverable amounts were determined based on | | | | | | | | | | |\n\n| value-in-use derived using discounted cash flow models. | | | | | | | | | | | | Each of the models were based on the most recent | | | | | | | | | | - Evaluated the reasonableness of approved | | approved financial plans and included 10-year | | | | | | | | | | financial plans by comparison to historical | | projection periods with terminal values assumed | | | | | | | | | | results; | | thereafter. | | | | | | | | | | - Assessed the reasonableness of the approach and | | | | | | | | | | | | inputs used to determine the terminal values; | | The exercise performed by management supported the | | | | | | | | | | - Evaluated the reasonableness of the pre-tax | | goodwill and brand carrying values and did not identify | | | | | | | | | | discount rates used by cross-checking the | | the need for any impairment charges to be recognised. | | | | | | | | | | underlying assumptions against observable |\n\n| We considered this to be a key audit matter given the | | | | | | | | | | | | | | | | | | | | | | - Tested the mathematical accuracy and logical |\n\n| determining recoverable amounts and the uncertainty | | | | | | | | | | | | inherent in the underlying forecasts and assumptions. | | | | | | | | | | - Tested management’s sensitivity analyses that | | The key inputs to the recoverable amounts included the: | | | | | | | | | | considered the impact of changes in assumptions | | ● Cash flows during the 10-year projection periods | | | | | | | | | | on the outcome of the impairment assessments. | | | including commodity prices, margins and other | | | | | | | | | ● We considered the reasonableness of the | | | underlying assumptions; | | | | | | | | | movements in the recoverable amounts during the | | ● Terminal values; and | | | | | | | | | | year ended December 31, 2023 in view of the |\n| ● Pre-tax discount rates. | | | | | | | | | | changes in', 'of Assets’, that is endorsed in the | | Kingdom of Saudi Arabia, requires goodwill and | | intangible assets that have indefinite useful lives to | | be tested annually for impairment, irrespective of | | whether there is any indication of impairment. | | Management performed an assessment of | | recoverability of the goodwill and brand | | (determined to have an indefinite useful life) | | recognised as part of the SABIC acquisition. The | | carrying amounts of these assets were SAR 99.1 | |\nbillion and SAR 18.1 billion, respectively, at | |\nDecember 31, 2022. | |\n\nGoodwill has been allocated to the Downstream | | operating segment. Therefore, the goodwill | | impairment test was performed at the Downstream | | operating segment level. The brand test was | | performed based on an aggregation of the relevant | | cash-generating units. | |\n\nThe recoverable amounts were determined based on | | value-in-use calculations derived using discounted | | cash flow models. The models were based on the | | most recent financial plans and included 10-year | | projection periods with terminal values assumed | | thereafter. | | Rationale for the materiality benchmark applied Income before income taxes and zakat is an important benchmark for the Group’s stakeholders and is a generally accepted benchmark for profit- oriented groups.\nThe exercise performed by management supported the goodwill and brand carrying values and did not identify the need for any impairment charges to be recognised.\nWe considered this to be a key audit matter given the significant judgment and estimates involved in determining recoverable amounts and the uncertainty inherent in the underlying forecasts and assumptions. The key inputs and assumptions in determining the recoverable amounts included the:\n● Cash flows during the 10-year periods including | | | | | commodity prices and margins; | | | ● Terminal values; and | | | | ● Pre-tax discount rates. | | | |\n\nRefer to Note 2(f), Note 2(i) and Note 6 to the | | | | consolidated financial statements for further | | | | information. | | | |\n\nIndependent auditor’s report to the shareholders of Saudi Arabian Oil Company (continued)\nKey audit matter How our audit addressed the key audit matter Assessment of recoverability of the goodwill and brand recognised as part of the SABIC acquisition ‘Impairment of Assets’, that is endorsed in the ● We evaluated the appropriateness of management’s Kingdom of Saudi Arabia, requires goodwill and allocation of goodwill to the Downstream operating intangible assets that have indefinite useful lives to segment and brand to the aggregation of the be tested annually for impairment, irrespective of relevant cash-generating units, based on the whether there is any indication of impairment.\nrequirements of IAS 36 ‘Impairment of Assets’, that is endorsed in the Kingdom of Saudi Arabia.\nManagement performed an assessment of recoverability of the goodwill and brand ● We assessed the completeness of the carrying values (determined to have an indefinite useful life) of the assets and liabilities considered as part of the recognised as part of the SABIC acquisition. The impairment tests for the goodwill and brand in light\ncarrying amounts of these assets were SAR 99.1 of the requirements of IAS 36 ‘Impairment of\nbillion and SAR 18.1 billion, respectively, at Assets’, that is endorsed in the Kingdom of Saudi\nDecember 31, 2022. Arabia.\n● With input from internal valuation experts, where Goodwill has been allocated to the Downstream considered necessary, we performed the following operating segment. Therefore, the goodwill procedures on management’s value-in-use impairment test was performed at the Downstream calculations, as deemed appropriate:\noperating segment level. The brand test was performed based on an aggregation of the relevant - Considered the consistency of certain cash-generating units. unobservable inputs underlying the 10-year cash flows such as expected product volumes and The recoverable amounts were determined based on future costs with approved financial plans;\nvalue-in-use calculations derived using discounted - Compared a sample of forecast commodity prices cash flow models. The models were based on the and margins underlying the 10-year cash flows to most recent financial plans and included 10-year market data points;\nprojection periods with terminal values assumed - Evaluated the reasonableness of approved financial plans by comparison to historical results;\nthereafter.\n- Assessed the reasonableness of the approach and The exercise performed by management supported inputs used to determine the terminal values by the goodwill and brand carrying values and did not benchmarking to observable market practice and identify the need for any impairment charges to be information;\nrecognised. - Evaluated the reasonableness of the pre-tax discount rates used by cross-checking the We considered this to be a key audit matter given the underlying assumptions against observable significant judgment and estimates involved in market data;\ndetermining recoverable amounts and the\n- Tested the mathematical accuracy and logical uncertainty inherent in the underlying forecasts and integrity of the models; and assumptions. The key inputs and assumptions in - Tested management’s sensitivity', 'ateness of the related | | | | | accounting policies and disclosures in the | | | | | consolidated financial statements. |\n\nAssessment of recoverability of the goodwill | | and brand recognised as part of the SABIC | | acquisition | |\n\nInternational Accounting Standard (“IAS”) 36 | | ‘Impairment of Assets’, that is endorsed in the | | Kingdom of Saudi Arabia, requires goodwill and | | intangible assets that have indefinite useful lives to | | be tested annually for impairment, irrespective of | | whether there is any indication of impairment. | | Management performed an assessment of | | recoverability of the goodwill and brand | | (determined to have an indefinite useful life) | | recognised as part of the SABIC acquisition. The | | carrying amounts of these assets were SAR 99.1 | |\nbillion and SAR 18.1 billion, respectively, at | |\nDecember 31, 2022. | |\n\nGoodwill has been allocated to the Downstream | | operating segment. Therefore, the goodwill | | impairment test was performed at the Downstream | | operating segment level. The brand test was | | performed based on an aggregation of the relevant | | cash-generating units. | |\n\nThe recoverable amounts were determined based on | | value-in-use calculations derived using discounted | | cash flow models. The models were based on the | | most recent financial plans and included 10-year | | projection periods with terminal values assumed | | thereafter. | | Rationale for the materiality benchmark applied Income before income taxes and zakat is an important benchmark for the Group’s stakeholders and is a generally accepted benchmark for profit- oriented groups.\nThe exercise performed by management supported the goodwill and brand carrying values and did not identify the need for any impairment charges to be recognised.\nWe considered this to be a key audit matter given the significant judgment and estimates involved in determining recoverable amounts and the uncertainty inherent in the underlying forecasts and assumptions. The key inputs and assumptions in determining the recoverable amounts included the:\n● Cash flows during the 10-year periods including | | | | | commodity prices and margins; | | | ● Terminal values; and | | | | ● Pre-tax discount rates. | | | |\n\nRefer to Note 2(f), Note 2(i) and Note 6 to the | | | | consolidated financial statements for further | | | | information. | | | |\n\nIndependent auditor’s report to the shareholders of Saudi Arabian Oil Company (continued)\nKey audit matter How our audit addressed the key audit matter Assessment of recoverability of the goodwill and brand recognised as part of the SABIC acquisition ‘Impairment of Assets’, that is endorsed in the ● We evaluated the appropriateness of management’s Kingdom of Saudi Arabia, requires goodwill and allocation of goodwill to the Downstream operating intangible assets that have indefinite useful lives to segment and brand to the aggregation of the be tested annually for impairment, irrespective of relevant cash-generating units, based on the whether there is any indication of impairment.\nrequirements of IAS 36 ‘Impairment of Assets’, that is endorsed in the Kingdom of Saudi Arabia.\nManagement performed an assessment of recoverability of the goodwill and brand ● We assessed the completeness of the carrying values (determined to have an indefinite useful life) of the assets and liabilities considered as part of the recognised as part of the SABIC acquisition. The impairment tests for the goodwill and brand in light\ncarrying amounts of these assets were SAR 99.1 of the requirements of IAS 36 ‘Impairment of\nbillion and SAR 18.1 billion, respectively, at Assets’, that is endorsed in the Kingdom of Saudi\nDecember 31, 2022. Arabia.\n● With input from internal valuation experts, where Goodwill has been allocated to the Downstream considered necessary, we performed the following operating segment. Therefore, the goodwill procedures on management’s value-in-use impairment test was performed at the Downstream calculations, as deemed appropriate:\noperating segment level. The brand test was performed based on an aggregation of the relevant - Considered the consistency of certain cash-generating units. unobservable inputs underlying the 10-year cash flows such as expected product volumes and The recoverable amounts were determined based on future costs with approved financial plans;\nvalue-in-use calculations derived using discounted - Compared a sample of forecast commodity prices cash flow models. The models were based on the and margins underlying the 10-year cash flows to most recent financial plans and included 10-year market data points;\nprojection periods with terminal values assumed - Evaluated the reasonableness of approved financial plans by comparison to historical results;\nthereafter.\n- Assessed the reasonableness of the approach and The exercise performed by management supported inputs used to determine the terminal values by the goodwill and brand carrying values and did not benchmarking to observable market practice and identify the need for any impairment charges to be information;\nrecognised. - Evaluated the reasonableness of the pre-tax discount rates used by cross-checking the We', 'from internal valuation experts, where\n2020. The carrying amounts of these assets were SAR 99.1\nconsidered necessary, we performed the following billion and SAR 18.1 billion, respectively, as at December procedures on management’s valuation models, as\n31, 2024.\ndeemed appropriate:\n- Considered the consistency of the projection Goodwill has been allocated to the Downstream operating periods with management’s financial planning segment. Therefore, the goodwill impairment test was cycle;\nperformed at the Downstream operating segment level. The brand test was performed based on an aggregation of the - Considered the consistency of certain relevant Cash-Generating Units (“CGUs”). unobservable inputs underlying the 10-year cash flows such as expected product volumes and costs The recoverable amounts were determined based on value- with approved financial plans;\nin-use derived using discounted cash flow models. Each of - Compared a sample of commodity prices (input the models were based on the most recent approved and output) underlying the 10-year cash flows to financial plans and included 10-year projection periods market data points;\nwith terminal values assumed thereafter. - Evaluated the reasonableness of approved financial plans by comparison to historical results;\nThe exercise performed by management supported the - Assessed the reasonableness of the approach and goodwill and brand carrying values and did not identify the inputs used to determine the terminal values;\nneed for any impairment charges to be recognised. - Evaluated the reasonableness of the pre-tax discount rates used by cross-checking the We considered this to be a key audit matter given the underlying assumptions against observable significant judgment and estimates involved in market data;\ndetermining recoverable amounts and the uncertainty - Tested the mathematical accuracy and logical inherent in the underlying forecasts and assumptions. The integrity of the models; and key inputs to the recoverable amounts included the: - Tested management’s sensitivity analyses that ● Cash flows during the 10-year projection periods considered the impact of changes in assumptions including commodity prices (input and output) and on the outcome of the impairment assessments.\nother underlying assumptions;\n● We considered the reasonableness of the year-on-year ● Terminal growth rates; and movements in the recoverable amounts as at ● Pre-tax discount rates.\nDecember 31, 2024 in view of the changes in the underlying key assumptions.\nRefer to Note 2(e), Note 2(h) and Note 6 to the consolidated financial statements for further information. ● We considered the appropriateness of the related accounting policies and disclosures in the consolidated financial statements.\nAssessment of the recoverability of the goodwill and brand (intangible assets) recognised as part of the SABIC acquisition International Accounting Standard (“IAS”) 36 ‘Impairment of Assets’, that is endorsed in the Kingdom of Saudi Arabia, requires goodwill and intangible assets that have indefinite useful lives to be tested annually for impairment, irrespective of whether there is any indication of impairment.\nManagement performed an assessment of the recoverability of the goodwill and brand (determined to have an indefinite useful life) recognised as part of the SABIC acquisition during the year ended December 31,\n2020. The carrying amounts of these assets were SAR 99.1\nbillion and SAR 18.1 billion, respectively, as at December\n31, 2024.\nGoodwill has been allocated to the Downstream operating segment. Therefore, the goodwill impairment test was performed at the Downstream operating segment level. The brand test was performed based on an aggregation of the relevant Cash-Generating Units (“CGUs”).\nThe recoverable amounts were determined based on value- in-use derived using discounted cash flow models. Each of the models were based on the most recent approved financial plans and included 10-year projection periods with terminal values assumed thereafter.\nThe exercise performed by management supported the goodwill and brand carrying values and did not identify the need for any impairment charges to be recognised.\nWe considered this to be a key audit matter given the significant judgment and estimates involved in determining recoverable amounts and the uncertainty inherent in the underlying forecasts and assumptions. The key inputs to the recoverable amounts included the:\n● Cash flows during the 10-year projection periods including commodity prices (input and output) and other underlying assumptions;\n● Terminal growth rates; and ● Pre-tax discount rates.\nRefer to Note 2(e), Note 2(h) and Note 6 to the consolidated financial statements for further information. | | |\n\n| | Our procedures included the following: | | | ● We considered the appropriateness of management’s | | | allocation of goodwill to the Downstream operating | | | segment and brand to the aggregation of the relevant | | | CGUs, based on the requirements of IAS 36 | | | ‘Impairment of Assets’, that is endorsed in the | | | Kingdom of Saudi Arabia. | | | ● We considered the completeness of the carrying values | | | of the assets and liabilities considered as part of the | | | impairment tests for both goodwill and brand. | | | ● With input from internal valuation experts,', 'the | that have indefinite useful lives to be tested annually for | | | | | | | | | | | Downstream operating segment and brand to the | impairment, irrespective of whether there is any | | | | | | | | | | | aggregation of the relevant CGUs, based on the | indication of impairment. | | | | | | | | | | | requirements of IAS 36 ‘Impairment of Assets’, that |\n\nof the goodwill and brand (determined to have an | | | | | | | | | | | ● We considered the completeness of the carrying | indefinite useful life) recognised as part of the SABIC | | | | | | | | | | | values of the assets and liabilities considered as part |\nacquisition during the year ended December 31, 2020. | | | | | | | | | | | of the impairment tests for both goodwill and |\nThe | | carrying amounts of these assets were SAR 99.1 | | | | | | | | | brand. | billion and SAR 18.1 billion, respectively, as at | | | | | | | | | | | ● With input from internal valuation experts, where |\nDecember 31, 2023. | | | | | | | | | | | considered necessary, we performed the following |\n\nGoodwill has been allocated to the Downstream | | | | | | | | | | | deemed appropriate: | operating segment. Therefore, the goodwill impairment | | | | | | | | | | | - Considered the consistency of certain | test was performed at the Downstream operating | | | | | | | | | | | unobservable inputs underlying the 10-year cash | segment level. The brand test was performed based on | | | | | | | | | | | flows such as expected product volumes and costs | an aggregation of the relevant Cash-Generating Units | | | | | | | | | | | with approved financial plans; |\n\n| | | | | | | | | | | and margins underlying the 10-year cash flows to | The recoverable amounts were determined based on | | | | | | | | | | | |\n\nvalue-in-use derived using discounted cash flow models. | | | | | | | | | | | | Each of the models were based on the most recent | | | | | | | | | | | - Evaluated the reasonableness of approved | approved financial plans and included 10-year | | | | | | | | | | | financial plans by comparison to historical | projection periods with terminal values assumed | | | | | | | | | | | results; | thereafter. | | | | | | | | | | | - Assessed the reasonableness of the approach and | | | | | | | | | | | | inputs used to determine the terminal values; | The exercise performed by management supported the | | | | | | | | | | | - Evaluated the reasonableness of the pre-tax | goodwill and brand carrying values and did not identify | | | | | | | | | | | discount rates used by cross-checking the | the need for any impairment charges to be recognised. | | | | | | | | | | | underlying assumptions against observable |\n\nWe considered this to be a key audit matter given the | | | | | | | | | | | | | | | | | | | | | | | - Tested the mathematical accuracy and logical |\n\ndetermining recoverable amounts and the uncertainty | | | | | | | | | | | | inherent in the underlying forecasts and assumptions. | | | | | | | | | | | - Tested management’s sensitivity analyses that | The key inputs to the recoverable amounts included the: | | | | | | | | | | | considered the impact of changes in assumptions | ● Cash flows during the 10-year projection periods | | | | | | | | | | | on the outcome of the impairment assessments. | | including commodity prices, margins and other | | | | | | | | | | ● We considered the reasonableness of the | | underlying assumptions; | | | | | | | | | | movements in the recoverable amounts during the | ● Terminal values; and | | | | | | | | | | | year ended December 31, 2023 in view of the |\n● Pre-tax discount rates. | | | | | | | | | | | changes in the underlying key assumptions. | Refer to Note 2(e), Note 2(h) and Note 6 to the | | | | | | | | | | | |\n\nconsolidated financial statements for further | | | | | | | | | | | accounting policies and disclosures in the |\n\nRationale for the | | Income before income taxes and zakat is an important benchmark for the materiality benchmark | | users of the consolidated financial']",The recoverable amounts for the SABIC goodwill impairment test were determined based on value-in-use calculations derived using discounted cash flow models. These models were based on the most recent approved financial plans and included 10-year projection periods with terminal values assumed thereafter.,"The recoverable amount was determined using value-in-use calculations based on discounted cash flow models. The models used 10-year financial plans and terminal values, and no impairment was identified.",1.0,0.9384174837556013,0.99999999998,1.0
How many proved reserves did Aramco estimate for the Kingdom's fields it operates at the end of 2023?,"['billion barrels) of\nBalance NGL and 252.6 tscf (2022: 246.7 tscf) of natural gas, including 164.8 tscf (2022: 156.9 tscf) of nonassociated gas.\nas at\nOriginal Repaid during December 31, Under the Original Concession, which was in effect until December 24, 2017, Aramco’s rights with respect to hydrocarbons in the\nAll amounts in millions SAR unless otherwise stated Total facility1 Loan duration the year 2023 Maturity date Kingdom were not limited to a particular term. Accordingly, until such date, the Kingdom’s reserves in the fields Aramco operated were\nBank borrowings 28,242 1 to 24 years (5,345) 26,483 2024-2045 the same as Aramco’s reserves. Effective December 24, 2017, the Concession limited Aramco’s exclusive right to explore, develop and\nSukuk (Shari’a compliant) 33,689 3 to 14 years (911) 33,689 2024-2031 produce the Kingdom’s hydrocarbon resources, except in the Excluded Areas, to an initial period of 40 years, which will be extended by\nExport credit agencies 1,597 15 to 17 years (641) 1,597 2025-2033 the Government for 20 years provided Aramco satisfies certain conditions commensurate with current operating practices. In addition,\nthe Concession may be extended for an additional 40 years beyond the prior 60-year period subject to Aramco and the Government\nPublic Investment Fund 820 15 years (365) 820 2025\nagreeing on the terms of the extension (see Section 6: Additional financial and legal information – The Concession). The provision of a\nSaudi Industrial Development Fund (Shari’a compliant) 3,338 7 to 17 years (357) 3,338 2025-2035 specified term in the Concession impacts the calculation of Aramco’s reserves as compared to the Kingdom’s reserves in the fields\nIjarah / Procurement (Shari’a compliant) 3,677 7 to 23 years – 3,512 2026-2039 Aramco operates. The Concession also requires Aramco to meet domestic demand for certain hydrocarbons, petroleum products, and\nMurabaha (Shari’a compliant) 26,238 5 to 24 years (2,445) 15,919 2028-2032 LPGs through domestic production or imports.\nWakala (Shari’a compliant) and other Islamic financing 919 7 to 16 years (26) 798 2028-2036 Based on the initial 40-year period and 20-year extension of the Concession, as at December 31, 2023, Aramco’s reserves were\nRevolving Credit Facilities 45,317 1 to 5 years – 1,237 2024-2027 251.2 billion boe (2022: 258.8 billion boe). Aramco’s oil equivalent reserves consisted of 191.3 billion barrels (2022: 200.8 billion barrels)\nShort-term borrowings 33,245 Under 1 year – 18,378 2024 of crude oil and condensate, 26.0 billion barrels (2022: 25.2 billion barrels) of NGL and 207.5 tscf (2022: 201.9 tscf) of natural gas. As at\nDebentures 90,775 10 to 50 years (7,425) 90,775 2024-2070 December 31, 2023, Aramco’s portfolio included 541 (2022: 535) reservoirs within 144 (2022: 142) fields distributed throughout the\nKingdom and its territorial waters.\nDeferred consideration2 – 8 years (116,980) – Not applicable\nLease Liabilities – – (13,639) 57,331 Not defined Aramco manages the Kingdom’s unique reserves and resources base to optimize production and maximize long-term value pursuant\nto the Hydrocarbons Law, which mandates that Aramco’s hydrocarbon operations promote long-term productivity of the Kingdom’s\nOther financing arrangements 36,270 11 to 25 years – 36,270 2028 - 2046\nreservoirs and support the prudent stewardship of its hydrocarbon resources. Aramco has historically replaced reserves on an organic\n304,127 (148,134) 290,147 basis through revisions of reserve estimates at existing fields and through delineation and exploration to identify new fields. As a result,\nthe Kingdom’s estimated proved', 'optimize production and maximize long-term value pursuant\nto the Hydrocarbons Law, which mandates that Aramco’s hydrocarbon operations promote long-term productivity of the Kingdom’s\nOther financing arrangements 36,270 11 to 25 years – 36,270 2028 - 2046\nreservoirs and support the prudent stewardship of its hydrocarbon resources. Aramco has historically replaced reserves on an organic\n304,127 (148,134) 290,147 basis through revisions of reserve estimates at existing fields and through delineation and exploration to identify new fields. As a result,\nthe Kingdom’s estimated proved reserves at the largest oil fields operated by Aramco have increased since the time of original 1. Includes total facility amounts and carrying amounts for certain long-term loans being repaid in installments. production.\n2. In 2023, the Company made payments in the amount of SAR 59.0 billion ($15.7 billion), SAR 41.3 billion ($11.0 billion), and SAR 16.7 billion ($4.5 billion), resulting in the full settlement of\nthe deferred consideration. The following table sets forth Aramco’s estimates of its proved reserves based on the term of the Concession as at December 31, 2023 and 2022.\nCrude Oil and Condensate Natural Gas NGL Combined (mmbbl) (bscf) (mmboe) (mmbbl) (mmboe)\nReserves as at December 31, 2023 191,349 207,450 33,822 26,024 251,195\nReserves as at December 31, 2022 200,803 201,905 32,826 25,153 258,782\nThe following table sets forth the Kingdom’s estimates of its proved reserves in the fields Aramco operates as at December 31, 2023 and 2022.\nCrude Oil and Condensate Natural Gas NGL Combined (mmbbl) (bscf) (mmboe) (mmbbl) (mmboe)\nReserves as at December 31, 2023 261,677 252,567 41,696 37,395 340,768\nReserves as at December 31, 2022 261,623 246,738 40,665 36,146 338,434\nAramco’s reserve estimates conform to the SPE-PRMS definitions and guidelines, which are the internationally recognized industry standard sponsored by the Society of Petroleum Engineers, the American Association of Petroleum Geologists, the World Petroleum Council, the Society of Petroleum Evaluation Engineers, the Society of Exploration Geophysicists, the Society of Petrophysicists and Well Log Analysts, and the European Association of Geoscientists and Engineers. To estimate or update Aramco’s reserve estimates, the Upstream segment employees responsible for reserves calculations perform technical analyses that are reviewed internally by progressively higher levels of management until finalized at year end. Aramco annually updates its estimates as it acquires and interprets new data. For reservoirs that have been producing and have established certain performance trends, Aramco is typically able to reliably forecast the reservoir’s future production. For reservoirs that have little to no production history and new discoveries, Aramco undertakes further analysis in addition to multidisciplinary evaluation to formulate production forecasts.\n6.ADDITIONAL FINANCIAL 7.CONSOLIDATED\n\nAND STRATEGY PERFORMANCE 3. SUSTAINABILITY 4. RISK GOVERNANCE INFORMATION STATEMENTS Additional legal information Aramco • Certain rights related to lands, such as use of land, easements, water rights, right-of-way, and other suitable rights of any part of the Concession Areas, that are outside the Reserved Area, designated in connection with Aramco’s operations and transportation of The Company was established in the Kingdom as a company with limited liability by virtue of Royal Decree No. M/8 dated 4/4/1409H products and free access to and use of any part of the Reserved Area;\n(corresponding to November 13, 1988) to assume the privileges and rights of the Arabian American Oil Company. On January 1, 2018,\nthe Company was converted into a Saudi joint stock company pursuant to Council of Ministers Resolution No. 180 dated 1/4/1439H • The right to purchase, lease, import or otherwise obtain all materials, equipment, and any other supplies necessary for\n(corresponding to December 19, 2017) and registered in the city of Dhahran under commercial registration No. 2052101150 dated Aramco’s operations;\n11/07/1439H (corresponding to March 28, 2018) with Saudi Arabian Oil Company as its official name. Its registered head office is located\nat P.O. Box 5000, Dhah', ""(Shari'a compliant) and other Islamic financing 2,460 7 to 16 years – 1,255 2028-2038\nRevolving Credit Facilities 36,880 1 to 5 years (534) 703 2025-2029\nShort-term borrowings 37,487 Under 1 year (5,787) 21,242 2025\nDebentures 106,283 10 to 50 years (9,552) 106,283 2025-2070\nLease liabilities – – (15,344) 62,483 Not defined\nOther financing arrangements 35,982 11 to 25 years – 35,982 2028 - 2046\n347,524 (46,826) 319,290\n1. Includes total facility amounts and carrying amounts for certain long-term loans being repaid in installments.\n5 . O RGANIZATIONAL 6. ADDITIONAL STRUCTURE AND FINANCIAL 7. C ONSOLIDATED\n\nAND STRATEGY PERFORMANCE 3. SUSTAINABILITY 4. RISK GOVERNANCE INFORMATION STATEMENTS Reserves information All amounts in millions unless otherwise stated Reserves as at December 31, 2024\nAs at December 31, 2024, the Kingdom’s reserves in the fields Aramco operates consisted of 341.3 billion boe (2023: 340.8 billion boe),\nincluding 261.7 billion barrels (2023: 261.7 billion barrels) of crude oil and condensate, 37.5 billion barrels (2023: 37.4 billion barrels)\nof NGL and 255.1 tscf (2023: 252.6 tscf) of natural gas, including 167.8 tscf (2023: 164.8 tscf) of nonassociated gas.\nUnder the Original Concession, which was in effect until December 24, 2017, Aramco’s rights with respect to hydrocarbons in the Kingdom\nwere not limited to a particular term. Accordingly, until such date, the Kingdom’s reserves in the fields Aramco operated were the same as\nAramco’s reserves. Effective December 24, 2017, the Concession limited Aramco’s exclusive right to explore, develop and produce the\nKingdom’s hydrocarbon resources, except in the Excluded Areas, to an initial period of 40 years, which will be extended by the Government for 20 years provided Aramco satisfies certain conditions commensurate with current operating practices. In addition, the\nConcession may be extended for an additional 40 years beyond the prior 60-year period subject to Aramco and the Government agreeing\non the terms of the extension (see Section 6: Additional financial and legal information – The Concession). The provision of a specified term in the Concession impacts the calculation of Aramco’s reserves as compared to the Kingdom’s reserves in the fields Aramco operates. The Concession also requires Aramco to meet domestic demand for certain hydrocarbons, petroleum products, and LPGs through domestic production or imports.\nBased on the initial 40-year period and 20-year extension of the Concession, as at December 31, 2024, Aramco’s reserves were 250.0 billion\nboe (2023: 251.2 billion boe). Aramco’s oil equivalent reserves consisted of 189.8 billion barrels (2023: 191.3 billion barrels) of crude oil and\ncondensate, 26.1 billion barrels (2023: 26.0 billion barrels) of NGL and 209.8 tscf (2023: 207.5 tscf) of natural gas. As at December 31, 2024,\nAramco’s portfolio included 548 (2023: 541) reservoirs within 148 (2023: 144) fields distributed throughout the Kingdom and its territorial\nwaters.\nAramco manages the Kingdom’s unique reserves and resources base to optimize production and maximize long-term value pursuant to the Hydrocarbons Law, which mandates that Aramco’s hydrocarbon operations promote long-term productivity of the Kingdom’s reservoirs and support the prudent stewardship of its hydrocarbon resources. Aramco has historically replaced reserves on an organic basis through revisions of reserve estimates at existing fields and through delineation and exploration to identify new fields. As a result, the Kingdom’s estimated proved reserves at the largest oil fields operated by Aramco have increased since the time of original production.\nThe following table sets forth Aramco’s estimates of its proved reserves based on the term of the Concession as at December 31, 2024 and 2023.\nCrude Oil and Condensate Natural Gas NGL Combined (mmbbl) (bscf) (mm"", 'Kingdom’s reserves in the fields Aramco operated were the same as\nAramco’s reserves. Effective December 24, 2017, the Concession limited Aramco’s exclusive right to explore, develop, and produce the\nKingdom’s hydrocarbon resources, except in the Excluded Areas, to an initial period of 40 years, which will be extended by the Government for 20 years provided Aramco satisfies certain conditions commensurate with current operating practices. In addition, the Concession may be\nextended for an additional 40 years beyond the prior 60-year period subject to Aramco and the Government agreeing on the terms of the\nextension (see Section 6: Additional financial and legal information – The Concession). The provision of a specified term in the Concession impacts the calculation of Aramco’s reserves as compared to the Kingdom’s reserves in the fields Aramco operates. The Concession also requires Aramco to meet domestic demand for certain hydrocarbons, petroleum products, and LPGs through domestic production or imports.\nBased on the initial 40-year period and 20-year extension of the Concession, as at December 31, 2025, Aramco’s reserves were 247.2 billion\nboe (2024: 250.0 billion boe). Aramco’s oil equivalent reserves consisted of 186.5 billion barrels (2024: 189.8 billion barrels) of crude oil and\ncondensate, 26.2 billion barrels (2024: 26.1 billion barrels) of NGL and 211.7 tscf (2024: 209.8 tscf) of natural gas.\nAramco manages the Kingdom’s unique reserves and resources base to optimize production and maximize long-term value pursuant to the Hydrocarbons Law, which mandates that Aramco’s hydrocarbon operations promote long-term productivity of the Kingdom’s reservoirs and support the prudent stewardship of its hydrocarbon resources. Aramco has historically replaced reserves on an organic basis through revisions of reserve estimates at existing fields and through delineation and exploration to identify new fields. As a result, the Kingdom’s estimated proved reserves at the largest oil fields operated by Aramco have increased since the time of original production.\nThe following table sets forth Aramco’s estimates of its proved reserves based on the term of the Concession as at December 31, 2025 and 2024.\nCrude Oil and Condensate Natural Gas NGL Combined (mmbbl) (bscf) (mmboe) (mmbbl) (mmboe)\nReserves as at December 31, 2025 186,542 211,659 34,508 26,186 247,236\nReserves as at December 31, 2024 189,782 209,769 34,189 26,058 250,029\nThe following table sets forth the Kingdom’s estimates of its proved reserves in the fields Aramco operates as at December 31, 2025 and 2024.\nCrude Oil and Condensate Natural Gas NGL Combined (mmbbl) (bscf) (mmboe) (mmbbl) (mmboe)\nReserves as at December 31, 2025 261,743 256,940 42,429 37,873 342,045\nReserves as at December 31, 2024 261,682 255,117 42,101 37,496 341,279\nAramco’s reserve estimates conform to the SPE-PRMS definitions and guidelines, which are the internationally recognized industry standard sponsored by the Society of Petroleum Engineers, the American Association of Petroleum Geologists, the World Petroleum Council, the Society of Petroleum Evaluation Engineers, the Society of Exploration Geophysicists, the Society of Petrophysicists and Well Log Analysts, and the European Association of Geoscientists and Engineers. To estimate or update Aramco’s reserve estimates, the Upstream segment employees responsible for reserves calculations perform technical analyses that are reviewed internally by progressively higher levels of management until finalized at year-end. Aramco annually updates its estimates as it acquires and interprets new data. For reservoirs that have been producing and have established certain performance trends, Aramco is typically able to reliably forecast the reservoir’s future production. For reservoirs that have little to no production history and new discoveries, Aramco undertakes further analysis in addition to multidisciplinary evaluation to formulate production forecasts.\nAdditional legal information All amounts in millions SAR unless otherwise stated Aramco The Company was established in the Kingdom as a company with limited liability by virtue of Royal Decree No. M/8 dated 4/4/1409H\n(corresponding to November 13, 1988) to assume the privileges and rights of the Arabian American Oil Company. On January 1, 201', 'cession). The provision of a specified term in the Concession impacts the calculation of Aramco’s reserves as compared to the Kingdom’s reserves in the fields Aramco operates. The Concession also requires Aramco to meet domestic demand for certain hydrocarbons, petroleum products and LPGs through domestic production or imports.\nBased on the initial 40-year period and 20-year extension of the Concession, as at December 31, 2021, Aramco’s reserves were\n253.6 billion boe (2020: 255.2 billion boe). Aramco’s oil equivalent reserves consisted of 196.9 billion barrels (2020: 198.8 billion\nbarrels) of crude oil and condensate, 25.2 billion barrels (2020: 25.2 billion barrels) of NGL and 194.5 tscf (2020: 191.6 tscf) of\nnatural gas. As at December 31, 2021, Aramco’s portfolio included 530 (2020: 517) reservoirs within 142 (2020: 137) fields\ndistributed throughout the Kingdom and its territorial waters. Based on Aramco’s reserves data, as at December 31, 2021,\nAramco’s oil equivalent reserves were sufficient for proved reserves life of 56 years.\nAramco manages the Kingdom’s unique reserves and resources base to optimize production and maximize long-term value pursuant to the Hydrocarbons Law, which mandates that Aramco’s hydrocarbon operations promote long-term productivity of the Kingdom’s reservoirs and support the prudent stewardship of its hydrocarbon resources. Aramco has historically replaced reserves on an organic basis through revisions of reserve estimates at existing fields and through delineation and exploration to identify new fields. As a result, the Kingdom’s estimated proved reserves at the largest oil fields operated by Aramco have increased since the time of original production.\nThe following table sets forth Aramco’s estimates of its proved reserves based on the term of the Concession as at December 31, 2021 and 2020.\nNatural gas Crude oil Condensate NGL Combined (mmbbl) (mmbbl) (bscf) (mmboe) (mmbbl) (mmboe)\nReserves as at December 31, 2021 193,195 3,676 194,453 31,549 25,188 253,608\nReserves as at December 31, 2020 195,444 3,399 191,573 31,086 25,226 255,155\nThe following table sets forth the Kingdom’s estimates of its proved reserves in the fields Aramco operates as at December 31, 2021 and 2020.\nNatural gas Crude oil Condensate NGL Combined (mmbbl) (mmbbl) (bscf) (mmboe) (mmbbl) (mmboe)\nReserves as at December 31, 2021 256,826 4,766 241,529 39,783 35,956 337,331\nReserves as at December 31, 2020 257,063 4,493 238,838 39,345 35,971 336,872\nAramco’s reserve estimates conform to the SPE-PRMS definitions and guidelines, which is the internationally recognized industry standard sponsored by the Society of Petroleum Engineers, the American Association of Petroleum Geologists, the World Petroleum Council, the Society of Petroleum Evaluation Engineers, the Society of Exploration Geophysicists, the Society of Petrophysicists and Well Log Analysts and the European Association of Geoscientists and Engineers. To estimate or update Aramco’s reserve estimates, the Upstream segment employees responsible for reserves calculations perform technical analyses that are reviewed internally by progressively higher levels of management until finalized at year-end. Aramco annually updates its estimates as it acquires and interprets new data. For reservoirs that have been producing and have established certain performance trends, Aramco is typically able to reliably forecast the reservoir’s future production. For reservoirs that have little to no production history and new discoveries, Aramco undertakes further analysis in addition to multidisciplinary evaluation to formulate production forecasts.\nRegulation of the oil and gas industry in the Kingdom The following paragraphs summarize certain key regulation and legislation to which Aramco is subject as an operator in the oil and gas industry.\nLaw on hydrocarbons Overview\nThe Hydrocarbons Law was enacted by Royal Decree No. M/37, dated 2/4/1439H (corresponding to December 20, 2017) and applies\nto hydrocarbons, hydrocarbon resources and the hydrocarbon operations existing within the territory of the Kingdom.\nLicenses No hydrocarbon operations can be conducted in the Kingdom without obtaining a license']","At the end of 2023, Aramco estimated the proved reserves for the Kingdom's fields it operates to be 340.8 billion boe.","At December 31, 2023, the Kingdom's estimated proved reserves in the fields Aramco operates were 261,677 million barrels of crude oil and condensate, 252,567 billion cubic feet of natural gas, and 340,768 million barrels of oil equivalent combined. These estimates are based on SPE-PRMS definitions.",1.0,0.953281789333988,0.9999999999666667,1.0
What happened to the deferred consideration for the SABIC acquisition in 2023?,"['corresponding to September 17, 2019), which extends the period for which the\nCompany will not be obligated to pay royalties on condensate production after the current five-year period for an additional\n10-year period, which may be further extended for subsequent 10-year periods, unless the Government determines the\neconomics impacting gas field development do not warrant such an extension.\nThe Government has the option to take all or part of the royalty in-kind from the produced hydrocarbons.\nAcquisition of 70% equity interest in SABIC\nOn June 16, 2020, Aramco acquired the PIF’s 70% equity interest in SABIC for total consideration of $69.1 billion. SABIC\noperates in over 50 countries and produces a range of chemicals. Aramco believes that purchasing this majority interest in SABIC advances its strategy to increase the proportion of petrochemicals production in its downstream portfolio and supports Aramco’s downstream growth ambitions. In addition, Aramco believes that the acquisition facilitates the application of SABIC’s expertise in the chemicals industry to Aramco’s existing and future integrated downstream facilities.\nThe March 27, 2019, purchase agreement provided that the purchase price for the acquisition would be paid on the closing date\nin the form of a cash payment equal to 50% of the purchase price (to be adjusted for certain expenses) and a seller loan in an\namount equal to 50% of the purchase price with the last payment due on or before December 31, 2021. On October 6, 2019,\nAramco and the PIF agreed to amend the payment terms to provide that, on the closing date, 36% of the purchase price (to be adjusted for certain expenses) would be paid in cash and 64% would be paid in the form of a seller loan with the last payment\ndue on or before September 30, 2025.\nOn June 16, 2020, Aramco and the PIF agreed to further amend the payment terms to provide that the entire purchase price\nwould be paid over several installments pursuant to a seller loan provided by the PIF (deferred consideration).\nOn January 24, 2022, the Company, in agreement with PIF, made a partial prepayment of $7.6 billion, which reduced the\nprincipal amounts of two promissory notes payable on or before April 7, 2024 and April 7, 2026, by $7.0 billion and $1.0 billion,\nrespectively. In addition, on June 30, 2022, the Company made a second partial prepayment of $10.2 billion, which reduced the\nprincipal amount of a promissory note payable on or before April 7, 2025 by $2.5 billion and further reduced the principal amount of the promissory note payable on or before April 7, 2026 by $9.5 billion.\nAfter taking these payments into account, as at December 31, 2022, future loan payments, which are represented by promissory\nnotes, are payable between April 7, 2023 and April 7, 2028 (the last payment), as follows:\n1. On or before April 7, 2023, an amount equal to $10.5 billion plus a loan charge of $500 million;\n2. On or before April 7, 2024, an amount equal to $3.5 billion plus a loan charge of $600 million;\n3. On or before April 7, 2025, an amount equal to $8.0 billion plus a loan charge of $800 million;\n4. On or before April 7, 2026, an amount equal to $6.6 billion plus a loan charge of $1.5 billion;\n5. On or before April 7, 2027, a loan charge of $1.0 billion; and\n6. On or before April 7, 2028, a loan charge of $1.0 billion.\nOn March 7, 2023, the Company agreed with PIF to make a third partial prepayment of $15.7 billion on or before March 15, 2023.\nThis partial prepayment will fully reduce the outstanding principal amount of $3.5 billion of the promissory note payable on or before April 7, 2024, and will partially reduce the outstanding principal amounts of the promissory notes payable on or before\nApril 7, 2025, and April 7, 2026, by $3.8 billion and $5.7 billion, respectively. The outstanding amounts of the loan charge\npromissory notes payable between 2024 and 2028, aggregating to $4.9 billion, will also be fully reduced. After taking this\nprepayment', '. SABIC manufactures on a global scale in the Americas, Europe, Middle East, and Asia Pacific, making different products, including chemicals, commodity and high-performance plastics, specialties, agri-nutrients and metals. The acquisition of the equity interest in SABIC is consistent with Saudi Aramco’s long-term Downstream strategy to grow its integrated refining and petrochemicals capacity and create value from integration across the hydrocarbon value chain.\nThe transaction resulted in the Company obtaining control of SABIC. The Company accounts for acquisitions of subsidiaries using the acquisition method of accounting, including those acquisitions under common control and having commercial substance. This requires recognition of the assets acquired and liabilities assumed at fair value as of the acquisition date.\n71 Saudi Arabian Oil Company | Consolidated financial statements for the year ended December 31, 2021\n\nAll amounts in millions of Saudi Riyals unless otherwise stated 35. Investments in affiliates continued Saudi Aramco engaged an independent valuer in order to determine the fair values of the assets and liabilities of SABIC as part of the purchase price allocation. The fair values of the identifiable assets and liabilities are as follows:\nCash and cash equivalents 27,515 Trade receivables 13,829\nInventories 24,919 Other current assets and receivables 4,803\nShort-term investments 8,405 Property, plant and equipment (Note 5) 179,313\nIntangible assets (Note 6) 37,079 Investments in joint ventures and associates 51,864\nOther non-current assets 11,598 Trade and other payables (23,460)\nIncome tax and zakat payable (4,178)\nCurrent borrowings (8,149)\nNon-current borrowings (37,174)\nPost-employment benefit obligations (16,549)\nOther non-current liabilities (9,067)\nTotal identified net assets at fair value 260,748 Non-controlling interests (100,739)\nGoodwill (Note 6) 99,116 Purchase consideration in the form of promissory notes 259,125\nNon-controlling interests which result from both the Company’s partial ownership of SABIC, as well as SABIC’s partial ownership of a number of its subsidiaries, were measured at their proportionate share of recognized net assets.\nThe purchase price amount is to be paid over several installments pursuant to a seller loan provided by PIF. Loan payments, which are represented by promissory notes denominated in USD, are as follows:\nPrincipal loan amount Loan charge On or before August 2, 2020 26,250 – On or before April 7, 2021 18,750 –\nOn or before April 7, 2022 31,875 1,875\nOn or before April 7, 2023 39,375 1,875\nOn or before April 7, 2024 39,375 2,250\nOn or before April 7, 2025 39,375 3,000\nOn or before April 7, 2026 64,125 5,625\nOn or before April 7, 2027 – 3,750 On or before April 7, 2028 – 3,750\nTotal purchase price and loan charges 259,125 22,125\nPayments to date (45,000) –\nTotal amount of outstanding installments 214,125 22,125\nThe combined fair value of the principal loan amounts and loan charges on the date of acquisition amounted to SAR 259,125 ($69,100).\nThis is subsequently measured at amortized cost using the effective interest method and is presented on a combined basis as ‘Deferred consideration’ within ‘Borrowings’ (Note 20).\nSaudi Aramco had agreed to make an accelerated payment of SAR 11,250 ($3,000) in April 2022 based on the occurrence of certain\nmarket conditions in 2021. At December 31, 2021, it was determined that the relevant conditions were not met during 2021 and, as a\nresult, no accelerated payment will be required in April 2022. If the accelerated payment would have been required, it would have\nreduced the principal amount that would otherwise be payable on or before April 2026 by SAR 11,250 ($3,000) and the loan charge in\nApril 2022 would have been reduced from SAR 1,875 ($500) to SAR 750 ($200).\nSaudi Arabian Oil Company | Consolidated financial statements for the year ended December 31, 2021 72\nNotes to the consolidated financial statements continued All amounts in millions of Saudi Riyals unless otherwise stated 35. Investments in affiliates continued The goodwill of SAR 99,116 arising from the transaction includes synergies expected from the transaction, representing value\nchain capture through downstream integration, procurement, supply chain, manufacturing, marketing and sales, future', 'PC for a 20-year period. Concurrently, AGPC granted the Company the exclusive right to use, operate and maintain the pipelines network during the 20-year period in exchange for a quarterly, volume-based tariff payable by the Company to AGPC. The tariff is backed\nby minimum volume commitments. The Company will at all times retain title to, and operational control of, the pipelines.\n35. Investments in affiliates (a) Investments in subsidiaries (i) Saudi Basic Industries Corporation (""SABIC"")\nOn June 16, 2020, the Company acquired a 70% equity interest in SABIC from the Public Investment Fund (""PIF""), for SAR 259,125\n($69,100). This equates to SAR 123.39 ($32.90) per share.\nSABIC is a global diversified chemicals company headquartered in Riyadh, Saudi Arabia. SABIC manufactures on a global scale in the Americas, Europe, Middle East, and Asia Pacific, making different products, including chemicals, commodity and high-performance plastics, specialties, agri-nutrients and metals. The acquisition of the equity interest in SABIC is consistent with Saudi Aramco’s long-term Downstream strategy to grow its integrated refining and petrochemicals capacity and create value from integration across the hydrocarbon value chain.\nThe transaction resulted in the Company obtaining control of SABIC. The Company accounts for acquisitions of subsidiaries using the acquisition method of accounting, including those acquisitions under common control and having commercial substance. This requires recognition of the assets acquired and liabilities assumed at fair value as of the acquisition date.\n\nConsolidated financial statements All amounts in millions of Saudi Riyals unless otherwise stated 35. Investments in affiliates continued Saudi Aramco engaged an independent valuer in order to determine the fair values of the assets and liabilities of SABIC as part of the purchase price allocation. The fair values of the identifiable assets and liabilities are as follows:\nCash and cash equivalents 27,515 Trade receivables 13,829\nInventories 24,919 Other current assets and receivables 4,803\nShort-term investments 8,405 Property, plant and equipment (Note 5) 179,313\nIntangible assets (Note 6) 37,079 Investments in joint ventures and associates 51,864\nOther non-current assets 11,598 Trade and other payables (23,460)\nIncome tax and zakat payable (4,178)\nCurrent borrowings (8,149)\nNon-current borrowings (37,174)\nPost-employment benefit obligations (16,549)\nOther non-current liabilities (9,067)\nTotal identified net assets at fair value 260,748 Non-controlling interests (100,739)\nGoodwill (Note 6) 99,116 Purchase consideration in the form of promissory notes 259,125\nNon-controlling interests which result from both the Company’s partial ownership of SABIC, as well as SABIC’s partial ownership of a number of its subsidiaries, were measured at their proportionate share of recognized net assets.\nThe purchase price amount is to be paid over several installments pursuant to a seller loan provided by PIF. Loan payments, which are represented by promissory notes denominated in USD, are as follows:\nPrincipal loan amount Loan charge On or before August 2, 2020 26,250 – On or before April 7, 2021 18,750 –\nOn or before April 7, 2022 31,875 1,875\nOn or before April 7, 2023 39,375 1,875\nOn or before April 7, 2024 39,375 2,250\nOn or before April 7, 2025 39,375 3,000\nOn or before April 7, 2026 64,125 5,625\nOn or before April 7, 2027 – 3,750 On or before April 7, 2028 – 3,750\nTotal purchase price and loan charges 259,125 22,125\nPayments to date (45,000) –\nTotal amount of outstanding installments 214,125 22,125\nThe combined fair value of the principal loan amounts and loan charges on the date of acquisition amounted to SAR 259,125 ($69,100).\nThis is subsequently measured at amortized cost using the effective interest method and is presented on a combined basis as ‘Deferred consideration’ within ‘Borrowings’ (Note 20).\nSaudi Aramco had agreed to make an accelerated payment of SAR 11,250 ($3,000) in April 2022 based on the occurrence of certain\nmarket conditions in 2021. At December 31, 2021, it was determined that the relevant conditions were not met during 2021 and, as a\nresult, no accelerated payment will be required in April 2022.', 'unless otherwise stated The changes in Level 3 investments in securities and other current assets for the six-month period ended June 30, 2020 and the year ended December 31, 2019 are as follows:\nJune 30, December 31,\n2020 2019\nBeginning 6,162 5,530\nNet (disposals)/ additions (997) 286\nAcquisition of SABIC 280 ‑\nNet movement in unrealized fair value (407) 346\nEnding 5,038 6,162\nThe movement in trade receivables related to contracts with provisional pricing arrangements mainly relates to sales transactions, net of settlements, made during the period, resulting from contracts with customers (Note 11). Unrealized fair value movements on these trade receivables are not significant.\n4. Acquisition of subsidiary - Saudi Basic Industries Corporation (“SABIC”)\nOn June 16, 2020, the Company completed its acquisition of a 70% equity interest in SABIC from the Public Investment Fund (""PIF""), for SAR\n259,125 ($69,100). This equates to SAR 123.39 ($32.90) per share.\nSABIC is a global diversified chemicals company headquartered in Riyadh, Saudi Arabia. SABIC manufactures on a global scale in the Americas, Europe, Middle East and Asia Pacific, making different products, including chemicals, commodity and high-performance plastics, specialties, agri- nutrients and metals. The acquisition of the equity interest in SABIC is consistent with Saudi Aramco’s long-term Downstream strategy to grow its integrated refining and petrochemicals capacity and create value from integration across the hydrocarbon chain.\nThe transaction resulted in the Company obtaining control of SABIC. The Company accounts for acquisitions of subsidiaries using the acquisition method of accounting, including those acquisitions under common control and having commercial substance, which requires the assets acquired and liabilities assumed to be recognized at their fair value as of the acquisition date.\nSaudi Aramco has engaged an independent valuer in order to determine the fair values of the assets and liabilities of SABIC as part of the purchase price allocation. The fair values in the following table are provisional in nature due to the limited period between the acquisition date and information required to assess the fair values of the assets acquired and liabilities assumed:\nCash and cash equivalents 27,515 Trade receivables 13,829\nInventories 24,522 Other current assets and receivables 4,803\nShort-term investments 8,206 Property, plant and equipment (Note 6) 179,050\nIntangible assets (Note 7) 37,044 Investments in joint ventures and associates 47,089\nOther non-current assets 10,746 Trade and other payables (23,586)\nIncome tax and zakat payable (4,051)\nCurrent borrowings (8,148)\nNon-current borrowings (37,173)\nPost-employment benefit obligations (16,547)\nOther non-current liabilities (6,892)\nTotal identified net assets at fair value 256,407 Non-controlling interests (98,252)\nGoodwill (Note 7) 100,970 Purchase consideration in the form of promissory notes 259,125\nNon-controlling interests, which result from both the Company’s partial ownership of SABIC as well as SABIC’s partial ownership of a number of i ts subsidiaries, were measured at their p roportionate share of recognized net assets.\nSaudi Arabian Oil Company 19 Second quarter and half year interim report 2020 All amounts in millions of Saudi Riyals unless otherwise stated The purchase price amount will be paid over several installments pursuant to a seller loan provided by PIF (Note 10). Loan payments, which are\nrepresented by promissory notes denominated in US Dollars, are payable as follows:\nPrincipal loan amount Loan charge On or before August 2, 2020 26,250 ‑ On or before April 7, 2021 18,750 ‑\nOn or before April 7, 2022 31,875 1,875\nOn or before April 7, 2023 39,375 1,875\nOn or before April 7, 2024 39,375 2,250\nOn or before April 7, 2025 39,375 3,000\nOn or before April 7, 2026 64,125 5,625\nOn or before April 7, 2027 ‑ 3,750 On or before April 7, 2028 ‑ 3,750\n259,125 22,125\nThe combined fair value of the principal loan amounts and loan charges amount to SAR 259,125 ($69,100). This is presented on a combined\nbasis as ‘Deferred consideration’ within ‘Borrowings’ (Note 10) and is subsequently measured at amortized', '598 Trade and other payables (23,460)\nIncome tax and zakat payable (4,178)\nCurrent borrowings (8,149)\nNon-current borrowings (37,174)\nPost-employment benefit obligations (16,549)\nOther non-current liabilities (9,067)\nTotal identified net assets at fair value 260,748 Non-controlling interests (100,739)\nGoodwill (Note 7) 99,116 Purchase consideration in the form of promissory notes 259,125\nNon-controlling interests which result from both the Company’s partial ownership of SABIC, as well as SABIC’s partial ownership of a number of its subsidiaries, were measured at their proportionate share of recognized net assets.\nAll amounts in millions of Saudi Riyals unless otherwise stated 201 4. Acquisition of SABIC continued The purchase price amount is to be paid over several installments pursuant to a seller loan provided by PIF. Loan payments, which are represented by promissory notes denominated in US Dollars, are as follows:\nPrincipal loan amount Loan charge On or before August 2, 2020 26,250 – On or before April 7, 2021 18,750 –\nOn or before April 7, 2022 31,875 1,875\nOn or before April 7, 2023 39,375 1,875\nOn or before April 7, 2024 39,375 2,250\nOn or before April 7, 2025 39,375 3,000\nOn or before April 7, 2026 64,125 5,625\nOn or before April 7, 2027 – 3,750 On or before April 7, 2028 – 3,750\nTotal purchase price and loan charges 259,125 22,125\nPayments during the period (26,250) –\nTotal amount of outstanding installments 232,875 22,125\nThe combined fair value of the principal loan amounts and loan charges on the date of acquisition amounted to SAR 259,125 ($69,100).\nThis is subsequently measured at amortized cost using the effective interest method and is presented on a combined basis as ‘Deferred consideration’ within ‘Borrowings’ (Note 21).\nSaudi Aramco has also agreed to make an accelerated payment of SAR 11,250 ($3,000) in April 2022 based on the occurrence of\ncertain market conditions in 2021. If the accelerated payment is made, it will reduce the principal amount that would otherwise be\npayable on or before April 2026 by SAR 11,250 ($3,000) and the loan charge in April 2022 will be reduced from SAR 1,875 ($500)\nto SAR 750 ($200).\nThe provisional goodwill of SAR 99,116 arising from the transaction includes synergies expected from the transaction, representing value chain capture through downstream integration, procurement, supply chain, manufacturing, marketing and sales, future customer relationships and intangibles such as acquired work force. Goodwill has been provisionally allocated to the Downstream operating segment, which is expected to benefit from the synergies of the acquisition.\nAcquisition and transaction costs of SAR 343 were expensed as selling, administrative and general expenses in the Consolidated Statement of Income.\nSABIC contributed revenues of SAR 64,659 and net loss of SAR 2,426 to Saudi Aramco for the period from June 16, 2020 to December\n31, 2020. If the acquisition had occurred on January 1, 2020, management estimates that consolidated pro-forma revenue and net\nincome for the year ended December 31, 2020 would have been SAR 809,204 and SAR 179,168, respectively. These amounts have\nbeen calculated using SABIC’s results and adjusting them mainly for depreciation, amortization and unwinding adjustments that would have been recorded assuming the acquisition-date fair value adjustments had applied from January 1, 2020.\n5. Operating segments Saudi Aramco is engaged in prospecting, exploring, drilling, extracting, processing, manufacturing, refining and marketing hydrocarbon substances within the Kingdom and has interests in refining, petrochemical, distribution, marketing and storage facilities outside the Kingdom.\nSaudi Aramco’s operating segments are established on the basis of those components that are evaluated regularly by the CEO, considered to be the Chief Operating Decision Maker. The Chief Operating Decision Maker monitors the operating results of Saudi Aramco’s operating segments separately for the purpose of making decisions about resource allocation and performance assessment.\nSegment performance is evaluated based on revenues, costs and a broad range of key performance indicators in addition to segment profitability.\nFor management purposes, Saudi Aramco is organized into business units based on the main types of activities. At December 31, 2020,\nSaudi Aramco had two reportable segments']","In 2023, the Company agreed with PIF to make a third partial prepayment of $15.7 billion on or before March 15, 2023. This prepayment fully reduced the outstanding principal amount of $3.5 billion of the promissory note payable on or before April 7, 2024, and partially reduced the outstanding principal amounts of the promissory notes payable on or before April 7, 2025, and April 7, 2026, by $3.8 billion and $5.7 billion, respectively. The outstanding amounts of the loan charge promissory notes payable between 2024 and 2028, aggregating to $4.9 billion, were also fully reduced.","Aramco made three payments in 2023 totaling SAR 116.9 billion, including a partial prepayment, repayment of promissory notes, and a final prepayment. As a result, the deferred consideration payable to PIF was fully settled.",0.75,0.58583690046964,0.99999999998,0.0
What is the purpose of Aramco's Supplier Code of Conduct and iktva program?,"[""rural Indonesia, Saudi Aramco’s programs have served thousands of workers, students, and at-risk citizens in dozens of locations throughout the region.\n)GSE( ecnanrevog\n\nlaicos ,latnemnorivne\n\nSaudi Aramco's procurement supports a diversified energy sector Responsible procurement The Company aims to cultivate local business with a goal of 70% of all expenditures in the Saudi Aramco’s commitment to ethical Kingdom being locally sourced over the next business practices extends to its supply chain three years.\nthrough its Supplier Code of Conduct which outlines mandatory policies on environmental, The Company aims to health and safety issues, fair trade practices, The Company has engaged with its business ethical sourcing, conflicts of interest, bribery, partners and suppliers to support local cultivate local business kickbacks, gifts and fraud, monitoring and community development and recruitment compliance. Saudi Aramco’s Supplier Code of through a model of scholarship and vocation with a goal of 70% of Conduct promotes the Company’s values and training in different industries. The Saudi extends and maintains its ethical standards Arabian Drilling Academy (SADA), a Saudi all expenditures in the across the supplier network, enabling long- Aramco-led collaboration, is working to train term, mutually beneficial partnerships. thousands of skilled exploration, drilling Kingdom being locally This requires that the Company’s vendors and workover talent in alignment with the sourced over the next and suppliers, and those of the Company’s Saudi Vision 2030 workforce development subsidiaries, meet the required standards aims. In September 2018 the first cohort of three years of ethics when it comes to anti-bribery and 132 drillers and service people graduated\nanti-corruption, as well as compliance with from SADA.\nall local legislation around human rights.\nThe Company is a major employer in Saudi Supply chain localization Arabia, and as part of the country’s Vision In support of the Company’s initiative to 2030, which includes goals for increasing develop local supply chains to enhance its female participation in the workforce, the long-term commercial interests and reduce Company has helped develop skilled female procurement costs, in 2015 the Company talent. The Company created the Leading launched its In-Kingdom Total Value Add National Academy (LNA) as a public-private Program (iktva), designed to increase the partnership under the National Specialized use of in-Kingdom suppliers of goods and Partnership Academies (NSPA) focusing on services. In 2019, the iktva metric reached providing women with industrial and\n56%. The Company believes that the scale technical skills training as well as soft skills of the Company’s procurement program can including speaking with impact, emotional support building a diversified energy sector intelligence and business acumen. Since in the Kingdom. In addition, the Company inception, NSPA academies have graduated believes this program not only has a positive over 18,000 trainees and currently have over\nimpact on the Kingdom’s economy but also 5,000 active students in 18 specialized\nsupports the Company’s efforts to improve institutions. LNA provides curricula in supply the efficiency and effectiveness of its supply chain, electrical, instrument, mechanical, chain. The program aims to increase the use laboratory science, and HSE disciplines. As of in-Kingdom suppliers, expand local supply the first female-focused industrial training chain capabilities and capacities, elevate the center in Saudi Arabia, LNA is paving the training and hiring of Saudi nationals, drive way to build inclusion into even the most collaboration in the industry through supplier male-dominated industrial sectors.\ndevelopment, bring new innovations to the Kingdom through R&D and promote the Kingdom as an export hub.\n\nRisk management Risk objectives Enterprise risk management framework Saudi Aramco operates in an industry characterized by price volatility, hazardous operations, and uncertain project outcomes.\nTaking informed risks is an inherent and Board necessary part of doing business. Saudi Aramco manages its strategic, operational, compliance and financial risks by continuously assessing them and undertaking appropriate Risk and HSE Committee Audit Committee responses. Business decisions are made after due consideration of rewards and associated risks.\nRisk management framework The Board of Directors provides risk oversight Executive team as a component of its strategic leadership.\nThe Risk & HSE Committee of the Board oversees the risk management framework and monitors specific major risks. Management Committee The primary role of the Risk and HSE Committee is to monitor overall management of risk and activities relating to health, safety and the environment and to assist the Board The framework is based on the Three Lines of Defense model of Directors with:\n(i) l eadership, direction, and oversight with respect to Saudi Aramco’s risk appetite, First line of defense: Second line of defense: Third line of defense:\nrisk tolerance, risk framework and risk Business assets Risk and control Internal audit strategy; and facilities functions (ii) g overnance and management of strategic and operational risks and sustainability; Identify and manage risk Monitor and report risk, Provide independent assurance and and provide guidance on the effectiveness of internal control systems (iii) f ostering a culture within Saudi Aramco that emphasizes and demonstrates"", 'to be Technical Professional (PTP) roles are happy, healthy, productive, and highly also actively promoted through the engaged — both at work and at home.\ncollege degree sponsorship program.\nEmployee development In the spring of 2020, employee development programs were migrated to the virtual environment in parallel with other COVID-19 risk mitigation measures.\nBetween March and December, more than 1,300 learning and development programs were conducted online, serving approximately 20,000 participants.\nThe Company also deployed courses via the Learning through Interactive Virtual Environment (LIVE) platform for 3,500 users, and leveraged the Harvard Manage Mentor site to reach more than 21,000 unique users for the delivery of\n42,000 online learning modules.\n\nlaicos ,latnemnorivn E\n\nAn Aramco geologist, participating in the company’s STEMania program, encourages female students to study science, technology, engineering, and mathematics.\n\nGrowing societal value Developing local supply chains Since the launch of iktva in 2015, the Company’s suppliers have tripled their Aramco is actively building a world-class local purchases of goods and services.\nsupply chain, through the In-Kingdom There has been a 20-fold increase Total Value Add (iktva) program, to serve in spending by the Company’s main the needs of the Company and its suppliers in developing local sub-suppliers.\npartners, facilitating the development Suppliers are now investing three times of a diverse, sustainable, and a globally the amount on research and development competitive energy sector in the in the Kingdom, and their employment Kingdom. The Company strives to of Saudi nationals is up by 60%, with cultivate local business with the goal female employment increasing by to retain 70% of all procurement spend\nalmost one-third.\nin-Kingdom.\n2020 2019 Iktva’s proven success model has become\nthe cornerstone for the Local Content\niktva1 (%) 57.5 55.8\nand Government Procurement Authority 1. Company. localization model, which will accelerate the maturity of the Kingdom’s industrial Iktva provided tangible benefits to the ecosystem across all sectors. This model Company and Kingdom during the global has attracted more than 450 investments.\npandemic of 2020. Localized supply chains From Jazan Economic City to the King enabled the Company to maintain Salman International Complex for operations with minimal disruption.\nMaritime Industries & Services, iktva has Many of the Company’s supply chain created an ecosystem of integrated value partners continued to build and startup chains to help businesses hit the ground facilities in-Kingdom despite the economic running in Saudi Arabia.\ndownturn, ensuring the provision of supplies and services to the Company The iktva program has demonstrated and retention of Saudis in the workforce.\nthe benefits of creating successful Billions of dollars in economic activity partnerships with business, government, that historically would have left the and academia. It also increases the Kingdom instead remained to serve the Company’s competitiveness, drives interests of the Company and support industry collaboration and brings the local economy.\ninnovation to the Kingdom through research and development. The synergy driven by the iktva program has delivered greater levels of prosperity for the Kingdom, the local business community, and Aramco.\n\nCitizenship COVID-19 Aramco’s citizenship programs throughout the Kingdom support economic and community projects that In response to the COVID-19 procurement processes. This was\nempower people to take the next step pandemic, Aramco adopted measures supported by a supercomputing forward and turn ideas into reality.\nto promote the safety, health and Human Resources data center These initiatives encompass a broad well-being of employees and that provides essential data and spectrum, from high-profile health care communities, while maintaining information to inform day-to-day projects to small business startups and a reliable supply of oil and gas to response efforts, and which has women’s groups.\nglobal markets — including vital been recognized by the World inputs for the chemicals, plastics and Economic Forum as a COVID The King Abdulaziz Center for World pharmaceutical industries — which “Global Best Practice.”\nCulture (Ithra) is Aramco’s flagship have been essential in global corporate citizenship initiative, and one coronavirus response efforts. Johns Hopkins Aramco Healthcare of the largest cultural contributions to (JHAH) is integral to the Company’s the Kingdom. Ithra globally showcases A dedicated internal taskforce was medical preparedness and response Saudi potential, facilitating the established to ensure business to COVID-19. JHAH took proactive generation of new creative content, continuity, safe operations, and measures to roll-out a companywide enabling the growth and talent of the community well-being. Aramco health awareness campaign, including Kingdom’s creative sector and providing implemented numerous measures at weekly updates, and ensured all new global cultural experiences to each operational location, including Company employees have access to Saudi audiences.\nactive prevention programs, detailed accurate and reliable information contingency plans and leading about preventing transmission of Aramco’s initiative to seed micro- medical support services to minimize COVID-19,', 'and industry. A Code of protections. The existence and purpose of Business Conduct provides guidelines to the hotline is communicated to all employees by management on the Directors, Senior Executives, employees through the Company’s continuous and contract employees of the Company a regular basis compliance training campaigns and initiatives.\nand its controlled affiliates regarding, among other things, integrity, health, safety and\n2019 2018\nenvironmental protection, competition and\nAllegations received 507 462\nantitrust, anti-bribery and anti-corruption, insider trading and compliance with Concerted efforts and a communication applicable law.\nstrategy have increased trust in the system and expanded awareness and use of the Suppliers and contractors are held to the hotline across the Company’s operations.\nCompany’s standard of ethics through a All allegations have been reviewed and dedicated Supplier Code of Conduct. For investigated. In 2019, 9% of received each of these policies, the Company has allegations have resulted in cases whereby operating guidelines and instructions irregular activities were substantiated and addressing record-keeping, approval for which corrective actions were applied.\nprocedures, appropriate behavior, stakeholder responsibilities, governance, process flows, Grievance mechanisms workflow interfaces and audits.\nIn addition to the anonymous hotline, a channel exists for employees to raise To promote the adoption of the Company’s formal complaints. The Company has ethics and compliance principles into its engaged employees to promote a culture corporate culture, regular training is provided of psychological safety, where it is safe to employees across business lines, as well as to speak up.\nsuppliers and contractors, in connection with Anti-Bribery and Anti-Corruption, Conflict of Interest, and Business Ethics policies.\n\nBusiness resilience and The Company’s Operational Excellence continuity planning management system enables continuous improvement and operational discipline With its operations in the Kingdom of Saudi through management of its various systems.\nArabia, and across the globe, Saudi Aramco It comprises processes, procedures, rules recognizes the risks associated with political The Company carefully and standards that work together to govern and social instability, terrorism, and armed operations of all operating assets throughout manages security concerns conflict. The Company takes these ongoing the asset lifecycle. Examples include the risks seriously as part of its continuity Safety Management System, Environmental that could have a material planning and has demonstrated the ability Management System, Asset Integrity to recover expeditiously from even significant Management System, Energy Management effect on its business, physical attacks on its facilities. The Company Program, Business Continuity Management, carefully manages security concerns that financial position and Data Protection Program, Inspection could have a material effect on the safety Programs, Knowledge Management of its staff, contractors, its business, financial operations Program and others.\nposition, or assets.\nRefer to Section 5: Risk for more details.\n)GSE( ecnanrevog\n\nlaicos ,latnemnorivne\n\nInformation security Cybersecurity Saudi Aramco recognizes cybersecurity as The Company works to protect Company a risk-management imperative in today’s data and systems, ensure business continuity increasingly digital business, political, and and operational recovery, and repel intrusion technological landscape. The Company attempts.\naddresses cybersecurity at senior levels, including Board consideration and oversight Data privacy of the Company’s cybersecurity and assessment Data privacy compliance is important to the of risks. Cybersecurity is a top corporate risk Company and enshrined in a Board approved and is regularly reviewed by the Risk and enterprise-wide data privacy and protection HSE Committee.\npolicy, developed to protect the personal data of all employees, contractors, shareholders, customers, vendors, job Refer to Section 5: Risk for more details.\napplicants, and website users. The data privacy and protection policy obligates The Company works to The Company has programs, controls employees to ensure compliance with the and processes in place designed to protect applicable data privacy and protection laws protect Company data and Company data and systems, to ensure and regulations.\nbusiness continuity and operational recovery systems, ensure business and to repel intrusion attempts. To respond The Company’s Code of Business Conduct to an ever-changing cyber threat landscape, continuity and operational outlines expectations with respect to the Chief Information Security Officer leads maintaining the privacy of employee the cybersecurity governance management recovery, and repel personal data and the data of customers model for Saudi Aramco’s operations in and business partners. intrusion attempts the Kingdom, to establish and maintain cybersecurity policies, direct the cybersecurity programs, and mandate relevant processes, capabilities and technologies.\nIn addition, the Company has established a Supply Chain Cybersecurity Program to combat cyber risks originating from third parties.\n\nenvironmental stewardship Saudi Aramco understands the importance of managing precious natural resources Grow sustainably The Company celebrates its role in global Climate change economic development by extracting, Saudi Aramco understands that no single processing and delivering its products safely, Saudi Aramco’s “Grow Sustainably” solution is sufficient to solve the climate reliably, and efficiently.\napproach to addressing climate-related challenge. The Company’s approach risks and opportunities is based on leverages a diverse and balanced portfolio, As a company founded and operating in key commitments: champions technological innovation, and a desert', 'tragically, one contractor fatality At the direction of the Board, the scope of During the year, the Company launched occurred in 2021 at a construction site.\nthe 2021 safety performance metrics has the D&I HR Working Committee and This incident was thoroughly investigated, been expanded to include the Company the D&I Project Management Office.\nwith root causes identified and action and its operationally controlled entities, Together, these groups take a proactive plans developed to avoid reoccurrence.\nwhere 2020 data included in-Kingdom approach to recruit females and people wholly-owned and operated assets. with disabilities to the workforce, and To protect its workforce, the Company For comparison purposes, 2021 data for then develop, engage, and retain them as combines an enterprise-wide safety in-Kingdom wholly-owned and operated Aramco employees. In 2021, the Company focus with robust policies and standards assets has also been stated. saw notable shifts in hiring, with women under the umbrella of the Health, comprising 31% of all direct hires in the\nSafety, Security and Environment People and communities year, raising the percentage of females (HSSE) Committee. The Company also in the workforce to 5.6%. As well, more deploys its subject matter experts to The Company is committed to growing people with disabilities were hired than independently assess the compliance and diversity and inclusion (D&I) in the in the past three years combined.\nimplementation of its Safety Management workforce. A diverse workforce System, and develop action plans to encourages a global perspective and further improve safety performance. fosters innovation, collaboration, and 2021 2020\nrespect. Attracting and cultivating the Company employees2 68,493 66,800\nA commitment to safety and safe best talent is a priority, and Aramco Female employees2\noperations is also a requirement for regards individual differences as (%) 5.6 5.1\nAramco’s contractors. Since the inception opportunities for creativity and growth.\nof the Construction Safety Index (CSI) in Aramco also works with the Government\n2019, the Company completed over 11,000 In 2021, over 16,000 participants attended\nand the business community to develop risk-based inspections and issued more Aramco D&I programs and events, which the skills of the local workforce. During than 3,700 CSI reports, contributing to raise awareness and reinforce the the year, the Altamayyuz Finance and the enhancement of contractor safety. importance of D&I in the workplace. A key Accounting Excellence Academy was component of the Company’s D&I strategy As part of its ongoing response to is empowering women and promoting inaugurated, offering programs to COVID-19, and in collaboration with the female participation in the workforce. This new graduates seeking professional\nMinistry of Health, the Company swiftly starts with supporting women as they enter certifications and helping to build a thriving implemented a vaccination program university, and in 2021 females accounted in-Kingdom financial sector. Two cohorts of\nto its employees, dependents, retirees, for approximately 48% of active overall nearly 90 candidates entered the Academy\nand trainees. enrollment in the Company-sponsored in 2021.\nCollege Preparatory Program.\n1. The Company and its operationally controlled entities.\n2. Applies to Saudi Arabian Oil Company (the Company).\n3. Total workforce (employees and contractors).\n4. Per 200,000 work hours.\nGrowing societal value\nDeveloping local supply chains and inventories, strengthening Aramco’s In 2021, 59% of the Company’s spending\nability to meet commitments to customers was directed to domestic suppliers, Aramco supports the economic growth around the world. representing billions of dollars in economic and diversification of Saudi Arabia and is activity that remained in-Kingdom in committed to creating direct and indirect In support of these efforts, and aligned support of the local economy.\nemployment opportunities for Saudi Arabian with iktva and the Kingdom’s Shareek nationals. In alignment with the Kingdom’s program, Aramco launched Namaat, Shareek corporate investment initiative, the 2021 2020 a major expansion of the Company’s Company has established programs intended iktva1 Industrial Investment Program, to forge\nto drive a world-class in-Kingdom energy (%) 59.0 57.5\nworld-class partnerships in sustainability, and industrial ecosystem.\ntechnology, industrials, and advanced materials. With Namaat, Aramco seeks The Company is building a world-class to drive the continued growth and local supply chain, through the Company’s development of a resilient and sustainable In-Kingdom Total Value-Add (iktva)\nprivate sector in the Kingdom.\nprogram, to serve the needs of the Company Aramco supports the and its partners, and facilitate development Aramco also supports the growth of of a diverse, sustainable, and globally sustainable traditional professions in- economic growth and competitive in-Kingdom energy sector.\nKingdom', '6 Through its in-Kingdom Total billion ($1.5 billion) Sustainability Value Add (iktva) program,\nFund to invest in technology Aramco entered into over 90 needed to support a stable and agreements with an estimated inclusive energy transition. value of SAR 64.9 billion\n($17.3 billion) with strategic local suppliers. The local component of the Company’s overall expenditure across its supply chain now stands at 63.0%.\nMarafiq initial public offering Expanded presence in Europe The Power and Water Utility Three successful transactions with Company for Jubail and Yanbu, Polish refiner and fuel retailer known as Marafiq, successfully PKN ORLEN were completed, executed its IPO of 29.2% of its expanding Aramco’s presence in shares and the listing of its shares the European downstream sector. on the Saudi Exchange.\nAugust September October November December Valvoline Global Products Maximizing crude-to- In-Kingdom petrochemical complex agreement chemicals value chain Aramco and Total Energies made a final Aramco signed an equity Aramco agreed to investment decision to construct a large purchase agreement to develop one of the petrochemical complex in Saudi Arabia.\nacquire Valvoline Inc.’s world’s largest global products business. refinery-integrated The transaction closed petrochemical steam in March 2023. crackers in South Korea through its S-OIL affiliate, which will convert crude oil Lower-carbon fuels into petrochemical An MoU was signed with feedstock.\nFormula Motorsport Limited to introduce the use of alternative, lower- carbon fuels in the Carbon capture and Formula 2 and Formula 3 storage hub racing championships A joint development Luberef initial First commercial beginning in 2023. agreement between public offering blue ammonia Aramco and the Saudi Aramco Base shipment Ministry of Energy was Oil Company Aramco and SABIC signed to construct (Luberef) Agri-Nutrients one of the largest successfully collaborated on planned carbon executed its IPO of the world’s first capture and storage 29.7% of its shares commercial\nhubs in the world in and the listing of shipment of Jubail, Saudi Arabia. its shares on the certified blue Saudi Exchange. ammonia to South Korea.\n\nBusiness model Capturing value across the hydrocarbon chain Inputs Capturing value Operations Integrated upstream and Total hydrocarbon Net chemicals reserves1 production capacity2 downstream operations (billion boe) (million tons per year)\n258.8 56.3\nNet refining Maximum capacity Sustainable Capacity (mmbpd) (mmbpd)\n4.1 12.0\nHuman Company employees3 70,496 Relationships Stakeholders:\n• Customers • Partners\n• Suppliers • Governments Countries of operations Domestic and foreign Low cost, lower carbon- Major integrated refiner subsidiaries, joint intensive upstream and petrochemical 50+ arrangements, production producer with a global and associates network of reliable assets 300+ in key regional markets Unique operational and hubs flexibility and opportunities Financial to rapidly increase crude Capital expenditures Net debt4 (billion) (billion) oil production Upstream production monetized through a high\nSAR 141 $38 SAR (123) $(33)\nquality external customer Total hydrocarbon Total liquids Average capital production production5 base and captive employed4 (mmboed) (mmbpd) downstream system (billion)\n13.6 11.5\nSAR 1,925 $514\n1. Hydrocarbon reserves of Saudi Arabian Oil Company Innovation\n(the Company) as at December 31, 2022, under the\nConcession agreement.\n2. Excludes SABIC Agri-Nutrients and Metals (Hadeed) businesses. Decarbonizing operations Carbon capture, 3. Refer to Section 3: Sustainability for further information. and developing lower-carbon utilization, and 4. For definition of average capital employed and net debt, solutions and noncombustible storage refer to “Non-IFRS measures reconciliations and definitions.”\nuses for products 5. Total liquids is comprised of crude oil, NGL and condensate.\n6. Applies to Saudi Arabian Oil Company (the Company). Blue 7. Includes income taxes, royalties, and dividends. ammonia Safety Citizenship Underpinned by core values\n\nOutcomes and impacts Operations Marketing Products produced:\nand distribution • Crude oil • B ase oils and lubricants\n• Gas • Electricity\n• Refined products • Lower-carbon energy\n• Chemicals solutions Upstream carbon Reliability6 intensity3 (%)\n(kg of COe/boe)\n2 99.9 10.3\nScope 1 emissions3 Scope 2 emissions3 (million metric tons of COe) (million metric tons of COe)\n55.7 16.1\nPower supplied to the Freshwater consumption3 national grid (million cubic meters)\n(gigawatts)\n93.60 1.3\nIntegrated trading Exclusive access to Human business enables the Kingdom’s large Lost time injuries/ Total']","The purpose of Aramco's Supplier Code of Conduct is to outline mandatory policies that ensure ethical business practices among suppliers, particularly regarding environmental health and safety issues, fair trade practices, ethical sourcing, and compliance with local legislation around human rights. This fosters long-term, mutually beneficial partnerships while maintaining ethical standards across the supplier network.

The iktva program (In-Kingdom Total Value Add) aims to develop local supply chains, increase the use of in-Kingdom suppliers, and enhance the local economy. It supports the diversification of the energy sector and facilitates the development of a sustainable and competitive industrial ecosystem in Saudi Arabia, ultimately striving to retain 70% of all procurement expenditures in the Kingdom.","The Supplier Code of Conduct sets mandatory standards for ethics, environmental and safety issues, and compliance across the supply chain. The iktva program aims to increase the use of in-Kingdom suppliers and build local supply chain capabilities.",1.0,0.9797363133360918,0.99999999998,1.0
