user_input,retrieved_contexts,response,reference,faithfulness,answer_relevancy,context_precision,context_recall
What accounting rules did Aramco say it followed for its mid-year interim financial report?,"['| (7,511)\n65,059 | | 53,059\n45,548 | 66,371 | 45,548\n\nSaudi Aramco Second quarter and half year interim report 2024 All amounts in millions of Saudi Riyals unless otherwise stated Notes to the condensed consolidated interim financial report 1. General information The Saudi Arabian Oil Company (the “Company”), with headquarters located in Dhahran, Kingdom of Saudi Arabia (the “Kingdom”), is engaged in prospecting, exploring, drilling and extracting hydrocarbon substances (“Upstream”) and processing, manufacturing, refining and marketing these hydrocarbon substances (“Downstream”). The Company was formed on November 13, 1988 by Royal Decree No. M/8; however, its history dates back to May 29, 1933 when the Saudi Arabian Government (the “Government”) granted a concession to the Company’s predecessor for the right\nto, among other things, explore the Kingdom for hydrocarbons. Effective January 1, 2018, the Council of Ministers Resolution No. 180, dated\n1/4/1439H (December 19, 2017), converted the Company to a Saudi Joint Stock Company with new Bylaws.\nOn December 11, 2019, the Company completed its Initial Public Offering (“IPO”) and its ordinary shares were listed on the Saudi Exchange. In\nconnection with the IPO, the Government, being the sole owner of the Company’s shares at such time, sold an aggregate of 3.45 billion ordinary shares, or 1.73% of the Company’s share capital.\nOn February 13, 2022, the Government transferred 4% of the Company\'s issued shares to the Public Investment Fund (""PIF""), the sovereign\nwealth fund of the Kingdom, followed by another transfer of 4% on April 16, 2023 to Saudi Arabian Investment Company (""Sanabil Investments""), a wholly-owned company of PIF. Further, on March 7, 2024, the Government announced the transfer of an additional 8% of the Company’s\nissued shares to PIF’s wholly-owned companies.\nOn June 11, 2024, the Government completed a secondary public offering of the Company’s ordinary shares. In connection with the offering, the\nGovernment sold an aggregate of approximately 1.7 billion shares, representing 0.7% of the Company’s issued shares. This includes 137.6 million\nordinary shares acquired by the Company from the Government for a cash payment of SAR 3,750, which have been classified as treasury shares.\nThese treasury shares will be used by the Company for its employee share plans. Following the completion of the offering, the Government remains the Company’s largest shareholder, retaining an 81.48% direct shareholding.\nThe condensed consolidated interim financial report of the Company and its subsidiaries (together “Saudi Aramco”) was approved by the Board of Directors on August 5, 2024.\n2. Basis of preparation and material accounting policy information\nThe condensed consolidated interim financial report has been prepared in accordance with International Accounting Standard 34 (“IAS 34”),\nInterim Financial Reporting, that is endorsed in the Kingdom, and other standards and pronouncements issued by the Saudi Organization for Chartered and Professional Accountants (“SOCPA”). The accounting policies used in the preparation of this condensed consolidated interim\nfinancial report are consistent with those set out in Saudi Aramco’s consolidated financial statements for the year ended December 31, 2023.\nThe results for the interim periods are unaudited and include all adjustments necessary for a fair presentation of the results for the periods presented. This condensed consolidated interim financial report should be read in conjunction with the consolidated financial statements and\nrelated notes for the year ended December 31, 2023, which have been prepared in accordance with International Financial Reporting Standards\n(“IFRS”) that are endorsed in the Kingdom, and other standards and pronouncements issued by SOCPA. The consolidated financial statements for the year ended December 31, 2023 are also in compliance with IFRS as issued by the International Accounting Standards Board (“IASB”).\nTranslations from SAR to USD presented as supplementary information in the condensed consolidated statement of income, condensed consolidated statement of comprehensive income, condensed consolidated balance sheet, condensed consolidated statement of changes in\nequity, and condensed consolidated statement of cash flows at June 30, 2024 and December 31, 2023 and for the three-month and six-month\nperiods ended June 30, 2024 and 2023, are for convenience and were calculated at the rate of USD 1.00 = SAR 3.75 representing the exchange\nrate at the balance sheet dates.\nNew or amended standards There are no amendments or interpretations that are effective for annual periods beginning on or after January 1, 2024 that have a material impact on the condensed consolidated interim financial report.\nSaudi Aramco has not early adopted any new', "") (165) (162)\nNet (purchases) maturities of short-term\ninvestments (1,898) (44,900) 43,341 (45,258) (506) (11,973) 11,558 (12,068)\nNet cash provided by (used in) investing\nactivities 2,442 (71,581) 22,015 (97,279) 652 (19,089) 5,872 (25,941)\nDividends (70,319) (87,713) (120,545) (173,963) (18,751) (23,390) (32,145) (46,390)\nDividends paid to non-controlling interests ‑ (22) (14) (22) ‑ (6) (4) (6)\nInterest paid (2,261) (1,432) (3,393) (2,376) (603) (382) (905) (634)\nProceeds from borrowings 1,466 46,555 9,925 47,963 390 12,414 2,646 12,790\nRepayments of borrowings (6,480) (4,091) (9,478) (5,939) (1,728) (1,090) (2,527) (1,583)\nNet cash used in financing activities (77,594) (46,703) (123,505) (134,337) (20,692) (12,454) (32,935) (35,823)\nNet (decrease) increase in cash and cash\nequivalents (28,842) (13,622) 28,887 (34,927) (7,691) (3,632) 7,704 (9,314)\nCash and cash equivalents at beginning of the\nperiod 235,435 161,847 177,706 183,152 62,783 43,159 47,388 48,841\nCash and cash equivalents at end of the\nperiod 206,593 148,225 206,593 148,225 55,092 39,527 55,092 39,527\n* Supplementary information is converted at a fixed rate of U.S. dollar 1.00 = SAR 3.75 for convenience only.\n\n� \\ -: l.'-''-'- Amin H. Nasser Khalid H. Al-Dabbagh Salah M. Al-Hareky Director, Senior Vice President, Controller President & Chief Executive Officer Finance, Strategy & Development Saudi Arabian Oil Company 15 Second quarter and half year interim report 2020 All amounts in millions of Saudi Riyals unless otherwise stated Notes to the condensed consolidated interim financial report 1. General information The Saudi Arabian Oil Company (the “Company”), with headquarters located in Dhahran, Kingdom of Saudi Arabia (the “Kingdom”), is engaged in prospecting, exploring, drilling and extracting hydrocarbon substances (“Upstream”) and processing, manufacturing, refining and marketing these hydrocarbon substances (“Downstream”). The Company was formed on November 13, 1988 by Royal Decree No. M/8; however, its history dates\nback to May 29, 1933 when the Saudi Arabian Government (the “Government”) granted a concession to the Company’s predecessor the right to,\namong other things, explore the Kingdom for hydrocarbons. Effective January 1, 2018, Council of Minister’s Resolution No. 180, dated 1/4/1439H\n(December 19, 2017), converted the Company to a Saudi Joint Stock Company with new Bylaws.\nOn December 11, 2019, the Company completed its Initial Public Offering (“IPO”) and its ordinary shares were listed on the Saudi Stock Exchange\n(“Tadawul”). In connection with the IPO, the Government sold an aggregate of 3.45 billion ordinary shares, or 1.73% of the Company’s share\ncapital.\nThe condensed consolidated interim financial report of the Company and its subsidiaries (together “Saudi Aramco”) was approved by the Board of Directors on August 7, 2020.\n2. Basis of preparation and other significant accounting policies\nThe condensed consolidated interim financial report has been prepared in accordance with International Accounting Standard 34 (“IAS 34”),\nInterim Financial Reporting, that is endorsed in the Kingdom, and other standards and pronouncements issued by the Saudi Organization for Certified Public Accountants (“SOCPA”). This condensed consolidated interim financial report is consistent with the accounting policies and methods of computation and presentation set out in Saudi Aramco’s December 31, 2019 consolidated financial statements, except for new and amended standards disclosed below.\nThe results for the interim periods are unaudited and include all adjustments necessary for a fair presentation of the results for the periods presented"", ""(194) 12,837 (12,262)\nNet cash (used in) provided by investing\nactivities (17,123) (31,136) 4,892 (128,415) (4,567) (8,303) 1,305 (34,244)\nDividends (70,320) (50,212) (190,865) (224,175) (18,752) (13,390) (50,897) (59,780)\nDividends paid to non-controlling interests (215) (14) (229) (36) (57) (4) (61) (10)\nInterest paid (2,599) (953) (5,992) (3,329) (693) (254) (1,598) (888)\nProceeds from borrowings 42,118 1,211 52,043 49,174 11,232 323 13,878 13,113\nRepayments of borrowings (31,286) (2,921) (40,764) (8,860) (8,343) (780) (10,870) (2,363)\nNet cash used in financing activities (62,302) (52,889) (185,807) (187,226) (16,613) (14,105) (49,548) (49,928)\nNet (decrease) increase in cash and cash\nequivalents (8,944) 23,617 19,943 (11,310) (2,386) 6,297 5,318 (3,017)\nCash and cash equivalents at beginning of the\nperiod 206,593 148,225 177,706 183,152 55,092 39,527 47,388 48,841\nCash and cash equivalents at end of the\nperiod 197,649 171,842 197,649 171,842 52,706 45,824 52,706 45,824\n* Supplementary information is converted at a fixed rate of U.S. dollar 1.00 = SAR 3.75 for convenience only.\n\n� \\ -: l.'-''-'- Amin H. Nasser Khalid H. Al-Dabbagh Salah M. Al-Hareky Director, Senior Vice President, Controller President & Chief Executive Officer Finance, Strategy & Development Third quarter and nine months interim report 2020 All amounts in millions of Saudi Riyals unless otherwise stated Notes to the condensed consolidated interim financial report 1. General information The Saudi Arabian Oil Company (the “Company”), with headquarters located in Dhahran, Kingdom of Saudi Arabia (the “Kingdom”), is engaged in prospecting, exploring, drilling and extracting hydrocarbon substances (“Upstream”) and processing, manufacturing, refining and marketing these hydrocarbon substances (“Downstream”). The Company was formed on November 13, 1988 by Royal Decree No. M/8; however, its history dates back to May 29, 1933 when the Saudi Arabian Government (the “Government”) granted a concession to the Company’s predecessor the right to,\namong other things, explore the Kingdom for hydrocarbons. Effective January 1, 2018, Council of Minister’s Resolution No. 180, dated 1/4/1439H\n(December 19, 2017), converted the Company to a Saudi Joint Stock Company with new Bylaws.\nOn December 11, 2019, the Company completed its Initial Public Offering (“IPO”) and its ordinary shares were listed on the Saudi Stock Exchange\n(“Tadawul”). In connection with the IPO, the Government sold an aggregate of 3.45 billion ordinary shares, or 1.73% of the Company’s share\ncapital.\nThe condensed consolidated interim financial report of the Company and its subsidiaries (together “Saudi Aramco”) was approved by the Board of Directors on November 2, 2020.\n2. Basis of preparation and other significant accounting policies\nThe condensed consolidated interim financial report has been prepared in accordance with International Accounting Standard 34 (“IAS 34”),\nInterim Financial Reporting, that is endorsed in the Kingdom, and other standards and pronouncements issued by the Saudi Organization for Certified Public Accountants (“SOCPA”). This condensed consolidated interim financial report is consistent with the accounting policies and methods of computation and presentation set out in Saudi Aramco’s December 31, 2019 consolidated financial statements, except for new and amended standards disclosed below.\nThe results for the interim periods are unaudited and include all adjustments necessary for a fair presentation of the results for the periods presented. This condensed consolidated interim financial report should be read in conjunction with the consolidated financial statements and\nrelated notes for the year ended December 31, 2019, which have been prepared in accordance with International Financial Reporting Standards\n(“IFRS”)"", '(495) (603)\nProceeds from sale of non-controlling equity interest in a subsidiary 58,125 15,500\nProceeds from issue of treasury shares 155 126 41 34\nProceeds from borrowings 15,708‑ 3,825 4,188‑ 1,020\nRepayments of borrowings (59,851) (33,278) (15,960) (8,875)\nPrincipal portion of lease payments (3,146) (3,049) (839) (813)\nInterest paid (2,204) (1,291) (587) (344)\nNet cash used in financing activities (124,344) (48,134) (33,159) (12,836)\nNet increase in cash and cash equivalents 114,627 58,291 30,567 15,544\nCash and cash equivalents at beginning of the period 226,047 299,579 60,279 79,888\nCash and cash equivalents at end of the period 340,674 357,870 90,846 95,432\n* This supplementary information is converted at a fixed rate of U.S. dollar 1.00 = SAR 3.75 for convenience only, and is presented in millions of U.S. dollars.\nAmin H. Nasser Ziad T. Al Murshed Bassam M. Asiri Director, Executive Vice President Senior Vice President President & Chief Executive Officer & Chief Financial Officer & Controller\n\n15,708‑ (59,851)\n(3,146)\n(2,204)\n(124,344)\n114,627 226,047\n340,674 61,129\n5,860 (2,925)\n(25)\n\n3,705 2,636\n(2,193)\n(1,159)\n\n(30,665)\n39,640 (8,746)\n(2,636)\n(28)\n\n1,816 (175)\n33,497 24,086\n(19,507)\n(495)\n\n4,188‑ (15,960)\n(839)\n(587)\n(33,159)\n30,567 60,279\n90,846\n\nSaudi Aramco First quarter interim report 2023 All amounts in millions of Saudi Riyals unless otherwise stated Notes to the condensed consolidated interim financial report 1.General information The Saudi Arabian Oil Company (the “Company”), with headquarters located in Dhahran, Kingdom of Saudi Arabia (the “Kingdom”), is engaged in prospecting, exploring, drilling and extracting hydrocarbon substances (“Upstream”) and processing, manufacturing, refining and marketing these hydrocarbon substances (“Downstream”). The Company was formed on November 13, 1988 by Royal Decree No. M/8; however, its history dates back to May 29, 1933 when the Saudi Arabian Government (the “Government”) granted a concession to the Company’s predecessor for the right\nto, among other things, explore the Kingdom for hydrocarbons. Effective January 1, 2018, Council of Minister’s Resolution No. 180, dated\n1/4/1439H (December 19, 2017), converted the Company to a Saudi Joint Stock Company with new Bylaws.\nOn December 11, 2019, the Company completed its Initial Public Offering (“IPO”) and its ordinary shares were listed on the Saudi Exchange. In\nconnection with the IPO, the Government, being the sole owner of the Company’s shares at such time, sold an aggregate of 3.45 billion ordinary shares, or 1.73% of the Company’s share capital.\nOn February 13, 2022, the Government transferred 4% of the Company’s issued shares to the Public Investment Fund (“PIF”), the sovereign\nwealth fund of the Kingdom. Subsequently, the Government announced on April 16, 2023, the transfer of 4% of the Company’s issued shares to\nSaudi Arabian Investment Company (“Sanabil Investments”), a wholly owned company of PIF. The Government remains the Company’s largest shareholder, retaining a 90.19% direct shareholding.\nThe condensed consolidated interim financial report of the Company and its subsidiaries (together “Saudi Aramco”) was approved by the Board of Directors on May 8, 2023.\n2.Basis of preparation and other significant accounting policies\nThe condensed consolidated interim financial report has been prepared in accordance with International Accounting Standard 34 (“IAS 34”),\nInterim Financial Reporting, that is endorsed in the Kingdom, and other standards and pronouncements issued by the Saudi Organization for Chartered and Professional Accountants (“SOCPA”). This condensed consolidated interim financial report is consistent with the accounting policies and methods of computation and presentation set out in Saudi Aramco’s consolidated financial statements for the year ended December\n31, 2022, except for new and amended standards disclosed below.\nThe results for the interim periods are una', '117)\n(309)\n(67)\n(11,737) | 88,015\n\n5,573 | | 10,977\n30 | | 114\n\n(651) | | (1,128)\n(84) | | (170)\n923 | | 1,623\n(67) | | (68)\n\n(23) | | 146\n\n81 | | 274\n\n(1,327) | | (3,160)\n(4,425) | | (10,686)\n(2,043) | | (2,581)\n(435) | | (643)\n1,805 | | 3,946\n602 | | 940\n\n(23) | | (289)\n\n201 | | 531\n(17,809) | | (31,451)\n30,063 | 12,349 | 56,542\n| (6,248)\n7,337\n\n(72)\n\n(148)\n(506) |\n(7,487) | | (15,687)\n\n109‑ | | 245‑\n\n(11) | | (47)\n\n68 | | 134\n5 | | (269)\n\n(173) | | 12\n| 652 |\n(7,422) | | (15,544)\n| (18,751)\n\n390‑ (790)‑\n(938)\n(603) |\n\n(18,754) | | (37,507)\n\n(649) | | (793)\n\n12,412 | | 12,412\n\n5,593 | | 6,231\n(6,137) | | (6,242)\n(826) | | (1,575)\n(817) | | (1,213)\n(9,152) | (20,692) | (28,635)\n| (7,691)\n62,783 |\n\n13,489 | | 12,363\n\n54,136 | | 55,262\n| 55,092 |\n67,625 | | 67,625\n\nSaudi Aramco 15 Second quarter and half year interim report 2021 All amounts in millions of Saudi Riyals unless otherwise stated Notes to the condensed consolidated interim financial report 1. General information The Saudi Arabian Oil Company (the “Company”), with headquarters located in Dhahran, Kingdom of Saudi Arabia (the “Kingdom”), is engaged in prospecting, exploring, drilling and extracting hydrocarbon substances (“Upstream”) and processing, manufacturing, refining and marketing these hydrocarbon substances (“Downstream”). The Company was formed on November 13, 1988 by Royal Decree No. M/8; however, its history dates\nback to May 29, 1933 when the Saudi Arabian Government (the “Government”) granted a concession to the Company’s predecessor the right to,\namong other things, explore the Kingdom for hydrocarbons. Effective January 1, 2018, Council of Minister’s Resolution No. 180, dated 1/4/1439H\n(December 19, 2017), converted the Company to a Saudi Joint Stock Company with new Bylaws.\nOn December 11, 2019, the Company completed its Initial Public Offering (“IPO”) and its ordinary shares were listed on the Saudi Stock Exchange\n(“Tadawul”). In connection with the IPO, the Government, being the sole owner of the Company’s shares at such time, sold an aggregate of 3.45 billion ordinary shares, or 1.73% of the Company’s share capital.\nThe condensed consolidated interim financial report of the Company and its subsidiaries (together “Saudi Aramco”) was approved by the Board of Directors on August 6, 2021.\n2. Basis of preparation and other significant accounting policies\nThe condensed consolidated interim financial report has been prepared in accordance with International Accounting Standard 34 (“IAS 34”),\nInterim Financial Reporting, that is endorsed in the Kingdom, and other standards and pronouncements issued by the Saudi Organization for Chartered and Professional Accountants (“SOCPA”). This condensed consolidated interim financial report is consistent with the accounting policies and methods of computation and presentation set out in Saudi Aramco’s December 31, 2020 consolidated financial statements, except for new and amended standards disclosed below.\nThe results for the interim periods are unaudited and include all adjustments necessary for a fair presentation of the results for the periods presented. This condensed consolidated interim financial report should be read in conjunction with the consolidated financial statements and\nrelated notes for the year ended December 31, 2020, which have been prepared in accordance with International Financial Reporting Standards\n(“IFRS”) that are endorsed in the Kingdom, and other standards and pronouncements issued by SOCPA. The consolidated financial statements for the year ended December 31, 2020 are also in compliance with IFRS as issued by the International Accounting Standards Board (“IASB”).\nTranslations from SAR to USD presented as supplementary', 'ities of short-term investments 83,585 125,611 22,289 33,497\nNet cash provided by investing activities 48,030 90,324 12,808 24,086\nDividends paid to shareholders of the Company 17 (116,503) (73,150) (31,067) (19,507)\nDividends paid to non-controlling interests in subsidiaries (4,214) (1,856) (1,124) (495)\nProceeds from issue of treasury shares 186 155 50 41\nProceeds from borrowings 2,788 15,708 743 4,188\nRepayments of borrowings (4,838) (59,851) (1,290) (15,960)\nPrincipal portion of lease payments (3,641) (3,146) (971) (839)\nInterest paid (2,778) (2,204) (741) (587)\nNet cash used in financing activities (129,000) (124,344) (34,400) (33,159)\nNet increase in cash and cash equivalents 44,999 114,627 12,000 30,567\nCash and cash equivalents at beginning of the period 198,973 226,047 53,059 60,279\nCash and cash equivalents at end of the period 243,972 340,674 65,059 90,846\n* This supplementary information is converted at a fixed rate of U.S. dollar 1.00 = SAR 3.75 for convenience only, and is presented in millions of U.S. dollars.\nAmin H. Nasser Ziad T. Al Murshed Bassam M. Asiri Director, Executive Vice President Senior Vice President President & Chief Executive Officer & Chief Financial Officer & Controller\n\nSaudi Aramco First quarter interim report 2024 All amounts in millions of Saudi Riyals unless otherwise stated Notes to the condensed consolidated interim financial report 1. General information The Saudi Arabian Oil Company (the “Company”), with headquarters located in Dhahran, Kingdom of Saudi Arabia (the “Kingdom”), is engaged in prospecting, exploring, drilling and extracting hydrocarbon substances (“Upstream”) and processing, manufacturing, refining and marketing these hydrocarbon substances (“Downstream”). The Company was formed on November 13, 1988 by Royal Decree No. M/8; however, its history dates back to May 29, 1933 when the Saudi Arabian Government (the “Government”) granted a concession to the Company’s predecessor for the right\nto, among other things, explore the Kingdom for hydrocarbons. Effective January 1, 2018, Council of Ministers Resolution No. 180, dated\n1/4/1439H (December 19, 2017), converted the Company to a Saudi Joint Stock Company with new Bylaws.\nOn December 11, 2019, the Company completed its Initial Public Offering (“IPO”) and its ordinary shares were listed on the Saudi Exchange. In\nconnection with the IPO, the Government, being the sole owner of the Company’s shares at such time, sold an aggregate of 3.45 billion ordinary shares, or 1.73% of the Company’s share capital.\nOn February 13, 2022, the Government transferred 4% of the Company\'s issued shares to the Public Investment Fund (""PIF""), the sovereign\nwealth fund of the Kingdom, followed by another transfer of 4% on April 16, 2023 to Saudi Arabian Investment Company (""Sanabil Investments""), a wholly-owned company of PIF. Further, on March 7, 2024, the Government announced the transfer of an additional 8% of the Company\'s\nissued shares to PIF’s wholly-owned companies. Following the transfers, the Government remains the Company\'s largest shareholder, retaining a 82.19% direct shareholding.\nThe condensed consolidated interim financial report of the Company and its subsidiaries (together “Saudi Aramco”) was approved by the Board of Directors on May 6, 2024.\n2. Basis of preparation and material accounting policy information\nThe condensed consolidated interim financial report has been prepared in accordance with International Accounting Standard 34 (“IAS 34”),\nInterim Financial Reporting, that is endorsed in the Kingdom, and other standards and pronouncements issued by the Saudi Organization for Chartered and Professional Accountants (“SOCPA”). This condensed consolidated interim financial report is consistent with the accounting policies and methods of computation and presentation set out in Saudi Aramco’s consolidated financial statements for the year ended December\n31, 2023.\nThe results for the interim periods are unaudited and include all adjustments necessary for a fair presentation of the results for the periods presented. This condensed consolidated interim financial report should be read in conjunction with the consolidated financial statements and\nrelated notes for the year ended December 31, 2023,', '| | 126\n251 | | 378\n(793) | | (1,284)\n(1,199) | | (1,355)\n786 | | 1,408\n(78) | | (82)\n\n(22) | | (20)\n(126) | | (85)\n\n(5,315) | | (11,085)\n(5,317) | | (21,458)\n(9,458) | | (12,100)\n513 | | (1,324)\n2,782 | | 8,266\n1,764 | | 8,439\n\n1,032 | | 863\n(122) | | (113)\n241 | | 603\n(34,732) | | (62,403)\n43,972 | 30,063 | 82,183\n| (7,487)\n\n(11)\n\n(173) |\n(9,358) | | (16,941)\n(107) | | (107)\n326 | | 521\n\n(216) | | (293)\n\n213 | | 341\n(28) | | (279)\n(15,997) | | (18,244)\n(25,089) | (7,422) | (34,920)\n| (18,754)\n(649)\n12,412\n\n5,593‑ (6,137)\n(826)\n(817) |\n(18,754) | | (37,509)\n\n(1,250) | | (1,853)\n\n| | 15,500\n(48) | | (48)\n36‑ | | 70\n270 | | 1,290\n(23,123) | | (31,998)\n(777) | | (1,590)\n(1,076) | | (1,420)\n(44,722) | (9,152) | (57,558)\n| 13,489 54,136 |\n(25,839) | | (10,295)\n95,432 | | 79,888\n69,593 | 67,625 | 69,593\n\nSaudi Aramco Second quarter and half year interim report 2022 All amounts in millions of Saudi Riyals unless otherwise stated Notes to the condensed consolidated interim financial report 1. General information The Saudi Arabian Oil Company (the “Company”), with headquarters located in Dhahran, Kingdom of Saudi Arabia (the “Kingdom”), is engaged in prospecting, exploring, drilling and extracting hydrocarbon substances (“Upstream”) and processing, manufacturing, refining and marketing these hydrocarbon substances (“Downstream”). The Company was formed\non November 13, 1988 by Royal Decree No. M/8; however, its history dates back to May 29, 1933 when the Saudi Arabian\nGovernment (the “Government”) granted a concession to the Company’s predecessor the right to, among other things, explore\nthe Kingdom for hydrocarbons. Effective January 1, 2018, Council of Minister’s Resolution No. 180, dated 1/4/1439H (December\n19, 2017), converted the Company to a Saudi Joint Stock Company with new Bylaws.\nOn December 11, 2019, the Company completed its Initial Public Offering (“IPO”) and its ordinary shares were listed on the\nSaudi Stock Exchange (“Tadawul”). In connection with the IPO, the Government, being the sole owner of the Company’s shares\nat such time, sold an aggregate of 3.45 billion ordinary shares, or 1.73% of the Company’s share capital.\nOn February 13, 2022, the Government transferred 8 billion ordinary shares, or 4% of the Company’s share capital, to the Public\nInvestment Fund (“PIF”), the sovereign wealth fund of the Kingdom. Following the transfer, the Government remains the Company’s largest shareholder, retaining a 94.19% direct shareholding.\nThe condensed consolidated interim financial report of the Company and its subsidiaries (together “Saudi Aramco”) was\napproved by the Board of Directors on August 12, 2022.\n2. Basis of preparation and other significant accounting policies The condensed consolidated interim financial report has been prepared in accordance with International Accounting Standard\n34 (“IAS 34”), Interim Financial Reporting, that is endorsed in the Kingdom, and other standards and pronouncements issued by\nthe Saudi Organization for Chartered and Professional Accountants (“SOCPA”). This condensed consolidated interim financial report is consistent with the accounting policies and methods of computation and presentation set out in Saudi Aramco’s\nconsolidated financial statements for the year ended December 31, 2021, except for new and amended standards disclosed\nbelow.\nThe results for the interim periods are unaudited and include all adjustments necessary for a fair presentation of the results for the periods presented. This condensed consolidated interim financial report should be', 'its ordinary shares were listed on the Saudi Exchange. In\nconnection with the IPO, the Government, being the sole owner of the Company’s shares at such time, sold an aggregate of 3.45 billion ordinary shares, or 1.73% of the Company’s share capital.\nOn February 13, 2022, the Government transferred 4% of the Company’s issued shares to the Public Investment Fund (“PIF”), the sovereign\nwealth fund of the Kingdom. Subsequently, the Government announced on April 16, 2023, the transfer of 4% of the Company’s issued shares to\nSaudi Arabian Investment Company (“Sanabil Investments”), a wholly owned company of PIF. The Government remains the Company’s largest shareholder, retaining a 90.19% direct shareholding.\nThe condensed consolidated interim financial report of the Company and its subsidiaries (together “Saudi Aramco”) was approved by the Board of Directors on August 6, 2023.\n2. Basis of preparation and other significant accounting policies\nThe condensed consolidated interim financial report has been prepared in accordance with International Accounting Standard 34 (“IAS 34”),\nInterim Financial Reporting, that is endorsed in the Kingdom, and other standards and pronouncements issued by the Saudi Organization for Chartered and Professional Accountants (“SOCPA”). This condensed consolidated interim financial report is consistent with the accounting policies and methods of computation and presentation set out in Saudi Aramco’s consolidated financial statements for the year ended\nDecember 31, 2022, except for new and amended standards disclosed below.\nThe results for the interim periods are unaudited and include all adjustments necessary for a fair presentation of the results for the periods presented. This condensed consolidated interim financial report should be read in conjunction with the consolidated financial statements and\nrelated notes for the year ended December 31, 2022, which have been prepared in accordance with International Financial Reporting Standards\n(“IFRS”) that are endorsed in the Kingdom, and other standards and pronouncements issued by SOCPA. The consolidated financial statements for the year ended December 31, 2022 are also in compliance with IFRS as issued by the International Accounting Standards Board (“IASB”).\nTranslations from SAR to USD presented as supplementary information in the condensed consolidated statement of income, condensed consolidated statement of comprehensive income, condensed consolidated balance sheet, condensed consolidated statement of changes in\nequity, and condensed consolidated statement of cash flows at June 30, 2023 and December 31, 2022 and for the three-month and six-month\nperiods ended June 30, 2023 and 2022, are for convenience and were calculated at the rate of USD 1.00 = SAR 3.75 representing the exchange\nrate at the balance sheet dates.\nNew or amended standards (i) Saudi Aramco adopted the following IASB pronouncements, as endorsed in the Kingdom, effective for annual periods beginning on or after January 1, 2023:\nAmendment to IAS 12, Income Taxes\nIn May 2023, the IASB issued an amendment to IAS 12, Income Taxes, relating to the International Tax Reform - Pillar Two Model Rules. This\namendment applies to income taxes arising from tax law enacted or substantively enacted to implement the Pillar Two model rules published by the Organisation for Economic Co-operation and Development (“OECD”), including tax law that implements qualified domestic minimum top-up taxes described in those rules. The amendment requires entities to make additional disclosures in their annual financial statements regarding their current tax exposure to pillar two income taxes. Further, as required by the amendment, Saudi Aramco has applied the mandatory temporary exception to neither recognize nor disclose information about deferred tax assets and liabilities related to Pillar Two income taxes.\n\nSaudi Aramco Second quarter and half year interim report 2023 All amounts in millions of Saudi Riyals unless otherwise stated 2. Basis of preparation and other significant accounting policies continued IFRS 17, Insurance Contracts\nIn May 2017, the IASB issued IFRS 17, Insurance Contracts, which introduces a new comprehensive accounting model for insurance contracts, and\nsets out the principles for the recognition, measurement, presentation and disclosure for the issuers of those contracts. The new standard replaces IFRS 4, Insurance Contracts, that was issued in 2005, and allowed insurers to use a range of different accounting treatments for insurance contracts. There is no material impact on the condensed consolidated interim financial report from the adoption of IFRS 17.\nThere are no other amendments or interpretations that are effective for annual periods beginning on or after January 1, 2023 that have a material impact on the condensed consolidated interim financial report.\n(ii) Saudi Aramco has not early adopted any new accounting standards, interpretations or amendments that are issued but not yet effective.\n3. Fair value estimation Fair value is the price that would be received to sell an asset or paid to transfer a liability in an orderly transaction between', 'CPA”).\nincluding with respect to SABIC;\nthe industries in which it operates may differ significantly from those made • Aramco’s dependence on the reliability In addition, this document includes in or suggested by these forward- and security of its IT systems; certain “non-IFRS financial measures.”\nlooking statements. In addition, even • Managing Aramco’s subsidiaries, joint These measures are not recognized if Aramco’s financial position, results operations, joint ventures, associates measures under IFRS and do not have of operations and business and the and entities in which it holds a standardized meanings prescribed development of the industries in which minority interest; by IFRS. Rather, these measures are it operates are consistent with these provided as additional information to\n• Aramco’s exposure to interest rate risk forward-looking statements, those complement IFRS measures by providing and foreign exchange risk;\nresults or developments may not be further understanding of Aramco’s indicative of results or developments in • Risks related to operating in a results of operations, cash flow and subsequent periods. regulated industry and changes financial position from management’s to oil, gas, environmental or other perspective. Accordingly, they should Factors that could cause actual results regulations that impact the industries not be considered in isolation or as in which Aramco operates;\nto differ materially from Aramco’s a substitute for analysis of Aramco’s expectations are contained in • Risks related to litigation, including financial information reported under cautionary statements in this Interim international trade litigation, disputes IFRS.\nReport and include, among other or agreements; and things, the following: A reconciliation of non-IFRS measures\n• Risks related to the Kingdom.\nis included in the Non-IFRS measures\n• Supply, demand and price fluctuations reconciliations and definitions section of Disclaimer – Risk Factors with respect to oil and gas, and this Interim Report.\nAramco’s other products;\nFor a discussion of our risk factors,\n• Global economic market conditions; please see Aramco’s Annual Report\n• Natural disasters and public health 2022, available through the investor pandemics or epidemics (such as relations section of Aramco’s website at COVID-19), and weather conditions www.aramco.com/en/investors/reports- (including those associated with and-presentations.\nclimate change);\nWe undertake no obligation to\n• Competition in the industries in which update or revise any forward-looking Aramco operates;\n\nReport on review of condensed consolidated interim financial report To the shareholders of Saudi Arabian Oil Company Introduction We have reviewed the accompanying condensed consolidated balance sheet of Saudi Arabian Oil Company and its subsidiaries as at June 30, 2023 and the related condensed consolidated statements of income, comprehensive income and cash flows for the three-month and six-month periods then ended and the condensed consolidated statement of changes in equity for the six-month period then ended and other explanatory notes (the “condensed consolidated interim financial report”). Management is responsible for the preparation and presentation of this condensed consolidated interim financial report in accordance with International Accounting Standard 34, ‘Interim Financial Reporting’, that is endorsed in the Kingdom\nof Saudi Arabia. Our responsibility is to express a conclusion on this condensed consolidated interim financial report based on our review.\nScope of review We conducted our review in accordance with International Standard on Review Engagements 2410, ‘Review of interim financial information performed by the independent auditor of the entity’, that is endorsed in the Kingdom of Saudi Arabia. A review of interim financial information consists of making inquiries, primarily of persons responsible for financial and accounting matters, and applying analytical and other review procedures. A review is substantially less in scope than an audit conducted in accordance with International Standards on Auditing, that are endorsed in the Kingdom of Saudi Arabia, and consequently does not enable us to obtain assurance that we would become aware of all significant matters that might be identified in an audit. Accordingly, we do not express an audit opinion.\nConclusion Based on our review, nothing has come to our attention that causes us to believe that the accompanying condensed consolidated interim financial report is not prepared, in all material respects, in accordance with International Accounting Standard 34, ‘Interim Financial Reporting’, that is endorsed in the Kingdom of Saudi Arabia.\nPricewaterhouse Coopers Omar M. Al Sagga License No. 369 August 6, 2023\nPricewaterhouse Coopers, License No. 25, Saudi Aramco, P.O. Box 1659, Dhahran 31311, Kingdom of Saudi Arabia\nT: +966 (13) 873-6800, F: +966 (13) 873-8883, www.pwc.com/middle-east\n\nSaudi Aramco Second quarter and half year interim report 2023 All amounts in millions of Saudi Riyals unless otherwise stated Condensed consolidated statement of income SAR USD* 2nd quarter 2nd quarter Six months Six months 2nd quarter 2nd quarter Six months Six months Note 2023 2022', ',771\nCash and cash equivalents at end of the period 230,813 202,698 61,550 54,053\n* This supplementary information is converted at a fixed rate of U.S. dollar 1.00 = SAR 3.75 for convenience only, and is presented in millions of U.S. dollars.\nAmin H. Nasser Ziad T. Al Murshed Bassam M. Asiri Director, Executive Vice President Senior Vice President President & Chief Executive Officer & Chief Financial Officer & Controller All amounts in millions of Saudi Riyals unless otherwise stated Notes to the condensed consolidated interim financial report 1. General information The Saudi Arabian Oil Company (the “Company”), with headquarters located in Dhahran, Kingdom of Saudi Arabia (the “Kingdom”), is engaged in prospecting, exploring, drilling and extracting hydrocarbon substances (“Upstream”) and processing, manufacturing, refining\nand marketing these hydrocarbon substances (“Downstream”). The Company was formed on November 13, 1988, by Royal Decree No. M/8;\nhowever, its history dates back to May 29, 1933, when the Saudi Arabian Government (the “Government”) granted a concession to the\nCompany’s predecessor for the right to, among other things, explore the Kingdom for hydrocarbons. Effective January 1, 2018, the Council of\nMinisters Resolution No. 180, dated 1/4/1439H (December 19, 2017), converted the Company to a Saudi Joint Stock Company with new\nBylaws.\nOn December 11, 2019, the Company completed its Initial Public Offering (“IPO”) and its ordinary shares were listed on the Saudi\nExchange. In connection with the IPO, the Government, being the sole owner of the Company’s shares at such time, sold an aggregate\nof 3.45 billion ordinary shares, or 1.73% of the Company’s share capital.\nOn February 13, 2022, the Government transferred 4% of the Company’s issued shares to the Public Investment Fund (“PIF”), the\nsovereign wealth fund of the Kingdom, followed by another transfer of 4% on April 16, 2023, to Saudi Arabian Investment Company\n(“Sanabil Investments”), a wholly-owned company of PIF. Further, on March 7, 2024, the Government transferred an additional 8% of the Company’s issued shares to PIF’s wholly-owned companies.\nOn June 11, 2024, the Government completed a secondary public offering of the Company’s ordinary shares. In connection with this\nsecondary offering, the Government sold an aggregate of approximately 1.7 billion shares, representing 0.7% of the Company’s issued\nshares. This included 137.6 million ordinary shares acquired by the Company from the Government for a cash payment of ﷼ 3,750,\nwhich have been classified as treasury shares. These treasury shares are being used by the Company for its employee share plans. As at\nMarch 31, 2026, the Government remains the Company’s largest shareholder, retaining an 81.48% direct shareholding.\nOn March 9, 2026, the Board of Directors approved the repurchase of up to 350 million of the Company’s ordinary shares from the\nmarket over a period of 18 months from the approval date, up to a maximum total spend of ﷼ 11,250. The shares repurchased will be\nclassified as treasury shares, and the Company may retain them for a maximum period of 10 years from the date of purchase without\nsale or allocation. The shares repurchased will primarily be used by the Company for its employee share plans. As of March 31, 2026,\nthe Company had repurchased an aggregate of 9.9 million shares from the market for a cash payment of ﷼ 266.\nThe condensed consolidated interim financial report of the Company and its subsidiaries (together “Saudi Aramco”) was approved by the Board of Directors on May 7, 2026.\n2. Basis of preparation and material accounting policy information The condensed consolidated interim financial report has been prepared in accordance with International Accounting Standard 34 (“IAS 34”), Interim Financial Reporting, that is endorsed in the Kingdom, and other standards and pronouncements issued by the Saudi\nOrganization for Chartered and Professional Accountants (“SOCPA”). The accounting policies used in the preparation of this condensed consolidated interim financial report are consistent with those set out in Saudi Aramco’s consolidated financial statements\nfor the year ended December 31, 2025.\nThe results for the interim periods are unaudited and include all adjustments necessary for a fair presentation of the results for the periods presented. This condensed consolidated interim financial report should be read in conjunction with the consolidated financial\nstatements and related notes for the year ended December 31, 2025, which have been prepared in accordance with International\nFinancial Reporting']","Saudi Aramco stated that its condensed consolidated interim financial report has been prepared in accordance with International Accounting Standard 34 (“IAS 34”), Interim Financial Reporting, which is endorsed in the Kingdom. Additionally, it follows other standards and pronouncements issued by the Saudi Organization for Chartered and Professional Accountants (“SOCPA”) (Saudi Aramco Second quarter and half year interim report 2024, Section 2).","The report was prepared under IAS 34 as endorsed in Saudi Arabia, together with standards and pronouncements issued by SOCPA. It was also intended to be read alongside the 2020 annual consolidated financial statements prepared under IFRS endorsed in the Kingdom.",1.0,0.7907298977573757,0.99999999999,0.5
How does Aramco treat contracts that give it control over an asset for a period of time?,"['18 months from the Board’s approval date, up to a maximum total spend of ﷼ 11.3 billion ($3.0 billion). The shares\nrepurchased will be classified as treasury shares and will primarily be used by the Company for its employee share plans. The Company intends to complete the repurchase through one or more transactions, and may retain the shares for a maximum period of 10 years from the date of purchase without sale or allocation.\nMaterial agreements Aramco has entered into a number of agreements for the purposes of its business. The following is a summary of those agreements that Aramco considers material to its business. Aramco believes that all such agreements, in addition to the key provisions thereunder, have been included in this section and that there are no other agreements that are material in the context of its business. These summaries do not purport to describe all the applicable terms and conditions of such agreements and are qualified in their entirety by the respective agreements.\nThe Concession Background\nThe Arabian American Oil Company Concession Agreement, which was entered into on 4/2/1352H (corresponding to May 29, 1933) was\nratified on 14/3/1352H (corresponding to July 7, 1933) pursuant to Royal Decree No. 1135, pursuant to which the Government granted\nArabian American Oil Company predecessors certain exclusive rights, including the right to explore, drill, recover, and treat crude oil and other hydrocarbons located within certain areas of the Kingdom. Pursuant to Royal Decree No. M/8 dated 4/4/1409H (corresponding to November 13, 1988) approving Aramco’s original articles, Aramco enjoyed all the privileges and rights provided under the Original\nConcession Agreement (the “Original Concession”). Pursuant to Royal Decree No. M/38, effective 6/4/1439H (corresponding to December 24,\n2017), the Government, represented by the Minister of Energy, and Aramco entered into the Concession Agreement (the “Concession”),\nwhich replaced and superseded in its entirety the Original Concession on such date (the “Concession Effective Date”). Further, on 20/1/1441H\n(corresponding to September 19, 2019), and in accordance with the Hydrocarbons Law, the Government, represented by the Minister of Energy, and Aramco entered into an amendment to the Concession (the “Concession Amendment”), with effect from January 1, 2020.\n\nAramco overview Results and Sustainability Risk Organizational structure Additional financial Consolidated and strategy performance and corporate governance and legal information financial statements All amounts in millions unless otherwise stated Grant of rights The Concession grants Aramco the following rights to be exercised during the term of the Concession:\n• The exclusive right to explore, drill, prospect, appraise, develop, extract, recover, and produce hydrocarbons in the Concession Area;\n• The non-exclusive right to manufacture, refine, treat, market, sell, transport, and export hydrocarbons and their derivatives extracted, recovered, developed, produced, treated, refined, consumed, transported, manufactured, marketed, sold, exported, or dealt with in any other way by Aramco or on its behalf pursuant to the rights granted to Aramco in the Concession;\n• The exclusive right to market and distribute hydrocarbons, petroleum products, and LPG in the Kingdom, with Aramco’s commitment to meeting all the domestic market’s needs for such products in accordance the consumption requirements thereof through domestic production or imports in accordance with laws issued by the Government;\n• The right to build, own, and operate relevant facilities and assets as may be necessary or desirable to perform Aramco’s operations within the Reserved Areas;\n• Certain rights related to lands, such as use of land, easements, water rights, right-of-way, and other suitable rights of any part of the Concession Areas, that are outside the Reserved Area, designated in connection with Aramco’s operations and transportation of products and free access to and use of any part of the Reserved Area;\n• The right to purchase, lease, import or otherwise obtain all materials, equipment, and any other supplies required for Aramco’s operations;\n• The right to conduct such other activity related to the foregoing subject to the provisions of the Concession and applicable law; and,\n• The right to receive Government assistance in securing the rights granted in the Concession, without prejudice to the foregoing, obtaining permits, licenses, and other special approvals and obtaining access, rights of way, and water rights from third parties necessary for Aramco’s operations.\nUnder the Concession, Aramco is required to obtain the necessary licenses, permits, and approvals that may be required pursuant to the Hydrocarbons Law, the Law of Gas Supplies and Pricing (which was superseded', 'capital is sixty billion Saudi Riyals (SAR 60,000,000,000),\nconsisting of two hundred billion (200,000,000,000) fully paid ordinary shares with no par value. Aramco’s primary operating segments are Upstream and Downstream, which are supported by corporate activities (for further details please refer to Section 3:\nResults and performance).\nOn December 11, 2019, the Company completed its IPO and its ordinary shares were listed on Tadawul. In connection with the\nIPO, the Government, being the sole owner of the Company’s shares at such time, sold 3.45 billion ordinary shares, or 1.73% of the\nCompany’s share capital. In addition, concurrent with the IPO, the Company acquired 117.2 million of its ordinary shares from the Government for a cash payment of SAR 3,750 million which are being classified as treasury shares. These shares are for use by the\nCompany for its employee share plans. On February 13, 2022, the Government announced the transfer of 4% of the Company’s total\nshare capital to the Public Investment Fund (PIF). Therefore, the current ownership of the Government in the Company is 94.19%.\nMaterial agreements Aramco has entered into a number of agreements for the purposes of its business. The following is a summary of those agreements that Aramco considers material to its business. Aramco believes that all such agreements, in addition to the key provisions thereunder, have been included in this section and that there are no other agreements that are material in the context of its business. These summaries do not purport to describe all the applicable terms and conditions of such agreements and are qualified in their entirety by the respective agreements.\nThe Concession Background\nThe Arabian American Oil Company Concession Agreement was ratified on 4/2/1352H (corresponding to May 29, 1933) and granted\nArabian American Oil Company certain exclusive rights, including the right to explore, drill, recover and treat crude oil and other hydrocarbons located within certain areas of the Kingdom (which were revised and grew over time), with limited territorial exceptions.\nPursuant to Royal Decree No. M/8 dated 4/4/1409H (corresponding to November 13, 1988) approving Aramco’s original articles,\nAramco enjoyed all the privileges and rights provided under the Arabian American Oil Company Concession Agreement, and all subsequent supplementary documents, agreements, Governmental orders and decisions in connection therewith (collectively, the\n“Original Concession”). Effective 6/4/1439H (corresponding to December 24, 2017), and in accordance with the Hydrocarbons Law,\nthe Government, represented by the Minister of MEIM (predecessor to the Minister of Energy), and Aramco entered into the revised\nConcession Agreement (the “Concession”), which was adopted under Royal Decree No. (M/12) dated 18/1/1441H (corresponding\nto September 17, 2019) and replaced and superseded in its entirety the Original Concession on such date (the “Concession\nEffective Date”). Further, on 20/1/1441H (corresponding to September 19, 2019), and in accordance with the Hydrocarbons Law,\nthe Government, represented by the Minister of Energy, and Aramco entered into an amendment to the Concession, with effect from January 1, 2020) (the “Concession Amendment”).\nGrant of rights The Government grants Aramco the following rights to be exercised at Aramco’s own responsibility during the term of the Concession:\n• The exclusive right to explore, drill, prospect, appraise, develop, extract, recover and produce hydrocarbons in the Concession Area;\n• The non-exclusive right to manufacture, refine and treat production and to market, sell, transport and export such production;\n• The exclusive right to market and distribute hydrocarbons, petroleum products and LPG in the Kingdom, with Aramco’s commitment to meeting all the domestic needs for such products in accordance with the consumption requirements thereof through domestic production or imports in accordance with laws issued by the Government;\n• The right to build, own and operate relevant facilities and assets as may be necessary or desirable to perform Aramco’s operations within the Reserved Areas;\n• Certain rights to acquire and use land, water and other natural products in connection with Aramco’s operations;\n• The right to purchase, lease, import or otherwise obtain all materials, equipment and any other supplies required for Aramco’s operations;\n• The right to conduct such other activity related to the foregoing subject to the provisions of the Concession and applicable law; and\n• The right to receive Government assistance in securing the rights granted in the Concession, obtaining permits, licenses and', 'ATED\n\nAND STRATEGY PERFORMANCE 3. SUSTAINABILITY 4. RISK GOVERNANCE INFORMATION STATEMENTS All amounts in millions unless otherwise stated Grant of rights The Concession grants Aramco the following rights to be exercised during the term of the Concession:\n• The exclusive right to explore, drill, prospect, appraise, develop, extract, recover, and produce hydrocarbons in the Concession Area;\n• The non-exclusive right to manufacture, refine, treat, market, sell, transport, and export hydrocarbons and their derivatives extracted, recovered, developed, produced, treated, refined, consumed, transported, manufactured, marketed, sold, exported, or dealt with in any other way by Aramco or on its behalf pursuant to the rights granted to Aramco in the Concession;\n• The exclusive right to market and distribute hydrocarbons, petroleum products, and LPG in the Kingdom, with Aramco’s commitment to meeting all the domestic market’s needs for such products in accordance the consumption requirements thereof through domestic production or imports in accordance with laws issued by the Government;\n• The right to build, own, and operate relevant facilities and assets as may be necessary or desirable to perform Aramco’s operations within the Reserved Areas;\n• Certain rights related to lands, such as use of land, easements, water rights, right-of-way, and other suitable rights of any part of the Concession Areas, that are outside the Reserved Area, designated in connection with Aramco’s operations and transportation of products and free access to and use of any part of the Reserved Area;\n• The right to purchase, lease, import or otherwise obtain all materials, equipment, and any other supplies required for Aramco’s operations;\n• The right to conduct such other activity related to the foregoing subject to the provisions of the Concession and applicable law; and,\n• The right to receive Government assistance in securing the rights granted in the Concession, without prejudice to the foregoing, obtaining permits, licenses, and other special approvals and obtaining access, rights of way, and water rights from third parties necessary for Aramco’s operations.\nUnder the Concession, Aramco is required to obtain the necessary licenses, permits, and approvals that may be required pursuant to the Hydrocarbons Law, the Law of Gas Supplies and Pricing (which was superseded by the Energy Supply Law), and the regulations issued pursuant to these laws. All hydrocarbons in the Kingdom are owned by the Kingdom, and upon extraction or recovery of such hydrocarbons by Aramco, title to such hydrocarbons shall automatically pass to Aramco at the ownership transfer point. Aramco has no rights to any natural resources existing in the Concession Area other than hydrocarbons except as otherwise provided in the Concession.\nThe rights granted to Aramco under the Concession are subject to the Hydrocarbons Law and other applicable law and regulation, including production decisions issued by the Government pursuant to its sovereign authority. Aramco may not sell to any entity any hydrocarbons or derivatives therefrom obtained pursuant to the Concession in violation of decisions the Government considers necessary for the protection of supreme security interests for the Kingdom in times of war or other emergency in international relations.\nTerm The Concession will remain effective for 40 years from the Concession Effective Date, unless terminated earlier in accordance with its terms.\nThe Government will issue a decision to extend the Concession for a period of 20 years on the 30th anniversary of the Concession Effective Date, provided it becomes clear to the Government that Aramco has fulfilled the following conditions: (a) Aramco has exerted reasonable efforts to maximize reserves and their recovery in the Concession Area, taking into consideration production decisions and hydrocarbons market conditions; (b) Aramco has conducted its operations in a manner that (i) is economically efficient, (ii) enhances the productivity of the reservoirs in the long-term in the Concession Area, and (iii) supports good management of hydrocarbons, in all cases, according to the Hydrocarbons Law; and, (c) Aramco generally has conducted its activities and operations in the Kingdom in an economically efficient manner thereby enhancing the efficiency of the Kingdom’s economy.\nIf the Concession is extended as described in the previous paragraph, the Concession may be amended and extended for an additional intent to extend the Concession, at any time from the beginning of the 50th anniversary until the end of the 53rd anniversary of the Concession Effective Date, provided that the parties undertake exclusive negotiations for a two-year period (which may be extended or reduced by mutual agreement of the parties), commencing at the end of the 53rd anniversary of the Concession Effective Date, to reach an agreement on the terms and conditions of such amendment and extension. If the Government and Aramco are unable to reach agreement on the amendment and extension during such exclusive negotiation period, and the Government elects to negotiate with any third-party to enter', 'official\nname. Its registered head office is located at P.O. Box 5000, Dhahran 31311, Kingdom of Saudi Arabia. Its share capital is seventy\nfive billion Saudi Riyals (SAR 75,000,000,000), consisting of two hundred and twenty billion (220,000,000,000) fully paid ordinary\nshares with no par value. Aramco’s primary operating segments are Upstream and Downstream, which are supported by corporate activities (for further details refer to Section 2: Results and performance).\nOn December 11, 2019, the Company completed its IPO and its ordinary shares were listed on Saudi Exchange (The Exchange).\nIn connection with the IPO, the Government, being the sole owner of the Company’s shares at such time, sold 3.45 billion\nordinary shares, or 1.73% of the Company’s share capital. In addition, concurrent with the IPO, the Company acquired 117.2\nmillion of its ordinary shares from the Government for a cash payment of SAR 3,750 million which are being classified as treasury\nshares. These shares are for use by the Company for its employee share plans. On February 13, 2022, the Government announced\nthe transfer of 4% of the Company’s total share capital to the Public Investment Fund (PIF). Therefore, the current ownership of the Government in the Company is 94.19%.\nIn May 2022, the Extraordinary General Assembly approved the granting and distribution of one bonus share for every ten shares\nheld by the shareholders. This resulted in an increase of issued ordinary shares from 200 billion to 220 billion and the share\ncapital of the Company from SAR 60.0 billion to SAR 75.0 billion.\nMaterial agreements Aramco has entered into a number of agreements for the purposes of its business. The following is a summary of those agreements that Aramco considers material to its business. Aramco believes that all such agreements, in addition to the key provisions thereunder, have been included in this section and that there are no other agreements that are material in the context of its business. These summaries do not purport to describe all the applicable terms and conditions of such agreements and are qualified in their entirety by the respective agreements.\nThe Concession Background\nThe Arabian American Oil Company Concession Agreement was ratified on 4/2/1352H (corresponding to May 29, 1933) and\ngranted Arabian American Oil Company certain exclusive rights, including the right to explore, drill, recover and treat crude oil and other hydrocarbons located within certain areas of the Kingdom (which were revised and grew over time), with limited\nterritorial exceptions. Pursuant to Royal Decree No. M/8 dated 4/4/1409H (corresponding to November 13, 1988) approving\nAramco’s original articles, Aramco enjoyed all the privileges and rights provided under the Arabian American Oil Company Concession Agreement, and all subsequent supplementary documents, agreements, Governmental orders and decisions in\nconnection therewith (collectively, the “Original Concession”). Effective 6/4/1439H (corresponding to December 24, 2017), and\nin accordance with the Hydrocarbons Law, the Government, represented by the Minister of MEIM (predecessor to the Minister of Energy), and Aramco entered into the revised Concession Agreement (the “Concession”), which was adopted under Royal Decree\nNo. (M/38) dated 6/4/1439H (corresponding to December 24, 2017) and replaced and superseded in its entirety the Original\nConcession on such date (the “Concession Effective Date”). Further, on 20/1/1441H (corresponding to September 19, 2019), and\nin accordance with the Hydrocarbons Law, the Government, represented by the Minister of Energy, and Aramco entered into an amendment to the Concession, with effect from January 1, 2020) (the “Concession Amendment”).\nGrant of rights The Government grants Aramco the following rights to be exercised at Aramco’s own risk during the term of the Concession:\n• The exclusive right to explore, prospect, drill, appraise, develop, extract, recover and produce hydrocarbons in the Concession Area;\n• The non-exclusive right to manufacture, refine, treat, market, sell, transport and export hydrocarbons and their derivatives extracted, recovered, developed, produced, treated, refined, consumed, transported, manufactured, marketed, sold, exported or dealt with in any other way by Aramco or on its behalf pursuant to the rights granted to Aramco in the Concession;\n• The exclusive right to market and distribute hydrocarbons, petroleum products and LPG in the Kingdom, with Aramco’s', 'was established in the Kingdom as a company with limited liability by virtue of Royal Decree No. M/8 dated 4/4/1409H\n(corresponding to November 13, 1988) to assume the privileges and rights of its predecessor. On January 1, 2018, the Company was\nconverted into a joint stock company pursuant to Council of Ministers Resolution No. 180 dated 1/4/1439H (corresponding to December\n19, 2017) and registered in the city of Dhahran under commercial registration No. 2052101150 dated 11/07/1439H (corresponding to\nMarch 28, 2018) with Saudi Arabian Oil Company as its official name. Its registered head office is located at P.O. Box 5000, Dhahran\n31311, Kingdom of Saudi Arabia. Its share capital is sixty billion Saudi Riyals (SAR 60,000,000,000), consisting of two hundred billion\n(200,000,000,000) fully paid ordinary shares with no par value. Aramco’s primary operating segments are Upstream and Downstream, which are supported by corporate activities (for further details please refer to Section 3: Results and performance).\nOn December 11, 2019, the Company completed its IPO and its ordinary shares were listed on Tadawul. In connection with the IPO, the\nGovernment, being the sole owner of the Company’s shares at such time, sold 3.45 billion ordinary shares, or 1.73% of the Company’s\nshare capital. In addition, concurrent with the IPO, the Company acquired 117.2 million of its ordinary shares from the Government for a cash payment of SAR 3,750 million which are being classified as treasury shares. These shares are for use by the Company for its\nemployee share plans.\nMaterial agreements Aramco has entered into a number of agreements for the purposes of its business. The following is a summary of those agreements that Aramco considers material to its business. Aramco believes that all such agreements, in addition to the key provisions thereunder, have been included in this section and that there are no other agreements that are material in the context of its business. These summaries do not purport to describe all the applicable terms and conditions of such agreements and are qualified in their entirety by the respective agreements.\nThe Concession Background\nThe Arabian American Oil Company Concession Agreement was ratified on 4/2/1352H (corresponding to May 29, 1933) and granted\nAramco’s predecessor certain exclusive rights, including the right to explore, drill, recover and treat crude oil and other hydrocarbons located within certain areas of the Kingdom (which were revised and grew over time), with limited territorial exceptions. Pursuant to\nRoyal Decree No. M/8 dated 4/4/1409H (corresponding to November 13, 1988) approving Aramco’s original articles, Aramco enjoyed\nall the privileges and rights provided under the Arabian American Oil Company Concession Agreement, and all subsequent supplementary documents, agreements, governmental orders and decisions in connection therewith (collectively, the “Original\nConcession”). Effective 6/4/1439H (corresponding to December 24, 2017), and in accordance with the Hydrocarbons Law, the\nGovernment, represented by the Minister of MEIM (predecessor to the Minister of Energy), and Aramco entered into the revised\nConcession Agreement (the “Concession”), which was adopted under Royal Decree No. (M/12) dated 18/1/1441H (corresponding to\nSeptember 17, 2019) and replaced and superseded in its entirety the Original Concession on such date (the “Concession Effective\nDate”). Further, on 20/1/1441H (corresponding to September 19, 2019), and in accordance with the Hydrocarbons Law, the\nGovernment, represented by the Minister of Energy, and Aramco entered into an amendment to the Concession, with effect from January 1, 2020) (the “Concession Amendment”).\nGrant of rights The Government grants Aramco the following rights to be exercised at Aramco’s own responsibility during the term of the Concession:\n• the exclusive right to explore, drill, prospect, appraise, develop, extract, recover and produce hydrocarbons in the Concession Area;\n• the non-exclusive right to manufacture, refine and treat production and to market, sell, transport and export such production;\n• the exclusive right to market and distribute hydrocarbons, petroleum products and LPG in the Kingdom, with Aramco’s commitment to meeting all the domestic market’s needs for such products in accordance with the consumption requirements thereof through domestic production or imports in accordance with laws', 'explore, prospect, drill, appraise, develop, extract, recover and produce hydrocarbons in the Concession Area;\n• The non-exclusive right to manufacture, refine, treat, market, sell, transport and export hydrocarbons and their derivatives extracted, recovered, developed, produced, treated, refined, consumed, transported, manufactured, marketed, sold, exported or dealt with in any other way by Aramco or on its behalf pursuant to the rights granted to Aramco in the Concession;\n• The exclusive right to market and distribute hydrocarbons, petroleum products and LPG in the Kingdom, with Aramco’s commitment to meeting all the domestic market’s needs for such products based on the consumption requirements thereof through domestic production or imports in accordance with laws issued by the Government;\n• The right to build, own and operate relevant facilities and assets as may be necessary or desirable to perform Aramco’s operations within the Reserved Areas;\n• Certain rights related to lands, such as use of land, easements, water rights, right-of-way and other suitable rights of any part of the Concession Areas, that are outside the Reserved Area, designated in connection with Aramco’s operations and transportation of products and free access to and use of any part of the Reserved Area;\n• The right to purchase, lease, import or otherwise obtain all materials, equipment and any other supplies necessary for Aramco’s operations;\n• The right to conduct such other activity related to the foregoing subject to the provisions of the Concession and applicable law;\n• The right to receive Government assistance in securing the rights granted in the Concession, obtaining permits, licenses and other special approvals and obtaining access, rights of way and water rights from third parties necessary for Aramco’s operations.\n\nAdditional legal information\n\nUnder the Concession, Aramco is required to obtain the necessary licenses, permits and approvals that may be required pursuant to the Hydrocarbons Law, the Law of Gas Supplies and Pricing (which is replaced by the Energy Supplies Law) and the regulations issued pursuant to these laws. The Concession and Aramco’s rights referred to under the Concession represent the licenses, permits, and approvals that are necessary or required for Aramco to conduct business in the Kingdom with respect to Aramco Operations and any related activities in accordance with the agreement. All hydrocarbons in the Kingdom are owned by the Kingdom, and upon extraction or recovery of such hydrocarbons by Aramco, title to such hydrocarbons shall automatically pass to Aramco at the ownership transfer point. Aramco has no rights to any natural resources existing in the Concession Area other than hydrocarbons except as otherwise provided in the Concession.\nThe rights granted to Aramco under the Concession are subject to the Hydrocarbons Law and other applicable law, including production decisions issued by the Government pursuant to its sovereign authority. Aramco may not sell to any entity any hydrocarbons or derivatives therefrom in violation of decisions the Government considers necessary for the protection of supreme security interests for the Kingdom in times of war or other emergency in international relations.\nTerm The Concession will remain effective for 40 years from the Concession Effective Date, unless terminated earlier in accordance with its terms.\nThe Government will issue a decision to extend the Concession for a period of 20 years on the 30th anniversary of the Concession Effective Date, provided Aramco has fulfilled the following conditions: (a) Aramco has exerted reasonable efforts to maximize reserves and their recovery in the Concession Area, taking into consideration production decisions and hydrocarbons market conditions; (b) Aramco has conducted its operations in a manner that (i) is economically efficient, (ii) enhances the productivity of the reservoirs in the long-term in the Concession Area and (iii) supports good management of hydrocarbons, in all cases, according to the Hydrocarbons Law; and (c) Aramco generally has conducted its activities and operations in the Kingdom in an economically efficient manner thereby enhancing the efficiency of the Kingdom’s economy.\nIf the Concession is extended as described in the previous paragraph, the Concession may be amended and extended for an additional 40 years following the 60th anniversary of the Concession Effective Date, if Aramco provides the Government with notice confirming its intent to extend the Concession, at any time from the beginning of the 50th anniversary until the end of the 53rd anniversary of the Concession Effective Date, provided that the parties undertake exclusive negotiations for a two-year period (which may be extended or reduced by the parties), commencing at the end of the 53rd anniversary of the Concession Effective Date, to reach an agreement on the terms and conditions of such amendment and extension. If the Government and Aramco are unable to reach agreement on the amendment and extension during such exclusive negotiation period, and the Government elects to negotiate with any third party to enter into an agreement with respect to any hydrocarbon activities or operations in', 'promissory note, Aramco may within 30 days of receiving notice of the offer or commitment, notify the PIF in writing of its intent to purchase all or a portion of the promissory notes to be transferred on the same terms. To the extent Aramco does not elect to purchase the promissory notes to be transferred, the PIF may transfer such promissory note during the subsequent 120-day period. In addition, the PIF may not transfer,\nassign or pledge prior to April 8, 2022, promissory notes with aggregate initial principal outstanding balances of (i) $300 million and\na payment date of April 7, 2022, and (ii) $3.0 billion and a payment date of April 7, 2026; provided that, if Aramco determines that\nthe Early Payment Event will not occur by April 8, 2022, it is required to notify the PIF and the restrictions on transfer will terminate.\nEach such promissory note must be surrendered for cancellation in the event the accelerated payment described above is made.\nFurthermore, the PIF may not transfer, assign or pledge at any time promissory notes with aggregate initial principal outstanding\nbalances of (i) $3.5 billion and a payment date of April 7, 2026, (ii) $250 million and a payment date of April 7, 2027, and (iii)\n$250 million and a payment date of April 7, 2028. Aramco currently intends to repay the promissory notes in a phased manner\nthrough cash from operations, external debt financing or a combination thereof.\nAs part of the June 16, 2020, amendment to the purchase agreement, Aramco agreed to enter into foreign exchange transactions\nwith banking institutions mutually agreed to between Aramco and the PIF to exchange U.S. dollars for Saudi Riyals. The aggregate\namount of these foreign exchange transactions is (i) up to $2.0 billion between June 16, and August 2, 2020, (ii) up to $3.0 billion\nin 2021 and (iii) up to $2.0 billion in 2022. In connection therewith, between June 16, and August 2, 2020, Aramco exchanged an\naggregate amount of $2.0 billion for Saudi Riyals.\nIntellectual property Aramco assesses, develops and incorporates new technology in a manner tailored to Aramco’s operations to protect business interests, enhance its operational efficiency, increase profitability and reduce the environmental impact of its operations. The scale of Aramco’s hydrocarbon reserves and operational capabilities enable it to realize significant benefits and value from otherwise marginal technological benefits.\nAramco focuses its technology initiatives in two primary areas: upstream and downstream. In addition, Aramco is working on several focused initiatives, including reductions in the environmental impact of operations and advancements in digital technologies.\nUpstream technology development is directed primarily to improving methods for discovering new hydrocarbon reserves, improving oil recoveries, increasing productivity, discovering novel catalysts and reducing lifting costs. Downstream technology development is dedicated primarily to maximizing value across the hydrocarbon chain and finding new and improved methods of producing products.\nAramco’s environmental impact initiatives include efforts aimed at producing low-carbon intensity crude oil, advancing efficient transport and driving high-impact low-carbon intensity solutions. Aramco’s digital technologies include innovations that leverage machine learning, artificial intelligence, and data analytics.\nLitigation From time to time, Aramco is subject to various claims, lawsuits, regulatory investigations and other legal matters arising in the ordinary course of business, including contractual claims relating to construction projects and agreements to render services undertaken by Aramco, claims for title to land and environmental claims. Additionally, Aramco in the past has been subject to antitrust claims.\nFurthermore, exports of crude oil, refined products and petrochemicals by Aramco or its affiliates to foreign countries may be affected by litigation, regulatory actions, investigations, disputes or agreements that lead to the imposition of import trade measures, including anti-dumping and countervailing duties, safeguard measures, import licensing and customs requirements, and new or increased tariffs, quotas or embargoes. The possibility and effect of any such measures will depend on the domestic laws in the relevant country to which the applicable products are being exported and applicable international trade agreements. Foreign countries may take such measures for political or other reasons, including reasons unrelated to Aramco actions or operations.\nThe outcome of litigation and other legal matters, including government investigations or other trade actions, is inherently uncertain.\nAramco believes it has valid defenses to the legal matters currently pending against it as a party. Certain trade actions that do not involve Aramco as a party may instead involve its products or industry, other products or industries impacting its operations, or the countries in which it operates. Trade actions may be taken without prior', 'following rights to be exercised at Aramco’s own responsibility during the term of the Concession:\n• the exclusive right to explore, drill, prospect, appraise, develop, extract, recover and produce hydrocarbons in the Concession Area;\n• the non-exclusive right to manufacture, refine and treat production and to market, sell, transport and export such production;\n• the exclusive right to market and distribute hydrocarbons, petroleum products and LPG in the Kingdom, with Aramco’s commitment to meeting all the domestic market’s needs for such products in accordance with the consumption requirements thereof through domestic production or imports in accordance with laws issued by the Government;\n• the right to build, own and operate relevant facilities and assets as may be necessary or desirable to perform Aramco’s operations within the Reserved Areas;\n• certain rights to acquire and use land, water and other natural products in connection with Aramco’s operations;\n• the right to purchase, lease, import or otherwise obtain all materials, equipment and any other supplies required for Aramco’s operations;\n• the right to conduct such other activity related to the foregoing subject to the provisions of the Concession and applicable law; and\n• the right to receive Government assistance in securing the rights granted in the Concession, obtaining permits, licenses and other special approvals and obtaining access, rights of way and water rights from third parties necessary for Aramco’s operations.\nnotiamrofni lagel\n\nlaicnanfi lanotiiddA\n\nUnder the Concession, Aramco is required to obtain the necessary licenses, permits and approvals that may be required pursuant to the Hydrocarbons Law, the Law of Gas Supplies and Pricing and the regulations issued pursuant to these laws. All hydrocarbons in the Kingdom are owned by the Kingdom, and upon extraction or recovery of such hydrocarbons by Aramco, title to such hydrocarbons shall automatically pass to Aramco at the ownership transfer point. Aramco has no rights to any natural resources existing in the Concession Area other than hydrocarbons except as otherwise provided in the Concession.\nThe rights granted to Aramco under the Concession are subject to the Hydrocarbons Law and other applicable law, including production decisions issued by the Government pursuant to its sovereign authority. Aramco may not sell to any entity any hydrocarbons or derivatives therefrom in violation of decisions the Government considers necessary for the protection of supreme security interests for the Kingdom in times of war or other emergency in international relations.\nTerm The Concession will remain effective for 40 years from the Concession Effective Date, unless terminated earlier in accordance with its terms.\nThe Government will issue a decision to extend the Concession for a period of 20 years on the 30th anniversary of the Concession Effective Date, provided Aramco has fulfilled the following conditions: (a) Aramco has exerted reasonable efforts to maximize reserves and their recovery in the Concession Area, taking into consideration production decisions and hydrocarbons market conditions; (b)\nAramco has conducted its operations in a manner that (i) is economically efficient, (ii) enhances the productivity of the reservoirs in the long-term in the Concession Area and (iii) supports good management of hydrocarbons, in all cases, according to the Hydrocarbons Law; and (c) Aramco generally has conducted its activities and operations in the Kingdom in an economically efficient manner thereby enhancing the efficiency of the Kingdom’s economy.\nIf the Concession is extended as described in the previous paragraph, the Concession may be amended and extended for an additional its intent to extend the Concession, at any time from the beginning of the 50th anniversary until the end of the 53rd anniversary of the Concession Effective Date, provided that the parties undertake exclusive negotiations for a two-year period (which may be extended or reduced by the parties), commencing at the end of the 53rd anniversary of the Concession Effective Date, to reach an agreement on the terms and conditions of such amendment and extension. If the Government and Aramco are unable to reach agreement on the amendment and extension during such exclusive negotiation period, and the Government elects to negotiate with any third party to enter into an agreement with respect to any hydrocarbons activities or operations in the Concession Area, Aramco will have a priority right to enter into an agreement with the Government under the same terms and conditions as agreed between the Government and such third party, provided that Aramco notifies the Government of its desire to exercise the priority right within 120 days of its receipt of a written notice from the Government that includes the entire draft agreement with such third party with respect to such hydrocarbons activities and operations.\nRoyalty and taxes\nAs at December 31, 2016, the royalty payable to the Government under the Original Concession consisted of an amount equal to (a)\n20% of the value of crude oil and the crude equivalent of refined products sold as exports, (b) 12.', 'tradeable shares Total no. Total no. Total no. No. of Country of of authorized of ordinary of preference issued ordinary incorporation shares shares shares shares Par Value\nRabigh Refining and Petrochemical Company Saudi Arabia 876,000,000 876,000,000 – 876,000,000 SAR 10\nS-Oil Corporation South Korea 240,000,000 180,000,000 60,000,000 112,582,792 Won 2,500\nMaterial subsidiaries with tradeable debt instruments Balance as at Country of Debt December 31, All amounts in millions SAR unless otherwise stated incorporation instruments 20191\nMotiva Enterprises LLC USA Debentures 7,680 S-Oil Corporation South Korea Debentures 10,206\nSadara Chemical Company (through its subsidiary Sadara Basic Services Company) Saudi Arabia Sukuk 6,478 Saudi Aramco Sukuk Company Saudi Arabia Sukuk 11,250\nSaudi Aramco Total Refining and Petrochemical Company (through its wholly owned subsidiary Arabian Aramco Total Services) Saudi Arabia Sukuk 2,530 1. Represents 100% of the balance as reported in the respective subsidiaries’ balance sheet.\nGovernment consents, licenses and certificates Saudi Aramco holds several operational and regulatory licenses and certificates from the relevant competent authorities that are periodically renewed. The following table lists the licenses and certificates currently held by Saudi Aramco that Saudi Aramco considers material in the context of its business.\nDetails of material regulatory and operational licenses and certificates obtained by Saudi Aramco Company Issuing authority License Effective date Expiry date\nSaudi Arabian Oil The Government The Concession December 24, 2017 Initial period of 40 years, with expiry date of\nCompany December 24, 2057, which will be extended\nby the Government for 20 years provided Saudi Aramco satisfies certain conditions commensurate with current operating practices. In addition, the Concession may be extended for an additional 40 years beyond\nthe prior 60-year period subject to Saudi Aramco and the Government agreeing on the terms of the extension.\nSATORP The Government SATORP Feedstock Various Ministerial Letters in connection with Allocation letters the supply of gas products to SATORP.\nMaterial agreements Saudi Aramco has entered into a number of agreements for the purposes of its business. The following is a summary of those agreements that Saudi Aramco considers material to its business. Saudi Aramco believes that all such agreements, in addition to the key provisions thereunder, have been included in this Section and that there are no other agreements that are material in the context of its business. These summaries do not purport to describe all the applicable terms and conditions of such agreements and are qualified in their entirety by the respective agreements. In addition, please see also below for details regarding Saudi Aramco’s financing agreements (Financing Agreements and Guarantees).\nThe Concession Background\nThe Arabian American Oil Company Concession Agreement was ratified on 4/2/1352H (corresponding to May 29, 1933) and granted Saudi Aramco’s\npredecessor certain exclusive rights, including the right to explore, drill, recover and treat crude oil and other hydrogen and carbon compounds in liquid or gaseous state within certain areas of the Kingdom (which were revised and grew over time), with limited territorial exceptions. Pursuant to Royal\nDecree No. M/8 dated 4/4/1409H (corresponding to November 13, 1988) approving Saudi Aramco’s original articles, Saudi Aramco enjoyed all the\nprivileges and rights provided under the Arabian American Oil Company Concession Agreement, and all subsequent supplementary documents, agreements, governmental orders and decisions in connection therewith (collectively, the “Original Concession”). Effective 6/4/1439H (corresponding to December 24, 2017), and in accordance with the Hydrocarbons Law, the Government, represented by the Minister of Energy, and Saudi Aramco entered\ninto the revised Concession Agreement (the “Concession”), which was adopted under Royal Decree No. (M/12) dated 18/1/1441H (corresponding\nto September 17, 2019) and replaced and superseded in its entirety the Original Concession on such date (the “Concession Effective Date”). Further, on\n20/1/1441H (corresponding to September 19, 2019), and in accordance with the Hydrocarbons Law, the Government, represented by the Minister of\nEnergy, and Saudi Aramco entered into an amendment to the Concession, with effect from January 1, 2020) (the “Concession Amendment”).\n\nGrant of rights The Government grants Saudi Aramco the following rights to be exercised at Saudi Aramco’s own responsibility during the term of the Concession:', 'the PIF may transfer such promissory notes during the subsequent 120 day period. Saudi Aramco currently intends to repay the promissory notes in a phased manner through cash from operations, external debt financing or a combination thereof.\nThe acquisition is currently expected to close in the first half of 2020.\n\nAgreements with key customers Other than one customer in 2016 which accounted for approximately 6% of Saudi Aramco’s revenue and other income related to sales, there was no single customer that constituted 5% or more of Saudi Aramco’s revenue and other income related to sales in the years ended December 31,\n2016, 2017, 2018 or 2019.\nAgreements with key suppliers Saudi Aramco purchases materials and services from local and international suppliers. There was no single supplier that constituted 5% or more\nof the Saudi Aramco’s total purchases in the years ended December 31, 2016, 2017, 2018 or 2019.\nFinancing agreements and guarantees The following table sets out the material financing agreements and guarantees entered into by Saudi Aramco for the purposes of its business.\nDetails of material financing agreements and guarantees Type of Financing Termination Date Key Legal Terms GMTN Program:\n$1 billion senior unsecured notes April 16, 2022 Customary covenants and events of default\n$2 billion senior unsecured notes April 16, 2024 Customary covenants and events of default\n$3 billion senior unsecured notes April 16, 2029 Customary covenants and events of default\n$3 billion senior unsecured notes April 16, 2039 Customary covenants and events of default\n$3 billion senior unsecured notes April 16, 2049 Customary covenants and events of default\nSukuk Program:\nSAR 11.25 billion sukuk April 10, 2024 Customary covenants and events of default\nRevolving credit facilities:\n5-year U.S. Dollar conventional facility (for an amount of $6 billion) March 26, 2022 Customary covenants and events of default\n5-year SAR Murabaha facility (for an amount of SAR 7.5 billion ($2 billion)) March 26, 2022 Customary covenants and events of default\n364-day U.S. Dollar conventional facility (for an amount of $1 billion) March 26, 2022 Customary covenants and events of default\n364-day SAR Murabaha facility (for an amount of SAR 3.75 billion ($1 billion)) March 26, 2022 Customary covenants and events of default\nSadara completion guarantee December 31, 2020 n/a Petro Rabigh completion guarantee July 1, 2020 n/a of Saudi Aramco, for further details in relation to the material financing arrangements. Refer to Section 7: Financial Statements – Note 27\nContingencies for further details in relation to the material guarantees.\nIntellectual property Saudi Aramco assesses, develops and incorporates new technology in a manner tailored to Saudi Aramco’s operations to ensure the long-term sustainability of its business, enhance its operational efficiency, increase profitability and reduce the environmental impact of its operations.\nThe scale of Saudi Aramco’s hydrocarbon reserves and operational capabilities enable it to realize significant benefits and value from otherwise marginal technological benefits.\nSaudi Aramco focuses its technology initiatives in three areas: upstream, downstream and sustainability. Upstream technology development is directed primarily to improving methods for discovering new hydrocarbon reserves, improving oil recoveries, increasing productivity, discovering novel catalysts and reducing lifting costs. Downstream technology development is dedicated primarily to maximizing value across the hydrocarbon chain and finding new and improved methods of producing products. Sustainability technology development is aimed at growing non-fuel applications for crude oil, sustaining low carbon intensity crude oil, advancing sustainable transport and driving high-impact low carbon intensity solutions.\nnoitamrofni lagel\n\nlaicnanfi lanoitidda\n\nLitigation From time to time, Saudi Aramco is subject to various claims, lawsuits, regulatory investigations and other legal matters arising in the ordinary course of business, including contractual claims relating to construction projects and agreements to render services undertaken by Saudi Aramco, claims for title to land and environmental claims. Additionally, Saudi Aramco in the past has been subject to antitrust claims in the United States.\nFurthermore, exports of crude oil, refined products and petrochemicals by Saudi Aramco or its affiliates to foreign countries may be affected by litigation, disputes or agreements that lead to the imposition of import trade measures, including anti-dumping and countervailing duties, safeguard measures, import licensing and customs requirements. The possibility and effect of any such measures will depend on the domestic laws in the relevant country to which the applicable products are being exported and applicable international trade agreements.\nThe outcome']",I couldn't find this in the available documents.,"Aramco treats such contracts as leases when they convey control of an identified asset in exchange for consideration. It recognizes right-of-use assets and lease liabilities at commencement, except for short-term and low-value leases, which are expensed over the lease term.",1.0,0.0,0.0,0.0
What direction has Aramco set for its gas business inside Saudi Arabia and internationally?,"['co’s East-West\n6.2 mmbpd (2018: 6.4 mmbpd) were sold to\npipeline is critical in linking oil production third-party customers. Also, Saudi Aramco’s facilities in the Eastern Province with Yanbu’ downstream business is the single largest on the west coast, and providing flexibility customer of Upstream’s crude oil, consuming to export from the east and west coasts of approximately 38% of its crude oil production the Kingdom.\nin both 2019 and 2018.\nReservoir modeling\n\nMSC Performance and achievements • The Dammam project with a total Saudi Aramco continued to support the production capacity of 75 mbpd is 1 2.0\nKingdom’s role as a reliable supplier of expected to commence operations in energy. Accordingly, spare capacity was two phases. The preparation for phase mmbpd maintained to respond to changes in global one has commenced and is planned to crude oil supply and demand and to be completed in 2022 with an expected supplement operational and supply reliability. capacity of 25 mbpd, while the remaining spare capacity was maintained to help capacity is planned to commence stabilize the market when needed The swift and effective restoration of the operations in 2026.\nAbqaiq and Khurais capacity after the attacks\nin September 2019 enabled Upstream to On September 14, 2019, Saudi Aramco’s\nmaintain the MSC at 12.0 mmbpd during 2019. Abqaiq and Khurais facilities were attacked,\nwhich resulted in explosions, fires and Maintaining MSC requires crude increments, significant damage to equipment at each development and maintain potential drilling facility. As a result of these attacks, as well as support programs such as well Saudi Aramco’s crude oil production was intervention and reservoir pressure maintenance. temporarily reduced by approximately 54%.\nSignificant work has been undertaken to Saudi Aramco took a number of actions progress key increment projects. Highlights to minimize the impact on its customers, of the status of these projects are listed below: including tapping into its crude oil inventories located outside the Kingdom, swapping\n• The Harmaliyah increment was completed grades of deliveries and curtailing NGL and commenced operations in January deliveries to some customers and increasing\n2019, adding 25 mbpd to reach a total\nproduction from other fields. As at of 100 mbpd capacity;\nSeptember 25, 2019, Saudi Aramco’s\n• The ‘Ain Dar and Fazran increments are production had recovered to the same progressing in the construction activities. level as that prior to the attacks. The related Both increments are expected to restoration and construction work is currently commence operations in 2020 with a total on-going and the estimated cost of repairs production capacity of 175 mbpd; of those facilities is not expected to have a material impact on the Company’s financial\n• The engineering design phase and the position or results of operations.\nprocurement work have commenced for both the Marjan and Berri field increment programs. These projects are expected\nto contribute 300 mbpd and 250 mbpd\nof crude oil, respectively, and are expected to commence operations in 2023; and Khurais plant ecnamrofrep\n\nWasit Gas Plant Gas and NGLs Pursuant to the Concession, Saudi Aramco is the exclusive supplier of natural gas in the Overview Kingdom. Saudi Aramco sells natural gas to Saudi Aramco’s non-associated gas fields power generation plants primarily pursuant vary widely in reservoir properties, depths, to long-term contracts and to customers in pressures and compositions. In general, the the Kingdom’s industrial sector. The supply southern area around the Ghawar field has of natural gas to domestic customers is rich gas at moderate depths and permeability, regulated by the GSPR and the prices paid while the northern offshore fields (Karan, by domestic customers are set by resolutions Arabiyah and Hasbah) have leaner gas in issued from time to time by the Council deeper reservoirs with high permeability.\nof Ministers. Saudi Aramco also exports Additionally, Saudi Aramco’s crude oil a portion of its NGLs production.\nproduction provides a base load of associated gas, which is rich in liquids.\nIn-line with its strategy, Saudi Aramco seeks over time to develop an integrated global Saudi Aramco’s primary natural gas gas portfolio and is pursuing investment processing and fractionation facilities are and joint venture opportunities outside the located in three geographical regions: Jubail, Kingdom in natural gas and LNG projects.\nGhawar and the Kingdom’s western area.\nThe facilities are strategically located near its In 2019, Saudi Aramco produced fields to reduce transportation and pipeline approximately 9.0 bscfd of natural gas\ncompression costs, as well as the time\n(2018: 8.9 bscfd), 1.0 bscfd of ethane\nrequired to deliver gas products to', 'to handle higher total fluid displacement rates at such fields. Kingdom-1 drilling rig, Marjan field, Saudi Arabia Aramco’s principal fields are located in close proximity to each other within the Central and Eastern Provinces of the Kingdom.\nAramco believes that its portfolio includes the world’s largest discovered conventional onshore oil field (Ghawar) and largest discovered conventional offshore oil field (Safaniyah). The crude oil, Highlights and developments condensate, natural gas, and NGL that Aramco produces from its fields travel through the extensive network of pipelines to multiple Dammam increment facilities for processing into refined and petrochemical products, or The Dammam development project continued water injection to domestic customers or export terminals. In particular, Aramco’s operations to support the reservoir and crude oil production East-West Pipeline is critical in linking oil production facilities in the and is expected to be fully onstream in 2025, adding crude oil Eastern Province with Yanbu’ on the west coast, and providing production capacity of 25 mbpd and an additional increment\nflexibility to export from the east and west coasts of the Kingdom. of 50 mbpd in 2027.\nAramco owns and operates the Abqaiq facility, which is its largest oil processing facility and the largest crude oil stabilization plant in\n\nthe world. Aramco also operates four crude export terminals that mbpd contribute to its operational flexibility and supply reliability. In Total expected production capacity of Dammam development project addition, Aramco has strategic international delivery points located in Rotterdam (the Netherlands), Sidi Kerir (Egypt), Okinawa and Marjan and Berri increment Kiire (Japan), and Ulsan (South Korea). The Marjan and Berri crude oil increments progressed procurement and construction activities and are expected Aramco consistently produces five grades of Arabian crude oil:\nto be online in 2025, adding crude oil production capacity of Arabian Super Light, Arabian Extra Light, Arabian Light, Arabian\n300 mbpd and 250 mbpd, respectively.\nMedium, and Arabian Heavy. These crude grades and the wide range of blends that can be produced from them are compatible with most global refineries. In 2024, Arabian Super Light, Arabian Extra Light, and Arabian Light accounted for approximately 68% mbpd\n(2023: 68%) of Aramco’s total crude oil production and were Total expected production capacity of Marjan and Berri crude oil increments classified as premium grades. In 2024, Aramco’s Downstream\nbusiness was the largest customer of the upstream crude oil Zuluf increment\nproduction, utilizing 53% (2023: 47%), while the remainder was\nThe Zuluf crude oil increment, which is expected to process sold to international and domestic third-party customers.\nfacility in 2026, advanced with engineering, procurement, Crude oil production and construction.\nclassified as premium grades\n68 69\n\n2023 2020 mbpd\nTotal expected production capacity of Zuluf oil increment Global Lighthouse Network status\n\nAramco facility to be added to the World Economic Forum\n2024 Global Lighthouse Network in recognition of its comprehensive\nadoption of advanced Fourth Industrial Revolution technologies that support its operational and environmental performance.\n68 66\n\n2022 2021\n\nUpstream continued Gas and NGL\nOverview raw gas processing capacity was 19.1 bscfd (2023: 19.1 bscfd),\nPursuant to the Concession, Aramco is the exclusive marketer and which primarily feeds into the MGS, an extensive network of distributor of natural gas in the Kingdom and its gas portfolio is rich pipelines that connects Saudi Aramco’s key gas production and in liquids, demonstrated by the production of both NGL and processing sites with demand centers throughout the Kingdom and unblended condensate. is currently undergoing expansion. The Company plans to increase its sales gas production capacity by more than 60% by 2030 from The Company’s nonassociated gas fields vary widely in reservoir the 2021 production levels subject to domestic demand and properties, depths, pressures, and compositions. In general, the inclusive of pre-FID projects not yet announced.\nsouthern area around the Ghawar field has rich gas at moderate depths and permeability, while the northern offshore fields (Karan, The Company sells natural gas to power generation plants primarily Arabiyah, and Hasbah) have leaner gas in deeper reservoirs with pursuant to long-term contracts and to customers in the Kingdom’s high permeability. Additionally, Aramco’s crude oil production industrial sector. The supply of natural gas to domestic customers is provides a base load of associated gas, which is rich in liquids. regulated by the Energy Supply Law (which superseded the GSPR Aramco’s primary natural gas processing and fractionation facilities and became effective in March 2023), and the prices paid by are located in Ghawar and the northern', 'GL Exploration Overview superseded the GSPR and became effective in March Overview Natural gas Pursuant to the Concession, Aramco is the exclusive 2023), and the prices paid by domestic customers are Through Aramco’s exploration program, the Aramco’s nonassociated gas exploration activities marketer and distributor of natural gas in the set by resolutions issued from time to time by the Company continued its efforts to achieve the strategic have yielded a number of major discoveries, with Kingdom and its gas portfolio is rich in liquids, Council of Ministers. Aramco also exports a portion of objectives and associated targets of growing the particular success in the Ghawar area and in deep demonstrated by the production of both NGL and its NGL production. Kingdom’s oil and nonassociated gas initially in place reservoirs in the Arabian Gulf. Aramco has enjoyed unblended condensate. Highlights and developments endowments. Aramco has historically replaced high success rates in locating new reserves in known reserves on an organic basis through revisions of hydrocarbon-bearing basins adjacent to its existing The Company’s nonassociated gas fields vary widely • In 2023, Aramco’s average gas production was reserve estimates at existing fields and through fields and production infrastructure, allowing it to\nin reservoir properties, depths, pressures, and approximately 10.7 bscfd (2022: 10.6 bscfd) including\ndelineation and exploration to identify new fields. As meet growing domestic demand at low cost, while compositions. In general, the southern area around both natural gas and ethane.\na result, the Kingdom’s estimated proved reserves at also exploring in new basins with high potential.\nthe Ghawar field has rich gas at moderate depths and\n• Design and construction activities continued on the the largest oil fields operated by Aramco have Aramco is looking to further expand its natural gas permeability, while the northern offshore fields Jafurah Gas Plant, part of the Jafurah unconventional increased since the time of original production. reserves through new field discoveries, new reservoir (Karan, Arabiyah, and Hasbah) have leaner gas in gas field, which is expected to commence production Aramco’s exploration program is aligned with additions in existing fields, and the delineation and deeper reservoirs with high permeability.\nin 2025 and is expected to gradually increase natural strategic value drivers to maximize profitability and reassessment of existing reservoirs and fields.\nAdditionally, Aramco’s crude oil production gas deliveries to reach a sustainable rate of 2.0 bscfd lower future finding and development costs through provides a base load of associated gas, which Unconventional resources by 2030. exploring for high-value premium crude and\n2.6 is rich in liquids. Aramco’s primary natural gas accelerating infrastructure-led gas exploration and Aramco, through its unconventional resource bscfd processing and fractionation facilities are • Construction and procurement activities continued delineation programs. program, is assessing several areas within the Planned additional located in Ghawar and the northern and at the Tanajib Gas Plant, part of the Marjan Kingdom for their potential to deliver gas and processing capacity from the western areas of the Kingdom. The Company’s development program. The plant is expected to be Crude oil associated liquids to help meet future domestic Tanajib Gas Plant, expected facilities are strategically located near its fields onstream by 2025 and add 2.6 bscfd of additional The majority of Aramco’s current crude oil energy needs. The unconventional resource program\nonstream by 2025. to reduce transportation and pipeline processing capacity from the Marjan and Zuluf exploration activities are focused in the Eastern consists of exploration activities, pilots, producing compression costs, as well as the time required fields. Province, with smaller scale of exploration activities in wells, and production facilities, with the objective of to deliver gas products to market. known hydrocarbon-bearing basins in the Empty developing unconventional gas resources in support\n• Hawiyah Unayzah Gas Reservoir Storage, the first Aramco owns and operates the Master Gas System underground natural gas storage in the Kingdom, Quarter, Northwest, and Summan regions. Aramco of the Kingdom’s growing demand for gas, and to (MGS), which is an extensive network of pipelines that achieved its maximum injection target of 1.5 bscfd. places a strong emphasis on improving the offset the use of crude oil for power generation.\nconnects its key gas production and processing sites This program is expected to provide up to 2.0 bscfd operational performance of its drilling activities by Highlights and developments\n\nHaradh gas increment program, was successfully well integrity.\nThe Company sells natural gas to power generation commissioned and brought onstream, increasing the plants primarily pursuant to long-term contracts and plant’s raw gas processing capacity by 800 mmscfd to customers in the Kingdom’s industrial sector. The which includes approximately 750 mmscfd of natural', 'strategic growing its portfolio.\nintegration and diversification Aramco’s strategy aims to of its operations reinforce its competitive positions across its upstream\nand downstream operations. See page 31 for more detail. See page 31 for more detail.\nExpand global Efficiently allocate recognition of capital and maintain Aramco’s brands a prudent and flexible balance sheet\nSee page 32 for more detail. See page 32 for more detail.\nDeliver sustainable Operate sustainably dividends through by leveraging crude oil price cycles technology and innovation\nSee page 33 for more detail. See page 33 for more detail.\n\nweivrevo ssenisuB\n\nMaintain its position as the world’s largest crude oil producer by production volume and one of the lowest cost producers, while providing reliable, low carbon intensity crude oil supply to customers Aramco intends to maintain its position in the exercise of its sovereign prerogative as the world’s largest crude oil company and requires Aramco to maintain MSC by production volume. Its reserves, in excess of its then current production operational capabilities and spare in accordance with the Hydrocarbons capacity allow it to increase production Law. The spare capacity afforded by in response to demand. Aramco maintaining MSC provides operational maintains its desired level of crude oil flexibility to respond rapidly to changes production by balancing production in global crude oil supply and demand.\nbetween maturing areas and newer Though Aramco has a robust field production sources, tapping into new maintenance philosophy that emphasizes reservoirs when required to optimize the reliability of its upstream operations, the depletion rate of its fields. It also MSC also provides an alternative supply maintains its low-cost position due option in the event of unplanned to the unique nature of the Kingdom’s production outages at any field.\ngeological formations, favorable onshore and shallow water offshore Moreover, Aramco utilizes term environments in which Aramco’s agreements for selling crude oil to major reservoirs are located, synergies consumers globally. These agreements available from Aramco’s use of its large provide supply predictability to customers infrastructure and logistics networks, by standardizing price and delivery its low depletion rate operational model terms to major regional demand centers.\nAramco’s vision is to be the and its scaled application of technology. Aramco continues to invest in and develop world’s preeminent a sophisticated and extensive crude oil In addition, Aramco seeks to maintain distribution and dispatch system, which integrated energy and its position as one of the world’s most maintains Aramco’s supply reliability.\nreliable crude oil suppliers. The chemicals company, Government determines the Kingdom’s Moreover, Aramco seeks to preserve the maximum level of crude oil production low lifting carbon intensity of its crude operating in a safe, oil production, which places it among sustainable and reliable the world’s least carbon intense producing sources of crude oil.\n\nCapture value from Expand gas activities further strategic integration and diversification of its operations Aramco intends to continue the Aramco plans to expand its gas business strategic integration of its upstream and to meet the large and growing domestic downstream businesses to facilitate the demand for low-cost cleaner energy by placement of Aramco’s crude oil in larger increasing production and investing in offtake volumes through a captive system additional infrastructure. This demand of domestic and international wholly is driven by power generation, water owned and affiliated refineries, allowing desalination, petrochemical production, it to capture additional value across the and other industrial consumption in the hydrocarbon chain, expand its sources Kingdom. Aramco’s gas production also of earnings and provide resilience to oil yields NGL (including ethane) and price volatility. For example, Aramco’s condensate, which supplement crude oil acquisition of a 70% equity interest production and provide feedstock to the\nin SABIC on June 16, 2020, supports refining and petrochemical industries.\nthe significant expansion of Aramco’s Furthermore, Aramco seeks over time to downstream activities, particularly develop an integrated global gas portfolio in its chemicals business, and provides and continues to evaluate investment and additional opportunities for Aramco joint venture opportunities outside the to supply mixed feedstock of crude oil, Kingdom in natural gas and LNG projects.\nrefinery products and gas to manufacture petrochemicals products.\nIn addition, the integration of Aramco’s Upstream and Downstream segments provides a unique opportunity for Aramco to secure crude oil demand by selling to refineries designed specifically to economically process Arabian crude oil.\nFurthermore, Aramco intends to enhance its domestic and global marketing businesses to support the position of its upstream business in key, high-growth geographies, including China, India and Southeast Asia, which are integral to Aramco’s existing business and future expansion strategy. Moreover, Aramco intends to maintain its presence in key large countries, such as the United States, and in countries that rely on importing crude oil, such as Japan and South Korea.\nWWaassiitt GGaass PPllaanntt,, EEaasstteerrnn PPrroovviinnc', '2.6 bscfd of raw gas processing processing capacity capacity (approximately 0.65 bscfd of\nThe Company sells natural gas to power sales gas production capacity) from the generation plants primarily pursuant to LNG offtake agreement Marjan and Zuluf fields.\nlong-term contracts and to customers in the Aramco signed a 20-year SPA with Kingdom’s industrial sector. The supply of NextDecade for offtake of 1.2 mmtpa of\nnatural gas to domestic customers is 2.6 bscfd LNG from liquefaction Train 4 of its Rio regulated by the Energy Supply Law, and the prices paid by domestic customers are set by Grande facility in Brownsville, Texas. Tanajib Gas Plant expected raw gas processing capacity resolutions issued from time to time by the Council of Ministers. Aramco also exports a portion of its NGL production and is assessing LNG investments internationally.\n\nAramco overview Results and Sustainability Risk Organizational structure Additional financial Consolidated and strategy performance and corporate governance and legal information financial statements Exploration Overview Natural gas Unconventional resources Through Aramco’s exploration program, the Aramco’s nonassociated gas exploration Aramco, through its unconventional resource Company continued its efforts to achieve the activities have yielded a number of major program, is assessing several areas within strategic objectives and associated targets of discoveries, with particular success in the the Kingdom for their potential to deliver growing the Kingdom’s oil and Ghawar area and in deep reservoirs in the additional oil, gas, and associated liquids to nonassociated gas initially in place Arabian Gulf. Aramco has enjoyed high help meet forecasted energy demand. The endowments. Aramco has historically success rates in locating new reserves in unconventional resource program consists of replaced reserves on an organic basis known hydrocarbon-bearing basins adjacent exploration activities, pilots, producing wells, through revisions of reserve estimates at to its existing fields and production and production facilities with the objective of existing fields and through delineation and infrastructure, allowing it to meet growing developing additional advantaged resources exploration to identify new fields. As a domestic demand at low cost, while also to grow the Kingdom’s unconventional oil result, the Kingdom’s estimated proved exploring in new basins with high potential. and gas resource base.\nreserves at the largest oil fields operated by Aramco is looking to further expand its Aramco have increased since the time of natural gas reserves through new field original production. Aramco’s exploration discoveries, new reservoir additions in program is aligned with strategic value existing fields, and the delineation and drivers to maximize profitability and lower reassessment of existing reservoirs and fields.\nfuture finding and development costs through exploring for high-value premium crude and accelerating infrastructure-led gas exploration and delineation programs. Hawiyah NGL Plant, Saudi Arabia Crude oil The majority of Aramco’s current crude oil exploration activities are focused in the Eastern Province, with smaller scale exploration activities in known hydrocarbon- bearing basins in the Empty Quarter, Northwest, and Summan regions. Aramco places a strong emphasis on improving the operational performance of its drilling activities by applying innovative technologies and benchmarking key metrics to identify trends and potential areas for enhancement.\nAramco believes its approach to drilling and development has led to high levels of well integrity.\nHighlights and developments Oil and gas discoveries Aramco’s exploration efforts resulted in the Ministry of Energy’s (MoE)\nnatural gas field and reservoir discoveries in the Kingdom’s Eastern Province and Empty Quarter. The discoveries are comprised of six fields and two reservoirs of Arabian oil, two natural gas fields, and four natural gas reservoirs.\n\nArabian oil and natural gas field and reservoir discoveries announced by the MoE in 2025\n\nDownstream “ Downstream continues to strengthen our integration across the hydrocarbon value chain, supporting our expansion globally and within the Kingdom. Through strategic investments in key markets, we have built a strong and robust downstream portfolio that meets the long-term needs of our customers and aligns with the evolving demands of the global energy landscape.”\nMohammed Y. Al Qahtani Downstream President Downstream overview Aramco has a large and growing, strategically The integration of Aramco’s refining and manufacturing efficiencies, deploying integrated global Downstream business that chemicals manufacturing assets provides an technologies and digital solutions, further provides opportunities to secure liquids opportunity to capture additional value and optimizing Downstream molecules, synergies, demand to capture incremental value from continue the shift of its product portfolio to and portfolio-wide cost-reduction programs.\nthe hydrocarbon supply chain by selling to its improve the balance of fuels and chemicals Since inception, the program has implemented dedicated system of domestic and production. Aramco’s global chemicals over 4,000 initiatives and captured over\ninternational refineries and petrochemical business includes production of basic ﷼ 18.75 billion ($5.0 billion) in incremental\nplants. The Downstream segment’s activities chemicals, such as aromatics, olefins, and financial benefits against the business baseline.\nconsist primarily of', '’s fields, processing segments are Upstream and Downstream, based in Saudi Arabia, plants, and other facilities. The produced which are supported by corporate crude oil, condensate, natural gas and while the Downstream activities. Aramco’s Upstream operations NGL travel through Aramco’s pipelines are primarily based in Saudi Arabia, while business is global. the Downstream business is global. to multiple facilities for processing into refined and petrochemical products, or to In 2021, Aramco’s average hydrocarbon domestic customers or export terminals.\nproduction was 12.3 mmboed, including In particular, Aramco’s East-West Pipeline 9.2 mmbpd of crude oil (including is critical in linking oil production facilities\nblended condensate and AGOC’s in the Eastern Province with Yanbu’ on production in the partitioned territory and the west coast, and providing flexibility its adjoining offshore areas in accordance to export from the east and west coasts with the agreements between the of the Kingdom.\nKingdom and the State of Kuwait, but The Government determines the excluding the Kingdom of Bahrain’s Kingdom’s maximum level of crude oil entitlement to volumes produced from production in the exercise of its sovereign the Abu Sa’fah field). As at December 31, prerogative and requires Aramco to\n2021, based on the initial 40-year period\nmaintain Maximum Sustainable Capacity and 20-year extension of the Concession,\n(MSC). As at December 31, 2021, Aramco’s\nAramco’s reserves stood at 253.6 billion MSC was maintained at 12.0 mmbpd of\nboe, including 196.9 billion barrels of crude oil. In line with the Government’s crude oil and condensate, 25.2 billion\nmandate for MSC to be increased to barrels of NGL, and 194.5 tscf of natural 13.0 mmbpd, Aramco is proceeding\ngas. In addition, as at December 31, 2021,\nwith its plans to gradually reach the Aramco had a gross refining capacity of mandated MSC by 2027 through multiple 6.8 mmbpd and net chemicals production increments. The spare capacity afforded capacity of 53.8 million tons per year.\nby maintaining MSC enables Aramco to rapidly increase its crude oil production Upstream Aramco’s MSC was maintained at above planned levels in response to The Upstream segment’s activities changes in global crude oil supply and consist of safely exploring for, developing, demand. Aramco also uses this spare 12.0 mmbpd and producing crude oil, condensate, capacity as an alternative supply option in natural gas and NGL. Aramco manages case of unplanned production outages at\nof crude oil as at December 31, 2021. the Kingdom’s unique reserves and any field and to maintain its production\nresources base to optimize production and levels during routine field maintenance.\nmaximize long-term value pursuant to the Hydrocarbons Law, which mandates that Aramco’s hydrocarbon operations promote long-term productivity of the Kingdom’s reservoirs and support the prudent stewardship of its hydrocarbon resources.\n\nBusiness overview and strategy Unrivaled reserves Aramco is the exclusive supplier of natural gas in the Kingdom and its gas portfolio One of world’s largest hydrocarbon producers is rich in liquids, demonstrated by the production of 1.0 mmbpd of NGL and 0.2 mmbpd of unblended condensate\nin 2021. Aramco owns and operates the Master Gas System (MGS), which is an extensive network of pipelines that connects its key gas production and Aramco’s hydrocarbon reserve s processing sites throughout the Kingdom.\nunder the Concession agreement In 2021, Aramco commenced development (December 31, 2021) of the vast Jafurah unconventional gas\nfield, which is considered the largest 253.6 B boe non-associated gas field in the Kingdom and hosts the largest liquids-rich shale gas development in the Middle East with an estimated 200 tscf of gas in place.\n196.9 The project aims to meet rising demand B bbl for high-value petrochemicals feedstock, of crude oil and condensate complement Aramco’s focus on hydrogen, support expansion of its integrated gas portfolio, and is expected to contribute 25.2 B bbl to greenhouse gas (GHG) avoidance in\nof NGL the domestic energy sector.\nAramco seeks to further expand its oil and gas reserves through new field 194.5 tscf discoveries, new reservoir additions of natural gas in existing fields, and delineation and reassessment of existing reservoirs and fields. The Company continued its focus on oil and gas reserves replacement which led to the discovery of five gas fields comprising three conventional and two unconventional discoveries.\n\nBusiness overview continued Downstream secure crude oil demand', '0)% Aramco’s principal fields are located in close\nEarnings before interest, income taxes and zakat 863,549 1,092,425 230,280 291,313 (21.0)% proximity to each other within the central region and\nCapital expenditures - cash basis 123,543 109,789 32,945 29,277 12.5% Eastern Provinces of the Kingdom. Aramco believes\nthat its portfolio includes the world’s largest\n* Supplementary information is converted at a fixed rate of U.S. dollar 1.00 = SAR 3.75 for convenience only. discovered conventional onshore oil field (Ghawar)\nand largest discovered conventional offshore oil field (Safaniyah). The crude oil, condensate, Earnings before interest, income taxes and zakat Capital expenditures in 2023 increased by 12.5%, mbpd from its fields travel through the extensive\n(EBIT) for the year ended December 31, 2023, totaled compared to the year ended December 31, 2022, from network of pipelines to multiple facilities for\nExpected processing\nSAR 863,549 ($230,280), compared to SAR 1,092,425 SAR 109,789 ($29,277) to SAR 123,543 ($32,945). This processing into refined and petrochemical\ncapacity from the\n($291,313) in 2022. The decrease in EBIT resulted increase reflects increased drilling and development Zuluf field by 2026. products, or to domestic customers or export\nprimarily from lower average realized crude oil activities related to crude oil increments, and ongoing terminals. In particular, Aramco’s East-West prices and from lower volumes sold. The decrease in progress of multiple gas projects toward the goal of Pipeline is critical in linking oil production facilities in EBIT was partly offset by lower crude oil production expanding gas production. the Eastern Province with Yanbu’ on the west coast, royalties. and providing flexibility to export from the east and west coasts of the Kingdom.\nAramco owns and operates the Abqaiq facility, which is its largest oil processing facility and the largest \uf070 Wellhead platform crude oil stabilization plant in the world. Aramco also Arabian Gulf operates four crude export terminals that contribute to its operational flexibility and supply reliability. In Highlights and developments addition, Aramco has strategic international delivery • Progress continues with construction and \uf071 Marjan field \uf071 Kingdom-1 drilling rig points located in Rotterdam (the Netherlands), Sidi engineering activities on the Marjan and Berri Saudi Arabia Arabian Gulf Kerir (Egypt), Okinawa and Kiire (Japan), and Ulsan crude oil increments, which are expected to be (South Korea). onstream by 2025 and add crude oil production\nAramco consistently produces five grades of Arabian capacity of 300 mbpd and 250 mbpd, respectively.\ncrude oil: Arabian Super Light, Arabian Extra Light, • Construction activities are continuing on the Arabian Light, Arabian Medium, and Arabian Heavy. Dammam development project, which is expected These crude grades and the wide range of blends that to add crude oil production of 25 mbpd in 2024 and\ncan be produced from them are compatible with most 50 mbpd in 2027.\nglobal refineries. In 2023, Arabian Super Light, Arabian Extra Light, and Arabian Light accounted for • Progress is ongoing with the Zuluf crude oil\napproximately 68% (2022: 68%) of Aramco’s total increment, which is expected to process 600 mbpd\ncrude oil production and were classified as premium of crude oil from the Zuluf field through a central\ngrades. In 2023, Aramco’s Downstream business was facility by 2026.\nthe largest customer of the upstream crude oil\nproduction, utilizing 47% (2022: 44%), while the\nremainder was sold to international and domestic third-party customers.\nmbpd Expected processing capacity from the Zuluf field by 2026. |\n\n5. ADDITIONAL FINANCIAL 6. CONSOLIDATED\n\nAND STRATEGY PERFORMANCE 3. SUSTAINABILITY 4. RISK GOVERNANCE INFORMATION STATEMENTS Upstream continued Gas and NGL Exploration Overview superseded the GSPR and became effective in March Overview Natural gas Pursuant to the Concession, Aramco is the exclusive 2023), and the prices paid by domestic customers are Through Aramco’s exploration program, the Aramco’s nonassociated gas exploration activities marketer and distributor of natural gas in the set by resolutions issued from time to time by the Company continued its efforts to achieve the strategic have yielded a number of major discoveries, with Kingdom and its gas portfolio is rich in liquids, Council of Ministers. Aramco also exports a portion of objectives and associated targets of growing the particular success in the', ', multi-speed, and multi-\nMarjan and Zuluf. We have also completed the first full cycle of gas dimensional approach to properly address the energy security, storage and reproduction into the Master Gas System from the affordability, and sustainability priorities of individual countries.\nKingdom’s first underground natural gas storage reservoir. In the Our view has not changed. At the same time, as economies in the liquefied natural gas space, we acquired a strategic minority stake Global South grow and living standards there rise, we believe the in MidOcean followed by additional investments including the corresponding increased energy demand can only be satisfied through a mix of sources that includes oil and gas.\n\n5 . O RGANIZATIONAL 6. A DDITIONAL STRUCTURE AND FINANCIAL 7. C ONSOLIDATED\n\nAND STRATEGY PERFORMANCE 3. SUSTAINABILITY 4. RISK GOVERNANCE INFORMATION STATEMENTS Accordingly, in addition to supporting the transition by providing As part of our efforts to positively contribute to the global reliable energy as we have done for decades, we continue to invest energy transition and also grow our portfolio into an adjacent sector, in ways to further lower emissions from oil and gas operations. In we have signed a non-binding Heads of Terms with Ma’aden to 2024, we signed a shareholders’ agreement to develop a carbon establish a joint venture for minerals exploration and mining in Saudi capture and storage hub at Jubail. When completed, this facility is Arabia. The JV could draw on Aramco’s extensive geoscience data expected to be one of the largest in the world with the capacity to and subsurface knowledge, with lithium production potentially capture up to nine million tons of CO annually from the first phase, commencing by 2027.\n\nwhich is equivalent to removing two million cars from the road each We also continue to increase the utilization of artificial intelligence year. Given carbon capture has the potential to reduce carbon in a number of areas of our operations to help unlock the full value emissions associated with hard-to-abate industries, we believe it of every hydrocarbon molecule we produce. We are, for example, will be a crucial component to not only our own net-zero ambition, using AI-driven analytics to monitor and further reduce our but also to global emission reduction targets.\ngreenhouse gas emissions. Most of our critical equipment is also We are also expanding our New Energies portfolio through now AI-monitored, with predictive algorithms helping to improve investments in several renewable projects within the Kingdom. facility reliability and therefore overall efficiency.\nThis includes the commencement of commercial operations at the Maintaining our competitive advantages 1.5 GW Sudair Solar PV Plant, and the Al Shuaibah 1 and Al ac Looking ahead, we remain confident in our Company’s ability to Shuaibah 2 solar PV projects, which have a planned combined thrive in an increasingly carbon-conscious world. This confidence is capacity of up to 2.66 GW . We also recently signed agreements\nac based on Aramco having a number of competitive advantages, together with our partners to develop three new solar PV projects including our unique scale, our low lifting costs, our lower that are anticipated to contribute an additional 5.5 GW of ac upstream carbon intensity, and our exclusive access to Saudi renewable energy to the Kingdom’s power grid by 2027.\nArabia’s vast reserves. That said, our greatest advantage remains Hydrogen is another new energy where we continue to have our people and their commitment to delivering the reliable energy discussions with potential customers about the long-term offtake the world needs both now and in the future.\ncontracts which will be critical to advancing the global hydrogen market. In the meantime, we acquired a 50% equity interest in a blue hydrogen company with the intention of developing a Amin H. Nasser hydrogen network to serve domestic customers. President and Chief Executive Officer\n\n2024 highlights\nRecapping a year of success and milestones Q1 Q2 Jafurah gas reserves additions International LNG investment Strategic gas expansion Pakistan retail investment Aramco announced the Aramco completed its first contracts Aramco completed its\naddition of 15.0 tscf of international investment in Contracts worth more than acquisition of a 40% equity\nraw gas and 2.0 bstb LNG by acquiring a strategic $25.0 billion awarded in stake in Gas & Oil Pakistan\nof condensate as proven minority stake in MidOcean. relation to the Jafurah Limited, supporting its global reserves at the Jafurah unconventional gas retail expansion and marking unconventional field. development, the expansion its first entry in the Pakistani South America retail of Aramco’s Master Gas fuels retail market.\ninvestment System, new gas rigs, and 15.0 Aramco completed its tscf ongoing capacity acquisition of a 100% Secondary public offering\nJafurah additional proven raw gas maintenance to progress reserves announced equity stake in the Chilean Aramco’s gas expansion The Government completed retailer Esmax, representing the sale of the Company’s strategy.', '2019, accounting for almost 36%\n$ per the IEA. Thus markets were roughly in of the overall primary energy mix and around\n/bbl\nbalance in 2019. 55% of the power generation and desalination\nsectors’ fuel mix.\nBrent crude oil price averaged $64/bbl Brent crude oil price averaged $64/bbl in\nin 2019, approximately 11% lower than 2019, approximately 11% lower than the\nthe average of $72/bbl in 2018 average of $72/bbl in 2018.\n\nweivrevo ssenisub\n\nSaudi Aramco’s vision is to be the world’s preeminent integrated energy Maintain its position as the world’s leading crude oil and chemicals company, operating in producer by production volume and the lowest a safe, sustainable and reliable manner. cost producer, while providing reliable, low carbon Saudi Aramco strives to provide its intensity crude oil supply to customers shareholders with resilient value creation through crude oil price cycles by maintaining its preeminence in oil and gas production, capturing additional value across the hydrocarbon value chain See page 30 for more detail.\nand profitably growing its portfolio.\nSaudi Aramco’s strategy aims to reinforce 2 3 its competitive positions across its upstream and downstream operations. Capture value from Expand gas activities further strategic in the Kingdom and integration and internationally diversification of its operations\nSee page 31 for more detail. See page 31 for more detail.\nExpand global Efficiently allocate recognition of Saudi capital and maintain Aramco’s brands a prudent and flexible balance sheet\nSee page 32 for more detail. See page 32 for more detail.\nOperate sustainably Deliver sustainable by leveraging and growing dividends technology and through crude oil innovation price cycles\nSee page 33 for more detail. See page 33 for more detail.\n\nStrategy Maintain its position as the world’s leading crude oil producer by production volume and the lowest cost producer, while providing reliable, low carbon intensity crude oil supply to customers Saudi Aramco intends to maintain its position The spare capacity afforded by maintaining as the world’s leading crude oil producer by MSC provides operational flexibility to production volume. Its reserves, operational respond rapidly to changes in global crude oil capabilities and spare capacity allow it to supply and demand. Though Saudi Aramco increase production in response to demand. has a robust field maintenance philosophy Saudi Aramco maintains its desired level of that emphasizes the reliability of its upstream crude oil production by balancing production operations, MSC also provides an alternative between maturing areas and newer supply option in the event of unplanned Saudi Aramco’s vision production sources, tapping into new production outages at any field.\nreservoirs when required to optimize the is to be the world’s depletion rate of its fields. Saudi Aramco also Moreover, Saudi Aramco utilizes term preeminent integrated maintains its low cost position due to the agreements for selling crude oil to major unique nature of the Kingdom’s geological consumers globally. These agreements energy and chemicals formations, favorable onshore and shallow provide supply predictability to customers water offshore environments in which Saudi by standardizing price and delivery terms company, operating Aramco’s reservoirs are located, synergies to major regional demand centers. Saudi available from Saudi Aramco’s use of its large Aramco continues to invest in and develop in a safe, sustainable infrastructure and logistics networks, low a sophisticated and extensive crude oil depletion rate operational model and scaled distribution and dispatch system, which and reliable manner application of technology. maintains Saudi Aramco’s supply reliability.\nIn addition, Saudi Aramco seeks to maintain Moreover, Saudi Aramco seeks to preserve its position as one of the world’s most the low carbon intensity of its crude oil reliable crude oil suppliers. The Saudi Arabian production, which places it among the Government determines the Kingdom’s world’s least carbon intense sources of maximum level of crude oil production in crude oil.\nthe exercise of its sovereign prerogative and requires Saudi Aramco to maintain MSC in accordance with the Hydrocarbons Law.\n\nweivrevo ssenisub\n\nCapture value from further Expand gas activities in the strategic integration and Kingdom and internationally diversification of its operations Saudi Aramco intends to continue the Saudi Aramco plans to expand its gas strategic integration of its upstream and business to meet large and growing downstream businesses to facilitate the domestic demand for low-cost clean energy placement of its crude oil in larger offtake by increasing production and investing volumes through a dedicated system of in additional infrastructure. This demand domestic and international wholly owned is driven by power generation, water and affiliated refineries. This integration also desalination, petrochemical production and allows Saudi Aramco to capture additional other industrial consumption in the Kingdom.\nvalue across the hydrocarbon chain, expand Saudi Aramco’s gas production also yields its sources of earnings and provide resilience NGLs (including ethane) and condensate, to oil price volatility. For example, the which supplement its crude oil production proposed acquisition of a', 'global Saudi Aramco’s primary natural gas gas portfolio and is pursuing investment processing and fractionation facilities are and joint venture opportunities outside the located in three geographical regions: Jubail, Kingdom in natural gas and LNG projects.\nGhawar and the Kingdom’s western area.\nThe facilities are strategically located near its In 2019, Saudi Aramco produced fields to reduce transportation and pipeline approximately 9.0 bscfd of natural gas\ncompression costs, as well as the time\n(2018: 8.9 bscfd), 1.0 bscfd of ethane\nrequired to deliver gas products to market.\n(2018: 1.0 bscfd), 1.1 mmbpd of NGLs\nAs at December 31, 2019, the total gas\n(2018: 1.1 mmbpd) and an additional processing system had a capacity of 17.0 bscfd\n0.2 mmbpd of unblended condensate (2018: 15.5 bscfd). This capacity feeds the\n(2018: 0.2 mmbpd).\nMGS, an extensive network of pipelines that connects Saudi Aramco’s key gas production and processing sites throughout the Kingdom.\n\nPerformance and achievements provide additional gas processing capacity The Kingdom’s growing demand for energy at HGP, achieving a total processing\n1.5 continues to drive Saudi Aramco’s large-scale capacity of 3.6 bscfd of raw gas. Operations\npursuit of new gas, ethane, and NGLs are expected to commence in 2021;\nbscfd production. Saudi Aramco’s strategy to meet • The Tanajib Gas Plant, which is part of the demand leverages all aspects of exploration, Marjan Development Program, provides appraisal and development of conventional for gas processing facilities of up to Fadhili Gas Plant facilities achieved and unconventional resources in addition 2.5 bscfd with operations expected to 1.5 bscfd capacity at year-end to investment in infrastructure.\ncommence in 2023. The engineering design work phase and critical material Major gas projects throughout 2019 are procurement have commenced for this as follows:\nproject. This project will process gas from\n• Fadhili Gas Plant achieved 1.5 bscfd the Marjan, Safaniyah and Zuluf fields; and capacity and is expected to reach full\n• Hawiyah Unayzah Reservoir Gas Storage capacity of 2.5 bscfd in 2020;\nwill be the first underground natural gas\n• Ethane deep recovery facility at the storage project in the Kingdom to inject Uthmaniyah Gas Plant to recover an 1.5 bscfd of surplus natural gas from the additional 85 mmscfd of ethane has been MGS into the Hawiyah Unayzah Reservoir completed and was undergoing during off-peak demand by 2022. In commissioning activities at year-end 2019; addition, the program will provide gas processing facilities to reproduce up to\n• Haradh increment program for the 2.0 bscfd of gas for re-introduction into Hawiyah Gas Plant (HGP) expansion the MGS by 2024.\nproject is currently under construction to Tanajib plant ecnamrofrep\n\nIn addition, Saudi Aramco successfully Performance and achievements and safely restored full production levels Saudi Aramco’s exploration activities during following the attack on its Shaybah NGL 2019 resulted in the following discoveries:\nfacility on August 17, 2019. The facility was\n• Crude oil: two fields, two new reservoirs attacked by five unmanned aerial vehicles, and seven successful delineations; and which resulted in fires and damage to the processing and cogeneration infrastructure • Conventional gas: one new onshore field, at the facility. No injuries or fatalities were five reservoirs and six successful reported during the incident. Restoration delineations.\nof plant operations on one NGL train was completed within two weeks after the Unconventional resources attack. Saudi Aramco took a number of steps Overview to mitigate the impact of the shutdown on Saudi Aramco has initiated an unconventional its customers, including providing alternative resources program and it is assessing several feedstock supply where possible.\nareas within the Kingdom for their potential to deliver gas and associated liquids to help Exploration meet future domestic energy needs. The Overview unconventional resources program consists The exploration program continued its of exploration activities, pilots, producing effort to achieve the strategic objectives and wells and production facilities, with the goal associated targets of growing Saudi Aramco’s to develop unconventional gas resources in oil and non-associated gas reserves. support of the Kingdom’s growing demand for gas and to offset crude oil used for power Crude oil generation. The unconventional resources The majority of Saudi Aramco’s current program continued to delineate and prove crude oil exploration activities are focused the Kingdom’s unconventional gas resource']","Aramco aims to expand its gas business both domestically and internationally to meet the growing demand for low-cost cleaner energy. Key directions include:

- **Domestic Expansion**: 
  - Increase production capacity to meet rising energy needs driven by power generation, water desalination, and petrochemical production.
  - Invest in additional infrastructure to facilitate the placement of crude oil in larger offtake volumes through a dedicated system of domestic and international wholly owned and affiliated refineries.
  - Develop unconventional gas resources to support domestic energy needs and offset crude oil usage for power generation.

- **International Investments**: 
  - Pursue investment and joint venture opportunities outside the Kingdom in natural gas and LNG projects.
  - Expand the integrated global gas portfolio to capture additional value across the hydrocarbon chain.

These strategies are designed to enhance Aramco's competitive position in the energy market while ensuring a reliable supply of gas to meet both domestic and international demands (source: various sections of the provided context).","Domestically, Aramco plans to expand gas operations, develop unconventional resources, add infrastructure, and raise sales gas production capacity by more than 60% by 2030 compared with 2021. Internationally, it plans to build an integrated global LNG business and pursue investment opportunities.",0.7777777777777778,0.8749818291750641,0.9159722222107726,1.0
Why were the acquired intangible values from the large chemicals transaction highlighted by the auditor?,"['key audit matter given\n- Compared certain key unobservable inputs the significant estimates involved in determining underlying the preliminary fair values to the preliminary fair values of the identifiable assets supporting documentation such as approved acquired and liabilities assumed.\nfinancial plans; and\n- Evaluated the reasonableness of certain Refer to Note 2(e) and Note 4 to the consolidated observable inputs and/or the resulting financial statements for further information.\npreliminary fair values based on comparable market data.\n• We considered the appropriateness of the related accounting policies and disclosures in the consolidated financial statements.\n\nmatter Accounting for the acquisition of SABIC The Company acquired a 70% equity interest in SABIC in June 2020.\nThe total purchase consideration was SAR 259.1 billion for acquisition of identifiable net assets with preliminary fair values of SAR 260.7 billion. Non-\ncontrolling interests of SAR 100.7 billion and goodwill of SAR 99.1 billion were recognised as\npart of the transaction.\nThe acquisition was accounted for in accordance with IFRS 3 ‘Business Combinations’, that is endorsed in the Kingdom of Saudi Arabia, and required management to make significant estimates as part of determining the preliminary fair values of the identifiable assets acquired and liabilities assumed.\nThe Group engaged an independent valuer in order to determine the fair value of the purchase consideration and the preliminary fair values that formed part of the purchase price allocation.\nWe considered this to be a key audit matter given the significant estimates involved in determining the preliminary fair values of the identifiable assets acquired and liabilities assumed.\nRefer to Note 2(e) and Note 4 to the consolidated financial statements for further information. | Our procedures included the following:\n• We read the share purchase agreement and tested the appropriateness of the fair value of the purchase consideration.\n• We assessed the competency, objectivity and independence of the independent valuer engaged by the Group.\n• With input from internal valuation experts (where considered necessary), we performed the following procedures, in relation to the preliminary fair values of the identifiable net assets that formed part of the purchase price allocation, as deemed appropriate:\n- Considered the appropriateness of the methodology and assumptions used in determining the preliminary fair values based on the applicable financial reporting requirements and established market practice;\n- Compared certain key unobservable inputs underlying the preliminary fair values to supporting documentation such as approved financial plans; and\n- Evaluated the reasonableness of certain observable inputs and/or the resulting preliminary fair values based on comparable market data.\n• We considered the appropriateness of the related accounting policies and disclosures in the consolidated financial statements.\nAccounting for the acquisition of SABIC The Company acquired a 70% equity interest in SABIC in June 2020.\nThe total purchase consideration was SAR 259.1 billion for acquisition of identifiable net assets with preliminary fair values of SAR 260.7 billion. Non-\ncontrolling interests of SAR 100.7 billion and goodwill of SAR 99.1 billion were recognised as\npart of the transaction.\nThe acquisition was accounted for in accordance with IFRS 3 ‘Business Combinations’, that is endorsed in the Kingdom of Saudi Arabia, and required management to make significant estimates as part of determining the preliminary fair values of the identifiable assets acquired and liabilities assumed.\nThe Group engaged an independent valuer in order to determine the fair value of the purchase consideration and the preliminary fair values that formed part of the purchase price allocation.\nWe considered this to be a key audit matter given the significant estimates involved in determining the preliminary fair values of the identifiable assets acquired and liabilities assumed.\nRefer to Note 2(e) and Note 4 to the consolidated financial statements for further information.\nOur procedures included the following:\n• We read the share purchase agreement and tested the appropriateness of the fair value of the purchase consideration.\n• We assessed the competency, objectivity and independence of the independent valuer engaged by the Group.\n• With input from internal valuation experts (where considered necessary), we performed the following procedures, in relation to the preliminary fair values of the identifiable net assets that formed part of the purchase price allocation, as deemed appropriate:\n- Considered the appropriateness of the methodology and assumptions used in determining the preliminary fair values based on the applicable financial reporting requirements and established market practice;\n- Compared certain key unobservable inputs underlying the preliminary fair values to supporting documentation such as approved financial plans; and\n- Evaluated the reasonableness of certain observable inputs and/or the resulting preliminary fair values based on comparable market data.\n• We considered the appropriateness of the related accounting policies and disclosures in the consolidated financial statements.\n\nIndependent auditor’s report to the shareholders of Saudi Arabian Oil Company (continued)\nKey audit matter How our audit addressed the key audit matter Assessment of recoverability of the goodwill and brand recognised as part of the SABIC acquisition IAS 36 ‘Impairment of Assets’, that is endorsed in Our procedures included the following:\nthe Kingdom of Saudi Arabia, requires goodwill and indefinite-lived intangible assets to be tested • We reviewed the appropriateness of annually,', 'accounting policies and disclosures in the consolidated financial statements.\nAccounting for the acquisition of SABIC The Company acquired a 70% equity interest in SABIC in June 2020.\nThe total purchase consideration was SAR 259.1 billion for acquisition of identifiable net assets with preliminary fair values of SAR 260.7 billion. Non-\ncontrolling interests of SAR 100.7 billion and goodwill of SAR 99.1 billion were recognised as\npart of the transaction.\nThe acquisition was accounted for in accordance with IFRS 3 ‘Business Combinations’, that is endorsed in the Kingdom of Saudi Arabia, and required management to make significant estimates as part of determining the preliminary fair values of the identifiable assets acquired and liabilities assumed.\nThe Group engaged an independent valuer in order to determine the fair value of the purchase consideration and the preliminary fair values that formed part of the purchase price allocation.\nWe considered this to be a key audit matter given the significant estimates involved in determining the preliminary fair values of the identifiable assets acquired and liabilities assumed.\nRefer to Note 2(e) and Note 4 to the consolidated financial statements for further information.\nOur procedures included the following:\n• We read the share purchase agreement and tested the appropriateness of the fair value of the purchase consideration.\n• We assessed the competency, objectivity and independence of the independent valuer engaged by the Group.\n• With input from internal valuation experts (where considered necessary), we performed the following procedures, in relation to the preliminary fair values of the identifiable net assets that formed part of the purchase price allocation, as deemed appropriate:\n- Considered the appropriateness of the methodology and assumptions used in determining the preliminary fair values based on the applicable financial reporting requirements and established market practice;\n- Compared certain key unobservable inputs underlying the preliminary fair values to supporting documentation such as approved financial plans; and\n- Evaluated the reasonableness of certain observable inputs and/or the resulting preliminary fair values based on comparable market data.\n• We considered the appropriateness of the related accounting policies and disclosures in the consolidated financial statements.\n\nIndependent auditor’s report to the shareholders of Saudi Arabian Oil Company (continued)\nKey audit matter How our audit addressed the key audit matter Assessment of recoverability of the goodwill and brand recognised as part of the SABIC acquisition IAS 36 ‘Impairment of Assets’, that is endorsed in Our procedures included the following:\nthe Kingdom of Saudi Arabia, requires goodwill and indefinite-lived intangible assets to be tested • We reviewed the appropriateness of annually, irrespective of whether there is any management’s provisional allocation of indication of impairment. goodwill to the Downstream operating segment and brand to the aggregation of the relevant Management performed an assessment of cash-generating units, based on the recoverability of the goodwill and brand requirements of IAS 36 ‘Impairment of assets’, recognised as part of the SABIC acquisition. The that is endorsed in the Kingdom of Saudi carrying amounts of these assets were SAR 99.1 Arabia.\nbillion and SAR 18.2 billion, respectively, at • We assessed the appropriateness of the assets\nDecember 31, 2020. and liabilities considered as part of the\nimpairment tests for the goodwill and brand.\nGoodwill has been provisionally allocated to the • With input from internal valuation experts Downstream operating segment. Therefore, the (where considered necessary), we performed goodwill impairment test was performed at the the following procedures on management’s Downstream operating segment level. The brand valuation models, as deemed appropriate:\ntest was performed based on an aggregation of the\n- Considered the consistency of certain relevant cash-generating units.\nunobservable inputs underlying the 1o-year cash flows such as expected product volumes The recoverable amounts were determined based and future operating and development costs on value-in-use calculations derived using with approved financial plans;\ndiscounted cash flow models. The models were\n- Compared a sample of forecast commodity based on the most recent financial plans and prices underlying the 10-year cash flows to included 10-year projection periods with terminal market data points;\nvalues assumed thereafter.\n- Evaluated the reasonableness of approved financial plans by comparison to historical The exercise performed supported the goodwill results;\nand brand carrying values and did not identify the\n- Assessed the reasonableness of the approach need for any impairment charges to be recognised.\nand inputs used to determine the terminal values;\nWe considered this to be a key audit matter given\n- Evaluated the reasonableness of the pre-tax the significant estimates involved in determining discount rates used by cross-checking the recoverable amounts and the uncertainty inherent underlying assumptions against observable in the underlying forecasts and assumptions. The market data;\nkey inputs to the recoverable amounts included\n- Tested the mathematical accuracy and the:\nlogical integrity of the models; and\n• Cash flows during the 10-year periods including - Tested management’s sensitivity analyses the underlying assumptions; that considered the impact of changes in\n• Terminal values; and assumptions on the outcome of the\n• Pre-tax discount rates. impairment assessments.\n• We', 'current period. These matters were addressed in the context of our audit of the consolidated financial statements as a whole, and in forming our opinion thereon, and we do not provide a separate opinion on these matters.\n\nIndependent auditor’s report to the shareholders of Saudi Arabian Oil Company (continued)\nKey audit matter How our audit addressed the key audit matter Accounting for the acquisition of SABIC The Company acquired a 70% equity interest in Our procedures included the following:\nSABIC in June 2020.\n• We read the share purchase agreement and The total purchase consideration was SAR 259.1 tested the appropriateness of the fair value of the billion for acquisition of identifiable net assets with purchase consideration.\npreliminary fair values of SAR 260.7 billion. Non- controlling interests of SAR 100.7 billion and • We assessed the competency, objectivity and\ngoodwill of SAR 99.1 billion were recognised as independence of the independent valuer part of the transaction. engaged by the Group.\nThe acquisition was accounted for in accordance • With input from internal valuation experts with IFRS 3 ‘Business Combinations’, that is (where considered necessary), we performed the endorsed in the Kingdom of Saudi Arabia, and following procedures, in relation to the required management to make significant preliminary fair values of the identifiable net estimates as part of determining the preliminary assets that formed part of the purchase price fair values of the identifiable assets acquired and allocation, as deemed appropriate:\nliabilities assumed.\n- Considered the appropriateness of the The Group engaged an independent valuer in order methodology and assumptions used in to determine the fair value of the purchase determining the preliminary fair values consideration and the preliminary fair values that based on the applicable financial reporting formed part of the purchase price allocation.\nrequirements and established market practice;\nWe considered this to be a key audit matter given\n- Compared certain key unobservable inputs the significant estimates involved in determining underlying the preliminary fair values to the preliminary fair values of the identifiable assets supporting documentation such as approved acquired and liabilities assumed.\nfinancial plans; and\n- Evaluated the reasonableness of certain Refer to Note 2(e) and Note 4 to the consolidated observable inputs and/or the resulting financial statements for further information.\npreliminary fair values based on comparable market data.\n• We considered the appropriateness of the related accounting policies and disclosures in the consolidated financial statements.\n\nstnemetats laicnanfi detadilosno C\n\nmatter Accounting for the acquisition of SABIC The Company acquired a 70% equity interest in SABIC in June 2020.\nThe total purchase consideration was SAR 259.1 billion for acquisition of identifiable net assets with preliminary fair values of SAR 260.7 billion. Non-\ncontrolling interests of SAR 100.7 billion and goodwill of SAR 99.1 billion were recognised as\npart of the transaction.\nThe acquisition was accounted for in accordance with IFRS 3 ‘Business Combinations’, that is endorsed in the Kingdom of Saudi Arabia, and required management to make significant estimates as part of determining the preliminary fair values of the identifiable assets acquired and liabilities assumed.\nThe Group engaged an independent valuer in order to determine the fair value of the purchase consideration and the preliminary fair values that formed part of the purchase price allocation.\nWe considered this to be a key audit matter given the significant estimates involved in determining the preliminary fair values of the identifiable assets acquired and liabilities assumed.\nRefer to Note 2(e) and Note 4 to the consolidated financial statements for further information. | Our procedures included the following:\n• We read the share purchase agreement and tested the appropriateness of the fair value of the purchase consideration.\n• We assessed the competency, objectivity and independence of the independent valuer engaged by the Group.\n• With input from internal valuation experts (where considered necessary), we performed the following procedures, in relation to the preliminary fair values of the identifiable net assets that formed part of the purchase price allocation, as deemed appropriate:\n- Considered the appropriateness of the methodology and assumptions used in determining the preliminary fair values based on the applicable financial reporting requirements and established market practice;\n- Compared certain key unobservable inputs underlying the preliminary fair values to supporting documentation such as approved financial plans; and\n- Evaluated the reasonableness of certain observable inputs and/or the resulting preliminary fair values based on comparable market data.\n• We considered the appropriateness of the related accounting policies and disclosures in the consolidated financial statements.\nAccounting for the acquisition of SABIC The Company acquired a 70% equity interest in SABIC in June 2020.\nThe total purchase consideration was SAR 259.1 billion for acquisition of identifiable net assets with preliminary fair values of SAR 260.7 billion. Non-\ncontrolling interests of SAR 100.7 billion and goodwill of SAR 99.1 billion were recognised as\npart of the transaction.\nThe acquisition was accounted for in accordance with IFRS 3 ‘Business Combinations’, that is endorsed in the Kingdom of Saudi Arabia, and required management', 'procedures on management’s value-in-use | | | | | calculations, as deemed appropriate: | | | | | - Considered the consistency of certain | | | | | unobservable inputs underlying the 10-year cash | | | | | flows such as expected product volumes and | | | | | future costs with approved financial plans; | | | | | - Compared a sample of forecast commodity prices | | | | | and margins underlying the 10-year cash flows to |\n| | | | market data points; | | | | | - Evaluated the reasonableness of approved | | | | | financial plans by comparison to historical results; | | | | | - Assessed the reasonableness of the approach and | | | | | inputs used to determine the terminal values by | | | | | benchmarking to observable market practice and | | | | | information; | | | | | - Evaluated the reasonableness of the pre-tax | | | | | discount rates used by cross-checking the | | | | | underlying assumptions against observable | | | | | market data; | | | | | - Tested the mathematical accuracy and logical | | | | | integrity of the models; and | | | | | - Tested management’s sensitivity analyses that | | | | | considered the impact of changes in assumptions | | | | | on the outcome of the impairment assessments. | | | | | ● We considered the reasonableness of the movement | | | | | in the recoverable amounts at December 31, 2022 | | | | | compared to the prior year in light of changes in the | | | | | underlying inputs and assumptions. | | | | | ● We considered the appropriateness of the related | | | | | accounting policies and disclosures in the | | | | | consolidated financial statements. |\n\nAssessment of recoverability of the goodwill | | and brand recognised as part of the SABIC | | acquisition | |\n\nInternational Accounting Standard (“IAS”) 36 | | ‘Impairment of Assets’, that is endorsed in the | | Kingdom of Saudi Arabia, requires goodwill and | | intangible assets that have indefinite useful lives to | | be tested annually for impairment, irrespective of | | whether there is any indication of impairment. | | Management performed an assessment of | | recoverability of the goodwill and brand | | (determined to have an indefinite useful life) | | recognised as part of the SABIC acquisition. The | | carrying amounts of these assets were SAR 99.1 | |\nbillion and SAR 18.1 billion, respectively, at | |\nDecember 31, 2022. | |\n\nGoodwill has been allocated to the Downstream | | operating segment. Therefore, the goodwill | | impairment test was performed at the Downstream | | operating segment level. The brand test was | | performed based on an aggregation of the relevant | | cash-generating units. | |\n\nThe recoverable amounts were determined based on | | value-in-use calculations derived using discounted | | cash flow models. The models were based on the | | most recent financial plans and included 10-year | | projection periods with terminal values assumed | | thereafter. | | The exercise performed by management supported the goodwill and brand carrying values and did not identify the need for any impairment charges to be recognised.\nWe considered this to be a key audit matter given the significant judgment and estimates involved in determining recoverable amounts and the uncertainty inherent in the underlying forecasts and assumptions. The key inputs and assumptions in determining the recoverable amounts included the:\n● Cash flows during the 10-year periods including | | | | | commodity prices and margins; | | | ● Terminal values; and | | | | ● Pre-tax discount rates. | | | |\n\nRefer to Note 2(f), Note 2(i) and Note 6 to the | | | | consolidated financial statements for further | | | | information. | | | |\n\nIndependent auditor’s report continued Independent auditor’s report to the shareholders of Saudi Arabian Independent auditor’s report to the shareholders of Saudi Arabian Oil Company (continued) Oil Company (continued)\nKey audit matter How our audit addressed the key audit Other information matter The Board of Directors is responsible for the other information. The other information comprises the Annual Accounting for the gas pipelines transaction Report (but does not include the consolidated financial statements and our auditor’s report thereon).\nThe Company sold a 49% equity interest in Aramco Our procedures included the following:\nOur opinion on the consolidated financial statements does not cover the other information and we do not Gas Pipelines Company (“AGPC”) in February 2022 ● We held discussions with management to express any form of assurance conclusion thereon.\nto GreenSaif Pipelines Bidco S.à r.l. (formerly, GEPIF understand the legal structure of the arrangement III Finance III Lux S.à r.l.) (“GreenSaif”) for upfront sale proceeds of SAR 58.1 billion. and the nature of', 'Saudi Arabian Oil Company (continued)\nOverall Group\nSAR 14.2 billion (2019: SAR 26.3 billion)\nmateriality How we Approximately 4% of income before income taxes and zakat determined it Rationale for the materiality Income before income taxes and zakat is an important benchmark for the Group’s benchmark stakeholders and is a generally accepted benchmark for profit-oriented groups.\napplied We agreed with those charged with governance that we would report to them misstatements identified during our audit above SAR 1.1 billion.\nHow we tailored our Group audit scope We tailored the scope of our audit in order to perform sufficient work to enable us to provide an opinion on the consolidated financial statements as a whole, taking into account the structure of the Group, the accounting processes and controls, and the industry in which the Group operates.\nThe Group’s operations are conducted through many components in several parts of the world. The most significant component within the Group is the Company itself and most of the audit effort was spent by the Group engagement team based in Dhahran, Kingdom of Saudi Arabia. The Group engagement team tested IT general controls, application and manual controls over systems and processes related to the Company’s financial information supplemented by tests of detail and analytical procedures. Certain audit procedures were carried out by the Group engagement team with assistance from internal accounting, valuation, pension, tax and IT experts and specialists. The Group engagement team also coordinated the work done by the various component teams across different locations and performed audit procedures on the consolidation workings and disclosures.\nWe identified four additional significant components where a full scope audit on the respective components’ financial information was performed under our instructions. Members of the Group engagement team performed the full scope audit of the significant component located in Dhahran, Kingdom of Saudi Arabia.\nComponent teams in Riyadh, Kingdom of Saudi Arabia, the United States of America and the Republic of Korea performed full scope audits of the components at those locations. We also requested certain other component teams to perform appropriate audit procedures. The selection of these components was based on qualitative and quantitative considerations, including whether the component accounted for a significant proportion of individual consolidated financial statement line items.\nThe Group engagement team’s involvement in the audit work performed by component teams considered the relative significance and complexity of the individual component. This included allocating overall Group materiality to the different components, sending formal instructions, obtaining regular updates on progress and results of procedures as well as review of deliverables and the relevant underlying working papers.\nKey audit matters Key audit matters are those matters that, in our professional judgment, were of most significance in our audit of the consolidated financial statements of the current period. These matters were addressed in the context of our audit of the consolidated financial statements as a whole, and in forming our opinion thereon, and we do not provide a separate opinion on these matters.\n\nIndependent auditor’s report to the shareholders of Saudi Arabian Oil Company (continued)\nKey audit matter How our audit addressed the key audit matter Accounting for the acquisition of SABIC The Company acquired a 70% equity interest in Our procedures included the following:\nSABIC in June 2020.\n• We read the share purchase agreement and The total purchase consideration was SAR 259.1 tested the appropriateness of the fair value of the billion for acquisition of identifiable net assets with purchase consideration.\npreliminary fair values of SAR 260.7 billion. Non- controlling interests of SAR 100.7 billion and • We assessed the competency, objectivity and\ngoodwill of SAR 99.1 billion were recognised as independence of the independent valuer part of the transaction. engaged by the Group.\nThe acquisition was accounted for in accordance • With input from internal valuation experts with IFRS 3 ‘Business Combinations’, that is (where considered necessary), we performed the endorsed in the Kingdom of Saudi Arabia, and following procedures, in relation to the required management to make significant preliminary fair values of the identifiable net estimates as part of determining the preliminary assets that formed part of the purchase price fair values of the identifiable assets acquired and allocation, as deemed appropriate:\nliabilities assumed.\n- Considered the appropriateness of the The Group engaged an independent valuer in order methodology and assumptions used in to determine the fair value of the purchase determining the preliminary fair values consideration and the preliminary fair values that based on the applicable financial reporting formed part of the purchase price allocation.\nrequirements and established market practice;\nWe considered this to be a key audit matter given\n- Compared certain key unobservable inputs the significant estimates involved in determining underlying the preliminary fair values to the preliminary fair values of the identifiable assets supporting documentation such as approved acquired and liabilities assumed.\nfinancial plans; and\n- Evaluated the reasonableness of certain Refer to Note 2(e) and Note 4 to the consolidated observable inputs and/or the resulting financial statements for further information.\npreliminary fair values based on comparable market data.\n• We considered the appropriateness of the related accounting policies and disclosures in the consolidated financial statements.\n\nmatter Accounting for the acquisition of SABIC The Company acquired a 70', 'test was performed at the Downstream other audit firms operating under our instructions. Where the work was performed by component auditors, calculations, as deemed appropriate:\noperating segment level. The brand test was we determined the level of involvement we needed to have in the audit work at those components to be able performed based on an aggregation of the relevant - Considered the consistency of certain to conclude whether sufficient appropriate audit evidence had been obtained as a basis for our opinion on cash-generating units. unobservable inputs underlying the 10-year cash the Group’s consolidated financial statements as a whole.\nflows such as expected product volumes and The recoverable amounts were determined based on future costs with approved financial plans;\nThe most significant component within the Group is the Company itself and most of the audit effort was spent value-in-use calculations derived using discounted - Compared a sample of forecast commodity prices by the Group engagement team based in Dhahran, Kingdom of Saudi Arabia. We identified five additional cash flow models. The models were based on the and margins underlying the 10-year cash flows to components where a full-scope audit on the respective components’ financial information was performed most recent financial plans and included 10-year market data points;\nunder our instructions. Members of the Group engagement team performed the full-scope audit of the projection periods with terminal values assumed - Evaluated the reasonableness of approved financial plans by comparison to historical results;\ncomponent located in Dhahran, Kingdom of Saudi Arabia. Component teams in Riyadh, Kingdom of Saudi thereafter.\n- Assessed the reasonableness of the approach and Arabia, the United States of America, the Republic of Korea and Malaysia performed full-scope audits of the The exercise performed by management supported inputs used to determine the terminal values by components at those locations based on our instructions. We also instructed certain other component teams the goodwill and brand carrying values and did not benchmarking to observable market practice and to perform an audit or specified procedures on material consolidated financial statement line items as part identify the need for any impairment charges to be information;\nof our overall Group audit scoping strategy. The selection of these components was based on qualitative and recognised. - Evaluated the reasonableness of the pre-tax discount rates used by cross-checking the quantitative considerations, including whether the component accounted for a significant proportion of We considered this to be a key audit matter given the underlying assumptions against observable individual consolidated financial statement line items. significant judgment and estimates involved in market data;\ndetermining recoverable amounts and the\n- Tested the mathematical accuracy and logical The Group engagement team’s involvement in the audit work performed by component teams considered the uncertainty inherent in the underlying forecasts and integrity of the models; and relative significance and complexity of the individual component. This included allocating materiality to the assumptions. The key inputs and assumptions in - Tested management’s sensitivity analyses that different components, sending formal instructions, obtaining regular updates on progress and results of determining the recoverable amounts included the: considered the impact of changes in assumptions on the outcome of the impairment assessments. procedures as well as reviewing deliverables and the relevant underlying working papers. ● Cash flows during the 10-year periods including commodity prices and margins; ● We considered the reasonableness of the movement Key audit matters ● Terminal values; and in the recoverable amounts at December 31, 2022 ● Pre-tax discount rates. compared to the prior year in light of changes in the Key audit matters are those matters that, in our professional judgment, were of most significance in our audit underlying inputs and assumptions.\nof the consolidated financial statements of the current period. These matters were addressed in the context Refer to Note 2(f), Note 2(i) and Note 6 to the ● We considered the appropriateness of the related of our audit of the consolidated financial statements as a whole, and in forming our opinion thereon, and we consolidated financial statements for further accounting policies and disclosures in the information.\ndo not provide a separate opinion on these matters. consolidated financial statements.\n\nIndependent auditor’s report continued Assessment of recoverability of the goodwill and brand recognised as part of the SABIC acquisition International Accounting Standard (“IAS”) 36 ‘Impairment of Assets’, that is endorsed in the Kingdom of Saudi Arabia, requires goodwill and intangible assets that have indefinite useful lives to be tested annually for impairment, irrespective of whether there is any indication of impairment.\nManagement performed an assessment of recoverability of the goodwill and brand (determined to have an indefinite useful life)\nrecognised as part of the SABIC acquisition. The carrying amounts of these assets were SAR 99.1 billion and SAR 18.1 billion, respectively, at\nDecember 31, 2022.\nGoodwill has been allocated to the Downstream operating segment. Therefore, the goodwill impairment test was performed at the Downstream operating segment level. The brand test was performed based on an aggregation of the relevant cash-generating units.\nThe recoverable amounts were determined based on value-in-use calculations derived using discounted cash flow models. The models were based on the most recent financial plans and included 10-year', 'trheopsree sloencatetido nas r. isWke o fa lmsoa treerqiuale smteisds tcaetretmainen ott dhuere to cforamupdo. nent teams to perform appropriate audit procedures. The selection of these components was based on q ualitative and quantitative considerations, including whether the component accounted for a significant proportion of individual consolidated financial statement line items.\nMateriality TThhee Gsrcoouppe eonfg aoguerm aeundti tte wamas’s iinnfvloulevnecmeden bt yin o tuhre aaupdpilti cwaotirokn p eorff omrmateedr ibayli tcyo.m Apno naeundti tte iasm dse csoignnsiedde rteod othbeta in rreelaastoivnea sbilgen aifsiscuanracne caen wd hceotmheprl etxhiety c oofn stholei dinatdeidvi dfiunaaln ccoiaml psotanteenmt.e nTthsi sa rine cflruedee dfr oamllo cmaatitnegr iaolv emraislls tGatreomupe nt.\nm Maistesrtiaatleimty etno ttsh me daiyf faerriesnet d cuoem tpoo fnraenutds ,o sre enrdrionrg. Tfohremy aalr ien cstornuscitdioenresd, ombtaatienriinagl irfe, ginudlairv iudpudaalltye so or nin p argoggrreesgsa te, athnedy r ecsouulltds orfe apsroonceadbulyr ebs ea se xwpeellc taesd r etvoi eiwnfilnuge ndceeli vtehrea belceosn aonmd itch ed erceilseivoannst uonf duesrelrysi ntga kweonr koinn gt hpea pbearssi.s of the consolidated financial statements.\nK ey audit matters Based on our professional judgment, we determined certain quantitative thresholds for materiality, including Key audit matters are those matters that, in our professional judgment, were of most significance in our audit the overall Group materiality for the consolidated financial statements as a whole as set out in the table below.\nof the consolidated financial statements of the current period. These matters were addressed in the context These, together with qualitative considerations, helped us to determine the scope of our audit and the nature, of our audit of the consolidated financial statements as a whole, and in forming our opinion thereon, and we timing and extent of our audit procedures and to evaluate the effect of misstatements, both individually and do not provide a separate opinion on these matters.\nin aggregate, on the consolidated financial statements as a whole.\n\nOOuvre raauldl iGt raopuppr oach materiality R ationale for the materiality benchmark applied\n\nIInnddeeppeennddeenntt aauuddiittoorr’’ss rreeppoorrtt ttoo tthhee sshhaarreehhoollddeerrss ooff S Saauuddi iA Arraabbiaiann OOiill C Coommppaannyy ((ccoonnttiinnuueedd))\nOKuery a auuddiitt ampaptrteora c h How our audit addressed the Key audit matter OAvsesrevsisemwe nt of recoverability of the goodwill and brand recognised as part of the SABIC acquisition ● We determined overall Group materiality taking into account the profit- oriented nature of the Group.\n● Based on income before income taxes and zakat of SAR 769.5 billion, we ‘Impairment of Assets’, that is endorsed in the determined our overa●ll WGreo ruepvi mewaetder tihaeli tayp aptr oSpArRia 2te8n.e1 sbsi lolfi omna. nagement’s Kingd om\n\na t\n\nl i\n\nra bia, r\n\neq u\n\ni v\n\nh reshaolllodc faotiro rne opfo grtoiondgw milli stsot athteem Deonwtns sttor etahmos oep cehraartignegd intangible assets that have indefinite useful lives to be with governance was seste agtm SeAnRt 1a.9n db ilbliroann.d to the aggregation of the tested annually, irrespective of whether there is any relevant cash-generating units, based on the indication of impairment.\nrequirements of IAS 36 ‘Impairment of Assets’, that M anagement performed a\n\na sed\n\neir e n\n\ni s\n\nt', 'SABIC’s property, plant and equipment (‘’PPE’’), and SABIC’s planned sale of its European Petrochemicals (“EP”) and ● Evaluating the appropriateness of management’s planned sale of its European Petrochemicals (“EP”) and ● Evaluating the appropriateness of management’s Engineering Thermoplastics (“ETP”) businesses (each a identification of CGUs, and the selection of CGUs to test Engineering Thermoplastics (“ETP”) businesses (each a identification of CGUs, and the selection of CGUs to test “disposal group”). These losses comprised SAR 19.0 billion for impairment.\n“disposal group”). These losses comprised SAR 19.0 billion for impairment.\nof impairments and write-downs on Downstream PPE and ● Assessing the completeness and accuracy of the carrying of impairments and write-downs on Downstream PPE and ● Assessing the completeness and accuracy of the carrying SAR 13.4 billion of remeasurement losses related to the amounts of property, plant and equipment included SAR 13.4 billion of remeasurement losses related to the amounts of property, plant and equipment included\ndisposal groups. within the CGU subject to impairment testing.\ndisposal groups. within the CGU subject to impairment testing.\n● With input from internal valuation experts, where ● With input from internal valuation experts, where Recoverable amounts for the impaired PPE were based on considered necessary, our procedures over Recoverable amounts for the impaired PPE were based on considered necessary, our procedures over value-in-use using discounted cash flow models derived management’s valuation model included:\nvalue-in-use using discounted cash flow models derived management’s valuation model included:\nfrom the most recent approved financial plans, and - Performing risk assessments, including sensitivity from the most recent approved financial plans, and - Performing risk assessments, including sensitivity determined to be higher than fair value less costs to sell. analyses that considered the impact of changes in determined to be higher than fair value less costs to sell. analyses that considered the impact of changes in Key inputs and assumptions included: assumptions on the outcome of the impairment Key inputs and assumptions included: assumptions on the outcome of the impairment assessment;\nassessment;\n● Carrying amounts of the relevant assets and liabilities; - Evaluating the appropriateness of the valuation ● Carrying amounts of the relevant assets and liabilities; - Evaluating the appropriateness of the valuation ● Cash flows during the projection periods, including method used by management, and testing the ● Cash flows during the projection periods, including method used by management, and testing the underlying volume, commodity price, margin and cost mathematical accuracy and logical integrity of the underlying volume, commodity price, margin and cost mathematical accuracy and logical integrity of the assumptions; and model;\nassumptions; and model;\n● Pre-tax discount rates. - Considering the reasonableness of the projection ● Pre-tax discount rates. - Considering the reasonableness of the projection period given the characteristics of the underlying period given the characteristics of the underlying Refer to Note 2(g), Note 2(h), and Note 5 to the asset, and the consistency of the cash flows and Refer to Note 2(g), Note 2(h), and Note 5 to the asset, and the consistency of the cash flows and consolidated financial statements for further information. certain underlying assumptions with approved consolidated financial statements for further information. certain underlying assumptions with approved financial plans;\nfinancial plans;\n\n- Assessing the reasonableness of the long-term growth rates used to determine terminal values, and growth rates used to determine terminal values, and of the pre-tax discount rates, by comparing to of the pre-tax discount rates, by comparing to observable market data.\nobservable market data.\n● We considered the reasonableness of the year-on-year ● We considered the reasonableness of the year-on-year movements in the recoverable amounts as at December movements in the recoverable amounts as at December 31, 2025 in light of the changes in the underlying key 31, 2025 in light of the changes in the underlying key\nassumptions.\nassumptions.\n● We considered the appropriateness of the related ● We considered the appropriateness of the related accounting policies and disclosures in the consolidated accounting policies and disclosures in the consolidated financial statements.\nfinancial statements. | - Assessing the reasonableness of the long-term | | 1. Recoverability of Downstream goodwill and | | | - Assessing the reasonableness of the long-term | | the SABIC brand (continued) | | | growth rates used to determine terminal values, and | | the SABIC brand (continued) | | | growth rates used to determine terminal values, and | | | | | of the pre-tax discount rates, by comparing to | | | | | of the pre-tax discount rates, by comparing to | | The exercise performed by management supported the | | | observable market data. | | The exercise performed by management supported the | | | observable market data. |', 'nIdCe”r)ly aincqgu tihseit 1io0n-y; eaanrd c ash il pipfeloliwnes s sturacnh saacst ioexnp. e cted product volumes and future costs with approved financial plans;\n- Compared a sample of forecast commodity prices lity aanndd a mssaersgsiends tuhned reirslkysi nogf tmhae t1e0r-iayle amr icsasstaht eflmowens tt oin market data points;\nwe considered where the Board of Directors made\n- Evaluated the reasonableness of approved nificant accounting estimates that involved making financial plans by comparison to historical inherently uncertain. As in all of our audits, we also results;\nnternal controls, including among other matters,\n- Assessed the reasonableness of the approach and hat represented a risk of material misstatement due to inputs used to determine the terminal values;\n- Evaluated the reasonableness of the pre-tax discount rates used by cross-checking the underlying assumptions against observable market data;\ncation of materiality. An audit is designed to obtain\n- Tested the mathematical accuracy and logical cial statements are free from material misstatement.\nintegrity of the models; and re considered material if, individually or in aggregate,\n- Tested management’s sensitivity analyses that conocmoincs iddeecriesdio tnhse oimf upsaecrt so ft ackheann goens itnh ea sbsuasmisp toifo nths e on the outcome of the impairment assessments.\n● We considered the reasonableness of the rtain quantitative thresholds for materiality, including movements in recoverable amounts during the year ciael nsdtaetde mDeecnetms abse ar 3w1h, o2l0e2 a1s. set out in the table below.\nus to determine the scope of our audit and the nature, ● We considered the appropriateness of the related uate the effect of misstatements, both individually and accounting policies and disclosures in the as cao wnhsoollied.a ted financial statements. |\n\n| International Accounting Standard (“IAS”) 36\n\n| determined our ov\n\n| ● Our quantitative th intangible assets that have indefinite useful lives to be | | | | | | | | | | | | | | | | | with governance w\n\n| Based on their size, co\n\n| rec | overability of\n\nthe goodwill and brand (determined | | | | | | | | | | | to | have an indefi | | | | | components locate nite useful life) recognised as part of | | | | | | | | | | | the | scoping SABIC acqui | | | | | America and the R sition. The carrying amounts of these | | | | | | | | | | | assets were | | | | | ● We also determine\nSAR 99.1 billion and SAR 18.2 billion, | | | | | | | | | | |\n| Group audit, in r\n\n| i mpairm | | entm teasttt ewrass p | | | | | | | erformeOdu art k tehye a Dudowit nmstartetaemrs | | | | | | |\n\n| performed based on an aggregatoiof nth oef Stahued rie Bleavsaicn tI | | | | | | | | | | | | | | | |\n\n| csa pshar ftl oowf dmeosidgenlsin. Tg hoeu mr aouddeilts, w weer ed betaesremd ionne tdh me matoesrti | | | | | | | | | | | | | | | | | hreec ecnont sofliindaantecdia lf inpanlacnias l satantde meinnctlsu. dIend pa1r0ti-cyuelaar | | | | | | | | | | | | | | | | | upbrojejecctitvioen j updegrmioedns tsw; iftohr teexramminpalel , vianl ureess paescstu mofe ds | | | | | | | | | | | | | | | | | tshsuermeapfttieorn. | | | s and considering future events that are | | | | | | | | | | | | |\n\n| ddressed the risk of management override of\n\n| othnes igdoeordatwioilnl aonf dw hbreathnedr ctahrerryein wga vsa eluviedse anncde odfi db inaos t | | | | | | | | | | | | | | | | | riaduend.t ify the', 'of management’s Engineering Thermoplastics (“ETP”) businesses (each a identification of CGUs, and the selection of CGUs to test Engineering Thermoplastics (“ETP”) businesses (each a identification of CGUs, and the selection of CGUs to test “disposal group”). These losses comprised SAR 19.0 billion for impairment.\n“disposal group”). These losses comprised SAR 19.0 billion for impairment.\nof impairments and write-downs on Downstream PPE and ● Assessing the completeness and accuracy of the carrying of impairments and write-downs on Downstream PPE and ● Assessing the completeness and accuracy of the carrying SAR 13.4 billion of remeasurement losses related to the amounts of property, plant and equipment included SAR 13.4 billion of remeasurement losses related to the amounts of property, plant and equipment included\ndisposal groups. within the CGU subject to impairment testing.\ndisposal groups. within the CGU subject to impairment testing.\n● With input from internal valuation experts, where ● With input from internal valuation experts, where Recoverable amounts for the impaired PPE were based on considered necessary, our procedures over Recoverable amounts for the impaired PPE were based on considered necessary, our procedures over value-in-use using discounted cash flow models derived management’s valuation model included:\nvalue-in-use using discounted cash flow models derived management’s valuation model included:\nfrom the most recent approved financial plans, and - Performing risk assessments, including sensitivity from the most recent approved financial plans, and - Performing risk assessments, including sensitivity determined to be higher than fair value less costs to sell. analyses that considered the impact of changes in determined to be higher than fair value less costs to sell. analyses that considered the impact of changes in Key inputs and assumptions included: assumptions on the outcome of the impairment Key inputs and assumptions included: assumptions on the outcome of the impairment assessment;\nassessment;\n● Carrying amounts of the relevant assets and liabilities; - Evaluating the appropriateness of the valuation ● Carrying amounts of the relevant assets and liabilities; - Evaluating the appropriateness of the valuation ● Cash flows during the projection periods, including method used by management, and testing the ● Cash flows during the projection periods, including method used by management, and testing the underlying volume, commodity price, margin and cost mathematical accuracy and logical integrity of the underlying volume, commodity price, margin and cost mathematical accuracy and logical integrity of the assumptions; and model;\nassumptions; and model;\n● Pre-tax discount rates. - Considering the reasonableness of the projection ● Pre-tax discount rates. - Considering the reasonableness of the projection period given the characteristics of the underlying period given the characteristics of the underlying Refer to Note 2(g), Note 2(h), and Note 5 to the asset, and the consistency of the cash flows and Refer to Note 2(g), Note 2(h), and Note 5 to the asset, and the consistency of the cash flows and consolidated financial statements for further information. certain underlying assumptions with approved consolidated financial statements for further information. certain underlying assumptions with approved financial plans;\nfinancial plans;\n\n- Assessing the reasonableness of the long-term growth rates used to determine terminal values, and growth rates used to determine terminal values, and of the pre-tax discount rates, by comparing to of the pre-tax discount rates, by comparing to observable market data.\nobservable market data.\n● We considered the reasonableness of the year-on-year ● We considered the reasonableness of the year-on-year movements in the recoverable amounts as at December movements in the recoverable amounts as at December 31, 2025 in light of the changes in the underlying key 31, 2025 in light of the changes in the underlying key\nassumptions.\nassumptions.\n● We considered the appropriateness of the related ● We considered the appropriateness of the related accounting policies and disclosures in the consolidated accounting policies and disclosures in the consolidated financial statements.\nfinancial statements. | - Assessing the reasonableness of the long-term | | 1. Recoverability of Downstream goodwill and | | | - Assessing the reasonableness of the long-term | | the SABIC brand (continued) | | | growth rates used to determine terminal values, and | | the SABIC brand (continued) | | | growth rates used to determine terminal values, and | | | | | of the pre-tax discount rates, by comparing to | | | | | of the pre-tax discount rates, by comparing to | | The exercise performed by management supported the | | | observable market data. | | The exercise performed by management supported the | | | observable market data. | | goodwill and brand carrying amounts and did not identify | | | | | goodwill and brand carrying amounts and did not identify | | | | | the need for any impairment charges to be recognised. | | | ● We considered the reasonableness of the year-on-year | | the need for any impairment charges to']","The acquired intangible values from the SABIC acquisition were highlighted by the auditor due to the significant estimates involved in determining the preliminary fair values of the identifiable assets acquired and liabilities assumed. Specifically, the auditor considered this a key audit matter because:

- The acquisition required management to make significant estimates as part of determining the preliminary fair values of the identifiable assets and liabilities.
- The Group engaged an independent valuer to assess the fair value of the purchase consideration and the preliminary fair values, which involved complex judgments and assumptions.
- The auditor performed various procedures to evaluate the appropriateness of the methodology and assumptions used, compared key unobservable inputs to supporting documentation, and assessed the reasonableness of observable inputs based on comparable market data.

These factors contributed to the auditor's focus on the acquired intangible values, as they represented a risk of material misstatement due to the inherent uncertainty in the underlying estimates and assumptions (refer to the independent auditor’s report and the section on accounting for the acquisition of SABIC).","The auditor treated the recoverability of goodwill and brand from the SABIC acquisition as a key audit matter because the assets had large carrying values and required significant judgment in value-in-use models. The assessment used 10-year cash flow projections, terminal values, commodity assumptions, margins, and discount rates.",0.7777777777777778,0.7981809242163264,0.5804421768624562,1.0
How does Aramco prepare and review its reserve estimates?,"['Kingdom’s reserves in the fields Aramco operated were the same as\nAramco’s reserves. Effective December 24, 2017, the Concession limited Aramco’s exclusive right to explore, develop, and produce the\nKingdom’s hydrocarbon resources, except in the Excluded Areas, to an initial period of 40 years, which will be extended by the Government for 20 years provided Aramco satisfies certain conditions commensurate with current operating practices. In addition, the Concession may be\nextended for an additional 40 years beyond the prior 60-year period subject to Aramco and the Government agreeing on the terms of the\nextension (see Section 6: Additional financial and legal information – The Concession). The provision of a specified term in the Concession impacts the calculation of Aramco’s reserves as compared to the Kingdom’s reserves in the fields Aramco operates. The Concession also requires Aramco to meet domestic demand for certain hydrocarbons, petroleum products, and LPGs through domestic production or imports.\nBased on the initial 40-year period and 20-year extension of the Concession, as at December 31, 2025, Aramco’s reserves were 247.2 billion\nboe (2024: 250.0 billion boe). Aramco’s oil equivalent reserves consisted of 186.5 billion barrels (2024: 189.8 billion barrels) of crude oil and\ncondensate, 26.2 billion barrels (2024: 26.1 billion barrels) of NGL and 211.7 tscf (2024: 209.8 tscf) of natural gas.\nAramco manages the Kingdom’s unique reserves and resources base to optimize production and maximize long-term value pursuant to the Hydrocarbons Law, which mandates that Aramco’s hydrocarbon operations promote long-term productivity of the Kingdom’s reservoirs and support the prudent stewardship of its hydrocarbon resources. Aramco has historically replaced reserves on an organic basis through revisions of reserve estimates at existing fields and through delineation and exploration to identify new fields. As a result, the Kingdom’s estimated proved reserves at the largest oil fields operated by Aramco have increased since the time of original production.\nThe following table sets forth Aramco’s estimates of its proved reserves based on the term of the Concession as at December 31, 2025 and 2024.\nCrude Oil and Condensate Natural Gas NGL Combined (mmbbl) (bscf) (mmboe) (mmbbl) (mmboe)\nReserves as at December 31, 2025 186,542 211,659 34,508 26,186 247,236\nReserves as at December 31, 2024 189,782 209,769 34,189 26,058 250,029\nThe following table sets forth the Kingdom’s estimates of its proved reserves in the fields Aramco operates as at December 31, 2025 and 2024.\nCrude Oil and Condensate Natural Gas NGL Combined (mmbbl) (bscf) (mmboe) (mmbbl) (mmboe)\nReserves as at December 31, 2025 261,743 256,940 42,429 37,873 342,045\nReserves as at December 31, 2024 261,682 255,117 42,101 37,496 341,279\nAramco’s reserve estimates conform to the SPE-PRMS definitions and guidelines, which are the internationally recognized industry standard sponsored by the Society of Petroleum Engineers, the American Association of Petroleum Geologists, the World Petroleum Council, the Society of Petroleum Evaluation Engineers, the Society of Exploration Geophysicists, the Society of Petrophysicists and Well Log Analysts, and the European Association of Geoscientists and Engineers. To estimate or update Aramco’s reserve estimates, the Upstream segment employees responsible for reserves calculations perform technical analyses that are reviewed internally by progressively higher levels of management until finalized at year-end. Aramco annually updates its estimates as it acquires and interprets new data. For reservoirs that have been producing and have established certain performance trends, Aramco is typically able to reliably forecast the reservoir’s future production. For reservoirs that have little to no production history and new discoveries, Aramco undertakes further analysis in addition to multidisciplinary evaluation to formulate production forecasts.\nAdditional legal information All amounts in millions SAR unless otherwise stated Aramco The Company was established in the Kingdom as a company with limited liability by virtue of Royal Decree No. M/8 dated 4/4/1409H\n(corresponding to November 13, 1988) to assume the privileges and rights of the Arabian American Oil Company. On January 1, 201', 'billion barrels (2021: 196.9 billion\nbarrels) of crude oil and condensate, 25.2 billion barrels (2021: 25.2 billion barrels) of NGL and 201.9 tscf (2021: 194.5 tscf) of\nnatural gas. As at December 31, 2022, Aramco’s portfolio included 535 (2021: 530) reservoirs within 142 (2021: 142) fields\ndistributed throughout the Kingdom and its territorial waters.\nAramco manages the Kingdom’s unique reserves and resources base to optimize production and maximize long-term value pursuant to the Hydrocarbons Law, which mandates that Aramco’s hydrocarbon operations promote long-term productivity of the Kingdom’s reservoirs and support the prudent stewardship of its hydrocarbon resources. Aramco has historically replaced reserves on an organic basis through revisions of reserve estimates at existing fields and through delineation and exploration to identify new fields. As a result, the Kingdom’s estimated proved reserves at the largest oil fields operated by Aramco have increased since the time of original production.\nThe following table sets forth Aramco’s estimates of its proved reserves based on the term of the Concession as at December 31,\n2022 and 2021.\nNatural Gas Crude Oil Condensate NGL Combined (mmbbl) (mmbbl) (bscf) (mmboe) (mmbbl) (mmboe)\nReserves as at December 31, 2022 197,410 3,393 201,905 32,826 25,153 258,782\nReserves as at December 31, 2021 193,195 3,676 194,453 31,549 25,188 253,608\nThe following table sets forth the Kingdom’s estimates of its proved reserves in the fields Aramco operates as at December 31,\n2022 and 2021.\nNatural Gas Crude Oil Condensate NGL Combined (mmbbl) (mmbbl) (bscf) (mmboe) (mmbbl) (mmboe)\nReserves as at December 31, 2022 257,143 4,480 246,738 40,665 36,146 338,434\nReserves as at December 31, 2021 256,826 4,766 241,529 39,783 35,956 337,331\nAramco’s reserve estimates conform to the SPE-PRMS definitions and guidelines, which is the internationally recognized industry standard sponsored by the Society of Petroleum Engineers, the American Association of Petroleum Geologists, the World Petroleum Council, the Society of Petroleum Evaluation Engineers, the Society of Exploration Geophysicists, the Society of Petrophysicists and Well Log Analysts and the European Association of Geoscientists and Engineers. To estimate or update Aramco’s reserve estimates, the Upstream segment employees responsible for reserves calculations perform technical analyses that are reviewed internally by progressively higher levels of management until finalized at year-end. Aramco annually updates its estimates as it acquires and interprets new data. For reservoirs that have been producing and have established certain performance trends, Aramco is typically able to reliably forecast the reservoir’s future production. For reservoirs that have little to no production history and new discoveries, Aramco undertakes further analysis in addition to multidisciplinary evaluation to formulate production forecasts.\n\nReserves information Aramco The Company was established in the Kingdom as a company with limited liability by virtue of Royal Decree No. M/8 dated\n4/4/1409H (corresponding to November 13, 1988) to assume the privileges and rights of the Arabian American Oil Company.\nOn January 1, 2018, the Company was converted into a Saudi joint stock company pursuant to Council of Ministers Resolution\nNo. 180 dated 1/4/1439H (corresponding to December 19, 2017) and registered in the city of Dhahran under commercial\nregistration No. 2052101150 dated 11/07/1439H (corresponding to March 28, 2018) with Saudi Arabian Oil Company as its official\nname. Its registered head office is located at P.O. Box 5000, Dhahran 31311, Kingdom of Saudi Arabia. Its share capital is seventy\nfive billion Saudi Riyals (SAR 75,000,000,000), consisting of two hundred and twenty billion (220,000,000,000) fully paid ordinary\nshares with no par value. Aramco’s primary operating segments are Upstream and Downstream, which are supported by corporate activities (for further details refer to Section 2: Results and performance).\nOn December 11, 2019, the Company completed its IPO', 'cession). The provision of a specified term in the Concession impacts the calculation of Aramco’s reserves as compared to the Kingdom’s reserves in the fields Aramco operates. The Concession also requires Aramco to meet domestic demand for certain hydrocarbons, petroleum products and LPGs through domestic production or imports.\nBased on the initial 40-year period and 20-year extension of the Concession, as at December 31, 2021, Aramco’s reserves were\n253.6 billion boe (2020: 255.2 billion boe). Aramco’s oil equivalent reserves consisted of 196.9 billion barrels (2020: 198.8 billion\nbarrels) of crude oil and condensate, 25.2 billion barrels (2020: 25.2 billion barrels) of NGL and 194.5 tscf (2020: 191.6 tscf) of\nnatural gas. As at December 31, 2021, Aramco’s portfolio included 530 (2020: 517) reservoirs within 142 (2020: 137) fields\ndistributed throughout the Kingdom and its territorial waters. Based on Aramco’s reserves data, as at December 31, 2021,\nAramco’s oil equivalent reserves were sufficient for proved reserves life of 56 years.\nAramco manages the Kingdom’s unique reserves and resources base to optimize production and maximize long-term value pursuant to the Hydrocarbons Law, which mandates that Aramco’s hydrocarbon operations promote long-term productivity of the Kingdom’s reservoirs and support the prudent stewardship of its hydrocarbon resources. Aramco has historically replaced reserves on an organic basis through revisions of reserve estimates at existing fields and through delineation and exploration to identify new fields. As a result, the Kingdom’s estimated proved reserves at the largest oil fields operated by Aramco have increased since the time of original production.\nThe following table sets forth Aramco’s estimates of its proved reserves based on the term of the Concession as at December 31, 2021 and 2020.\nNatural gas Crude oil Condensate NGL Combined (mmbbl) (mmbbl) (bscf) (mmboe) (mmbbl) (mmboe)\nReserves as at December 31, 2021 193,195 3,676 194,453 31,549 25,188 253,608\nReserves as at December 31, 2020 195,444 3,399 191,573 31,086 25,226 255,155\nThe following table sets forth the Kingdom’s estimates of its proved reserves in the fields Aramco operates as at December 31, 2021 and 2020.\nNatural gas Crude oil Condensate NGL Combined (mmbbl) (mmbbl) (bscf) (mmboe) (mmbbl) (mmboe)\nReserves as at December 31, 2021 256,826 4,766 241,529 39,783 35,956 337,331\nReserves as at December 31, 2020 257,063 4,493 238,838 39,345 35,971 336,872\nAramco’s reserve estimates conform to the SPE-PRMS definitions and guidelines, which is the internationally recognized industry standard sponsored by the Society of Petroleum Engineers, the American Association of Petroleum Geologists, the World Petroleum Council, the Society of Petroleum Evaluation Engineers, the Society of Exploration Geophysicists, the Society of Petrophysicists and Well Log Analysts and the European Association of Geoscientists and Engineers. To estimate or update Aramco’s reserve estimates, the Upstream segment employees responsible for reserves calculations perform technical analyses that are reviewed internally by progressively higher levels of management until finalized at year-end. Aramco annually updates its estimates as it acquires and interprets new data. For reservoirs that have been producing and have established certain performance trends, Aramco is typically able to reliably forecast the reservoir’s future production. For reservoirs that have little to no production history and new discoveries, Aramco undertakes further analysis in addition to multidisciplinary evaluation to formulate production forecasts.\nRegulation of the oil and gas industry in the Kingdom The following paragraphs summarize certain key regulation and legislation to which Aramco is subject as an operator in the oil and gas industry.\nLaw on hydrocarbons Overview\nThe Hydrocarbons Law was enacted by Royal Decree No. M/37, dated 2/4/1439H (corresponding to December 20, 2017) and applies\nto hydrocarbons, hydrocarbon resources and the hydrocarbon operations existing within the territory of the Kingdom.\nLicenses No hydrocarbon operations can be conducted in the Kingdom without obtaining a license', 'the prudent stewardship of its hydrocarbon resources. Aramco has historically replaced reserves on an organic basis through revisions of reserve estimates at existing fields and through delineation and exploration to identify new fields. As a result, the Kingdom’s estimated proved reserves at the largest oil fields operated by Aramco have increased since the time of original production.\nThe following table sets forth Aramco’s estimates of its proved reserves based on the term of the Concession as at December 31, 2024 and 2023.\nCrude Oil and Condensate Natural Gas NGL Combined (mmbbl) (bscf) (mmboe) (mmbbl) (mmboe)\nReserves as at December 31, 2024 189,782 209,769 34,189 26,058 250,029\nReserves as at December 31, 2023 191,349 207,450 33,822 26,024 251,195\nThe following table sets forth the Kingdom’s estimates of its proved reserves in the fields Aramco operates as at December 31,\n2024 and 2023.\nCrude Oil and Condensate Natural Gas NGL Combined (mmbbl) (bscf) (mmboe) (mmbbl) (mmboe)\nReserves as at December 31, 2024 261,682 255,117 42,101 37,496 341,279\nReserves as at December 31, 2023 261,677 252,567 41,696 37,395 340,768\nAramco’s reserve estimates conform to the SPE-PRMS definitions and guidelines, which are the internationally recognized industry standard sponsored by the Society of Petroleum Engineers, the American Association of Petroleum Geologists, the World Petroleum Council, the Society of Petroleum Evaluation Engineers, the Society of Exploration Geophysicists, the Society of Petrophysicists and Well Log Analysts, and the European Association of Geoscientists and Engineers. To estimate or update Aramco’s reserve estimates, the Upstream segment employees responsible for reserves calculations perform technical analyses that are reviewed internally by progressively higher levels of management until finalized at year-end. Aramco annually updates its estimates as it acquires and interprets new data. For reservoirs that have been producing and have established certain performance trends, Aramco is typically able to reliably forecast the reservoir’s future production. For reservoirs that have little to no production history and new discoveries, Aramco undertakes further analysis in addition to multidisciplinary evaluation to formulate production forecasts.\nAdditional legal information All amounts in millions unless otherwise stated Aramco The Company was established in the Kingdom as a company with limited liability by virtue of Royal Decree No. M/8 dated 4/4/1409H\n(corresponding to November 13, 1988) to assume the privileges and rights of the Arabian American Oil Company. On January 1, 2018,\nthe Company was converted into a Saudi joint stock company pursuant to Council of Ministers Resolution No. 180 dated 1/4/1439H\n(corresponding to December 19, 2017) and registered in the city of Dhahran under commercial registration No. 2052101150 dated\n11/07/1439H (corresponding to March 28, 2018) with Saudi Arabian Oil Company as its official name. Its registered head office is located\nat P.O. Box 5000, Dhahran 31311, Kingdom of Saudi Arabia. Its share capital is ninety billion Saudi Riyals (﷼ 90,000,000,000), consisting of\ntwo hundred and forty two billion (242,000,000,000) fully paid ordinary shares with no par value. Aramco’s primary operating segments are Upstream and Downstream, which are supported by corporate activities (for further details refer to Section 2: Results and performance).\nOn December 11, 2019, the Company completed its IPO and its ordinary shares were listed on the Saudi Exchange. In connection with the\nIPO, the Government, being the sole owner of the Company’s shares at such time, sold 3.45 billion ordinary shares, or 1.73% of the\nCompany’s share capital. In addition, concurrent with the IPO, the Company acquired 117.2 million of its ordinary shares from the\nGovernment for a cash payment of ﷼ 3.75 billion ($1.0 billion), which are being classified as treasury shares. These shares are for use by the\nCompany for its employee share plans. On February 13, 2022, the Government announced the transfer of 4% of the Company’s total share\ncapital to PIF. On April 16, 2023, the Government announced the transfer of an additional 4% of the Company’s ordinary shares to Sanabil', ""(Shari'a compliant) and other Islamic financing 2,460 7 to 16 years – 1,255 2028-2038\nRevolving Credit Facilities 36,880 1 to 5 years (534) 703 2025-2029\nShort-term borrowings 37,487 Under 1 year (5,787) 21,242 2025\nDebentures 106,283 10 to 50 years (9,552) 106,283 2025-2070\nLease liabilities – – (15,344) 62,483 Not defined\nOther financing arrangements 35,982 11 to 25 years – 35,982 2028 - 2046\n347,524 (46,826) 319,290\n1. Includes total facility amounts and carrying amounts for certain long-term loans being repaid in installments.\n5 . O RGANIZATIONAL 6. ADDITIONAL STRUCTURE AND FINANCIAL 7. C ONSOLIDATED\n\nAND STRATEGY PERFORMANCE 3. SUSTAINABILITY 4. RISK GOVERNANCE INFORMATION STATEMENTS Reserves information All amounts in millions unless otherwise stated Reserves as at December 31, 2024\nAs at December 31, 2024, the Kingdom’s reserves in the fields Aramco operates consisted of 341.3 billion boe (2023: 340.8 billion boe),\nincluding 261.7 billion barrels (2023: 261.7 billion barrels) of crude oil and condensate, 37.5 billion barrels (2023: 37.4 billion barrels)\nof NGL and 255.1 tscf (2023: 252.6 tscf) of natural gas, including 167.8 tscf (2023: 164.8 tscf) of nonassociated gas.\nUnder the Original Concession, which was in effect until December 24, 2017, Aramco’s rights with respect to hydrocarbons in the Kingdom\nwere not limited to a particular term. Accordingly, until such date, the Kingdom’s reserves in the fields Aramco operated were the same as\nAramco’s reserves. Effective December 24, 2017, the Concession limited Aramco’s exclusive right to explore, develop and produce the\nKingdom’s hydrocarbon resources, except in the Excluded Areas, to an initial period of 40 years, which will be extended by the Government for 20 years provided Aramco satisfies certain conditions commensurate with current operating practices. In addition, the\nConcession may be extended for an additional 40 years beyond the prior 60-year period subject to Aramco and the Government agreeing\non the terms of the extension (see Section 6: Additional financial and legal information – The Concession). The provision of a specified term in the Concession impacts the calculation of Aramco’s reserves as compared to the Kingdom’s reserves in the fields Aramco operates. The Concession also requires Aramco to meet domestic demand for certain hydrocarbons, petroleum products, and LPGs through domestic production or imports.\nBased on the initial 40-year period and 20-year extension of the Concession, as at December 31, 2024, Aramco’s reserves were 250.0 billion\nboe (2023: 251.2 billion boe). Aramco’s oil equivalent reserves consisted of 189.8 billion barrels (2023: 191.3 billion barrels) of crude oil and\ncondensate, 26.1 billion barrels (2023: 26.0 billion barrels) of NGL and 209.8 tscf (2023: 207.5 tscf) of natural gas. As at December 31, 2024,\nAramco’s portfolio included 548 (2023: 541) reservoirs within 148 (2023: 144) fields distributed throughout the Kingdom and its territorial\nwaters.\nAramco manages the Kingdom’s unique reserves and resources base to optimize production and maximize long-term value pursuant to the Hydrocarbons Law, which mandates that Aramco’s hydrocarbon operations promote long-term productivity of the Kingdom’s reservoirs and support the prudent stewardship of its hydrocarbon resources. Aramco has historically replaced reserves on an organic basis through revisions of reserve estimates at existing fields and through delineation and exploration to identify new fields. As a result, the Kingdom’s estimated proved reserves at the largest oil fields operated by Aramco have increased since the time of original production.\nThe following table sets forth Aramco’s estimates of its proved reserves based on the term of the Concession as at December 31, 2024 and 2023.\nCrude Oil and Condensate Natural Gas NGL Combined (mmbbl) (bscf) (mm"", ""(Shari’a compliant) 3,784 11 to 17 years (885) 3,736 2025-2035\nIjarah / Procurement (Shari'a compliant) 3,304 5 to 23 years (614) 2,701 2026-2039\nMurabaha (Shari'a compliant) 28,173 7 to 24 years (4,203) 18,293 2028-2032\nWakala (Shari'a compliant) and other\nIslamic financing 1,294 7 to 16 years (43) 1,023 2028-2036\nRevolving Credit Facilities 47,708 1 to 5 years (5,370) – 2023-2027\nShort-term borrowings 27,000 Under 1 year (1,779) 10,205 2023\nDebentures 97,212 3 to 50 years (6,551) 97,212 2023-2070\nDeferred consideration2 122,163 8 years (100,520) 122,163 2028\nLease Liabilities – – (12,114) 52,664 Not defined\nOther financing arrangements 23,978 11 to 25 years (923) 23,978 2028-2046\n418,044 (144,628) 393,144\n1. Includes total facility amounts and carrying amounts for certain long-term loans being repaid in installments.\n2. On March 7, 2023, the Company signed an agreement with PIF to make a third partial prepayment of $15.7 billion on or before March 15, 2023, which will fully or partially reduce\nthe outstanding amounts of the promissory notes payable between 2024 and 2028. Accordingly, the remaining amount of the deferred consideration will mature in 2026.\n\nAdditional financial information continued Reserves as at December 31, 2022\nAs at December 31, 2022, the Kingdom’s reserves in the fields Aramco operates consisted of 338.4 billion boe (2021: 337.3 billion\nboe), including 261.6 billion barrels (2021: 261.6 billion barrels) of crude oil and condensate, 36.1 billion barrels (2021: 36.0 billion\nbarrels) of NGL and 246.7 tscf (2021: 241.5 tscf) of natural gas, including 156.9 tscf (2021: 153.7 tscf) of nonassociated gas.\nUnder the Original Concession, which was in effect until December 24, 2017, Aramco’s rights with respect to hydrocarbons\nin the Kingdom were not limited to a particular term. Accordingly, until such date, the Kingdom’s reserves in the fields Aramco\noperated were the same as Aramco’s reserves. Effective December 24, 2017, the Concession limited Aramco’s exclusive right to\nexplore, develop and produce the Kingdom’s hydrocarbon resources, except in the Excluded Areas, to an initial period of 40 years, which will be extended by the Government for 20 years provided Aramco satisfies certain conditions commensurate with\ncurrent operating practices. In addition, the Concession may be extended for an additional 40 years beyond the prior 60-year\nperiod subject to Aramco and the Government agreeing on the terms of the extension (see Section 6: Additional legal information — the Concession). The provision of a specified term in the Concession impacts the calculation of Aramco’s reserves as compared to the Kingdom’s reserves in the fields Aramco operates. The Concession also requires Aramco to meet domestic demand for certain hydrocarbons, petroleum products and LPGs through domestic production or imports.\nBased on the initial 40-year period and 20-year extension of the Concession, as at December 31, 2022, Aramco’s reserves were\n258.8 billion boe (2021: 253.6 billion boe). Aramco’s oil equivalent reserves consisted of 200.8 billion barrels (2021: 196.9 billion\nbarrels) of crude oil and condensate, 25.2 billion barrels (2021: 25.2 billion barrels) of NGL and 201.9 tscf (2021: 194.5 tscf) of\nnatural gas. As at December 31, 2022, Aramco’s portfolio included 535 (2021: 530) reservoirs within 142 (2021: 142) fields\ndistributed throughout the Kingdom and its territorial waters.\nAramco manages the Kingdom’s unique reserves and resources base"", '50 years (618) 104,425 2021-2070\nDeferred consideration 259,125 8 years (26,249) 235,867 2028\nLease liabilities – – (10,868) 53,575 Not defined\n614,303 (52,993) 536,077\n\nReserves information Reserves as at December 31, 2020\nAs at December 31, 2020, the Kingdom’s reserves in the fields Aramco operates consisted of 336.9 billion boe (2019: 336.7 billion boe),\nincluding 261.6 billion barrels (2019: 261.5 billion barrels) of crude oil and condensate, 36.0 billion barrels (2019: 36.0 billion barrels)\nof NGL and 238.8 tscf (2019: 237.4 tscf) of natural gas, including 150.2 tscf (2019: 146.8 tscf) of non-associated gas.\nUnder the Original Concession, which was in effect until December 24, 2017, Aramco’s rights with respect to hydrocarbons in the\nKingdom were not limited to a particular term. Accordingly, until such date, the Kingdom’s reserves in the fields Aramco operated\nwere the same as Aramco’s reserves. Effective December 24, 2017, the Concession limited Aramco’s exclusive right to explore,\ndevelop and produce the Kingdom’s hydrocarbon resources, except in the Excluded Areas, to an initial period of 40 years, which will be extended by the Government for 20 years provided Aramco satisfies certain conditions commensurate with current operating\npractices. In addition, the Concession may be extended for an additional 40 years beyond the prior 60-year period subject to Aramco\nand the Government agreeing on the terms of the extension (see Additional legal information — the Concession). The provision of a specified term in the Concession impacts the calculation of Aramco’s reserves as compared to the Kingdom’s reserves in the fields Aramco operates. The Concession also requires Aramco to meet domestic demand for certain hydrocarbons, petroleum products and LPGs through domestic production or imports.\nBased on the initial 40-year period and 20-year extension of the Concession, as at December 31, 2020, Aramco’s reserves were\n255.2 billion boe (2019: 258.6 billion boe). Aramco’s oil equivalent reserves consisted of 198.8 billion barrels (2019: 201.9 billion\nbarrels) of crude oil and condensate, 25.2 billion barrels (2019: 25.7 billion barrels) of NGL and 191.6 tscf (2019: 190.6 tscf) of\nnatural gas. As at December 31, 2020, Aramco’s portfolio included 517 (2019: 510) reservoirs within 137 (2019: 138) fields distributed\nthroughout the Kingdom and its territorial waters. Based on Aramco’s reserves data, as at December 31, 2020, Aramco’s oil equivalent\nreserves were sufficient for proved reserves life of 56 years.\nAramco manages the Kingdom’s unique reserves and resources base to optimize production and maximize long-term value pursuant to the Hydrocarbons Law, which mandates that Aramco’s hydrocarbon operations promote long-term productivity of the Kingdom’s reservoirs and support the prudent stewardship of its hydrocarbon resources. Aramco has historically replaced reserves on an organic basis through revisions of reserve estimates at existing fields and through delineation and exploration to identify new fields.\nAs a result, the Kingdom’s estimated proved reserves at the largest oil fields operated by Aramco have increased since the time of original production.\nThe following table sets forth Aramco’s estimates of its proved reserves based on the term of the Concession as at December 31, 2020 and 2019.\nNatural gas Crude oil Condensate NGL Combined (mmbbl) (mmbbl) (bscf) (mmboe) (mmbbl) (mmboe)\nReserves as at December 31, 2020 195,444 3,399 191,573 31,086 25,226 255,155\nReserves as at December 31, 2019 198,569 3,338 190,575 30,933 25,723 258,563\nThe following table sets forth the Kingdom’s estimates of its proved reserves in the fields Aramco operates as at December 31, 2020 and 2019.\nNatural gas Crude oil Condensate NGL Combined (mmbbl) (mmbbl) (', ""6,354 12 years (488) 3,743 2025\nPublic Investment Fund 4,594 7 to 12 years (458) 2,880 2023-2025\nSaudi Industrial Development Fund (Shari’a compliant) 3,248 6 to 7 years (296) 2,486 2022-2030\nIJARA/Procurement (Shari'a compliant) 1,811 10 years (90) 1,811 2029\nMarabaha (Shari'a compliant) 3,750 10 years – 1,084 2023\nWakala (Shari’a compliant) and other Islamic financing 345 10 years (270) 345 2029\nRevolving Credit Facility 49,350 1 to 3 year – 2,861 2020-2022\nShort-term bank financing 25,500 1 year – 9,803 2020\nDebentures – 10 to 30 years (71) 61,489 2027-2049\nOther – – (13) 2,329 Not defined\nFinance leases – 1 to 13 years (7,751) 40,934 2021-2043\n176,372 (12,902) 175,585\n\nReserves information Reserves as at December 31, 2019\nAs at December 31, 2019, the Kingdom’s reserves in the fields Saudi Aramco operates consisted of 336.7 billion boe (2018: 336.2 billion boe),\nincluding 261.5 billion barrels (2018: 261.5 billion barrels) of crude oil and condensate, 36.0 billion barrels (2018: 36.1 billion barrels) of NGLs and\n237.4 tscf (2018: 233.8 tscf) of natural gas, including 146.8 tscf (2018: 143.2 tscf) of non-associated gas.\nUnder the Original Concession, which was in effect until December 24, 2017, Saudi Aramco’s rights with respect to hydrocarbons in the\nKingdom were not limited to a particular term. Accordingly, until such date, the Kingdom’s reserves in the fields Saudi Aramco operated were\nthe same as Saudi Aramco’s reserves. Effective December 24, 2017, the Concession limited Saudi Aramco’s exclusive right to explore, develop\nand produce the Kingdom’s hydrocarbon resources, except in the Excluded Areas, to an initial period of 40 years, which will be extended by the Government for 20 years provided Saudi Aramco satisfies certain conditions commensurate with current operating practices. In addition, the\nConcession may be extended for an additional 40 years beyond the prior 60 year period subject to Saudi Aramco and the Government agreeing\non the terms of the extension (see Section 8: Additional financial and legal information – Material Agreements – The Concession). The provision of a specified term in the Concession impacts the calculation of Saudi Aramco’s reserves as compared to the Kingdom’s reserves in the fields Saudi Aramco operates. The Concession also requires Saudi Aramco to meet domestic demand for certain hydrocarbons, petroleum products and LPG through domestic production or imports.\nBased on the initial 40-year period and 20-year extension of the Concession, as at December 31, 2019, Saudi Aramco’s reserves were 258.6\nbillion boe (2018: 256.9 billion boe). Saudi Aramco’s oil equivalent reserves consisted of 201.9 billion barrels (2018: 201.4 billion barrels) of crude\noil and condensate, 25.7 billion barrels (2018: 25.4 billion barrels) of NGLs and 190.6 tscf (2018: 185.7 tscf) of natural gas. As at December 31,\n2019, Saudi Aramco’s portfolio included 510 (2018: 498) reservoirs within 138 (2018: 136) fields distributed throughout the Kingdom and its\nterritorial waters. Based on Saudi Aramco’s reserve data, as at December 31, 2019, Saudi Aramco’s oil equivalent reserves were sufficient for\nproved reserves life of 52 years.\nThe increase in the 2019 Concession reserves compared to 2018 is partly attributable to Saudi Aramco conducting 44 simulation studies, which resulted in reserves additions in some of the existing and producing fields. In addition, portfolio production optimization and latest advanced technology implementation led to a further increase in reserves.\nSaudi Aramco manages the Kingdom’s unique reserves and resources base to optimize production and maximize long-term value pursuant to"", 'and Kingdom. Aramco also depends on accidents involving explosions, fires, remediation costs. In addition, Aramco is critical assets to process its crude oil, blowouts and surface cratering; not insured against all risks, and insurance such as the Abqaiq facility, which is in connection with certain risks and its largest oil processing facility and\n• Power shortages or failures;\nhazards may not be available (see risk processes a significant amount of\n• Mechanical or equipment failures; — Aramco could be subject to losses from Aramco’s daily produced crude oil.\nrisks related to insufficient insurance). The East-West Pipeline, the Shaybah\n• Transportation interruptions and To the extent a subcontractor was NGL facility, the Abqaiq facility, and accidents;\nresponsible for the damage, Aramco’s the Khurais processing facility have\n• Tropical monsoons, storms, floods, recourse to the relevant subcontractor been subject to attacks within the last and other natural disasters (including may be limited by contract or the financial few years. If Aramco’s critical transport weather conditions associated with viability of such subcontractor. Such systems or processing facilities were climate change); and occurrences could also interrupt Aramco’s subject to significant disruption, it operations, delay Aramco’s projects or could have a material adverse effect on\n• Chemical spills, discharges, or releases of damage its reputation, which could have Aramco’s business, financial position, and toxic or hazardous substances or gases.\na material adverse effect on its business. results of operations (see risk — Terrorism and armed conflict may materially and adversely affect Aramco).\nRisk factors continued Estimates of proved hydrocarbon reserves depend on significant interpretations, assumptions, and judgments. Any significant deviation or changes in existing economic and operating conditions could affect the estimated quantity and value of Aramco’s proved reserves.\nAramco’s reserve estimates conform to There can be no assurance that the regulations, the terms of the Concession the SPE-PRMS definitions and guidelines, interpretations, assumptions and or other events. Further, declining which are internationally recognized judgments utilized by Aramco to estimate hydrocarbon prices may cause certain industry standards. Aramco’s and D&M’s proved reserves, or those utilized by D&M proved reserves to no longer be estimates of the quantity of Aramco’s for the purposes of preparing its considered commercially viable, which proved hydrocarbon reserves depend on certification letter, will prove to be could result in downward adjustments to significant interpretations, assumptions accurate. Any significant deviation from Aramco’s estimates of Aramco’s proved and judgments relating to available these interpretations, assumptions or reserves, impairment of Aramco’s assets, geological, geophysical, engineering, judgments could materially affect the or changes to Aramco’s capital contractual, economic and other estimated quantity or value of Aramco’s expenditures and production plans.\ninformation, and take into account proved reserves. In addition, these Moreover, proved reserves estimates existing economic and operating estimates could change due to new are subject to change due to changes in conditions and commercial viability as at information from production or drilling published rules or changes in guidelines.\nthe date the reserve estimates are made. activities, changes in economic factors, Any material reduction in the quantity or including changes in the price of value of Aramco’s proved reserves could hydrocarbons, changes to laws, adversely affect Aramco’s business.\nThe independent third-party certification letter does not cover the entirety of the Kingdom’s estimated reserves.\nAramco retained independent petroleum scope because of the overall scale of the the same Concession time period. There consultants, D&M, to independently Kingdom’s reserves and the concentration is no independent third-party certification\nevaluate, as at December 31, 2019, of deposits in the major reservoirs that letter with respect to the balance of the\nreservoirs Aramco believes accounted were assessed. Further independent Kingdom’s proved oil equivalent reserves for approximately 85% of its proved oil assessment of the Kingdom’s smaller or as at a more recent date than\nreserves to which it has rights under the reservoirs would have taken several years December 31, 2019. Any material\nConcession and remain to be produced to complete. D&M’s reserves estimation deviation in the quantity of proved\nafter December 31, 2019, but before of 214.2 billion barrels of oil equivalent reserves could have a material adverse\nDecember 31, 2077 (the end of the initial reserves for the reservoirs it evaluated effect on Aramco’s financial position.\n40-year term of the Concession plus the was within 1% of Aramco’s internal first 20-year extension). Aramco chose this estimation for the same reservoirs for\nAramco could be subject to losses from risks related to insufficient insurance.\nAramco insures against risk primarily major crude oil spills, environmental risks for which its insurance does not by self-insuring through its captive disasters, terrorist attacks, or acts', 'orial waters. Based on Saudi Aramco’s reserve data, as at December 31, 2019, Saudi Aramco’s oil equivalent reserves were sufficient for\nproved reserves life of 52 years.\nThe increase in the 2019 Concession reserves compared to 2018 is partly attributable to Saudi Aramco conducting 44 simulation studies, which resulted in reserves additions in some of the existing and producing fields. In addition, portfolio production optimization and latest advanced technology implementation led to a further increase in reserves.\nSaudi Aramco manages the Kingdom’s unique reserves and resources base to optimize production and maximize long-term value pursuant to the Hydrocarbons Law, which mandates that Saudi Aramco’s hydrocarbon operations promote long-term productivity of the Kingdom’s reservoirs and support the prudent stewardship of its hydrocarbon resources. Saudi Aramco has historically replaced reserves on an organic basis through revisions of reserve estimates at existing fields and through delineation and exploration to identify new fields. As a result, the Kingdom’s estimated proved reserves at the largest oil fields operated by Saudi Aramco have increased since the time of original production.\nThe following table sets forth Saudi Aramco’s estimates of its proved reserves of crude oil, condensate, natural gas and NGLs based on the term\nof the Concession as at December 31, 2019 and 2018.\nNatural gas Crude oil Condensate NGLs Combined (mmbbl) (mmbbl) (bscf) (mmboe) (mmbbl) (mmboe)\nReserves as at December 31, 2019 198,569 3,338 190,575 30,933 25,723 258,563\nReserves as at December 31, 2018 198,194 3,191 185,726 30,120 25,385 256,890\nThe following table sets forth the Kingdom’s estimates of its proved reserves of crude oil, condensate, natural gas and NGLs in the fields\nSaudi Aramco operates as at December 31, 2019 and 2018.\nNatural gas Crude oil Condensate NGLs Combined (mmbbl) (mmbbl) (bscf) (mmboe) (mmbbl) (mmboe)\nReserves as at December 31, 20191 257,125 4,410 237,368 39,119 36,043 336,697\nReserves as at December 31, 2018 257,270 4,257 233,766 38,519 36,144 336,190\n1. Total “raw” natural gas reserves additions of 9.2 tscf in 2019, comprising 7.6 tscf of non-associated gas and 1.6 tscf of associated gas.\nnoitamrofni lagel\n\nlaicnanfi lanoitidda\n\nSaudi Aramco’s reserve estimates conform to the SPE-PRMS definitions and guidelines, which is the internationally recognized industry standard sponsored by the Society of Petroleum Engineers, the American Association of Petroleum Geologists, the World Petroleum Council, the Society of Petroleum Evaluation Engineers, the Society of Exploration Geophysicists, the Society of Petrophysicists and Well Log Analysts and the European Association of Geoscientists and Engineers. To estimate or update Saudi Aramco’s reserve estimates, the Upstream segment employees responsible for reserves calculations perform technical analyses that are reviewed internally by progressively higher levels of management until finalized at year-end. Saudi Aramco annually updates its estimates as it acquires and interprets new data. For reservoirs that have been producing and have established certain performance trends, Saudi Aramco is typically able to reliably forecast the reservoir’s future production. For reservoirs that have little to no production history and new discoveries, Saudi Aramco undertakes further analysis in addition to multidisciplinary evaluation to formulate production forecasts.\n\nRegulation of the oil and gas industry in the Kingdom The following paragraphs summarize certain key regulation and legislation to which Saudi Aramco is subject as an operator in the oil and gas industry.\nLaw on hydrocarbons Overview\nThe Hydrocarbons Law was enacted by Royal Decree No. M/37, dated 2/4/1439H (corresponding to December 20, 2017) and applies to\nhydrocarbons, hydrocarbon resources and the hydrocarbon operations existing within the territory of the Kingdom.\nLicenses No hydrocarbon operations can be conducted in the Kingdom without obtaining a license in accordance with the Hydrocarbons Law. The Government grants licenses related to hydrocarbon operations pursuant to regulations, procedures and policies established from time to time, which outline the terms and conditions relating to the granting of a license.\nThe grant of a license pursuant to the Hydrocarbons Law does not, and cannot, confer any right of ownership of the']","Aramco prepares and reviews its reserve estimates through a structured process involving the following steps:

- **Technical Analyses**: Employees in the Upstream segment responsible for reserves calculations perform detailed technical analyses to estimate or update reserves.

- **Internal Review**: These analyses are reviewed internally by progressively higher levels of management to ensure accuracy and compliance with standards.

- **Annual Updates**: Aramco updates its reserve estimates annually as it acquires and interprets new data.

- **Forecasting**: For producing reservoirs with established performance trends, Aramco can reliably forecast future production. For reservoirs with little to no production history or new discoveries, further analysis and multidisciplinary evaluation are conducted to formulate production forecasts.

This process ensures that Aramco's reserve estimates conform to the SPE-PRMS definitions and guidelines, which are recognized industry standards (see context on reserve estimates).","Aramco’s reserve estimates follow SPE-PRMS definitions and guidelines. Upstream employees perform technical analyses that are reviewed through higher management levels, and the estimates are updated annually as new data is acquired and interpreted.",0.6363636363636364,0.9999996143689699,0.8592592592449383,1.0
How did Aramco finish paying the deferred amount owed for the chemicals stake bought from the public investment fund?,"['corresponding to September 17, 2019), which extends the period for which the\nCompany will not be obligated to pay royalties on condensate production after the current five-year period for an additional\n10-year period, which may be further extended for subsequent 10-year periods, unless the Government determines the\neconomics impacting gas field development do not warrant such an extension.\nThe Government has the option to take all or part of the royalty in-kind from the produced hydrocarbons.\nAcquisition of 70% equity interest in SABIC\nOn June 16, 2020, Aramco acquired the PIF’s 70% equity interest in SABIC for total consideration of $69.1 billion. SABIC\noperates in over 50 countries and produces a range of chemicals. Aramco believes that purchasing this majority interest in SABIC advances its strategy to increase the proportion of petrochemicals production in its downstream portfolio and supports Aramco’s downstream growth ambitions. In addition, Aramco believes that the acquisition facilitates the application of SABIC’s expertise in the chemicals industry to Aramco’s existing and future integrated downstream facilities.\nThe March 27, 2019, purchase agreement provided that the purchase price for the acquisition would be paid on the closing date\nin the form of a cash payment equal to 50% of the purchase price (to be adjusted for certain expenses) and a seller loan in an\namount equal to 50% of the purchase price with the last payment due on or before December 31, 2021. On October 6, 2019,\nAramco and the PIF agreed to amend the payment terms to provide that, on the closing date, 36% of the purchase price (to be adjusted for certain expenses) would be paid in cash and 64% would be paid in the form of a seller loan with the last payment\ndue on or before September 30, 2025.\nOn June 16, 2020, Aramco and the PIF agreed to further amend the payment terms to provide that the entire purchase price\nwould be paid over several installments pursuant to a seller loan provided by the PIF (deferred consideration).\nOn January 24, 2022, the Company, in agreement with PIF, made a partial prepayment of $7.6 billion, which reduced the\nprincipal amounts of two promissory notes payable on or before April 7, 2024 and April 7, 2026, by $7.0 billion and $1.0 billion,\nrespectively. In addition, on June 30, 2022, the Company made a second partial prepayment of $10.2 billion, which reduced the\nprincipal amount of a promissory note payable on or before April 7, 2025 by $2.5 billion and further reduced the principal amount of the promissory note payable on or before April 7, 2026 by $9.5 billion.\nAfter taking these payments into account, as at December 31, 2022, future loan payments, which are represented by promissory\nnotes, are payable between April 7, 2023 and April 7, 2028 (the last payment), as follows:\n1. On or before April 7, 2023, an amount equal to $10.5 billion plus a loan charge of $500 million;\n2. On or before April 7, 2024, an amount equal to $3.5 billion plus a loan charge of $600 million;\n3. On or before April 7, 2025, an amount equal to $8.0 billion plus a loan charge of $800 million;\n4. On or before April 7, 2026, an amount equal to $6.6 billion plus a loan charge of $1.5 billion;\n5. On or before April 7, 2027, a loan charge of $1.0 billion; and\n6. On or before April 7, 2028, a loan charge of $1.0 billion.\nOn March 7, 2023, the Company agreed with PIF to make a third partial prepayment of $15.7 billion on or before March 15, 2023.\nThis partial prepayment will fully reduce the outstanding principal amount of $3.5 billion of the promissory note payable on or before April 7, 2024, and will partially reduce the outstanding principal amounts of the promissory notes payable on or before\nApril 7, 2025, and April 7, 2026, by $3.8 billion and $5.7 billion, respectively. The outstanding amounts of the loan charge\npromissory notes payable between 2024 and 2028, aggregating to $4.9 billion, will also be fully reduced. After taking this\nprepayment', 'PC for a 20-year period. Concurrently, AGPC granted the Company the exclusive right to use, operate and maintain the pipelines network during the 20-year period in exchange for a quarterly, volume-based tariff payable by the Company to AGPC. The tariff is backed\nby minimum volume commitments. The Company will at all times retain title to, and operational control of, the pipelines.\n35. Investments in affiliates (a) Investments in subsidiaries (i) Saudi Basic Industries Corporation (""SABIC"")\nOn June 16, 2020, the Company acquired a 70% equity interest in SABIC from the Public Investment Fund (""PIF""), for SAR 259,125\n($69,100). This equates to SAR 123.39 ($32.90) per share.\nSABIC is a global diversified chemicals company headquartered in Riyadh, Saudi Arabia. SABIC manufactures on a global scale in the Americas, Europe, Middle East, and Asia Pacific, making different products, including chemicals, commodity and high-performance plastics, specialties, agri-nutrients and metals. The acquisition of the equity interest in SABIC is consistent with Saudi Aramco’s long-term Downstream strategy to grow its integrated refining and petrochemicals capacity and create value from integration across the hydrocarbon value chain.\nThe transaction resulted in the Company obtaining control of SABIC. The Company accounts for acquisitions of subsidiaries using the acquisition method of accounting, including those acquisitions under common control and having commercial substance. This requires recognition of the assets acquired and liabilities assumed at fair value as of the acquisition date.\n\nConsolidated financial statements All amounts in millions of Saudi Riyals unless otherwise stated 35. Investments in affiliates continued Saudi Aramco engaged an independent valuer in order to determine the fair values of the assets and liabilities of SABIC as part of the purchase price allocation. The fair values of the identifiable assets and liabilities are as follows:\nCash and cash equivalents 27,515 Trade receivables 13,829\nInventories 24,919 Other current assets and receivables 4,803\nShort-term investments 8,405 Property, plant and equipment (Note 5) 179,313\nIntangible assets (Note 6) 37,079 Investments in joint ventures and associates 51,864\nOther non-current assets 11,598 Trade and other payables (23,460)\nIncome tax and zakat payable (4,178)\nCurrent borrowings (8,149)\nNon-current borrowings (37,174)\nPost-employment benefit obligations (16,549)\nOther non-current liabilities (9,067)\nTotal identified net assets at fair value 260,748 Non-controlling interests (100,739)\nGoodwill (Note 6) 99,116 Purchase consideration in the form of promissory notes 259,125\nNon-controlling interests which result from both the Company’s partial ownership of SABIC, as well as SABIC’s partial ownership of a number of its subsidiaries, were measured at their proportionate share of recognized net assets.\nThe purchase price amount is to be paid over several installments pursuant to a seller loan provided by PIF. Loan payments, which are represented by promissory notes denominated in USD, are as follows:\nPrincipal loan amount Loan charge On or before August 2, 2020 26,250 – On or before April 7, 2021 18,750 –\nOn or before April 7, 2022 31,875 1,875\nOn or before April 7, 2023 39,375 1,875\nOn or before April 7, 2024 39,375 2,250\nOn or before April 7, 2025 39,375 3,000\nOn or before April 7, 2026 64,125 5,625\nOn or before April 7, 2027 – 3,750 On or before April 7, 2028 – 3,750\nTotal purchase price and loan charges 259,125 22,125\nPayments to date (45,000) –\nTotal amount of outstanding installments 214,125 22,125\nThe combined fair value of the principal loan amounts and loan charges on the date of acquisition amounted to SAR 259,125 ($69,100).\nThis is subsequently measured at amortized cost using the effective interest method and is presented on a combined basis as ‘Deferred consideration’ within ‘Borrowings’ (Note 20).\nSaudi Aramco had agreed to make an accelerated payment of SAR 11,250 ($3,000) in April 2022 based on the occurrence of certain\nmarket conditions in 2021. At December 31, 2021, it was determined that the relevant conditions were not met during 2021 and, as a\nresult, no accelerated payment will be required in April 2022.', '/1/1441H (corresponding to September 17, 2019), which extends the period for which the Company will not be obligated to pay\nroyalties on condensate production after the current five-year period for an additional 10-year period, which may be further extended for subsequent 10-year periods, unless the Government determines the economics impacting gas field development do not warrant\nsuch an extension.\nThe Government has the option to take all or part of the royalty in-kind from the produced hydrocarbons.\nAcquisition of 70% equity interest in SABIC\nOn June 16, 2020, Aramco acquired the PIF’s 70% equity interest in SABIC for total consideration of $69.1 billion. SABIC operates in\nover 50 countries and produces a range of chemicals. Aramco believes that purchasing this majority interest in SABIC advances its strategy to increase the proportion of petrochemicals production in its downstream portfolio and supports Aramco’s downstream growth ambitions. In addition, Aramco believes that the acquisition facilitates the application of SABIC’s expertise in the chemicals industry to Aramco’s existing and future integrated downstream facilities.\nThe March 27, 2019, purchase agreement provided that the purchase price for the acquisition would be paid on the closing date in\nthe form of a cash payment equal to 50% of the purchase price (to be adjusted for certain expenses) and a seller loan in an amount\nequal to 50% of the purchase price with the last payment due on or before December 31, 2021. On October 6, 2019, Aramco and the\nPIF agreed to amend the payment terms to provide that, on the closing date, 36% of the purchase price (to be adjusted for certain expenses) would be paid in cash and 64% would be paid in the form of a seller loan with the last payment due on or before\nSeptember 30, 2025.\nOn June 16, 2020, Aramco and the PIF agreed to further amend the payment terms to provide that the entire purchase price would be\npaid over several installments pursuant to a seller loan provided by the PIF. A loan payment of $7.0 billion was paid on August 2, 2020.\nFuture loan payments, which are represented by promissory notes, are payable between April 7, 2021, and April 7, 2028 (the last payment), as follows:\ni. on or before April 7, 2021, an amount equal to $5.0 billion;\nii. o n or before April 7, 2022, an amount equal to $8.5 billion plus a loan charge of $500 million (subject to reduction by $300 million\nin the event that the accelerated payment described below is made);\niii. on or before April 7, 2023, an amount equal to $10.5 billion plus a loan charge of $500 million;\niv. on or before April 7, 2024, an amount equal to $10.5 billion plus a loan charge of $600 million;\nv. on or before April 7, 2025, an amount equal to $10.5 billion plus a loan charge of $800 million;\nvi. o n or before April 7, 2026, an amount equal to $17.1 billion (provided that (a) $3.0 billion of such amount is subject to acceleration\nas described below and (b) such amount will be reduced by the amount of any withholding taxes and similar amounts that Aramco incurs with respect to payments made under any promissory note as a result of the PIF’s transfer thereof to a transferee who is not tax resident in the Kingdom) plus a loan charge of $1.5 billion;\nvii. o n or before April 7, 2027, a loan charge of $1.0 billion (subject to reduction to reflect certain withholding amounts as described\nabove); and\nviii. o n or before April 7, 2028, a loan charge of $1.0 billion (subject to reduction to reflect certain withholding amounts as described\nabove).\nIn the event that the average Brent price during 2021 meets or exceeds $60.0 per barrel and Aramco’s average daily production of crude oil during 2021 exceeds ten million barrels per day, Aramco will be required to pay $3.0 billion of the payment otherwise due\nin April 2026 on April 7, 2022 (the “Early Payment Event”).\nnotiamrofni lagel\n\nlaicnanfi lanotiiddA\n\nSubject to the exceptions set forth below, the promissory notes are freely transferable and assignable and may be pledged by the PIF.\nHowever, if the PIF receives any offer or commitment', 'Company’s official selling prices. An effective royalty rate was applied to production value and was based each month on the average daily price quotes for Brent crude on the Intercontinental Exchange (or any successor exchange) for each day during such period. The effective royalty rate was determined based on a baseline rate of 20% applied to the value of production at\nprices up to $70 per barrel, a marginal rate of 40% applied to the value of production at prices above $70 per barrel up to $100 per\nbarrel and a marginal rate of 50% applied to the value of production at prices above $100 per barrel.\n• With respect to the Company’s production of natural gas, ethane and NGL, excluding those volumes used by the Company for upstream operations and related operations (including transportation, pipelines and storage and export facilities, fractionation plants, gas and NGL plants), royalties are calculated based on a flat royalty rate of 12.5% applied to a factor established by the\nMinistry of Energy. As at December 31, 2021, the factor to which this royalty is applied is $0.035 per mmBTU for NGL (propane,\nbutane and natural gasoline) and $0.00 per mmBTU for natural gas (methane) and ethane. The Minister of Energy may amend the price on which such values are based, taking into account the price that achieves the targeted internal rate of return set by the Minister of Energy in coordination with the Company.\nCommencing January 1, 2020, the Concession Amendment amended the royalties payable to the Government with respect to the Company’s production of crude oil and condensates, including those used by the Company in its operations, so that the effective royalty\nrate is determined based on a baseline rate of 15% applied to the value of production at prices up to $70 per barrel, a marginal rate of\n45% applied to the value of production at prices above $70 per barrel up to $100 per barrel and a marginal rate of 80% applied to the\nvalue of production at prices above $100 per barrel.\n\nAdditional financial and legal information In order to increase gas production to meet the needs of the Kingdom, the Government may choose not to collect royalties on natural gas, NGL (including ethane) and condensates for a period specified by the Government with respect to any field as required by the\neconomics of such field’s development. Pursuant to the Ministry of Energy’s authority under the Concession, on February 25, 2018,\nthe Ministry of Energy decided not to collect royalties from the Company on condensate production for a grace period of five years\nbeginning on January 1, 2018. On September 17, 2019, the Ministry of Energy issued Ministerial Resolution No. 1/422/1441, dated\n18/1/1441H (corresponding to September 17, 2019), which extends the period for which the Company will not be obligated to pay\nroyalties on condensate production after the current five-year period for an additional 10-year period, which may be further extended for subsequent 10-year periods, unless the Government determines the economics impacting gas field development do not warrant\nsuch an extension.\nThe Government has the option to take all or part of the royalty in-kind from the produced hydrocarbons.\nAcquisition of 70% equity interest in SABIC\nOn June 16, 2020, Aramco acquired the PIF’s 70% equity interest in SABIC for total consideration of $69.1 billion. SABIC operates in\nover 50 countries and produces a range of chemicals. Aramco believes that purchasing this majority interest in SABIC advances its strategy to increase the proportion of petrochemicals production in its downstream portfolio and supports Aramco’s downstream growth ambitions. In addition, Aramco believes that the acquisition facilitates the application of SABIC’s expertise in the chemicals industry to Aramco’s existing and future integrated downstream facilities.\nThe March 27, 2019, purchase agreement provided that the purchase price for the acquisition would be paid on the closing date in the\nform of a cash payment equal to 50% of the purchase price (to be adjusted for certain expenses) and a seller loan in an amount equal to\n50% of the purchase price with the last payment due on or before December 31, 2021. On October 6, 2019, Aramco and the PIF agreed\nto amend the payment terms to provide that, on the closing date, 36% of the purchase price (to be adjusted for certain expenses) would\nbe paid in cash and 64% would be paid in the form of a seller loan with the last payment due on or before September 30, 2025.\nOn June 16, 2020, Aramco and the PIF agreed to', '. As a result of this planned sale, production levels.\nAramco’s results of operations and cash SABIC reclassified the related assets and flows are primarily driven by market prices Portfolio and funding optimization liabilities as held for sale and recognized a and volumes sold of hydrocarbons, as well In February, SABIC completed the sale of its remeasurement loss of ﷼ 13.4 billion\nas refined and chemicals products. 20.62% shareholding in ALBA to Ma’aden ($3.57 billion). The major classes of assets\nInternational crude oil prices have for proceeds of approximately ﷼ 3.6 billion reclassified as held for sale include property, fluctuated significantly in the past and may ($0.96 billion). Upon receipt of the plant, and equipment, and other assets of\nremain volatile. Fluctuations in the price at proceeds, the carrying amount of the ﷼ 22.2 billion ($5.92 billion). In addition,\nwhich Aramco is able to sell crude oil could investment in ALBA of ﷼ 3.3 billion liabilities reclassified as held for sale are cause Aramco’s results of operations and ($0.88 billion) was derecognized and the primarily comprised of post-employment\ncash flow to vary significantly. Crude oil is difference was recognized as a gain in the benefit obligations, trade payables, and\nalso a major component of the cost of consolidated statement of income. This other liabilities of ﷼ 6.4 billion ($1.71 billion).\nproduction of refined products and resulted in an increase in cash and cash This resulted in an increase in impairment chemicals that use hydrocarbons as a equivalents and a decrease in assets and held for sale remeasurement losses, an feedstock. However, because prices for classified as held for sale in the consolidated increase in assets and liabilities classified as refined products and chemicals may not balance sheet. held for sale, and a decrease in the related timely adjust to reflect movements in crude assets and liabilities.\nDuring 2025, SABIC received ﷼ 3.2 billion\noil prices, such movements could, in the ($0.85 billion) of the deferred consideration short term, positively or negatively impact related to the sale of Hadeed to PIF in 2024.\nThis resulted in an increase in cash and cash equivalents, and a decrease in current other\n11.1 8.0 22.5\n\nCash proceeds from the sale of an Cash proceeds from bonds and Additional stake in Petro Rabigh equity interest in JMGC Sukuk issuance Class A shares\n\nAramco overview Results and Sustainability Risk Organizational structure Additional financial Consolidated and strategy performance and corporate governance and legal information financial statements Investments in affiliates Financing arrangements In June, Aramco announced the completion In January, Aramco completed the In March, Aramco received the final tranche of an international bond issuance\nacquisition of a 50% equity interest in BHIG, of ﷼ 2.0 billion ($0.53 billion) related to the aggregating to an equivalent of ﷼ 18.8\na wholly-owned subsidiary of APQ. financing arrangement with JIGPC, a joint billion ($5.0 billion) under its GMTN Following the initial investment in January, operation of Aramco, in which Aramco Programme. The issuance consists of three\nsubsequent investments were made during recognized an amount of ﷼ 1.6 billion ($0.43 tranches, with the first tranche of ﷼ 5.63\nthe year, resulting in a total investment of billion), representing the amount due to the billion ($1.5 billion) with five-year maturities\n﷼ 1.0 billion ($0.27 billion). The transaction other shareholders of JIGPC. This resulted in and a 4.75% coupon rate, a second tranche\nresulted in a reduction in cash and cash an increase in cash and cash equivalents and of ﷼ 4.69 billion ($1.25 billion) with 10-year\nequivalents, and an increase in investments an increase in borrowings. maturities and a 5.375% coupon rate, and a\nin joint ventures and associates. third tranche of ﷼ 8.44 billion ($2.25 billion)\nIn March, SATORP, a joint operation of\nwith 30-year maturities and a 6.375%\nIn January, Aramco and Sumitomo Aramco, entered into an asset transfer coupon rate. The notes are listed on the completed the waiver of the remaining transaction with BHIG, a joint venture of London Stock Exchange’s Main Market. This amounts of their respective shareholder Aramco, for upfront cash proceeds of resulted in an increase in cash and cash\nloans to Petro Rabigh of ﷼ 0.94 billion �', 'modity swaps 78 159 28 265\nCurrency forward contracts – 212 – 212\nProvisions and other liabilities:\nFinancial liability against options – 1,995 – 1,995\nTotal liabilities 78 3,240 28 3,346\n\nTrade and other payables:\nInterest rate swaps – 338 – 338\nCommodity swaps – 521 – 521\nCurrency forward contracts – 109 – 109\nTotal liabilities – 968 – 968\n\n,13 rebmeceD dedne\n\nstnemetats laicnanfi detadilosno C\n\n3. Financial risk management continued The valuation techniques for Saudi Aramco’s investments in securities are described in Note 11. The changes in Level 3 investments in securities for the years ended December 31, 2020 and 2019 are as follows:\n2020 2019\nJanuary 1 6,162 5,530\nAcquisition 262 –\nNet (disposals) additions (1,681) 286\nNet movement in unrealized fair value (299) 296\nRealized gain 526 50\nDecember 31 4,970 6,162\nThe movement in trade receivables related to contracts with provisional pricing arrangements mainly relates to sales transactions, net of settlements, made during the period, resulting from contracts with customers (Note 13). Unrealized fair value movements on these trade receivables are not significant.\nThe change in commodity swaps primarily relate to purchase and sales derivative contracts including recognition of a gain or loss that results from adjusting a derivative to fair value. Fair value movements on these commodity swaps are not significant.\n4. Acquisition of SABIC\nOn June 16, 2020, the Company acquired a 70% equity interest in SABIC from the Public Investment Fund (""PIF""), for SAR 259,125\n($69,100). This equates to SAR 123.39 ($32.90) per share.\nSABIC is a global diversified chemicals company headquartered in Riyadh, Saudi Arabia. SABIC manufactures on a global scale in the Americas, Europe, Middle East, and Asia Pacific, making different products, including chemicals, commodity and high-performance plastics, specialties, agri-nutrients and metals. The acquisition of the equity interest in SABIC is consistent with Saudi Aramco’s long-term Downstream strategy to grow its integrated refining and petrochemicals capacity and create value from integration across the hydrocarbon value chain.\nThe transaction resulted in the Company obtaining control of SABIC. The Company accounts for acquisitions of subsidiaries using the acquisition method of accounting, including those acquisitions under common control and having commercial substance. This requires recognition of the assets acquired and liabilities assumed at fair value as of the acquisition date.\nSaudi Aramco has engaged an independent valuer in order to determine the fair values of the assets and liabilities of SABIC as part of the purchase price allocation. The preliminary fair values of the identifiable assets and liabilities are as follows:\nCash and cash equivalents 27,515 Trade receivables 13,829\nInventories 24,919 Other current assets and receivables 4,803\nShort-term investments 8,405 Property, plant and equipment (Note 6) 179,313\nIntangible assets (Note 7) 37,079 Investments in joint ventures and associates 51,864\nOther non-current assets 11,598 Trade and other payables (23,460)\nIncome tax and zakat payable (4,178)\nCurrent borrowings (8,149)\nNon-current borrowings (37,174)\nPost-employment benefit obligations (16,549)\nOther non-current liabilities (9,067)\nTotal identified net assets at fair value 260,748 Non-controlling interests (100,739)\nGoodwill (Note 7) 99,116 Purchase consideration in the form of promissory notes 259,125\nNon-controlling interests which result from both the Company’s partial ownership of SABIC, as well as SABIC’s partial ownership of a number of its subsidiaries, were measured at their proportionate share of recognized net assets.\n\n,13 rebmeceD dedne\n\nstnemetats laicnanfi detadilosno C\n\n4. Acquisition of SABIC continued The purchase price amount is to be paid over several installments pursuant to a seller loan provided by PIF. Loan payments, which are represented by promissory notes denominated in US Dollars, are as follows:\nPrincipal loan amount Loan charge On or before August 2, 2020 26,250 – On or before April 7, 2021 18,750 –\nOn or before April 7, 2022 31,875 1,875\nOn or before April 7, 2023 39,375 1,875\nOn or before April 7, 2024 39,375', 'the nine Sustainable and progressive dividends months ended September 30, 2025 Aramco’s results of operations and cash flows are primarily driven by market prices and volumes sold of hydrocarbons as well as Dividends paid – first nine months of 2025 refined and chemical products.\n﷼ 240.3\n$64.1\nShareholders’ returns bn bn\n• During the first nine months of 2025, the Company paid base\ndividends of ﷼ 237.86 billion ($63.4 billion), and performance-\nlinked dividends of ﷼ 2.47 billion ($0.7 billion). These dividend\npayments, aggregating to ﷼ 240.3 billion ($64.1 billion), reflect\nPortfolio optimization Aramco’s drive to deliver value and share the upside of its financial performance with shareholders. • In February, SABIC completed the sale of its 20.62% shareholding in ALBA to Ma’aden for proceeds of\napproximately ﷼ 3.6 billion ($0.96 billion). Upon receipt of the\nInvestment in affiliates proceeds, the carrying amount of the investment in ALBA of\n• In January, Aramco completed the acquisition of a 50% equity\n﷼ 3.3 billion ($0.88 billion) was derecognized and the difference\ninterest in BHIG, a wholly-owned subsidiary of APQ. Following was recognized as a gain in the consolidated statement of the initial investment in January, subsequent investments were income. This resulted in an increase in cash and cash equivalents made during the year, resulting in a total investment of ﷼ 1.0 and a decrease in assets classified as held for sale in the billion ($0.27 billion). The transaction resulted in a reduction in\nconsolidated balance sheet.\ncash and cash equivalents, and a corresponding increase in\n• During the first nine months of 2025, SABIC received ﷼ 3.2 investments in joint ventures and associates.\nbillion ($0.85 billion) of the deferred consideration related to\n• In January, Aramco and Sumitomo completed the waiver of the the sale of Hadeed to PIF in 2024. This resulted in an increase in remaining amounts of their respective shareholder loans to cash and cash equivalents, and a decrease in current other\nPetro Rabigh of ﷼ 0.9 billion ($0.24 billion) each. As a result,\nassets and receivables. In addition, the remaining amount of the Aramco derecognized its loan receivable, amounting to ﷼ 0.9\ndeferred consideration of ﷼ 1.9 billion ($0.5 billion) was\nbillion ($0.24 billion), and recorded an addition to its equity reclassified from non-current other assets and receivables to investment in Petro Rabigh. This resulted in a decrease in current other assets and receivables.\nnon-current other assets and receivables, and a corresponding increase in investments in joint ventures and associates.\nSubsequent to the nine months ended September 30, 2025, in\nOctober, Aramco completed the acquisition of an additional 22.5% stake of class A shares with voting rights in Petro Rabigh\nfrom Sumitomo for ﷼ 2.6 billion ($0.7 billion). As part of the\ntransaction, Petro Rabigh issued a new class of non-voting class\nB shares to Aramco and Sumitomo for ﷼ 2.6 billion ($0.7 billion)\neach.\n• In September, Aramco recognized an initial investment of ﷼ 2.3 billion ($0.6 billion) related to an integrated refining and petrochemical complex in Fujian province, China, and established Fujian Sinopec Aramco Refining and Petrochemical Co. Ltd. joint venture. This resulted in an increase in investments in joint ventures and associates, and a corresponding increase in trade payables and other liabilities.\n\nAll amounts in millions unless otherwise stated ▼ Aramco headquarters, Dhahran, Saudi Arabia Financing arrangements\n• In March, SATORP, a joint operation of Aramco, entered into an • In June, Aramco announced the completion of an international asset transfer transaction with BHIG, a joint venture of Aramco, bond issuance aggregating to an equivalent of ﷼ 18.8 billion\nfor upfront cash proceeds of ﷼ 1.5 billion ($0.4 billion), of which ($5.0 billion) under its GMTN Programme. The issuance consists\nAramco’s share was ﷼ 0.9 billion ($0.24 billion). As part of the of three tranches, with the first tranche of ﷼ 5.63 billion ($1.5\ntransaction, SATORP transferred the ownership of', 'the most significant factors that energy security goals or for any other reason. Therefore, Aramco’s have impacted Aramco’s financial position, results of operations, results of operations and cash flows may depend in part on these\nand cash flows for the year ended December 31, 2024. sovereign decisions with respect to production levels.\nSupply, demand, and prices for hydrocarbons, Portfolio and funding optimization\nand refined and chemicals products In April 2024, the Company repaid ﷼ 7.5 billion ($2.0 billion)\nAramco’s results of operations and cash flows are primarily driven associated with the second tranche of its unsecured notes issued in\nby market prices and volumes sold of hydrocarbons, as well as 2019. In addition, in June 2024 the Company repaid ﷼ 3.75 billion\nrefined and chemicals products. International crude oil prices have ($1.0 billion) relating to the first tranche of its international sukuk fluctuated significantly in the past and may remain volatile. trust certificates issued in 2021. These repayments resulted in a\nFluctuations in the price at which Aramco is able to sell crude oil decrease in cash and cash equivalents and a corresponding could cause Aramco’s results of operations and cash flow to vary decrease in borrowings during the year.\nsignificantly. Crude oil is also a major component of the cost of In May 2024, SABIC completed the transfer of its ownership production of refined products and chemicals that use in Hadeed to PIF. As part of the transfer, SABIC received cash hydrocarbons as a feedstock. However, because prices for refined\nconsideration of ﷼ 1.2 billion ($0.32 billion) with the remaining\nproducts and chemicals may not timely adjust to reflect movements\namount of ﷼ 4.8 billion ($1.3 billion) recognized as deferred\nin crude oil prices, such movements could, in the short-term, consideration. In addition, Hadeed’s total assets and liabilities positively or negatively impact margins for downstream products\nof ﷼ 19.1 billion ($5.1 billion) and ﷼ 9.8 billion ($2.6 billion)\nthat use crude oil as a feedstock. The prices for refined products respectively, were derecognized. This resulted in an increase in cash and chemicals are also impacted by changes in supply and demand Dhahran, Saudi Arabia\n\n5 . O RGANIZATIONAL 6. A DDITIONAL STRUCTURE AND FINANCIAL 7. C ONSOLIDATED\n\nAND STRATEGY PERFORMANCE 3. SUSTAINABILITY 4. RISK GOVERNANCE INFORMATION STATEMENTS and cash equivalents and other assets and receivables, and a Government share transfer and secondary public offering\ncorresponding decrease in assets and liabilities classified as held for In March 2024, the Government announced it had transferred 8.0%\nsale in the consolidated balance sheet. of the Company’s issued shares to PIF’s wholly-owned companies.\nThis private transfer did not affect the Company’s total number of During 2024, SATORP finalized external long-term debt financing issued shares and had no impact on the Company’s operations, arrangements which comprise conventional bank borrowings, strategy, dividend distribution policy, or governance framework.\nexport credit agencies, Wakala facility, and SIDF facility for a petrochemical facility expansion. The aggregate amount of the In June 2024, the Government completed a secondary public\narrangements totaled ﷼ 25.8 billion ($6.9 billion), with Aramco’s offering of ordinary shares of Aramco, resulting in the sale of\nshare representing ﷼ 16.1 billion ($4.3 billion). As at December 31, approximately 1.7 billion shares, representing 0.7% of the\n2024, the total outstanding amounts under these financing Company’s issued shares. The offering attracted strong\narrangements were ﷼ 5.3 billion ($1.4 billion), of which Aramco’s participation from both international and domestic investors,\nshare was ﷼ 3.3 ($0.9 billion). This resulted in an increase in broadening the Company’s shareholder base and increasing the\nborrowings and a corresponding increase in cash and cash liquidity of its shares. The Government remains Aramco’s largest equivalents during the year. shareholder, retaining an 81.48% direct shareholding.\nIn July 2024, the Company issued three tranches of USD- Treasury shares denominated senior unsecured notes, aggregating to an equivalent In June 2024, as part of the secondary public offering, the Company\nof ﷼ 22.5 billion ($6.0 billion), under its GMTN Programme. acquired 137.6 million ordinary shares from the Government for a\nAt initial recognition, the Company', 'barrel up to $100 per barrel and a marginal rate of 80% applied to the value of production\nat prices above $100 per barrel.\nIn order to increase gas production to meet the needs of the Kingdom, the Government may choose not to collect royalties on natural gas, NGLs (including ethane) and condensates for a period specified by the Government with respect to any field as required by the economics\nof such field’s development. Pursuant to the Ministry of Energy’s authority under the Concession, on February 25, 2018, the Ministry of Energy\ndecided not to collect royalties from the Company on condensate production for a grace period of five years beginning on January 1, 2018.\nOn September 17, 2019, the Ministry of Energy issued Ministerial Resolution No. 1/422/1441, dated 18/1/1441H (corresponding to September 17,\n2019), which extends the period for which Saudi Aramco will not be obligated to pay royalties on condensate production after the current\nfive-year period for an additional 10-year period, which may be further extended for subsequent 10-year periods, unless the Government\ndetermines the economics impacting gas field development do not warrant such an extension.\nThe Government has the option to take all or part of the royalty in kind from the produced Hydrocarbons. Saudi Aramco is subject to the Kingdom’s Income Tax Law. Income tax is due for payment monthly.\nPurchase agreement in connection with the proposed acquisition of the PIF’s 70% equity interest in SABIC\nOn March 27, 2019, the Company entered into a purchase agreement with PIF to acquire PIF’s 70% equity interest in SABIC for total\nconsideration of $69.1 billion provided that the purchase price for the acquisition would be paid on the closing date in the form of a cash\npayment equal to 50% of the purchase price (to be adjusted for certain expenses) and a seller loan in an amount equal to 50% of the purchase\nprice. On October 6, 2019, Saudi Aramco and the PIF agreed to amend the payment terms to provide that, on the closing date, 36% of the\npurchase price (to be adjusted for certain expenses) will be paid in cash and 64% will be paid in the form of a seller loan. The seller loan will be secured by four separate promissory notes issued by the Company in favor of the PIF. In accordance with the terms of the purchase agreement,\nthe Company will pay a loan charge to the PIF on the closing date in the form of a cash payment equal to SAR 1,875 million ($500 million) and\nthe issuance of five additional promissory notes in an aggregate principal amount of $2.5 billion.\nThe seller loan and the balance of the loan charge secured by the promissory notes will become due and payable as follows:\ni. on or before 30 September 2020, a loan charge of $250 million;\nii. on or before 30 September 2021, an amount equal to 16% of the purchase price plus a loan charge of $250 million;\niii. on or before 30 September 2022, an amount equal to 16% of the purchase price;\niv. on or before 30 September 2023, an amount equal to 16% of the purchase price plus a loan charge of $750 million;\nv. on or before 30 September 2024, an amount equal to 16% of the purchase price plus a loan charge of $750 million; and\nvi. on or before 30 September 2025, a loan charge of $500 million.\nEach promissory note will be fully transferable and assignable and may be pledged by the PIF. However, if the PIF receives any offer or commitment of financing which would include a transfer of a promissory note, Saudi Aramco may within 30 days of receiving notice of the offer or commitment notify the PIF in writing of its intent to purchase all or a portion of the promissory notes to be transferred on the same terms.\nTo the extent Saudi Aramco does not elect to purchase the promissory notes to be transferred, the PIF may transfer such promissory notes during the subsequent 120 day period. Saudi Aramco currently intends to repay the promissory notes in a phased manner through cash from operations, external debt financing or a combination thereof.\nThe acquisition is currently expected to close in the first half of 2020.\n\nAgreements with key customers Other than one customer in 2016 which accounted for approximately 6% of Saudi Aramco’s revenue and other income related to sales, there was no single customer that constituted 5% or more of Saudi Aramco’s revenue and other income related to sales in the years ended December', 'partial prepayment will fully reduce the outstanding principal amount of $3.5 billion of the promissory note payable on or before April 7, 2024, and will partially reduce the outstanding principal amounts of the promissory notes payable on or before\nApril 7, 2025, and April 7, 2026, by $3.8 billion and $5.7 billion, respectively. The outstanding amounts of the loan charge\npromissory notes payable between 2024 and 2028, aggregating to $4.9 billion, will also be fully reduced. After taking this\nprepayment into account, the future loan payment will be as follows:\n1. On or before April 7, 2023 an amount equal to $10.5 billion plus a loan charge of $500 million;\n2. On or before April 7, 2025 an amount equal to $4.2 billion;\n3. On or before April 7, 2026 an amount equal to $0.9 billion.\nSubject to the exceptions set forth below, the promissory notes are freely transferable and assignable and may be pledged by the PIF. However, if the PIF receives any offer or commitment of financing which would include a transfer of any promissory note, Aramco may within 30 days of receiving notice of the offer or commitment, notify the PIF in writing of its intent to purchase all or a portion of the promissory notes to be transferred on the same terms. To the extent Aramco does not elect to purchase the promissory notes to be transferred, the PIF may transfer such promissory note during the subsequent 120-day period.\nFurthermore, the PIF may not transfer, assign or pledge at any time promissory notes with aggregate initial principal outstanding\nbalances of (i) $3.5 billion and a payment date of April 7, 2026, (ii) $250 million and a payment date of April 7, 2027, and (iii)\n$250 million and a payment date of April 7, 2028. Aramco currently intends to repay the promissory notes in a phased manner\nthrough cash from operations, external debt financing or a combination thereof.\nAs part of the June 16, 2020, amendment to the purchase agreement, Aramco agreed to enter into foreign exchange\ntransactions with banking institutions mutually agreed between Aramco and the PIF to exchange U.S. dollars for Saudi Riyals.\nThe aggregate amount of these foreign exchange transactions is (i) up to $2.0 billion between June 16, and August 2, 2020,\n(ii) up to $3.0 billion in 2021 and (iii) up to $2.0 billion in 2022.\n\nAdditional legal information continued\n\nIntellectual property Aramco assesses, develops and incorporates new technology in a manner tailored to Aramco’s operations to protect business interests, enhance its operational efficiency, increase profitability and reduce the environmental impact of its operations.\nThe scale of Aramco’s hydrocarbon reserves and operational capabilities enable it to realize significant benefits and value from otherwise marginal technological benefits.\nAramco focuses its technology initiatives in two primary areas: upstream and downstream. In addition, Aramco is working on several focused initiatives, including reductions in the environmental impact of operations and advancements in digital technologies. Upstream technology development is directed primarily to improving methods for discovering new hydrocarbon reserves, improving oil recoveries, increasing productivity, discovering novel catalysts and reducing lifting costs. Downstream technology development is dedicated primarily to maximizing value across the hydrocarbon chain and finding new and improved methods of producing products. Aramco’s environmental impact initiatives include efforts aimed at producing lower carbon intensity crude oil, advancing efficient transport and driving high-impact lower carbon intensity solutions. Aramco’s digital technologies include innovations that leverage machine learning, artificial intelligence, and data analytics.\nAramco intellectual property portfolio includes patents, trademarks and copyrights, of which no individual asset is considered material to the Company, nor does the business of the Company depend on any such asset.\nLitigation From time to time, Aramco is subject to various claims, lawsuits, regulatory investigations and other legal matters arising in the ordinary course of business, including contractual claims relating to construction projects and agreements to render services undertaken by Aramco, claims for title to land and environmental claims. Additionally, Aramco in the past has been subject to antitrust claims.\nFurthermore, exports of crude oil, refined products and petrochemicals by Aramco or its affiliates to foreign countries may be affected by litigation, regulatory actions, investigations, disputes or agreements that lead to the imposition of import trade measures, including anti-dumping and countervailing duties, safeguard measures, import licensing and customs requirements, and new or increased tariffs, quotas or embargoes. The possibility and effect of any such measures will depend on the domestic laws in the relevant country to']","Aramco finished paying the deferred amount owed for the 70% equity interest in SABIC acquired from the Public Investment Fund (PIF) through a series of structured payments. The total consideration for the acquisition was $69.1 billion, which was to be paid over several installments via a seller loan provided by the PIF.

Key points regarding the payment structure include:

1. **Initial Payment Terms**: The purchase agreement initially stipulated that 50% of the purchase price would be paid in cash and the remaining 50% through a seller loan. This was later amended to 36% cash and 64% as a seller loan.

2. **Amendments to Payment Terms**: On June 16, 2020, the payment terms were further amended to allow the entire purchase price to be paid over several installments.

3. **Partial Prepayments**: 
   - On January 24, 2022, Aramco made a partial prepayment of $7.6 billion, reducing the principal amounts of two promissory notes.
   - On June 30, 2022, a second partial prepayment of $10.2 billion was made, further reducing the principal amounts of the promissory notes.

4. **Future Payments**: After these prepayments, the future loan payments were scheduled as follows:
   - On or before April 7, 2023: $10.5 billion plus a loan charge of $500 million.
   - On or before April 7, 2025: $4.2 billion.
   - On or before April 7, 2026: $0.9 billion.

5. **Final Payment**: The final payment is due on or before April 7, 2028, which includes loan charges.

This structured approach allowed Aramco to manage its cash flow while fulfilling its financial obligations related to the acquisition of SABIC (source: consolidated financial statements).","In 2023, Aramco made three repayments or prepayments to PIF: SAR 59.0 billion, SAR 41.3 billion, and SAR 16.7 billion. These payments fully settled the deferred consideration for the SABIC acquisition.",0.84375,0.8875067059187666,0.0,0.0
What main privileges and time structure are attached to Aramco’s state-granted operating rights?,"['was established in the Kingdom as a company with limited liability by virtue of Royal Decree No. M/8 dated 4/4/1409H\n(corresponding to November 13, 1988) to assume the privileges and rights of its predecessor. On January 1, 2018, the Company was\nconverted into a joint stock company pursuant to Council of Ministers Resolution No. 180 dated 1/4/1439H (corresponding to December\n19, 2017) and registered in the city of Dhahran under commercial registration No. 2052101150 dated 11/07/1439H (corresponding to\nMarch 28, 2018) with Saudi Arabian Oil Company as its official name. Its registered head office is located at P.O. Box 5000, Dhahran\n31311, Kingdom of Saudi Arabia. Its share capital is sixty billion Saudi Riyals (SAR 60,000,000,000), consisting of two hundred billion\n(200,000,000,000) fully paid ordinary shares with no par value. Aramco’s primary operating segments are Upstream and Downstream, which are supported by corporate activities (for further details please refer to Section 3: Results and performance).\nOn December 11, 2019, the Company completed its IPO and its ordinary shares were listed on Tadawul. In connection with the IPO, the\nGovernment, being the sole owner of the Company’s shares at such time, sold 3.45 billion ordinary shares, or 1.73% of the Company’s\nshare capital. In addition, concurrent with the IPO, the Company acquired 117.2 million of its ordinary shares from the Government for a cash payment of SAR 3,750 million which are being classified as treasury shares. These shares are for use by the Company for its\nemployee share plans.\nMaterial agreements Aramco has entered into a number of agreements for the purposes of its business. The following is a summary of those agreements that Aramco considers material to its business. Aramco believes that all such agreements, in addition to the key provisions thereunder, have been included in this section and that there are no other agreements that are material in the context of its business. These summaries do not purport to describe all the applicable terms and conditions of such agreements and are qualified in their entirety by the respective agreements.\nThe Concession Background\nThe Arabian American Oil Company Concession Agreement was ratified on 4/2/1352H (corresponding to May 29, 1933) and granted\nAramco’s predecessor certain exclusive rights, including the right to explore, drill, recover and treat crude oil and other hydrocarbons located within certain areas of the Kingdom (which were revised and grew over time), with limited territorial exceptions. Pursuant to\nRoyal Decree No. M/8 dated 4/4/1409H (corresponding to November 13, 1988) approving Aramco’s original articles, Aramco enjoyed\nall the privileges and rights provided under the Arabian American Oil Company Concession Agreement, and all subsequent supplementary documents, agreements, governmental orders and decisions in connection therewith (collectively, the “Original\nConcession”). Effective 6/4/1439H (corresponding to December 24, 2017), and in accordance with the Hydrocarbons Law, the\nGovernment, represented by the Minister of MEIM (predecessor to the Minister of Energy), and Aramco entered into the revised\nConcession Agreement (the “Concession”), which was adopted under Royal Decree No. (M/12) dated 18/1/1441H (corresponding to\nSeptember 17, 2019) and replaced and superseded in its entirety the Original Concession on such date (the “Concession Effective\nDate”). Further, on 20/1/1441H (corresponding to September 19, 2019), and in accordance with the Hydrocarbons Law, the\nGovernment, represented by the Minister of Energy, and Aramco entered into an amendment to the Concession, with effect from January 1, 2020) (the “Concession Amendment”).\nGrant of rights The Government grants Aramco the following rights to be exercised at Aramco’s own responsibility during the term of the Concession:\n• the exclusive right to explore, drill, prospect, appraise, develop, extract, recover and produce hydrocarbons in the Concession Area;\n• the non-exclusive right to manufacture, refine and treat production and to market, sell, transport and export such production;\n• the exclusive right to market and distribute hydrocarbons, petroleum products and LPG in the Kingdom, with Aramco’s commitment to meeting all the domestic market’s needs for such products in accordance with the consumption requirements thereof through domestic production or imports in accordance with laws', 'capital is sixty billion Saudi Riyals (SAR 60,000,000,000),\nconsisting of two hundred billion (200,000,000,000) fully paid ordinary shares with no par value. Aramco’s primary operating segments are Upstream and Downstream, which are supported by corporate activities (for further details please refer to Section 3:\nResults and performance).\nOn December 11, 2019, the Company completed its IPO and its ordinary shares were listed on Tadawul. In connection with the\nIPO, the Government, being the sole owner of the Company’s shares at such time, sold 3.45 billion ordinary shares, or 1.73% of the\nCompany’s share capital. In addition, concurrent with the IPO, the Company acquired 117.2 million of its ordinary shares from the Government for a cash payment of SAR 3,750 million which are being classified as treasury shares. These shares are for use by the\nCompany for its employee share plans. On February 13, 2022, the Government announced the transfer of 4% of the Company’s total\nshare capital to the Public Investment Fund (PIF). Therefore, the current ownership of the Government in the Company is 94.19%.\nMaterial agreements Aramco has entered into a number of agreements for the purposes of its business. The following is a summary of those agreements that Aramco considers material to its business. Aramco believes that all such agreements, in addition to the key provisions thereunder, have been included in this section and that there are no other agreements that are material in the context of its business. These summaries do not purport to describe all the applicable terms and conditions of such agreements and are qualified in their entirety by the respective agreements.\nThe Concession Background\nThe Arabian American Oil Company Concession Agreement was ratified on 4/2/1352H (corresponding to May 29, 1933) and granted\nArabian American Oil Company certain exclusive rights, including the right to explore, drill, recover and treat crude oil and other hydrocarbons located within certain areas of the Kingdom (which were revised and grew over time), with limited territorial exceptions.\nPursuant to Royal Decree No. M/8 dated 4/4/1409H (corresponding to November 13, 1988) approving Aramco’s original articles,\nAramco enjoyed all the privileges and rights provided under the Arabian American Oil Company Concession Agreement, and all subsequent supplementary documents, agreements, Governmental orders and decisions in connection therewith (collectively, the\n“Original Concession”). Effective 6/4/1439H (corresponding to December 24, 2017), and in accordance with the Hydrocarbons Law,\nthe Government, represented by the Minister of MEIM (predecessor to the Minister of Energy), and Aramco entered into the revised\nConcession Agreement (the “Concession”), which was adopted under Royal Decree No. (M/12) dated 18/1/1441H (corresponding\nto September 17, 2019) and replaced and superseded in its entirety the Original Concession on such date (the “Concession\nEffective Date”). Further, on 20/1/1441H (corresponding to September 19, 2019), and in accordance with the Hydrocarbons Law,\nthe Government, represented by the Minister of Energy, and Aramco entered into an amendment to the Concession, with effect from January 1, 2020) (the “Concession Amendment”).\nGrant of rights The Government grants Aramco the following rights to be exercised at Aramco’s own responsibility during the term of the Concession:\n• The exclusive right to explore, drill, prospect, appraise, develop, extract, recover and produce hydrocarbons in the Concession Area;\n• The non-exclusive right to manufacture, refine and treat production and to market, sell, transport and export such production;\n• The exclusive right to market and distribute hydrocarbons, petroleum products and LPG in the Kingdom, with Aramco’s commitment to meeting all the domestic needs for such products in accordance with the consumption requirements thereof through domestic production or imports in accordance with laws issued by the Government;\n• The right to build, own and operate relevant facilities and assets as may be necessary or desirable to perform Aramco’s operations within the Reserved Areas;\n• Certain rights to acquire and use land, water and other natural products in connection with Aramco’s operations;\n• The right to purchase, lease, import or otherwise obtain all materials, equipment and any other supplies required for Aramco’s operations;\n• The right to conduct such other activity related to the foregoing subject to the provisions of the Concession and applicable law; and\n• The right to receive Government assistance in securing the rights granted in the Concession, obtaining permits, licenses and', 'official\nname. Its registered head office is located at P.O. Box 5000, Dhahran 31311, Kingdom of Saudi Arabia. Its share capital is seventy\nfive billion Saudi Riyals (SAR 75,000,000,000), consisting of two hundred and twenty billion (220,000,000,000) fully paid ordinary\nshares with no par value. Aramco’s primary operating segments are Upstream and Downstream, which are supported by corporate activities (for further details refer to Section 2: Results and performance).\nOn December 11, 2019, the Company completed its IPO and its ordinary shares were listed on Saudi Exchange (The Exchange).\nIn connection with the IPO, the Government, being the sole owner of the Company’s shares at such time, sold 3.45 billion\nordinary shares, or 1.73% of the Company’s share capital. In addition, concurrent with the IPO, the Company acquired 117.2\nmillion of its ordinary shares from the Government for a cash payment of SAR 3,750 million which are being classified as treasury\nshares. These shares are for use by the Company for its employee share plans. On February 13, 2022, the Government announced\nthe transfer of 4% of the Company’s total share capital to the Public Investment Fund (PIF). Therefore, the current ownership of the Government in the Company is 94.19%.\nIn May 2022, the Extraordinary General Assembly approved the granting and distribution of one bonus share for every ten shares\nheld by the shareholders. This resulted in an increase of issued ordinary shares from 200 billion to 220 billion and the share\ncapital of the Company from SAR 60.0 billion to SAR 75.0 billion.\nMaterial agreements Aramco has entered into a number of agreements for the purposes of its business. The following is a summary of those agreements that Aramco considers material to its business. Aramco believes that all such agreements, in addition to the key provisions thereunder, have been included in this section and that there are no other agreements that are material in the context of its business. These summaries do not purport to describe all the applicable terms and conditions of such agreements and are qualified in their entirety by the respective agreements.\nThe Concession Background\nThe Arabian American Oil Company Concession Agreement was ratified on 4/2/1352H (corresponding to May 29, 1933) and\ngranted Arabian American Oil Company certain exclusive rights, including the right to explore, drill, recover and treat crude oil and other hydrocarbons located within certain areas of the Kingdom (which were revised and grew over time), with limited\nterritorial exceptions. Pursuant to Royal Decree No. M/8 dated 4/4/1409H (corresponding to November 13, 1988) approving\nAramco’s original articles, Aramco enjoyed all the privileges and rights provided under the Arabian American Oil Company Concession Agreement, and all subsequent supplementary documents, agreements, Governmental orders and decisions in\nconnection therewith (collectively, the “Original Concession”). Effective 6/4/1439H (corresponding to December 24, 2017), and\nin accordance with the Hydrocarbons Law, the Government, represented by the Minister of MEIM (predecessor to the Minister of Energy), and Aramco entered into the revised Concession Agreement (the “Concession”), which was adopted under Royal Decree\nNo. (M/38) dated 6/4/1439H (corresponding to December 24, 2017) and replaced and superseded in its entirety the Original\nConcession on such date (the “Concession Effective Date”). Further, on 20/1/1441H (corresponding to September 19, 2019), and\nin accordance with the Hydrocarbons Law, the Government, represented by the Minister of Energy, and Aramco entered into an amendment to the Concession, with effect from January 1, 2020) (the “Concession Amendment”).\nGrant of rights The Government grants Aramco the following rights to be exercised at Aramco’s own risk during the term of the Concession:\n• The exclusive right to explore, prospect, drill, appraise, develop, extract, recover and produce hydrocarbons in the Concession Area;\n• The non-exclusive right to manufacture, refine, treat, market, sell, transport and export hydrocarbons and their derivatives extracted, recovered, developed, produced, treated, refined, consumed, transported, manufactured, marketed, sold, exported or dealt with in any other way by Aramco or on its behalf pursuant to the rights granted to Aramco in the Concession;\n• The exclusive right to market and distribute hydrocarbons, petroleum products and LPG in the Kingdom, with Aramco’s', '18 months from the Board’s approval date, up to a maximum total spend of ﷼ 11.3 billion ($3.0 billion). The shares\nrepurchased will be classified as treasury shares and will primarily be used by the Company for its employee share plans. The Company intends to complete the repurchase through one or more transactions, and may retain the shares for a maximum period of 10 years from the date of purchase without sale or allocation.\nMaterial agreements Aramco has entered into a number of agreements for the purposes of its business. The following is a summary of those agreements that Aramco considers material to its business. Aramco believes that all such agreements, in addition to the key provisions thereunder, have been included in this section and that there are no other agreements that are material in the context of its business. These summaries do not purport to describe all the applicable terms and conditions of such agreements and are qualified in their entirety by the respective agreements.\nThe Concession Background\nThe Arabian American Oil Company Concession Agreement, which was entered into on 4/2/1352H (corresponding to May 29, 1933) was\nratified on 14/3/1352H (corresponding to July 7, 1933) pursuant to Royal Decree No. 1135, pursuant to which the Government granted\nArabian American Oil Company predecessors certain exclusive rights, including the right to explore, drill, recover, and treat crude oil and other hydrocarbons located within certain areas of the Kingdom. Pursuant to Royal Decree No. M/8 dated 4/4/1409H (corresponding to November 13, 1988) approving Aramco’s original articles, Aramco enjoyed all the privileges and rights provided under the Original\nConcession Agreement (the “Original Concession”). Pursuant to Royal Decree No. M/38, effective 6/4/1439H (corresponding to December 24,\n2017), the Government, represented by the Minister of Energy, and Aramco entered into the Concession Agreement (the “Concession”),\nwhich replaced and superseded in its entirety the Original Concession on such date (the “Concession Effective Date”). Further, on 20/1/1441H\n(corresponding to September 19, 2019), and in accordance with the Hydrocarbons Law, the Government, represented by the Minister of Energy, and Aramco entered into an amendment to the Concession (the “Concession Amendment”), with effect from January 1, 2020.\n\nAramco overview Results and Sustainability Risk Organizational structure Additional financial Consolidated and strategy performance and corporate governance and legal information financial statements All amounts in millions unless otherwise stated Grant of rights The Concession grants Aramco the following rights to be exercised during the term of the Concession:\n• The exclusive right to explore, drill, prospect, appraise, develop, extract, recover, and produce hydrocarbons in the Concession Area;\n• The non-exclusive right to manufacture, refine, treat, market, sell, transport, and export hydrocarbons and their derivatives extracted, recovered, developed, produced, treated, refined, consumed, transported, manufactured, marketed, sold, exported, or dealt with in any other way by Aramco or on its behalf pursuant to the rights granted to Aramco in the Concession;\n• The exclusive right to market and distribute hydrocarbons, petroleum products, and LPG in the Kingdom, with Aramco’s commitment to meeting all the domestic market’s needs for such products in accordance the consumption requirements thereof through domestic production or imports in accordance with laws issued by the Government;\n• The right to build, own, and operate relevant facilities and assets as may be necessary or desirable to perform Aramco’s operations within the Reserved Areas;\n• Certain rights related to lands, such as use of land, easements, water rights, right-of-way, and other suitable rights of any part of the Concession Areas, that are outside the Reserved Area, designated in connection with Aramco’s operations and transportation of products and free access to and use of any part of the Reserved Area;\n• The right to purchase, lease, import or otherwise obtain all materials, equipment, and any other supplies required for Aramco’s operations;\n• The right to conduct such other activity related to the foregoing subject to the provisions of the Concession and applicable law; and,\n• The right to receive Government assistance in securing the rights granted in the Concession, without prejudice to the foregoing, obtaining permits, licenses, and other special approvals and obtaining access, rights of way, and water rights from third parties necessary for Aramco’s operations.\nUnder the Concession, Aramco is required to obtain the necessary licenses, permits, and approvals that may be required pursuant to the Hydrocarbons Law, the Law of Gas Supplies and Pricing (which was superseded', 'following rights to be exercised at Aramco’s own responsibility during the term of the Concession:\n• the exclusive right to explore, drill, prospect, appraise, develop, extract, recover and produce hydrocarbons in the Concession Area;\n• the non-exclusive right to manufacture, refine and treat production and to market, sell, transport and export such production;\n• the exclusive right to market and distribute hydrocarbons, petroleum products and LPG in the Kingdom, with Aramco’s commitment to meeting all the domestic market’s needs for such products in accordance with the consumption requirements thereof through domestic production or imports in accordance with laws issued by the Government;\n• the right to build, own and operate relevant facilities and assets as may be necessary or desirable to perform Aramco’s operations within the Reserved Areas;\n• certain rights to acquire and use land, water and other natural products in connection with Aramco’s operations;\n• the right to purchase, lease, import or otherwise obtain all materials, equipment and any other supplies required for Aramco’s operations;\n• the right to conduct such other activity related to the foregoing subject to the provisions of the Concession and applicable law; and\n• the right to receive Government assistance in securing the rights granted in the Concession, obtaining permits, licenses and other special approvals and obtaining access, rights of way and water rights from third parties necessary for Aramco’s operations.\nnotiamrofni lagel\n\nlaicnanfi lanotiiddA\n\nUnder the Concession, Aramco is required to obtain the necessary licenses, permits and approvals that may be required pursuant to the Hydrocarbons Law, the Law of Gas Supplies and Pricing and the regulations issued pursuant to these laws. All hydrocarbons in the Kingdom are owned by the Kingdom, and upon extraction or recovery of such hydrocarbons by Aramco, title to such hydrocarbons shall automatically pass to Aramco at the ownership transfer point. Aramco has no rights to any natural resources existing in the Concession Area other than hydrocarbons except as otherwise provided in the Concession.\nThe rights granted to Aramco under the Concession are subject to the Hydrocarbons Law and other applicable law, including production decisions issued by the Government pursuant to its sovereign authority. Aramco may not sell to any entity any hydrocarbons or derivatives therefrom in violation of decisions the Government considers necessary for the protection of supreme security interests for the Kingdom in times of war or other emergency in international relations.\nTerm The Concession will remain effective for 40 years from the Concession Effective Date, unless terminated earlier in accordance with its terms.\nThe Government will issue a decision to extend the Concession for a period of 20 years on the 30th anniversary of the Concession Effective Date, provided Aramco has fulfilled the following conditions: (a) Aramco has exerted reasonable efforts to maximize reserves and their recovery in the Concession Area, taking into consideration production decisions and hydrocarbons market conditions; (b)\nAramco has conducted its operations in a manner that (i) is economically efficient, (ii) enhances the productivity of the reservoirs in the long-term in the Concession Area and (iii) supports good management of hydrocarbons, in all cases, according to the Hydrocarbons Law; and (c) Aramco generally has conducted its activities and operations in the Kingdom in an economically efficient manner thereby enhancing the efficiency of the Kingdom’s economy.\nIf the Concession is extended as described in the previous paragraph, the Concession may be amended and extended for an additional its intent to extend the Concession, at any time from the beginning of the 50th anniversary until the end of the 53rd anniversary of the Concession Effective Date, provided that the parties undertake exclusive negotiations for a two-year period (which may be extended or reduced by the parties), commencing at the end of the 53rd anniversary of the Concession Effective Date, to reach an agreement on the terms and conditions of such amendment and extension. If the Government and Aramco are unable to reach agreement on the amendment and extension during such exclusive negotiation period, and the Government elects to negotiate with any third party to enter into an agreement with respect to any hydrocarbons activities or operations in the Concession Area, Aramco will have a priority right to enter into an agreement with the Government under the same terms and conditions as agreed between the Government and such third party, provided that Aramco notifies the Government of its desire to exercise the priority right within 120 days of its receipt of a written notice from the Government that includes the entire draft agreement with such third party with respect to such hydrocarbons activities and operations.\nRoyalty and taxes\nAs at December 31, 2016, the royalty payable to the Government under the Original Concession consisted of an amount equal to (a)\n20% of the value of crude oil and the crude equivalent of refined products sold as exports, (b) 12.', 'to Council of Ministers Resolution No. 180 dated 1/4/1439H • The right to purchase, lease, import or otherwise obtain all materials, equipment, and any other supplies necessary for\n(corresponding to December 19, 2017) and registered in the city of Dhahran under commercial registration No. 2052101150 dated Aramco’s operations;\n11/07/1439H (corresponding to March 28, 2018) with Saudi Arabian Oil Company as its official name. Its registered head office is located\nat P.O. Box 5000, Dhahran 31311, Kingdom of Saudi Arabia. Its share capital is ninety billion Saudi Riyals (SAR 90,000,000,000), • The right to conduct such other activity related to the foregoing subject to the provisions of the Concession and applicable law; and,\nconsisting of two hundred and forty two billion (242,000,000,000) fully paid ordinary shares with no par value. Aramco’s primary • The right to receive Government assistance in securing the rights granted in the Concession, without prejudice to the foregoing, operating segments are Upstream and Downstream, which are supported by corporate activities (for further details refer to Section 2: obtaining permits, licenses, and other special approvals and obtaining access, rights of way, and water rights from third parties necessary Results and performance). for Aramco’s operations.\nOn December 11, 2019, the Company completed its IPO and its ordinary shares were listed on the Saudi Exchange. In connection with\nUnder the Concession, Aramco is required to obtain the necessary licenses, permits, and approvals that may be required pursuant to the\nthe IPO, the Government, being the sole owner of the Company’s shares at such time, sold 3.45 billion ordinary shares, or 1.73% of the\nHydrocarbons Law, the Law of Gas Supplies and Pricing (which is replaced by the Energy Supply Law), and the regulations issued Company’s share capital. In addition, concurrent with the IPO, the Company acquired 117.2 million of its ordinary shares from the pursuant to these laws. The Concession and Aramco’s rights referred to under the Concession represent the licenses, permits, and Government for a cash payment of SAR 3,750 million which are being classified as treasury shares. These shares are for use by the\napprovals that are necessary or required for Aramco to conduct business in the Kingdom with respect to Aramco Operations and any\nCompany for its employee share plans. On February 13, 2022, the Government announced the transfer of 4% of the Company’s total\nrelated activities in accordance with the agreement. All hydrocarbons in the Kingdom are owned by the Kingdom, and upon extraction\nshare capital to PIF and, on April 16, 2023, the Government announced the transfer of an additional 4% of the Company’s issued shares\nor recovery of such hydrocarbons by Aramco, title to such hydrocarbons shall automatically pass to Aramco at the ownership transfer to Sanabil Investments, a wholly-owned subsidiary of PIF, and on March 7, 2024, the Government announced the transfer of an point. Aramco has no rights to any natural resources existing in the Concession Area other than hydrocarbons except as otherwise additional 8% of the Company’s issued shares to PIF’s wholly-owned companies. As a result, the Government directly owned 82.19% of\nprovided in the Concession.\nthe Company’s shares as of the date of this Annual Report.\nThe rights granted to Aramco under the Concession are subject to the Hydrocarbons Law and other applicable law, including production In May 2022 and May 2023, the Extraordinary General Assembly approved grants of one bonus share for every ten outstanding shares.\ndecisions issued by the Government pursuant to its sovereign authority. Aramco may not sell to any entity any hydrocarbons or As a result of the bonus share grants, the Company’s share capital increased by a total of thirty billion Saudi Riyals by capitalizing a derivatives therefrom obtained pursuant to the Concession in violation of decisions the Government considers necessary for the portion of its retained earnings. As a result, as at the date of the Report, the share capital of the Company is ninety billion Saudi Riyals, protection of supreme security interests for the Kingdom in times of war or other emergency in international relations.\nwhich is fully paid, consisting of two hundred and forty two billion shares with no par value.\nTerm Material agreements The Concession will remain effective for 40 years from the Concession Effective Date, unless terminated earlier in accordance Aramco has entered into a number of agreements for the purposes of its business. The following is a summary of those agreements that with its terms.\nAramco considers material to its business. Aramco believes that all such', 'co’s operations;\n• The right to conduct such other activity related to the foregoing subject to the provisions of the Concession and applicable law; and,\n• The right to receive Government assistance in securing the rights granted in the Concession, without prejudice to the foregoing, obtaining permits, licenses, and other special approvals and obtaining access, rights of way, and water rights from third parties necessary for Aramco’s operations.\nUnder the Concession, Aramco is required to obtain the necessary licenses, permits, and approvals that may be required pursuant to the Hydrocarbons Law, the Law of Gas Supplies and Pricing (which was superseded by the Energy Supply Law), and the regulations issued pursuant to these laws. All hydrocarbons in the Kingdom are owned by the Kingdom, and upon extraction or recovery of such hydrocarbons by Aramco, title to such hydrocarbons shall automatically pass to Aramco at the ownership transfer point. Aramco has no rights to any natural resources existing in the Concession Area other than hydrocarbons except as otherwise provided in the Concession.\nThe rights granted to Aramco under the Concession are subject to the Hydrocarbons Law and other applicable law and regulation, including production decisions issued by the Government pursuant to its sovereign authority. Aramco may not sell to any entity any hydrocarbons or derivatives therefrom obtained pursuant to the Concession in violation of decisions the Government considers necessary for the protection of supreme security interests for the Kingdom in times of war or other emergency in international relations.\nTerm The Concession will remain effective for 40 years from the Concession Effective Date, unless terminated earlier in accordance with its terms.\nThe Government will issue a decision to extend the Concession for a period of 20 years on the 30th anniversary of the Concession Effective Date, provided it becomes clear to the Government that Aramco has fulfilled the following conditions: (a) Aramco has exerted reasonable efforts to maximize reserves and their recovery in the Concession Area, taking into consideration production decisions and hydrocarbons market conditions; (b) Aramco has conducted its operations in a manner that (i) is economically efficient, (ii) enhances the productivity of the reservoirs in the long term in the Concession Area, and (iii) supports good management of hydrocarbons, in all cases, according to the Hydrocarbons Law; and, (c) Aramco generally has conducted its activities and operations in the Kingdom in an economically efficient manner thereby enhancing the efficiency of the Kingdom’s economy.\nIf the Concession is extended as described in the previous paragraph, the Concession may be amended and extended for an additional to extend the Concession, at any time from the beginning of the 50th anniversary until the end of the 53rd anniversary of the Concession Effective Date, provided that the parties undertake exclusive negotiations for a two-year period (which may be extended or reduced by mutual agreement of the parties), commencing at the end of the 53rd anniversary of the Concession Effective Date, to reach an agreement on the terms and conditions of such amendment and extension. If the Government and Aramco are unable to reach agreement on the amendment and extension during such exclusive negotiation period, and the Government elects to negotiate with any third party to enter into an agreement with respect to any hydrocarbon activities or operations in the Concession Area, Aramco will have a priority right to enter into an agreement with the Government under the same terms and conditions as agreed between the Government and such third party, provided that Aramco notifies the Government of its desire to exercise the priority right within 120 days of its receipt of a written notice from the Government that includes the entire draft agreement with such third party with respect to such hydrocarbon activities and operations.\n\nAdditional legal information continued All amounts in millions SAR unless otherwise stated Royalties Commencing January 1, 2017, royalties payable to the Government with respect to the Company’s operations were calculated as follows:\n• With respect to the Company’s production of crude oil and condensate, including those used by the Company in its operations, royalties were calculated based on a progressive scheme applied to crude oil and condensate production value. Production was valued based on the Company’s official selling prices. An effective royalty rate was applied to production value and was based each month on the average daily price quotes for Brent crude on the Intercontinental Exchange (or any successor exchange) for each day during such period. The effective\nroyalty rate was determined based on a baseline rate of 20% applied to the value of production at prices up to $70 per barrel, a marginal\nrate of 40% applied to the value of production at prices above $70 per barrel up to $100 per barrel and a marginal rate of 50% applied to\nthe value of production at prices above $100 per barrel.\n• With respect to the Company’s production of natural gas, ethane and NGL, excluding those volumes used by the Company for upstream operations and related operations', 'tradeable shares Total no. Total no. Total no. No. of Country of of authorized of ordinary of preference issued ordinary incorporation shares shares shares shares Par Value\nRabigh Refining and Petrochemical Company Saudi Arabia 876,000,000 876,000,000 – 876,000,000 SAR 10\nS-Oil Corporation South Korea 240,000,000 180,000,000 60,000,000 112,582,792 Won 2,500\nMaterial subsidiaries with tradeable debt instruments Balance as at Country of Debt December 31, All amounts in millions SAR unless otherwise stated incorporation instruments 20191\nMotiva Enterprises LLC USA Debentures 7,680 S-Oil Corporation South Korea Debentures 10,206\nSadara Chemical Company (through its subsidiary Sadara Basic Services Company) Saudi Arabia Sukuk 6,478 Saudi Aramco Sukuk Company Saudi Arabia Sukuk 11,250\nSaudi Aramco Total Refining and Petrochemical Company (through its wholly owned subsidiary Arabian Aramco Total Services) Saudi Arabia Sukuk 2,530 1. Represents 100% of the balance as reported in the respective subsidiaries’ balance sheet.\nGovernment consents, licenses and certificates Saudi Aramco holds several operational and regulatory licenses and certificates from the relevant competent authorities that are periodically renewed. The following table lists the licenses and certificates currently held by Saudi Aramco that Saudi Aramco considers material in the context of its business.\nDetails of material regulatory and operational licenses and certificates obtained by Saudi Aramco Company Issuing authority License Effective date Expiry date\nSaudi Arabian Oil The Government The Concession December 24, 2017 Initial period of 40 years, with expiry date of\nCompany December 24, 2057, which will be extended\nby the Government for 20 years provided Saudi Aramco satisfies certain conditions commensurate with current operating practices. In addition, the Concession may be extended for an additional 40 years beyond\nthe prior 60-year period subject to Saudi Aramco and the Government agreeing on the terms of the extension.\nSATORP The Government SATORP Feedstock Various Ministerial Letters in connection with Allocation letters the supply of gas products to SATORP.\nMaterial agreements Saudi Aramco has entered into a number of agreements for the purposes of its business. The following is a summary of those agreements that Saudi Aramco considers material to its business. Saudi Aramco believes that all such agreements, in addition to the key provisions thereunder, have been included in this Section and that there are no other agreements that are material in the context of its business. These summaries do not purport to describe all the applicable terms and conditions of such agreements and are qualified in their entirety by the respective agreements. In addition, please see also below for details regarding Saudi Aramco’s financing agreements (Financing Agreements and Guarantees).\nThe Concession Background\nThe Arabian American Oil Company Concession Agreement was ratified on 4/2/1352H (corresponding to May 29, 1933) and granted Saudi Aramco’s\npredecessor certain exclusive rights, including the right to explore, drill, recover and treat crude oil and other hydrogen and carbon compounds in liquid or gaseous state within certain areas of the Kingdom (which were revised and grew over time), with limited territorial exceptions. Pursuant to Royal\nDecree No. M/8 dated 4/4/1409H (corresponding to November 13, 1988) approving Saudi Aramco’s original articles, Saudi Aramco enjoyed all the\nprivileges and rights provided under the Arabian American Oil Company Concession Agreement, and all subsequent supplementary documents, agreements, governmental orders and decisions in connection therewith (collectively, the “Original Concession”). Effective 6/4/1439H (corresponding to December 24, 2017), and in accordance with the Hydrocarbons Law, the Government, represented by the Minister of Energy, and Saudi Aramco entered\ninto the revised Concession Agreement (the “Concession”), which was adopted under Royal Decree No. (M/12) dated 18/1/1441H (corresponding\nto September 17, 2019) and replaced and superseded in its entirety the Original Concession on such date (the “Concession Effective Date”). Further, on\n20/1/1441H (corresponding to September 19, 2019), and in accordance with the Hydrocarbons Law, the Government, represented by the Minister of\nEnergy, and Saudi Aramco entered into an amendment to the Concession, with effect from January 1, 2020) (the “Concession Amendment”).\n\nGrant of rights The Government grants Saudi Aramco the following rights to be exercised at Saudi Aramco’s own responsibility during the term of the Concession:', 'right to build, own and operate relevant facilities and assets as may be necessary or desirable to perform Aramco’s operations within the Reserved Areas;\n• Certain rights to acquire and use land, water and other natural products in connection with Aramco’s operations;\n• The right to purchase, lease, import or otherwise obtain all materials, equipment and any other supplies required for Aramco’s operations;\n• The right to conduct such other activity related to the foregoing subject to the provisions of the Concession and applicable law; and\n• The right to receive Government assistance in securing the rights granted in the Concession, obtaining permits, licenses and other special approvals and obtaining access, rights of way and water rights from third parties necessary for Aramco’s operations.\n\nAdditional legal information continued Under the Concession, Aramco is required to obtain the necessary licenses, permits and approvals that may be required pursuant to the Hydrocarbons Law, the Law of Gas Supplies and Pricing and the regulations issued pursuant to these laws. All hydrocarbons in the Kingdom are owned by the Kingdom, and upon extraction or recovery of such hydrocarbons by Aramco, title to such hydrocarbons shall automatically pass to Aramco at the ownership transfer point. Aramco has no rights to any natural resources existing in the Concession Area other than hydrocarbons except as otherwise provided in the Concession.\nThe rights granted to Aramco under the Concession are subject to the Hydrocarbons Law and other applicable law, including production decisions issued by the Government pursuant to its sovereign authority. Aramco may not sell to any entity any hydrocarbons or derivatives therefrom in violation of decisions the Government considers necessary for the protection of supreme security interests for the Kingdom in times of war or other emergency in international relations.\nTerm The Concession will remain effective for 40 years from the Concession Effective Date, unless terminated earlier in accordance with its terms.\nThe Government will issue a decision to extend the Concession for a period of 20 years on the 30th anniversary of the Concession Effective Date, provided Aramco has fulfilled the following conditions: (a) Aramco has exerted reasonable efforts to maximize reserves and their recovery in the Concession Area, taking into consideration production decisions and hydrocarbons market conditions; (b)\nAramco has conducted its operations in a manner that (i) is economically efficient, (ii) enhances the productivity of the reservoirs in the long-term in the Concession Area and (iii) supports good management of hydrocarbons, in all cases, according to the Hydrocarbons Law; and (c) Aramco generally has conducted its activities and operations in the Kingdom in an economically efficient manner thereby enhancing the efficiency of the Kingdom’s economy.\nIf the Concession is extended as described in the previous paragraph, the Concession may be amended and extended for an additional its intent to extend the Concession, at any time from the beginning of the 50th anniversary until the end of the 53rd anniversary of the Concession Effective Date, provided that the parties undertake exclusive negotiations for a two-year period (which may be extended or reduced by the parties), commencing at the end of the 53rd anniversary of the Concession Effective Date, to reach an agreement on the terms and conditions of such amendment and extension. If the Government and Aramco are unable to reach agreement on the amendment and extension during such exclusive negotiation period, and the Government elects to negotiate with any third party to enter into an agreement with respect to any hydrocarbon activities or operations in the Concession Area, Aramco will have a priority right to enter into an agreement with the Government under the same terms and conditions as agreed between the Government and such third party, provided that Aramco notifies the Government of its desire to exercise the priority right within 120 days of its receipt of a written notice from the Government that includes the entire draft agreement with such third party with respect to such hydrocarbon activities and operations.\nRoyalty and taxes Commencing January 1, 2017, royalties payable to the Government with respect to the Company’s operations were calculated as follows:\n• With respect to the Company’s production of crude oil and condensates, including those used by the Company in its operations, royalties were calculated based on a progressive scheme applied to crude oil and condensate production value. Production was valued based on the Company’s official selling prices. An effective royalty rate was applied to production value and was based each month on the average daily price quotes for Brent crude on the Intercontinental Exchange (or any successor exchange) for each day during such period. The effective royalty rate was determined based on a baseline rate of 20% applied to the value of production at\nprices up to $70 per barrel, a marginal rate of 40% applied to the value of production at prices above $70 per barrel up to $100 per\nbarrel and a marginal rate of 50% applied to the value of production at prices above $100 per barrel.', 'share capital. In addition, concurrent with the IPO, the Company acquired 117.2 million of its ordinary shares from the\nGovernment for a cash payment of ﷼ 3.75 billion ($1.0 billion), which are being classified as treasury shares. These shares are for use by the\nCompany for its employee share plans. On February 13, 2022, the Government announced the transfer of 4% of the Company’s total share\ncapital to PIF. On April 16, 2023, the Government announced the transfer of an additional 4% of the Company’s ordinary shares to Sanabil\nInvestments, a wholly-owned subsidiary of PIF, and on March 7, 2024, the Government announced the transfer of an additional 8% of the Company’s ordinary shares to PIF’s wholly-owned companies.\nOn June 11, 2024, the Government completed a secondary public offering of the Company’s ordinary shares. In connection with the\noffering, the Government sold an aggregate of approximately 1.7 billion shares, representing 0.7% of the Company’s issued shares. This\nincludes 137.6 million ordinary shares acquired by the Company from the Government for a cash payment of ﷼ 3.75 billion ($1.0 billion),\nwhich have been classified as treasury shares. These treasury shares will be used by the Company for its employee share plans. Following the completion of the offering, the Government remains the Company’s largest shareholder, retaining an 81.48% direct shareholding as of the date of this Annual Report.\nIn May 2022 and May 2023, the Extraordinary General Assembly approved grants of one bonus share for every ten outstanding shares. As a result of the bonus share grants, the Company’s share capital increased by a total of thirty billion Saudi Riyals by capitalizing a portion of its retained earnings. As a result, as at the date of the Report, the share capital of the Company is ninety billion Saudi Riyals, which is fully paid, consisting of two hundred and forty two billion shares with no par value.\nMaterial agreements Aramco has entered into a number of agreements for the purposes of its business. The following is a summary of those agreements that Aramco considers material to its business. Aramco believes that all such agreements, in addition to the key provisions thereunder, have been included in this section and that there are no other agreements that are material in the context of its business. These summaries do not purport to describe all the applicable terms and conditions of such agreements and are qualified in their entirety by the respective agreements.\nThe Concession Background\nThe Arabian American Oil Company Concession Agreement, which was entered into on 4/2/1352H (corresponding to May 29, 1933) was\nratified on 14/3/1352H (corresponding to 7 July 1933) pursuant to Royal Decree No. 1135, pursuant to which the Government granted\nArabian American Oil Company predecessors certain exclusive rights, including the right to explore, drill, recover, and treat crude oil and other hydrocarbons located within certain areas of the Kingdom. Pursuant to Royal Decree No. M/8 dated 4/4/1409H (corresponding to November 13, 1988) approving Aramco’s original articles, Aramco enjoyed all the privileges and rights provided under the Original\nConcession Agreement (the “Original Concession”). Effective 6/4/1439H (corresponding to December 24, 2017), the Government,\nrepresented by the Minister of Energy, and Aramco entered into the Concession Agreement (the “Concession”), which replaced\nand superseded in its entirety the Original Concession on such date (the “Concession Effective Date”). Further, on 20/1/1441H\n(corresponding to September 19, 2019), and in accordance with the Hydrocarbons Law, the Government, represented by the Minister of Energy, and Aramco entered into an amendment to the Concession (the “Concession Amendment”), with effect from January 1, 2020.\n\n5 . O RGANIZATIONAL 6. ADDITIONAL STRUCTURE AND FINANCIAL 7. C ONSOLIDATED\n\nAND STRATEGY PERFORMANCE 3. SUSTAINABILITY 4. RISK GOVERNANCE INFORMATION STATEMENTS All amounts in millions unless otherwise stated Grant of rights The Concession grants Aramco the following rights to be exercised during the term of the Concession:\n• The exclusive right to explore, drill, prospect, appraise, develop, extract, recover, and produce hydrocarbons in the Concession Area;\n• The non-exclusive right to manufacture, refine, treat, market, sell, transport, and export hydrocarbons and their derivatives extracted, recovered, developed, produced, treated, refined, consumed, transported,']","Aramco's state-granted operating rights include several main privileges and a defined time structure:

### Main Privileges:
1. **Exclusive Rights**:
   - Explore, drill, prospect, appraise, develop, extract, recover, and produce hydrocarbons in the Concession Area.
   - Market and distribute hydrocarbons, petroleum products, and LPG within the Kingdom, ensuring domestic market needs are met.
   - Build, own, and operate necessary facilities and assets for operations.

2. **Non-Exclusive Rights**:
   - Manufacture, refine, treat, market, sell, transport, and export hydrocarbons and their derivatives.

3. **Additional Rights**:
   - Acquire and use land, water, and other natural products for operations.
   - Purchase, lease, or obtain materials and equipment necessary for operations.
   - Receive government assistance in securing rights and obtaining necessary permits and licenses.

### Time Structure:
- The Concession is effective for **40 years** from the Concession Effective Date (December 24, 2017).
- The Government may extend the Concession for an additional **20 years** on the 30th anniversary, provided certain conditions are met.
- Further extensions may be negotiated for an additional **40 years** beyond the initial 60-year period, subject to agreement on terms between Aramco and the Government (Section on Grant of Rights and Term).","The Concession Agreement gives Aramco exclusive rights to explore, develop, recover, produce, market, and distribute hydrocarbons and LPG in Saudi Arabia, along with non-exclusive rights for refining and exporting. Its initial term is 40 years, extendable by 20 years, with a possible additional 40-year extension by agreement.",0.918918918918919,0.9876734246310009,0.9999999999888889,1.0
How did Aramco describe its shareholder payout during the early pandemic downturn?,"['2020, Aramco joined the Aramco’s climate change to the amount necessary to enable Hydrogen Council as a steering member.\nAramco to first pay the minimum The Hydrogen Council is a CEO-led strategy aims to grow quarterly cash dividend amount described organization that promotes collaboration above to holders of shares other than between governments, industry and its business sustainably the Government. The remaining amount investors to provide guidance on by leveraging technology of the declared dividend as determined accelerating the deployment of by the Board of Directors in its discretion hydrogen solutions globally. Moreover, and innovation to lower will be paid to the Government. in September 2020, Aramco and the Institute of Energy Economics, Japan its climate impact (IEEJ), in partnership with SABIC, Refer to Section 6: Corporate governance successfully completed the world’s first for further details.\nshipment of high-grade blue ammonia, which involved the conversion of hydrocarbons to hydrogen and then to ammonia, as well as the capture of associated carbon dioxide emissions.\nForty tonnes were shipped from Saudi Arabia to Japan for use to generate power with a zero-carbon footprint.\n\nweivrevo ssenisuB\n\nKKeeyy 22002200 mmeettrriiccss SShhaayybbaahh ffaacciilliittyy F inancial highlights Net income EBIT* Free cash flow* Net cash provided by (billion) (billion) (billion) operating activities (billion)\n184 380 184 285\nSAR SAR SAR SAR\n$49 $101 $49 $76\n(2019: $88) (2019: $178) (2019: $78) (2019: $111)\nCapital expenditures Dividends paid Dividends paid per share ROACE* (billion) (billion) (%)\n101 261 1.30 13.2\nSAR SAR SAR\n$27 $70 $0.35\n(2019: $33) (2019: $73) (2019: $0.37) (2019: 28.4)\nGearing* Earnings per share Average realized (%) (basic and diluted) crude oil price ($/barrel)\n23.0 0.93 40.6\n$0.25\n(2019: -0.2) (2019: $0.44) (2019: $64.6)\n\nOperational highlights MSC Hydrocarbon production Crude oil production1 Reliability2 (mmbpd) (mmboed) (mmbpd) (%)\n12.0 12.4 9.2 99.9\n(2019: 12.0) (2019: 13.2) (2019: 9.9) (2019: 99.2)\nGross refining capacity Net chemicals production Upstream carbon Flaring intensity3 (mmbpd) capacity intensity (scf/boe)\n(million tonnes per year) (kg of CO2e/boe)\n6.4 53.1 10.5 5.95\n(2019: 6.4) (2019: 21.7) (2019: 10.4) (2019: 5.88)\nTotal recordable case frequency2 (per 200,000 work hours)\n* Non-IFRS measure: refer to “Non-IFRS measures reconciliations and definitions”\n0.044 for further details.\n1. Includes blended condensate and AGOC’s production but excludes the Kingdom of Bahrain’s entitlement to volumes produced from the Abu Sa’fah field.\n2. The Company.\n(2019: 0.059) 3. Wholly owned in-Kingdom assets, SASREF, Motiva and ARLANXEO.\n\nCFO’s message Aramco achieved solid earnings and cash flow and maintained a strong balance sheet, while declaring a total dividend of SAR 281 billion ($75 billion) for 2020\nThe year 2020 will undoubtedly be In a year marked by uncertainty, remembered as one of the most difficult Aramco achieved a number of milestones, and challenging economic periods in including the successful completion of\nrecent history due to the COVID-19 our historic acquisition of a 70% stake\npandemic. The global economy was in SABIC, which transformed our company severely disrupted, which resulted in into a major global petrochemicals a collapse in energy demand and producer and strengthened the resilience significant price volatility. There were, of our cash flow generation through however, some positive signs of a limited synergistic opportunities.\neconomic recovery in the second half of the year as demand and prices for In order to meet the challenges of the petroleum products improved. evolving market conditions, Aramco focused on rebalancing its cash priorities In response to the pandemic, Aramco to maintain liquidity and preserve its carried out comprehensive mitigation industry-leading financial position.\neff', 'details, refer to All amounts in millions SAR 2020 2019 the Directors, Senior Management, Note 18 of the consolidated financial\nemployees and contract employees of the Pension plans 12,167 (1,600) statements contained in Section 8.\nCompany and its controlled subsidiaries Medical and other post-\nregarding, among other things, health, employment benefit plans 42,040 22,774 Redeemable debt instruments\nsafety and environmental protection, Net benefit liability 54,207 21,174 The Company did not redeem,\ncompetition and antitrust, anti-bribery purchase or cancel any redeemable and anti-corruption, insider trading, For details regarding investments made debt instruments.\nand compliance with applicable law. or any reserves set up for the benefit of employees, refer to Note 22 of the Numbers of Aramco’s requests of Risk management consolidated financial statements shareholders records in 2020 contained in Section 8.\nThe Board routinely assesses the No. Request date Request rationale Company’s risks that could impact Convertible debt instruments, contractual 1 January 2 Shareholder analysis its business model and/or, future securities, preemptive right or similar 2 January 9 Shareholder analysis performance. The Company’s risk management framework and risk\nOn December 11, 2019, the Company\nacquired 117.2 million ordinary shares from the Government for the purposes of Board of Directors declarations 6 March 8 Shareholder analysis issuing them to employees through the The Board declares the following: Company’s share plans. For further 7 March 9 Shareholder analysis\ndetails, refer to Note 17 and 18 of the 8 March 10 Shareholder analysis\n• the accounting records were properly contained in Section 8.\n10 March 12 Shareholder analysis\n• the system of internal control is sound\n11 March 16 Shareholder analysis\nin design and has been effectively Conversion or subscription rights under\nimplemented; and any convertible debt instruments, 12 March 18 Shareholder analysis\ncontractually based securities, warrants 13 March 22 Dividends distributions\n• there are no doubts on the Company’s The Company did not issue or grant any\n15 April 30 Shareholder analysis\nconversion or subscription rights under\nCompany declarations 16 May 11 Annual General\nany convertible debt instruments, Assembly Meeting SOCPA endorsed IFRS compliant contractually based securities, warrants The consolidated financial statements or similar rights. Refer to the preceding\nhave been prepared in accordance paragraph for disclosure on convertible 18 August 13 Dividends distributions\nStandards (IFRS), that are endorsed preemptive right or similar rights issued 20 September 21 Shareholder analysis\nin the Kingdom, and other standards or granted by the Company.\nand pronouncements issued by SOCPA.\n22 November 11 Dividends distributions\nThe consolidated financial statements\nare also in compliance with IFRS as 23 December 16 Shareholder analysis\nissued by the International Accounting Standards Board (IASB).\necnanrevog etaroproC\n\nDividend distribution policy and In 2019 and 2020, the Company’s dividend Royal Order No. A/42, dated 26/1/1441H\ndividends framework payments totaled SAR 274.4 billion (corresponding to September 25, 2019)\nPursuant to the Bylaws, the Board has ($73.2 billion) and SAR 261.2 billion provides that, to the extent that the\nsole discretion to declare dividends ($69.6 billion), respectively. On March 18, Board determines that the amount of\nwith respect to the outstanding shares 2021, the Company declared an ordinary any quarterly cash dividend declared\nin accordance with the Company’s dividend of SAR 70.3 billion ($18.8 billion) with respect to calendar years 2020\nDividend Distribution Policy. However, with respect to the fourth quarter of 2020 through 2024 would have been less it is under no obligation to do so. The and is payable to the holders of shares as than $0.09375 per ordinary share amount and frequency of any dividends at the eligibility date for payment of such (based on 200,000,000,000 ordinary\nwill depend on a number of factors, dividend as declared by the Board. shares outstanding) but for the including the Company’s historic and Government forgoing its rights to such anticipated earnings and cash flow, It is the intention of the Board, in its dividend as follows, the Government the Company’s financial obligations and discretion, to deliver sustainable dividends will forgo its right to receive the portion capital requirements, general economic to its shareholders. The Company’s of cash dividends on its ordinary shares and market conditions and other factors Dividend Distribution Policy states that equal to the amount necessary to enable deemed relevant by the Board. The dividends may be declared from net the Company to first pay the minimum Company’s expectations in connection profits only after the Company has: quarterly cash dividend amount described', 'second quarter of 2019.\nAramco navigated challenging market conditions to record net income of $6.6 billion for the\nsecond quarter and $23.2 billion for the first half of 2020, respectively, compared to $24.7 billion\nand $46.9 billion in the corresponding periods of 2019. This demonstrates Aramco’s agility,\nstrength and resilience across market cycles.\nFree cash flow* was $6.1 billion in the second quarter and $21.1 billion for the first half of 2020,\nrespectively, compared to $20.6 billion and $38.0 billion for the same periods in 2019.\nThe gearing ratio* was 20.1% at the end of June, mainly reflecting deferred consideration for the Saudi Basic Industries Corporation (SABIC) acquisition and the consolidation of SABIC’s net debt onto Aramco’s balance sheet.\nCapital expenditure was $6.2 billion in the second quarter and $13.6 billion for the first half of\n2020. Aramco continues to implement its capital spending optimization and efficiency program,\nand expects capital expenditure to be at the lower end of the $25 billion to $30 billion range for\n2020.\nOperational Highlights The COVID-19 pandemic has spread rapidly throughout the world, resulting in substantial reductions in consumer and business activity and significantly reduced demand for crude oil, natural gas and petroleum products.\nUnder these challenging market conditions, Aramco continued its strong track record of reliable supply, achieving 99.8% reliability in the delivery of crude oil and other products in the second quarter of 2020.\nThe Company demonstrated reliable upstream performance with total hydrocarbon production\nof 12.7 million barrels per day of oil equivalent in the second quarter of 2020.\nAramco achieved a historic highest single day crude oil production of 12.1 million barrels on April 2, 2020.\n\nTo meet future global and domestic energy demand, Aramco continues to expand its gas business. In line with this strategy, the Fadhili Gas Plant reached its full production capacity of 2.5 billion standard cubic feet per day during the second quarter, after successfully completing its commissioning activities.\nThe Downstream business continues to deliver on its long-term strategy of strategic integration and diversification.\nIn June 2020, Aramco successfully completed the acquisition of a 70% stake in SABIC, for $69.1\nbillion. SABIC is a world-class, diversified petrochemicals company with complementary chemicals capabilities. The acquisition enhances Aramco’s existing Downstream portfolio, accelerates its petrochemicals growth, increases existing chemicals volumes and expands its international reach.\nIn July 2020, the Oil and Gas Climate Initiative (OGCI) member companies announced a target to reduce the average carbon intensity of their aggregated upstream oil and gas operations to\nbetween 20 kg and 21 kg of CO2 equivalent per barrel of oil equivalent (CO2e/boe) by 2025, from\na collective baseline of 23 kg CO2e/boe in 2017. Aramco, an OGCI member, achieved an upstream\ncarbon intensity of 10.4 kg CO2e/boe in 2019. The Company’s Greenhouse Gas emissions were\nverified by an independent third party.\nCOVID-19 Update Throughout the ongoing COVID-19 pandemic, Aramco has remained committed to the safety of\nits people, establishing protocols to monitor and limit the spread of COVID-19.\nThe Company has helped its people and communities around the world confront the virus through initiatives such as employee donation programs, medical support services and monetary contributions. Working with communities in each of its geographies, Aramco and its subsidiaries have provided much-needed equipment to hospitals, such as ventilators, high-efficiency air purifiers and personal protective equipment for frontline healthcare professionals.\nAramco has extended financial support to aid agencies around the world to help combat the spread of COVID-19. Aramco Overseas Company and Aramco’s regional affiliates have made donations of $6.7 million to organizations in the United States, Asia and Europe to support\nemergency workers and help protect vulnerable groups. This includes financial support to multiple food banks and to advance trials of treatments for COVID-19 patients.\nIn Saudi Arabia, Aramco has contributed over $50 million to the Health Endowment Fund of the Ministry of Health to support efforts to combat COVID-19. It also matched an amount raised by\nAramco employees through staff donations, with a total of $3.5 million going towards the distribution of welfare supplies to more than 20,000 deserving households, including orphans\nand widows, across the Kingdom.\nDespite the virus’s impact on demand, the Company continues to place great importance on maintaining its industry-leading capabilities and operations, backed by its world-class supply chain, to ensure its customers’ requirements are met.\n\nAdditional information on Ar', ""*: $18.3 billion\n• Q4 2020 dividend of $18.8 billion paid in the first quarter; Q1 2021 dividend of $18.8 billion to be paid in the second quarter Dhahran, Saudi Arabia, May 4, 2021 – The Saudi Arabian Oil Company (“Aramco” or “the Company”) today announced its first quarter financial results, posting a 30% year-on-year\nincrease in net income to $21.7 billion and declaring a dividend of $18.8 billion to be paid in Q2.\nThe results were underpinned by higher oil prices and an improved economic environment in the first three months of 2021.\nCommenting on the results, Aramco President & CEO Amin H. Nasser, said:\n“The momentum provided by the global economic recovery has strengthened energy markets, and Aramco’s operational flexibility, financial agility and the resilience of our employees have contributed to a strong first quarter performance. For our customers we remain a supplier of choice, and for our shareholders we continue to deliver an exceptional quarterly dividend.\n“We made further progress towards our strategic objectives during the quarter and our portfolio optimization program continues to identify value creation opportunities, such as the recent announcement of our landmark $12.4 billion pipeline infrastructure deal. We also expect Saudi Arabia’s newly-launched Shareek program to present growth opportunities, through incentives which encourage partnerships and investment.\n“Given the positive signs for energy demand in 2021, there are more reasons to be optimistic that better days are coming. And while some headwinds still remain, we are well-positioned to meet the world’s growing energy needs as economies start to recover.”\n\nFinancial Highlights\nAramco’s net income was $21.7 billion for the first quarter, a 30% increase from $16.7 billion in\nQ1 2020, primarily driven by a stronger oil market and higher refining and chemicals margins, partly offset by lower production.\nCash flow from operating activities and free cash flow* was $26.5 billion and $18.3 billion\nrespectively in the first quarter, while first quarter capital expenditure stood at $8.2 billion.\nAramco's gearing ratio* remained unchanged at 23.0% on March 31, 2021, compared to\nDecember 31, 2020.\nAramco declared a dividend of $18.8 billion for the first quarter, to be paid in Q2 2021.\nOperational Highlights Aramco demonstrated reliable upstream performance with an average total hydrocarbon\nproduction of 11.5 million barrels per day of oil equivalent in the first quarter of 2021, including\n8.6 million barrels per day of crude oil.\nThe Company maintained its exceptional track record as a global energy supplier, achieving 100% reliability in its deliveries to customers during the first quarter.\nIn January, Aramco partnered with stc, a leading telecom and technology services company, to launch one of the world’s most powerful supercomputers, Dammam 7. Its high-performance computing capability of 55.4 petaflops presents new opportunities in both exploration and development, enhancing Aramco’s ability to predict the location of new reserves using sophisticated imaging and artificial intelligence deep learning technologies. Dammam 7 supports Aramco’s digital transformation program, complementing a suite of advanced technologies that are reshaping core operations, driving efficiencies and reinforcing its industry leadership.\nDuring the first quarter, Aramco and The Dow Chemical Company, partners in the Sadara Chemical Company (Sadara) joint venture, entered into agreements relating to their Sadara joint venture. This includes extending the debt repayment tenure, a grace period for interest payments and sponsor guarantees. It further includes other agreements with respect to procurement of feedstock and marketing rights for Sadara’s finished products.\nAramco planted more than 500,000 trees during the first quarter, successfully completing its program to plant one million trees. The program’s main objective is to mitigate desertification, sequester carbon, and enhance native biodiversity. The One Million Trees Initiative aligns with the United Nations Biodiversity and Sustainability Development Goals, and is part of the Company’s commitment to protecting the environment.\n\nThe Company also contributed to COVID-19 vaccination efforts during the first quarter to protect its workforce and the wider community from the risk of infection. As of April 30, more than\n178,000 Aramco employees, retirees and their dependents had received vaccinations. This includes around 85% of the Aramco workforce. These were administered either through\nAramco’s vaccination program, being conducted from 14 locations across Saudi Arabia in conjunction with its medical partner Johns Hopkins Aramco Healthcare, or through a government vaccination scheme.\n*Please refer to www.aramco.com/investors for reconciliation of non-IFRS measures Contact Information International Media Relations: international.media@aramco.com Investor Relations: investor.relations@aramco.com Aramco Disclaimer The press"", 'Valvoline Inc.’s global to deliver a sustainable and progressive base dividend,\nincrease of 4.0% compared to the previous quarter, products business and a 10% interest in Rongsheng which provides downside resilience when necessary.\nand a performance-linked dividend distribution of Petrochemical in China. The former complements Second, we aim to share the upside with our\nSAR 40.4 billion ($10.8 billion). Both dividends will be Aramco’s line of premium-branded lubricant products, shareholders, which we expect to do through our\npaid in the first quarter of 2024. while the latter aligns with our goal to enhance our newly introduced performance-linked dividends.\nAdvancing our growth strategy Downstream business in high-growth geographies. Finally, we intend to continue to heavily reinvest in our business through unique growth opportunities.\nIn 2023, we continued to demonstrate our financial Alongside these investments, our acquisition of SABIC flexibility as we scaled up the ongoing implementation in 2020 continues to support our downstream growth The positive impact of our dividend distribution of the largest capital program in our Company’s and deliver value. We are targeting approximately strategy was on full display in 2023. Our total base\nhistory. Our capital expenditures in 2023 were SAR 11.3 billion to SAR 15.0 billion ($3.0 billion to 4.0 dividends paid in 2023 of SAR 292.7 billion\nSAR 158.3 billion ($42.2 billion), representing an billion) in annual recurring synergies by 2025. ($78.0 billion) were 4.0% higher than the dividends\nincrease of 12.1% from the previous year. We expect paid in 2022. In addition, we also paid out\n\n5. ADDITIONAL FINANCIAL 6. CONSOLIDATED\n\nAND STRATEGY PERFORMANCE 3. SUSTAINABILITY 4. RISK GOVERNANCE INFORMATION STATEMENTS Financial performance Portfolio and funding optimization Government share transfer and In January 2023, Aramco received a payment of Bonus share distribution\nSAR 15.6 billion ($4.2 billion) related to the financing On April 16, 2023, the Government announced it\narrangement with the Jazan Integrated Gasification has transferred 4% of the Company’s issued shares and Power Company (JIGPC). This is the second of to Sanabil Investments Company. In addition, on three payments received by Aramco as a result of the March 7, 2024, the Government announced it had financing arrangement. The remaining amount to be transferred an additional 8% of the Company’s issued received under the financing arrangement as at shares to PIF’s wholly-owned companies. These\nDecember 31, 2023 is SAR 2.0 billion ($0.5 billion). private transfers did not affect the Company’s total\nnumber of issued shares and do not have any impact With respect to the deferred consideration related to on the Company’s operations, strategy, dividend the SABIC acquisition, the Company made total distribution policy, or governance framework. The payments in the amount of SAR 117.0 billion Government remains Aramco’s largest shareholder,\n($31.2 billion), in 2023 resulting in the full settlement retaining an 82.19% direct shareholding.\nof the deferred consideration. These payments resulted in a decrease in total borrowings and On May 8, 2023, the Company’s Extraordinary cash and cash equivalents, and a net gain of General Assembly approved the Board of Directors’\nSAR 5.8 billion ($1.5 billion). recommendation to increase the Company’s share\ncapital through capitalizing SAR 15.0 billion\nIn relation to SABIC’s agreement to sell its 100% ($4.0 billion) of the Company’s retained earnings to\nshareholding in Hadeed to PIF, the assets and support the distribution of bonus shares to eligible liabilities of Hadeed were remeasured and classified shareholders, in the amount of one share for every\nas held for sale as at September 30, 2023. As a result, 10 shares held. This resulted in the increase of issued\n\nshareholders across crude oil price cycles. statement of income. SAR 15.0 billion ($4.0 billion).\nInvestments in affiliates and securities Shareholder returns\nIn March 2023, Aramco completed its acquisition of During 2023, the Company declared and paid base\nValvoline Inc.’s global products business (VGP dividend payments totaling SAR 292.7 billion\nDelivering shareholder value Holdings LLC) for approximately SAR 10.34 billion ($78.0 billion). In addition to the base dividend, the\n($2.76 billion), including customary adjustments. This Company established a mechanism for performance-\ntransaction resulted in Aramco recognizing assets linked dividends to be paid in the amount of', 'filed with the Tadawul. For additional information on the potential risks and uncertainties that could cause actual results to differ from the results predicted please see the Company’s latest periodic reports filed with the Tadawul. Such forward-looking statements are based on numerous assumptions regarding the Company’s present and future business strategies and the environment in which it will operate in the future.\nThe information contained in the press release, including but not limited to forward-looking statements, applies only as of the date of this press release and is not intended to give any assurances as to future results. The Company expressly disclaims any obligation or undertaking to disseminate any updates or revisions to the press release, including any financial data or forward-looking statements, whether as a result of new information, future events or otherwise, unless required by applicable law or regulation. No person should construe the press release as financial, tax or investment advice.\nUndue reliance should not be placed on the forward-looking statements, and the Company, its directors, senior executives and employees shall not be liable for any direct or indirect loss or damage that any person may incur due to their reliance on the forward-looking statements.\n\nSOURCE: Saudi Aramco — Press Release 2020 Q2 H1\nTYPE: Press Release\nURL: https://www.aramco.com/-/media/publications/corporate-reports/reports-and-presentations/2020/q2---h1/saudi-aramco-q2-2020-press-release-english.pdf\n\nPress Release Aramco announces second quarter and half-year 2020 results Continued progress on strategy and commitment to dividend enabled by resilience and financial prudence\n• Net income: $6.6 billion (Q2) / $23.2 billion (H1)\n• Cash flow from operating activities: $12.3 billion (Q2) / $34.8 billion (H1)\n• Free cash flow*: $6.1 billion (Q2) / $21.1 billion (H1)\n• Q1 dividend of $18.75 billion paid in the second quarter; Q2 dividends of $18.75 billion to be paid in the third quarter\n• Completion of SABIC transaction is a milestone for Downstream growth strategy Dhahran, Saudi Arabia, August 9, 2020 – The Saudi Arabian Oil Company (“Aramco” or “the Company”) today announced its results for the second quarter and first half of 2020, highlighting the Company’s financial and operational resilience, and commitment to shareholders despite challenging market conditions caused by the COVID-19 pandemic.\nCommenting on the results, Aramco President & CEO Amin H. Nasser, said:\n“Despite COVID-19 bringing the world to a standstill, Aramco kept going. We have proven our financial resilience and operational reliability, setting a record in our business operations, while at the same time taking steps to ensure the health and safety of our people.\n“Strong headwinds from reduced demand and lower oil prices are reflected in our second quarter results. Yet we delivered solid earnings because of our low production costs, unique scale, agile workforce, and unrivalled financial and operational strength. This helped us deliver on our plan to maintain a second quarter dividend of $18.75 billion to be paid in the third quarter.\n“We will continue to pursue our long-term growth and diversification strategy to capture unrealized and additional value from every hydrocarbon molecule we produce – driving global commerce and enhancing people’s lives. The completion of our historic acquisition of a 70% stake in SABIC is yet more evidence of that forward momentum and a testament to our healthy financial position.\n\n“We are seeing a partial recovery in the energy market as countries around the world take steps to ease restrictions and reboot their economies. Meanwhile, we continue to place people’s safety first and have adapted to the new normal, implementing wide-ranging precautions to limit the spread of COVID-19 wherever we operate.\n“We are determined to emerge from the pandemic stronger and will continue making progress on our long-term strategic journey, through ongoing investments in our business – which has one of the lowest upstream carbon footprints in the world.”\nFinancial Highlights Despite continued global economic disruption and challenges facing the energy sector, Aramco continued to deliver on its commitment to shareholders by declaring a dividend of $18.75 billion\nfor the second quarter, compared to $13.4 billion for the second quarter of 2019.\nAramco navigated challenging market conditions to record net income of $6.6 billion for the\nsecond quarter and $23.2 billion for the first half of 2020, respectively, compared to $24.7 billion\nand $46.9 billion in the corresponding periods of 2019. This demonstrates Aramco’s agility,\nstrength and resilience across market cycles.\nFree cash flow* was $6.1 billion in the second quarter and $21.1 billion for the first half of 2020,\nrespectively, compared to $20.6 billion and $38.', '16 April Shareholder analysis 27 November Shareholder analysis1\n18 May Shareholder analysis 15 December Shareholder analysis2\n25 May Dividend distribution 15 December Dividend distribution\n2. Three requests on that day for shareholder analysis.\n* In 2025, total number of requests of shareholder records is 52.\nDividend distribution policy and The Company pays cash dividends to • E stablished any reserves to meet dividends framework non-Government shareholders in SAR and contingencies as determined from time to Pursuant to the Bylaws, the Board has sole to the Government in U.S. dollars. All shares time at the discretion of the Board; and, discretion to declare dividends with respect have the same entitlement to any dividends\n• T aken into consideration its working to the outstanding shares in accordance declared by the Board and any dividends are capital requirements, near-term liquidity, with the Company’s dividend distribution and will be distributed in compliance with and any other factors or considerations policy. However, it is under no obligation to applicable tax laws.\nthat may be relevant in this regard, do so. The amount and frequency of any It is the intention of the Board, in its including but not limited to the dividends will depend on a number of discretion, to deliver a sustainable base implications of any dividend distributions factors, including the Company’s historic dividend and performance-linked dividends on the Company’s capital structure, credit and anticipated earnings and cash flow, the to the Company’s shareholders. The ratings, and publicly communicated Company’s financial obligations, capital Company’s dividend distribution policy gearing targets.\nrequirements and growth plans, the states that dividends may be declared from Company’s desire to maintain an investment net profits only after the Company has:\ngrade credit rating across oil price cycles, general economic and market conditions, • E nsured that dividends are capable of and other factors deemed relevant by the being distributed by the Company with Board. The Company’s expectations in reference to its most current financial connection with these factors are subject to statements;\nnumerous assumptions, risks, and uncertainties, which may be beyond the Company’s control.\n\nAramco overview Results and Sustainability Risk Organizational structure Additional financial Consolidated and strategy performance and corporate governance and legal information financial statements\nIn 2023, the Company introduced a On March 9, 2026, the Board declared a\nmechanism for performance-linked base dividend of ﷼ 82.08 billion ($21.89\ndividends to support its aim to deliver a billion) for the fourth quarter of 2025.\nbalanced mix of growth and yield to Punishments and penalties shareholders, which is intended to be paid The Company is committed to high\nin the amount of 50-70% of the Group’s\nstandards of governance. The Company is annual free cash flow, net of the base not aware of any penalty, precautionary dividend and other amounts including procedure, or preventative measure external investments1.\nimposed on it by any authority, supervisory,\nIn 2024 and 2025, the Company’s base regulatory, or judicial body in 2025.\ndividend payments totaled ﷼ 304.3 billion Board of Directors’ report\n($81.15 billion) and ﷼ 317.16 billion ($84.58\nThe information contained in Sections 1–6 billion), respectively.\nof this Annual Report constitutes the Board In 2024 and 2025, the Company’s of Directors’ report.\nperformance-linked dividend payments\ntotaled ﷼ 161.6 billion ($43.09 billion) and\n﷼ 3.29 billion ($0.88 billion), respectively.\nIn 2025, there is no shareholder of the Company who has waived any rights to dividends.\nCompliance with CMA Corporate Governance Regulations The Company has implemented all the provisions contained in the Corporate Governance Regulations issued by the CMA, to the extent applicable to it in light of the Bylaws, except the provisions noted below:\nArticle No. Provision of the Article Justification 92 (Guiding Article) If the Board forms a corporate governance While Aramco’s Board has not formed a corporate committee, it shall assign to it the competencies governance committee as stated in this Guiding stipulated in Article (91) of the Corporate Governance Article, the Board has instead charged the\nRegulations. Such committee shall oversee any Nomination Committee, formed pursuant to the matters relating to the implementation of Company Bylaws, with the responsibility of governance, and shall provide the Board with its overseeing and making recommendations to the reports and recommendations at least annually. Board with respect to the Company’s corporate governance policies and practices, including the competencies of effective governance described in Article (91) of the Corporate Governance Regulations.\n1. For the purpose of calculating performance-linked dividends, external investments include acquisition of affiliates, net of cash acquired, additional investments in joint ventures and associates, and certain amounts recognized in net investment in securities. Please see the consolidated statement of cash flows for more information.\n\nAdditional financial information All amounts in millions SAR unless', 'deliver an exceptional quarterly\nCapital expenditures 30,750 27,740 8,200 7,397 dividend.\nFree cash flow 68,549 56,327 18,279 15,021\nWe made further progress towards our strategic objectives\nDividends paid 70,325 50,226 18,753 13,394 during the quarter and our portfolio optimization program\nROACE1 14.2% 26.3% 14.2% 26.3% continues to identify value creation opportunities, such as the\nAverage realized crude oil recent announcement of our landmark $12.4 billion pipeline\nprice ($/barrel) n/a n/a 60.2 51.8 infrastructure deal. We also expect Saudi Arabia’s newly-\n\uf02a Supplementary information is converted at a fixed rate of U.S. dollar 1.00 = SAR 3.75 for launched Shareek program to present growth opportunities,\nconvenience only.\n1. Calculated on a 12-month rolling basis. through incentives which encourage partnerships and investment.\nGiven the positive signs for energy demand in 2021, there are more reasons to be optimistic that better days are coming.\nAnd while some headwinds still remain, we are well-positioned to meet the world’s growing energy needs as economies start to recover.\nn/a 21,717 40,982\n8,200 18,279\n18,753 14.2%\n60.2\n\nSaudi Aramco 3 First quarter interim report 2021 First quarter highlights The energy markets saw a strong recovery in the first quarter of 2021 In the first quarter of 2021, Aramco’s Downstream segment, one of the due to the ongoing rebalancing of supply and demand fundamentals, in world’s largest refining and petrochemicals businesses, consumed\naddition to improved sentiment for an increase in global demand 43.8% (Q1 2020: 35.5%) of Aramco’s crude oil production.\nspurred by ongoing vaccination programs. This led to a steady Downstream developments in the first quarter of 2021 include:\nincrease in crude oil prices, while discipline from refiners and petrochemicals producers helped improve margins. Capitalizing on \uf0b7 Aramco safely and successfully started-up the Jazan refinery in these increasingly encouraging market conditions, Aramco delivered January and work is progressing well to reach the 400 mbpd strong quarterly earnings and cash flows, while maintaining its low design capacity;\nUpstream production cost and high level of operational agility.\n\uf0b7 Aramco and the Dow Chemical Company (Dow), partners in the To unlock value from its asset base and maximize shareholder return, Sadara Chemical Company (Sadara) joint venture, entered into Aramco continues progressing with its ongoing portfolio optimization agreements to provide additional feedstock by increasing the program. In April 2021, Aramco signed a share sale and purchase quantity of ethane and natural gasoline supplied by Aramco.\nagreement to sell a 49% equity interest in Aramco Oil Pipelines These also include a gradual increase in Aramco’s rights to Company, a newly-formed Aramco subsidiary, to a consortium of market, through SABIC, the finished products produced by investors led by EIG Global Energy Partners for cash consideration of Sadara over the next five years through an executive sales and\nSAR 46.5 billion ($12.4 billion). As part of this infrastructure deal, operations planning committee. Additionally, Aramco and Dow\nAramco Oil Pipelines Company will lease and leaseback usage rights agreed to guarantee up to an aggregate of SAR 13.9 billion ($3.7\nin Aramco’s stabilized crude oil pipelines network for a 25-year period, billion) of senior debt principal in proportion to their ownership and in return, will receive a tariff from Aramco. Aramco will continue to interests in Sadara, an amount that is significantly lower than the retain full ownership and operational control of its stabilized crude oil $10.0 billion shareholder completion guarantees that were\npipelines network. The cash proceeds will be used for general released when Sadara achieved project completion in November corporate purposes. 2020. The terms of the restructuring also include beneficial terms such as a principal repayment grace period until June 15, 2026\nAramco continues to maintain its highly disciplined approach to capital and an extension of the final maturity date from 2029 to 2038, in allocation and expects 2021 capital expenditures to be approximately connection with all of the facilities. Sadara will also benefit from\n$35 billion, compared to the original guidance of $40 – $45 billion.\nlonger-term structural operating and feedstock improvements,\nA dividend of SAR 70.33 billion ($18.76 billion) was declared for the further enhancing its cracker’s flexibility and improving Sadara’s\nfirst quarter of', ""paid per share ROACE* (billion) (billion) (%)\n120 281 1.40 24.4\nSAR SAR SAR\n$32 $75 $0.37\n2020: $27 2020: $70 2020: $0.35 2020: 13.2\nGearing* Earnings per share Average realized (%) (basic and diluted) crude oil price ($/barrel)\n14.2 1.98 70.5\n$0.53\n\nmeasures reconciliations and definitions” for further details.\nHawiyah NGL Recovery Plant, Saudi Arabia\n\nResults and performance Operational highlights MSC Hydrocarbon production Crude oil production 1 (mmbpd) (mmboed) (mmbpd)\n12.0 12.3 9.2\n\nNet refining capacity Net chemicals Reliability 2 (mmbpd) production capacity (%)\n(million tons per year)\n4.0 53.8 99.9\n\nUpstream carbon Flaring intensity 3 Total recordable case 1. Includes blended condensate and AGOC’s production but excludes the intensity (scf/boe) frequency 4 Kingdom of Bahrain’s entitlement to volumes produced from the Abu Sa’fah (kg of COe/boe) (per 200,000 work hours)\n2. Applies to Saudi Arabian Oil Company\n11.2 5.51 0.054 (the Company).\n3. The Company’s GHG emissions inventory includes emissions from wholly-owned in-Kingdom operated assets, SASREF,\n\n4. The Company and its operationally controlled entities.\n\nCFO’s message Continued agility, resilience, and fiscal discipline Dear Shareholders, be a vital part of the global energy mix, and captures the opportunity to create Aramco’s extraordinary performance considerable shareholder value from the in 2021 is a testament to our fiscal current global under-investment in the discipline and flexibility through oil and gas industry that may result in evolving market conditions. a supply gap in the mid to long run.\nDuring the year, we saw a rebound During 2021, we progressed with our in the global economy with increased portfolio optimization program and\ndemand and higher prices for energy completed a SAR 46.5 billion ($12.4 billion)\nproducts, which translated into strong infrastructure deal with an international financial results. For the year ended consortium of investors. As part of the\nDecember 31, 2021, Aramco’s net income deal, we sold a 49% equity interest in a\nwas SAR 412.4 billion ($110.0 billion) subsidiary that holds leasing rights for\nwith free cash flow of SAR 403.0 billion Aramco's stabilized crude oil pipeline\n($107.5 billion) and ROACE of 24.4%. network. We signed a similar deal with\nWe also continued to strengthen our a second group of investors for our gas balance sheet, and improved our gearing pipeline network of SAR 58.1 billion\nratio to 14.2% at the end of 2021 from ($15.5 billion) that closed in February\n23.0% at the end of 2020. 2022. We also entered into a financing\nWe saw a rebound in the arrangement with a joint operation With this outstanding performance, we company in relation to the Jazan global economy with declared cash dividends of SAR 281.3 billion Integrated Gasification Combined-Cycle\n($75.0 billion) for 2021, and our Board (IGCC) Power Plant, an Air Separation\nincreased demand and recommended capitalizing SAR 15.0 billion Unit, and other ancillary assets for\n($4.0 billion) of retained earnings to SAR 44.1 billion ($11.8 billion). These\nhigher prices for energy support the distribution of bonus shares transactions demonstrate continued to shareholders, in the amount of one investor confidence in Aramco’s long-term products, which translated share for every 10 shares held. outlook, as well as the attractiveness of the Kingdom to institutional investors.\ninto strong financial results.”\nGoing forward, our financial framework will remain focused on long-term To further diversify our funding sources shareholder value creation and centered and expand our investor base, Aramco around three main pillars. First, we will successfully raised SAR 22.5 billion continue to prudently optimize our capital ($6.0 billion) through the issuance of our\nstructure to maintain a high investment inaugural U.S. dollar-denominated Shari’a grade rating with sufficient capacity. compliant securities. Our offering was the Second, we will ensure optionality and largest order book ever recorded globally execution flexibility through diversified for a dollar-denominated sukuk funding sources with optimized costs. transaction. This successfully expanded Finally, we will continue our proven our investor pool, primarily by adding capital discipline and financial prudence international investors seeking Shari’a through crude oil price cycles. compliant instruments. The"", ""eries designed specifically to economically process Arabian crude oil.\nFurthermore, Aramco intends to enhance its domestic and global marketing businesses to support the position of its upstream business in key, high-growth geographies, including China, India and Southeast Asia, which are integral to Aramco’s existing business and future expansion strategy. Moreover, Aramco intends to maintain its presence in key large countries, such as the United States, and in countries that rely on importing crude oil, such as Japan and South Korea.\nWWaassiitt GGaass PPllaanntt,, EEaasstteerrnn PPrroovviinnccee ygetarts\n\nweivrevo ssenisuB\n\nExpand global recognition Efficiently allocate capital of Aramco’s brands and maintain a prudent and flexible balance sheet Aramco intends to expand global Aramco has a comprehensive and recognition of its brands. One aspect disciplined internal approval process Aramco intends to expand of this strategy is to introduce its brands for capital expenditures, new projects global recognition of its to existing domestic and international and debt issuance. It analyzes future marketing businesses, including at retail projects based on strategic, operational, brands in the energy sector service stations, and further develop its commercial, and financial targets.\npetrochemicals and base oil brands. In Aramco’s unique reserves and resources addition, as new marketing activities are base, operational flexibility, field added to its business portfolio, Aramco management practices and strong cash intends to use its own brands and thereby flow generation serve as a foundation build recognition of its position as for its low gearing and flexibility to a leader in the global energy sector. allocate capital. Moreover, in August\nFor example, in March 2020, Aramco 2020, Aramco established an integrated\nannounced a long-term global corporate development organization to partnership with Formula 1®. create value, assess and divest of certain existing assets and secure greater access to growth markets and technologies through portfolio optimization and strategic alignment. Aramco operates within a conservative financial framework and strives to maintain its gearing ratio to within its long-term targeted range of 5% to 15%.\nHowever, following the acquisition of the PIF’s 70% equity interest in SABIC, Aramco’s gearing ratio as at December 31,\n2020 was 23.0%, as compared to (0.2)%\nas at December 31, 2019. Gearing is a\nnon-IFRS financial measure. For a definition of gearing and a reconciliation to the nearest financial measure calculated in accordance with IFRS, see Section 3: Results and performance.\nJu'aymah, Eastern Province\n\nDeliver sustainable Operate sustainably by dividends through leveraging technology crude oil price cycles and innovation Aramco intends to deliver sustainable Aramco’s climate change strategy aims dividends to its shareholders through to grow its business sustainably by crude oil price cycles. After consideration leveraging technology and innovation of a number of factors, the Board of to lower its climate impact. Aramco Directors, at its discretion, declared intends to maintain its position as a leader aggregate ordinary cash dividends of in Scope 1 and Scope 2 upstream carbon\n$75.0 billion with respect to calendar intensity, with one of the lowest carbon\nyear 2020. In addition, Royal Order No. footprints per unit of hydrocarbons\nA/42, dated 26/1/1441H (corresponding produced. It is also pursuing a wide\nto September 25, 2019) provides that, range of initiatives to further lower its to the extent that the Board of Directors carbon intensity. For example, Aramco’s determines that the amount of any natural gas program is increasing the quarterly cash dividend declared percentage of gas used to meet the with respect to calendar years 2020 Kingdom’s energy needs. Aramco is also through 2024 would have been less a founding member of the Oil and Gas than $0.09375 per share (based on Climate Initiative (OGCI) and uses this\n200,000,000,000 shares outstanding) platform for sharing best practices and but for the Government forgoing its devising common solutions to climate rights to such dividend, the Government change with other major companies.\nwill forgo its right to receive the portion of cash dividends on its shares equal In January 2020, Aramco joined the Aramco’s climate change to the amount necessary to enable Hydrogen Council as a steering member.\nAramco to first pay the minimum The Hydrogen Council is a CEO-led strategy aims to grow quarterly cash dividend amount described organization that promotes collaboration above to holders of shares other than between governments, industry and its business sustainably the Government. The remaining amount investors to provide guidance on by leveraging technology of the declared dividend as determined accelerating the deployment of by the Board of Directors in its discretion hydrogen solutions globally. Moreover, and innovation to lower will be paid to the Government. in September 2020,""]","During the early pandemic downturn, Aramco described its shareholder payout as a demonstration of its commitment to shareholders despite challenging market conditions. The company maintained a total dividend of SAR 281 billion ($75 billion) for 2020, reflecting its financial resilience and operational reliability. Aramco's President & CEO emphasized that the company delivered solid earnings due to its low production costs and unique scale, which allowed it to sustain dividends even amid reduced demand and lower oil prices (source: Press Release 2020 Q2 H1).","Despite weaker demand and lower oil prices, Aramco said it maintained a second-quarter dividend of $18.75 billion to be paid in the third quarter. The CEO attributed the company’s resilience to low production costs, scale, and financial and operational strength.",0.9285714285714286,0.9583867926363475,0.18333333332416668,1.0
How does Aramco try to make its purchasing practices ethical and locally beneficial?,"[""innovative solutions to market challenges, industries that, with the right business model and a variety of funding options to energize and support, are ripe for generating entrepreneurs. Since its founding, Wa’ed long-term impact for local communities. Helping beekeepers has created 1,700 new job opportunities, These programs focus on delivering training\nfunded 80 ventures, hosted 70 teams of and training facilities, knowledge, tools and\nIn partnership with the Al-Baha entrepreneurs in its startup lab, and trained technology that remove financial barriers Beekeepers Cooperative Association, more than 400 entrepreneurs. and lay the groundwork for participants and the Company has been helping beneficiaries to succeed in new endeavors beekeepers in Al-Baha improve their Supporting people with disabilities and enterprises.\nhoney yield quantity and quality.\nEstablishing national centers for Since 2016, the program has planted people with disabilities In the Jazan Mountains, Saudi Aramco’s flowering trees and generated Saudi Aramco is committed to improving coffee programs have supported farmers the living conditions of community members with training, farm preparation and water with disabilities and their families. The network system installations, resulting in the\nCompany extends financial and technical planting of over 20,000 seedlings since 2016,\nsupport to autism and Down syndrome replacing other less sustainable crops.\ncenters, rehabilitation centers and centers for individuals with special needs. The Company is working in partnership with the Border Guard, Ministry of Environment, The Company provided the funds to Water and Agriculture, and Nesma Holding construct the Shamah Autism Center in Company to strengthen fishing industries in Dammam. This is the first multidisciplinary Yanbu’ and Jazan, providing expertise and autism center for Saudi children in the equipment to fishermen collectively since 2018.\nEastern Province of the Kingdom. In addition, the Company constructed the Ajyal Center The Company has provided embroidery for Comprehensive Education & Life Skills. training and jobs to hearing-impaired and The center serves children with developmental other under-served women in Dammam disabilities, including autism spectrum since 2017, also in partnership with Nesma disorder, behavioral disorders and intellectual Holding Company.\ndisabilities.\nThese programs seek to make a real difference in people’s lives by equipping community members with the knowledge and skills to establish, manage and grow sustainable businesses.\n\nInternational citizenship initiatives North America Saudi Aramco’s community efforts extend As the base of North American operations beyond the borders of Saudi Arabia with and home to many of its regional affiliates, participation in community outreach and much of Saudi Aramco’s North American development efforts everywhere it operates. community-related efforts focus on or These range from natural disaster relief and originate from the Houston area. In the educational initiatives in China, habitat aftermath of Hurricane Harvey in 2017, preservation programs in Japan and Saudi Aramco volunteers have continually Southeast Asia, to STEM and petrochemical provided assistance to the local community, industry education programs in the U.S. including packing over 300,000 meals for\nand Europe. Saudi Aramco’s international at-risk families and working on Habitat for citizenship efforts are governed by the Humanity crews to rebuild 176 homes.\nCompany’s Citizenship Executive Committee. It is also the title sponsor of the Houston Everywhere Saudi Aramco The committee advises on the Citizenship Half Marathon, and in Houston and across Strategy and overarching position, approves the United States, over 5,000 students operates, it participates in related plans and mobilizes requisite business and educators have participated in support, ensures alignment of activities and Saudi Aramco-sponsored STEM education, community outreach and spending, monitors progress and compliance career awareness, environmental stewardship of related programs and develops citizenship and energy conservation programs.\ndevelopment efforts activity budgets for CEO and Board approval.\nEurope Saudi Aramco’s community outreach programs in Europe seek to motivate people to become more active and engaged members of their communities. In the Netherlands, for example, another location central to its global operations, Saudi Aramco’s supports a range of local philanthropic and recreational opportunities like the Juliana Children’s Hospital; one of the country’s leading pediatric hospitals, and the Aramco Beach Run, the Saudi Aramco’s flagship Citizenship event in Europe.\nAsia Saudi Aramco is committed to making important community and citizenship contributions everywhere it has meaningful operations throughout Asia. Ranging from coral reef conservation in Okinawa, to children’s medical and educational programs in China, Malaysia and Korea, to replacing vulnerable homes in rural Indonesia, Saudi Aramco’s programs have served thousands of workers, students, and at-risk citizens in dozens of locations throughout the region.\n)GSE( ecnanrevog\n\nlaicos ,latnemnorivne\n\nSaudi Aramco's procurement supports a diversified energy sector Responsible procurement The Company aims to cultivate local business with a goal of 70% of all expenditures in the Saudi Aramco’s commitment to ethical Kingdom being locally sourced over the next business practices extends to its supply chain three years.\nthrough its Supplier Code of Conduct which outlines mandatory policies on environmental, The Company aims to health and safety issues, fair"", 'petrochemicals, base oil and fuels demand, are driving the Company’s strategy to favor lubricants brands. As new marketing activities are added to its investments in facilities with high liquids-to-chemicals conversion business portfolio, Aramco intends to use its own brands to build rates. Aramco intends to continue to grow its liquids-to-chemicals recognition of its position in the global energy sector.\nStrategy in action Aramco’s dedicated system of domestic and international refineries provide secure demand for upstream crude production.\nUpstream crude oil production utilized by Aramco’s downstream operations 53\n\n% 2024\n\n% 2023\n\n% 2022\n\n% 2021\n\nUpstream Downstream\n\nStrategy continued Lower-carbon initiatives Aramco’s strategy for lower carbon intensity energy is designed to support this strategy, the Company has established a New Energies address climate-related risks and opportunities while derisking its organization to consolidate its lower-carbon businesses, focusing on businesses and maintaining competitiveness and differentiation in renewable power generation, lower-carbon hydrogen, and carbon carbon-constrained scenarios. At the same time, it aims to build a capture and storage. Aramco has ambitions to invest in up to 12 GW\n\nmaterial and profitable new business area for the longer-term. capacity of solar PV and wind projects by 2030. As part of the Jubail carbon capture and storage hub, Aramco aims to capture and store up The strategy comprises two main aspects. The first focuses on to 9.0 million tons of CO annually from Aramco facilities and other\nachieving lower net carbon emissions of the Company’s operations 2 industrial sources by 2028. A prudent strategy is being adopted in over time, with the ambition to achieve net-zero Scope 1 and Scope 2 developing the company’s low-carbon hydrogen and ammonia greenhouse gas emissions across wholly-owned operated assets by business, with a phased development approach that calibrates supply 2050. The second involves developing and investing in renewable\nwith market demand and with optionality for early market entry to power generation and lower-carbon products and solutions across the establish a market leading position. Aramco is targeting the production energy, chemicals, and materials industries.\nof up to 2.5 million tons of blue ammonia annually by 2030, subject to\nLowering the Company’s own net carbon emissions requires the availability of commercially viable long-term offtake projects.\nmanaging, reducing, and balancing carbon emissions across its Aramco aims to grow its business sustainably by leveraging technology wholly-owned operated assets through a number of measures, and innovation. The Company intends to maintain its position among including efficiency gains, renewable power investment, carbon the leaders in upstream carbon intensity, with one of the lowest capture and storage, and multiple offset initiatives.\ncarbon emissions per unit of hydrocarbons produced.\nBy developing and investing in renewable power generation and lower-carbon products and solutions, Aramco aims to support its efforts to reduce carbon emissions from its own operations. Through investments in lower-carbon hydrogen and ammonia, lower-carbon Strategy in action fuels, and gas, Aramco aims to support emissions reductions in hard-to-abate sectors, such as heavy-duty transport and industrial Aramco is developing a hub to capture and store up to applications, as well as developing products to complement renewables in the domestic energy mix. These initiatives are expected 9.0 million tons to support the participation in the growing lower-carbon products and solutions market. Aramco is also pursuing carbon capture and storage of CO annually by 2028.\n\nas a service offering to third parties, and is seeking investments in renewables that align with its other lower-carbon initiatives. To Localization and promotion of national champions In addition to Aramco’s core businesses, the Company seeks to foster new businesses that aim to increase the long-term reliability and Strategy in action competitiveness of the Company’s ecosystem, as well as contributing to the Kingdom’s economic development. This is key to ensuring Aramco is helping to build a world class local supply chain Aramco’s long-term cost and productivity leadership, sustainability, through its iktva program.\nand resilience. The objectives are two-fold: to maximize localization of the Company’s supply chain, and promote national champions. Percentage of total procurement expenditures locally sourced1\n\nAramco aims to strengthen its supply chain through its localization efforts and uses the Kingdom’s Shareek program, which provides a 67.0 2024 framework to incentivize in-Kingdom investments. As part of this strategy, Aramco seeks to increase the use of in-Kingdom suppliers 65.0 2023\nof goods and services to 70.0% through its iktva program by the end 70.0\nof 2025. % 63.0 2022\nTarget 2025 Through its Namaat industrial investment program, Aramco intends to drive continued growth and development of a resilient and 59.0 2021 sustainable domestic', 'progression from entry- sustainably manage, and restore natural and modified\nfor all of its people. The Company believes it has one of level to leadership roles. These efforts are driven by a 2023 8,566 ecosystems. Aramco planted 6.5 million mangrove\nthe world’s largest corporate-supported education clear vision and include not only developmental 2022 142,885 trees in-Kingdom in 2023, bringing its cumulative\nprograms, with offerings covering all segments of the opportunities, but also policy enhancements and total to over 30 million. The third-party validated total workforce, and includes pre-employment, secondary, mentorship programs. As a result of these initiatives, 2021 14,447 carbon stock of the planted and existing mangroves is\ntertiary, post-graduate, and technical/vocational in 2023 the number of female employees increased 2020 134 equal to nearly 445,000 tons of CO2e.\ntraining. by 12.5% and the number of females in leadership 2019 38\npositions increased by 26.3% compared to the Diversity and inclusion previous year.\nAramco is committed to fostering a culture of diversity 1. Freshwater consumption data for 2019 and 2020 applies to the Saudi Arabian Oil Company (the Company).\nand inclusion (D&I) at all levels of its organization. Freshwater consumption data from 2021 to 2023 reflects the expanded boundary which includes the Saudi Arabian Oil Company in-Kingdom wholly-owned operated assets, SASREF, Motiva, and ARLANXEO.\n2. The 2023 figure for freshwater consumption has undergone ISAE3000 (revised) limited assurance.\nAssurance results will be published on the Aramco website in Q2 2024. Prior year figures have\n2023 2022 2021 2020 2019 undergone external limited assurance and can be viewed online at\nCompany employees6 73,311 70,496 68,493 66,800 69,867 https://www.aramco.com/en/sustainability/sustainability-report.\n3. Applies to the Saudi Arabian Oil Company in-Kingdom wholly-owned operated assets, SASREF, Motiva,\nFemale employees6 (%) 7.2 6.4 5.6 5.1 4.9 and ARLANXEO.\n4. Oil spill incidents with volume greater than one barrel.\nFemale employees in 5. The 2023 figure for volume of hydrocarbon spills has undergone ISAE3000 (revised) limited assurance.\nleadership positions6 (%) 4.8 3.8 3.1 2.7 2.1 Assurance results will be published on the Aramco website in Q2 2024. Prior year figures\nhave undergone external limited assurance and can be viewed online at 6. Applies to the Saudi Arabian Oil Company (the Company). https://www.aramco.com/en/sustainability/sustainability-report.\nFemale employees in\nleadership positions6 (%) | 4.8 | | | | 2.1\n\n6. ADDITIONAL FINANCIAL 7. CONSOLIDATED\n\nAND STRATEGY PERFORMANCE 3. SUSTAINABILITY 4. RISK GOVERNANCE INFORMATION STATEMENTS Four areas of focus continued Growing societal value From its first oil discovery in 1933, Aramco has sought Aramco’s National Champions program encompasses to create sustainable opportunities for the welfare of a set of unique programs focused around five the Kingdom and the global communities where it strategic domains – sustainability, digital, industrial, operates. Citizenship, and contributing to growing manufacturing, and social innovation – that drive societal value, is a firmly established principle toward development from an initial idea to a small- and which Aramco dedicates resources and capabilities. medium-enterprise through to global businesses, In line with relevant UN SDGs and Saudi Vision 2030, and aligns with the Kingdom’s Vision 2030 and its\nAramco seeks to support local content and develop Shareek Private Sector Partnership Reinforcement innovative opportunities for the future. Program (Shareek).\nAramco believes its commitment and investment in The Company’s iktva program is an ongoing success.\ntraining, skills development, and nurturing of Through the program, the local component of the in-Kingdom partnerships has contributed to the Company’s overall expenditure across its supply chain\ndevelopment of the labor force in Saudi Arabia, now stands at 65.0%, with a target to grow to 70.0%\nwhile adding robustness to the Company’s supply by 2025. Billions of dollars in economic activity that chain through localization. historically would have left the Kingdom instead remained to serve the interests of the Company Aramco supports the development of new industries and support the local economy. In 2023, Aramco\nin the Kingdom under its Namaat industrial entered into 86 corporate', 'effectively mitigated to water-efficient practices, maximizing support in-Kingdom wholly-owned operated eliminate environmental impacts.\nwastewater reuse, and minimizing water assets that are located in a water-stressed losses at operating facilities and region, with the remaining freshwater communities. consumed by out of Kingdom wholly-owned operated assets.\nAramco produces wastewater and recognizes the need to responsibly manage Spills to the environment and treat wastewater prior to returning it to Aramco operates across a vast geographic the environment. Its approach to wastewater area with many remote sites. This introduces management is governed by relevant challenges to early detection of potential national and international frameworks or spills, particularly across the Kingdom’s standards, including Saudi Arabian Executive enormous deserts. To meet its target of zero Regulations for the Protection of Aqueous spills, Aramco employs rigorous inspection Media from Pollution, Royal Commission programs to assess the integrity of assets, Environmental Regulations, and Ipieca’s oil putting fail-safe measures in place, training and gas industry guidance on voluntary employees, and utilizing advanced sustainability reporting – discharges to technologies to predict possible failures water. for rapid decision making and action.\nFreshwater consumption1,2 Number of hydrocarbon spills3,4,5 Volume of hydrocarbon spills3,5 (million cubic meters) (barrels)\n\n94.6 93.6 142,885\n89.9\n\n83.0\n78.5 12 12\n\n14,447\n[•] 8,566 34 149\n2021 2022 2023 2024 2025 2021 2022 2023 2024 2025 2021 2022 2023 2024 2025\n1. The 2025 figure applies to the Saudi Arabian Oil Company and its operationally controlled entities. Figures from 2021 to 2024 apply to the Saudi Arabian Oil Company and its operationally controlled entities, excluding ATC, ASC, AOC, and SAAC.\n2. The 2025 figure for freshwater consumption has undergone ISAE3000 (revised) limited assurance. Assurance results will be published on the Aramco website in Q2 2026. Figures from 2022 to 2024 have also undergone external limited assurance\nwhich can be viewed online at www.aramco.com/en/sustainability/sustainability-report.\n3. Applies to the Saudi Arabian Oil Company and its operationally controlled entities.\n4. Oil spill incidents with volume greater than one barrel.\n5. The 2025 figures for the number of hydrocarbon spills and the volume of hydrocarbon spills have undergone ISAE3000 (revised) limited assurance. Assurance results will be published on the Aramco website in Q2 2026. The volume of\nhydrocarbon spills figure for 2022 to 2024 have also undergone external limited assurance and can be viewed online at www.aramco.com/en/sustainability/sustainability-report.\n\nFour focus areas continued Growing societal value From the signing of the crude oil Concession that aligns with national development goals entities in Saudi Arabia to receive accreditation agreement in 1933, Aramco has sought to and community needs. under the National Volunteerism Standards for create more sustainable opportunities for the the Private Sector, affirming its leadership in In 2025, Aramco continued to drive change\nwelfare of the Kingdom and the global structured, high-impact volunteering.\nthrough various citizenship initiatives with a communities where it operates. Citizenship, focus on education, healthcare, and community During Ramadan, employees supported the and contributing to growing societal value, is resilience. From modernizing schools to Blue Box Campaign, distributing 19,300 food a firmly established principle toward which launching cutting-edge training centers, boxes and contributing 9,200 volunteer hours\nAramco dedicates resources and capabilities.\nAramco’s efforts have helped thousands and through partnerships with 61 charities, Informed by Saudi Vision 2030 and relevant advanced inclusive growth in alignment with benefiting more than 96,500 individuals.\nUN SDGs, Aramco seeks to support local Saudi Vision 2030. Aramco’s ongoing support for community-led content and develop innovative opportunities initiatives reflects its broader commitment to for the future. Education and training inclusive development, social cohesion, and Across the globe, Aramco expanded its iktva creating sustainable value for all stakeholders.\nreach through transformative projects in over Aramco’s iktva program continues to serve as a cornerstone of supply chain localization and innovators through STEM competitions like known as Ithra, is Aramco’s flagship citizenship in-Kingdom value creation. Through sustained the World Robot Olympiad and FIRST initiative. Ithra’s volunteering program stands investment in training, skills development, and Championship, to advancing sustainability as a testament to the power of giving, strategic partnerships, the program strengthens through coral reef restoration, solar-powered leadership, and community spirit, with the national capabilities while enhancing the clinics, and youth-led environmental programs, total number of hours volunteered exceeding resilience of the', 'as a service opportunities, aims to de-risk its businesses and offering to third parties, and is seeking investments in maintain competitiveness and differentiation in renewables that align with its other lower-carbon carbon-constrained scenarios and, at the same time, initiatives. To support this strategy, the Company has People to build a material and profitable new business area established a New Energies organization to group for the longer term. together its low-carbon businesses, focused on Aramco recognizes the need to prepare its workforce of the future and seeks to ensure its The strategy has two main aspects. The first is to renewable power generation, lower-carbon capabilities match its strategic requirements by:\nlower the net carbon emissions of the Company’s hydrogen, and carbon capture and storage (CCS).\noperations over time with the ambition to achieve The Company has ambitions to capture and store up • Advancing technical and professional skills, developing commercial and leadership competencies, net-zero Scope 1 and Scope 2 greenhouse gas to 11 million tons of CO2 annually from Aramco and supporting the progress of localization; and, emissions across wholly-owned operated assets facilities, plus additional CO2 from other industrial • Focusing on diversity and inclusion.\nby 2050. The second is to develop and invest in sources, by 2035, and invest in up to 12 gigawatts of\nrenewables power generation and lower-carbon solar PV and wind projects by 2030.\nproducts and solutions across the energy, chemicals, Aramco aims to grow its business sustainably by and materials industries. leveraging technology and innovation to lower its Technology Lowering the Company’s own net carbon emissions climate impact. The Company intends to maintain its requires managing, reducing, and balancing carbon position amongst the leaders in upstream carbon Aramco’s technology program aims to develop new solutions for its Upstream and Downstream emissions across its operations through a number of intensity, with one of the lowest carbon emissions per businesses, help diversify its product portfolio, and grow its business sustainably and achieve its measures, including efficiency gains, renewable unit of hydrocarbons produced. net-zero ambition. The program also aims to enable Aramco to grow its business competitively and power investment, carbon capture, utilization, and sustainably in new areas such as new energies, advanced materials, and digital solutions. Aramco storage, and multiple offset initiatives. focuses its technology initiatives in upstream, downstream, and sustainability, and recognizes the importance of embedding technology in its strategy and business culture.\nBy developing and investing in renewable power Strategy in action generation and lower-carbon products and solutions, Aramco has increased the venture capital (VC) funding available to Aramco Ventures by SAR 15.0 billion Aramco aims to both support its efforts to Aramco has ambitions to capture and store up to ($4.0 billion), making it one of the top corporate venture capital funds in the world and more than\ndecarbonize its own operations, while building a doubling the total funding available to its VC programs to SAR 28.1 billion ($7.5 billion), including\n\nhydrogen and ammonia, lower-carbon fuels, and gas, digital domains.\n\ntransport and industrial applications, and develop diversification opportunities.\nExamples of the new solutions that Aramco believes will positively impact its business sustainability, Localization and national champions and which are being actively pursued, include:\n• Directly converting liquids to chemicals;\nIn addition to Aramco’s core businesses, the Company The objectives are two-fold: to localize the Company’s seeks to foster new businesses that will increase the supply chain, and promote national champions. • Producing hydrogen from hydrocarbons while capturing and storing associated emissions;\nlong-term reliability and competitiveness of the • Expanding nonmetallic applications;\nAramco aims to strengthen its supply chain through Company’s ecosystem, as well as contributing to the its localization efforts and utilizes the Kingdom’s • Accelerating large-scale deployment of carbon capture, utilization, and storage;\nKingdom’s economic development. This is key to Shareek program, which provides a framework to • Enabling sustainable transport through more efficient engines and lower-carbon fuels; and, ensuring Aramco’s long-term cost and productivity leadership, sustainability, and resilience. incentivize in-Kingdom investments. As part of this • Accelerating technology-based offsetting solutions, such as direct air capture.\nstrategy, Aramco seeks to increase the use of in- Kingdom suppliers of goods and services to 70.0% Strategy in action through its in-Kingdom Total Value Add (iktva)\nprogram. Portfolio optimization Aramco is helping to build a world class local supply chain through its iktva program. Through its Namaat industrial investment program, Aramco intends to drive continued growth and Through portfolio optimization, Aramco seeks to unlock value, enhance its capital structure and Percentage of total procurement expenditures locally sourced1 development of a resilient and sustainable reallocate capital to higher growth and higher return investments. Aramco has a comprehensive and domestic supply chain to strengthen and', 'Aramco’s iktva program continues to serve as a cornerstone of supply chain localization and innovators through STEM competitions like known as Ithra, is Aramco’s flagship citizenship in-Kingdom value creation. Through sustained the World Robot Olympiad and FIRST initiative. Ithra’s volunteering program stands investment in training, skills development, and Championship, to advancing sustainability as a testament to the power of giving, strategic partnerships, the program strengthens through coral reef restoration, solar-powered leadership, and community spirit, with the national capabilities while enhancing the clinics, and youth-led environmental programs, total number of hours volunteered exceeding resilience of the Company’s supply chain.\nAramco’s global citizenship initiatives are one million in 2025. This million-hour In 2025, Aramco achieved its iktva milestone of shaping a more equitable and sustainable milestone demonstrates a strong commitment\n70% local content and set a new target of 75% future, wherever it operates. to national development, with each hour of\nby 2030. This ambition reinforces supply chain service contributing to the Kingdom’s progress Aramco continues to invest in education and resilience, drives industrial growth, and ensures and future growth.\nvocational training to empower Saudi youth that greater economic value is retained within and build a competitive national workforce. In the Kingdom. In the same year, Aramco entered\n2025, the Company supported 160 schools\ninto over 140 corporate purchase agreements across the Kingdom, including modernizing\nwith an estimated value of ﷼ 60.0 billion ($16.0\naging facilities and delivering programs that billion), further advancing long-term enhance student readiness in health, localization and industrial development.\nsustainability, and STEM fields.\nCommunity and society Through the National Training Centers (NTC)\nSince its inception more than 90 years ago, initiative, over 7,400 participants enrolled in\nAramco has been instrumental in the core programs, while over 11,000 joined Kingdom’s progress. From the 1930s\nshort-term programs to meet immediate through the 1970s, the Company focused market needs. To date, over 85,000 students\non establishing infrastructure and driving have been trained by the NTCs in more than industrial expansion to support commercial\n100 disciplines, with over 10% of students\ngrowth. Over the years, Aramco has iktva1,2 being female. This initiative reflects Aramco’s increasingly engaged in voluntary citizenship (%)\ncommitment to fostering lifelong learning, initiatives, aligning with the Kingdom’s vision of supporting Saudi Vision 2030 and ensuring a fostering a knowledge-driven society.\nsustainable pipeline of skilled talent for the Citizenship initiatives Kingdom’s evolving economy. 70.0 67.0\nAramco’s Corporate Donation Program is 65.0\ndedicated to enhancing the social and economic Volunteering 59.0 63.0\nAramco remains committed to fostering a wellbeing of communities across Saudi Arabia.\nculture of volunteerism that delivers meaningful In 2025, the program directed support toward impact across its global operations. In 2025, the\neducation, healthcare, and social initiatives.\nCompany contributed over 55,000 volunteer Over 7,600 individuals benefited from\nhours with efforts spanning education, educational programs that provide access to environmental sustainability, community quality learning and skill development. In development, and youth empowerment.\nhealthcare, critical support including medical During the year, Aramco launched the equipment and specialized programs were Professional Volunteer Program through which provided for people with disabilities. Social employees provided technical expertise in IT, [•] initiatives focused on home renovations for safety, and finance to more than 80 nonprofit families affected by natural disasters and 2021 2022 2023 2024 2025 organizations, enhancing their capacity and support for specialized centers serving people effectiveness. The Company was also with disabilities. Through strategic partnerships, recognized as one of the first 10 private sector 1. Percentage of total procurement expenditures locally sourced.\nAramco ensures long-term, meaningful impact 2. Applies to the Saudi Arabian Oil Company (the Company).\n\nRisk management Managing risk exposure Risk objectives (i) Leadership, direction, and oversight with Prevention, Environmental Protection, Aramco operates in an industry characterized respect to the Company’s risk appetite, risk Information Security, Corporate Emergency by market volatility, hazardous operations, tolerance, risk framework, and risk strategy; Management and Continuity, Corporate and uncertain project outcomes. Taking Compliance, and Financial Risk Management (ii) Governance and management of informed risks is an inherent and necessary organizations, as well as the Group Risk strategic, operational, sustainability, and part of doing business. Aramco manages its Management function. Internal Audit, as the ESG related risks; and, strategic, operational, compliance, and third line, provides management and the financial risks by continuously assessing (iii) Fostering a culture within the Company Audit Committee with independent them and undertaking appropriate that emphasizes and demonstrates the assurance on', 'successfully its operations.\nthat would see Aramco acquire a concluded the first edition of Design in Digital and innovation significant minority stake in HUMAIN, a Saudi with AI (DISAI), an AI accelerator Quantum computing deployment PIF company, with PIF retaining majority program. DISAI is an open innovation In 2025, Aramco and Pasqal achieved a ownership. The proposed plan would initiative designed to encourage national significant technological milestone with unify certain AI assets, capabilities, and startups to address real-world industrial the successful deployment of the Middle talent from Aramco and PIF to enable the challenges using AI. Through the East’s first quantum computer dedicated rapid scaling up of HUMAIN’s operations program, six startups successfully to industrial applications. Powered by to capture value and accelerate its growth developed cutting-edge AI solutions to neutral atom technology and hosted at in the AI sector. HUMAIN provides a address key industrial challenges which Aramco’s data center in Dhahran, the range of AI products and services, will be promoted for adoption both deployment represents a breakthrough including next-generation data centers, within Aramco and externally.\nfor the region’s technology landscape and cloud capabilities, and advanced AI AI computing leap supports the acceleration of quantum models and solutions. The non-binding In 2025, Aramco took a major leap applications across the energy, materials, term sheet is subject to the signing of forward in its AI journey by significantly and industrial sectors.\ndefinitive agreements, applicable boosting its AI dense half-precision regulatory approvals, and other computing capacity to reach over 570 customary conditions.\nPetaFLOPs, a remarkable 10-fold increase from the previous year. This milestone solidifies Aramco’s leadership in the energy sector’s digital transformation, enabling the Company to drive Upstream Innovation Center, Dhahran, Saudi Arabia\n\nAramco overview Results and Sustainability Risk Organizational structure Additional financial Consolidated and strategy performance and corporate governance and legal information financial statements Highlights and developments New transport technologies Low Earth Orbit satellites Crude-to-chemicals development Aramco and its JV partners in HORSE Aramco further expanded its satellite In October, Aramco signed a Joint Powertrain agreed on four new capabilities by utilizing Low Earth Orbit Development Agreement with Honeywell collaborative projects to foster innovation satellites, a new generation of low and the KAUST to co-develop a cutting- in lower-emission propulsion technologies orbiting satellites that can send large edge, direct crude-to-chemicals and advanced fuel solutions. This joint volumes of data in a shorter period technology. This collaborative effort aims development with HORSE Powertrain compared to traditional Geostationary to optimize the crude-to-chemicals provides Aramco an avenue for deploying Orbit satellites. The Company has conversion process, reducing both capital its new transport technologies, including continually expanded its satellite and operating expenses. The new engine and after-treatment optimization, communication capacity to include more technology is designed to optimize the advanced fuel formulations, and onboard offshore platforms and remote drilling value of each barrel of crude oil by carbon capture. and exploration sites that have no means directly converting it into high-demand of guaranteed connectivity except chemicals such as light olefins.\nFlow battery deployment through space.\nAramco successfully commissioned a one megawatt-hour iron vanadium flow Aramco-BYD innovation battery system to power gas production In April, Aramco signed a Joint activities in Wa’ad Al-Shamal, Saudi Development Agreement with BYD, a Arabia, marking the first deployment of leading new energy vehicle and power this type of battery system for gas well battery manufacturer, to drive innovation operations. The flow battery offers a in new energy vehicle technologies. The robust alternative to existing solar energy agreement aims to develop cutting-edge solutions and can handle variable power solutions that enhance efficiency and demands efficiently and cost effectively. environmental performance, leveraging the combined R&D expertise of both companies to achieve breakthroughs in the field.\nIron vanadium mixed acid flow battery, Wa’ad Al-Shamal, Saudi Arabia\n\nAramco’s approach Commitment to act responsibly The GEC approves major sustainability Sustainability is embedded within Aramco’s strategy initiatives and targets, while the GSC reviews and underpins how it engages with its people, its partners and approves functional strategies including those related to HR, technology, and and suppliers, its host communities, and the planet, while sustainability. The GHSSEC establishes the delivering value to shareholders. Company’s health, safety, security, and environmental policies and reviews key issues. This includes Company-wide safety The long-term sustainability of the business Sustainability governance initiatives, environmental and safety is driven by the Company’s ability to Aramco’s governance model aligns its performance, compliance and conformance leverage its competitive position while sustainability aspirations with its corporate reviews, major HSSE incidents, insurance reducing its GHG emissions, within the business strategy and goals. The Board of survey results, and cybersecurity.\ncontext that the world needs a realistic Directors is responsible for the Company’s At a management level, the Sustainability energy transition plan that emphasizes the', 'with cumulative crude oil production reaching 5 billion barrels. And by 1971, average daily production of crude oil had ramped up to 4.49 million barrels, which was roughly 1.6 billion barrels per year.\nMaking a name for ourselves\nThroughout the 1970s, we not only proved ourselves as an economic force for Saudi Arabia, but we also returned to our Saudi Arabian heritage. In 1973, the Saudi government bought a 25% interest in Aramco, increasing that interest to 60% the following year.\nAnd in 1980, the Saudi government increased its interest in Aramco to 100%. Eight years later, the Saudi Arabian Oil Company (Saudi Aramco) was officially established — a new company to take over all the responsibilities of Aramco, with His Excellency Ali I. Al-Naimi becoming our first Saudi Company President in 1984, and the first Saudi President and CEO in 1988.\nThe following year, Saudi Aramco began its transformation from an oil producing and exporting company to an integrated petroleum enterprise , with the formation of Star Enterprises in 1989 — a joint venture with Texaco in the United States. This would evolve to become Motiva, initially a partnership with Texaco and Shell, which in 2017 progressed to Saudi Aramco being the sole owner of North America’s largest single-site crude oil refinery, located at Port Arthur, Texas.\nA truly global company\nThroughout the 1990s, we gradually extended our ties and partnerships across the world and made several international investments — starting with our purchase in 1991 of a 35% interest in the SsangYong Oil Refining Company (renamed S-Oil in 2000) in the Republic of Korea.\nOur expansion continued in 1994, when we acquired a 40% interest in Petron Corporation, then the largest crude oil refiner and marketer in the Philippines. And then in 1996, we made several overseas investments in Europe, purchasing 50% in privately-held Greek refiner Motor Oil (Hellas) Corinth Refineries S.A., and its marketing affiliate, Avinoil Industrial Commercial and Maritime Oil Company, S.A.\nToday, we are represented in the three major\xa0global energy markets of Asia, Europe, and North America.\nInnovation Leading up to the millennium, using advanced techniques to help us discover and extract crude oil became essential. We needed technology on our side.\nIn 1997, we developed POWERS (Parallel Oil-Water-Gas-Reservoir Simulator), a high-resolution reservoir simulator that models and predicts the performance of super-giant reservoirs. POWERS was so successful that it went on to inspire a range of more powerful and precise Aramco simulation software.\nIn 2000, we built the state-of-the-art Research and Development Center (R&DC) in Dhahran, the foundation for a network of research centers across the world working on breakthroughs to increase discovery and recovery, reduce costs and GHG emissions, and enhance safety.\nOur success in world-scale innovation was highlighted when, in 2010, we unveiled our giga-cell reservoir simulation technology, GigaPOWERS — the second generation of POWERS. And then, six years later, TeraPOWERS — the industry’s first trillion cell reservoir simulation.\nTransformation Throughout the early 2000s, to help us achieve our vision of becoming the world’s leading integrated energy and chemicals enterprise, we continued to diversify.\nWith many ways of delivering value from a barrel of oil — including nonmetallic and crude-to-chemicals products — we moved beyond traditional markets and uses for oil and gas. We also invested in new solutions to achieve more efficient production and consumption of our energy products, including programs aimed at enhancing the performance and lowering the emissions of transportation.\nLooking forward, we envision transforming our hydrocarbon resources into multiple new streams of value, while continuing to remain a reliable supplier of lower-carbon energy to the world.\n\nOil concession agreement signed\n\n2020 and Beyond: Sustainability\n\nSOURCE: Careers  | Aramco\nURL: https://www.aramco.com/en/careers\nTYPE: Website Content\n\nCareers For Saudi applicants For international applicants We are Aramco. Our high-performing employees are drawn by the challenging and rewarding professional opportunities we offer, and by the aspiration to make a positive difference through their work. At Aramco we give our people the opportunity to do the work they dreamed of doing, and support them in achieving more than they thought possible.\nPioneers and innovators, scientists and engineers, dreamers and thinkers — our people are our most important asset. They drive us forward, every hour of every day, as we aim to lead the way in responsibly producing reliable energy for the world.\nJoin us to help reshape the global energy landscape and set our world on a path towards a lower-carbon energy future.\nOpportunities for all Jobs in regional offices Explore our world of', ""seeks to support local content and develop Aramco extended the reach of its STEM education initiatives to innovative opportunities for the future. Europe, the Americas, and Asia through programs that aimed to, among others, develop the capability of STEM educators and iktva and national champions enhance access to resources needed to support effective STEM Aramco believes its commitment and investment in training, skills education, including infrastructure and teaching materials, development, and nurturing of in-Kingdom partnerships has involving teachers especially from predominately low-income and contributed to the development of the labor force in Saudi Arabia, underserved school districts and schools in less developed areas.\nwhile adding robustness to the Company’s supply chain through localization. Aramco’s citizenship initiatives in 2024 demonstrated a deep commitment to community engagement and societal development.\nDuring 2024, Aramco continued to play a role in the localization of Key highlights include employee donation campaigns, such as the the supply chain and developing a Saudi-based energy ecosystem.\nBlueBox Campaign and Ramadan Donation Campaign that provided The Company’s iktva program is an ongoing success, and through food, along with social, educational, and medical support to it the local component of the Company’s overall expenditure across underprivileged families. The Company also led impactful micro- its supply chain now stands at 67.0%, with a target to grow to industry projects like the Saudi Coffee Development Center,\n70.0% by the end of 2025. This program retained billions of dollars\nfostering local economic growth. Aramco’s outreach efforts in economic activity within Saudi Arabia, thereby serving the celebrated cultural milestones like the Saudi National Day Company’s interest while supporting the local economy. In 2024, with orphans and people with disabilities, while educational partnerships like the STEM Challenge and World Robotics Olympiad\nestimated value of ﷼ 65.7 billion ($17.5 billion) to strengthen the\nempowered future innovators. Aramco's Energy Access Program local supply chain ecosystem for strategic commodities and enhance distributed over 20,000 cooking stoves, benefiting more than the manufacturing landscape within the Kingdom. In addition, 153,000 people in India. Volunteering activities, such as blood\nAramco signed 145 agreements and Memoranda of Understanding donation campaigns, home renovation projects, and collaborations\nvalued at around ﷼ 33.75 billion ($9.0 billion) at the 2025 iktva\nwith people with disabilities care centers showcased Aramco's Forum and Exhibition. The Company has also launched the Supplier dedication to inclusion and community welfare.\nESG Program, aimed at embedding ESG principles across its supply chain.\niktva1,2\n\n63.0 65.0 67.0\n57.5 59.0\n2020 2021 2022 2023 2024\n1. Percentage of total procurement expenditures locally sourced.\n2. Applies to the Saudi Arabian Oil Company (the Company).\n\n5 . O RGANIZATIONAL 6. A DDITIONAL STRUCTURE AND FINANCIAL 7. C ONSOLIDATED\n\nAND STRATEGY PERFORMANCE 3. SUSTAINABILITY 4. RISK GOVERNANCE INFORMATION STATEMENTS Ithra, Aramco’s flagship citizenship initiative, has grown to be a Aramco also fosters a culture of volunteerism among both leading stakeholder in the Kingdom’s arts and culture sector by employees and community members. In 2024, it introduced a driving engaging and relevant programs for cultural sector unified global volunteer program called “Energy for You” uniting development, innovation, education, and entrepreneurship. Since employees across local and international offices under a shared opening, Ithra has welcomed around five million visitors who have mission and brand. Aramco has also significantly expanded its engaged in thousands of offerings. School visits and special visits, employee volunteer program while facilitating a well-established organized as part of Ithra's community engagement efforts, volunteer program for the public at Ithra. Further reinforcing its continue to enrich children's cultural knowledge, benefiting more efforts on impactful and innovative community service, Aramco,\nthan 120,000 children over the years. In 2024, there was a together with its partners, also offers training and certification for\ncompelling series of programs, exhibitions, performances, volunteer practitioners and leaders in public education with the aim workshops, events, and other various initiatives. These world-class of enhancing the curation of volunteer activities. Additionally, the experiences bring together culture, innovation, and knowledge, Company provides volunteering impact awareness sessions and and are carefully designed to engage diverse communities. curated courses for public education students.\nKing Abdulaziz Center for World Culture (Ithra), Dhahran, Saudi Arabia\n\n5 . O RGANIZATIONAL 6. A DDITIONAL STRUCTURE AND FINANCIAL 7. C ONSOLIDATED\n\nAND STRATEGY PERFORMANCE 3. SUSTAINABILITY 4. RISK GOVERNANCE INFORMATION STATEMENTS Risk management:"", 'achieve its value. This includes providing net-zero ambition. sustainable dividend growth through crude oil price cycles and maintaining a The program also aims to enable strong investment-grade credit rating.\nAramco to grow its business competitively and sustainably in new areas such as new energies, advanced materials, and digital solutions. Growth Both in its traditional oil and gas activities and new businesses.\nPortfolio optimization Aramco seeks to unlock value, enhance its capital structure, and Sustainability reallocate capital to higher growth and return investments. It follows As a core element of Aramco’s a comprehensive and disciplined operational philosophy.\ninternal approval process for capital expenditures, new projects, and debt issuances.\nF or more information see page 25 Aramco seeks to deliver value across | | | | | | | Aramco recognizes the need to prepare its workforce of the future to | | | | four dimensions:\n| | | | | | | ensure its capabilities match its strategic requirements. This includes advancing | | | | | | | | | | | technical and professional skills, developing commercial and leadership | | | | Profitability | | | | | | | competencies, supporting the progress of localization, and focusing on equity | | | | By reinforcing its competitive positions across its upstream and\n\nAramco’s technology program aims to | | | | Resilience Both operational and financial, | | | | | | | develop new solutions for its Upstream | | | | enabling our Board to declare | | | | | | | and Downstream businesses, help diversify its product portfolio, grow its | | | | dividends on a regular basis with a view to building long-term shareholder | | | | | | | business sustainably, and achieve its net-zero ambition. | | | | value. This includes providing sustainable dividend growth through | | | | | | | The program also aims to enable Aramco to grow its business | | | | crude oil price cycles and maintaining a strong investment-grade credit rating.\n| | | | | | | competitively and sustainably in new areas such as new energies, advanced | | | | | | | | | | | materials, and digital solutions. | | | | Growth | | | | | | | | | | | Both in its traditional oil and gas activities and new businesses.\n\n| | | | | | | Aramco seeks to unlock value, enhance its capital structure, and | | | | Sustainability | | | | | | | reallocate capital to higher growth and return investments. It follows | | | | As a core element of Aramco’s\n\ninternal approval process for capital | | | | operational philosophy.\n| | | | | | | expenditures, new projects, and debt issuances. | | | |\n\nStrategy continued Four strategic themes Upstream preeminence Oil by 2035 compared to a 2018 baseline. Through reliable and lower Aramco intends to maintain its position as the world’s largest crude carbon intensity production, Aramco aims to support energy oil company by production volume. Its reserves, operational access and security through the energy transition.\ncapabilities, and spare capacity allow it to increase production in The Company balances production between maturing areas and response to demand.\nnewer production sources, tapping into new reservoirs when Aramco expects global demand for crude oil will continue to increase required to optimize the depletion rate of its fields and maintain for many years to come. Aramco believes there is a need for industry- crude oil production. Aramco’s low-cost position is a result of the wide investment to meet this demand, and that new oil discoveries unique nature of the Kingdom’s geological formations, favorable and developments will be needed to offset the natural decline in onshore and shallow water offshore environments in which its production from currently producing fields. The Company intends to reservoirs are located, synergies from Aramco’s use of its large continue to invest in crude oil exploration and production through oil infrastructure and logistics networks, its low depletion rate price cycles in order to meet this expected global demand growth, operational model, and its scaled application of technology.\nand believes that its low lifting costs, low capital intensity, and lower Aramco seeks to maintain its position as one of the world’s most upstream carbon intensity uniquely position it to benefit from these reliable crude oil suppliers. The Company utilizes term agreements investments and the continued pressure on the oil and gas industry for selling crude oil to major consumers globally, providing supply to reduce the environmental impact of the industry’s operations.\npredictability to customers by standardizing price and delivery terms The Company seeks to preserve its position as one of the world’s to major regional demand centers. Aramco continues to invest in its lowest average upstream carbon intensive crude oil producers. sophisticated and extensive crude oil distribution and dispatch system Aramco’s low per barrel gas flaring rates, low depletion rate to maintain its supply reliability.\noperational model, and a focus on reducing the quantity of produced The Government determines the Kingdom’s maximum level of water contribute to its low average upstream']","Aramco aims to make its purchasing practices ethical and locally beneficial through several key initiatives:

- **Supplier Code of Conduct**: This outlines mandatory policies on environmental, health and safety issues, and fair business practices, ensuring ethical standards in the supply chain.

- **Localization Goals**: Aramco targets 70% of all expenditures in the Kingdom to be locally sourced by the end of 2025, promoting local businesses and contributing to the Saudi economy.

- **Iktva Program**: This program focuses on increasing the local content of the Company’s overall expenditure across its supply chain, which currently stands at 67.0% with a goal to reach 70.0% by 2025.

- **Shareek Program**: This framework incentivizes in-Kingdom investments, further strengthening local suppliers and enhancing the domestic supply chain.

These initiatives collectively support ethical procurement while fostering economic growth within Saudi Arabia (source: context provided).","Aramco uses a Supplier Code of Conduct covering environmental, health and safety, fair trade, ethical sourcing, conflicts of interest, anti-bribery, and compliance standards. It also uses the iktva localization program and aims for 70% of its Kingdom expenditures to be locally sourced over the next three years.",0.8260869565217391,0.9889292461157178,0.8833333333186111,0.5
What risk does Aramco identify around compensation for regulated domestic sales?,"['sanctioning bodies. Laws and regulations result in substantial civil or criminal governing sanctions, trade restrictions, penalties. If Aramco were to be bribery, and corruption are complex and sanctioned in the future, as a result are subject to change. of its transactions with other parties or\n\nRisk Aramco is required to obtain, maintain, and renew governmental licenses, permits, and approvals in order to operate its businesses.\nThe rights granted to Aramco under the the Hydrocarbons Law, GSPR, or with or obtain the required permits and Concession represent Aramco’s licenses, respect to certain other activities approvals or the revocation or termination permits, and approvals necessary to unrelated to hydrocarbons operations. of existing licenses, permits and conduct business in the Kingdom with There can be no assurance that the approvals, may interrupt Aramco’s respect to hydrocarbon operations and relevant authorities will issue any such operations and could have a material related activities. However, Aramco is licenses, permits, or approvals in the time adverse effect on Aramco’s business, required to obtain and renew any license, frame anticipated by Aramco, or at all. financial position, and results of permit, or approval that is required under Any unforeseen failure to renew, maintain operations.\nAramco’s operations are subject to environmental protection, health and safety laws and regulations, and increased concerns regarding the safe use of chemicals and plastics and their potential impact on the environment have resulted in more restrictive regulations and could lead to new regulations.\nAramco’s operations are subject to laws Aramco may also (i) incur significant costs including personal injury claims, may and regulations relating to environmental associated with the investigation, cleanup be filed in the future. Motiva could be protection, health and safety. These laws and restoration of contaminated land, subject to material liabilities relating to and regulations govern, among other water or ecosystems, as well as claims for MTBE claims.\nthings, the generation, storage, handling, damage to property, and (ii) face claims use, disposal and transportation of of death or injury to persons resulting Moreover, concerns regarding chemicals hazardous materials, the emission and from exposure to hazardous materials and plastics, including their safe use and discharge of hazardous materials, or adverse impacts on natural resources potential impact on the environment, groundwater use and contamination, and properties of others resulting from its and how plastics contribute to climate and the health and safety of Aramco’s operations (including potentially from the change, reflect a growing trend in societal employees and the communities in transportation of hazardous substances demands for increasing levels of product which it operates. Compliance with and products, feedstock or chemical safety, less plastic use, environmental these obligations can result in significant pollution). Any such costs or liabilities protection, and recycling. These concerns expenditures. If Aramco fails to comply could have a material adverse effect have led to more restrictive regulations with applicable laws and regulations, it on Aramco’s business, financial position, and could lead to new regulations.\ncould be subject to fines or the partial or and results of operations. In particular, They could also manifest themselves total shutdown of related operations. in the United States, Motiva and other in shareholder proposals, delays or failures Aramco has, from time to time, shut companies in the petroleum refining and in obtaining or retaining regulatory down certain facilities in order to ensure marketing industry historically used MTBE approvals, increased costs related to compliance with applicable laws and as a gasoline additive. Motiva is a party complying with more restrictive regulations. In addition, a stricter to pending lawsuits concerning alleged regulations, delayed product launches, interpretation of existing laws and environmental impacts associated with lack of market acceptance, lower sales regulations, any changes in these laws historic releases of MTBE in the United volumes or discontinuance of chemicals or and regulations, or the enactment of States, many of which involve other plastics products, continued pressure for new laws and regulations may impose petroleum marketers and refiners. more stringent regulatory intervention and new obligations on Aramco or otherwise Plaintiffs in these MTBE lawsuits generally increased litigation. These consequences adversely affect Aramco’s business, seek to spread liability among large could also have an adverse effect on financial position, and results of operations. groups of oil companies and seek Aramco’s business, financial position, substantial damages. Additional lawsuits results of operations, and reputation.\nand claims related to the use of MTBE,\n\nRisk factors continued The mechanism for equalization compensation Aramco receives from the Government in respect of domestic sales of certain hydrocarbons may be changed.\nThe Concession requires Aramco compensation for the difference between mechanism, Aramco receives to meet domestic demand for certain regulated prices and equalization prices in compensation for the difference between hydrocarbons, petroleum products, and respect of such sales. Domestic Prices and Blended Prices in LPGs through domestic production or respect of such sales.\nimports. In addition, pursuant to the Furthermore, in the Kingdom, natural gas Kingdom’s regulatory regime, Aramco prices are regulated by the Government No assurance', 'approvals, or the Aramco is required to However, Aramco is required to obtain and revocation or termination thereof, may interrupt obtain, maintain, and maintain licenses, permits, and approvals required Aramco’s operations, could result in financial and renew Governmental under the Hydrocarbons Law and the Energy other penalties and could have a material adverse licenses, permits, and Supply Law (which superseded the GSPR and effect on Aramco’s business, financial position, and approvals in order to became effective in March 2023). Additionally, results of operations.\noperate its businesses. Aramco is required to have licenses, permits, and approvals necessary to conduct business in jurisdictions in which it operates or sells products and with respect to certain activities unrelated to hydrocarbons operations.\n\nAramco overview Results and Sustainability Risk Organizational structure Additional financial Consolidated and strategy performance and corporate governance and legal information financial statements Aramco’s operations are subject to laws and such costs or liabilities could have a material Environmental regulations relating to environmental protection, adverse effect on Aramco’s business, financial regulations health, and safety. These laws and regulations position, and results of operations. In particular, in govern, among other things, the generation, the United States, Motiva and other companies in Aramco’s operations are storage, handling, use, disposal, and the petroleum refining and marketing industry subject to environmental transportation of hazardous materials, the historically used MTBE as a gasoline additive.\nprotection, health, and safety emission and discharge of hazardous materials, Motiva is a party to pending lawsuits concerning laws and regulations. groundwater use and contamination, and the alleged environmental impacts associated with Increased concerns regarding health and safety of Aramco’s employees and the historic releases of MTBE in the United States, the safe use of various communities in which it operates. Compliance with many of which involve other petroleum marketers materials, including chemicals these obligations can result in significant and refiners. Plaintiffs in these MTBE lawsuits and plastics, and their expenditures. If Aramco fails to comply with generally seek to spread liability among large potential impact on the applicable laws and regulations, it could be subject groups of oil companies and seek substantial environment, have resulted to fines or the partial or total shutdown of related damages. Additional lawsuits and claims related to in more restrictive regulations operations. Aramco has, from time to time, the use of MTBE, including personal-injury claims, and could lead to the shutdown certain facilities in order to ensure may be filed in the future. Motiva could be subject implementation of compliance with applicable laws and regulations. to material liabilities relating to MTBE claims.\nnew regulations.\nThe regulations relating to air quality in the Moreover, concerns regarding chemicals and Kingdom impose stringent limits on emissions from plastics, including their safe use and potential various types of facilities. If Aramco fails to comply impact on the environment, and how plastics with applicable laws and regulations, there is a risk contribute to climate change, reflect a growing that material corrective costs could be required to trend in societal demands for increasing levels of bring Aramco’s facilities into compliance with product safety, less plastic use, environmental these regulations. In addition, a stricter protection, and recycling. These concerns have led interpretation of existing laws and regulations, any to more restrictive regulations and could lead to changes in these laws and regulations or the new regulations. They could also manifest enactment of new laws and regulations may themselves in shareholder proposals, delays, or impose new obligations on Aramco or otherwise failures in obtaining or retaining regulatory adversely affect Aramco’s business, financial approvals, increased costs related to complying position, and results of operations. with more restrictive regulations, delayed product launches, lack of market acceptance, lower sales Aramco may also (i) incur significant costs volumes or discontinuance of chemicals or plastics associated with the investigation, clean up and products, continued pressure for more stringent restoration of contaminated land, water or regulatory intervention, and increased litigation.\necosystems, as well as claims for damage to These consequences could also have an adverse property and (ii) face claims of death or injury to effect on Aramco’s business, financial position, persons resulting from exposure to hazardous results of operations, and reputation.\nmaterials or adverse impacts on natural resources and properties of others resulting from its operations (including potentially from the transportation of hazardous substances and products, feedstock, or chemical pollution). Any\n\nRisk factors continued\nThe Concession requires Aramco to meet domestic Effective September 17, 2019, the Government\nMechanism of demand for hydrocarbons, petroleum products, implemented an equalization mechanism to equalization and LPG through domestic production or imports. compensate Aramco for the revenue it directly In addition, pursuant to the Kingdom’s regulatory forgoes as a result of selling Regulated Gas compensation regime, Aramco is required to sell crude oil and Products in the Kingdom at Domestic Gas Prices to The mechanism for certain refined products to third parties in the ensure Aramco receives a commercial rate of', 'the customer when the title of crude oil and related products passes to the customer, which typically takes place when product is physically transferred into a vessel, pipe or other delivery mechanism.\nRevenue contracts for crude and certain related products provide for provisional pricing at the time of shipment, with final pricing based on the average market price for a particular future period. Revenue on these contracts is recorded based on the estimate of the final price at the time control is transferred to the customer. Any difference between the estimate and the final price is recorded as a change in fair value of the related receivable, as part of revenue, in the Consolidated Statement of Income. Where applicable the transaction price is allocated to the individual performance obligations of a contract based on their relative stand-alone selling prices.\n(z) Other income related to sales The Government compensates the Company through price equalization for revenue directly forgone as a result of the Company’s compliance with local regulations governing domestic sales and distribution of certain liquid products, LPG and other products (Note 2(b)(ii)). This compensation reflected in these consolidated financial statements, is calculated by the Company as the difference between the product’s equalization price and the corresponding domestic regulated price, net of Government fees, in accordance with the implementing regulations issued by the Government in 2017 and 2019.\nThis compensation is recorded as other income related to sales, that is taxable, when the Company has satisfied its performance obligations through transfer of the title to the buyer, which occurs when product is physically transferred. The compensation due from the Government is characterized as a due from the Government (Note 2(o)) current receivable and is recognized initially at fair value and subsequently measured at amortized cost using the effective interest rate method less impairment losses, if any.\nThe implementing regulations allow the Company to offset any amounts due from the Government against payment of taxes, and in the event of insufficiency of tax balances, offsetting may extend against any other amounts due and payable by the Company to the Government.\n(aa) Production royalties Royalties to the Government are calculated based on a progressive scheme applied to crude oil and condensate production. An effective royalty rate is applied to production based on the Company’s official selling prices. The effective royalty rate is determined\nbased on a baseline marginal rate of 15% applied to prices up to $70 per barrel, increasing to 45% applied to prices above $70 per\nbarrel and 80% applied to prices above $100 per barrel (Note 2(b)(i)). All such royalties are accounted for as an expense in the\nConsolidated Statement of Income and are deductible costs for Government income tax calculations.\n(bb) Research and development Development costs that are expected to generate probable future economic benefits are capitalized as intangible assets and amortized over their estimated useful life. During the period of development, the asset is tested for impairment annually. All other research and development costs are recognized in net income as incurred.\n(cc) Dividends Provision is made for the amount of any dividend declared, being appropriately authorized and no longer at the discretion of the Company, on or before the end of the reporting period but not distributed at the end of the reporting period.\n(dd) Earnings per share (i) Basic earnings per share Basic earnings per share is calculated by dividing:\n• the net income attributable to the ordinary shareholder of the Company;\n• by the weighted average number of ordinary shares outstanding during the reporting period, adjusted for bonus elements in ordinary shares issued during the period and excluding treasury shares.\n(ii) Diluted earnings per share Diluted earnings per share adjusts the figures used in the determination of basic earnings per share to take into account:\n• the after income tax effect of interest and other financing costs associated with dilutive potential ordinary shares; and\n• the weighted average number of additional ordinary shares that would have been outstanding assuming the conversion of all dilutive potential ordinary shares.\n\n,13 rebmeceD dedne\n\nstnemetats laicnanfi detadilosno C\n\n3. Financial risk management Saudi Aramco operates internationally but has limited exposure to financial risks. Financial risks include market risk (including foreign currency exchange risk, price risk, and interest rate risk), credit risk, and liquidity risk. Financial risk management is carried out primarily by a central treasury department. The adequacy of financial risk management policies is regularly reviewed with consideration of current activities and market conditions on a consolidated basis. Saudi Aramco uses derivative financial instruments with limited complexity to manage certain risk exposures and does not enter into or trade financial instruments, including derivative financial instruments, for speculative purposes.\n(a) Financial risk factors (i) Market risk 1) Foreign currency exchange risk – The risk that the fair value or future cash flows of a financial instrument will fluctuate due to changes in foreign currency exchange rates.\nSaudi Aramco operates internationally but has limited exposure to financial risk due to changes in foreign currency exchange rates as most significant transactions are denominated in its functional currency (Note 2(w)), are linked to its functional currency or are hedged. Saudi Aramco’s', 'through price equalization for revenue directly forgone as a result of the Company’s compliance with local regulations governing domestic sales and distribution of certain liquid products, LPGs and certain other products.\nThis compensation reflected in these consolidated financial statements, is calculated by the Company as the difference between the product’s equalization price and the corresponding domestic regulated price, net of Government fees, in accordance with the implementing regulations issued by the Government in 2017 and 2019.\nThis compensation is recorded as other income related to sales, that is taxable, when the Company has satisfied its performance obligations through transfer of the title to the buyer, which occurs when product is physically transferred. The compensation due from the Government is characterized as a due from the Government (Note 2(n)) current receivable and is recognized initially at fair value and subsequently measured at amortized cost using the effective interest method less impairment losses, if any.\nThe implementing regulations allow the Company to offset any amounts due from the Government against payment of taxes, and in the event of insufficiency of tax balances, offsetting may extend against any other amounts due and payable by the Company to the Government.\n\n5 . O RGANIZATIONAL 6. A DDITIONAL STRUCTURE AND FINANCIAL 7. CONSOLIDATED\n\nAND STRATEGY PERFORMANCE 3. SUSTAINABILITY 4. RISK GOVERNANCE INFORMATION STATEMENTS All amounts in millions of Saudi Riyals unless otherwise stated 2. Material accounting policy information and significant judgments and estimates continued (z) Production royalties Royalties to the Government are calculated based on a progressive scheme applied to crude oil production. An effective royalty rate is applied to production based on the Company’s official selling prices. The effective royalty rate is determined based on a baseline marginal\nrate of 15% applied to prices up to $70 per barrel, increasing to 45% applied to prices above $70 per barrel and 80% applied to prices\nabove $100 per barrel. All such royalties are accounted for as an expense in the consolidated statement of income based on volumes sold during the year and are deductible costs for the Government income tax calculations.\n(aa) Research and development Development costs that are expected to generate probable future economic benefits are capitalized as intangible assets and amortized over their estimated useful life. During the period of development, the asset is tested for impairment annually. All other research and development costs are recognized in net income as incurred.\n(bb) Dividends Provision is made for the amount of any dividend declared, being appropriately authorized and no longer at the discretion of the Company, on or before the end of the reporting period but not distributed at the end of the reporting period.\n(cc) Earnings per share (i) Basic earnings per share Basic earnings per share is calculated by dividing:\n- the net income attributable to the ordinary shareholders of the Company.\n- b y the weighted average number of ordinary shares outstanding during the reporting period, adjusted for bonus elements in ordinary shares issued during the period and excluding treasury shares.\n(ii) Diluted earnings per share Diluted earnings per share adjusts the figures used in the determination of basic earnings per share to take into account:\n- t he after-income tax effect of interest and other financing costs associated with dilutive potential ordinary shares; and\n- t he weighted average number of additional ordinary shares that would have been outstanding assuming the conversion of all dilutive potential ordinary shares.\n3. Financial risk management Financial risks include market risk (including foreign currency exchange risk, price risk, and interest rate risk), credit risk, and liquidity risk.\nFinancial risk management is carried out primarily by a central treasury department. The adequacy of financial risk management policies is regularly reviewed with consideration of current activities and market conditions on a consolidated basis. Saudi Aramco uses derivative financial instruments with limited complexity to manage certain risk exposures and does not enter into or trade financial instruments, including derivative financial instruments, for speculative purposes.\n(a) Financial risk factors (i) Market risk 1) Foreign currency exchange risk – The risk that the fair value or future cash flows of a financial instrument will fluctuate due to changes in foreign currency exchange rates.\nSaudi Aramco operates internationally but has limited exposure to foreign currency exchange risk as most significant transactions are denominated in its functional currency (Note 2(w)), are linked to its functional currency or are hedged. Saudi Aramco’s limited foreign currency exchange risk arises from future commercial transactions or recognized assets or liabilities denominated in a currency that is not Saudi Aramco’s functional currency. In addition, a substantial amount of costs of Saudi Aramco are denominated in SAR which has been at a fixed rate to USD since 1986. A change in the fixed exchange rate would result in foreign exchange differences being recognized in the consolidated financial statements.\nSaudi Aramco engages in foreign currency hedging activities through the use of currency forward contracts to manage its exposure from significant transactions denominated in a foreign currency. The hedge ratio considers variability in potential outcomes, spot rates, as well as interest rates on a transaction by transaction basis.\nThe notional amounts', 'equalization price and the corresponding domestic regulated price, net of Government fees, in accordance with the implementing regulations issued by the Government in 2017 and 2019.\nThis compensation is recorded as other income related to sales, that is taxable, when the Company has satisfied its performance obligations through transfer of the title to the buyer, which occurs when product is physically transferred. The compensation due from the Government is characterized as a due from the Government (Note 2(o)) current receivable and is recognized initially at fair value and subsequently measured at amortized cost using the effective interest method less impairment losses, if any.\nThe implementing regulations allow the Company to offset any amounts due from the Government against payment of taxes, and in the event of insufficiency of tax balances, offsetting may extend against any other amounts due and payable by the Company to the Government.\n(aa) Production royalties Royalties to the Government are calculated based on a progressive scheme applied to crude oil production. An effective royalty rate is applied to production based on the Company’s official selling prices. The effective royalty rate is determined based on a\nbaseline marginal rate of 15% applied to prices up to $70 per barrel, increasing to 45% applied to prices above $70 per barrel and\n80% applied to prices above $100 per barrel. All such royalties are accounted for as an expense in the consolidated statement of\nincome and are deductible costs for Government income tax calculations.\n(bb) Research and development Development costs that are expected to generate probable future economic benefits are capitalized as intangible assets and amortized over their estimated useful life. During the period of development, the asset is tested for impairment annually.\nAll other research and development costs are recognized in net income as incurred.\n(cc) Dividends Provision is made for the amount of any dividend declared, being appropriately authorized and no longer at the discretion of the Company, on or before the end of the reporting period but not distributed at the end of the reporting period.\n\nNotes to the consolidated financial statements continued All amounts in millions of Saudi Riyals unless otherwise stated 2. Summary of significant accounting policies, judgments and estimates continued (dd) Earnings per share (i) Basic earnings per share Basic earnings per share is calculated by dividing:\n• the net income attributable to the ordinary shareholders of the Company\n• by the weighted average number of ordinary shares outstanding during the reporting period, adjusted for bonus elements in ordinary shares issued during the period and excluding treasury shares.\n(ii) Diluted earnings per share Diluted earnings per share adjusts the figures used in the determination of basic earnings per share to take into account:\n• the after-income tax effect of interest and other financing costs associated with dilutive potential ordinary shares; and\n• the weighted average number of additional ordinary shares that would have been outstanding assuming the conversion of all dilutive potential ordinary shares.\n3. Financial risk management Financial risks include market risk (including foreign currency exchange risk, price risk, and interest rate risk), credit risk, and liquidity risk. Financial risk management is carried out primarily by a central treasury department. The adequacy of financial risk management policies is regularly reviewed with consideration of current activities and market conditions on a consolidated basis.\nSaudi Aramco uses derivative financial instruments with limited complexity to manage certain risk exposures and does not enter into or trade financial instruments, including derivative financial instruments, for speculative purposes.\n(a) Financial risk factors (i) Market risk 1) Foreign currency exchange risk – The risk that the fair value or future cash flows of a financial instrument will fluctuate due to changes in foreign currency exchange rates.\nSaudi Aramco operates internationally but has limited exposure to financial risk due to changes in foreign currency exchange rates as most significant transactions are denominated in its functional currency (Note 2(w)), are linked to its functional currency or are hedged. Saudi Aramco’s limited foreign currency exchange risk arises from future commercial transactions or recognized assets or liabilities denominated in a currency that is not Saudi Aramco’s functional currency. In addition, a substantial amount of costs of Saudi Aramco are denominated in SAR which has been at a fixed rate to USD since 1986. A change in the fixed exchange rate would result in foreign exchange differences being recognized in the consolidated financial statements.\nSaudi Aramco engages in foreign currency hedging activities through the use of currency forward contracts to manage its exposure from significant transactions denominated in a foreign currency. The hedge ratio considers variability in potential outcomes, spot rates, as well as interest rates, and on a transaction by transaction basis, can cover up to 100% of the exposure at inception.\nThe notional amounts of outstanding currency forward contracts designated as hedging instruments are included in Note 30.\n2) Price risk – The risk that the fair value or future cash flows of a financial instrument will fluctuate because of changes in market prices. Price risk primarily stems from investments in securities and commodity trading.\na) Investments in securities Saudi Aramco has limited exposure to price risk with such risk arising from investments in securities carried at fair value.\nSaudi Aramco regularly', '. If Aramco fails to comply with alleged environmental impacts associated with and their potential impact applicable laws and regulations, it could be historic releases of MTBE in the United States, on the environment, have subject to fines or the partial or total shutdown of many of which involve other petroleum marketers resulted in more restrictive related operations. Aramco has, from time to and refiners. Plaintiffs in these MTBE lawsuits regulations and could lead time, shutdown certain facilities in order to ensure generally seek to spread liability among large to the implementation of compliance with applicable laws and regulations. groups of oil companies and seek substantial new regulations. damages. Additional lawsuits and claims related The regulations relating to air quality in the to the use of MTBE, including personal-injury Kingdom impose stringent limits on emissions claims, may be filed in the future. Motiva could be from various types of facilities. The Company has subject to material liabilities relating to MTBE conducted several engagements with the Ministry claims.\nof Energy relating to certain requirements set out under these regulations. Depending on the Moreover, concerns regarding chemicals and outcome of the discussions with the regulator, plastics, including their safe use and potential there is a risk that material corrective costs could impact on the environment, and how plastics be required to bring Aramco’s facilities into contribute to climate change, reflect a growing compliance with these regulations. In addition, trend in societal demands for increasing levels of a stricter interpretation of existing laws and product safety, less plastic use, environmental regulations, any changes in these laws and protection, and recycling. These concerns have regulations or the enactment of new laws and led to more restrictive regulations and could lead regulations may impose new obligations on to new regulations. They could also manifest Aramco or otherwise adversely affect Aramco’s themselves in shareholder proposals, delays, or business, financial position, and results of failures in obtaining or retaining regulatory operations. approvals, increased costs related to complying with more restrictive regulations, delayed product Aramco may also (i) incur significant costs launches, lack of market acceptance, lower sales associated with the investigation, clean up and volumes or discontinuance of chemicals or plastics restoration of contaminated land, water or products, continued pressure for more stringent ecosystems, as well as claims for damage to regulatory intervention, and increased litigation.\nproperty and (ii) face claims of death or injury to These consequences could also have an adverse persons resulting from exposure to hazardous effect on Aramco’s business, financial position, materials or adverse impacts on natural resources results of operations, and reputation.\n\nRisk factors continued The Concession requires Aramco to meet domestic the Council of Ministers. Effective September 17, Mechanism of demand for hydrocarbons, petroleum products, 2019, the Government implemented an\nequalization and LPG through domestic production or imports. equalization mechanism to compensate Aramco In addition, pursuant to the Kingdom’s regulatory for the revenue it directly forgoes as a result of compensation regime, Aramco is required to sell crude oil and selling Regulated Gas Products in the Kingdom at The mechanism for certain refined products to third parties in the Domestic Gas Prices to ensure Aramco receives a equalization compensation Kingdom at the Government’s regulated prices. commercial rate of return on each project. Under Aramco receives from the The regulated prices for these products have this mechanism, Aramco receives compensation Government in respect of historically generated less revenue for Aramco for the difference between Domestic Gas Prices domestic sales of certain than if the same product had been sold for and Blended Prices in respect of such sales.\nhydrocarbons may be export. No assurance can be given that either changed. Pursuant to an equalization mechanism, the equalization mechanism will not be revoked or Government compensates Aramco for the amended on terms less favorable to Aramco than revenue it directly forgoes as a result of selling the existing mechanism. In addition, in the event these products in the Kingdom at regulated that the equalization price is less than the prices. Under this mechanism, Aramco receives regulated price, in the case of liquids, or the compensation for the difference between Blended Price is less than the Domestic Gas Price, regulated prices and equalization prices in respect in the case of natural gas, the difference would be of such sales. due from Aramco to the Government. Any such event could have a material adverse effect on Furthermore, in the Kingdom, natural gas prices Aramco’s earnings, cash flow, financial position, are regulated by the Government and the price and results of operations.\nthat domestic customers pay is traditionally set by\n\n5 . O RGANIZATIONAL 6. A DDITIONAL STRUCTURE AND FINANCIAL 7. C ONSOLIDATED\n\nAND STRATEGY PERFORMANCE 3. SUSTAINABILITY 4. RISK GOVERNANCE INFORMATION STATEMENTS\nRISKS RELATED TO THE KINGDOM\nThe Government determines the Kingdom’s On January 30, 2024, the Government (acting\nGovernment maximum level of crude oil production in the through the Ministry of', 'is taxable, when the Company has satisfied its performance obligations through transfer of the title to the buyer, which occurs when product is physically transferred. The compensation due from the Government is characterized as a due from the Government (Note 2(o)) current receivable and is recognized initially at fair value and subsequently measured at amortized cost using the effective interest method less impairment losses, if any.\nThe implementing regulations allow the Company to offset any amounts due from the Government against payment of taxes, and in the event of insufficiency of tax balances, offsetting may extend against any other amounts due and payable by the Company to the Government.\n(aa) Production royalties Royalties to the Government are calculated based on a progressive scheme applied to crude oil production. An effective royalty rate is applied to production based on the Company’s official selling prices. The effective royalty rate is determined based on a\nbaseline marginal rate of 15% applied to prices up to $70 per barrel, increasing to 45% applied to prices above $70 per barrel and\n80% applied to prices above $100 per barrel. All such royalties are accounted for as an expense in the consolidated statement of\nincome and are deductible costs for Government income tax calculations.\n(bb) Research and development Development costs that are expected to generate probable future economic benefits are capitalized as intangible assets and amortized over their estimated useful life. During the period of development, the asset is tested for impairment annually.\nAll other research and development costs are recognized in net income as incurred.\n(cc) Dividends Provision is made for the amount of any dividend declared, being appropriately authorized and no longer at the discretion of the Company, on or before the end of the reporting period but not distributed at the end of the reporting period.\n\nC ONSOLIDATED\nAll amounts in millions of Saudi Riyals unless otherwise stated\n\n2. Summary of significant accounting policies, judgments and estimates continued (dd) Earnings per share (i) Basic earnings per share Basic earnings per share is calculated by dividing:\n• the net income attributable to the ordinary shareholders of the Company\n• by the weighted average number of ordinary shares outstanding during the reporting period, adjusted for bonus elements in ordinary shares issued during the period and excluding treasury shares.\n(ii) Diluted earnings per share Diluted earnings per share adjusts the figures used in the determination of basic earnings per share to take into account:\n• the after-income tax effect of interest and other financing costs associated with dilutive potential ordinary shares; and\n• the weighted average number of additional ordinary shares that would have been outstanding assuming the conversion of all dilutive potential ordinary shares.\n3. Financial risk management Financial risks include market risk (including foreign currency exchange risk, price risk, and interest rate risk), credit risk, and liquidity risk. Financial risk management is carried out primarily by a central treasury department. The adequacy of financial risk management policies is regularly reviewed with consideration of current activities and market conditions on a consolidated basis.\nSaudi Aramco uses derivative financial instruments with limited complexity to manage certain risk exposures and does not enter into or trade financial instruments, including derivative financial instruments, for speculative purposes.\n(a) Financial risk factors (i) Market risk 1) Foreign currency exchange risk – The risk that the fair value or future cash flows of a financial instrument will fluctuate due to changes in foreign currency exchange rates.\nSaudi Aramco operates internationally but has limited exposure to financial risk due to changes in foreign currency exchange rates as most significant transactions are denominated in its functional currency (Note 2(w)), are linked to its functional currency or are hedged. Saudi Aramco’s limited foreign currency exchange risk arises from future commercial transactions or recognized assets or liabilities denominated in a currency that is not Saudi Aramco’s functional currency. In addition, a substantial amount of costs of Saudi Aramco are denominated in SAR which has been at a fixed rate to USD since 1986. A change in the fixed exchange rate would result in foreign exchange differences being recognized in the consolidated financial statements.\nSaudi Aramco engages in foreign currency hedging activities through the use of currency forward contracts to manage its exposure from significant transactions denominated in a foreign currency. The hedge ratio considers variability in potential outcomes, spot rates, as well as interest rates, and on a transaction by transaction basis, can cover up to 100% of the exposure at inception.\nThe notional amounts of outstanding currency forward contracts designated as hedging instruments are included in Note 30.\n2) Price risk – The risk that the fair value or future cash flows of a financial instrument will fluctuate because of changes in market prices. Price risk primarily stems from investments in securities and commodity trading.\na) Investments in securities Saudi Aramco has limited exposure to price risk with such risk arising from investments in securities carried at fair value.\nSaudi Aramco regularly reviews its positions in investments in securities considering current and expected future economic trends.\nAt December 31, 2022 and 2021, a change in fair value due to a movement of 5% in the price of listed equity', 'Aramco to fair value interest rate risk. Saudi Aramco may enter into interest rate swap agreements as part of its overall strategy to manage the interest rate risk on its debt.\nAt December 31, 2019 and 2018, a change of 1% in market interest rates, with all other variables held constant, would result in a net change\nof SAR 435 and SAR 1,125, respectively, in Saudi Aramco’s income before income taxes as a result of the effect of higher or lower market\ninterest rates.\nThe notional amounts of interest rate swap contracts are included in Note 28.\n\nAll amounts in millions of Saudi Riyals unless otherwise stated consolidated financial statements for the year ended December 31, 2019 29\n3. Financial risk management continued (ii) Credit risk Credit risk is the risk that counterparties might not fulfill their contractual payment obligations towards an entity.\nSaudi Aramco is exposed to credit risk related to its counterparties not performing or honoring their obligations which would result in financial loss. Credit risk arises from credit exposures on trade receivables as well as from cash and cash equivalents, short-term investments, debt securities classified as FVOCI, and derivatives with financial institutions. The maximum exposure to credit risk is the carrying value of these assets.\nSaudi Aramco’s trade receivables arise from a global customer base which limits geographic concentrations of credit risk. Moreover, a credit risk policy is in place to ensure credit limits are extended to creditworthy counterparties and risk mitigation measures are defined and implemented accordingly. Saudi Aramco performs ongoing evaluations of its counterparty’s financial standing and takes additional measures to mitigate credit risk when considered appropriate by means of letter of credits, bank guarantees or parent company guarantees.\nIn addition, the credit policy limits the amount of credit exposure to any individual counterparty based on their credit rating as well as other factors. Moreover, Saudi Aramco’s investment policy limits exposure to credit risk arising from investment activities. The policy requires that cash and cash equivalents and short-term investments be invested with a diversified group of financial institutions with acceptable credit ratings.\nSaudi Aramco ensures that each counterparty is of an acceptable credit quality by relying on quantitative and qualitative measures compiled from\ninternal and third party rating models. At December 31, 2019, all the short-term investments were with financial institutions assigned a long-term\ncredit rating of “BBB” (2018: “BBB+”) or above.\nEmployee home loans (Note 9) and debt securities measured at FVOCI are generally considered to have low credit risk based on history of default and thus the impairment provision recognized during the year based on the general approach allowed by IFRS 9, where applicable, was substantially limited to 12-month expected losses.\nSaudi Aramco applies the simplified approach allowed by IFRS 9 in providing for expected credit losses for trade receivables. The simplified approach uses the lifetime expected loss provision for all trade receivables. Such credit losses have historically been nominal and the loss allowance for trade receivables (Note 12) is not material.\n(iii) Liquidity risk Liquidity risk is the risk that an entity will encounter difficulty in meeting obligations associated with financial liabilities.\nSaudi Aramco’s liquidity risk management includes maintaining sufficient cash and cash equivalents and ensuring the availability of incremental funding through credit facilities (Note 19). Management also monitors and forecasts Saudi Aramco’s liquidity requirements based on current and non-current expected cash flows.\nSaudi Aramco invests surplus cash in current accounts, time deposits, money market deposits, government repurchase agreements and marketable securities, choosing instruments with appropriate maturities or sufficient liquidity to meet forecasted cash flow requirements.\nSaudi Aramco prioritizes security and liquidity over yield.\nNote 19 analyzes Saudi Aramco’s borrowings into relevant maturity groupings based on the balances associated with each contractual maturity date at the end of the reporting period.\n(b) Capital structure management Saudi Aramco seeks to maintain a prudent capital structure, comprised of borrowings and shareholders’ equity, to support its capital investment plans and maintain a sustainable, growing dividend profile. Maintaining sufficient financial flexibility is considered strategically important to mitigate industry cyclicality while also enabling the pursuit of organic and inorganic investment opportunities. Borrowings or dividends will result in an adjustment to Saudi Aramco’s capital structure.\n(c) Casualty loss risk retention Saudi Aramco’s casualty loss risk strategy includes a risk retention and insurance program, including providing coverage to certain joint arrangements and associates limited to Saudi Aramco’s percentage interest in the relevant entity. Current maximum risk retention is SAR 2,490 per loss event (2018: SAR 2,118) and various insurance limits apply, of which the risk retention forms a part. Should a credible loss event occur, the maximum\ninsurance limit above retention is SAR 4,875 (2018: SAR 4,875) per event dependent on the circumstances.\n\nAll amounts in millions of Saudi Riyals unless', 'oil production. An effective royalty rate is applied to production based on the Company’s official selling prices. The effective royalty rate is determined based on a baseline marginal rate of\n15% applied to prices up to $70 per barrel, increasing to 45% applied to prices above $70 per barrel and 80% applied to prices above $100\nper barrel. All such royalties are accounted for as an expense in the consolidated statement of income based on volumes sold during the year and are deductible costs for the Government income tax calculations.\n(aa) Research and development Development costs that are expected to generate probable future economic benefits are capitalized as intangible assets and amortized over their estimated useful life. During the period of development, the asset is tested for impairment annually. All other research and development costs are recognized in net income as incurred.\n(bb) Dividends Provision is made for the amount of any dividend declared, being appropriately authorized and no longer at the discretion of the Company, on or before the end of the reporting period but not distributed at the end of the reporting period.\n(cc) Earnings per share (i) Basic earnings per share Basic earnings per share is calculated by dividing:\n- the net income attributable to the ordinary shareholders of the Company\n- by the weighted average number of ordinary shares outstanding during the reporting period, adjusted for bonus elements in ordinary shares issued during the period and excluding treasury shares.\n(ii) Diluted earnings per share Diluted earnings per share adjusts the figures used in the determination of basic earnings per share to take into account:\n- the after-income tax effect of interest and other financing costs associated with dilutive potential ordinary shares; and\n- the weighted average number of additional ordinary shares that would have been outstanding assuming the conversion of all dilutive potential ordinary shares.\n(dd) Reclassifications Certain comparative amounts for 2024 have been reclassified to conform to the current year presentation.\n3. Financial risk management Financial risks include market risk (including foreign currency exchange risk, price risk, and interest rate risk), credit risk, and liquidity risk.\nFinancial risk management is carried out primarily by a central treasury department. The adequacy of financial risk management policies is regularly reviewed with consideration of current activities and market conditions on a consolidated basis. Saudi Aramco uses derivative financial instruments with limited complexity to manage certain risk exposures and does not enter into or trade financial instruments, including derivative financial instruments, for speculative purposes.\n(a) Financial risk factors (i) Market risk 1) Foreign currency exchange risk – The risk that the fair value or future cash flows of a financial instrument will fluctuate due to changes in foreign currency exchange rates.\nSaudi Aramco operates internationally but has limited exposure to foreign currency exchange risk as most significant transactions are denominated in its functional currency (Note 2(w)), are linked to its functional currency or are hedged. Saudi Aramco’s limited foreign currency exchange risk arises from future commercial transactions or recognized assets or liabilities denominated in a currency that is not Saudi Aramco’s functional currency. In addition, a substantial amount of costs of Saudi Aramco are denominated in SAR which has been at a fixed rate to USD since 1986. A change in the fixed exchange rate would result in foreign exchange differences being recognized in the consolidated financial statements.\nSaudi Aramco engages in foreign currency hedging activities through the use of currency forward contracts to manage its exposure from significant transactions denominated in a foreign currency. The hedge ratio considers variability in potential outcomes, spot rates, as well as interest rates on a transaction-by-transaction basis.\nThe notional amounts of outstanding currency forward contracts designated as hedging instruments are included in Note 30.\n\nNotes to the consolidated financial statements continued All amounts in millions of Saudi Riyals unless otherwise stated 3. Financial risk management continued (a) Financial risk factors continued 2) Price risk – The risk that the fair value or future cash flows of a financial instrument will fluctuate because of changes in market prices.\nPrice risk primarily stems from investments in securities and commodity trading.\na) Investments in securities Saudi Aramco has limited exposure to price risk with such risk mainly arising from investments in securities carried at fair value.\nSaudi Aramco regularly reviews its positions in investments in securities considering current and expected future economic trends.\nAt December 31, 2025 and 2024, a change in fair value due to a movement of 5% in the price of listed equity securities would result in a\nchange in other comprehensive income before income taxes and zakat of ﷼ 685 and ﷼ 622, respectively.\nAt December 31, 2025 and 2024, a change in fair value due to a movement of 5% in the unit price of equities and mutual and hedge funds\nwould result in a change in income before income taxes and zakat of ﷼ 83 and ﷼ 31, respectively.\nb) Commodity derivative contracts Saudi Aramco trades crude, natural gas liquids and various refined and bulk petrochemical products and uses commodity derivatives as a means', 'subsidiaries of Saudi Aramco within a certain time period as a condition of the Government allowing the general corporate tax rate to apply to the Company’s downstream business.\n\n2.10. Risks related to licenses, The rights granted to Saudi Aramco under the assurance that the relevant authorities will permits and approvals Concession represent Saudi Aramco’s licenses, issue any such licenses, permits or approvals in permits, and approvals necessary to conduct the time frame anticipated by Saudi Aramco, business in the Kingdom with respect to or at all. Any failure to renew, maintain or Saudi Aramco is required to obtain, Hydrocarbons operations and related obtain the required permits and approvals, maintain and renew governmental activities. However, Saudi Aramco is required or the revocation or termination of existing licenses, permits and approvals in to obtain and renew any license, permit, licenses, permits and approvals, may interrupt order to operate its businesses.\nor approval that is required under the Saudi Aramco’s operations and could have Hydrocarbons Law, GSPR or with respect a material adverse effect on Saudi Aramco’s to certain other activities unrelated to business, financial position and results Hydrocarbons operations. There can be no of operations.\n2.11. Risks related to Saudi Aramco’s operations are subject to damage to property, and (ii) face claims of environmental protection, extensive laws and regulations relating to death or injury to persons resulting from environmental protection, health and safety. exposure to hazardous materials or adverse health and safety laws and These laws and regulations govern, among impacts on natural resources and properties regulations other things, the generation, storage, of others resulting from its operations handling, use, disposal and transportation (including potentially from the transportation Saudi Aramco’s operations are of hazardous materials, the emission of hazardous substances and products, subject to extensive environmental and discharge of hazardous materials, feedstock or chemical pollution). Any such protection, health and safety laws groundwater use and contamination and costs or liabilities could have a material and regulations. the health and safety of Saudi Aramco’s adverse effect on Saudi Aramco’s business, employees and the communities in which it financial position and results of operations.\noperates. Compliance with these obligations In particular, in the United States, Motiva and can result in significant expenditures. If Saudi other companies in the petroleum refining Aramco fails to comply with applicable laws and marketing industry historically used and regulations, it could be subject to fines MTBE as a gasoline additive. Motiva is a party or the partial or total shut down of related to pending lawsuits concerning alleged operations. Saudi Aramco has, from time to environmental impacts associated with time, shut down certain facilities in order to historic releases of MTBE in the United States, ensure compliance with applicable laws and many of which involve other petroleum regulations. In addition, a stricter interpretation marketers and refiners. Plaintiffs in these of existing laws and regulations, any changes MTBE lawsuits generally seek to spread in these laws and regulations or the liability among large groups of oil companies enactment of new laws and regulations may and seek substantial damages. Additional impose new obligations on Saudi Aramco lawsuits and claims related to the use of or otherwise adversely affect Saudi Aramco’s MTBE, including personal injury claims, may business, financial position and results be filed in the future. Motiva could be subject of operations. to material liabilities relating to MTBE claims.\nSaudi Aramco may also (i) incur significant costs associated with the investigation, clean up and restoration of contaminated land, water or ecosystems, as well as claims for\n\n2.12. Risks related to Exports of crude oil, refined products and In addition, the Kingdom is a party to international trade litigation, petrochemicals by Saudi Aramco or its international trade agreements, such as World affiliates to foreign countries may be affected Trade Organization agreements that include disputes or agreements by litigation, disputes or agreements that lead commitments by the Kingdom with respect to to the imposition of import trade measures, the composition of its laws, regulations and Saudi Aramco may be affected including anti-dumping and countervailing practices that impact international trade. The by international trade litigation, duties, safeguard measures, import licensing Kingdom may become a party to other such disputes or agreements.\nand customs requirements. The possibility and agreements in the future. Compliance by the effect of any such measures will depend on Kingdom with any such commitments may the laws governing the foreign country to directly or indirectly impact Saudi Aramco which the applicable products are being and could cause it to alter its operations exported and applicable international trade in a manner that is costly or otherwise has agreements. Since the majority of Saudi a material adverse effect on its business, Aramco’s products are exported, any such financial position or results of operations.\nmeasures may have a material adverse effect If the Kingdom fails to comply with these on Saudi Aramco’s business, financial position commitments, Saudi Aramco’s business and results of operations. operations could be exposed to scrutiny and its exports to potential remedial']","Aramco identifies the risk that the mechanism for equalization compensation it receives from the Government for domestic sales of certain hydrocarbons may be changed. Specifically, the Government compensates Aramco for the revenue it directly forgone as a result of selling regulated gas products at domestic prices, which historically generated less revenue than if the same products had been sold for export.

Key points include:

- The equalization mechanism compensates for the difference between regulated prices and equalization prices.
- There is no assurance that the equalization mechanism will not be revoked or amended on less favorable terms.
- If the equalization price is less than the regulated price, it could result in a financial obligation for Aramco to the Government.
- Any changes could have a material adverse effect on Aramco’s earnings, cash flow, financial position, and results of operations (source: context provided).","Aramco receives compensation mechanisms for revenue forgone when selling certain products and gas domestically at regulated or domestic prices. The company warns that these mechanisms could be revoked or amended on less favorable terms, which could materially affect earnings, cash flow, financial position, and results.",0.9166666666666666,0.8515583740111593,0.6666666666333333,1.0
