user_input,retrieved_contexts,response,reference,faithfulness,answer_relevancy,context_precision,context_recall
What accounting rules did Aramco say it followed for its mid-year interim financial report?,"['its ordinary shares were listed on the Saudi Exchange. In\nconnection with the IPO, the Government, being the sole owner of the Company’s shares at such time, sold an aggregate of 3.45 billion ordinary shares, or 1.73% of the Company’s share capital.\nOn February 13, 2022, the Government transferred 4% of the Company’s issued shares to the Public Investment Fund (“PIF”), the sovereign\nwealth fund of the Kingdom. Subsequently, the Government announced on April 16, 2023, the transfer of 4% of the Company’s issued shares to\nSaudi Arabian Investment Company (“Sanabil Investments”), a wholly owned company of PIF. The Government remains the Company’s largest shareholder, retaining a 90.19% direct shareholding.\nThe condensed consolidated interim financial report of the Company and its subsidiaries (together “Saudi Aramco”) was approved by the Board of Directors on August 6, 2023.\n2. Basis of preparation and other significant accounting policies\nThe condensed consolidated interim financial report has been prepared in accordance with International Accounting Standard 34 (“IAS 34”),\nInterim Financial Reporting, that is endorsed in the Kingdom, and other standards and pronouncements issued by the Saudi Organization for Chartered and Professional Accountants (“SOCPA”). This condensed consolidated interim financial report is consistent with the accounting policies and methods of computation and presentation set out in Saudi Aramco’s consolidated financial statements for the year ended\nDecember 31, 2022, except for new and amended standards disclosed below.\nThe results for the interim periods are unaudited and include all adjustments necessary for a fair presentation of the results for the periods presented. This condensed consolidated interim financial report should be read in conjunction with the consolidated financial statements and\nrelated notes for the year ended December 31, 2022, which have been prepared in accordance with International Financial Reporting Standards\n(“IFRS”) that are endorsed in the Kingdom, and other standards and pronouncements issued by SOCPA. The consolidated financial statements for the year ended December 31, 2022 are also in compliance with IFRS as issued by the International Accounting Standards Board (“IASB”).\nTranslations from SAR to USD presented as supplementary information in the condensed consolidated statement of income, condensed consolidated statement of comprehensive income, condensed consolidated balance sheet, condensed consolidated statement of changes in\nequity, and condensed consolidated statement of cash flows at June 30, 2023 and December 31, 2022 and for the three-month and six-month\nperiods ended June 30, 2023 and 2022, are for convenience and were calculated at the rate of USD 1.00 = SAR 3.75 representing the exchange\nrate at the balance sheet dates.\nNew or amended standards (i) Saudi Aramco adopted the following IASB pronouncements, as endorsed in the Kingdom, effective for annual periods beginning on or after January 1, 2023:\nAmendment to IAS 12, Income Taxes\nIn May 2023, the IASB issued an amendment to IAS 12, Income Taxes, relating to the International Tax Reform - Pillar Two Model Rules. This\namendment applies to income taxes arising from tax law enacted or substantively enacted to implement the Pillar Two model rules published by the Organisation for Economic Co-operation and Development (“OECD”), including tax law that implements qualified domestic minimum top-up taxes described in those rules. The amendment requires entities to make additional disclosures in their annual financial statements regarding their current tax exposure to pillar two income taxes. Further, as required by the amendment, Saudi Aramco has applied the mandatory temporary exception to neither recognize nor disclose information about deferred tax assets and liabilities related to Pillar Two income taxes.\n\nSaudi Aramco Second quarter and half year interim report 2023 All amounts in millions of Saudi Riyals unless otherwise stated 2. Basis of preparation and other significant accounting policies continued IFRS 17, Insurance Contracts\nIn May 2017, the IASB issued IFRS 17, Insurance Contracts, which introduces a new comprehensive accounting model for insurance contracts, and\nsets out the principles for the recognition, measurement, presentation and disclosure for the issuers of those contracts. The new standard replaces IFRS 4, Insurance Contracts, that was issued in 2005, and allowed insurers to use a range of different accounting treatments for insurance contracts. There is no material impact on the condensed consolidated interim financial report from the adoption of IFRS 17.\nThere are no other amendments or interpretations that are effective for annual periods beginning on or after January 1, 2023 that have a material impact on the condensed consolidated interim financial report.\n(ii) Saudi Aramco has not early adopted any new accounting standards, interpretations or amendments that are issued but not yet effective.\n3. Fair value estimation Fair value is the price that would be received to sell an asset or paid to transfer a liability in an orderly transaction between', 'activities was reduced from the 50% rate applicable to qualified domestic oil and hydrocarbon production companies to the general corporate tax rate of 20% applicable to similar domestic downstream companies under the\nSaudi Arabian Income Tax Law of 2004 and its amendments (the “Tax Law”). The new rate is conditioned on the Company separating its\nDownstream activities under the control of one or more separate wholly owned subsidiaries before December 31, 2024, otherwise, the\nCompany’s Downstream activities will be retroactively taxed at 50%. The Company expects to transfer all its Downstream activities into a separate legal entity or entities within the period specified (Note 8).\nDuring the current quarter, the Tax Law was amended whereby shares held directly or indirectly in listed companies on the Tadawul by taxpayers engaged in oil and hydrocarbon activities are exempt from the application of the corporate income tax. As a result, the Company’s ownership interests in SABIC, Rabigh Refining and Petrochemical Company (“Petro Rabigh”), National Shipping Company of Saudi Arabia (“Bahri”) and Saudi Electricity Company (“SEC”) are now subject to zakat (Note 8).\n(b) New or amended standards (i) Saudi Aramco adopted the following IASB pronouncement, as endorsed in the Kingdom, effective for annual periods beginning on or after January 1, 2020:\nIn September 2019, the IASB amended IAS 39, Financial Instruments: Recognition and Measurement, IFRS 7, Financial Instruments: Disclosures,\nand IFRS 9, Financial Instruments, which modify some specific hedge accounting requirements to provide relief from potential effects of the uncertainty caused by the Interbank Offered Rate (“IBOR”) reform in which the London Interbank Offered Rate (“LIBOR”) interest benchmark will cease after 2021. The amendments also require companies to provide additional information about their hedging relationships that are directly affected by these uncertainties. Additionally, the IASB is considering the potential consequences on financial reporting of replacing an existing benchmark with an alternative. IBOR reforms and expectation of cessation of LIBOR will impact Saudi Aramco’s current risk management strategy and possibly accounting for certain financial instruments used for hedging. Saudi Aramco has recognized the following hedging instruments at fair value (Note 3) which are exposed to the impact of LIBOR with a nominal value of SAR 11,745:\n- Financial Liabilities: SAR 1,061 Saudi Aramco uses financial instruments as part of its risk management strategy to manage exposures arising from variation of interest rates that could affect net income or other comprehensive income and applies hedge accounting to these instruments. Saudi Aramco has certain borrowings where the reference rate is linked to LIBOR. Saudi Aramco is establishing a transition plan that follows a risk management approach to ensure a smooth transition to alternative reference rates. There is no material impact on Saudi Aramco’s condensed consolidated interim financial report from adopting these amendments to IAS 39, IFRS 7, and IFRS 9.\nOther standards and amendments did not have any impact on Saudi Aramco’s accounting policies and did not require retrospective adjustments.\n(ii) Saudi Aramco has not early adopted any new accounting standards, interpretations or amendments that are issued but not yet effective.\n(c) Reclassifications Certain comparative amounts in the Condensed Consolidated Statement of Income for the three-month and six-month periods ended June 30, 2019 have been reclassified to conform to the current period presentation. Such reclassifications did not impact the previously reported\nnet income. These include certain sales of crude oil and related purchases of refined products in the amount of SAR 2,849 and SAR 5,385,\nrespectively, which are presented in the Condensed Consolidated Statement of Income as revenue and purchases, reflecting current trading\narrangements, and producing and manufacturing costs in the amount of SAR 1,625 and SAR 3,196, respectively, which are presented in the\nCondensed Consolidated Statement of Income as purchases.\n(d) Inventories\nDuring the three-month and six-month periods ended June 30, 2020, a portion of the inventory purchased from third parties by certain subsidiaries\nwas written-down to its net realizable value.\n3. Fair value estimation Fair value is the price that would be received to sell an asset or paid to transfer a liability in an orderly transaction between market participants at the measurement date. The fair value measurement is based on the presumption that the transaction to sell the asset or transfer the liability takes place either in the principal market for the asset or liability or, in the absence of a principal market, in the most advantageous market for the asset or liability. Management believes that the fair values of Saudi Aramco’s financial assets and liabilities that are measured and recognized at a mortized cost are not materially differen t from their carrying amounts at the end of the reporting period.\n\nSaudi Arabian Oil Company 17 Second quarter and half year interim report 2020 All', 'PO”) and its ordinary shares were listed on the Saudi Exchange. In\nconnection with the IPO, the Government, being the sole owner of the Company’s shares at such time, sold an aggregate of 3.45 billion ordinary shares, or 1.73% of the Company’s share capital.\nOn February 13, 2022, the Government transferred 4% of the Company’s issued shares to the Public Investment Fund (“PIF”), the sovereign\nwealth fund of the Kingdom. Subsequently, the Government announced on April 16, 2023, the transfer of 4% of the Company’s issued shares to\nSaudi Arabian Investment Company (“Sanabil Investments”), a wholly owned company of PIF. The Government remains the Company’s largest shareholder, retaining a 90.19% direct shareholding.\nThe condensed consolidated interim financial report of the Company and its subsidiaries (together “Saudi Aramco”) was approved by the Board of Directors on November 6, 2023.\n2. Basis of preparation and other significant accounting policies\nThe condensed consolidated interim financial report has been prepared in accordance with International Accounting Standard 34 (“IAS 34”),\nInterim Financial Reporting, that is endorsed in the Kingdom, and other standards and pronouncements issued by the Saudi Organization for Chartered and Professional Accountants (“SOCPA”). This condensed consolidated interim financial report is consistent with the accounting policies and methods of computation and presentation set out in Saudi Aramco’s consolidated financial statements for the year ended\nDecember 31, 2022, except for new and amended standards disclosed below.\nThe results for the interim periods are unaudited and include all adjustments necessary for a fair presentation of the results for the periods presented. This condensed consolidated interim financial report should be read in conjunction with the consolidated financial statements and\nrelated notes for the year ended December 31, 2022, which have been prepared in accordance with International Financial Reporting Standards\n(“IFRS”) that are endorsed in the Kingdom, and other standards and pronouncements issued by SOCPA. The consolidated financial statements for the year ended December 31, 2022 are also in compliance with IFRS as issued by the International Accounting Standards Board (“IASB”).\nTranslations from SAR to USD presented as supplementary information in the condensed consolidated statement of income, condensed consolidated statement of comprehensive income, condensed consolidated balance sheet, condensed consolidated statement of changes in\nequity, and condensed consolidated statement of cash flows at September 30, 2023 and December 31, 2022 and for the three-month and nine-\nmonth periods ended September 30, 2023 and 2022, are for convenience and were calculated at the rate of USD 1.00 = SAR 3.75 representing\nthe exchange rate at the balance sheet dates.\nNew or amended standards (i) Saudi Aramco adopted the following IASB pronouncements, as endorsed in the Kingdom, effective for annual periods beginning on or after January 1, 2023:\nAmendment to IAS 12, Income Taxes\nIn May 2023, the IASB issued an amendment to IAS 12, Income Taxes, relating to the International Tax Reform - Pillar Two Model Rules. This\namendment applies to income taxes arising from tax law enacted or substantively enacted to implement the Pillar Two model rules published by the Organisation for Economic Co-operation and Development (“OECD”), including tax law that implements qualified domestic minimum top-up taxes described in those rules. The amendment requires entities to make additional disclosures in their annual financial statements regarding their current tax exposure to pillar two income taxes. Further, as required by the amendment, Saudi Aramco has applied the mandatory temporary exception to neither recognize nor disclose information about deferred tax assets and liabilities related to Pillar Two income taxes.\n\nSaudi Aramco Third quarter and nine months interim report 2023 All amounts in millions of Saudi Riyals unless otherwise stated 2. Basis of preparation and other significant accounting policies continued IFRS 17, Insurance Contracts\nIn May 2017, the IASB issued IFRS 17, Insurance Contracts, which introduces a new comprehensive accounting model for insurance contracts, and\nsets out the principles for the recognition, measurement, presentation and disclosure for the issuers of those contracts. The new standard replaces IFRS 4, Insurance Contracts, that was issued in 2005, and allowed insurers to use a range of different accounting treatments for insurance contracts. There is no material impact on the condensed consolidated interim financial report from the adoption of IFRS 17.\nThere are no other amendments or interpretations that are effective for annual periods beginning on or after January 1, 2023 that have a material impact on the condensed consolidated interim financial report.\n(ii) Saudi Aramco has not early adopted any new accounting standards, interpretations or amendments that are issued but not yet effective.\n3. Fair value estimation Fair value is the price that would be received to sell an asset or paid to transfer a liability in an orderly', 'amco uses financial instruments as part of its risk management strategy to manage exposures arising from variation of interest rates that could affect net income or other comprehensive income and applies hedge accounting to these instruments. Saudi Aramco has certain borrowings where the reference rate is linked to LIBOR. Saudi Aramco is establishing a transition plan that follows a risk management approach to ensure a smooth transition to alternative reference rates. There is no material impact on Saudi Aramco’s condensed consolidated interim financial report from adopting these amendments to IAS 39, IFRS 7, and IFRS 9.\nOther standards and amendments did not have any impact on Saudi Aramco’s accounting policies and did not require retrospective adjustments.\n(ii) Saudi Aramco has not early adopted any new accounting standards, interpretations or amendments that are issued but not yet effective.\n(c) Reclassifications Certain comparative amounts in the Condensed Consolidated Statement of Income for the three-month period ended March 31, 2019 have been reclassified to conform to the current period presentation. Such reclassifications did not impact the previously reported net income. These include certain sales of crude oil and related purchases of refined products in the amount of SAR 2,536, which are presented in the Condensed\nConsolidated Statement of Income as revenue and purchases, reflecting current trading arrangements, and producing and manufacturing costs in the amount of SAR 1,571 which are presented in the Condensed Consolidated Statement of Income as purchases.\n(d) Inventories A portion of the inventory purchased from third parties by certain subsidiaries was written-down to its net realizable value.\n3. Fair value estimation Fair value is the price that would be received to sell an asset or paid to transfer a liability in an orderly transaction between market participants at the measurement date. The fair value measurement is based on the presumption that the transaction to sell the asset or transfer the liability takes place either in the principal market for the asset or liability or, in the absence of a principal market, in the most advantageous market for the asset or liability. Management believes that the fair values of Saudi Aramco’s financial assets and liabilities that are measured and recognized at amortized cost are not materially different from their carrying amounts at the end of the reporting period.\nThe following table presents Saudi Aramco’s assets and liabilities measured and recognized at fair value at March 31, 2020 and December 31,\n2019, based on the prescribed fair value measurement hierarchy on a recurring basis. Saudi Aramco did not measure any financial assets or\nfinancial liabilities at fair value on a non-recurring basis at March 31, 2020 and December 31, 2019. There were no changes made to any of the\nvaluation techniques and valuation processes applied as of December 31, 2019 and changes in unobservable inputs are not expected to materially impact the fair value.\n\nSaudi Arabian Oil Company | first quarter 2020 18 Condensed Consolidated Interim Financial Report All amounts in millions of Saudi Riyals unless otherwise stated Assets Level 1i Level 2ii Level 3iii Total March 31, 2020:\nInvestments in securities:\nEquity securities at Fair Value Through Other Comprehensive\nIncome (""FVOCI"") 6,583 - 1,239 7,822\nDebt securities at FVOCI 1 4,697 - 4,698\nEquity securities at Fair Value Through Profit Or Loss (""FVPL"") - 857 4,479 5,336\nTrade receivables related to contracts with provisional pricing\narrangements - - 43,420 43,420\n6,584 5,554 49,138 61,276\nOther assets and receivables:\nInterest rate swaps - 11 - 11\nCommodity swaps - 5,081 - 5,081\nCurrency forward contracts - 118 - 118\n- 5,210 - 5,210\nTotal assets 6,584 10,764 49,138 66,486\nDecember 31, 2019:\nInvestments in securities:\nEquity securities at FVOCI 8,246 1,244 9,490\nDebt securities at FVOCI 1 4,563 4,564\n\nEquity securities at FVPL 1,265 4,918 6,183\n\nTrade receivables related to contracts with provisional pricing\narrangements – 75,723 75,723\n8,247 5,828 81,885 95,960\n\nOther assets and receivables:\nInterest rate swaps 13 13\nCommodity swaps 288 288\n\nCurrency forward contracts 30 30\n\n331 331\n\nTotal assets 8,247 6,159 81,885 96,291\n\nLiabilities Level 1i Level 2ii Level 3iii Total March 31, 2020:\nTrade and other payables', '.\n2.Basis of preparation and other significant accounting policies\nThe condensed consolidated interim financial report has been prepared in accordance with International Accounting Standard 34 (“IAS 34”),\nInterim Financial Reporting, that is endorsed in the Kingdom, and other standards and pronouncements issued by the Saudi Organization for Chartered and Professional Accountants (“SOCPA”). This condensed consolidated interim financial report is consistent with the accounting policies and methods of computation and presentation set out in Saudi Aramco’s consolidated financial statements for the year ended December\n31, 2022, except for new and amended standards disclosed below.\nThe results for the interim periods are unaudited and include all adjustments necessary for a fair presentation of the results for the periods presented. This condensed consolidated interim financial report should be read in conjunction with the consolidated financial statements and\nrelated notes for the year ended December 31, 2022, which have been prepared in accordance with International Financial Reporting Standards\n(“IFRS”) that are endorsed in the Kingdom, and other standards and pronouncements issued by SOCPA. The consolidated financial statements for the year ended December 31, 2022 are also in compliance with IFRS as issued by the International Accounting Standards Board (“IASB”).\nTranslations from SAR to USD presented as supplementary information in the condensed consolidated statement of income, condensed consolidated statement of comprehensive income, condensed consolidated balance sheet, condensed consolidated statement of changes in\nequity, and condensed consolidated statement of cash flows at March 31, 2023 and December 31, 2022 and for the three-month periods ended\nMarch 31, 2023 and 2022, are for convenience and were calculated at the rate of USD 1.00 = SAR 3.75 representing the exchange rate at the\nbalance sheet dates.\nNew or amended standards (i) Saudi Aramco adopted the following IASB pronouncement, as endorsed in the Kingdom, effective for annual periods beginning on or after January 1, 2023:\nIFRS 17, Insurance Contracts\nIn May 2017, the IASB issued IFRS 17, Insurance Contracts, which introduces a new comprehensive accounting model for insurance contracts, and\nsets out the principles for the recognition, measurement, presentation and disclosure for the issuers of those contracts. The new standard replaces IFRS 4, Insurance Contracts, that was issued in 2005, and allowed insurers to use a range of different accounting treatments for insurance contracts. There is no material impact on the condensed consolidated interim financial report from the adoption of IFRS 17.\nThere are no other amendments or interpretations that are effective for annual periods beginning on or after January 1, 2023 that have a material impact on the condensed consolidated interim financial report.\n(ii) Saudi Aramco has not early adopted any new accounting standards, interpretations or amendments that are issued but not yet effective.\n\nSaudi Aramco First quarter interim report 2023 All amounts in millions of Saudi Riyals unless otherwise stated 3. Fair value estimation Fair value is the price that would be received to sell an asset or paid to transfer a liability in an orderly transaction between market participants at the measurement date. The fair value measurement is based on the presumption that the transaction to sell the asset or transfer the liability takes place either in the principal market for the asset or liability or, in the absence of a principal market, in the most advantageous market for the asset or liability. Management believes that the fair values of Saudi Aramco’s financial assets and liabilities that are measured and recognized at amortized cost are not materially different from their carrying amounts at the end of the reporting period.\nThe following table presents Saudi Aramco’s assets and liabilities measured and recognized at fair value at March 31, 2023 and December 31, 2022,\nbased on the prescribed fair value measurement hierarchy on a recurring basis. Saudi Aramco did not measure any financial assets or financial\nliabilities at fair value on a non-recurring basis at March 31, 2023 and December 31, 2022. There were no changes made to any of the valuation\ntechniques and valuation processes applied as of December 31, 2022 and changes in unobservable inputs are not expected to materially impact the fair values.\nAssets Level 1i Level 2ii Level 3iii Total March 31, 2023 Investments in securities:\nEquity securities at Fair Value Through Other Comprehensive Income (""FVOCI"") 8,638 34 2,127 10,799\nDebt securities at FVOCI 52 7,853 7,905\nEquity securities at Fair Value Through Profit or Loss (""FVPL"") 525 1,450 6,532 8,507\nDebt securities at FVPL 142 ‑ 142\nTrade receivables related to contracts with provisional pricing arrangements 107,603 107,603\n9,215\n\n9,479 116,262\n\n134', '.45 billion ordinary shares, or 1.73% of the Company’s share capital.\nOn February 13, 2022, the Government transferred 4% of the Company\'s issued shares to the Public Investment Fund (""PIF""), the\nsovereign wealth fund of the Kingdom, followed by another transfer of 4% on April 16, 2023 to Saudi Arabian Investment Company (""Sanabil Investments""), a wholly-owned company of PIF. Further, on March 7, 2024, the Government transferred an additional 8%\nof the Company’s issued shares to PIF’s wholly-owned companies. Furthermore, on June 11, 2024, the Government completed a\nsecondary public offering of the Company’s ordinary shares. In connection with the secondary offering, the Government sold an\naggregate of approximately 1.7 billion shares, representing 0.7% of the Company’s issued shares. This includes 137.6 million ordinary\nshares acquired by the Company from the Government, which have been classified as treasury shares. Following the completion of the secondary offering, the Government remains the Company’s largest shareholder, retaining an 81.48% direct shareholding.\nThe condensed consolidated interim financial report of the Company and its subsidiaries (together “Saudi Aramco”) was approved by the Board of Directors on August 4, 2025.\n2. Basis of preparation and material accounting policy information The condensed consolidated interim financial report has been prepared in accordance with International Accounting Standard 34 (“IAS 34”), Interim Financial Reporting, that is endorsed in the Kingdom, and other standards and pronouncements issued by the\nSaudi Organization for Chartered and Professional Accountants (“SOCPA”). The accounting policies used in the preparation of this condensed consolidated interim financial report are consistent with those set out in Saudi Aramco’s consolidated financial statements\nfor the year ended December 31, 2024.\nThe results for the interim periods are unaudited and include all adjustments necessary for a fair presentation of the results for the periods presented. This condensed consolidated interim financial report should be read in conjunction with the consolidated financial\nstatements and related notes for the year ended December 31, 2024, which have been prepared in accordance with International\nFinancial Reporting Standards (“IFRS”) that are endorsed in the Kingdom, and other standards and pronouncements issued by SOCPA.\nThe consolidated financial statements for the year ended December 31, 2024 are also in compliance with IFRS as issued by the International Accounting Standards Board (“IASB”).\nTranslations from Saudi Riyals (“SAR” or “﷼”) to U.S. dollar (“USD” or “$”) presented as supplementary information in the condensed consolidated statement of income, condensed consolidated statement of comprehensive income, condensed consolidated balance sheet, condensed consolidated statement of changes in equity, and condensed consolidated statement of cash flows at June 30, 2025\nand December 31, 2024 and for the three-month and six-month periods ended June 30, 2025 and 2024, are for convenience and were\ncalculated at the rate of USD 1.00 = SAR 3.75 representing the exchange rate at the balance sheet dates.\nNew or amended standards (i) There are no new standards, amendments or interpretations that are effective for annual periods beginning on or after January 1, 2025 that have a material impact on the condensed consolidated interim financial report.\n(ii) Saudi Aramco has not early adopted any new accounting standards, interpretations or amendments that are issued but not yet effective.\n\nAll amounts in millions of Saudi Riyals unless otherwise stated 3. Fair value estimation Fair value is the price that would be received to sell an asset or paid to transfer a liability in an orderly transaction between market participants at the measurement date. The fair value measurement is based on the presumption that the transaction to sell the asset or transfer the liability takes place either in the principal market for the asset or liability or, in the absence of a principal market, in the most advantageous market for the asset or liability. Management believes that the fair values of Saudi Aramco’s financial assets and liabilities that are measured and recognized at amortized cost are not materially different from their carrying amounts at the end of the reporting period.\nThe following table presents Saudi Aramco’s financial assets and financial liabilities measured and recognized at fair value at June 30, 2025\nand December 31, 2024, based on the prescribed fair value measurement hierarchy on a recurring basis. Saudi Aramco did not measure\nany financial assets or financial liabilities at fair value on a non-recurring basis at June 30, 2025 and December 31, 2024. There were no\nchanges made to any of the valuation techniques and valuation processes applied as of December 31, 2024 and changes in unobservable inputs are not expected to materially impact the fair values.\nAssets Level 1i Level 2ii Level 3iii Total At June 30, 202', 'officially notified the Company of their holdings 11 April 27 Shareholder analysis Company’s control.\nstructure, and the industry in which it operates. In pursuant to Article 85 of the Rules on the Offer of 12 May 7 Shareholder analysis\ninternal training plan in support of the Company’s Investments made or any reserves set up for the Assembly meeting"" shareholders in SAR and to the Government in U.S.\n\nattesting to awareness of, and adherence to, the All amounts in millions SAR 2023 2022 15 May 14 Shareholder analysis and will be distributed in compliance with applicable\nCompany’s ethical and regulatory compliance Pension plans (7,784) (7,481) 16 May 16 Shareholder analysis tax laws.\nstandards. Medical and other 17 May 16 Shareholder analysis In 2022 and 2023, the Company’s base dividend\npost-employment 18 May 18 Dividend distribution payments totaled SAR 281.3 billion ($75.0 billion)\nRisk management benefit plans 9,270 11,370 19 May 18 Shareholder analysis and SAR 292.7 billion ($78.0 billion), respectively.\nThe Board routinely assesses the Company’s risks\nthat could impact its business model and/or future Net benefit liability 1,486 3,889 20 June 7 Shareholder analysis On March 8, 2024, the Company declared a base\nperformance. The Company’s risk management 21 June 7 Shareholder analysis dividend of SAR 76.1 billion ($20.3 billion) for the\nframework and risk factors are outlined in For details regarding investments made or any 22 June 8 Shareholder analysis fourth quarter of 2023.\n\nBoard of Directors declarations statements – Note 21. 24 June 11 Shareholder analysis introduced a mechanism for performance-linked\n\n• The accounting records were properly prepared; preemptive right or similar rights issued or granted 26 June 13 Shareholder analysis to be paid in the amount of 50-70% of the Group\'s\n• The system of internal control is sound in design and On December 11, 2019, the Company acquired 27 June 20 Shareholder analysis annual free cash flow, net of the base dividend and\nhas been effectively implemented; and, 117.2 million ordinary shares from the Government 28 July 9 Shareholder analysis other amounts including external investments1. The\nfor the purposes of issuing them to employees 29 July 16 Shareholder analysis first performance-linked dividends were calculated\n\nstatements – Notes 16 and 17. 31 August 10 Shareholder analysis quarters, commencing in the third quarter of 2023.\nCompany declarations 32 August 10 Shareholder analysis\nSOCPA endorsed IFRS compliant Conversion or subscription rights under any 33 August 10 Shareholder analysis\n\nReporting Standards (IFRS) that are endorsed in the The Company did not issue or grant any conversion 35 September 12 Dividend distribution\nKingdom, and other standards and pronouncements or subscription rights under any convertible debt 36 September 12 Dividend distribution\nissued by the International Accounting Standards Redeemable debt instruments 39 November 16 Dividend distribution\nBoard (IASB).\nDuring 2023, SATORP has redeemed all of its 40 November 16 Dividend distribution\nSenior Executives Saudi Exchange amounting to SAR 1,458 million.\nOther than compensation arrangements, there are no The Company did not redeem, purchase or cancel Company contracts or business with the Company in any redeemable debt instruments.\nwhich Directors, Senior Executives or persons related to them have a personal interest.\n1. For the purpose of calculating performance-linked dividends, external investments include acquisition of affiliates, net of cash acquired, additional investments in joint ventures and associates, and certain amounts recognized in net investment in securities. Please see the consolidated statement of cash flows for more information.\n6. A DDITIONAL FINANCIAL 7. C ONSOLIDATED\n\nAND STRATEGY PERFORMANCE 3. SUSTAINABILITY 4. RISK GOVERNANCE INFORMATION STATEMENTS Governance, risk and compliance continued\nThe first distribution of SAR 37.0 billion ($9.9 billion) Royal Order No. A/42, dated 26/1/1441H (corresponding Punishments and penalties\nwas paid in the third-quarter of 2023 based on the to September 25, 2019) provides that, if the Board The Company is committed to high standards of governance. The Company is not aware of any penalty, full-year results of 2022 and the six-month results for resolved to distribute dividends, and to the extent that precautionary procedure or preventative measure imposed on it by any authority, supervisory, regulatory, or\nthe period ended June 30, 2023. The second the Board determines that the amount of any quarterly judicial body in 2023.\ndistribution of SAR 37.0 billion ($9.9 billion', 'transfer, the Government remains the Company’s largest shareholder, retaining a 94.19% direct shareholding.\nThe condensed consolidated interim financial report of the Company and its subsidiaries (together “Saudi Aramco”) was approved by the Board\nof Directors on October 31, 2022.\n2.Basis of preparation and other significant accounting policies\nThe condensed consolidated interim financial report has been prepared in accordance with International Accounting Standard 34 (“IAS 34”),\nInterim Financial Reporting, that is endorsed in the Kingdom, and other standards and pronouncements issued by the Saudi Organization for Chartered and Professional Accountants (“SOCPA”). This condensed consolidated interim financial report is consistent with the accounting policies and methods of computation and presentation set out in Saudi Aramco’s consolidated financial statements for the year ended\nDecember 31, 2021, except for new and amended standards disclosed below.\nThe results for the interim periods are unaudited and include all adjustments necessary for a fair presentation of the results for the periods presented. This condensed consolidated interim financial report should be read in conjunction with the consolidated financial statements and\nrelated notes for the year ended December 31, 2021, which have been prepared in accordance with International Financial Reporting Standards\n(“IFRS”) that are endorsed in the Kingdom, and other standards and pronouncements issued by SOCPA. The consolidated financial statements for the year ended December 31, 2021 are also in compliance with IFRS as issued by the International Accounting Standards Board (“IASB”).\nTranslations from SAR to USD presented as supplementary information in the Condensed Consolidated Statement of Income, Condensed Consolidated Statement of Comprehensive Income, Condensed Consolidated Balance Sheet, Condensed Consolidated Statement of Changes in\nEquity, and Condensed Consolidated Statement of Cash Flows at September 30, 2022 and December 31, 2021 and for the three-month and\nnine-month periods ended September 30, 2022 and 2021, are for convenience and were calculated at the rate of USD 1.00 = SAR 3.75\nrepresenting the exchange rate at the balance sheet dates.\nNew or amended standards (i) Saudi Aramco adopted the following IASB pronouncement, as endorsed in the Kingdom, effective for annual periods beginning on or after January 1, 2022:\nAmendment to IAS 16, Property, Plant and Equipment\nIn May 2020, the IASB issued an amendment to IAS 16, Property, Plant and Equipment, which prohibits an entity from deducting from the cost of\nan item of property, plant and equipment any proceeds from selling items produced while the entity is preparing the asset for its intended use.\nInstead, the proceeds from selling such items, and the costs of producing those items, are recognized in profit or loss. There is no material impact on the condensed consolidated interim financial report from adopting this amendment to IAS 16.\n(ii) Saudi Aramco has not early adopted any new accounting standards, interpretations or amendments that are issued but not yet effective.\n\nSaudi Aramco Third quarter and nine months interim report 2022 All amounts in millions of Saudi Riyals unless otherwise stated 3. Fair value estimation Fair value is the price that would be received to sell an asset or paid to transfer a liability in an orderly transaction between market participants at the measurement date. The fair value measurement is based on the presumption that the transaction to sell the asset or transfer the liability takes place either in the principal market for the asset or liability or, in the absence of a principal market, in the most advantageous market for the asset or liability. Management believes that the fair values of Saudi Aramco’s financial assets and liabilities that are measured and recognized at amortized cost are not materially different from their carrying amounts at the end of the reporting period.\nThe following table presents Saudi Aramco’s assets and liabilities measured and recognized at fair value at September 30, 2022 and\nDecember 31, 2021, based on the prescribed fair value measurement hierarchy on a recurring basis. Saudi Aramco did not measure any financial\nassets or financial liabilities at fair value on a non-recurring basis at September 30, 2022 and December 31, 2021. There were no changes made to\nany of the valuation techniques and valuation processes applied as of December 31, 2021 and changes in unobservable inputs are not expected to materially impact the fair values.\nAssets Level 1i Level 2ii Level 3iii Total September 30, 2022 Investments in securities:\nEquity securities at Fair Value Through Other Comprehensive Income (""FVOCI"") 9,414 104 1,305 10,823\nDebt securities at FVOCI 40 7,504 7,544\nEquity securities at Fair Value Through Profit or Loss (""FVPL"") 288 1,365 5,592 7,245\nDebt securities at', 'of internal control systems\n\nRisk Principal risk categories Risks related to macroeconomic Risks related to Aramco, environment and external factors its operations and industry Read more Read more\non page 88 on page 91\nLegal and regulatory risks Risks related to the Kingdom Read more Read more\non page 95 on page 99\nManagement-level oversight of the This includes the escalation, as Risk factors ERM framework is provided by the appropriate, of risk ownership through The following risks, which are identified Management Committee, chaired by Aramco’s organizational levels, resulting as material, do not necessarily comprise the President and CEO. He also chairs the in a hierarchy of risks from individual all the risks affecting Aramco. There may HSSE Committee, which oversees health, departmental risks to corporate risks.\nbe additional risks that Aramco is currently safety, security, and environmental risk Annually, the Management Committee not aware of, or that Aramco currently management; the Strategy Council, which reviews the composition of the top risks, believes are immaterial, which may in the reviews matters of strategic risk; and the taking into consideration risks reported future become material or affect Aramco’s Conflicts of Interest and Business Ethics from the businesses and a top-down business, financial position and results of Committee. Various other management- scan for new and emerging risks. The operations, or the market price of the level committees oversee specific Management Committee is updated shares. As a result of these and other risk-related topics, such as the quarterly on individual risks, and every risks, the forward-looking events and Sustainability Steering Committee year several risks are presented in detail circumstances discussed in this Annual and the Information Security Risk to the Management Committee and the Report might not occur in the way Aramco Management Steering Committee. Board’s Risk and HSE Committee.\nexpects, or at all. All forward-looking statements in this Annual Report should be Business risk assessment Decision-making considered in light of these explanations.\nThe process by which individual To reduce planning uncertainty and organizations identify, assess, mitigate, help manage the variability of outcomes, The risks described in this section are monitor and report risks to achieve Aramco has embedded risk assessment not presented in order of priority based business objectives is integrated into into its strategic and investment planning. on their importance or expected effect Aramco’s annual planning cycle through Strategic scenarios are stress-tested, and on Aramco.\na system based on ISO 31000 principles the investment portfolio is optimized and guidelines. using stochastic risk modeling. Individual projects and investments pass through a gated decision process that includes risk assessments and value assurance reviews.\nRisk factors Understanding risks Risks related to macroeconomic environment and external factors Aramco’s results of operations and cash flow are significantly impacted by international crude oil supply and demand, and the price at which it sells crude oil.\nSales of crude oil are the largest • Capital investments of oil and gas International crude oil prices have component of Aramco’s consolidated companies relating to the exploration, fluctuated significantly in the past and revenue and other income related to development and production of crude may remain volatile. Between January\nsales, accounting for 49.1% and 47.0% oil reserves; 2016 and December 2021, Brent prices\nfor the years ended December 31, 2020, generally fluctuated between $40.0 and\n• The impact of climate change on the\nand 2021, respectively. Accordingly, $70.0 per barrel. However, Brent prices\ndemand for, and price of, hydrocarbons Aramco’s operations and cash flow fell below $20.0 per barrel in mid-March (see risk — Climate change concerns results are significantly impacted by 2020 in response to the impact of the and impacts could reduce global the price at which it sells crude oil. COVID-19 pandemic on worldwide\ndemand for hydrocarbons and demand for oil and economic activity, hydrocarbon-based products and International crude oil supply and as well as other supply and demand could cause Aramco to incur costs demand and the sales price for crude factors, and did not recover to above or invest additional capital);\noil are affected by many factors that $60.0 per barrel until February 2021.\nare beyond Aramco’s control, including: • Changes to environmental or other Fluctuations in the price at which Aramco regulations or laws applicable to crude is able to sell crude oil have previously,\n• Markets’ expectations with respect oil and related products or the energy and could in the future, cause Aramco’s to future supply of petroleum and industry (see risk — Aramco’s results of operations and cash flow to vary petroleum products, demand and operations are subject to environmental significantly. In addition, decreases in the price changes; protection, health and safety laws and price at which Aramco is able to sell its\n• Global economic and political conditions regulations, and increased concerns crude oil could have a material adverse and geopolitical events, including any regarding the safe use of chemicals and effect on', 'FRS as issued by the International Accounting Standards Board (“IASB”).\nTranslations from SAR to USD presented as supplementary information in the Condensed Consolidated Statement of Income, Condensed Consolidated Statement of Comprehensive Income, Condensed Consolidated Balance Sheet, Condensed Consolidated Statement of Changes in\nEquity, and Condensed Consolidated Statement of Cash Flows at March 31, 2020 and December 31, 2019 and for the three-month periods ended\nMarch 31, 2020 and 2019, are for convenience and were calculated at the rate of USD 1.00 = SAR 3.75 representing the exchange rate at the\nbalance sheet dates.\nIn response to the novel Coronavirus (COVID-19), which has caused global economic disruption, Saudi Aramco has implemented active prevention programs at its sites and contingent plans to minimize the risk related to COVID-19 and continue its operations. Management has\nconsidered the potential impact of COVID-19 pandemic in the Company’s significant accounting judgements and estimates and there are no changes to the significant judgements and estimates disclosed in the December 31, 2019 consolidated financial statements, other than for those\ndisclosed in this condensed consolidated interim financial report.\n(a) Fiscal regime changes\nOn September 17, 2019, the following significant changes to the fiscal regime under which the Company operates were announced effective\nJanuary 1, 2020:\n(i) The Company and the Government executed an amendment to the Concession Agreement which changed the effective royalty rate applied to crude oil production based on the Company’s official selling prices. The effective royalty rate is determined based on a baseline marginal\nrate of 15% (from 20%) applied to prices up to $70 per barrel, increasing to 45% (from 40%) applied to prices above $70 per barrel and 80%\n(from 50%) applied to prices above $100 per barrel.\n(ii) LPGs and certain other products were added to the price equalization mechanism to compensate the Company for revenue directly foregone as a result of the Company’s compliance with the Government mandates related to domestic sales of those products by the Company.\n(iii) The tax rate applicable to the Company’s Downstream activities was reduced from the 50% rate applicable to qualified domestic oil and hydrocarbon production companies to the general corporate tax rate of 20% applicable to similar domestic downstream companies under the\nSaudi Arabian Income Tax Law of 2004 and its amendments (the “Tax Law”). The new rate is conditioned on the Company separating its\nDownstream activities under the control of one or more separate wholly owned subsidiaries before December 31, 2024, otherwise, the\nCompany’s Downstream activities will be retroactively taxed at 50%. The Company expects to transfer all its Downstream activities into a separate legal entity or entities within the period specified (Note 7).\n\nSaudi Arabian Oil Company | first quarter 2020 17 Condensed Consolidated Interim Financial Report All amounts in millions of Saudi Riyals unless otherwise stated (b) New or amended standards (i) Saudi Aramco adopted the following IASB pronouncement, as endorsed in the Kingdom, effective for annual periods beginning on or after January 1, 2020:\nIn September 2019, the IASB amended IAS 39, Financial Instruments: Recognition and Measurement, IFRS 7, Financial Instruments: Disclosures,\nand IFRS 9, Financial Instruments, which modify some specific hedge accounting requirements to provide relief from potential effects of the uncertainty caused by the Interbank Offered Rate (“IBOR”) reform in which the London Interbank Offered Rate (“LIBOR”) interest benchmark will cease after 2021. The amendments also require companies to provide additional information about their hedging relationships which are directly affected by these uncertainties. Additionally, the IASB is considering the potential consequences on financial reporting of replacing an existing benchmark with an alternative. IBOR reforms and expectation of cessation of LIBOR will impact Saudi Aramco’s current risk management strategy and possibly accounting for certain financial instruments used for hedging. Saudi Aramco has recognized the following hedging instruments at fair value (Note 3) which are exposed to the impact of LIBOR with a nominal value of SAR 12,820:\n- Financial Assets: SAR 11\n- Financial Liabilities: SAR 908 Saudi Aramco uses financial instruments as part of its risk management strategy to manage exposures arising from variation of interest rates that could affect net income or other comprehensive income and applies hedge accounting to these instruments. Saudi Aramco has certain borrowings where the reference rate is linked to LIBOR. Saudi Aramco is establishing a transition plan that follows a risk management approach to ensure a smooth transition to alternative reference rates. There is no material impact on Saudi Aramco’s condensed consolidated interim financial report from adopting these amendments to IAS 39, IFRS 7, and IFRS 9.\nOther standards and amendments did not have any']","Saudi Aramco stated that its condensed consolidated interim financial report was prepared in accordance with International Accounting Standard 34 (""IAS 34""), Interim Financial Reporting, which is endorsed in the Kingdom, as well as other standards and pronouncements issued by the Saudi Organization for Chartered and Professional Accountants (""SOCPA""). This report is consistent with the accounting policies and methods of computation and presentation set out in Saudi Aramco’s consolidated financial statements for the year ended December 31, 2022 (document reference: condensed consolidated interim financial report).","The report was prepared under IAS 34 as endorsed in Saudi Arabia, together with standards and pronouncements issued by SOCPA. It was also intended to be read alongside the 2020 annual consolidated financial statements prepared under IFRS endorsed in the Kingdom.",1.0,0.8017416580641838,0.7116666666524333,0.5
How does Aramco treat contracts that give it control over an asset for a period of time?,"['the cost of of a discovered oil or gas field, both its areal operating the business.\nextent and its vertical hydrocarbon column.\nProved reserves Gross refining capacity Those quantities of liquids and gas, which, The total combined refining capacity of by analysis of geoscience and engineering Saudi Aramco and the joint ventures and other data, can be estimated with reasonable entities in which it owns an equity interest. certainty to be economically producible – from a given date forward, from known Lifting costs reservoirs, and under existing economic Oil and gas operations (i) production related conditions, operating methods and expenses; (ii) taxes other than income taxes government regulations – prior to the time (if applicable); and (iii) production related at which contracts providing the right to general and administrative expenses. Lifting operate expire, unless evidence indicates costs exclude exploration, royalty, R&D and that renewal is reasonably certain, regardless depreciation costs.\nof whether deterministic or probabilistic Liquids methods are used for the estimation. The Crude oil, condensate and NGLs. project to extract the hydrocarbons must have commenced or the operator must be LPG/LPGs reasonably certain that it will commence the Liquefied petroleum gas, which is a mixture project within a reasonable time.\nof saturated and unsaturated hydrocarbons, with up to five carbon atoms, used as Reserves life household fuel. Calculated on a barrel of oil equivalent basis by dividing proved reserves as at a given MSC year-end by production for that year.\nMaximum Sustainable Capacity – the average maximum number of barrels per day of crude Throughput oil that can be produced for one year during The volume of crude oil processed by any future planning period, after taking into a refinery and converted into intermediate account all planned capital expenditures and and finished products.\nmaintenance, repair and operating costs, and after being given three months to make operational adjustments.\nnoitamrofni lagel\n\nlaicnanfi lanoitidda\n\nGlossary Affiliate CMA D&M Except with respect to financial information, The Capital Market Authority, including, DeGolyer & Mac Naughton, Saudi Aramco’s the term Affiliate means a person who where the context permits, any committee, independent petroleum consultant.\ncontrols another person or is controlled by sub-committee, employee or agent to whom Domestic that other person, or who is under common any function of the CMA may be delegated.\nRefers to the Kingdom of Saudi Arabia.\ncontrol with that person by a third person.\nCompanies Law In any of the preceding, control could be Domestic Price The Companies Law, issued under Royal direct or indirect. Certain prices for the domestic sale of gas\nDecree No. M/3, dated 28/1/1437H\nhydrocarbons including those for Regulated With respect to financial information, the (corresponding to November 10, 2015), Gas Products.\nterm Affiliate is defined by IFRS, meaning the as amended.\nCompany’s subsidiaries, joint arrangements Dow Company and associates. Dow Inc.\nSaudi Arabian Oil Company.\nAPI Energy intensity Concession The American Petroleum Institute, which An index for measuring the total energy As defined in Section 8: Additional is the major United States trade association consumed to generate a unit of product, Information – Material Agreements – for the oil and gas industry. represented in thousand BTUs per total The Concession.\nproduction in barrel of oil equivalent.\nConcession Amendment ARLANXEO Holding B.V., a wholly owned Equalization prices As defined in Section 8: Additional specialty chemicals subsidiary. Prices are established separately by the Information – Material Agreements – Ministry of Energy for each relevant liquid Associate The Concession.\nproduct using a combination of either An entity over which the Company has Concession Area internationally recognized indices or, where significant influence but does not control, The territorial lands and maritime areas of the relevant, Saudi Aramco’s official selling generally reflected by a shareholding of Kingdom except in the Excluded Areas. price and, depending on the relevant\nbetween 20% and 50% of the voting rights.\nliquid product, on the basis of export parity, Significant influence is the power to Concession Effective Date import parity or a combination of both.\nparticipate in the financial and operating As defined in Section 8: Additional policy decisions of the investee but is not Information – Material Agreements – Exchange or Tadawul control or joint control over those policies. The Concession. The Saudi Stock Exchange, the sole entity authorized in the Kingdom to act as ATC Control a securities exchange.\nAramco Trading Company. Except with respect to financial information, the term Control means the ability to Excluded Areas Auditor influence the actions or decisions of The limited area excluded from Saudi Pricewaterhouse Coopers Public Accountants, another person through, whether directly or Aramco’s rights under the Concession, the independent external auditor of indirectly, alone or with a relative or affiliate consisting of: (a) the boundaries of the Saudi Ar', 'aspiration to make a positive difference through their work. At Aramco we give our people the opportunity to do the work they dreamed of doing, and support them in achieving more than they thought possible.\nPioneers and innovators, scientists and engineers, dreamers and thinkers — our people are our most important asset. They drive us forward, every hour of every day, as we aim to lead the way in responsibly producing reliable energy for the world.\nJoin us to help reshape the global energy landscape and set our world on a path towards a lower-carbon energy future.\nOpportunities for all Jobs in regional offices Explore our world of rewarding career options in Asia, Europe, and U.S.\n\nNational talent recruitment We give our people the opportunity to do the work they’ve dreamed of doing.\n\nInternational recruitment Our employees are drawn by the rewarding professional opportunities we offer.\n\nA great place to work Employee reviews See more on Glassdoor Glassdoor rating ""Great pay and benefits, but hot in summer.""\nAccount Manager, April 2026 “Great salary, great people, changing lives and giving opportunities to the youth of the country”\nAdvanced ITC Teacher, March 2025 8+ years “Great career and work life-balance”\nGeologist, June 2024 “Aramco is the Best Company that I have ever worked for. The work environment is the most productive that I have ever worked in”\nIT Consulting Engineer, March 2024 8+ years “Challenging and exciting tasks, solving tomorrows toughest challenges”\nLead Analyst, August 2023 “Good place to work in. Work-life balance is top priority of company and career growth is highly encouraged”\nSenior Business Analyst, August 2023 “Excellent company to work for all around”\nPilot, June 2023 10+ years “Amazing work environment, and great colleagues”\nScience specialist, April 2023 10+ years “Cross cultured, multi-national organization. It’s amazing to work for the company”\nSupply Chain Director, February 2023 Testimonials “As a working mother of three I’ve found that settling in to life at Aramco has been seamless.”\nRosa Peterson — Lead Environmental Scientist\n\n“Moving from Chile to Saudi Arabia was one of the most important decisions of my life and, to be honest, one of the best.”\nMiguel Arias Vasquez — Senior Hydrographer\n\n“I joined Aramco quite early-on in my Career, it felt like a huge leap of faith, but the feeling of community is like nothing I’ve ever experienced.”\nLucy Gadsby — Executive Assistant to Senior Vice President\n\n“I joined Aramco in 2013 and really enjoy the diversity and richness of culture and the people that I work with every day. It’s truly a global network.”\nFahad Rana — Manager Projects Business Support\n\nA diverse workplace Equity and inclusion We are committed to attracting and developing diverse talent in a welcoming and inclusive work environment.\n\nYLAB: Young Leaders Advisory Board Engaging and inspiring our young employees.\n\nWomen in business How we\'re supporting women\'s educational and career aspirations in our workforce and beyond.\n\nStories about our people Show all articles Elements February 05, 2026 How Aramco is driving sporting excellence Elements January 01, 2026\nA day in the life of an OSPAS engineer Elements December 10, 2025 The desert pioneer behind our first oil discovery Elements November 27, 2025\nMeet Aramco\'s divers Latest social posts About us Learn more about Aramco.\n\nSOURCE: Sustainability  | Aramco\nURL: https://www.aramco.com/en/sustainability\nTYPE: Website Content\n\nOur approach to sustainability\n\nRead our 2024 Sustainability Report A sustainable approach is essential to how we operate, as well as to ensuring that Aramco continues to thrive in the long-term, and remains one of the world’s leading integrated energy and chemicals companies.\nIt allows the Company to consider how societal and environmental issues affect our day-to-day business, and is a key driver of our strategy as we navigate a global Energy Transition and the shift towards a lower-carbon economy.\nWe recognize the scale and urgency of the climate challenge. We are leveraging our operational strengths and our business portfolio to play our part in the Energy Transition, underpinned by our ambition to achieve net-zero Scope 1 and Scope 2 greenhouse gas emissions across our wholly-owned operated assets by 2050, and our development of lower-carbon energy solutions.\n\nClimate and energy Our efforts towards GHG emissions reduction and efficient resource utilization across our operations.\n\nPeople and safety We strive to provide a safe and respectful working environment for all.\n\nEnvironment Environmental stewardship is deeply integral to our approach.\n\nSociety Initiatives and programs created to support the communities and the environment in which we operate.\n\nGovernance and oversight Aramco’s internal governance model for sustainability.\n\nSustainability news and stories\n\nNews March 24, 2025 Aramco completes acquisition of 50% stake in Blue Hydrogen Industrial Gases', 'adjusted for the time value of money as Saudi Aramco does not have any contracts where the period between the transfer of product to the customer and payment by the customer exceeds one year.\nDisaggregation of revenue from contracts with customers Saudi Aramco’s revenue from contracts with customers according to product type and source is as follows:\n\nUpstream Downstream Corporate Total\nCrude oil 645,499 22,049 – 667,548\nRefined and chemical products – 369,478 – 369,478\nNatural gas and NGLs 57,649 1,769 – 59,418\nRevenue from contracts with customers 703,148 393,296 – 1,096,444\nMovement between provisional and final prices 5,405 245 – 5,650\nOther revenue 697 1,558 1,347 3,602\nExternal revenue 709,250 395,099 1,347 1,105,696\n\nUpstream Downstream Corporate Total\nCrude oil 720,010 8,268 – 728,278\nRefined and chemical products – 392,882 – 392,882\nNatural gas and NGLs 69,649 2,156 – 71,805\nRevenue from contracts with customers 789,659 403,306 – 1,192,965\nMovement between provisional and final prices (1,756) (514) – (2,270)\nOther revenue 569 1,783 1,329 3,681\nExternal revenue 788,472 404,575 1,329 1,194,376\nRevenue from contracts with customers includes local sales at Kingdom regulated prices as follows:\n2019 2018\nCrude oil 2,745 1,847\nRefined and chemical products 56,777 55,790\nNatural gas and NGLs 15,341 16,037\n74,863 73,674\nstnemetats laicnanfi detadilosnoc Notes to the consolidated financial statements continued All amounts in millions of Saudi Riyals unless otherwise stated 185 24. Finance and other income\n2019 2018\nInterest income on time deposits and loans receivable 5,359 2,777\nGain on remeasurement of existing interest in equity investments (Note 33) 1,278 870\nDividend income from investments in securities 509 143\nInvestment income 175 63\nGain on derivative transactions 6 4 Other 24 8\n7,351 3,865\n25. Non-cash transactions in the Consolidated Statement of Cash Flows\nInvesting activities during 2019 include additions to right-of-use assets of SAR 9,670 (2018: finance lease assets of SAR 8,195), subordinated\nshareholder loans and trade receivables with a joint venture that were converted to equity of SAR 1,706 and SAR 1,098 (2018: SAR 1,915 and\nSAR 583), respectively, and asset retirement provisions of SAR 50 (2018: SAR 1,533).\n26. Commitments (a) Capital commitments\nCapital expenditures contracted for but not yet incurred were SAR 154,181 and SAR 90,034 at December 31, 2019 and 2018, respectively.\nIn addition, leases contracted for but not yet commenced were SAR 7,467 at December 31, 2019.\n(b) Operating leases\nPrior to the adoption of IFRS 16, Leases, effective January 1, 2019, non-cancellable operating leases on drilling rigs, tankers, real estate,\ntransportation equipment, light industrial equipment and office equipment were classified as operating leases. The leases have varying terms, escalation clauses and renewal rights. Rates are generally fixed at the contract date. The approximate minimum payments on the non-cancellable operating leases at December 31, 2018 were as follows:\n2019 2018\nNo later than one year – 8,078 Later than one year and no later than five years – 15,625\nLater than five years – 11,862\n– 35,565 From January 1, 2019, Saudi Aramco has recognized right-of-use assets for these leases, except for short-term and low-value leases. Refer to Note 2(c)(i) and Note 5 for further information.\n(c) IMIC In 2017, Saudi Aramco Development Company (“SADCO”), a wholly owned subsidiary of the Company, and Lamprell plc (“Lamprell”), Bahri and Korea Shipbuilding and Offshore Engineering (“KSOE”), formerly known as Hyundai Heavy Industries, formed a company, IMIC, in which SADCO\nowns 50.1%, Lamprell owns 20%, Bahri owns 19.9% and KSOE', '. ADDITIONAL STRUCTURE AND FINANCIAL 7. C ONSOLIDATED\n\nAND STRATEGY PERFORMANCE 3. SUSTAINABILITY 4. RISK GOVERNANCE INFORMATION STATEMENTS Liquids Production costs Tier 1 process safety event Crude oil, condensate, and NGL. The sum of operating costs and An unplanned or uncontrolled release of depreciation, reflecting both the erosion of any material, including nontoxic and LNG asset value over time on an accounting basis nonflammable materials, from a process Liquefied natural gas.\nand the cost of operating the business. that results in one or more of the LPG consequences listed in API Recommended Proved reserves/Hydrocarbon reserves Practice-754.\nLiquefied petroleum gas, which is a mixture Those quantities of liquids and gas, which, of saturated and unsaturated hydrocarbons, by analysis of geoscience and engineering Total recordable case (TRC) rate with up to five carbon atoms, used as data, can be estimated with reasonable Sum of recordable cases that occurred in the household fuel.\ncertainty to be economically producible workplace per 200,000 work hours.\nMSC – from a given date forward, from known Unconventional oil and gas reservoirs, and under existing economic Maximum Sustainable Capacity – the Refers to the oil and gas resources which conditions, operating methods, and average maximum number of barrels per cannot be explored, developed, and government regulations – prior to the time day of crude oil that can be produced for produced by conventional processes just in at which contracts providing the right to one year during any future planning period, using the natural pressure of the wells and operate expire, unless evidence indicates after taking into account all planned capital pumping or compression operations.\nthat renewal is reasonably certain, expenditures and maintenance, repair, and regardless of whether deterministic or operating costs, and after being given three probabilistic methods are used for the months to make operational adjustments.\nestimation. The project to extract the The MSC excludes AGOC’s crude oil hydrocarbons must have commenced or the production capacity.\noperator must be reasonably certain that it MTBE will commence the project within a Methyl tertiary butyl ether – a volatile, reasonable time.\ncolorless, flammable liquid that is PV manufactured via a chemical reaction Photovoltaic.\nbetween methanol and isobutylene, and is used as a component in fuel for gasoline Reserves life engines.\nCalculated on a barrel of oil equivalent basis Natural gas by dividing proved reserves as at a given year-end by production for that year.\nMethane produced at Aramco’s gas plants and sold within the Kingdom as sales gas. Scope 1 GHG emissions Net chemicals production capacity Direct emissions, which include GHG emissions from onsite fuel combustion, Aramco’s equity share of its gross chemicals flaring, venting, and fugitive emissions.\nproduction capacity, calculated by multiplying the gross chemicals production Scope 2 GHG emissions capacity of each facility in which Aramco Indirect emissions, which account for GHG has an interest by Aramco’s percentage emissions from offsite power generation, equity ownership in the entity that owns including electricity and steam.\nthe facility.\nSupply reliability Net refining capacity Total products volume shipped/delivered Aramco’s equity share of its gross refining within 24 hours of the scheduled time, capacity, calculated by multiplying the gross divided by the total products volume refining capacity of each refinery in which committed. Any delays caused by factors Aramco has an interest by Aramco’s that are under the Company’s control (e.g.\npercentage equity ownership in the entity terminal, pipeline, stabilization, or that owns the refinery.\nproduction) negatively affect the score, NGL whereas delays caused by conditions that are beyond the Company’s control, such as Natural gas liquids, which are liquid or adverse weather, are not considered. A liquefied hydrocarbons produced in the score of less than 100% indicates there were manufacture, purification, and stabilization issues that negatively impacted supply of natural gas. For the reporting of reserves, reliability.\nethane is included in NGL. For the reporting of production, NGL is included in total liquids, and ethane is reported as a component of total gas.\n\nGlossary Affiliate BHIG Company Except with respect to financial information, Blue Hydrogen Industrial Gases Company. Saudi Arabian Oil Company (the Company).\nthe term Affiliate means a person who Blended Price Concession controls another person or is controlled by Pursuant to Council of Ministers Resolution As defined in Section 6: Additional financial that other person, or who is under common\nNo. 370, dated 10/7/1439H (corresponding and legal information – Material\ncontrol with that person by a third person.\nto March 27, 2018) and the Ministerial agreements – The Concession.\nIn any of the preceding, control could be Resolution issued by the Ministry of Energy, direct or indirect. Concession Amendment in agreement with the Ministry of Finance,', 'meet minimum funding requirements.\nIn addition to the above plans, Saudi Aramco maintains or participates in defined contribution plans for which Saudi Aramco’s legal or constructive obligation is limited to the contributions. The costs of the defined contribution plans, which are included principally within producing and manufacturing, and selling, administrative and general expenses in the consolidated statement\nof income, are SAR 1,201 and SAR 1,634 for the years ended December 31, 2022 and 2021, respectively (Note 26).\n22. Provisions and other liabilities\n2022 2021\nAsset retirement 17,568 18,296\nEnvironmental 770 824\nFinancial liability – options and forward contracts 2,929 3,301\nOther non-current liabilities 6,510 3,823\n27,777 26,244\nAsset retirement provisions relate to the future plugging and abandonment of oil and natural gas wells and the decommissioning of certain Downstream assets. The environmental provision is for the remediation of ground water and soil contamination.\nPayments to settle these provisions will occur on an ongoing basis and will continue over the lives of the operating assets, which can exceed 50 years for the time when it is necessary to abandon oil and natural gas wells. The amount and timing of settlement in respect of these provisions are uncertain and dependent on various factors that are not always within management’s control.\nThe movements in asset retirement and environmental provisions are as follows:\nAsset retirement Environmental\nJanuary 1, 2021 17,339 940\nRevision to estimate 154 (75)\nAdditional provisions 368 4 Unwinding of discount 446 4\nAmounts charged against provisions (11) (49)\nDecember 31, 2021 18,296 824\nRevision to estimate (1,770) (8)\nAdditional provisions 626 4 Unwinding of discount 431 4\nAmounts charged against provisions (15) (54)\nDecember 31, 2022 17,568 770\n23. Trade and other payables\n2022 2021\nTrade payables 65,425 55,325\nAccrued materials and services 36,900 37,509\nAmounts due to related parties (Note 29(b)) 15,431 17,678\nEmployee related payables 10,304 8,801\nOther 7,330 5,376\n135,390 124,689\n\nAll amounts in millions of Saudi Riyals unless otherwise stated 24. Revenue\n2022 2021\nRevenue from contracts with customers 2,003,347 1,335,391\nMovement between provisional and final prices (3,397) 5,299\nOther revenue 7,005 6,240\n2,006,955 1,346,930\nOther revenue:\nServices provided to:\nGovernment, semi-Government and other entities with Government ownership or control\n(Note 29(a)) 1,061 1,061\nThird parties 698 814\nJoint ventures and associates (Note 29(a)) 195 683\nFreight 1,076 1,474\nOther 3,975 2,208\n7,005 6,240\nRevenue from contracts with customers is measured at a transaction price agreed under the contract and the payment is due\nwithin 10 to 120 days from the invoice date depending on specific terms of the contract.\nTransaction prices are not adjusted for the time value of money, as Saudi Aramco does not have any contracts where the period between the transfer of product to the customer and payment by the customer exceeds one year.\nDisaggregation of revenue from contracts with customers Saudi Aramco’s revenue from contracts with customers according to product type and source is as follows:\n\nUpstream Downstream Corporate Total\nCrude oil 971,325 105,401 – 1,076,726\nRefined and chemical products – 835,884 – 835,884\nNatural gas and NGLs 56,055 19,292 – 75,347\nMetal products – 15,390 – 15,390\nRevenue from contracts with customers 1,027,380 975,967 – 2,003,347\nMovement between provisional and final prices (3,142) (255) – (3,397)\nOther revenue 390 4,969 1,646 7,005\nExternal revenue 1,024,628 980,681 1,646 2,006,955\n\nUpstream Downstream Corporate Total\nCrude oil 600,673 60,208 – 660,881\nRefined and chemical products – 607,771 – 607,771\nNatural gas and NGLs 49,956 3,992 – 53,948\nMetal products – 12,791 – 12,791\nRevenue from contracts with customers', 'amco’s funding strategy to meet benefit plan expenses using applicable U.S. plan funding rules. Other plans follow local regulations or contractual obligations to meet minimum funding requirements.\nIn addition to the above plans, Saudi Aramco maintains or participates in defined contribution plans for which Saudi Aramco’s legal or constructive obligation is limited to the contributions. The costs of the defined contribution plans, which are included principally within producing and manufacturing, and selling, administrative and general expenses in the consolidated statement\nof income, are SAR 1,201 and SAR 1,634 for the years ended December 31, 2022 and 2021, respectively (Note 26).\n22. Provisions and other liabilities\n2022 2021\nAsset retirement 17,568 18,296\nEnvironmental 770 824\nFinancial liability – options and forward contracts 2,929 3,301\nOther non-current liabilities 6,510 3,823\n27,777 26,244\nAsset retirement provisions relate to the future plugging and abandonment of oil and natural gas wells and the decommissioning of certain Downstream assets. The environmental provision is for the remediation of ground water and soil contamination.\nPayments to settle these provisions will occur on an ongoing basis and will continue over the lives of the operating assets, which can exceed 50 years for the time when it is necessary to abandon oil and natural gas wells. The amount and timing of settlement in respect of these provisions are uncertain and dependent on various factors that are not always within management’s control.\nThe movements in asset retirement and environmental provisions are as follows:\nAsset retirement Environmental\nJanuary 1, 2021 17,339 940\nRevision to estimate 154 (75)\nAdditional provisions 368 4 Unwinding of discount 446 4\nAmounts charged against provisions (11) (49)\nDecember 31, 2021 18,296 824\nRevision to estimate (1,770) (8)\nAdditional provisions 626 4 Unwinding of discount 431 4\nAmounts charged against provisions (15) (54)\nDecember 31, 2022 17,568 770\n23. Trade and other payables\n2022 2021\nTrade payables 65,425 55,325\nAccrued materials and services 36,900 37,509\nAmounts due to related parties (Note 29(b)) 15,431 17,678\nEmployee related payables 10,304 8,801\nOther 7,330 5,376\n135,390 124,689\n\nNotes to the consolidated financial statements continued All amounts in millions of Saudi Riyals unless otherwise stated 24. Revenue\n2022 2021\nRevenue from contracts with customers 2,003,347 1,335,391\nMovement between provisional and final prices (3,397) 5,299\nOther revenue 7,005 6,240\n2,006,955 1,346,930\nOther revenue:\nServices provided to:\nGovernment, semi-Government and other entities with Government ownership or control\n(Note 29(a)) 1,061 1,061\nThird parties 698 814\nJoint ventures and associates (Note 29(a)) 195 683\nFreight 1,076 1,474\nOther 3,975 2,208\n7,005 6,240\nRevenue from contracts with customers is measured at a transaction price agreed under the contract and the payment is due\nwithin 10 to 120 days from the invoice date depending on specific terms of the contract.\nTransaction prices are not adjusted for the time value of money, as Saudi Aramco does not have any contracts where the period between the transfer of product to the customer and payment by the customer exceeds one year.\nDisaggregation of revenue from contracts with customers Saudi Aramco’s revenue from contracts with customers according to product type and source is as follows:\n\nUpstream Downstream Corporate Total\nCrude oil 971,325 105,401 – 1,076,726\nRefined and chemical products – 835,884 – 835,884\nNatural gas and NGLs 56,055 19,292 – 75,347\nMetal products – 15,390 – 15,390\nRevenue from contracts with customers 1,027,380 975,967 – 2,003,347\nMovement between provisional and final prices (3,142) (255) – (3,397)\nOther revenue 390 4,969 1,646 7,005\nExternal revenue 1,024,628 980,681 1,646 2,006,955\n\nUpstream Downstream Corporate Total\nCrude oil 600,673 60,208 – 660,881\nRefined and chemical products – 607,771 – 607,771\nNatural gas and N', 'be SAR 6,672 in 2022. While the Saudi plans are generally not governed\nby regulatory minimum funding requirements, the funding objective is to reach full funding of the larger plans only. Saudi Aramco pays annual contributions equal to benefit payments. Asset outperformance is expected to meet the shortfall between assets and the assessed liabilities within a reasonable period. Funding for the U.S. plans sponsored by Aramco Shared Benefit Company, a wholly owned subsidiary of the Company, is recommended by the actuary in order to meet Saudi Aramco’s funding strategy to meet benefit plan expenses using applicable U.S. plan funding rules. Other plans follow local regulation or contractual obligations to meet minimum funding requirements.\nIn addition to the above plans, Saudi Aramco maintains or participates in defined contribution plans for which Saudi Aramco’s legal or constructive obligation is limited to the contributions. The costs of the defined contribution plans, which are included principally within producing and manufacturing, and selling, administrative and general expenses in the Consolidated Statement of Income,\nare SAR 1,634 and SAR 1,372 for the years ended December 31, 2021 and 2020, respectively (Note 26).\n22. Provisions and other liabilities Asset retirement Environmental Other Total\nJanuary 1, 2020 13,716 937 1,332 15,985\nAcquisition – – 5,093 5,093\nRevision to estimate 2,485 45 194 2,724\nAdditional provisions 744 83 544 1,371\nUnwinding of discount (Note 20) 411 23 5 439\nAmounts charged against provisions (17) (148) (239) (404)\nDecember 31, 2020 17,339 940 6,929 25,208\nRevision to estimate 154 (75) 75 154\nAdditional provisions 368 4 345 717\nUnwinding of discount (Note 20) 446 4 – 450\nAmounts charged against provisions (11) (49) (225) (285)\nDecember 31, 2021 18,296 824 7,124 26,244\nAsset retirement provisions relate to the future plugging and abandonment of oil and natural gas wells and the decommissioning of certain Downstream assets. The environmental provision is for the remediation of ground water and soil contamination. Payments to settle these provisions will occur on an ongoing basis and will continue over the lives of the operating assets, which can exceed 50 years for the time when it is necessary to abandon oil and natural gas wells. The amount and timing of settlement in respect of these provisions are uncertain and dependent on various factors that are not always within management’s control. Other includes non- current payables, financial liabilities for options and forward contracts, provisions and other obligations.\nConsolidated financial statements All amounts in millions of Saudi Riyals unless otherwise stated 23. Trade and other payables\n2021 2020\nTrade payables 55,325 36,595\nAccrued materials and services 37,509 36,726\nAmounts due to related parties (Note 29(b)) 17,678 9,540\nEmployee related payables 8,801 6,800\nOther 5,376 4,079\n124,689 93,740\n24. Revenue\n2021 2020\nRevenue from contracts with customers 1,335,391 771,246\nMovement between provisional and final prices 5,299 (7,344)\nOther revenue 6,240 4,207\n1,346,930 768,109\nOther revenue:\nServices provided to:\nGovernment, semi-Government and other entities with Government ownership or control (Note 29(a)) 1,061 953\nThird parties 814 675\nJoint ventures and associates (Note 29(a)) 683 825\nFreight 1,474 431\nOther 2,208 1,323\n6,240 4,207\nRevenue from contracts with customers is measured at a transaction price agreed under the contract and the payment is due within\n10 to 120 days from the invoice date depending on specific terms of the contract.\nTransaction prices are not adjusted for the time value of money, as Saudi Aramco does not have any contracts where the period between the transfer of product to the customer and payment by the customer exceeds one year.\nDisaggregation of revenue from contracts with customers Saudi Aramco’s revenue from contracts with customers according to product type and source is as follows:\n\nUpstream Downstream Corporate Total\nCrude oil 600,673 60,208 – 660,881\nRefined and chemical products – 607,771 – 607,771\nNatural gas and NGLs 49,956 3,992 – 53,948\nMetal products – 12,791 –', ""gas, which is a A process by which new wells are mixture of saturated and unsaturated mmbpd drilled in order to determine the hydrocarbons, with up to five carbon Million barrels per day boundaries of a discovered oil or gas atoms, used as household fuel.\nfield, both its areal extent and its mmBTU vertical hydrocarbon column. MSC Million British thermal units Maximum Sustainable Capacity – the Energy intensity mmscf average maximum number of barrels An index for measuring the total energy Million standard cubic feet per day of crude oil that can be produced consumed to generate a unit of product, for one year during any future planning mmscfd represented in thousand BTUs per total period, after taking into account all Million standard cubic feet production in barrel of oil equivalent.\nplanned capital expenditures and per day Flaring intensity maintenance, repair and operating per day Volume of gas flared per barrel of oil costs, and after being given three months Volumes are converted into a daily basis equivalent produced (scf/boe). to make operational adjustments.\nusing a calendar year (Gregorian) The MSC excludes AGOC’s crude oil Freshwater production capacity.\nscf Non-brackish water with total dissolved Standard cubic feet solids (TDS) concentration up to 2,000 MTBE mg/l. Methyl tertiary butyl ether.\ntscf Trillion standard cubic feet notiamrofni lagel\n\nlaicnanfi lanotiiddA\n\nNatural gas Reliability Dry gas produced at Aramco's gas plants Total products volume shipped/delivered and sold within the Kingdom. within 24 hours of the scheduled time, divided by the total products volume Net chemicals production capacity committed. Any delays caused by factors Aramco’s equity share of its gross that are under the Company’s control chemicals production capacity, calculated (e.g. terminal, pipeline, stabilization, or by multiplying the gross chemicals production) negatively affect the score, production capacity of each facility whereas delays caused by conditions that in which Aramco has an interest by are beyond the Company’s control, such Aramco’s percentage equity ownership as adverse weather, are not considered.\nin the entity that owns the facility.\nA score of less than 100 percent indicates Net refining capacity there were issues that negatively Aramco’s equity share of its gross refining impacted reliability.\ncapacity, calculated by multiplying the Reserves life gross refining capacity of each refinery Calculated on a barrel of oil equivalent in which Aramco has an interest by basis by dividing proved reserves as Aramco’s percentage equity ownership at a given year-end by production for in the entity that owns the refinery.\nthat year.\nNGL Scope 1 GHG emissions Natural gas liquids, which are liquid Direct emissions, which include GHG or liquefied hydrocarbons produced in emissions from onsite fuel combustion, the manufacture, purification and flaring, venting and fugitive emissions.\nstabilization of natural gas. For purposes of reserves, ethane is included in NGL. Scope 2 GHG emissions For purposes of production, ethane Indirect emissions, which account for GHG is reported separately and excluded emissions from offsite power generation from NGL. including electricity and steam.\nProduction costs Tier 1 Process Safety Event The sum of operating costs and An unplanned or uncontrolled release depreciation, reflecting both the erosion of any material, including non-toxic and of asset value over time on an accounting nonflammable materials, from a process basis and the cost of operating the that results in one or more of the business. consequences listed in API Recommended Practice-754.\nProved reserves Those quantities of liquids and gas, which, Total recordable case (TRC) frequency by analysis of geoscience and engineering Sum of recordable cases that occurred in data, can be estimated with reasonable the workplace per 200,000 work hours.\ncertainty to be economically producible Unconventional oil and gas\n– from a given date forward, from known Term refers to the oil and gas resources reservoirs, and under existing economic which cannot be explored, developed and conditions, operating methods and produced by conventional processes just government regulations – prior to the in using the natural pressure of the wells time at which contracts providing the and pumping or compression operations.\nright to operate expire, unless evidence indicates that renewal is reasonably Upstream methane intensity certain, regardless of whether Estimated methane emissions from deterministic or probabilistic methods are upstream operations per volume used for the estimation. The project to of marketed natural gas expressed extract the hydrocarbons must have as a percentage.\ncommenced or the operator must be reasonably certain that it will commence the project within a reasonable time.\n\nGlossary Affiliate Board Control Except with respect to financial The Board of Directors of the Company. Except with respect to financial information, the term Affiliate means a information, the term Control means the Bylaws person who controls another person or is ability to influence the actions or decisions The Bylaws of the Company, approved controlled by that other person, or who is of another person through, whether by Council of Ministers"", 'Amounts charged against provisions (17) (148) (239) (404)\nDecember 31, 2020 17,339 940 6,929 25,208\nRevision to estimate 154 (75) 75 154\nAdditional provisions 368 4 345 717\nUnwinding of discount (Note 20) 446 4 – 450\nAmounts charged against provisions (11) (49) (225) (285)\nDecember 31, 2021 18,296 824 7,124 26,244\nAsset retirement provisions relate to the future plugging and abandonment of oil and natural gas wells and the decommissioning of certain Downstream assets. The environmental provision is for the remediation of ground water and soil contamination. Payments to settle these provisions will occur on an ongoing basis and will continue over the lives of the operating assets, which can exceed 50 years for the time when it is necessary to abandon oil and natural gas wells. The amount and timing of settlement in respect of these provisions are uncertain and dependent on various factors that are not always within management’s control. Other includes non- current payables, financial liabilities for options and forward contracts, provisions and other obligations.\n63 Saudi Arabian Oil Company | Consolidated financial statements for the year ended December 31, 2021\nAll amounts in millions of Saudi Riyals unless otherwise stated 23. Trade and other payables\n2021 2020\nTrade payables 55,325 36,595\nAccrued materials and services 37,509 36,726\nAmounts due to related parties (Note 29(b)) 17,678 9,540\nEmployee related payables 8,801 6,800\nOther 5,376 4,079\n124,689 93,740\n24. Revenue\n2021 2020\nRevenue from contracts with customers 1,335,391 771,246\nMovement between provisional and final prices 5,299 (7,344)\nOther revenue 6,240 4,207\n1,346,930 768,109\nOther revenue:\nServices provided to:\nGovernment, semi-Government and other entities with Government ownership or control (Note 29(a)) 1,061 953\nThird parties 814 675\nJoint ventures and associates (Note 29(a)) 683 825\nFreight 1,474 431\nOther 2,208 1,323\n6,240 4,207\nRevenue from contracts with customers is measured at a transaction price agreed under the contract and the payment is due within\n10 to 120 days from the invoice date depending on specific terms of the contract.\nTransaction prices are not adjusted for the time value of money, as Saudi Aramco does not have any contracts where the period between the transfer of product to the customer and payment by the customer exceeds one year.\nDisaggregation of revenue from contracts with customers Saudi Aramco’s revenue from contracts with customers according to product type and source is as follows:\n\nUpstream Downstream Corporate Total\nCrude oil 600,673 60,208 – 660,881\nRefined and chemical products – 607,771 – 607,771\nNatural gas and NGLs 49,956 3,992 – 53,948\nMetal products – 12,791 – 12,791\nRevenue from contracts with customers 650,629 684,762 – 1,335,391\nMovement between provisional and final prices 5,026 273 – 5,299\nOther revenue 411 4,342 1,487 6,240\nExternal revenue 656,066 689,377 1,487 1,346,930\nSaudi Arabian Oil Company | Consolidated financial statements for the year ended December 31, 2021 64\nNotes to the consolidated financial statements continued All amounts in millions of Saudi Riyals unless otherwise stated 24. Revenue continued\n\nUpstream Downstream Corporate Total\nCrude oil 377,094 31,400 – 408,494\nRefined and chemical products – 314,066 – 314,066\nNatural gas and NGLs 40,684 2,287 – 42,971\nMetal products – 5,715 – 5,715\nRevenue from contracts with customers 417,778 353,468 – 771,246\nMovement between provisional and final prices (7,286) (58) – (7,344)\nOther revenue 464 2,377 1,366 4,207\nExternal revenue 410,956 355,787 1,366 768,109\nRevenue from contracts with customers includes local sales at Kingdom regulated prices as follows:\n2021 2020\nCrude oil 2,829 2,749\nRefined and chemical products 62,262', '436,371\nDeferred consideration 33,735 33,544\nShort-term bank financing 16,939 17,351\nCommercial borrowings 7,197 10,556\nDebentures 3,750 3,750\nSukuk 264 266\nLease liabilities 9,256 9,083\n71,141 74,550\nOn January 24, 2022, Saudi Aramco, in agreement with PIF, made a partial prepayment of SAR 28,579 ($7,621), which has reduced the principal\namounts of two promissory notes by SAR 26,250 ($7,000) and SAR 3,750 ($1,000) payable on or before April 7, 2024 and April 7, 2026,\nrespectively.\n10. Revenue 1st quarter 1st quarter\n2022 2021\nRevenue from contracts with customers 463,403 269,833\nMovement between provisional and final prices 2,543 1,335\nOther revenue 1,057 904\n467,003 272,072\nRevenue from contracts with customers is measured at a transaction price agreed under the contract and the payment is due within 10 to 120\ndays from the invoice date depending on specific terms of the contract.\nTransaction prices are not adjusted for the time value of money as Saudi Aramco does not have any contracts where the period between the transfer of product to the customer and payment by the customer exceeds one year.\nDisaggregation of revenue from contracts with customers Saudi Aramco’s revenue from contracts with customers according to product type and source is as follows:\n1st quarter 2022 Upstream Downstream Corporate Total\nCrude oil 224,622 15,095 239,717\nRefined and chemical products 200,628 200,628\n\nNatural gas and NGLs 15,731 3,012 18,743\n\nMetal products 4,315 4,315\n\nRevenue from contracts with customers 240,353 223,050 463,403\n\nMovement between provisional and final prices 2,349 194 2,543\nOther revenue 77 660 320 1,057\n\nExternal revenue 242,779 223,904 320 467,003\nFirst quarter interim report 2022 All amounts in millions of Saudi Riyals unless otherwise stated 10. Revenue continued Disaggregation of revenue from contracts with customers continued 1st quarter 2021 Upstream Downstream Corporate Total\nCrude oil 119,368 11,443 130,811\nRefined and chemical products 125,442 125,442\n\nNatural gas and NGLs 10,067 532 10,599\n\nMetal products 2,981 2,981\n\nRevenue from contracts with customers 129,435 140,398 269,833\n\nMovement between provisional and final prices 1,308 27 1,335\nOther revenue 93 524 287 904\n\nExternal revenue 130,836 140,949 287 272,072\nRevenue from contracts with customers includes local sales at Kingdom regulated prices as follows:\n1st quarter 1st quarter\n2022 2021\nCrude oil 547 483\nRefined and chemical products 18,715 13,215\nNatural gas and NGLs 3,600 1,368\n22,862 15,066\n11. Non-cash investing and financing activities\nInvesting and financing activities for the three-month period ended March 31, 2022 include additions to right-of-use assets of SAR 1,121 (March\n31, 2021: SAR 2,852), asset retirement provisions of SAR 75 (March 31, 2021: SAR 68) and equity awards issued to employees of SAR 54\n(March 31, 2021: SAR 15).\n12. Commitments Capital commitments\nCapital expenditures contracted for but not yet incurred were SAR 182,537 and SAR 159,145 at March 31, 2022 and December 31, 2021,\nrespectively. In addition, leases contracted for but not yet commenced were SAR 10,406 and SAR 10,309 at March 31, 2022 and December 31,\n2 021, respectively.\n13. Contingencies Saudi Aramco has contingent assets and liabilities with respect to certain disputed matters, including claims by and against contractors and lawsuits and arbitrations involving a variety of issues. These contingencies arise in the ordinary course of business. It is not anticipated that any material adjustments will result from these contingencies.\n14. Payments to the Government by the Company 1st quarter 1st quarter\n2022 2021\nIncome taxes (Note 7(c)) 59,948 22,387']",I couldn't find this in the available documents.,"Aramco treats such contracts as leases when they convey control of an identified asset in exchange for consideration. It recognizes right-of-use assets and lease liabilities at commencement, except for short-term and low-value leases, which are expensed over the lease term.",0.0,0.0,0.3333333333,0.0
What direction has Aramco set for its gas business inside Saudi Arabia and internationally?,"['2019. He was Co-Founder and Principal of Washington Counsel, P.C. (acquired by EY) from 1996 to 2000, Partner,\nOldaker, Ryan & Leonard from 1995 to 1996, member of the International Business Council at the World Economic Forum, and Global Agenda Steward for Economic Progress at the World Economic Forum.\nIn addition, Mr. Weinberger has served the U.S. government in several strategic roles.\nQualifications Mr. Mark A. Weinberger Mr. Weinberger obtained a B.A. from Emory University (Economics) in 1983, Director an MBA and a J.D. from Case Western Reserve University in 1987, and an LLM\nIndependent Non-executive Director since 2020 in Taxation from Georgetown University Law Center in 1991. Mr. Weinberger University.\n\nBoard of Directors continued Board memberships Names of the companies inside and outside the Kingdom in which a Board member is a member of their current or previous Boards.\nPrevious H.E. Yasir O. Al-Rumayyan H.E. Dr. Ibrahim A. Al-Assaf\n• Director of Red Sea Cruises Company from Board of Directors membership inside KSA 2019 to 2022 Board of Directors membership inside KSA Current Current\n• Vice Chairman of Saudi Information\n• Director of PIF • Director of PIF Technology Company (SITE) from\n• Chairman of the Board of the Saudi 2019 to 2022 Previous Decision Support Centre • Member of the Board of Governors • Chairman of Sanabil Investments\n• Chairman of NEOM Investment Fund of the Islamic Development Bank Company from 2009 to 2017\n• Member of the Board of Trustees of the from 2016 to 2020 • Governor of the Islamic Development Hevolution Foundation • Director of the Saudi Industrial Bank from 1996 to 2016\n• Director of Industrial Company for Development Fund from 2016 to 2020 Board of Directors membership outside KSA Electronics (ALAT) • Director of the Saudi Exchange Previous\n• Chairman of the Future Investment in 2014 • Governor of the International Monetary Initiative Institute • CEO and Director of Saudi Fransi Fund from 1996 to 2016\n• Director of Ceer National Automotive Capital from 2011 to 2015 • Governor of the World Bank\n• Director of Savvy Games Group • Director of Corporate Finance and from 1996 to 2016 Issuance, CMA from 2008 to 2010 • Governor of the Arab Monetary\n• Chairman of Aviation Services Company Fund from 1996 to 2016 (Riyadh Air) Board of Directors membership outside KSA\n• Director of Oil Park Development Current Company • Chairman of Magic Leap, Inc.\nH.E. Mohammed A. Al-Jadaan\n• Member of the Large Companies • Chairman of LIV Golf Investments Ltd.\nBoard of Directors membership inside KSA Investment Committee (Shareek) • Chairman of Newcastle United Current\n• Chairman of Golf Saudi Football Club\n• Chairman of the General Authority\n• Director of NEOM Company • Director of Reliance Industries Limited for Awqaf\n• Chairman of Ma’aden Previous\n• Director of Economic Cities and Special\n• Director of Uber Technologies,\n• Director of The Red Sea Global Company Zones Authority Inc. from 2016 to 2023\n• Vice Chairman of Roshn Real Estate\n• Director of ARM Limited from • Chairman of the Zakat, Tax and Customs Company\n2018 to 2022 Authority\n• Director of Qiddiya Investment Company\n• Director of SoftBank Group Corp. • Chairman of Expenditure & Projects\n• Chairman of Noon Investments Company from 2017 to 2020 Efficiency Authority\n• Chairman of Sanabil Investments\n• Chairman of Saudi Authority for Company Accredited Valuers\n• Member of the Council of CEDA\n• Chairman of the National Center of\n• Director of HUMAIN Government Resources Systems\n• Director of King Salman International Airport Development Company • Director of Digital Government Authority\n• Board of Trustee of OceanQuest • Director of Royal Commission for Makkah Foundation City and Holy Sites\n• Chairman of the General Organization for Social Insurance\n• Director of General Authority for Statistics\n• Chairman of the National Center for Privatization & PPP (NCP)\n• Chairman of the National Debt Management Center\n• Director of the Saudi Authority for Data and Artificial Intelligence\n• Director of the Royal Commission for Riyadh City\n• Chairman of the Non-Oil Revenue Center\n\nAramco overview Results and Sustainability Risk Organizational structure Additional financial Consolidated and strategy performance and corporate governance and legal information financial statements\n• Chairman of the State Properties General Board of Directors membership outside KSA H.E. Faisal F. Alibrahim Authority Current\n• Chairman of the International Monetary Board of Directors membership inside KSA\n• Committee Chairman of the Fiscal and Financial Committee (IMFC) Current Sustainability Program Committee\n• Chairman of the General Authority for', '. Weinberger held a series of roles at Ernst & Young (EY) including Global Chairman and CEO from 2013 to 2019. He was Co-Founder and Principal of Washington Counsel, P.C. (acquired by EY) from 1996 to 2000, Partner,\nOldaker, Ryan & Leonard from 1995 to 1996, member of the International Business Council at the World Economic Forum, and Global Agenda Steward for Economic Progress at the World Economic Forum.\nIn addition, Mr. Weinberger has served the U.S. government in several strategic roles.\nMr. Mark A. Weinberger Director Qualifications Independent Non-executive Director since 2020 Mr. Weinberger obtained a B.A. from Emory University (Economics) in 1983, an MBA and a J.D. from Case Western Reserve University in 1987 and an LLM in Taxation from Georgetown University Law Center in 1991. Mr. Weinberger\nhas an honorary doctorate from the Kogod School of Business at American University.\n\nBoard of Directors continued Board memberships Names of the companies inside and outside the Kingdom in which a Board member is a member of their current or previous Boards.\nH.E. Yasir O. Al-Rumayyan H.E. Dr. Ibrahim A. Al-Assaf Board of Directors membership inside KSA Board of Directors membership inside KSA Current Current\n• Director of PIF • Director of PIF\n• Chairman of Riyadh Air Previous\n• Chairman of the Saudi Decision Support Center of the Royal Court • Chairman of Sanabil Investments Company from 2009 to 2017\n• Chairman of NEOM Investment Fund • Governor of the Islamic Development Bank from 1996 to 2016\n• Member of the Board of Trustees of the Hevolution Foundation Board of Directors membership outside KSA\n• Director of Industrial Company for Electronics (ALAT) Previous\n• Chairman of the Future Investment Initiative Institute • Governor of the International Monetary Fund from 1996 to 2016\n• Director of Ceer National Automotive • Governor of the World Bank from 1996 to 2016\n• Director of Savvy Games Group • Governor of the Arab Monetary Fund from 1996 to 2016\n• Chairman of Aviation Services Company\n• Director of Oil Park Development Company H.E. Mohammed A. Al-Jadaan\n• Director of the Board of Destinations Development Company Board of Directors membership inside KSA\n• Member of the Large Companies Investment Committee Current (Shareek) • Chairman of the General Authority for Awqaf\n• Chairman of Golf Saudi • Director of Economic Cities and Special Zones Authority\n• Director of NEOM Company • Chairman of the Zakat, Tax and Customs Authority\n• Chairman of Ma’aden • Chairman of Expenditure & Projects Efficiency Authority\n• Director of The Red Sea Global Company • Chairman of Saudi Authority for Accredited Valuers\n• Vice Chairman of Roshn Real Estate Company • Chairman of the National Center of Government Resources\n• Director of Qiddiya Investment Company Systems\n• Chairman of Noon Investments Company • Director of Digital Government Authority\n• Chairman of Sanabil Investments Company • Director of Royal Commission for Makkah City and Holy Sites\n• Chairman of the General Organization for Social Insurance Previous\n• Director of General Authority for Statistics\n• Director of Red Sea Cruises Company from 2019 to 2022\n• Chairman of the National Center for Privatization & PPP (NCP)\n• Vice Chairman of Saudi Information Technology Company (SITE)\nfrom 2019 to 2022 • Chairman of the National Debt Management Center\n• Member of the Board of Governors of the Islamic Development • Director of the Saudi Authority for Data and Artificial Intelligence Bank from 2016 to 2020 • Director of the Royal Commission for Riyadh City\n• Director of the Saudi Industrial Development Fund from 2016 to • Committee Chairman of the Privatization Program Committee\n\n• Chairman of the Non-Oil Revenue Center\n• Director of the Saudi Exchange (Tadawul) in 2014\n• Chairman of the State Properties General Authority\n• CEO and Director of Saudi Fransi Capital from 2011 to 2015\n• Committee Chairman of the Fiscal Sustainability Program\n• Director of Corporate Finance and Issuance, CMA from 2008 to Committee\n\n• Committee Chairman of the Financial Sector Development Board of Directors membership outside KSA Program Committee Current • Committee Chairman of the Fiscal Balance Program Committee\n• Chairman of Magic Leap, Inc • Director of National Development Fund\n• Chairman of LIV Golf Investments Ltd • Director of General Authority for Military Industries\n• Chairman of Newcastle United Football Club • Director of PIF\n• Director of Reliance Industries Limited • Director of Military Industries Corporation Previous • Member of the Board of Governors of the Islamic Development\n• Director of Uber Technologies, Inc from 2016 to 2023 Bank\n• Director of ARM Limited from 2018 to 2022 Previous\n• Director of SoftBank Group Corp.', '• Director of the Saudi Authority for Data and Artificial Intelligence\n• Director of the Royal Commission for Riyadh City\n• Chairman of the Non-Oil Revenue Center\n\nAramco overview Results and Sustainability Risk Organizational structure Additional financial Consolidated and strategy performance and corporate governance and legal information financial statements\n• Chairman of the State Properties General Board of Directors membership outside KSA H.E. Faisal F. Alibrahim Authority Current\n• Chairman of the International Monetary Board of Directors membership inside KSA\n• Committee Chairman of the Fiscal and Financial Committee (IMFC) Current Sustainability Program Committee\n• Chairman of the General Authority for\n• Member of the Board of Governors of the\n• Committee Chairman of the Financial Statistics International Monetary Fund Sector Development Program Committee • Chairman of the National Infrastructure\n• Member of the Board of Governors of the Fund (INFRA)\n• Director of National Development Fund World Bank\n• Director of PIF\n• Director of General Authority for Military\n• Member of the Board of Governors of the • Director of the National Development Industries Arab Fund for Economic and Social Fund\n• Director of PIF Development\n• Director of the Royal Commission for\n• Member of the Board of Governors of the • Member of the Board of Governors of the Riyadh City Islamic Development Bank Arab Monetary Fund • Director of the General Organization for Social Insurance\n• Director of King Salman International • Member of the Board of Governors of the Airport Development Company Asian Infrastructure Investment Bank • Director of the National Center for Performance Management\n• Director of the Special Economic Zones Previous\n• Director of the Cultural Development Center in Riyadh • Member of the Board of Governors of the Fund Arab Bank for Economic Development in\n• Director of Supreme Authority for Africa from 2016 to 2025 • Director of Zakat, Tax and Customs Industrial Security\n• Member of the Board of Governors Authority\n• Director of Saudi Center for Strategic and of the Arab Authority for Agricultural\n• Director of HUMAIN International Partnerships Investment and Development from\n2016 to 2025 • Chairman of the Steering Committee for\nPrevious the Kingdom’s Participation in World\n• Chairman of the CMA from 2015 to 2016 • Member of the Board of Governors Expos of the Arab Investment and Export Credit\n• Committee Chairman of the Privatization Guarantee Corporation from 2016 to 2025 • Director of Saudi Eksab Program Committee from 2019 to 2025 Board of Directors membership outside KSA\n• Committee Chairman of the Fiscal Previous Sustainability Program Committee from\n• Member of the UCLA Health\n2017 to 2025\nInternational Advisory Board\n• Committee Chairman of the Fiscal Balance from 2021 to 2024 Program Committee from 2017 to 2025\n• Director of Military Industries Corporation from 2016 to 2025\n\nBoard of Directors continued Mr. Khalid H. Al-Dabbagh Mr. Amin H. Nasser Ms. Lynn L. Elsenhans Board of Directors membership inside KSA Board of Directors membership inside KSA Board of Directors membership outside KSA Current Current Current\n• Chairman of SABIC • Member of the International Advisory • Director of TSMC\n• Member of the Investment Board of KFUPM Previous Committee of PIF • Member of the Board of Trustees of • Director of Glaxo Smith Kline plc\n• Member of King Abdulaziz Excellence KAUST from 2012 to 2022 Award Board Advisory Committee • Director of HUMAIN • Director of Baker Hughes, a GE Previous Board of Directors membership outside KSA Company from 2017 to 2019\n• Chairman of SADCO from 2018 to 2021 Current • Director of Baker Hughes, Inc.\n• Member of the World Economic Forum’s from 2012 to 2017\n• Chairman of Wisayah Global Investment Company from 2019 to 2021 International Business Council (IBC) and its • Director of Flowserve Corporation Executive Committee from 2014 to 2017\n• Director of Sadara from 2015 to 2018\n• Member of the Massachusetts Institute • Director of International Paper Company\n• Director of Aramco Ventures LLC of Technology Presidential CEO from 2007 to 2012 from 2015 to 2018 Advisory Board\n• Chairwoman of Sunoco, Inc. in 2009\n• Director of Saudi Aramco • Member of the JP Morgan International Entrepreneurship Center from Council • Chairwoman of Sunoco Logistics\n2014 to 2017 Partners from 2008 to 2012\n• Member of the Board of Directors\n• Director of ATC and the Chairman of its of BlackRock, Inc. • Director of Baker Hughes Company from Board Audit Committee from 2011 to 2013 2019 to 2025\n• Director of Luberef from 2009 to 2011 Mr. Robert W. Dudley Board of Directors membership outside KSA Mr. Stuart T. Gulliver Current Board of Directors membership outside KSA Board of', 'Directors membership outside KSA Program Committee Current • Committee Chairman of the Fiscal Balance Program Committee\n• Chairman of Magic Leap, Inc • Director of National Development Fund\n• Chairman of LIV Golf Investments Ltd • Director of General Authority for Military Industries\n• Chairman of Newcastle United Football Club • Director of PIF\n• Director of Reliance Industries Limited • Director of Military Industries Corporation Previous • Member of the Board of Governors of the Islamic Development\n• Director of Uber Technologies, Inc from 2016 to 2023 Bank\n• Director of ARM Limited from 2018 to 2022 Previous\n• Director of SoftBank Group Corp. from 2017 to 2020 • Chairman of the CMA from 2015 to 2016\n\n5 . O RGANIZATIONAL 6. A DDITIONAL STRUCTURE AND FINANCIAL 7. C ONSOLIDATED\n\nAND STRATEGY PERFORMANCE 3. SUSTAINABILITY 4. RISK GOVERNANCE INFORMATION STATEMENTS Board of Directors membership outside KSA Mr. Khalid H. Al-Dabbagh Current Board of Directors membership inside KSA\n• Member of the Board of Governors of the International Monetary Fund Current\n• Chairman of SABIC\n• Member of the Board of Governors of the World Bank\n• Member of the Investment Committee of PIF\n• Member of the Board of Governors of the Arab Fund for Economic and Social Development • Member of King Abdulaziz Excellence Award Board Advisory Committee\n• Member of the Board of Governors of the Arab Monetary Fund\n• Member of the Board of Governors of the Arab Bank for Previous Economic Development in Africa • Chairman of SADCO from 2018 to 2021\n• Member of the Board of Governors of the Asian Infrastructure • Chairman of Wisayah Global Investment Company from Investment Bank 2019 to 2021\n• Member of the Board of Governors of the Arab Authority • Director of Sadara from 2015 to 2018 for Agricultural Investment and Development\n• Director of Aramco Ventures LLC from 2015 to 2018\n• Member of the Board of Governors of the Arab Investment\n• Director of Saudi Aramco Entrepreneurship Center from and Export Credit Guarantee Corporation\n2014 to 2017\n• Director of ATC and the Chairman of its Board Audit Committee H.E. Faisal F. Alibrahim from 2011 to 2013 Board of Directors membership inside KSA • Director of Luberef from 2009 to 2011 Current Board of Directors membership outside KSA\n• Chairman of the General Authority for Statistics Current\n• Chairman of the National Infrastructure Fund (INFRA)\n• Director of Governors of the GCC Board Directors Institute\n• Director of PIF\n• Member of the World Economic Forum Chairpersons’ Committee\n• Director of the National Development Fund Previous\n• Director of the Royal Commission for Riyadh City\n• Director of PRefChem from 2018 to 2020\n• Director of the General Organization for Social Insurance\n• Director of ARLANXEO (the Netherlands) from 2016 to 2018\n• Director of the Local Content and Government Procurement\n• Director of Fujian Refining and Petrochemical Company (China)\nAuthority from 2007 to 2009\n• Director of the National Center for Performance Management\n• Vice Chairman of Sinopec SenMei Products Company (China) from\n• Director of the Cultural Development Fund 2007 to 2009 Board of Directors membership outside KSA • Director of Showa Shell Sekiyu K.K. (Japan) from 2007 to 2009 Current • Director of SUMED from 2000 to 2001\n• Member of the UCLA Health International Advisory Board\n\nBoard of Directors continued Mr. Amin H. Nasser Ms. Lynn L. Elsenhans Board of Directors membership inside KSA Board of Directors membership outside KSA Current Current\n• Member of the International Advisory Board of KFUPM • Director of Baker Hughes Company\n• Member of the Board of Trustees of KAUST • Director of TSMC Board of Directors membership outside KSA Previous Current • Director of Glaxo Smith Kline plc from 2012 to 2022\n• Member of the World Economic Forum’s International Business • Director of Baker Hughes, a GE Company from 2017 to 2019 Council (IBC)\n• Director of Baker Hughes, Inc from 2012 to 2017\n• Member of the Massachusetts Institute of Technology\n• Director of Flowserve Corporation from 2014 to 2017 Presidential CEO Advisory Board and its Executive Committee\n• Director of International Paper Company from 2007 to 2012\n• Member of the JP Morgan International Council\n• Chairwoman of Sunoco, Inc in 2009\n• Member of the Board of Directors of BlackRock, Inc\n• Chairwoman of Sunoco Logistics Partners from 2008 to 2012 Mr. Robert W. Dudley Mr. Stuart T. Gull', 'amco Nabors Drilling Company (“SANAD”)\nIn 2017, SADCO and Nabors International Netherlands BV formed a company, SANAD (Note 38), to provide onshore drilling services to\nthe Company. In 2018, MOFSL was incorporated as a subsidiary of SADCO and all of SADCO’s investments and related commitments in and to ARO Drilling were transferred to MOFSL by way of a Novation Agreement. Saudi Aramco has committed to lease 50 onshore\nrigs over a ten-year period beginning in 2021 for an estimated value of SAR 24,263. In addition, Saudi Aramco has committed to award\ndrilling contracts for an estimated value of SAR 52,489 for up to 20 new build offshore rigs to be purchased by ARO Drilling over a\n10-year period.\n(f) Arabian Rig Manufacturing Company (‘‘ARM’’)\nIn June 2018, SADCO and NOV Downhole Eurasia Limited formed a company, ARM, to provide onshore land drilling manufacturing, equipment and services to SANAD and the Middle East and North Africa region. Saudi Aramco committed to invest SAR 225, of which,\nSAR 53 is invested at December 31, 2020 (2019: SAR 9). In addition, SADCO has guaranteed the purchase of 50 onshore rigs over\na 12-year period beginning in 2021 for an estimated value of SAR 6,741, and has the option to cancel the onshore rig orders for a\nmaximum financial exposure of SAR 1,358.\n(g) Other (i) I n order to comply with past Government directives, the Company expects to sell portions of its equity in Saudi Aramco Total Refining and Petrochemical Company and Yanbu Aramco Sinopec Refining Company Ltd. (Note 39) through a public offering of shares in Saudi Arabia. Also in order to comply with a past Government directive, Excellent Performance Chemical Company (“EPCC”), a wholly owned subsidiary of the Company, expects to sell portions of its equity in Sadara (Note 34(a)) through a public\noffering of shares in Saudi Arabia.\n(ii) S audi Aramco is committed to comply with the Government directive to guarantee that Saudi Aramco Total Refining and\nPetrochemical Company and Yanbu Aramco Sinopec Refining Company Ltd. shall spend a total of SAR 750 over a 10-year period\nending December 31, 2025 on social responsibility programs. At December 31, 2020, SAR 446 (2019: SAR 461) remains to be spent.\n(iii) S audi Aramco has commitments of SAR 328 (2019: SAR 384) to invest in private equity investments both inside and outside the\nKingdom. Such commitments can be called on demand.\n(iv) S audi Aramco has commitments of SAR 55 (2019: SAR 58) to fund additional loans and acquire additional unlisted equity\ninvestments of certain small to mid-sized enterprises in the Kingdom. The commitments can be called by the enterprises upon meeting certain conditions.\n\n,13 rebmeceD dedne\n\nstnemetats laicnanfi detadilosno C\n\n34. Contingencies Saudi Aramco has contingent assets and liabilities with respect to certain disputed matters, including claims by and against contractors and lawsuits and arbitrations involving a variety of issues. These contingencies arise in the ordinary course of business.\nIt is not anticipated that any material adjustments will result from these contingencies.\nSaudi Aramco also has bank guarantees with respect to the acquisition of a subsidiary (Note 4) amounting to SAR 2,867 as of December 31, 2020 arising in the ordinary course of business.\nSaudi Aramco also has contingent liabilities with respect to the following:\n(a) Sadara In 2011, EPCC and Dow Saudi Arabia Holding B.V. (together to be referred to as the “Founding Shareholders”) signed a shareholder agreement with a term of 99 years to construct and operate a fully-integrated chemicals complex at Jubail II Industrial City in Saudi\nArabia (“the Project”). Shortly thereafter, the Founding Shareholders formed Sadara to execute the Project. In May 2019, Saudi\nAramco committed to increase the total financing facility provided to Sadara from SAR 25,125 to SAR 32,035. As of December 31, 2020,\nSAR 30,678 (2019: SAR 28,362) has been drawn down.\nIn 2013, Sadara entered into definitive agreements with certain export credit agencies and commercial banks for approximately\nSAR 39,505 of project financing. In 2013, Sadara also conducted a project Sukuk issuance in Saudi Arabia for approximately SAR 7,500\nwith a final maturity in', ')\n• Director of Baker Hughes, Inc from 2012 to 2017\n• Member of the Massachusetts Institute of Technology\n• Director of Flowserve Corporation from 2014 to 2017 Presidential CEO Advisory Board and its Executive Committee\n• Director of International Paper Company from 2007 to 2012\n• Member of the JP Morgan International Council\n• Chairwoman of Sunoco, Inc in 2009\n• Member of the Board of Directors of BlackRock, Inc\n• Chairwoman of Sunoco Logistics Partners from 2008 to 2012 Mr. Robert W. Dudley Mr. Stuart T. Gulliver Board of Directors membership outside KSA Board of Directors membership inside KSA Current Current\n• Chairman of Prism Global Management, LLC\n• Director of the Saudi Awwal Bank\n• Chairman of Axio Board of Directors membership outside KSA\n• Director of Lyondell Basell Industries Current\n• Director of Freeport-Mc Moran\n• Director of the Jardine Matheson Holdings Limited\n• Director of Bahrain Petroleum Company (BAPCO)\n• Chairman for Maggie’s Cancer Charity\n• Director of 8 Rivers Capital Previous\n• Director of the Airport Authority Hong Kong from 2019 to 2023\n• Chairman of the Hong Kong and Shanghai Banking Corporation from 2011 to 2018\n• Executive Director of HSBC Holdings plc from 2008 until 2018\n• Executive Director of the Hong Kong and Shanghai Banking Corporation from 2006 to 2018\n• Chairman of HSBC Private Banking Holdings (Suisse) SA from 2010 to 2011 and HSBC France from 2009 to 2012\n• Deputy Chairman of HSBC Trinkaus & Burkhardt AG from 2007 to\n2011 and a member of its supervisory board from 2006 to 2011\n• Chairman of HSBC Bank plc and HSBC Bank Middle East Limited in 2010\n\n5 . O RGANIZATIONAL 6. A DDITIONAL STRUCTURE AND FINANCIAL 7. C ONSOLIDATED\n\nAND STRATEGY PERFORMANCE 3. SUSTAINABILITY 4. RISK GOVERNANCE INFORMATION STATEMENTS Mr. Andrew N. Liveris Mr. Mark A. Weinberger Board of Directors membership inside KSA Board of Directors membership outside KSA Current Current\n• Member of the Board of Trustees of KAUST • Director of JPMorgan Chase\n• Member of the Advisory Board of NEOM • Director of MetLife, Inc\n• Director of Industrial Company for Electronics (ALAT) • Director of the Board of Trustees for the Greater Board of Directors membership outside KSA Washington Partnership Current • Director of the Board of Trustees for the Concord Coalition\n• Deputy Chairman of Worley Parsons • Director of the Board of Trustees for the Emory University\n• Director of Lucid Motors • Director of the Board of Trustees for the Case Western\n• Director of IBM Corporation Reserve University\n• Director of the Hevolution Foundation • Director of JUST Capital Foundation, Inc\n• Member of the Board of Trustees of the United States Council • Director of the National Bureau of Economic Research (NBER)\nfor International Business • Director of Global Ai\n• Chairman of The Hellenic Initiative • Director of the Board of Advisors of American Council of\n• Member of the Advisory Board of Sumitomo Mitsui Banking Capital Formation Corporation (SMBC) • Member of the Advisory Board of the Liveris Academy for\n• Member of the Advisory Board of Salesforce.com, Inc Innovation and Leadership at The University of Queensland\n• Director of LIV Golf Investments Ltd Previous\n• Director of Global Ai • Global Chairman of EY from 2013 to 2019 and a director since 2000 Previous\n• Director of U.S. Business Roundtable from 2014 to 2019\n• Executive Chairman of DowDuPont Inc from 2017 to 2018\n• Director of Catalyst from 2013 to 2019\n• Chairman of The Dow Chemical Company from 2006 to 2018\n• Chairman of the International Business Leaders Advisory Council\n• Chairman of the US Business Council from 2013 to 2014 (IBLAC)\n\nSenior Executives Company and industry insight Aramco is organized into two Business Lines that include Upstream and Downstream, and six Service Lines that include Technical Services; Law;\nFinance; Technology & Innovation; Strategy & Corporate Development; and Human Resources & Corporate Services. The Business Lines are each headed by a President, and the Service Lines are headed up by Executive Vice Presidents, each delegated the authority to plan and manage the activities of the assigned area. The Business Line and Service Line Heads report directly to the President & CEO.\nMr. Amin H. Nasser President & Chief Executive Officer Experience Qualifications Currently, Mr. Nasser serves as President and CEO of the Company, Mr. Nasser obtained a B.S. in Petroleum Engineering from KFUPM in and is a member of the', 'of the JP Morgan International Entrepreneurship Center from Council • Chairwoman of Sunoco Logistics\n2014 to 2017 Partners from 2008 to 2012\n• Member of the Board of Directors\n• Director of ATC and the Chairman of its of BlackRock, Inc. • Director of Baker Hughes Company from Board Audit Committee from 2011 to 2013 2019 to 2025\n• Director of Luberef from 2009 to 2011 Mr. Robert W. Dudley Board of Directors membership outside KSA Mr. Stuart T. Gulliver Current Board of Directors membership outside KSA Board of Directors membership inside KSA\n• Director of Governors of the GCC Board Current Current Directors Institute • Chairman of Prism Global Management,\n• Director of the Saudi Awwal Bank LLC\n• Member of the World Economic Forum Chairpersons’ Committee • Chairman of Axio Board of Directors membership outside KSA Current\n• Director of Lyondell Basell Industries Previous • Director of the Jardine Matheson\n• Director of PRefChem from 2018 to 2020 • Director of Freeport-Mc Moran Holdings Limited\n• Director of ARLANXEO (the Netherlands) • Director of Bahrain Petroleum • Chairman for Maggie’s Cancer Charity from 2016 to 2018 Company (BAPCO)\n• Director of Fujian Refining and • Director of 8 Rivers Capital\n• Director of the Airport Authority Hong Petrochemical Company (China) • Chairman of OGCI Kong from 2019 to 2023 from 2007 to 2009\n• Chairman of the Hong Kong and Shanghai\n• Vice Chairman of Sinopec SenMei Banking Corporation from 2011 to 2018 Products Company (China) from\n• Executive Director of HSBC Holdings plc\n2007 to 2009\nfrom 2008 until 2018\n• Director of Showa Shell Sekiyu K.K.\n• Executive Director of the Hong Kong (Japan) from 2007 to 2009 and Shanghai Banking Corporation from\n• Director of SUMED from 2000 to 2001\n2006 to 2018\n• Chairman of HSBC Private Banking Holdings (Suisse) SA from 2010 to 2011 and HSBC France from 2009 to 2012\n• Deputy Chairman of HSBC Trinkaus & Burkhardt AG from 2007 to 2011 and a member of its supervisory board from\n2006 to 2011\n• Chairman of HSBC Bank plc and HSBC Bank Middle East Limited in 2010\n\nAramco overview Results and Sustainability Risk Organizational structure Additional financial Consolidated and strategy performance and corporate governance and legal information financial statements Mr. Andrew N. Liveris Mr. Mark A. Weinberger Board of Directors membership inside KSA Board of Directors membership outside KSA Current Current\n• Member of the Board of Trustees • Director of JPMorgan Chase of KAUST • Director of MetLife, Inc.\n• Member of the Advisory Board of NEOM • Director of the Board of Johnson &\n• Director of Industrial Company for Johnson Electronics (ALAT) • Director of the Board of Trustees for the Board of Directors membership outside KSA Greater Washington Partnership Current • Director of the Board of Trustees\n• Deputy Chairman of Worley Parsons for the Concord Coalition\n• Director of Lucid Motors • Director of the Board of Trustees for the\n• Director of IBM Corporation Emory University\n• Director of the Hevolution Foundation • Director of the Board of Trustees for the Case Western Reserve University\n• Member of the Board of Trustees of the United States Council for International • Director of JUST Capital Foundation, Inc.\nBusiness • Director of the National Bureau of\n• Chairman of The Hellenic Initiative Economic Research (NBER)\n• Member of the Advisory Board • Director of Global AI of Sumitomo Mitsui Banking • Director of the Board of Advisors Corporation (SMBC) of American Council of Capital Formation\n• Member of the Advisory Board • Member of the Advisory Board of the of Salesforce.com, Inc. Liveris Academy for Innovation and\n• Director of LIV Golf Investments Ltd. Leadership at The University of Queensland\n• Director of Global AI Previous Previous\n• Global Chairman of EY from 2013 to\n• Executive Chairman of DowDuPont\n2019 and a director since 2000\nInc. from 2017 to 2018\n• Director of U.S. Business Roundtable\n• Chairman of The Dow Chemical from 2014 to 2019 Company from 2006 to 2018\n• Director of Catalyst from 2013 to 2019\n• Chairman of the US Business Council from 2013 to 2014 • Chairman of the International Business L eaders Advisory Council (IBLAC)\n2017 to 2018\n\nSenior Executives Company and industry insight Aramco is organized into two business lines that include Upstream and Downstream, and six Corporate functions that include Technical Services,', '1996 for the company’s Prior to that, Mr. Al-Jama’ had been Executive ‘Udhailiyah — and led a complex organization Out-of-Kingdom Law Degree Program — Director, Industrial Services, from January 2012 that consisted of seven gas processing centers. through which he earned his Juris Doctor to January 2015.\ndegree with honors in Law from Oklahoma Prior to this, he was Vice President of Pipelines, University in the U.S. He started with Aramco in 1980 in the Home Distribution & Terminals, responsible for the Ownership Division, after which he joined the transportation of oil, gas, and domestic fuel After completion of the bar exam and working Company’s College Degree Program, earning a distribution through bulk plants and air fueling for a leading U.S. law firm in New York, Mr. B.S. degree in 1985 and then an M.S. degree in units, and the Kingdom’s crude exports Al-Mansour returned to the Kingdom in 2000 1998 — both in Community & Regional through terminals. and joined the Saudi Aramco Law Planning from King Fahd University of Organization, where he held a number of Petroleum and Minerals.\nMr. Al-Sa’adi held the position of Chief positions of increasing scope and responsibility.\nEngineer of Saudi Aramco, and prior to that, He led the Aramco legal team that supported Mr. Al-Jama’ returned to the Home Ownership he was President & CEO of the Aramco Gulf the development of Sadara Chemicals, and he Division in 1985, where he became Supervisor Operations Company (AGOC), and Chairman led a number of legal teams in connection with of the Home Ownership Unit in 1993 after of the AGOC Executive Committee, providing oil and gas concessions and other investment serving in a variety of administrative roles.\npolicy and direction to Al-Khafji Joint agreements including participating in In 1998, Mr. Al-Jama’ became Director of Saudi Operations. negotiations with various international oil Aramco Built Government Schools before companies (IOCs) for significant investments in taking on the role of Administrator, Home He has served professionally, and in a Saudi Arabia’s non-associated gas sector. Ownership & Community Development, in\nsupervisory capacity, domestically and He also served as Corporate Secretary to a September 2000. In February 2002, he became\ninternationally, over a multitude of number of joint venture companies established Manager, Central Community Services.\nengineering, refining, and project by Aramco and IOCs.\nmanagement fields. During that time, he completed several Mr. Al-Mansour served as Associate General assignments in diverse organizations within Mr. Al-Sa’adi is the Chairman of the Sadara Counsel from April 2011 to February 2014, Employee Relations & Training and the Central Chemical Company, Saudi Aramco Mobil championing a multi-year strategic program in Community Services Department, as well as Refinery (SAMREF), and the International the Law Organization, which led to roles as acting General Manager of Medical Maritime Industries Company (IMIC). He also transforming it into a best-in-class international Operations, acting Personnel Director, and serves as a Shareholder Representative for legal organization. He was also responsible for acting Executive Director, Community, the Saudi Arabian Industrial Investment overseeing multiple legal practice areas Buildings & Office Services.\nCompany. including litigation, international trade, and project development and finance. Mr. Al-Jama’ was elevated to General Manager, Mr. Al-Sa’adi joined Aramco in 1981 after Training & Career Development, in 2006 before earning a B.S. degree in Chemical Engineering In February 2014, he was appointed Executive being assigned acting Executive Director, from King Fahd University of Petroleum and Director of Procurement & Supply Chain Community Services, in 2008. He was\nMinerals. Management, overseeing the corporate supply permanently assigned as Executive Director,\nchain, contracting activities, and Aramco’s Community Services, in 2009, and in 2012, he\nglobal materials logistics operations. He was moved to Industrial Services. In February 2015, named Vice President of that organization in Mr. Al-Jama’ transferred to Pipelines, May 2015 and then, in October 2015, was Distribution & Terminals.\nappointed Deputy General Counsel in Law.\n\nMr. Nasir K. Al-Naimi Acting Business Line Head, Upstream Nasir K. Al-Naimi was named acting Business Line Head of Upstream for Aramco, in September 2020, after being appointed Vice President, Petroleum Engineering & Development for Aramco, in September 2016.\nHe had previously served as Vice President, Northern Area Oil Operations, an assignment he assumed in May 2012.\nMr. Al-Naimi joined the company in 1980 as an Engineering Aide in the Planning & Administration Services Division. He received a B.S. degree in Petroleum Engineering from the', '2021 for an estimated value of SAR 24,263. In addition, Saudi Aramco has committed to award\ndrilling contracts for an estimated value of SAR 52,489 for up to 20 new build offshore rigs to be purchased by ARO Drilling over a\n10-year period.\n(f) Arabian Rig Manufacturing Company (‘‘ARM’’)\nIn June 2018, SADCO and NOV Downhole Eurasia Limited formed a company, ARM, to provide onshore land drilling manufacturing, equipment and services to SANAD and the Middle East and North Africa region. Saudi Aramco committed to invest SAR 225, of which,\nSAR 53 is invested at December 31, 2020 (2019: SAR 9). In addition, SADCO has guaranteed the purchase of 50 onshore rigs over\na 12-year period beginning in 2021 for an estimated value of SAR 6,741, and has the option to cancel the onshore rig orders for a\nmaximum financial exposure of SAR 1,358.\n(g) Other (i) I n order to comply with past Government directives, the Company expects to sell portions of its equity in Saudi Aramco Total Refining and Petrochemical Company and Yanbu Aramco Sinopec Refining Company Ltd. (Note 39) through a public offering of shares in Saudi Arabia. Also in order to comply with a past Government directive, Excellent Performance Chemical Company (“EPCC”), a wholly owned subsidiary of the Company, expects to sell portions of its equity in Sadara (Note 34(a)) through a public\noffering of shares in Saudi Arabia.\n(ii) S audi Aramco is committed to comply with the Government directive to guarantee that Saudi Aramco Total Refining and\nPetrochemical Company and Yanbu Aramco Sinopec Refining Company Ltd. shall spend a total of SAR 750 over a 10-year period\nending December 31, 2025 on social responsibility programs. At December 31, 2020, SAR 446 (2019: SAR 461) remains to be spent.\n(iii) S audi Aramco has commitments of SAR 328 (2019: SAR 384) to invest in private equity investments both inside and outside the\nKingdom. Such commitments can be called on demand.\n(iv) S audi Aramco has commitments of SAR 55 (2019: SAR 58) to fund additional loans and acquire additional unlisted equity\ninvestments of certain small to mid-sized enterprises in the Kingdom. The commitments can be called by the enterprises upon meeting certain conditions.\n\nAll amounts in millions of Saudi Riyals unless otherwise stated 235 34. Contingencies\nSaudi Aramco has contingent assets and liabilities with respect to certain disputed matters, including claims by and against contractors and lawsuits and arbitrations involving a variety of issues. These contingencies arise in the ordinary course of business.\nIt is not anticipated that any material adjustments will result from these contingencies.\nSaudi Aramco also has bank guarantees with respect to the acquisition of a subsidiary (Note 4) amounting to SAR 2,867 as of December 31, 2020 arising in the ordinary course of business.\nSaudi Aramco also has contingent liabilities with respect to the following:\n(a) Sadara In 2011, EPCC and Dow Saudi Arabia Holding B.V. (together to be referred to as the “Founding Shareholders”) signed a shareholder agreement with a term of 99 years to construct and operate a fully-integrated chemicals complex at Jubail II Industrial City in Saudi\nArabia (“the Project”). Shortly thereafter, the Founding Shareholders formed Sadara to execute the Project. In May 2019, Saudi\nAramco committed to increase the total financing facility provided to Sadara from SAR 25,125 to SAR 32,035. As of December 31, 2020,\nSAR 30,678 (2019: SAR 28,362) has been drawn down.\nIn 2013, Sadara entered into definitive agreements with certain export credit agencies and commercial banks for approximately\nSAR 39,505 of project financing. In 2013, Sadara also conducted a project Sukuk issuance in Saudi Arabia for approximately SAR 7,500\nwith a final maturity in December 2028. Saudi Aramco previously provided guarantees of 65% of the senior debt (including Sukuk)\namounts owed by Sadara to its senior creditors. Sadara achieved project completion on November 23, 2020, which triggered the\nautomatic termination of these guarantees. As part of project completion, Saudi Aramco, on a several basis, provided a guarantee for the funding of 65% of the debt service reserve account (DSRA) balance required by the senior creditors to cover Sadara’s semi-annual scheduled senior debt principal and interest payments. Saudi Aramco’s guarantee amounts to approximately SAR', 'CO has guaranteed the purchase of 50 onshore rigs\nover a 10-year period beginning in 2022 for an estimated value of SAR 6,741, and has the option to cancel the onshore rig orders\nfor a maximum financial exposure of SAR 1,358.\n(g) Saudi Engines Manufacturing Company (‘‘SEMCO’’)\nOn May 19, 2019, SADCO, Korea Shipbuilding and Offshore Engineering (“KSOE”), and the Saudi Arabian Industrial Investment\nCompany (“Dussur”) entered into an agreement to form a company to set up an engine manufacturing and aftersales facility in the\nKingdom. A limited liability company, SEMCO, was formed on November 16, 2020 by SADCO, which owns 55% of the company, while\nKSOE and Dussur own 30% and 15%, respectively. SADCO is a 25% shareholder of Dussur. Total investment in SEMCO will be up to\nSAR 646 of which SADCO’s share will be up to SAR 355. At December 31, 2021, SAR 86 has been drawn down by SEMCO.\n(h) Other (i) In order to comply with past Government directives, the Company expects to sell portions of its equity in Saudi Aramco Total Refining and Petrochemical Company and Yanbu Aramco Sinopec Refining Company Limited (Note 39) through a public offering of shares in Saudi Arabia.\n(ii) Saudi Aramco is committed to comply with the Government directive to guarantee that Saudi Aramco Total Refining and\nPetrochemical Company shall spend a total of SAR 375 over a 10-year period ending December 31, 2025 on social responsibility\nprograms. At December 31, 2021, SAR 217 remains to be spent.\n(iii) Saudi Aramco is committed to comply with the Government directive to guarantee that Yanbu Aramco Sinopec Refining Company\nLimited shall spend a total of SAR 375 on social responsibility programs by September 30, 2025. At December 31, 2021, SAR 229\nremains to be spent.\n(iv) Saudi Aramco has commitments of SAR 287 (2020: SAR 328) to invest in private equity investments both inside and outside the\nKingdom. Such commitments can be called on demand.\n(v) Saudi Aramco has commitments of SAR 79 (2020: SAR 55) to fund additional loans and acquire additional unlisted equity\ninvestments of certain small to mid-sized enterprises in the Kingdom. The commitments can be called by the enterprises upon meeting certain conditions.\n33. Contingencies Saudi Aramco has contingent assets and liabilities with respect to certain disputed matters, including claims by and against contractors and lawsuits and arbitrations involving a variety of issues. These contingencies arise in the ordinary course of business. It is not anticipated that any material adjustments will result from these contingencies.\nSaudi Aramco has bank guarantees with respect to the acquisition of a subsidiary (Note 35) amounting to SAR 1,958 as of December 31,\n2021 (2020: SAR 2,867) arising in the ordinary course of business.\n\nConsolidated financial statements All amounts in millions of Saudi Riyals unless otherwise stated 33. Contingencies continued Saudi Aramco also has contingent liabilities with respect to the following:\n(a) Sadara\nOn March 25, 2021, Sadara entered into various agreements to restructure its senior project financing debt amounting to SAR 37,280.\nTerms of the restructuring include a principal repayment grace period until June 2026 and an extension of the final maturity date from\n2029 to 2038. In connection with the restructuring, the Company and Dow have agreed to guarantee up to an aggregate of SAR\n13,875 of senior debt principal and its associated interest in proportion to their ownership interests in Sadara. Further, the Company and Dow have agreed to provide guarantees and support, in proportion to their ownership interest in Sadara, for interest payment\nshortfalls on all outstanding senior debt until June 2026, working capital shortfall support up to SAR 1,875 in 2030, as well as an\nundertaking to provide acceptable credit support to cover the required Debt Service Reserve Account balance, which needs to be funded prior to June 2026.\nIn addition to the senior debt restructuring, effective March 25, 2021, the Company, Dow (and/or their affiliates) and Sadara have also\nentered into agreements to (i) provide additional feedstock by increasing the allocated quantity of ethane and natural gasoline supplied by Saudi Aramco, and (ii) gradually increase Saudi Aramco’s rights to market, through SABIC, its equity share of finished products produced by Sadara (subject to certain agreed terms) over the next five to 10 years']",I couldn't find this in the available documents.,"Domestically, Aramco plans to expand gas operations, develop unconventional resources, add infrastructure, and raise sales gas production capacity by more than 60% by 2030 compared with 2021. Internationally, it plans to build an integrated global LNG business and pursue investment opportunities.",1.0,0.0,0.0,0.0
Why were the acquired intangible values from the large chemicals transaction highlighted by the auditor?,"[""not included for entities and groups listed on the Tadawul.\nAll amounts in millions of Saudi Riyals unless otherwise stated 251 40. Events after the reporting period\nOn January 4, 2021, SABIC Agri-Nutrients Company (“SABIC AGRI-NUTRIENTS”), formerly Saudi Arabian Fertilizer Company (“SAFCO”), acquired 100% of the issued share capital of SABIC Agri-Nutrients Investment Company (“SANIC”) from SABIC in\nconsideration for the issue by SAFCO of 59,368,738 additional shares to SABIC thereby increasing SABIC’s ownership of SAFCO\nfrom 43% to 50.1%. Under the terms of the transaction, SABIC injected cash of SAR 392 into SANIC prior to its transfer to SAFCO and\nan adjustment to the purchase price will be required depending on the levels of net working capital and net cash at completion.\nstnemetats laicnanfi detadilosno C\n\nSOURCE: Saudi Aramco — Annual Report 2021\nTYPE: Annual Report\nURL: https://www.aramco.com/-/media/publications/corporate-reports/annual-reports/saudi-aramco-ara-2021-english.pdf\n\nEnergy security for a sustainable world Aramco is one of the world's largest integrated energy and chemicals companies, creating value across the hydrocarbon chain and delivering societal and economic benefits to the Kingdom and communities who rely on the vital energy we supply.\nWe are committed to playing a leading role in the energy transition. We have a responsibility to help the world achieve a net-zero economy, and our people are working hard to solve the world's sustainability challenges.\nFor our customers, we are a supplier of choice.\nFor our shareholders, we provide long-term value creation.\nFor communities around the world, our ambition is to provide reliable, affordable, sustainable energy.\n\nCCoonntteennttss Aramco Corporate governance\n1 History: 06 6 Board of Directors: 104\nChairman’s message: 08 Senior Executives: 108\nPresident and CEO’s message: 10 Board structure: 112\n2021 highlights: 12 Audit Committee report: 117\nAramco’s operations: 14 Risk and HSE Committee report: 119\nBusiness model: 16 Nomination Committee statement: 120\nAt a glance: 20 Compensation Committee statement: 121\nCompensation and other interests: 122 Business overview and strategy Governance, risk and compliance: 126\nStrategy: 29 7 Additional financial information: 130\nReserves information: 137 Results and performance Regulation of the oil and gas industry\n3 Key 2021 metrics: 36 in the Kingdom: 138\nCFO’s message: 38 Additional legal information: 143\nUpstream: 48 statements: 156\nDownstream: 58 Terms and abbreviations: 157\nCorporate: 70 Glossary: 159\nEnvironmental, social and governance Consolidated financial statements\n4 Aramco's approach to sustainability: 74 8 Independent auditor’s report: 166\nClimate change and the energy transition: 76 Consolidated statement of income: 174\nAccelerating human potential: 80 comprehensive income: 175\nGrowing societal value.: 82 Consolidated balance sheet: 176\nConsolidated statement Risk of changes in equity: 177 of cash flows: 178\nRisk factors: 88 Notes to the consolidated financial statements: 179\nThis Annual Report covers financial and operational aspects of Aramco and is issued in both Arabic and English. The print version is identical to its PDF counterpart, which is available at aramco.com. The Arabic version prevails in the event of any discrepancy.\nThe images in this document are representative of the services provided by Aramco. Wherever possible, sustainable printing techniques were used.\nThe information contained in Sections 1 – 7 of this Annual Report constitutes the Board of Directors’ report.\n\nHistory Aramco's history dates back more than 85 years, when a small group of intrepid adventurers set out to explore the deserts of Saudi Arabia The birth of Expansion Making a name Arabian oil for itself\n1933-1944 1945-1965 1966-1988\n1933 Oil concession agreement signed 1948 Standard Oil Company of New 1971 Oil production averages\nwith Standard Oil of California Jersey, later Exxon, purchases 30% 4.5 mmbpd\nwhich creates the California of Arabian American Oil Company, Arabian Standard Oil Company and Socony-Vacuum Oil Company, 1973 The Saudi Government acquires an\n(CASOC) to manage the concession later Mobil, purchases 10% to help initial 25% participating interest in\nprovide market outlets the concession, which increases to\n1938 Oil discovered at Dammam 60%"", 'key audit matter given\n- Compared certain key unobservable inputs the significant estimates involved in determining underlying the preliminary fair values to the preliminary fair values of the identifiable assets supporting documentation such as approved acquired and liabilities assumed.\nfinancial plans; and\n- Evaluated the reasonableness of certain Refer to Note 2(e) and Note 4 to the consolidated observable inputs and/or the resulting financial statements for further information.\npreliminary fair values based on comparable market data.\n• We considered the appropriateness of the related accounting policies and disclosures in the consolidated financial statements.\n\nmatter Accounting for the acquisition of SABIC The Company acquired a 70% equity interest in SABIC in June 2020.\nThe total purchase consideration was SAR 259.1 billion for acquisition of identifiable net assets with preliminary fair values of SAR 260.7 billion. Non-\ncontrolling interests of SAR 100.7 billion and goodwill of SAR 99.1 billion were recognised as\npart of the transaction.\nThe acquisition was accounted for in accordance with IFRS 3 ‘Business Combinations’, that is endorsed in the Kingdom of Saudi Arabia, and required management to make significant estimates as part of determining the preliminary fair values of the identifiable assets acquired and liabilities assumed.\nThe Group engaged an independent valuer in order to determine the fair value of the purchase consideration and the preliminary fair values that formed part of the purchase price allocation.\nWe considered this to be a key audit matter given the significant estimates involved in determining the preliminary fair values of the identifiable assets acquired and liabilities assumed.\nRefer to Note 2(e) and Note 4 to the consolidated financial statements for further information. | Our procedures included the following:\n• We read the share purchase agreement and tested the appropriateness of the fair value of the purchase consideration.\n• We assessed the competency, objectivity and independence of the independent valuer engaged by the Group.\n• With input from internal valuation experts (where considered necessary), we performed the following procedures, in relation to the preliminary fair values of the identifiable net assets that formed part of the purchase price allocation, as deemed appropriate:\n- Considered the appropriateness of the methodology and assumptions used in determining the preliminary fair values based on the applicable financial reporting requirements and established market practice;\n- Compared certain key unobservable inputs underlying the preliminary fair values to supporting documentation such as approved financial plans; and\n- Evaluated the reasonableness of certain observable inputs and/or the resulting preliminary fair values based on comparable market data.\n• We considered the appropriateness of the related accounting policies and disclosures in the consolidated financial statements.\nAccounting for the acquisition of SABIC The Company acquired a 70% equity interest in SABIC in June 2020.\nThe total purchase consideration was SAR 259.1 billion for acquisition of identifiable net assets with preliminary fair values of SAR 260.7 billion. Non-\ncontrolling interests of SAR 100.7 billion and goodwill of SAR 99.1 billion were recognised as\npart of the transaction.\nThe acquisition was accounted for in accordance with IFRS 3 ‘Business Combinations’, that is endorsed in the Kingdom of Saudi Arabia, and required management to make significant estimates as part of determining the preliminary fair values of the identifiable assets acquired and liabilities assumed.\nThe Group engaged an independent valuer in order to determine the fair value of the purchase consideration and the preliminary fair values that formed part of the purchase price allocation.\nWe considered this to be a key audit matter given the significant estimates involved in determining the preliminary fair values of the identifiable assets acquired and liabilities assumed.\nRefer to Note 2(e) and Note 4 to the consolidated financial statements for further information.\nOur procedures included the following:\n• We read the share purchase agreement and tested the appropriateness of the fair value of the purchase consideration.\n• We assessed the competency, objectivity and independence of the independent valuer engaged by the Group.\n• With input from internal valuation experts (where considered necessary), we performed the following procedures, in relation to the preliminary fair values of the identifiable net assets that formed part of the purchase price allocation, as deemed appropriate:\n- Considered the appropriateness of the methodology and assumptions used in determining the preliminary fair values based on the applicable financial reporting requirements and established market practice;\n- Compared certain key unobservable inputs underlying the preliminary fair values to supporting documentation such as approved financial plans; and\n- Evaluated the reasonableness of certain observable inputs and/or the resulting preliminary fair values based on comparable market data.\n• We considered the appropriateness of the related accounting policies and disclosures in the consolidated financial statements.\n\nIndependent auditor’s report to the shareholders of Saudi Arabian Oil Company (continued)\nKey audit matter How our audit addressed the key audit matter Assessment of recoverability of the goodwill and brand recognised as part of the SABIC acquisition IAS 36 ‘Impairment of Assets’, that is endorsed in Our procedures included the following:\nthe Kingdom of Saudi Arabia, requires goodwill and indefinite-lived intangible assets to be tested • We reviewed the appropriateness of annually,', 'current period. These matters were addressed in the context of our audit of the consolidated financial statements as a whole, and in forming our opinion thereon, and we do not provide a separate opinion on these matters.\n\nIndependent auditor’s report to the shareholders of Saudi Arabian Oil Company (continued)\nKey audit matter How our audit addressed the key audit matter Accounting for the acquisition of SABIC The Company acquired a 70% equity interest in Our procedures included the following:\nSABIC in June 2020.\n• We read the share purchase agreement and The total purchase consideration was SAR 259.1 tested the appropriateness of the fair value of the billion for acquisition of identifiable net assets with purchase consideration.\npreliminary fair values of SAR 260.7 billion. Non- controlling interests of SAR 100.7 billion and • We assessed the competency, objectivity and\ngoodwill of SAR 99.1 billion were recognised as independence of the independent valuer part of the transaction. engaged by the Group.\nThe acquisition was accounted for in accordance • With input from internal valuation experts with IFRS 3 ‘Business Combinations’, that is (where considered necessary), we performed the endorsed in the Kingdom of Saudi Arabia, and following procedures, in relation to the required management to make significant preliminary fair values of the identifiable net estimates as part of determining the preliminary assets that formed part of the purchase price fair values of the identifiable assets acquired and allocation, as deemed appropriate:\nliabilities assumed.\n- Considered the appropriateness of the The Group engaged an independent valuer in order methodology and assumptions used in to determine the fair value of the purchase determining the preliminary fair values consideration and the preliminary fair values that based on the applicable financial reporting formed part of the purchase price allocation.\nrequirements and established market practice;\nWe considered this to be a key audit matter given\n- Compared certain key unobservable inputs the significant estimates involved in determining underlying the preliminary fair values to the preliminary fair values of the identifiable assets supporting documentation such as approved acquired and liabilities assumed.\nfinancial plans; and\n- Evaluated the reasonableness of certain Refer to Note 2(e) and Note 4 to the consolidated observable inputs and/or the resulting financial statements for further information.\npreliminary fair values based on comparable market data.\n• We considered the appropriateness of the related accounting policies and disclosures in the consolidated financial statements.\n\nstnemetats laicnanfi detadilosno C\n\nmatter Accounting for the acquisition of SABIC The Company acquired a 70% equity interest in SABIC in June 2020.\nThe total purchase consideration was SAR 259.1 billion for acquisition of identifiable net assets with preliminary fair values of SAR 260.7 billion. Non-\ncontrolling interests of SAR 100.7 billion and goodwill of SAR 99.1 billion were recognised as\npart of the transaction.\nThe acquisition was accounted for in accordance with IFRS 3 ‘Business Combinations’, that is endorsed in the Kingdom of Saudi Arabia, and required management to make significant estimates as part of determining the preliminary fair values of the identifiable assets acquired and liabilities assumed.\nThe Group engaged an independent valuer in order to determine the fair value of the purchase consideration and the preliminary fair values that formed part of the purchase price allocation.\nWe considered this to be a key audit matter given the significant estimates involved in determining the preliminary fair values of the identifiable assets acquired and liabilities assumed.\nRefer to Note 2(e) and Note 4 to the consolidated financial statements for further information. | Our procedures included the following:\n• We read the share purchase agreement and tested the appropriateness of the fair value of the purchase consideration.\n• We assessed the competency, objectivity and independence of the independent valuer engaged by the Group.\n• With input from internal valuation experts (where considered necessary), we performed the following procedures, in relation to the preliminary fair values of the identifiable net assets that formed part of the purchase price allocation, as deemed appropriate:\n- Considered the appropriateness of the methodology and assumptions used in determining the preliminary fair values based on the applicable financial reporting requirements and established market practice;\n- Compared certain key unobservable inputs underlying the preliminary fair values to supporting documentation such as approved financial plans; and\n- Evaluated the reasonableness of certain observable inputs and/or the resulting preliminary fair values based on comparable market data.\n• We considered the appropriateness of the related accounting policies and disclosures in the consolidated financial statements.\nAccounting for the acquisition of SABIC The Company acquired a 70% equity interest in SABIC in June 2020.\nThe total purchase consideration was SAR 259.1 billion for acquisition of identifiable net assets with preliminary fair values of SAR 260.7 billion. Non-\ncontrolling interests of SAR 100.7 billion and goodwill of SAR 99.1 billion were recognised as\npart of the transaction.\nThe acquisition was accounted for in accordance with IFRS 3 ‘Business Combinations’, that is endorsed in the Kingdom of Saudi Arabia, and required management', '-scope audits; and ● We also determined a number of other components to be in scope for the Group audit, in respect of which appropriate audit procedures were performed.\nKey audit Our key audit matters comprise the following:\nmatters ● Assessment of recoverability of the goodwill and brand recognised as part of the Saudi Basic Industries Corporation (“SABIC”) acquisition; and ● Accounting for the gas pipelines transaction.\nAs part of designing our audit, we determined materiality and assessed the risks of material misstatement in the consolidated financial statements. In particular, we considered where the Board of Directors made subjective judgments; for example, in respect of significant accounting estimates that involved making assumptions and considering future events that are inherently uncertain. As in all of our audits, we also addressed the risk of management override of internal controls, including among other matters, consideration of whether there was evidence of bias that represented a risk of material misstatement due to fraud.\nMateriality The scope of our audit was influenced by our application of materiality. An audit is designed to obtain reasonable assurance whether the consolidated financial statements are free from material misstatement.\nMisstatements may arise due to fraud or error. They are considered material if, individually or in aggregate, they could reasonably be expected to influence the economic decisions of users taken on the basis of the consolidated financial statements.\nBased on our professional judgment, we determined certain quantitative thresholds for materiality, including the overall Group materiality for the consolidated financial statements as a whole as set out in the table below.\nThese, together with qualitative considerations, helped us to determine the scope of our audit and the nature, timing and extent of our audit procedures and to evaluate the effect of misstatements, both individually and in aggregate, on the consolidated financial statements as a whole.\n\nIndependent auditor’s report to the shareholders of Saudi Arabian Independent auditor’s report to the shareholders of Saudi Arabian Oil Company (continued) Oil Company (continued)\nOverall Group SAR 37.5 billion (2021: SAR 28.1 billion). Key audit matter How our audit addressed the key audit matter\nmateriality Assessment of recoverability of the goodwill and brand recognised as part of the SABIC How we determined it Based on income before income taxes and zakat.\nacquisition Rationale for the Income before income taxes and zakat is an important benchmark for the materiality benchmark Group’s stakeholders and is a generally accepted benchmark for profit- ‘Impairment of Assets’, that is endorsed in the applied oriented groups. Kingdom of Saudi Arabia, requires goodwill and ● We evaluated the appropriateness of management’s allocation of goodwill to the Downstream operating intangible assets that have indefinite useful lives to segment and brand to the aggregation of the be tested annually for impairment, irrespective of We agreed with those charged with governance that we would report to them misstatements identified during relevant cash-generating units, based on the whether there is any indication of impairment.\nour audit above SAR 2.8 billion. requirements of IAS 36 ‘Impairment of Assets’, that\nis endorsed in the Kingdom of Saudi Arabia.\nManagement performed an assessment of How we tailored our Group audit scope recoverability of the goodwill and brand ● We assessed the completeness of the carrying values (determined to have an indefinite useful life) of the assets and liabilities considered as part of the We tailored the scope of our audit in order to perform sufficient work to enable us to provide an opinion on recognised as part of the SABIC acquisition. The impairment tests for the goodwill and brand in light the consolidated financial statements as a whole, taking into account the structure of the Group, the\ncarrying amounts of these assets were SAR 99.1 of the requirements of IAS 36 ‘Impairment of\naccounting processes and controls, and the industry in which the Group operates.\nbillion and SAR 18.1 billion, respectively, at Assets’, that is endorsed in the Kingdom of Saudi\nDecember 31, 2022. Arabia.\nThe Group’s operations are conducted through many components in different parts of the world. In ● With input from internal valuation experts, where establishing the overall approach to the Group audit, we determined the type of work that needed to be Goodwill has been allocated to the Downstream considered necessary, we performed the following performed by us, as the Group engagement team, or component auditors from other PwC network firms or operating segment. Therefore, the goodwill procedures on management’s value-in-use impairment test was performed at the Downstream other audit firms operating under our instructions. Where the work was performed by component auditors, calculations, as deemed appropriate:\noperating segment level. The brand test was we determined the level of involvement we needed to have in the audit work at those components to be able performed based on an aggregation of the relevant - Considered the consistency of certain to conclude whether sufficient appropriate audit evidence had been obtained as a basis for our opinion on cash-generating units. unobservable inputs underlying the 10-year cash the Group’s consolidated financial statements as a whole.\nflows such as expected product volumes and The recoverable amounts were', 'At the same time, we are continuing to build Supporting our customers, our partners our Downstream business into a world-class and the nation to decarbonize operation. In 2022 we progressed with refining It makes sense for the Company to focus first and chemicals projects in Saudi Arabia and Asia, on the greenhouse gas emissions we can directly while also expanding our presence in Europe.\ninfluence — our Scope 1 and 2 GHG emissions Aramco’s Downstream strategy reflects our from wholly-owned operated assets — while also belief that a significant share of future oil supporting our customers’ efforts to decarbonize.\ndemand will come from petrochemicals, not This is why we continue to work closely with the least from products which are essential inputs automotive industry to develop lower-carbon for the energy transition. We estimate, for synthetic fuels and high efficiency engines, and example, that eight to 11 tons of chemical with the materials industry to develop solutions products are required to produce one megawatt to complement steel and cement. For industries of renewable energy, on average. Aramco, for with hard-to-abate emissions, we plan to be a its part, is preparing for this future by expanding significant exporter of lower-carbon hydrogen the integration of our refining and chemicals which has the potential to assist with renewable facilities, and investing in large-scale liquids-to- energy storage. 2022 saw further work to chemicals projects.\ndevelop this vital new market.\nInvesting in the Kingdom’s economic We remain committed supporters of the Saudi development Green Initiative (SGI) — a massive program of In 2022 we continued to scale our investments reforestation and clean energy deployment in in the Kingdom’s industrial economy, which the Kingdom of Saudi Arabia — as well as the each year grows more diversified and dynamic. SGI’s regional counterpart, the Middle East Green The Company is targeting five strategic domains Initiative. We strongly back the Kingdom’s aim to — sustainability, digital, industrial, manufacturing, reach net-zero emissions by 2060 through the and social innovation — all of which complement circular carbon economy approach, which is Aramco’s supply chain. Today we offer support supported by our ambition to achieve net-zero to companies at every stage of the growth cycle, Scope 1 and Scope 2 greenhouse gas emissions from start-ups to small- and medium-enterprises by 2050 across wholly-owned operated assets.\nto companies with the potential to become Saudi The foundation for Aramco’s success national champions. In March 2023, we signed a framework agreement with the Kingdom’s Private I want to take this opportunity to pay tribute Sector Partnership Reinforcement Program — to the leadership of the Custodian of the known as Shareek — as we seek to foster new Two Holy Mosques King Salman bin Abdulaziz businesses and contribute to the Kingdom’s Al-Saud, and His Royal Highness Prince economic development. Mohammed bin Salman bin Abdulaziz Al-Saud, Crown Prince and Prime Minister of the This strategy enhances Aramco’s supply chain Kingdom of Saudi Arabia. Their vision for resilience, helping to ensure that more of the the future of the Kingdom is an inspiration products and services we rely on can be provided and a guide to everyone at Aramco. I also right on our doorstep. It is also creating jobs for want to thank the Kingdom’s Ministry of our fellow citizens. Energy for their continued support of Aramco.\nThe future favors Aramco Our success in 2022 would also not have The global energy transition is both a long-term been possible without our people — a brilliant challenge and opportunity to leverage Aramco’s team of skilled professionals who are deeply strengths and capabilities to deliver increasingly dedicated to their work and mission.\nsustainable energy solutions. This past year has Finally, my thanks go out to you, our also highlighted the scale and complexity of shareholders, for continuing to place your what is required to meet the energy security trust in our great Company.\nchallenges of the future.\nNo single solution will address the challenge ahead. No single technology will provide the H.E. Yasir O. Al-Rumayyan energy necessary to support a $100 trillion global Chairman of the Board of Directors economy. Leveraging our unique scale and resources, we are exploring multiple pathways to support our aspirations for a lower-carbon future for Aramco, including energy efficiency, carbon capture, utilization, and storage, carbon offsetting, and renewables.\nUltimately, we believe the world will continue to need oil and gas for the foreseeable future.\nIndeed, the future will most certainly favor the lowest-cost, least carbon-intensive producers, and Aramco is exceptionally well-placed in this respect.\n\nC ORPORATE\n\nCreating value and delivering our strategy Dear Shareholders, For Aramco, 2022 was a year with notable achievements on a number of significant fronts.\nFinancially, the Company recorded its highest annual profits as a listed company as global crude oil prices strengthened compared to the previous year. Operationally, we embarked on the largest capital expenditure program in Aramco’s history, driven', 'statements to those charged with governance was set at SAR 2.8 billion.\nBased on their size, complexity and risk:\nGroup ● We selected the Company’s standalone operations and five other scoping components located in the Kingdom of Saudi Arabia, the United States of America, the Republic of Korea and Malaysia for full-scope audits; and ● We also determined a number of other components to be in scope for the Group audit, in respect of which appropriate audit procedures were performed.\nKey audit Our key audit matters comprise the following:\nmatters ● Assessment of recoverability of the goodwill and brand recognised as part of the Saudi Basic Industries Corporation (“SABIC”) acquisition; and ● Accounting for the gas pipelines transaction.\nAs part of designing our audit, we determined materiality and assessed the risks of material misstatement in the consolidated financial statements. In particular, we considered where the Board of Directors made subjective judgments; for example, in respect of significant accounting estimates that involved making assumptions and considering future events that are inherently uncertain. As in all of our audits, we also addressed the risk of management override of internal controls, including among other matters, consideration of whether there was evidence of bias that represented a risk of material misstatement due to fraud.\nMateriality The scope of our audit was influenced by our application of materiality. An audit is designed to obtain reasonable assurance whether the consolidated financial statements are free from material misstatement.\nMisstatements may arise due to fraud or error. They are considered material if, individually or in aggregate, they could reasonably be expected to influence the economic decisions of users taken on the basis of the consolidated financial statements.\nBased on our professional judgment, we determined certain quantitative thresholds for materiality, including the overall Group materiality for the consolidated financial statements as a whole as set out in the table below.\nThese, together with qualitative considerations, helped us to determine the scope of our audit and the nature, timing and extent of our audit procedures and to evaluate the effect of misstatements, both individually and in aggregate, on the consolidated financial statements as a whole.\n\nIndependent auditor’s report continued Independent auditor’s report to the shareholders of Saudi Arabian Independent auditor’s report to the shareholders of Saudi Arabian Oil Company (continued) Oil Company (continued)\nOverall Group SAR 37.5 billion (2021: SAR 28.1 billion). Key audit matter How our audit addressed the key audit matter\nmateriality Assessment of recoverability of the goodwill and brand recognised as part of the SABIC How we determined it Based on income before income taxes and zakat.\nacquisition Rationale for the Income before income taxes and zakat is an important benchmark for the materiality benchmark Group’s stakeholders and is a generally accepted benchmark for profit- ‘Impairment of Assets’, that is endorsed in the applied oriented groups. Kingdom of Saudi Arabia, requires goodwill and ● We evaluated the appropriateness of management’s allocation of goodwill to the Downstream operating intangible assets that have indefinite useful lives to segment and brand to the aggregation of the be tested annually for impairment, irrespective of We agreed with those charged with governance that we would report to them misstatements identified during relevant cash-generating units, based on the whether there is any indication of impairment.\nour audit above SAR 2.8 billion. requirements of IAS 36 ‘Impairment of Assets’, that\nis endorsed in the Kingdom of Saudi Arabia.\nManagement performed an assessment of How we tailored our Group audit scope recoverability of the goodwill and brand ● We assessed the completeness of the carrying values (determined to have an indefinite useful life) of the assets and liabilities considered as part of the We tailored the scope of our audit in order to perform sufficient work to enable us to provide an opinion on recognised as part of the SABIC acquisition. The impairment tests for the goodwill and brand in light the consolidated financial statements as a whole, taking into account the structure of the Group, the\ncarrying amounts of these assets were SAR 99.1 of the requirements of IAS 36 ‘Impairment of\naccounting processes and controls, and the industry in which the Group operates.\nbillion and SAR 18.1 billion, respectively, at Assets’, that is endorsed in the Kingdom of Saudi\nDecember 31, 2022. Arabia.\nThe Group’s operations are conducted through many components in different parts of the world. In ● With input from internal valuation experts, where establishing the overall approach to the Group audit, we determined the type of work that needed to be Goodwill has been allocated to the Downstream considered necessary, we performed the following performed by us, as the Group engagement team, or component auditors from other PwC network firms or operating segment. Therefore, the goodwill procedures on management’s value-in-use impairment test was performed at the Downstream other audit firms operating under our instructions. Where the work was performed by component auditors, calculations, as deemed appropriate:\noperating segment level. The brand test was we determined the level of involvement we needed to have in the audit work at those components to be able performed', 'accounting policies and disclosures in the consolidated financial statements.\nAccounting for the acquisition of SABIC The Company acquired a 70% equity interest in SABIC in June 2020.\nThe total purchase consideration was SAR 259.1 billion for acquisition of identifiable net assets with preliminary fair values of SAR 260.7 billion. Non-\ncontrolling interests of SAR 100.7 billion and goodwill of SAR 99.1 billion were recognised as\npart of the transaction.\nThe acquisition was accounted for in accordance with IFRS 3 ‘Business Combinations’, that is endorsed in the Kingdom of Saudi Arabia, and required management to make significant estimates as part of determining the preliminary fair values of the identifiable assets acquired and liabilities assumed.\nThe Group engaged an independent valuer in order to determine the fair value of the purchase consideration and the preliminary fair values that formed part of the purchase price allocation.\nWe considered this to be a key audit matter given the significant estimates involved in determining the preliminary fair values of the identifiable assets acquired and liabilities assumed.\nRefer to Note 2(e) and Note 4 to the consolidated financial statements for further information.\nOur procedures included the following:\n• We read the share purchase agreement and tested the appropriateness of the fair value of the purchase consideration.\n• We assessed the competency, objectivity and independence of the independent valuer engaged by the Group.\n• With input from internal valuation experts (where considered necessary), we performed the following procedures, in relation to the preliminary fair values of the identifiable net assets that formed part of the purchase price allocation, as deemed appropriate:\n- Considered the appropriateness of the methodology and assumptions used in determining the preliminary fair values based on the applicable financial reporting requirements and established market practice;\n- Compared certain key unobservable inputs underlying the preliminary fair values to supporting documentation such as approved financial plans; and\n- Evaluated the reasonableness of certain observable inputs and/or the resulting preliminary fair values based on comparable market data.\n• We considered the appropriateness of the related accounting policies and disclosures in the consolidated financial statements.\n\nIndependent auditor’s report to the shareholders of Saudi Arabian Oil Company (continued)\nKey audit matter How our audit addressed the key audit matter Assessment of recoverability of the goodwill and brand recognised as part of the SABIC acquisition IAS 36 ‘Impairment of Assets’, that is endorsed in Our procedures included the following:\nthe Kingdom of Saudi Arabia, requires goodwill and indefinite-lived intangible assets to be tested • We reviewed the appropriateness of annually, irrespective of whether there is any management’s provisional allocation of indication of impairment. goodwill to the Downstream operating segment and brand to the aggregation of the relevant Management performed an assessment of cash-generating units, based on the recoverability of the goodwill and brand requirements of IAS 36 ‘Impairment of assets’, recognised as part of the SABIC acquisition. The that is endorsed in the Kingdom of Saudi carrying amounts of these assets were SAR 99.1 Arabia.\nbillion and SAR 18.2 billion, respectively, at • We assessed the appropriateness of the assets\nDecember 31, 2020. and liabilities considered as part of the\nimpairment tests for the goodwill and brand.\nGoodwill has been provisionally allocated to the • With input from internal valuation experts Downstream operating segment. Therefore, the (where considered necessary), we performed goodwill impairment test was performed at the the following procedures on management’s Downstream operating segment level. The brand valuation models, as deemed appropriate:\ntest was performed based on an aggregation of the\n- Considered the consistency of certain relevant cash-generating units.\nunobservable inputs underlying the 1o-year cash flows such as expected product volumes The recoverable amounts were determined based and future operating and development costs on value-in-use calculations derived using with approved financial plans;\ndiscounted cash flow models. The models were\n- Compared a sample of forecast commodity based on the most recent financial plans and prices underlying the 10-year cash flows to included 10-year projection periods with terminal market data points;\nvalues assumed thereafter.\n- Evaluated the reasonableness of approved financial plans by comparison to historical The exercise performed supported the goodwill results;\nand brand carrying values and did not identify the\n- Assessed the reasonableness of the approach need for any impairment charges to be recognised.\nand inputs used to determine the terminal values;\nWe considered this to be a key audit matter given\n- Evaluated the reasonableness of the pre-tax the significant estimates involved in determining discount rates used by cross-checking the recoverable amounts and the uncertainty inherent underlying assumptions against observable in the underlying forecasts and assumptions. The market data;\nkey inputs to the recoverable amounts included\n- Tested the mathematical accuracy and the:\nlogical integrity of the models; and\n• Cash flows during the 10-year periods including - Tested management’s sensitivity analyses the underlying assumptions; that considered the impact of changes in\n• Terminal values; and assumptions on the outcome of the\n• Pre-tax discount rates. impairment assessments.\n• We', 'BlackRock Real Assets and Hassana Investment Company, acquiring a 49% stake in a newly formed subsidiary, Aramco Gas Pipelines Company (AGPC), for $15.5 billion.\nOperational Highlights\nIn 2022, Aramco’s average hydrocarbon production was 13.6 million barrels of oil equivalent per\nday (mmboed), including 11.5 million barrels per day (mmbpd) of total liquids.\nAramco continued its strong track record of supply reliability by delivering crude oil and other\nproducts with 99.9% reliability in 2022. It was the third year running that Aramco achieved this\nlevel of reliability.\n\nUpstream continues to execute its growth plans to promote long-term productivity of Saudi Arabia’s reservoirs and is proceeding with implementing the Government’s mandate to increase\nAramco’s crude oil MSC to 13.0 mmbpd by 2027.\nConstruction and engineering activities for the Marjan and Berri crude oil increments continue to progress, and are expected to add production capacity of 300,000 barrels per day (bpd) and\n250,000 bpd, respectively, by 2025.\nThe Zuluf crude oil increment is in the engineering phase, and is expected to provide a central\nfacility to process a total of 600,000 bpd of crude oil from the Zuluf field by 2026. Construction\nactivities are also continuing on the Dammam development project, which is expected to add\n25,000 bpd and 50,000 bpd of crude oil by 2024 and 2027, respectively.\nCompression projects at the Haradh and Hawiyah fields commenced commissioning activities and full capacity is expected to be reached in 2023. Construction at the Hawiyah Unayzah Gas Reservoir Storage, the first underground natural gas storage project in the Kingdom, is at an advanced stage and has commenced injection activities. The program is designed to provide up to 2.0 billion standard cubic feet per day of natural gas for reintroduction into the Kingdom’s\nMaster Gas System by 2024.\nAramco announced its final investment decision to participate in the development of a major integrated refinery and petrochemical complex in northeast China. The project presents an opportunity for Aramco to supply up to 210,000 bpd of crude oil feedstock to the complex. The transaction is subject to certain closing conditions, including regulatory approvals.\nIn August, Aramco signed an equity purchase agreement to acquire Valvoline Inc.’s global products business (Valvoline Global Products) for $2.65 billion. The strategic acquisition, which closed in March 2023, will complement Aramco’s line of premium branded lubricant products,\noptimize its global base oils production capabilities, and expand Aramco’s own R&D activities and partnerships with original equipment manufacturers.\nIn November, three transactions with Polish refiner and fuel retailer PKN ORLEN were completed, expanding Aramco’s presence in the European downstream sector. As part of the transaction,\nthe Company acquired equity stakes of 30% in a 210,000 bpd refinery in Gdańsk; 100% in an\nassociated wholesale business; and 50% in a jet fuel marketing joint venture.\n\nAramco and Total Energies made a final investment decision in December to construct a large petrochemical complex in Saudi Arabia. It will enable an existing SATORP refinery to advance Aramco’s liquids-to-chemicals strategy. The investment decision is subject to customary closing conditions and approvals.\nIn October, Aramco established a $1.5 billion Sustainability Fund to invest in technology needed to support a stable and inclusive energy transition. The fund plans to invest in technologies that support the Company’s announced Scope 1 and Scope 2 net-zero 2050 ambition in its wholly- owned operational assets, as well as development of new lower-carbon fuels.\nIn November, a joint development agreement between Aramco and the Ministry of Energy was signed to construct one of the largest planned carbon capture and storage hubs in the world in Jubail, Saudi Arabia, with a storage capacity of up to 9 million tons of carbon dioxide a year by 2027.\n\nAramco will discuss its full-year financial results for 2022 in an audio webcast on March 13,\n2023 at 3.30pm Riyadh / 12.30pm London / 8.30am New York. The webcast will be available at\nwww.aramco.com/investors.\n*Please refer to www.aramco.com/investors for reconciliation of non-IFRS measures Contact Information International Media Relations: international.media@aramco.com Investor Relations: investor.relations@aramco.com Aramco Disclaimer The press release contains forward-looking statements. All statements other than statements relating to historical or current facts included in the press release are forward-looking statements. Forward- looking statements give the Company’s current expectations and', 'jet fuel and diesel fuel. This acquisition is in line with Saudi Aramco’s strategy of expanding its Downstream portfolio, and strengthening its capabilities across the energy value chain. On increasing its ownership, Saudi Aramco remeasured its investment to fair value and recognized a gain of SAR 1,278, which is reflected in the Consolidated\nStatement of Income within finance and other income for the year ended December 31, 2019.\nThe transaction was accounted for using the acquisition method of accounting, which requires the assets acquired and liabilities assumed to be recognized at their fair value as of the acquisition date. If the acquisition had occurred on January 1, 2019, the\nconsolidated revenue of Saudi Aramco would have been an additional SAR 394 and net income would have been an additional SAR 47\nfor the year ended December 31, 2019. In determining these amounts, management has assumed that the fair value adjustments that\narose on the acquisition date would have been the same if the acquisition occurred on the first day of the accounting period.\nThe fair values of identifiable assets and liabilities have been determined by management, assisted by an independent valuer, as part of the purchase price allocation process.\nThe following table summarizes the goodwill and fair values of SASREF’s assets and liabilities acquired on September 18, 2019:\nCash and cash equivalents 1,233 Trade accounts receivable and other current assets 3,938\nInventories 1,260 Property, plant and equipment 5,461\nIntangible assets 57 Other non-current assets 385\nTrade and other payables (6,249)\nAccrued expenses and other current liabilities (866)\nDeferred tax liabilities (528)\nEmployee benefit obligations (298)\nLease liabilities (188)\nTotal identifiable net assets and liabilities at fair value 4,205 Goodwill 527\nTotal consideration 4,732 Acquisition date fair value of previously held interest (2,366)\nPurchase consideration 2,366 Acquisition and transaction costs of nil and SAR 2 for the years ended December 31, 2020 and 2019 were expensed as selling,\nadministrative and general in the Consolidated Statement of Income. The post-acquisition revenue of SAR 39 and net loss of SAR 925\nis included in the Consolidated Statement of Comprehensive Income for the year ended December 31, 2019.\n\n,13 rebmeceD dedne\n\nstnemetats laicnanfi detadilosno C\n\n35. Investments in affiliates continued (ii) Investment in Motiva Chemicals LLC (“Motiva Chemicals”)\nOn October 31, 2019, Motiva Enterprises LLC (“Motiva”), a wholly owned subsidiary of the Company, acquired 100% of the equity\ninterest in Flint Hills Resources Port Arthur LLC which was immediately re-named as Motiva Chemicals. Motiva Chemicals was acquired for total cash consideration of SAR 7,090. Motiva Chemicals owns and operates a chemical plant located in Port Arthur, Texas, comprised of a mixed feed cracker, a cyclohexane unit, a benzene unit, NGL and ethylene pipelines and storage facilities. The acquisition extends Motiva’s logistics capabilities, provides an early entry into petrochemicals and creates the opportunity to further improve planned chemicals projects.\nThe transaction was accounted for using the acquisition method of accounting, which requires the assets acquired and liabilities assumed to be recognized at their fair value as of the acquisition date. If the acquisition had occurred on January 1, 2019, the\nconsolidated revenue of Saudi Aramco would have been an additional SAR 2,928 and net loss would have been an additional SAR 28\nfor the year ended December 31, 2019.\nSaudi Aramco engaged an independent valuer in order to determine the fair value of the assets and liabilities of Motiva Chemicals.\nThe fair values of the identifiable assets and liabilities of Motiva Chemicals as of the date of acquisition are as follows:\nCash and cash equivalents 11 Accounts receivable and other assets 229\nInventories 266 Property, plant and equipment 6,263\nIntangible assets 544 Trade and other payables (184)\nPost-employment benefit obligations and provisions (39)\nTotal identifiable net assets at fair value/purchase consideration 7,090 Acquisition and transaction costs of nil and SAR 13 were expensed as selling, administrative and general in the Consolidated Statement\nof Income for the year ended December 31, 2020 and 2019. The post-acquisition revenue of SAR 372 and net loss of SAR 151 is\nincluded in the Consolidated Statement of Comprehensive Income for the year ended December 31, 2019.\n(b) Investments in joint ventures and associates (i) Investment in Tas’helat Marketing Company (“TMC”)\nOn June 17, 2019, Saudi Aramco Retail Company, a wholly owned subsidiary of the Company, and Total', ""and liabilities of Motiva Chemicals as at the date of acquisition are as follows:\nCash and cash equivalents 11 Accounts receivable and other assets 229\nInventories 266 Property, plant and equipment 6,263\nIntangible assets 544 Trade and other payables (184)\nPost-employment benefit obligations and provisions (39)\nTotal identifiable net assets at fair value/purchase consideration 7,090 Acquisition and transaction costs of SAR 13 were expensed as selling, administrative and general in the Consolidated Statement of Income for\nthe year ended December 31, 2019. The post-acquisition revenue of SAR 372 and net loss of SAR 151 is included in the Consolidated Statement\nof Comprehensive Income.\n(iv) ARLANXEO Holding B.V. (“ARLANXEO”)\nOn December 31, 2018, ARLANXEO, previously a joint venture between Saudi Aramco and LANXESS Deutschland GmbH (“LANXESS”),\nbecame a wholly owned subsidiary as a result of Saudi Aramco acquiring the remaining 50% equity interest in ARLANXEO. The initial 50% share\nacquisition was made on April 1, 2016. The transaction comprised the exchange of the ownership shares of LANXESS, including all the rights and obligations attached to the shares, and cash payments to LANXESS in the amount of SAR 6,106. As a result of this transaction, Saudi Aramco\nobtained the sole ownership of ARLANXEO, which consists of all the 15 subsidiaries (the full ownership of 14 subsidiaries and a 50% non-wholly\nowned interest in ARLANXEO-TSRC) that have 20 manufacturing sites in nine countries. This acquisition is in line with Saudi Aramco’s strategy of enabling further diversification of the downstream portfolio, and strengthening its capabilities across the energy and chemicals value chain.\nAs part of this transaction, Saudi Aramco’s equity investment in ARLANXEO of SAR 4,943, previously classified as Investment in joint ventures and associates in the Consolidated Balance Sheet, was remeasured to fair value which resulted in a gain of SAR 870 recognized in finance and\nother income for the year ended December 31, 2018.\nThe transaction was accounted for using the acquisition method of accounting which requires the assets acquired and liabilities assumed to be recognized at their fair value as of the acquisition date. If the acquisition had occurred on January 1, 2018, the consolidated revenue of\nSaudi Aramco would have been an additional SAR 14,288 and net income would have been reduced by share of net loss of SAR 98. In\ndetermining these amounts, management has assumed that the fair value adjustments that arose on the acquisition date would have been the same if the acquisition occurred on first day of accounting period.\nThe fair values of identifiable assets and liabilities have been determined by management, assisted by an independent valuer, as part of the purchase price allocation process, which has been concluded.\n\n33. Investments in affiliates continued The following table summarizes the goodwill and the fair values of ARLANXEO's assets and liabilities acquired on December 31, 2018:\nCash and cash equivalents 528 Accounts receivable and other assets 2,983\nInventories 3,112 Property, plant and equipment 9,725\nIntangible assets 268 Trade and other payables (2,396)\nBorrowings (511)\nPost-employment benefit obligations and provisions (1,038)\nOther liabilities (1,055)\nTotal identifiable net assets at fair value 11,616 Non-controlling interest (53)\nAcquisition date fair value of previously held interest (5,813)\nFair value of additional interest acquired on December 31, 2018 5,750\nGoodwill 191 Other adjustments 165\nNet purchase consideration 6,106 Acquisition and transaction costs of nil and SAR 10 were expensed as selling, administrative and general in the Consolidated Statement of\nIncome for the years ended December 31, 2019 and 2018, respectively.\n(b) Investment in joint operation\nOn March 28, 2018, Aramco Overseas Holdings Coöperatief U.A. (“AOHC”), a wholly owned subsidiary of The Company, acquired from Petronas\nRefinery and Petrochemical Corporation Sdn. Bhd. (“PETRONAS”) a 50% voting interest in Pengerang Refining Company Sdn. Bhd. (“PRefChem Refining”), and also acquired from Petronas Chemicals Group Berhad, a PETRONAS publicly traded affiliate, a 50% participation in Pengerang\nPetrochemical Company Sdn. Bhd. (“PRefChem Petrochemical”). The total cash consideration of the transactions amounted to SAR 3,534.\nIn addition, Saudi Aramco had acquired 50% of the subordinated""]","The acquired intangible values from the large chemicals transaction were highlighted by the auditor due to the requirement under IAS 36 ‘Impairment of Assets’ to test the recoverability of goodwill and indefinite-lived intangible assets annually, irrespective of whether there is any indication of impairment. 

During the audit, the auditor noted that:
- The carrying amounts of these assets, which include goodwill recognized as part of the acquisition, were significant, amounting to SAR 99.1 billion and SAR 18.2 billion for goodwill and brand, respectively, as of December 31, 2020.
- The assessment of recoverability involved substantial estimates, making it a key audit matter. The auditor assessed management’s valuation models and inputs used in the impairment tests, including cash flow forecasts and discount rates, to ensure the reliability of the values reported and to evaluate any potential impairment charges (Independent auditor’s report to the shareholders of Saudi Arabian Oil Company).","The auditor treated the recoverability of goodwill and brand from the SABIC acquisition as a key audit matter because the assets had large carrying values and required significant judgment in value-in-use models. The assessment used 10-year cash flow projections, terminal values, commodity assumptions, margins, and discount rates.",0.8461538461538461,0.8603325236199953,0.5178571428441964,0.5
How does Aramco prepare and review its reserve estimates?,"['gas, required to close facilities because of illness or securities. refined products and petrochemicals which has government restrictions, Aramco’s operations had, and may continue to have, a direct impact and business may be negatively affected.\non Aramco’s operations. In addition, the COVID-19 pandemic has resulted in volatility in global capital markets and investor sentiment, which may affect the availability, amount and type of financing available to Aramco.\n\nRisks related to Aramco’s operations and activities continued Estimates of proved Aramco’s reserve estimates conform to the or those utilized by D&M for the purposes of hydrocarbon reserves SPE-PRMS definitions and guidelines, which are preparing its certification letter, will prove to be depend on significant internationally recognized industry standards appropriate or accurate. Any significant deviation interpretations, promulgated by the Society of Petroleum from these interpretations, assumptions or assumptions and Engineers, the World Petroleum Council, the judgments could materially affect the estimated judgments. Any American Association of Petroleum Geologists, quantity or value of Aramco’s proved reserves.\nsignificant deviation the Society of Petroleum Evaluation Engineers, In addition, these estimates could change due or changes in existing the Society of Exploration Geophysicists, the to new information from production or drilling economic and Society of Petrophysicists and Well Log Analysts activities, changes in economic factors, including operating conditions and the European Association of Geoscientists changes in the price of hydrocarbons, changes to could affect the & Engineers. Reserve estimation is an inherently laws, regulations or the terms of the Concession estimated quantity complex process that principally relies on a or other events. Further, declining hydrocarbon and value of Aramco’s combination of knowledge, experience and prices may cause certain proved reserves to no proved reserves. judgment. Aramco’s and D&M’s estimates of longer be considered commercially viable, the quantity of Aramco’s proved hydrocarbon which could result in downward adjustments reserves depend on significant interpretations, to Aramco’s estimates of its proved reserves, assumptions and judgments relating to available impairment of its assets or changes to its capital geological, geophysical, engineering, expenditures and production plans. Moreover, contractual, economic and other information, proved reserve estimates are subject to change and take into account existing economic and due to errors in the application of published rules operating conditions and commercial viability and changes in guidance. Any material reduction as at the date the reserve estimates are made. in the quantity or value of Aramco’s proved reserves could adversely affect Aramco’s There can be no assurance that the business and reputation.\ninterpretations, assumptions and judgments utilized by Aramco to estimate proved reserves, The independent Aramco retained independent petroleum There is no independent third-party certification third-party consultants, D&M, to audit, as at December 31, letter with respect to the balance of the certification with 2021, reservoirs Aramco believes accounted for Kingdom’s proved oil equivalent reserves or as\nrespect to the approximately 85% of its proved oil reserves to at a more recent date than December 31, 2021.\nKingdom’s estimated which it has rights under the Concession and Any material deviation in the quantity of proved\nreserves does not remain to be produced after December 31, 2021, reserves could have a material adverse effect on\ncover the entirety but before December 31, 2077 (the end of the Aramco’s financial condition and reputation.\nof its reserves. initial 40-year term of the Concession plus the first 20-year extension). Aramco chose this scope\nbecause of the overall scale of the Kingdom’s reserves and the concentration of deposits in the major reservoirs that were assessed. Further independent assessment of the Kingdom’s smaller reservoirs would have taken several years to complete. D&M’s reserves estimation of 217.0 billion barrels of oil equivalent reserves for the reservoirs it evaluated was within the no material difference category (within 5% of Aramco’s internal estimation for the same reservoirs)\nfor the same Concession time period.\n\nRisk factors continued\n\nAramco could be Aramco insures against risk primarily by self- operations and certain of its operations are subject to losses insuring through its captive insurance subsidiary, insured separately from the rest of its business.\nfrom risks related to Stellar, which provides insurance exclusively to Furthermore, there can be no assurance that insufficient insurance. Aramco. Aramco also obtains insurance in certain Aramco can continue to renew its existing levels areas from third-party providers in excess of the of coverage on commercially acceptable terms, coverage provided through Stellar. or at all. As a result, it could incur significant losses from uninsured risks or risks for which Aramco does not insure against all risks and its insurance does not cover the entire loss.\nits insurance may not protect it against Any such losses could have a material adverse liability from all potential events, particularly effect on Aramco’s business, financial position catastrophic events such as major crude oil spills, and results of operations.\nenvironmental', 'amco’s capital expenditure plans could, in turn, have a material adverse effect on Aramco’s These challenges have led and could lead to growth objectives and its business, financial delays in the completion of projects and position and results of operations.\nincreased project costs. If projects are delayed, cost more than expected or do not generate the expected return, Aramco’s operations and expected levels of production could be impacted.\nThese occurrences could result in Aramco\n\n6. ADDITIONAL FINANCIAL 7. CONSOLIDATED\n\nAND STRATEGY PERFORMANCE 3. SUSTAINABILITY 4. RISK GOVERNANCE INFORMATION STATEMENTS Risk factors continued Risks related to Aramco’s operations and activities continued Estimates of proved Aramco’s reserve estimates conform to the or those utilized by D&M for the purposes of hydrocarbon reserves depend SPE-PRMS definitions and guidelines, which are preparing its certification letter, will prove to be The independent third-party Aramco retained independent petroleum 211.4 billion barrels of oil equivalent reserves for on significant interpretations, internationally recognized industry standards appropriate or accurate. Any significant deviation certification with respect to consultants, D&M, to certify, as at December 31, the reservoirs it evaluated was within the no assumptions and judgments. promulgated by the Society of Petroleum from these interpretations, assumptions or\nthe Kingdom’s estimated 2022, reservoirs Aramco believes accounted for material difference category (within 5% of Any significant deviation or Engineers, the World Petroleum Council, the judgments could materially affect the estimated reserves does not cover the approximately 85% of its proved oil reserves to Aramco’s internal estimation for the same changes in existing economic American Association of Petroleum Geologists, quantity or value of Aramco’s proved reserves. In\nentirety of its reserves. which it has rights under the Concession and reservoirs) for the same Concession time period. and operating conditions the Society of Petroleum Evaluation Engineers, addition, these estimates could change due to\nremain to be produced after December 31, 2022, could affect the estimated the Society of Exploration Geophysicists, the new information from production or drilling\nThere is no independent third-party certification but before December 31, 2077 (the end of the quantity and value of Society of Petrophysicists and Well Log Analysts, activities, future adjustments to MSC, changes in letter with respect to the balance of the initial 40-year term of the Concession plus the Aramco’s proved reserves. and the European Association of Geoscientists economic factors, including changes in the price\nKingdom’s proved oil equivalent reserves or as at first 20-year extension). Aramco chose this scope and Engineers. Reserve estimation is an of hydrocarbons, changes to laws, regulations or\na more recent date than December 31, 2022. Any\nbecause of the overall scale of the Kingdom’s inherently complex process that principally relies the terms of the Concession or other events.\nmaterial deviation in the quantity of proved reserves and the concentration of deposits in the on a combination of knowledge, experience and Further, declining hydrocarbon prices may cause reserves could have a material adverse effect on major reservoirs that were assessed. Further judgment. Aramco’s and D&M’s estimates of the certain proved reserves to no longer be Aramco’s financial condition and reputation.\nindependent assessment of the Kingdom’s quantity of Aramco’s proved hydrocarbon considered commercially viable, which could smaller reservoirs would have taken several years reserves depend on significant interpretations, result in downward adjustments to Aramco’s to complete. D&M’s reserves estimation of assumptions and judgments relating to available estimates of its proved reserves, impairment of its geological, geophysical, engineering, assets or changes to its capital expenditures and Aramco could be subject to Aramco insures against risk primarily by self- interruption insurance for disruptions to its contractual, economic and other information, production plans. Moreover, proved reserve losses from risks related to insuring through its captive insurance subsidiary, operations and certain of its operations are and take into account existing economic and estimates are subject to change due to errors in insufficient insurance. Stellar, which provides insurance exclusively to insured separately from the rest of its business. operating conditions and commercial viability as the application of published rules and changes in Aramco. Aramco also obtains insurance in certain Furthermore, there can be no assurance that at the date the reserve estimates are made. guidance. Any material reduction in the quantity areas from third-party providers in excess of the Aramco can continue to renew its existing levels There can be no assurance that the or value of Aramco’s proved reserves could coverage provided through Stellar. of coverage on commercially acceptable terms, or interpretations, assumptions and judgments adversely affect Aramco’s business and Aramco does not insure against all risks and its at all. As a result, it could incur significant losses utilized by Aramco to estimate proved reserves, reputation.\nfrom uninsured risks or risks for which its insurance', 'the Kingdom’s smaller may be limited by contract or the financial interpretations, assumptions and reservoirs would have taken several years viability of such subcontractor. Such judgments utilized by Aramco to estimate to complete. D&M’s reserves estimation occurrences could also interrupt Aramco’s proved reserves, or those utilized by of 214.2 billion barrels of oil equivalent operations, delay Aramco’s projects or D&M for the purposes of preparing its reserves for the reservoirs it evaluated damage its reputation, which could have certification letter, will prove to be was within 1% of Aramco’s internal a material adverse effect on its business. accurate. Any significant deviation from estimation for the same reservoirs for these interpretations, assumptions or the same Concession time period.\nFurthermore, the majority of Aramco’s judgments could materially affect the assets are located in the Kingdom and it estimated quantity or value of Aramco’s There is no independent third-party relies heavily on a cross country pipeline proved reserves. In addition, these certification letter with respect to the system and terminal facilities to transport estimates could change due to new balance of the Kingdom’s proved oil crude oil and products through the information from production or drilling equivalent reserves or as at a more\nKingdom. Aramco also depends on critical activities, changes in economic factors, recent date than December 31, 2019.\nassets to process its crude oil, such as the including changes in the price of Any material deviation in the quantity Abqaiq facility, which is its largest oil hydrocarbons, changes to laws, of proved reserves could have a processing facility and processes a regulations or the terms of the Concession material adverse effect on Aramco’s significant amount of Aramco’s daily or other events. Further, declining financial position.\nproduced crude oil. The East-West hydrocarbon prices may cause certain pipeline, the Shaybah NGL facility, the proved reserves to no longer be Aramco could be subject to losses Abqaiq facility and the Khurais processing considered commercially viable, which from risks related to insufficient facility have been subject to attacks could result in downward adjustments to insurance.\nwithin the last few years. If Aramco’s Aramco’s estimates of Aramco’s proved critical transport systems or processing reserves, impairment of Aramco’s assets facilities were subject to a significant or changes to Aramco’s capital Aramco insures against risk primarily by disruption, it could have a material expenditures and production plans. self-insuring through its captive insurance adverse effect on Aramco’s business, Moreover, proved reserves estimates subsidiary, Stellar, which provides financial position and results of are subject to change due to changes in insurance exclusively to Aramco. Aramco operations. See risk — Terrorism and published rules or changes in guidelines. also obtains insurance in certain areas armed conflict may materially and Any material reduction in the quantity or from third-party providers in excess of adversely affect Aramco. value of Aramco’s proved reserves could the coverage provided through Stellar.\nadversely affect Aramco’s business.\nAramco does not insure against all risks Estimates of proved hydrocarbon and its insurance may not protect it reserves depend on significant The independent third-party against liability from all potential events, interpretations, assumptions and certification letter does not cover particularly catastrophic events such as judgments. Any significant the entirety of the Kingdom’s major crude oil spills, environmental deviation or changes in existing estimated reserves. disasters, terrorist attacks or acts of war.\nIn addition, it does not maintain business economic and operating conditions interruption insurance for disruptions to could affect the estimated quantity Aramco retained independent petroleum its operations and certain of its operations consultants, D&M, to independently and value of Aramco’s proved are insured separately from the rest of its\nevaluate, as at December 31, 2019,\nreserves. business. Furthermore, there can be no reservoirs Aramco believes accounted for assurance that Aramco can continue to approximately 85% of its proved oil renew its existing levels of coverage on Aramco’s reserve estimates conform to reserves to which it has rights under the commercially acceptable terms, or at all.\nthe SPE-PRMS definitions and guidelines, Concession and remain to be produced As a result, it could incur significant\nwhich are internationally recognized after December 31, 2019, but before\nlosses from uninsured risks or risks for industry standards. Aramco’s and D&M’s December 31, 2077 (the end of the initial which its insurance does not cover the estimates of the quantity of Aramco’s 40-year term of the Concession plus the\nentire loss. Any such losses could have proved hydrocarbon reserves depend on first 20-year extension). Aramco chose this a material adverse effect on Aramco’s significant interpretations, assumptions scope because of the overall scale of the business, financial position and results and judgments relating to available Kingdom’s reserves and the concentration of operations.\ngeological, geophysical, engineering, of deposits in', 'are established. All such capitalized costs are not subject to amortization, but at each reporting date are subject to regular technical and management review to confirm the continued intent to develop, or otherwise extract value from the well. Where such intent no longer exists, the costs are written off to exploration in the consolidated statement of income. Capitalized exploratory expenditures are, at each reporting date, subject to review for impairment indicators.\nWhen proved reserves of hydrocarbons are determined and there is a firm plan for development approved by management, the relevant capitalized costs are transferred to property, plant and equipment.\n(g) Property, plant and equipment Property, plant and equipment is stated on the consolidated balance sheet at cost less accumulated depreciation and impairment losses, if any. Cost includes expenditures directly attributable to the construction and/or acquisition of the asset (Note 2(s)). Land and construction-in-progress are not depreciated. When a construction-in-progress asset is deemed available for use as intended by management, depreciation commences.\nSubsequent expenditures including major renovations are included in an asset’s carrying amount, or recognized as a separate asset only when it is probable that future economic benefits associated with the item will flow to Saudi Aramco and the cost of the item can be measured reliably. The carrying amount of the replaced item is derecognized. All other repair and maintenance expenditures are expensed as incurred. The present value of the expected cost for the decommissioning of an asset after its use is included in the cost of the respective asset if the recognition criteria for a provision are met (Note 2(v)).\nWhere the life of expected hydrocarbon reserves substantially exceeds the economic or technical lives of the underlying assets, the straight-line method of depreciation is used. The unit of production method is used for fields where the expected reserve life is approximately equal to or less than the estimated useful lives of the underlying assets. Depletion rates are calculated on the basis of a group of wells or fields with similar characteristics based on proved developed reserves. The estimation of expected reserve lives reflects management’s assessment of proved developed reserves and the related depletion strategy on a field-by-field basis. Depreciation expense on all other assets is calculated using the straight-line method to allocate the cost less residual values over the estimated useful lives. Depreciation expense is recorded in the consolidated statement of income.\nDepreciation expense is calculated after determining an estimate of an asset’s expected useful life and the expected residual value at the end of its useful life. The useful lives and residual values are determined by management at the time the asset is initially recognized and are reviewed annually for appropriateness or when events or conditions occur that impact capitalized costs, hydrocarbon reserves, residual values or estimated useful lives.\nCONSOLIDATED FINANCIASAL USTDAI TAERMAEMNCTOS 2| 0A2N3N |U ASAL URDEPI OARRAT M20C2O3 12711\nAND LEGAL\nINFORMATION | 7. CONSOLIDATED\n\nNotes to the consolidated financial statements continued All amounts in millions of Saudi Riyals unless otherwise stated 2. Material accounting policy information and significant judgments and estimates continued (g) Property, plant and equipment continued The estimated useful lives or, for right-of-use assets the lease term, if shorter (Note 2(i)), in years, of principal groups of depreciable assets is as follows:\nLand and land improvements 3 to 54 Buildings 5 to 50\nOil and gas properties 15 to 30\nPlant, machinery and equipment 2 to 52 Depots, storage tanks and pipelines 4 to 30\nFixtures, IT and office equipment 2 to 20 Gains and losses on disposals of depreciable assets are recognized in net income.\n(h) Impairment of non-financial assets At each reporting date, Saudi Aramco assesses, whether there are any indications that a non-financial asset with a definite life might be impaired. Assets with indefinite useful lives, such as goodwill and brands acquired on acquisition of certain subsidiaries, are reviewed for impairment on an annual basis. If an indication of impairment exists, or when annual impairment testing for an asset is required, the asset’s recoverable amount is estimated. An impairment loss is recognized for the amount by which the asset’s carrying amount exceeds its recoverable amount. The recoverable amount is the higher of an asset’s fair value less costs of disposal or value in use (“VIU”). The fair value less costs of disposal calculation is based on either, post-tax discounted cash flow models or available data from binding arm’s length sales transactions for similar assets, or observable market prices less incremental costs of disposing of the asset. The VIU calculation is based on a post-tax risk adjusted discounted cash flow model. The use of post-tax discount rates in determining VIU does not result in a materially different determination of the need for, or the amount of, impairment that would be required if pre-tax discount rates had been used.\nImpairment losses are recognized as a component of net income', 'hydrocarbons are found, these costs continue to be capitalized subject to further appraisal activities that would determine the commercial viability and technical feasibility of the reserves. If potentially commercial quantities of hydrocarbons have not been found, and no alternative use of the well is determined, the previously capitalized costs are written off to exploration in the consolidated statement of income.\nExploratory wells remain capitalized while additional appraisal drilling on the potential oil and/or gas field is performed or while optimum development plans are established. All such capitalized costs are not subject to amortization, but at each reporting date are subject to regular technical and management review to confirm the continued intent to develop, or otherwise extract value from the well. Where such intent no longer exists, the costs are written off to exploration in the consolidated statement of income. Capitalized exploratory expenditures are, at each reporting date, subject to review for impairment indicators.\nWhen proved reserves of hydrocarbons are determined and there is a firm plan for development approved by management, the relevant capitalized costs are transferred to property, plant and equipment.\n(g) Property, plant and equipment Property, plant and equipment is stated on the consolidated balance sheet at cost less accumulated depreciation and impairment losses, if any. Cost includes expenditures directly attributable to the construction and/or acquisition of the asset (Note 2(s)). Land and construction- in-progress are not depreciated. When a construction-in-progress asset is deemed available for use as intended by management, depreciation commences.\nSubsequent expenditures including major renovations are included in an asset’s carrying amount, or recognized as a separate asset only when it is probable that future economic benefits associated with the item will flow to Saudi Aramco and the cost of the item can be measured reliably. The carrying amount of the replaced item is derecognized. All other repair and maintenance expenditures are expensed as incurred. The present value of the expected cost for the decommissioning of an asset after its use is included in the cost of the respective asset if the recognition criteria for a provision are met (Note 2(v)).\nWhere the life of expected hydrocarbon reserves substantially exceeds the economic or technical lives of the underlying assets, the straight-line method of depreciation is used. The unit of production method is used for fields where the expected reserve life is approximately equal to or less than the estimated useful lives of the underlying assets. Depletion rates are calculated on the basis of a group of wells or fields with similar characteristics based on proved developed reserves. The estimation of expected reserve lives reflects management’s assessment of proved developed reserves and the related depletion strategy on a field-by-field basis. Depreciation expense on all other assets is calculated using the straight-line method to allocate the cost less residual values over the estimated useful lives.\nDepreciation expense is recorded in the consolidated statement of income.\nDepreciation expense is calculated after determining an estimate of an asset’s expected useful life and the expected residual value at the end of its useful life. The useful lives and residual values are determined by management at the time the asset is initially recognized and are reviewed annually for appropriateness or when events or conditions occur that impact capitalized costs, hydrocarbon reserves, residual values or estimated useful lives.\n\nNotes to the consolidated financial statements continued All amounts in millions of Saudi Riyals unless otherwise stated 2. Material accounting policy information and significant judgments and estimates continued (g) Property, plant and equipment continued The estimated useful lives or, for right-of-use assets the lease term, if shorter (Note 2(i)), in years, of principal groups of depreciable assets is as follows:\nLand and land improvements 3 to 54 Buildings 5 to 50\nOil and gas properties 15 to 30\nPlant, machinery and equipment 2 to 52 Depots, storage tanks and pipelines 4 to 30\nFixtures, IT and office equipment 2 to 20 Gains and losses on disposals of depreciable assets are recognized in net income.\n(h) Impairment of non-financial assets At each reporting date, Saudi Aramco assesses, whether there are any indications that a non-financial asset with a definite life might be impaired. Assets with indefinite useful lives, such as goodwill and brands acquired on acquisition of certain subsidiaries, are reviewed for impairment on an annual basis. If an indication of impairment exists, or when annual impairment testing for an asset is required, the asset’s recoverable amount is estimated. An impairment loss is recognized for the amount by which the asset’s carrying amount exceeds its recoverable amount. The recoverable amount is the higher of an asset’s fair value less costs of disposal or value in use (“VIU”). The fair value less costs of disposal calculation is based on either, post-tax discounted cash flow models or available data from binding arm’s length sales transactions for similar assets, or observable market prices less incremental costs of disposing of the asset. The VIU calculation is based on a post-tax risk adjusted discounted cash flow model. The use of post-tax discount rates in determining VIU does not result in a materially different determination of the need for', 'be capitalized subject to further appraisal activities that would determine the commercial viability and technical feasibility of the reserves. If potentially commercial quantities of hydrocarbons have not been found, and no alternative use of the well is determined, the previously capitalized costs are written off to exploration in the consolidated statement of income.\nExploratory wells remain capitalized while additional appraisal drilling on the potential oil and/or gas field is performed or while optimum development plans are established. All such capitalized costs are not subject to amortization, but at each reporting date are subject to regular technical and management review to confirm the continued intent to develop, or otherwise extract value from the well. Where such intent no longer exists, the costs are written off to exploration in the consolidated statement of income. Capitalized exploratory expenditures are, at each reporting date, subject to review for impairment indicators.\nWhen proved reserves of hydrocarbons are determined and there is a firm plan for development approved by management, the relevant capitalized costs are transferred to property, plant and equipment.\n(h) Property, plant and equipment Property, plant and equipment is stated on the consolidated balance sheet at cost less accumulated depreciation and impairment losses, if any. Cost includes expenditures directly attributable to the construction and/or acquisition of the asset (Note 2(s)). Land and construction-in-progress are not depreciated. When a construction-in-progress asset is deemed available for use as intended by management, depreciation commences.\nSubsequent expenditures including major renovations are included in an asset’s carrying amount, or recognized as a separate asset only when it is probable that future economic benefits associated with the item will flow to Saudi Aramco and the cost of the item can be measured reliably. The carrying amount of the replaced item is derecognized. All other repair and maintenance expenditures are expensed as incurred. The present value of the expected cost for the decommissioning of an asset after its use is included in the cost of the respective asset if the recognition criteria for a provision are met (Note 2(v)).\nWhere the life of expected hydrocarbon reserves substantially exceeds the economic or technical lives of the underlying assets, the straight-line method of depreciation is used. The unit of production method is used for fields where the expected reserve life is approximately equal to or less than the estimated useful lives of the underlying assets. Depletion rates are calculated on the basis of a group of wells or fields with similar characteristics based on proved developed reserves. The estimation of expected reserve lives reflects management’s assessment of proved developed reserves and the related depletion strategy on a field-by- field basis. Depreciation expense on all other assets is calculated using the straight-line method to allocate the cost less residual values over the estimated useful lives. Depreciation expense is recorded in the consolidated statement of income.\nDepreciation expense is calculated after determining an estimate of an asset’s expected useful life and the expected residual value at the end of its useful life. The useful lives and residual values are determined by management at the time the asset is initially recognized and are reviewed annually for appropriateness or when events or conditions occur that impact capitalized costs, hydrocarbon reserves, residual values or estimated useful lives.\n\nAll amounts in millions of Saudi Riyals unless otherwise stated\n\n2. Summary of significant accounting policies, judgments and estimates continued (h) Property, plant and equipment continued The estimated useful lives or, for right-of-use assets the lease term, if shorter (Note 2(j)), in years, of principal groups of depreciable assets is as follows:\nLand and land improvements 3 to 54 Buildings 5 to 50\nOil and gas properties 15 to 30\nPlant, machinery and equipment 2 to 52 Depots, storage tanks and pipelines 4 to 30\nFixtures, IT and office equipment 2 to 20 Gains and losses on disposals of depreciable assets are recognized in net income.\n(i) Impairment of non-financial assets Saudi Aramco assesses, at each reporting date, whether there is an indication that a non-financial asset may be impaired except that assets with indefinite useful lives such as goodwill and brand acquired on acquisition of SABIC in 2020 are reviewed for impairment on an annual basis. If an indication exists, or when annual impairment testing for an asset is required, the asset’s recoverable amount is estimated. An impairment loss is recognized for the amount by which the asset’s carrying amount exceeds its recoverable amount. The recoverable amount is the higher of an asset’s fair value less costs of disposal or value in use (“VIU”).\nThe fair value less costs of disposal calculation is based on either, post-tax discounted cash flow models or available data from binding arm’s length sales transactions for similar assets, or observable market prices less incremental costs for disposing of the asset. The VIU calculation is based on a post-tax risk adjusted discounted cash flow model. The use of post-tax discount rates in determining VIU does not result in a materially different determination of the need for, or the amount of, impairment that would be required if pre-tax discount rates had been', 'Reserves as at December 31, 2020 195,444 3,399 191,573 31,086 25,226 255,155\nReserves as at December 31, 2019 198,569 3,338 190,575 30,933 25,723 258,563\nThe following table sets forth the Kingdom’s estimates of its proved reserves in the fields Aramco operates as at December 31, 2020 and 2019.\nNatural gas Crude oil Condensate NGL Combined (mmbbl) (mmbbl) (bscf) (mmboe) (mmbbl) (mmboe)\nReserves as at December 31, 2020 257,063 4,493 238,838 39,345 35,971 336,872\nReserves as at December 31, 2019 257,125 4,410 237,368 39,119 36,043 336,697\nAramco’s reserve estimates conform to the SPE-PRMS definitions and guidelines, which is the internationally recognized industry standard sponsored by the Society of Petroleum Engineers, the American Association of Petroleum Geologists, the World Petroleum Council, the Society of Petroleum Evaluation Engineers, the Society of Exploration Geophysicists, the Society of Petrophysicists and Well Log Analysts and the European Association of Geoscientists and Engineers. To estimate or update Aramco’s reserve estimates, the Upstream segment employees responsible for reserves calculations perform technical analyses that are reviewed internally by progressively higher levels of management until finalized at year-end. Aramco annually updates its estimates as it acquires and interprets new data. For reservoirs that have been producing and have established certain performance trends, Aramco is typically able to reliably forecast the reservoir’s future production. For reservoirs that have little to no production history and new discoveries, Aramco undertakes further analysis in addition to multidisciplinary evaluation to formulate production forecasts.\nnotiamrofni lagel\n\nlaicnanfi lanotiiddA\n\nRegulation of the oil and gas industry in the Kingdom The following paragraphs summarize certain key regulation and legislation to which Aramco is subject as an operator in the oil and gas industry.\nLaw on hydrocarbons Overview\nThe Hydrocarbons Law was enacted by Royal Decree No. M/37, dated 2/4/1439H (corresponding to December 20, 2017) and applies to\nhydrocarbons, hydrocarbon resources and the hydrocarbon operations existing within the territory of the Kingdom.\nLicenses No hydrocarbon operations can be conducted in the Kingdom without obtaining a license in accordance with the Hydrocarbons Law.\nThe Government grants licenses related to hydrocarbon operations pursuant to regulations, procedures and policies established from time to time, which outline the terms and conditions relating to the granting of a license.\nThe grant of a license pursuant to the Hydrocarbons Law does not, and cannot, confer any right of ownership of the soil or subsoil in the license area. In addition, the Government retains the right to explore for and exploit any natural resource other than hydrocarbons in the license area and may exercise such right in a manner that does not prejudice the licensee’s rights and does not hinder the hydrocarbon operations conducted by a licensee.\nOwnership rights Under the Hydrocarbons Law, the Kingdom exercises sovereignty over all hydrocarbon deposits, hydrocarbons and hydrocarbon resources. All hydrocarbons in the Kingdom are owned by the Kingdom and, upon extraction or recovery of such hydrocarbons by the licensee, title to such hydrocarbons shall automatically pass to the licensee at the ownership transfer point. The Kingdom’s ownership of hydrocarbon deposits and hydrocarbon resources may not be transferred.\nSupervision and implementation of the Hydrocarbons Law The Ministry of Energy is the only body responsible for implementing the Hydrocarbons Law and overseeing all aspects of a licensee’s hydrocarbons operations, including the licensee’s technical operations and the review of all the licensee’s revenues and expenses.\nThe Ministry of Energy acts as a liaison between relevant bodies and the licensee in relation to a license. The Ministry of Energy is also responsible for preparing and overseeing the national strategies and policies related to hydrocarbons to ensure the implementation, development and appropriate use of hydrocarbon resources, and conservation of the Kingdom’s hydrocarbon reserves for future generations.\nProduction decisions The Kingdom has the sovereign, exclusive and binding authority to make production decisions related to both the maximum level of hydrocarbons that a licensee can produce at any given point in time and the level of MSC that a licensee must maintain. In each case, the Kingdom shall take into account the Kingdom’s economic development, environment conservation, national security, political and developmental goals, foreign policy, diplomatic considerations, domestic energy needs, public interest and any other sovereign interest when making a production decision. In setting the level of MSC, consideration shall be given to the economic or operational', 'geological and geophysical costs are recognized as an expense when incurred and exploration costs associated with exploratory wells are initially capitalized on the Consolidated Balance Sheet as an intangible asset until the drilling of the well is complete and the results have been evaluated. If potential commercial quantities of hydrocarbons are found, these costs continue to be capitalized subject to further appraisal activities that would determine the commercial viability and technical feasibility of the reserves. If potentially commercial quantities of hydrocarbons have not been found, and no alternative use of the well is determined, the previously capitalized costs are written off to exploration in the Consolidated Statement of Income.\nExploratory wells remain capitalized while additional appraisal drilling on the potential oil and/or gas field is performed or while optimum development plans are established. All such capitalized costs are not subject to amortization, but at each reporting date are subject to regular technical and management review to confirm the continued intent to develop, or otherwise extract value from the well. Where such intent no longer exists, the costs are written off to exploration in the Consolidated Statement of Income.\nCapitalized exploratory expenditures are, at each reporting date, subject to review for impairment indicators.\nWhen proved reserves of hydrocarbons are determined and there is a firm plan for development approved by management, the relevant capitalized costs are transferred to property, plant and equipment.\n(g) Property, plant and equipment Property, plant and equipment is stated on the Consolidated Balance Sheet at cost less accumulated depreciation and impairment losses, if any. Cost includes expenditures directly attributable to the construction and/or acquisition of the asset (Note 2(r)). Land and construction-in-progress are not depreciated. When a construction-in-progress asset is deemed available for use as intended by management, depreciation commences.\nSubsequent expenditures including major renovations are included in an asset’s carrying amount, or recognized as a separate asset only when it is probable that future economic benefits associated with the item will flow to Saudi Aramco and the cost of the item can be measured reliably. The carrying amount of the replaced item is derecognized. All other repair and maintenance expenditures are expensed as incurred. The present value of the expected cost for the decommissioning of an asset after its use is included in the cost of the respective asset if the recognition criteria for a provision are met (Note 2(u)).\nWhere the life of expected hydrocarbon reserves substantially exceeds the economic or technical lives of the underlying assets, the straight-line method of depreciation is used. The unit of production method is used for fields where the expected reserve life is approximately equal to or less than the estimated useful lives of the underlying assets. Depletion rates are calculated on the basis of a group of wells or fields with similar characteristics based on proved developed reserves. The estimation of expected reserve lives reflects management’s assessment of proved developed reserves and the related depletion strategy on a field-by-field basis.\nDepreciation expense on all other assets is calculated using the straight-line method to allocate the cost less residual values over the estimated useful lives. Depreciation expense is recorded in the Consolidated Statement of Income.\nDepreciation expense is calculated after determining an estimate of an asset’s expected useful life and the expected residual value at the end of its useful life. The useful lives and residual values are determined by management at the time the asset is initially recognized and are reviewed annually for appropriateness or when events or conditions occur that impact capitalized costs, hydrocarbon reserves or estimated useful lives.\nAs of January 1, 2021, Saudi Aramco changed the presentation of the groups of assets under property, plant and equipment. The new presentation is consistent with the generally accepted practice of presenting assets based on their nature as compared to the business function where they are used in the company’s operations. This change has no current or future impact on the total reported carrying values, estimated useful lives or depreciation expense.\nSaudi Arabian Oil Company | Consolidated financial statements for the year ended December 31, 2021 18\n\nNotes to the consolidated financial statements continued All amounts in millions of Saudi Riyals unless otherwise stated 2. Summary of significant accounting policies, judgments and estimates continued The estimated useful lives or, the lease term, if shorter, for right of use assets (Note 2(i)) in years of principal groups of depreciable assets based on the revised presentation is as follows:\nLand and land improvements 3 to 30 Buildings 5 to 50\nOil and gas properties 15 to 30\nPlant, machinery and equipment 2 to 50 Depots, storage tanks and pipelines 4 to 30\nFixtures, IT and office equipment 2 to 20 The estimated useful lives or, the lease term, if shorter, for right-of-use assets (Note 2(i)), in years of the principal groups of depreciable assets for the previous presentation is set forth below:\nCrude oil facilities:\nPipelines and storage tanks 12 to 23\nDrilling and construction equipment 5 to 25\nOil and gas properties 15 to 30\nMarine equipment 13 to', 'orial waters. Based on Saudi Aramco’s reserve data, as at December 31, 2019, Saudi Aramco’s oil equivalent reserves were sufficient for\nproved reserves life of 52 years.\nThe increase in the 2019 Concession reserves compared to 2018 is partly attributable to Saudi Aramco conducting 44 simulation studies, which resulted in reserves additions in some of the existing and producing fields. In addition, portfolio production optimization and latest advanced technology implementation led to a further increase in reserves.\nSaudi Aramco manages the Kingdom’s unique reserves and resources base to optimize production and maximize long-term value pursuant to the Hydrocarbons Law, which mandates that Saudi Aramco’s hydrocarbon operations promote long-term productivity of the Kingdom’s reservoirs and support the prudent stewardship of its hydrocarbon resources. Saudi Aramco has historically replaced reserves on an organic basis through revisions of reserve estimates at existing fields and through delineation and exploration to identify new fields. As a result, the Kingdom’s estimated proved reserves at the largest oil fields operated by Saudi Aramco have increased since the time of original production.\nThe following table sets forth Saudi Aramco’s estimates of its proved reserves of crude oil, condensate, natural gas and NGLs based on the term\nof the Concession as at December 31, 2019 and 2018.\nNatural gas Crude oil Condensate NGLs Combined (mmbbl) (mmbbl) (bscf) (mmboe) (mmbbl) (mmboe)\nReserves as at December 31, 2019 198,569 3,338 190,575 30,933 25,723 258,563\nReserves as at December 31, 2018 198,194 3,191 185,726 30,120 25,385 256,890\nThe following table sets forth the Kingdom’s estimates of its proved reserves of crude oil, condensate, natural gas and NGLs in the fields\nSaudi Aramco operates as at December 31, 2019 and 2018.\nNatural gas Crude oil Condensate NGLs Combined (mmbbl) (mmbbl) (bscf) (mmboe) (mmbbl) (mmboe)\nReserves as at December 31, 20191 257,125 4,410 237,368 39,119 36,043 336,697\nReserves as at December 31, 2018 257,270 4,257 233,766 38,519 36,144 336,190\n1. Total “raw” natural gas reserves additions of 9.2 tscf in 2019, comprising 7.6 tscf of non-associated gas and 1.6 tscf of associated gas.\nnoitamrofni lagel\n\nlaicnanfi lanoitidda\n\nSaudi Aramco’s reserve estimates conform to the SPE-PRMS definitions and guidelines, which is the internationally recognized industry standard sponsored by the Society of Petroleum Engineers, the American Association of Petroleum Geologists, the World Petroleum Council, the Society of Petroleum Evaluation Engineers, the Society of Exploration Geophysicists, the Society of Petrophysicists and Well Log Analysts and the European Association of Geoscientists and Engineers. To estimate or update Saudi Aramco’s reserve estimates, the Upstream segment employees responsible for reserves calculations perform technical analyses that are reviewed internally by progressively higher levels of management until finalized at year-end. Saudi Aramco annually updates its estimates as it acquires and interprets new data. For reservoirs that have been producing and have established certain performance trends, Saudi Aramco is typically able to reliably forecast the reservoir’s future production. For reservoirs that have little to no production history and new discoveries, Saudi Aramco undertakes further analysis in addition to multidisciplinary evaluation to formulate production forecasts.\n\nRegulation of the oil and gas industry in the Kingdom The following paragraphs summarize certain key regulation and legislation to which Saudi Aramco is subject as an operator in the oil and gas industry.\nLaw on hydrocarbons Overview\nThe Hydrocarbons Law was enacted by Royal Decree No. M/37, dated 2/4/1439H (corresponding to December 20, 2017) and applies to\nhydrocarbons, hydrocarbon resources and the hydrocarbon operations existing within the territory of the Kingdom.\nLicenses No hydrocarbon operations can be conducted in the Kingdom without obtaining a license in accordance with the Hydrocarbons Law. The Government grants licenses related to hydrocarbon operations pursuant to regulations, procedures and policies established from time to time, which outline the terms and conditions relating to the granting of a license.\nThe grant of a license pursuant to the Hydrocarbons Law does not, and cannot, confer any right of ownership of the', 'optimize production and maximize long-term value pursuant\nto the Hydrocarbons Law, which mandates that Aramco’s hydrocarbon operations promote long-term productivity of the Kingdom’s\nOther financing arrangements 36,270 11 to 25 years – 36,270 2028 - 2046\nreservoirs and support the prudent stewardship of its hydrocarbon resources. Aramco has historically replaced reserves on an organic\n304,127 (148,134) 290,147 basis through revisions of reserve estimates at existing fields and through delineation and exploration to identify new fields. As a result,\nthe Kingdom’s estimated proved reserves at the largest oil fields operated by Aramco have increased since the time of original 1. Includes total facility amounts and carrying amounts for certain long-term loans being repaid in installments. production.\n2. In 2023, the Company made payments in the amount of SAR 59.0 billion ($15.7 billion), SAR 41.3 billion ($11.0 billion), and SAR 16.7 billion ($4.5 billion), resulting in the full settlement of\nthe deferred consideration. The following table sets forth Aramco’s estimates of its proved reserves based on the term of the Concession as at December 31, 2023 and 2022.\nCrude Oil and Condensate Natural Gas NGL Combined (mmbbl) (bscf) (mmboe) (mmbbl) (mmboe)\nReserves as at December 31, 2023 191,349 207,450 33,822 26,024 251,195\nReserves as at December 31, 2022 200,803 201,905 32,826 25,153 258,782\nThe following table sets forth the Kingdom’s estimates of its proved reserves in the fields Aramco operates as at December 31, 2023 and 2022.\nCrude Oil and Condensate Natural Gas NGL Combined (mmbbl) (bscf) (mmboe) (mmbbl) (mmboe)\nReserves as at December 31, 2023 261,677 252,567 41,696 37,395 340,768\nReserves as at December 31, 2022 261,623 246,738 40,665 36,146 338,434\nAramco’s reserve estimates conform to the SPE-PRMS definitions and guidelines, which are the internationally recognized industry standard sponsored by the Society of Petroleum Engineers, the American Association of Petroleum Geologists, the World Petroleum Council, the Society of Petroleum Evaluation Engineers, the Society of Exploration Geophysicists, the Society of Petrophysicists and Well Log Analysts, and the European Association of Geoscientists and Engineers. To estimate or update Aramco’s reserve estimates, the Upstream segment employees responsible for reserves calculations perform technical analyses that are reviewed internally by progressively higher levels of management until finalized at year end. Aramco annually updates its estimates as it acquires and interprets new data. For reservoirs that have been producing and have established certain performance trends, Aramco is typically able to reliably forecast the reservoir’s future production. For reservoirs that have little to no production history and new discoveries, Aramco undertakes further analysis in addition to multidisciplinary evaluation to formulate production forecasts.\n6.ADDITIONAL FINANCIAL 7.CONSOLIDATED\n\nAND STRATEGY PERFORMANCE 3. SUSTAINABILITY 4. RISK GOVERNANCE INFORMATION STATEMENTS Additional legal information Aramco • Certain rights related to lands, such as use of land, easements, water rights, right-of-way, and other suitable rights of any part of the Concession Areas, that are outside the Reserved Area, designated in connection with Aramco’s operations and transportation of The Company was established in the Kingdom as a company with limited liability by virtue of Royal Decree No. M/8 dated 4/4/1409H products and free access to and use of any part of the Reserved Area;\n(corresponding to November 13, 1988) to assume the privileges and rights of the Arabian American Oil Company. On January 1, 2018,\nthe Company was converted into a Saudi joint stock company pursuant to Council of Ministers Resolution No. 180 dated 1/4/1439H • The right to purchase, lease, import or otherwise obtain all materials, equipment, and any other supplies necessary for\n(corresponding to December 19, 2017) and registered in the city of Dhahran under commercial registration No. 2052101150 dated Aramco’s operations;\n11/07/1439H (corresponding to March 28, 2018) with Saudi Arabian Oil Company as its official name. Its registered head office is located\nat P.O. Box 5000, Dhah']","Aramco prepares and reviews its reserve estimates through the following process:

- **Technical Analyses**: Employees within the Upstream segment responsible for reserves calculations perform technical analyses.

- **Internal Review**: These analyses are reviewed internally by progressively higher levels of management to ensure accuracy and compliance.

- **Annual Updates**: Aramco annually updates its estimates based on the acquisition and interpretation of new data.

- **Production Forecasting**: For reservoirs with established performance trends, Aramco can reliably forecast future production. For new discoveries with little or no production history, additional analyses and multidisciplinary evaluations are conducted to formulate production forecasts.

This process ensures that Aramco's reserve estimates conform to internationally recognized industry standards, specifically the SPE-PRMS definitions and guidelines (Saudi Aramco Consolidated Financial Statements).","Aramco’s reserve estimates follow SPE-PRMS definitions and guidelines. Upstream employees perform technical analyses that are reviewed through higher management levels, and the estimates are updated annually as new data is acquired and interpreted.",0.75,0.9999997578746292,0.7878306878175574,1.0
How did Aramco finish paying the deferred amount owed for the chemicals stake bought from the public investment fund?,"[""bonus share for every 10 shares they hold.\nAgainst a backdrop of higher prices for our upstream products and better margins in our Downstream business, we take a long-term view while delivering on our strategic objectives.\nWe are maintaining a highly-disciplined and flexible approach to capital allocation Reducing emissions from energy production as we expand our business so our customers will continue to have access to and use, while at the same time satisfying the the reliable energy they need to support the growth they desire. In Upstream, we world’s growing energy requirements, is the are working on increasing our Maximum Sustainable Capacity as per the biggest dual challenge facing our industry.”\nGovernment’s direction. In Downstream, we are growing and diversifying our operations while also integrating SABIC as Aramco's chemicals arm.\n\nAramco Creating value for shareholders Tackling the climate challenge Our continued success would also not be and society In step with the Saudi Green Initiative, possible without the visionary leadership of the Custodian of the Two Holy Mosques The improved market sentiment provided the Company announced its ambition King Salman bin Abdulaziz Al-Saud, and us with an excellent opportunity to unlock to achieve net-zero Scope 1 and Scope 2 His Royal Highness Prince Mohammed further value from Aramco’s asset base greenhouse gas emissions across our bin Salman bin Abdulaziz Al-Saud, Crown through the ongoing portfolio optimization wholly-owned operated assets by Prince, Deputy Prime Minister and Minister program. The Company entered into 2050, which in turn will help support of Defense of the Kingdom of Saudi Arabia.\ntwo energy infrastructure deals in 2021 the Kingdom’s own 2060 net-zero aim.\nwith a total value of SAR 104.6 billion In addition, we thank the Ministry of We did not make nor do we take this ($27.9 billion). This resulted in one group Energy of the Kingdom of Saudi Arabia\nambition for our Company lightly. We fully of investors taking a 49% equity stake for their ongoing support of Aramco.\nrecognize both the scale and the urgency in Aramco’s stabilized crude oil pipeline of the global climate challenge. As one network in June, and a second group Recognizing our many stakeholders of the world’s largest integrated energy taking a 49% equity stake in our natural and chemicals companies, and as stewards In February 2022, the Government\ngas pipeline network following the closing of the Kingdom’s vast hydrocarbon transferred 4% of its shares in the Company of that transaction in February 2022.\nresources, we have a critical role to play in to the Public Investment Fund. This private In a further demonstration of global helping the complex transition to a lower transfer did not affect the Company’s total investor confidence in Aramco’s long-term emissions future be as orderly as possible. number of issued shares and does not have value creation story, our inaugural any impact on the Company’s operations, international U.S. dollar Shari’a compliant As demand for energy continues to strategy, dividend distribution policy, or offering was well received. The grow in response to an expanding world governance framework. The Government\nSAR 22.5 billion ($6.0 billion) transaction population and rising living standards, we remains Aramco’s largest shareholder.\nbelieve oil and gas will still play a vital role not only illustrates our unique value for decades to come. The suggestion that Aramco has long played a special proposition but also serves to further hydrocarbons can be quickly eliminated role in providing energy that powers diversify our funding sources as well from the global energy mix is unrealistic the development of countries and as expand our investor base.\nas doing so would severely impede and communities around the world. It is not The Company remains at the forefront of negatively impact trade and travel. an exaggeration to suggest that each and enabling and enhancing the Kingdom’s Instead, society as a whole must seek every day billions of people, directly and industrial, technology and sustainability a stable and inclusive energy transition indirectly, depend on a reliable supply of infrastructure to help create new jobs and that meets the needs of people in both energy that originates from Aramco.\nfurther diversify the domestic economy. the developed and developing world.\nOur ability to reliably meet these energy Aramco has taken a leading role in the Reducing emissions from energy demands is dependent on the hard work Shareek program launched by the production and use, while at the same of a talented team. And on behalf of the Government of Saudi Arabia in March last time satisfying the world’s growing Board of Directors, I want to take this year. The word “shareek” means partner energy requirements, is the biggest dual opportunity to acknowledge the men and in Arabic, and as the name suggests, the challenge facing our industry. With our women of Aramco for their dedication program is designed to promote increased low upstream carbon intensity and our and commitment. I also want to express public-private partnerships through low-cost oil, as well as our demonstrated our collective appreciation to our a range of finance, funding, tax, and"", 'crude oil concession rights, production production and facilities to 100% Saudi Aramco becomes a public\n2011 Sadara Chemical Company formed\ncompany with shares listed on\n1988 Saudi Aramco officially\n2014 SATORP and YASREF refineries Tadawul\nestablished come online\n\nhighlights Our work to build the world’s foremost integrated energy and chemicals company moved forward in 2019 with resolve, and in significant ways February March Saudi Aramco signs agreement Saudi Aramco showcases to form the largest Sino-foreign innovative engine technologies at joint venture with NORINCO Geneva International Motor Show and Panjin Sincen in China Saudi Aramco signs purchase Saudi Aramco signs agreements agreement to acquire a 70% to acquire stake in Zhejiang equity stake in SABIC from the Integrated Refining & Public Investment Fund of Petrochemical Complex Saudi Arabia (PIF)\nAugust September Saudi Aramco publicly reports H.E. Yasir Othman Al-Rumayyan first-ever half-year financial results, named Chairman of the Board with net income of $46.9 billion New Aramco Singapore office marks regional downstream expansion and integration Following the September 14\nattacks on Abqaiq and Khurais plants, Saudi Aramco restores production to pre-attack output on September 25 Saudi Aramco completes the acquisition of the remaining 50%\nequity interest in the SASREF refining joint venture, from Shell\n\nSaudi Aramco goes public April June July Saudi Aramco issues $12.0 billion Aramco Trading Company opens Saudi Aramco awards contracts of Senior Unsecured Notes listed Fujairah office in UAE valued at $18 billion to increase\non the London Stock Exchange Marjan and Berri oilfields’ Saudi Aramco and Air Products production capacity by 550 mbpd Aramco Trading signs Supply inaugurate Saudi Arabia’s first and 2.5 bscfd of gas\nAgreement with “PKN Orlen”, hydrogen fueling station Poland’s leading oil refiner, enhancing downstream Saudi Aramco inaugurates new integration in Europe complex with S-Oil in Ulsan, South Korea, advancing its global chemicals strategy Saudi Aramco acquires a network of 270 service stations and a fuel tanker fleet in Saudi Arabia through a joint venture with Total October November December Motiva, a wholly owned Saudi Aramco announces Saudi Aramco lists on Tadawul subsidiary, acquires a 100% equity intention to float\ninterest in Motiva Chemicals LLC Saudi Aramco acquires a 17% (formerly Flint Hills), a chemical Saudi Aramco joins World Bank’s equity interest in Hyundai Oilbank plant in Port Arthur, Texas “Zero Routine Flaring by 2030” in South Korea initiative\n\nSaudi Aramco’s values Excellence Safety Integrity At Saudi Aramco, excellence translates into Safety is an integral part of Saudi Aramco’s The integrity of business at Saudi Aramco all aspects of our workplace. It is our personal culture. We are committed to providing is based on the ethical standards of our and group commitment to doing what we a safe and respectful working environment employees in our everyday operations.\ndo well. We drive for best results and are for all with the appropriate safety procedures Integrity is a precious asset, it is our reputation.\nagile in addressing new challenges. and policies in place on-site and within The foundation of corporate integrity is the community. personal integrity.\nAs a business, we drive excellence by setting challenging goals, rewarding top We define safety as protecting ourselves, We treat people with fairness and respect, performance, committing ourselves to protecting others and protecting our future. we embrace diversity and accept differences developing our people, encouraging and we do not tolerate misconduct.\ninnovation, creativity and diversity of Citizenship thought, and fostering teamwork and No matter where in the world we are Accountability open communication. conducting business, it is important to be Accountability means all employees at known as a good corporate citizen and to Saudi Aramco take responsibility for their be a positive influence within communities. actions in meeting corporate objectives.\nAs a global company in Saudi Arabia, we Accountability for achieving Saudi Aramco’s take this role seriously. overarching business objectives starts with the goals and objectives outlined by the We define citizenship as acting as a catalyst President & CEO for its business lines, and for economic growth, demonstrating social pervades through Saudi Aramco.\nresponsibility, supporting our communities and serving as role models in building solid Our employees place authority where relationships with our customers and partners. responsibility lies, deliver on commitments and seek and provide constructive feedback.\n\nBusiness model Our resources What we do Saudi Aramco’s conventional proved reserves Upstream and crude oil production are unrivalled.\nSaudi Aramco is the world’s Through the utilization of a skilled workforce largest producer of crude oil operating in a safe and reliable manner and and condensate. We manage the Kingdom’s unique reserves leveraging technology, Saudi Aramco sustains and resource base to optimize production and', 'for our shareholders.\n\nCFO’s message\n\nThis framework continues to be supported by The Fund is being managed by Aramco Ventures, three main pillars, the first of which is the prudent our venture capital arm, and will focus on optimization of Aramco’s capital structure in order making investments in innovative technologies to maintain a high investment-grade credit rating that support our 2050 net-zero ambition.\nwith sufficient capacity. During the year we With petrochemicals positioned to provide strategically directed cash flow towards essential inputs for the energy transition, we deleveraging our balance sheet, making partial are also investing to grow our net chemicals\nprepayments totaling SAR 66.8 billion ($17.8\nproduction capacity and announcing expansion billion) of the deferred consideration related projects in the Kingdom and in Asia. Since the to the SABIC acquisition, thereby reducing the acquisition of SABIC, Aramco has sought to principal amounts of the associated promissory achieve synergies in procurement, supply chain, notes. This resulted in savings of approximately marketing, feedstock optimization, stream\nSAR 8.3 billion ($2.2 billion).\nintegration, operations, and maintenance.\nThe second pillar of our financial framework Aramco estimates that it has generated centers on continuing to diversify our funding incremental EBITDA synergies of approximately\nsources and optimize funding costs to provide SAR 8.1 billion ($2.15 billion) and is targeting\nmaximum optionality and execution flexibility. the capture of approximately SAR 11.3 billion\nIn 2022, this included signing a five-year to SAR 15.0 billion ($3.0 billion to 4.0 billion)\nagreement for SAR 37.5 billion ($10.0 billion) to in annual recurring EBITDA synergies by 2025.\nreplace certain unsecured revolving credit facilities.\nExpanding our capital market presence The third and final pillar is maintaining our In the fourth quarter of 2022, two companies capital discipline and financial prudence through that Aramco holds interests in completed crude oil price cycles. We believe oil and gas initial public offerings with listings on the will remain a key part of the energy mix over Saudi Exchange.\nthe longer term in order to satisfy the world’s need for affordable, reliable and stable energy. The IPO of the Power and Water Utility Company Accordingly, our capital expenditures in 2022 for Jubail and Yanbu, known as Marafiq, resulted\nincreased by 18.0% to SAR 141.2 billion in Aramco’s effective equity ownership being\n($37.6 billion) as we continued to make long-term reduced from 42.2% to 29.8%. Aramco received\ninvestments across the hydrocarbon chain to SAR 1.7 billion ($0.44 billion) from the sale of\nfurther our growth ambitions. this portion of our stake in Marafiq. Our majority-owned base oil subsidiary, Luberef, These investments included expanding our also completed its IPO; however, no proceeds downstream European presence with the closing from this public offering were received as we of three landmark transactions with Polish retained our entire 70% stake.\nrefiner and fuel retailer PKN ORLEN. Aramco also signed an equity purchase agreement to acquire Both IPOs reinforce our efforts to increase Valvoline Inc.’s global products business for Aramco’s participation and presence in capital\nSAR 9.9 billion ($2.65 billion) in the third quarter markets, expand our shareholder base, and\nof 2022. This strategic acquisition, which closed provide existing and new investors with in March 2023, is expected to complement additional avenues to capture value that\nAramco’s line of premium-branded lubricant Aramco and its subsidiaries generate.\nproducts and enhance our global base oils Focusing on value creation production capabilities.\nAramco’s unprecedented financial results for Investing in the energy transition 2022 reinforce our ability to generate consistent At the same time, we are investing in key energy value for our shareholders across price cycles, transition-related solutions, including the while providing energy supply stability development of cleaner fuel technologies, to our customers.\nlower-carbon hydrogen, renewables, and Our aim is to continue to deliver a sustainable carbon capture, utilization, and storage.\nand progressive dividend while focusing on These future-focused investments are already long-term value creation. Going forward, making progress. Aramco, through our SASREF continued agility, resilience, and fiscal discipline and SABIC Agri-Nutrients subsidiaries, was will remain the cornerstones of our financial granted the world’s first independent certification approach as we continue to lay the foundation for production of blue ammonia and hydrogen in for Aramco to be a leading energy player as the the third quarter of 2022, as well as collaborating world moves towards a lower-carbon future.\non the world’s first commercial shipment of lower-carbon blue ammonia in the fourth quarter of 2022. Ziad T. Al Murshed Executive', 'SABIC is an industry leader in multiple chemical segments, and Net chemicals production capacity1 produces a wide range of products, including olefins, methanol, MTBE, (million tons per year)\naromatics, glycols, linear alpha olefins, polyethylene, polypropylene, polyethylene terephthalate, polyvinyl chloride, polystyrene, 59.6 57.62\npolycarbonate, and engineering thermoplastics and their blends. 56.3 54.2\nSince the acquisition of SABIC, Aramco has sought to achieve 52.6 synergies mainly in procurement, supply chain, marketing, feedstock optimization, stream integration, operations, and maintenance.\nAramco is targeting to capture approximately ﷼ 11.3 billion to\n﷼ 15.0 billion ($3.0 billion to $4.0 billion) in annual recurring synergies\nby 2025.\n2020 2021 2022 2023 2024\n1. Excludes SABIC Agri-Nutrients business for 2024 and SABIC Agri-Nutrients and Metals (Hadeed) businesses for 2023 and includes only ZPC’s net chemical production capacity through our investment in Rongsheng.\n2. The reduction in net chemicals production capacity is due to the termination of operations of three assets related to SABIC mainly in Europe.\nHighlights and developments Petrochemical complex construction Hadeed ownership transfer A groundbreaking ceremony was held by SABIC and Fujian Energy SABIC completed the transfer of its ownership of Hadeed to PIF. This and Petrochemical Group Co. Ltd. to mark the start of construction transaction enables SABIC to optimize its portfolio, focus on its core at the SABIC Fujian Petrochemical Complex in China’s Fujian business, and support its vision to become the preferred world\nprovince. With an estimated total investment of ﷼ 24.0 billion ($6.4 leader in chemicals.\nbillion), the complex will consist of a mixed-feed steam cracker and Petro Rabigh investment world-class downstream facilities, with an expected annual Aramco signed a definitive agreement to acquire an additional ethylene capacity of up to 1.8 million tons. The project aims to stake of approximately 22.5% in Petro Rabigh, an integrated\nsupport SABIC’s goal to diversify its feedstock sources and expand refining and petrochemical complex in the Kingdom, from its manufacturing presence in Asia as a key market for a wide range\nSumitomo Chemical for ﷼ 2.6 billion ($0.7 billion), subject to\nof products. The project is expected to be completed in 2027.\ncustomary closing conditions including regulatory and other third-party approvals. Upon completion of the transaction, 1.8 million tons Aramco will become Petro Rabigh’s largest shareholder with an Expected annual ethylene capacity of Petrochemical Complex equity stake of approximately 60%, while Sumitomo Chemical\nwill retain a 15% equity stake.\nAmiral complex ALBA shareholding sale During 2024, a financial closing between TAQA and JERA has SABIC announced the signing of an agreement for the sale of its been completed for a cogeneration plant for the Amiral complex 20.62% stake in ALBA to Ma’aden. The transaction, closed in\nthat follows a 25-year power and steam purchase agreement\nFebruary 2025 with a final sale amount of ﷼ 3.61 billion ($0.96\ncompleted earlier in the year. Additionally, TAQA and JERA will billion), is expected to support Aramco’s portfolio optimization be responsible for the operations and maintenance of the plant.\nefforts to unlock value and reallocate capital to higher growth The complex will be owned and operated by SATORP and aims and higher return investments.\nto house one of the largest mixed-load steam crackers in the region, with a capacity to produce 1.65 million tons per annum of ethylene and other industrial gases.\n\n5 . O RGANIZATIONAL 6. A DDITIONAL STRUCTURE AND FINANCIAL 7. C ONSOLIDATED\n\nAND STRATEGY PERFORMANCE 3. SUSTAINABILITY 4. RISK GOVERNANCE INFORMATION STATEMENTS Base oils and lubricants Overview In keeping with Aramco’s strategy to capture incremental value Base oils sold across the hydrocarbon chain, Aramco has a growing presence in (million tons)\ndomestic and international lubricants markets. Aramco’s products\nare engineered to the highest of standards that meet the latest 4.5 4.6 4.4 4.8\n4.1 lubricant specifications required by original equipment\nmanufacturers. In 2024, Aramco sold 1.1 million tons\n(2023: 0.9 million tons) of finished lubricants', 'the right to supply 480,000 barrels per day (mbpd) of crude oil to Rongsheng Petrochemical’s affiliate, Zhejiang Petroleum and Chemical Company Limited (ZPC), which operates one of the largest integrated refining and chemicals complex in China.\nSaudi Aramco: Public\n\nComplementing Aramco’s premium-branded lubricant products, the Company completed its acquisition of Valvoline Inc.’s global products business. The acquisition is expected to optimize Aramco’s global base oils production capabilities, and expand its R&D activities and partnerships with original equipment manufacturers.\nAramco and Total Energies awarded engineering, procurement, and construction contracts for the $11.0 billion Amiral complex, a future world-scale petrochemicals facility expansion at SATORP refinery in Jubail, Saudi Arabia. The new complex aims to house one of the largest mixed- load steam crackers in the region, with a capacity to produce 1.65 million tons per annum of\nethylene and other industrial gases. It is expected to enable SATORP to advance Aramco’s liquids- to-chemicals strategy with expected commercial operations in 2027.\nSupporting the expansion of its global retail operations, Aramco has completed the purchase of a 100% equity stake in the Chilean retailer Esmax Distribución SpA (Esmax), one of the leading diversified downstream fuels and lubricants retailers in Chile, from Southern Cross Group, representing the Company’s first downstream retail investment in South America. Aramco also signed definitive agreements to acquire a 40% equity stake in Gas & Oil Pakistan Limited (GO), a\ndiversified downstream fuels, lubricants and convenience stores operator in Pakistan, subject to customary closing conditions, including regulatory approvals.\nAdvancing its role in renewables development, and in line with its aim to capitalize on the Kingdom’s solar resources, Aramco entered into a shareholders’ agreement with the Public Investment Fund (PIF) and ACWA Power for the development of the Al Shuaibah 1 and Al Shuaibah 2 photovoltaic solar projects in the Kingdom of Saudi Arabia. With an expected\ncombined capacity of 2.66 GW, commercial operations are expected to commence in 2025.\nAs part of Aramco’s corporate development activities, and to enhance its supply chain ecosystem, the Company also signed a shareholders’ agreement with Baoshan Iron & Steel Co. Ltd. (Boasteel)\nand PIF to establish a world-class steel plate manufacturing complex in the Kingdom of Saudi Arabia, as well as a shareholders’ agreement with DHL for a new Procurement and Logistics Hub.\nYanbu Refinery became the fourth Aramco facility to be added to the World Economic Forum Global Lighthouse Network, having been recognized for its pioneering deployment of cutting- edge technologies to deliver a range of operational, commercial and environmental benefits. This reflects Aramco’s continued focus on the development and deployment of state-of-the-art Fourth Industrial Revolution technologies, which enhance operations.\n\nAramco will discuss its full-year financial results for 2023 in an audio webcast on March 11,\n2024 at 3.30pm Riyadh / 12.30pm London / 8.30am New York. To register for the webcast, visit\nwww.aramco.com/investors.\n*Please refer to www.aramco.com/investors for reconciliation of non-IFRS measures.\nSaudi Aramco: Public\n\nAramco Contact Information Media Relations: media.inquiries@aramco.com Investor Relations: investor.relations@aramco.com\n\nAbout Aramco Aramco is a global integrated energy and chemicals company. We are driven by our core belief that energy is opportunity. From producing approximately one in every eight barrels of the world’s oil supply to developing new energy technologies, our global team is dedicated to creating impact in all that we do. We focus on making our resources more dependable, more sustainable and more useful. This helps promote stability and long-term growth around the world. www.aramco.com Disclaimer The press release contains forward-looking statements. All statements other than statements relating to historical or current facts included in the press release are forward-looking statements. Forward-looking statements give the Company’s current expectations and projections relating to its capital expenditures and investments, major projects, upstream and downstream performance, including relative to peers. These statements may include, without limitation, any statements preceded by, followed by or including words such as “target,” “believe,” “expect,” “aim,” “intend,” “may,” “anticipate,” “estimate,” “plan,” “project,” “can have,”\n“likely,” “should,” “could,” and other words and terms of similar meaning or the negative thereof. Such forward-looking statements involve known and unknown risks, uncertainties and other important factors beyond the Company’s control that could cause the Company’s actual results, performance or achievements to be materially different from the expected results, performance, or achievements expressed or implied by', '. Saudi Aramco faces numerous result in Saudi Aramco reviewing and challenges in developing such projects, recognizing impairments on its projects, including: assuming liabilities of joint venture or affiliate partners or other consequences, any of\n• constraints on the availability and cost which could have a material adverse effect of skilled labor, contractors, materials, on Saudi Aramco’s business, financial position equipment and facilities, particularly during and results of operations.\nperiods of global expansion in the oil and gas or chemicals industry;\nIn addition, many of Saudi Aramco’s projects\n• its ability to obtain funding necessary for require significant capital expenditures. If cash the implementation of the relevant project flow from operating activities and funds from on terms acceptable to it, or at all; external financial resources are not sufficient to cover Saudi Aramco’s capital expenditure\n• fluctuations in the market prices for requirements, Saudi Aramco may be required hydrocarbons, which may impact its ability to reallocate available capital among its to finance its projects from its cash flow projects or modify its capital expenditure from operating activities;\nplans, which may result in delays to, or\n• difficulties in obtaining necessary permits, cancellation of, certain projects or deferral complying with applicable regulations and of certain capital expenditures. Any change changes to applicable law or regulations; to Saudi Aramco’s capital expenditure plans could, in turn, have a material adverse effect\n• difficulties coordinating multiple on Saudi Aramco’s growth objectives and contractors and sub-contractors involved in its business, financial position and results complex projects;\nof operations.\n• making economic estimates or assumptions based on data or conditions, including crude oil and gas price assumptions, which may change; and\n• undertaking projects or ventures in new lines of business in which Saudi Aramco has limited or no prior operating experience.\n\n1.8. Risks related to litigation Saudi Aramco has been subject to significant In addition, increasing attention on climate litigation, primarily in the United States and change risks may result in an increased Saudi Aramco has been subject the Kingdom. Some of the most significant possibility of litigation against Saudi Aramco to litigation in the past and may U.S. litigation involved allegations of violations and its affiliated companies. Claims relating be again in the future. of antitrust laws arising, in part, from the to climate change matters have been filed Kingdom’s membership and participation against companies in the oil and gas industry in OPEC. Such antitrust litigation sought by private parties, shareholders of such extensive relief, including treble damages, companies, public interest organizations, cities divestiture of assets in the United States and and other localities, especially in the United disgorgement of profits. If granted, this relief States, including claims that the extraction could have had a material adverse impact on and development of fossil fuels has increased Saudi Aramco. To date, the OPEC-related climate change. Some of these claims demand antitrust lawsuits have been dismissed on the that the defendants pay financial amounts basis of various sovereign defenses under as compensation for alleged past and future U.S. law, including the political question and damages resulting from climate change. On the act of state doctrines, sovereign immunity July 2, 2018, Motiva, Saudi Aramco’s refining\nunder the FSIA and other legal defenses. subsidiary in the United States, was named However, there is no assurance that as a defendant in such a claim brought by Saudi Aramco will prevail in its assertion of the State of Rhode Island against multiple these defenses in the future and any adverse companies in the oil and gas industry. Claims judgment or settlement could have an adverse such as these could grow in number and effect on Saudi Aramco’s business, financial Saudi Aramco could be the subject of similar position and results of operations. claims in the United States or elsewhere in the future.\nIn February 2019, members of the U.S. House of Representatives introduced a bill that seeks Further, Saudi Aramco’s investors could assert to make unlawful certain conduct by foreign claims against it and its Directors and Senior states, state instrumentalities and state Executives alleging breaches of applicable agents, such as taking action collectively laws and regulations, or other legal theories.\nto reduce the production of oil. The draft bill would expressly remove or weaken certain Litigation in a variety of jurisdictions could sovereign defenses, including sovereign result in substantial costs (including civil or immunity under the FSIA. If this or any other criminal penalties, or both, damages or the legislation affecting Saudi Aramco’s legal imposition of import trade measures), require liability were to become law and result in Saudi Aramco to devote substantial resources litigation against Saudi Aramco, such and divert management attention, which litigation, including any adverse judgment may have a material adverse effect on or settlement, could have a material adverse Saudi Aramco’s business, financial position effect on Saudi Aramco’s business, financial and results of operations. For further details position and results of operations. on litigation, see Section 8: Additional Information.\n1', 'aspiration to make a positive difference through their work. At Aramco we give our people the opportunity to do the work they dreamed of doing, and support them in achieving more than they thought possible.\nPioneers and innovators, scientists and engineers, dreamers and thinkers — our people are our most important asset. They drive us forward, every hour of every day, as we aim to lead the way in responsibly producing reliable energy for the world.\nJoin us to help reshape the global energy landscape and set our world on a path towards a lower-carbon energy future.\nOpportunities for all Jobs in regional offices Explore our world of rewarding career options in Asia, Europe, and U.S.\n\nNational talent recruitment We give our people the opportunity to do the work they’ve dreamed of doing.\n\nInternational recruitment Our employees are drawn by the rewarding professional opportunities we offer.\n\nA great place to work Employee reviews See more on Glassdoor Glassdoor rating ""Great pay and benefits, but hot in summer.""\nAccount Manager, April 2026 “Great salary, great people, changing lives and giving opportunities to the youth of the country”\nAdvanced ITC Teacher, March 2025 8+ years “Great career and work life-balance”\nGeologist, June 2024 “Aramco is the Best Company that I have ever worked for. The work environment is the most productive that I have ever worked in”\nIT Consulting Engineer, March 2024 8+ years “Challenging and exciting tasks, solving tomorrows toughest challenges”\nLead Analyst, August 2023 “Good place to work in. Work-life balance is top priority of company and career growth is highly encouraged”\nSenior Business Analyst, August 2023 “Excellent company to work for all around”\nPilot, June 2023 10+ years “Amazing work environment, and great colleagues”\nScience specialist, April 2023 10+ years “Cross cultured, multi-national organization. It’s amazing to work for the company”\nSupply Chain Director, February 2023 Testimonials “As a working mother of three I’ve found that settling in to life at Aramco has been seamless.”\nRosa Peterson — Lead Environmental Scientist\n\n“Moving from Chile to Saudi Arabia was one of the most important decisions of my life and, to be honest, one of the best.”\nMiguel Arias Vasquez — Senior Hydrographer\n\n“I joined Aramco quite early-on in my Career, it felt like a huge leap of faith, but the feeling of community is like nothing I’ve ever experienced.”\nLucy Gadsby — Executive Assistant to Senior Vice President\n\n“I joined Aramco in 2013 and really enjoy the diversity and richness of culture and the people that I work with every day. It’s truly a global network.”\nFahad Rana — Manager Projects Business Support\n\nA diverse workplace Equity and inclusion We are committed to attracting and developing diverse talent in a welcoming and inclusive work environment.\n\nYLAB: Young Leaders Advisory Board Engaging and inspiring our young employees.\n\nWomen in business How we\'re supporting women\'s educational and career aspirations in our workforce and beyond.\n\nStories about our people Show all articles Elements February 05, 2026 How Aramco is driving sporting excellence Elements January 01, 2026\nA day in the life of an OSPAS engineer Elements December 10, 2025 The desert pioneer behind our first oil discovery Elements November 27, 2025\nMeet Aramco\'s divers Latest social posts About us Learn more about Aramco.\n\nSOURCE: Sustainability  | Aramco\nURL: https://www.aramco.com/en/sustainability\nTYPE: Website Content\n\nOur approach to sustainability\n\nRead our 2024 Sustainability Report A sustainable approach is essential to how we operate, as well as to ensuring that Aramco continues to thrive in the long-term, and remains one of the world’s leading integrated energy and chemicals companies.\nIt allows the Company to consider how societal and environmental issues affect our day-to-day business, and is a key driver of our strategy as we navigate a global Energy Transition and the shift towards a lower-carbon economy.\nWe recognize the scale and urgency of the climate challenge. We are leveraging our operational strengths and our business portfolio to play our part in the Energy Transition, underpinned by our ambition to achieve net-zero Scope 1 and Scope 2 greenhouse gas emissions across our wholly-owned operated assets by 2050, and our development of lower-carbon energy solutions.\n\nClimate and energy Our efforts towards GHG emissions reduction and efficient resource utilization across our operations.\n\nPeople and safety We strive to provide a safe and respectful working environment for all.\n\nEnvironment Environmental stewardship is deeply integral to our approach.\n\nSociety Initiatives and programs created to support the communities and the environment in which we operate.\n\nGovernance and oversight Aramco’s internal governance model for sustainability.\n\nSustainability news and stories\n\nNews March 24, 2025 Aramco completes acquisition of 50% stake in Blue Hydrogen Industrial Gases', 'to continue making significant investments in our Upstream operations. These strategic investments are designed to help reinforce our dominant position in oil, maintain our maximum sustainable production capacity, and allow us to carry out an exploration and production program focused on finding and developing conventional and unconventional gas resources.\nDownstream, we are pursuing a strategy to grow our non-crude oil businesses and pursue tighter integration across our Upstream and Downstream operations. We see product diversification and global integration as a means to strengthen our portfolio resilience, and deliver additional revenue streams for the company.\nOur 70% stake inaccelerates our Downstream growth strategy and strengthens our chemicals platform , positioning us for continued growth and value creation in the petrochemicals industry, expected to be a growing source of oil demand in the years ahead.\nWe employ a wide range of capital efficiency practices to help lower capital costs and improve productivity, supporting the financial health of our company in various operating scenarios. Focusing on our underlying cost structure helps give us the tools we need to meet our goals of greater efficiency and cost competitiveness — without compromising on safety or our commitment to responsible environmental management\n\nFrom engineering mega projects to creating industry-changing technologies to launching innovative new products , we have always had a relentless drive to succeed by enhancing the long-term, positive impacts we enable from our resources.\nOur history Driven by the curiosity to explore Starting with just a small group of intrepid explorers, our history goes back to the early 1930s and the sands of the Saudi Arabian desert.\nLearn more about our history\n\nFinancial statements and key reports\n\nAnnual Report 2025 March 10, 2026\n\nOur 2024 Sustainability Report\n\nOur leadership Our leaders bring a wealth of international business and engineering knowledge and experience.\n\nOur governance High standards, high performance.\n\nOur offices and facilities Our business takes us all over the world, from promising international start-ups to strategic global hubs.\n\nSOURCE: Our history  | Aramco\nURL: https://www.aramco.com/en/about-us/our-history\nTYPE: Website Content\n\nOur history Driven by the curiosity to explore.\nOur story is one of creativity and perseverance in equal measure. We’ve overcome challenges, advanced knowledge in our industry and far beyond, and helped usher in an age of abundant energy and transformative technology.\nOur history is one we’re proud of, and which inspires us as we evolve and transition into a new era of energy.\nDiscover more about Aramco’s founding, and some of our key milestones and achievements through the years, below.\nThe birth of Arabian oil Aramco traces its beginnings to 1933 when a Concession Agreement was signed between Saudi Arabia and the Standard Oil Company of California (SOCAL). A subsidiary company, the California Arabian Standard Oil Company (CASOC), was created to manage the agreement.\nThe work began right away: following surveys of the Saudi desert, drilling began in 1935.\nFollowing years of effort with little to show for it, in 1937, SOCAL executives sought advice from their chief geologist, Max Steineke. Drawing on years of fieldwork, Steineke told them to keep on drilling.\nFinally, success In 1938, the efforts finally paid off with the commencement of commercial oil production from Dammam No. 7 — the aptly named Prosperity Well.\nRadical expansion across Saudi Arabia From the late 1940s, we grew from strength to strength — hitting record-breaking oil production milestones. Along the way, we were making Saudi Arabia famous for its energy, too.\nNow named Aramco (the Arabian American Oil Company), our crude oil production hit 500,000 barrels per day in 1949.\nOur rapid increase in oil production meant we had to expand our distribution efforts as well. In 1950, we completed the 1,212-kilometer Trans-Arabian Pipeline (Tapline) — at the time the longest in the world.\nThe Tapline linked eastern Saudi Arabia to the Mediterranean Sea, sharply cutting the time and cost of exporting oil to Europe. And, after two years of exploration in the shallow Arabian Gulf waters, we located the Safaniyah field in 1951, the world’s largest offshore oil field discovered so far. And in 1958, Aramco’s crude oil production exceeded 1 million barrels per day.\nBillions of barrels\nBy 1962, we reached another milestone, with cumulative crude oil production reaching 5 billion barrels. And by 1971, average daily production of crude oil had ramped up to 4.49 million barrels, which was roughly 1.6 billion barrels per year.\nMaking a name for ourselves\nThroughout the 1970s, we not only proved ourselves as an economic force for Saudi Arabia, but we also returned to our Saudi Arabian heritage. In 1973, the Saudi government bought a 25% interest in Aramco, increasing that interest to 60% the following year.\nAnd in 1980, the Saudi government increased its interest in Aram', '39) and the Middle East and North Africa region. The Company\ncommitted to invest ﷼ 225, of which, ﷼ 207 is invested at December 31, 2025. In addition, SADCO has guaranteed the purchase of 50 onshore\nrigs over a 10-year period beginning in 2022. 14 of these rigs were delivered up to the end of 2025, and accordingly, the remaining\ncommitment as at December 31, 2025 amounted to ﷼ 6,789. SADCO has the option to cancel the rig orders for a maximum financial exposure\nof ﷼ 945.\nNotes to the consolidated financial statements continued All amounts in millions of Saudi Riyals unless otherwise stated 32. Commitments continued (d) Other (i) The Company and The Dow Chemical Company (“Dow”) equally committed to comply with the Ministry of Energy feedstock agreement to support the development of Chemical Value Parks in the Kingdom in the total amount of ﷼ 375. The first payment of\napproximately ﷼ 38 will be deposited within one month from the date of supplying Sadara with additional ethane. The remaining\nfunds will be paid over nine years at ﷼ 38 annually. Saudi Aramco’s commitment of ﷼ 188 is outstanding at December 31, 2025.\n(ii) In order to comply with past Government directives, the Company expects to sell portions of its equity in SATORP and Yanbu Aramco Sinopec Refining Company Limited (Note 40) through a public offering of shares in Saudi Arabia.\n(iii) Saudi Aramco has commitments of ﷼ 667 (2024: ﷼ 569) to invest in private equity investments both inside and outside the Kingdom.\nSuch commitments can be called on demand.\n(iv) Saudi Aramco has commitments of ﷼ 23 (2024: ﷼ 35) to fund additional loans and acquire additional unlisted equity investments of\ncertain small to mid-sized enterprises in the Kingdom. The commitments can be called by the enterprises upon meeting certain conditions.\n(v) Saudi Aramco has commitments of ﷼ 5,114 (2024: ﷼ 3,865) in relation to capital contributions and ﷼ 348 (2024: ﷼ 348) for social\nresponsibility programs for certain other affiliates.\n33. Contingencies Saudi Aramco has contingent assets and liabilities with respect to certain disputed matters, including claims by and against contractors and lawsuits and arbitrations involving a variety of issues. These contingencies arise in the ordinary course of business. It is not anticipated that any material adjustments will result from these contingencies.\nSaudi Aramco also has contingent liabilities with respect to the following:\n(a) Sadara\nOn March 25, 2021, Sadara entered into various agreements to restructure its senior project financing debt amounting to ﷼ 37,280. Terms of\nthe restructuring include a principal repayment grace period until June 2026 and an extension of the final maturity date from 2029 to 2038.\nIn connection with the restructuring, the Company and Dow have agreed to guarantee up to an aggregate of ﷼ 13,875 of senior debt principal and its associated interest in proportion to their ownership interests in Sadara (Note 41). Further, the Company and Dow have\nagreed to provide guarantees and support, in proportion to their ownership interest in Sadara, for interest payment shortfalls on all\noutstanding senior debt until June 2026, working capital shortfall support up to ﷼ 1,875 in 2030, as well as an undertaking to provide\nacceptable credit support to cover the required Debt Service Reserve Account balance, which needs to be funded prior to June 2026.\nIn addition to the senior debt restructuring, effective March 25, 2021, the Company, Dow (and/or their affiliates) and Sadara have also\nentered into agreements to (i) provide additional feedstock by increasing the allocated quantity of ethane and natural gasoline supplied by Saudi Aramco, and (ii) gradually increase Saudi Aramco’s rights to market, through SABIC, its equity share of finished products produced by Sadara (subject to certain agreed terms), which is estimated to be achieved by 2031. The Company has provided a guarantee for the payment and performance obligations of SABIC under the Product Marketing and Lifting Agreement.\nOn June 17, 2021, Excellent Performance Chemical Company (“EPCC”), a wholly-owned subsidiary of the Company, and Sadara entered into a\n﷼ 1,500 subordinated revolving credit facility to provide shortfall funding to Sadara. The facility, originally scheduled to mature in June 2023,\nhas been extended till June 2026. As of December 31, 2025, an amount of ﷼', ""SAUDI ARAMCO — COMPLETE KNOWLEDGE BASE\nGenerated from: Official Annual Reports (2017-2026), Quarterly Reports, Press Releases, and Website\nCoverage: Financial results, production data, sustainability, operations, careers, leadership\nNOTE: Cleaned, readable build. Removed PDF-extraction noise (redundant table dumps, page headers/footers, tables of contents, dotted leaders); repaired word-spacing in financial statements; merged split currency-table rows; reflowed wrapped lines into full sentences. All text and figures preserved. Annual Report pages were extracted from multi-column PDFs row-by-row, so some of their prose may still read slightly out of order.\n\nSOURCES INCLUDED:\n  - Annual Reports: 2019, 2020, 2021, 2022, 2023, 2024, 2025\n  - Full Financials: 2018-2025 (full-year)\n  - Quarterly Interim Reports: Q1/H1/Q3 2020-2026\n  - Press Releases: Q1 2019 – Q1 2026\n  - Non-IFRS Reconciliations: 2019-2024\n  - Website: About, Careers, Operations, Sustainability, News\n\nSOURCE: About us  | Aramco\nURL: https://www.aramco.com/en/about-us\nTYPE: Website Content\n\nAbout Aramco Energy security for a more-sustainable world.\nWe are one of the world's largest integrated energy and chemicals companies, creating value across the hydrocarbon chain, and delivering societal and economic benefits to people and communities around the globe who rely on the vital energy we supply.\nWe are committed to playing a leading role in the Energy Transition. We have a responsibility to help the world achieve a net-zero economy, and our people are working hard to help solve the world's sustainability challenges.\nFor our customers, we are a supplier of choice. For our shareholders, we provide long-term value creation. For communities around the world, our ambition is to provide reliable, affordable, and more-sustainable energy.\nAramco at a glance\n\n93 years of experience In 2026, we marked our ninety-third year of exploration, discovery, and innovation stemming from our long-term role as caretakers of Saudi Arabia’s vast hydrocarbon resources.\n76,000+ total workforce Our high-performing employees are drawn by the challenging and rewarding professional opportunities we offer.\n247.2 billion barrels of oil Aramco manages Saudi Arabia’s hydrocarbon reserves base, enhancing production, and increasing long-term value.\n50+ countries of operation Aramco operates in more than 50 countries via our network of affiliates, subsidiaries, and joint ventures.\n11.4 bscfd of natural gas In 2025 our natural gas production from our in-Kingdom operations was 11.4 billion standard cubic feet per day (bscfd).\n59.3 million tons of chemicals Our petrochemicals production capacity in 2025 was 59.3 million tons per year.\nOur perspective We believe in the power of energy to transform lives, enhance communities, and advance human progress.\nWith the UN predicting that global population could increase by two billion over the next 55 years, even more energy will be required to meet rising demand. And while alternative energy sources are steadily making advances, they will not be capable of meeting future demand alone. Even as we transition to a low emissions global economy, hydrocarbon-based energy sources will be counted on to meet the bulk of the world’s energy demand, now and into the future.\nWe’re committed to driving energy efficiency and addressing the global emissions challenge. And as one of the world's largest integrated oil and gas companies, we believe we are exceptionally qualified to make effective contributions to the overall solution.\nAt Aramco, we are proactively doing our part to reliably, and ever-more-sustainably, provide the energy products that enable people to seize opportunities that can transform our world.\nWhere we're going We're explorers at heart. That drive to reach the next frontier or solve the next great problem has allowed us to build one of the world’s most important energy and chemicals enterprises.\nTo help us achieve optimal future performance, we are focused on delivering greater value, creating additional organizational resilience, enabling continued growth, and developing future-proofing technology solutions.\nOver the next decade, we expect to continue making significant investments in our Upstream operations. These strategic investments are designed to help reinforce our dominant position in oil, maintain our maximum sustainable production capacity, and allow us to carry out an exploration and production program focused on finding and developing conventional and unconventional gas resources.\nDownstream, we are pursuing a strategy to grow our non-crude oil businesses and pursue tighter integration across our Upstream and Downstream operations. We see product diversification and global integration as a means to strengthen our portfolio resilience, and deliver additional revenue streams for the company.\nOur 70% stake inaccelerates our Downstream growth strategy and strengthens our chemicals platform""]",Aramco finished paying the deferred amount owed for the chemicals stake bought from the Public Investment Fund (PIF) by making partial prepayments totaling SAR 66.8 billion ($17.8 billion) of the deferred consideration. This action contributed to reducing the principal amounts of the associated promissory notes (CFO’s message section).,"In 2023, Aramco made three repayments or prepayments to PIF: SAR 59.0 billion, SAR 41.3 billion, and SAR 16.7 billion. These payments fully settled the deferred consideration for the SABIC acquisition.",0.8333333333333334,0.982620539195786,0.0,0.0
What main privileges and time structure are attached to Aramco’s state-granted operating rights?,"['capital is sixty billion Saudi Riyals (SAR 60,000,000,000),\nconsisting of two hundred billion (200,000,000,000) fully paid ordinary shares with no par value. Aramco’s primary operating segments are Upstream and Downstream, which are supported by corporate activities (for further details please refer to Section 3:\nResults and performance).\nOn December 11, 2019, the Company completed its IPO and its ordinary shares were listed on Tadawul. In connection with the\nIPO, the Government, being the sole owner of the Company’s shares at such time, sold 3.45 billion ordinary shares, or 1.73% of the\nCompany’s share capital. In addition, concurrent with the IPO, the Company acquired 117.2 million of its ordinary shares from the Government for a cash payment of SAR 3,750 million which are being classified as treasury shares. These shares are for use by the\nCompany for its employee share plans. On February 13, 2022, the Government announced the transfer of 4% of the Company’s total\nshare capital to the Public Investment Fund (PIF). Therefore, the current ownership of the Government in the Company is 94.19%.\nMaterial agreements Aramco has entered into a number of agreements for the purposes of its business. The following is a summary of those agreements that Aramco considers material to its business. Aramco believes that all such agreements, in addition to the key provisions thereunder, have been included in this section and that there are no other agreements that are material in the context of its business. These summaries do not purport to describe all the applicable terms and conditions of such agreements and are qualified in their entirety by the respective agreements.\nThe Concession Background\nThe Arabian American Oil Company Concession Agreement was ratified on 4/2/1352H (corresponding to May 29, 1933) and granted\nArabian American Oil Company certain exclusive rights, including the right to explore, drill, recover and treat crude oil and other hydrocarbons located within certain areas of the Kingdom (which were revised and grew over time), with limited territorial exceptions.\nPursuant to Royal Decree No. M/8 dated 4/4/1409H (corresponding to November 13, 1988) approving Aramco’s original articles,\nAramco enjoyed all the privileges and rights provided under the Arabian American Oil Company Concession Agreement, and all subsequent supplementary documents, agreements, Governmental orders and decisions in connection therewith (collectively, the\n“Original Concession”). Effective 6/4/1439H (corresponding to December 24, 2017), and in accordance with the Hydrocarbons Law,\nthe Government, represented by the Minister of MEIM (predecessor to the Minister of Energy), and Aramco entered into the revised\nConcession Agreement (the “Concession”), which was adopted under Royal Decree No. (M/12) dated 18/1/1441H (corresponding\nto September 17, 2019) and replaced and superseded in its entirety the Original Concession on such date (the “Concession\nEffective Date”). Further, on 20/1/1441H (corresponding to September 19, 2019), and in accordance with the Hydrocarbons Law,\nthe Government, represented by the Minister of Energy, and Aramco entered into an amendment to the Concession, with effect from January 1, 2020) (the “Concession Amendment”).\nGrant of rights The Government grants Aramco the following rights to be exercised at Aramco’s own responsibility during the term of the Concession:\n• The exclusive right to explore, drill, prospect, appraise, develop, extract, recover and produce hydrocarbons in the Concession Area;\n• The non-exclusive right to manufacture, refine and treat production and to market, sell, transport and export such production;\n• The exclusive right to market and distribute hydrocarbons, petroleum products and LPG in the Kingdom, with Aramco’s commitment to meeting all the domestic needs for such products in accordance with the consumption requirements thereof through domestic production or imports in accordance with laws issued by the Government;\n• The right to build, own and operate relevant facilities and assets as may be necessary or desirable to perform Aramco’s operations within the Reserved Areas;\n• Certain rights to acquire and use land, water and other natural products in connection with Aramco’s operations;\n• The right to purchase, lease, import or otherwise obtain all materials, equipment and any other supplies required for Aramco’s operations;\n• The right to conduct such other activity related to the foregoing subject to the provisions of the Concession and applicable law; and\n• The right to receive Government assistance in securing the rights granted in the Concession, obtaining permits, licenses and', '18 months from the Board’s approval date, up to a maximum total spend of ﷼ 11.3 billion ($3.0 billion). The shares\nrepurchased will be classified as treasury shares and will primarily be used by the Company for its employee share plans. The Company intends to complete the repurchase through one or more transactions, and may retain the shares for a maximum period of 10 years from the date of purchase without sale or allocation.\nMaterial agreements Aramco has entered into a number of agreements for the purposes of its business. The following is a summary of those agreements that Aramco considers material to its business. Aramco believes that all such agreements, in addition to the key provisions thereunder, have been included in this section and that there are no other agreements that are material in the context of its business. These summaries do not purport to describe all the applicable terms and conditions of such agreements and are qualified in their entirety by the respective agreements.\nThe Concession Background\nThe Arabian American Oil Company Concession Agreement, which was entered into on 4/2/1352H (corresponding to May 29, 1933) was\nratified on 14/3/1352H (corresponding to July 7, 1933) pursuant to Royal Decree No. 1135, pursuant to which the Government granted\nArabian American Oil Company predecessors certain exclusive rights, including the right to explore, drill, recover, and treat crude oil and other hydrocarbons located within certain areas of the Kingdom. Pursuant to Royal Decree No. M/8 dated 4/4/1409H (corresponding to November 13, 1988) approving Aramco’s original articles, Aramco enjoyed all the privileges and rights provided under the Original\nConcession Agreement (the “Original Concession”). Pursuant to Royal Decree No. M/38, effective 6/4/1439H (corresponding to December 24,\n2017), the Government, represented by the Minister of Energy, and Aramco entered into the Concession Agreement (the “Concession”),\nwhich replaced and superseded in its entirety the Original Concession on such date (the “Concession Effective Date”). Further, on 20/1/1441H\n(corresponding to September 19, 2019), and in accordance with the Hydrocarbons Law, the Government, represented by the Minister of Energy, and Aramco entered into an amendment to the Concession (the “Concession Amendment”), with effect from January 1, 2020.\n\nAramco overview Results and Sustainability Risk Organizational structure Additional financial Consolidated and strategy performance and corporate governance and legal information financial statements All amounts in millions unless otherwise stated Grant of rights The Concession grants Aramco the following rights to be exercised during the term of the Concession:\n• The exclusive right to explore, drill, prospect, appraise, develop, extract, recover, and produce hydrocarbons in the Concession Area;\n• The non-exclusive right to manufacture, refine, treat, market, sell, transport, and export hydrocarbons and their derivatives extracted, recovered, developed, produced, treated, refined, consumed, transported, manufactured, marketed, sold, exported, or dealt with in any other way by Aramco or on its behalf pursuant to the rights granted to Aramco in the Concession;\n• The exclusive right to market and distribute hydrocarbons, petroleum products, and LPG in the Kingdom, with Aramco’s commitment to meeting all the domestic market’s needs for such products in accordance the consumption requirements thereof through domestic production or imports in accordance with laws issued by the Government;\n• The right to build, own, and operate relevant facilities and assets as may be necessary or desirable to perform Aramco’s operations within the Reserved Areas;\n• Certain rights related to lands, such as use of land, easements, water rights, right-of-way, and other suitable rights of any part of the Concession Areas, that are outside the Reserved Area, designated in connection with Aramco’s operations and transportation of products and free access to and use of any part of the Reserved Area;\n• The right to purchase, lease, import or otherwise obtain all materials, equipment, and any other supplies required for Aramco’s operations;\n• The right to conduct such other activity related to the foregoing subject to the provisions of the Concession and applicable law; and,\n• The right to receive Government assistance in securing the rights granted in the Concession, without prejudice to the foregoing, obtaining permits, licenses, and other special approvals and obtaining access, rights of way, and water rights from third parties necessary for Aramco’s operations.\nUnder the Concession, Aramco is required to obtain the necessary licenses, permits, and approvals that may be required pursuant to the Hydrocarbons Law, the Law of Gas Supplies and Pricing (which was superseded', 'was established in the Kingdom as a company with limited liability by virtue of Royal Decree No. M/8 dated 4/4/1409H\n(corresponding to November 13, 1988) to assume the privileges and rights of its predecessor. On January 1, 2018, the Company was\nconverted into a joint stock company pursuant to Council of Ministers Resolution No. 180 dated 1/4/1439H (corresponding to December\n19, 2017) and registered in the city of Dhahran under commercial registration No. 2052101150 dated 11/07/1439H (corresponding to\nMarch 28, 2018) with Saudi Arabian Oil Company as its official name. Its registered head office is located at P.O. Box 5000, Dhahran\n31311, Kingdom of Saudi Arabia. Its share capital is sixty billion Saudi Riyals (SAR 60,000,000,000), consisting of two hundred billion\n(200,000,000,000) fully paid ordinary shares with no par value. Aramco’s primary operating segments are Upstream and Downstream, which are supported by corporate activities (for further details please refer to Section 3: Results and performance).\nOn December 11, 2019, the Company completed its IPO and its ordinary shares were listed on Tadawul. In connection with the IPO, the\nGovernment, being the sole owner of the Company’s shares at such time, sold 3.45 billion ordinary shares, or 1.73% of the Company’s\nshare capital. In addition, concurrent with the IPO, the Company acquired 117.2 million of its ordinary shares from the Government for a cash payment of SAR 3,750 million which are being classified as treasury shares. These shares are for use by the Company for its\nemployee share plans.\nMaterial agreements Aramco has entered into a number of agreements for the purposes of its business. The following is a summary of those agreements that Aramco considers material to its business. Aramco believes that all such agreements, in addition to the key provisions thereunder, have been included in this section and that there are no other agreements that are material in the context of its business. These summaries do not purport to describe all the applicable terms and conditions of such agreements and are qualified in their entirety by the respective agreements.\nThe Concession Background\nThe Arabian American Oil Company Concession Agreement was ratified on 4/2/1352H (corresponding to May 29, 1933) and granted\nAramco’s predecessor certain exclusive rights, including the right to explore, drill, recover and treat crude oil and other hydrocarbons located within certain areas of the Kingdom (which were revised and grew over time), with limited territorial exceptions. Pursuant to\nRoyal Decree No. M/8 dated 4/4/1409H (corresponding to November 13, 1988) approving Aramco’s original articles, Aramco enjoyed\nall the privileges and rights provided under the Arabian American Oil Company Concession Agreement, and all subsequent supplementary documents, agreements, governmental orders and decisions in connection therewith (collectively, the “Original\nConcession”). Effective 6/4/1439H (corresponding to December 24, 2017), and in accordance with the Hydrocarbons Law, the\nGovernment, represented by the Minister of MEIM (predecessor to the Minister of Energy), and Aramco entered into the revised\nConcession Agreement (the “Concession”), which was adopted under Royal Decree No. (M/12) dated 18/1/1441H (corresponding to\nSeptember 17, 2019) and replaced and superseded in its entirety the Original Concession on such date (the “Concession Effective\nDate”). Further, on 20/1/1441H (corresponding to September 19, 2019), and in accordance with the Hydrocarbons Law, the\nGovernment, represented by the Minister of Energy, and Aramco entered into an amendment to the Concession, with effect from January 1, 2020) (the “Concession Amendment”).\nGrant of rights The Government grants Aramco the following rights to be exercised at Aramco’s own responsibility during the term of the Concession:\n• the exclusive right to explore, drill, prospect, appraise, develop, extract, recover and produce hydrocarbons in the Concession Area;\n• the non-exclusive right to manufacture, refine and treat production and to market, sell, transport and export such production;\n• the exclusive right to market and distribute hydrocarbons, petroleum products and LPG in the Kingdom, with Aramco’s commitment to meeting all the domestic market’s needs for such products in accordance with the consumption requirements thereof through domestic production or imports in accordance with laws', 'official\nname. Its registered head office is located at P.O. Box 5000, Dhahran 31311, Kingdom of Saudi Arabia. Its share capital is seventy\nfive billion Saudi Riyals (SAR 75,000,000,000), consisting of two hundred and twenty billion (220,000,000,000) fully paid ordinary\nshares with no par value. Aramco’s primary operating segments are Upstream and Downstream, which are supported by corporate activities (for further details refer to Section 2: Results and performance).\nOn December 11, 2019, the Company completed its IPO and its ordinary shares were listed on Saudi Exchange (The Exchange).\nIn connection with the IPO, the Government, being the sole owner of the Company’s shares at such time, sold 3.45 billion\nordinary shares, or 1.73% of the Company’s share capital. In addition, concurrent with the IPO, the Company acquired 117.2\nmillion of its ordinary shares from the Government for a cash payment of SAR 3,750 million which are being classified as treasury\nshares. These shares are for use by the Company for its employee share plans. On February 13, 2022, the Government announced\nthe transfer of 4% of the Company’s total share capital to the Public Investment Fund (PIF). Therefore, the current ownership of the Government in the Company is 94.19%.\nIn May 2022, the Extraordinary General Assembly approved the granting and distribution of one bonus share for every ten shares\nheld by the shareholders. This resulted in an increase of issued ordinary shares from 200 billion to 220 billion and the share\ncapital of the Company from SAR 60.0 billion to SAR 75.0 billion.\nMaterial agreements Aramco has entered into a number of agreements for the purposes of its business. The following is a summary of those agreements that Aramco considers material to its business. Aramco believes that all such agreements, in addition to the key provisions thereunder, have been included in this section and that there are no other agreements that are material in the context of its business. These summaries do not purport to describe all the applicable terms and conditions of such agreements and are qualified in their entirety by the respective agreements.\nThe Concession Background\nThe Arabian American Oil Company Concession Agreement was ratified on 4/2/1352H (corresponding to May 29, 1933) and\ngranted Arabian American Oil Company certain exclusive rights, including the right to explore, drill, recover and treat crude oil and other hydrocarbons located within certain areas of the Kingdom (which were revised and grew over time), with limited\nterritorial exceptions. Pursuant to Royal Decree No. M/8 dated 4/4/1409H (corresponding to November 13, 1988) approving\nAramco’s original articles, Aramco enjoyed all the privileges and rights provided under the Arabian American Oil Company Concession Agreement, and all subsequent supplementary documents, agreements, Governmental orders and decisions in\nconnection therewith (collectively, the “Original Concession”). Effective 6/4/1439H (corresponding to December 24, 2017), and\nin accordance with the Hydrocarbons Law, the Government, represented by the Minister of MEIM (predecessor to the Minister of Energy), and Aramco entered into the revised Concession Agreement (the “Concession”), which was adopted under Royal Decree\nNo. (M/38) dated 6/4/1439H (corresponding to December 24, 2017) and replaced and superseded in its entirety the Original\nConcession on such date (the “Concession Effective Date”). Further, on 20/1/1441H (corresponding to September 19, 2019), and\nin accordance with the Hydrocarbons Law, the Government, represented by the Minister of Energy, and Aramco entered into an amendment to the Concession, with effect from January 1, 2020) (the “Concession Amendment”).\nGrant of rights The Government grants Aramco the following rights to be exercised at Aramco’s own risk during the term of the Concession:\n• The exclusive right to explore, prospect, drill, appraise, develop, extract, recover and produce hydrocarbons in the Concession Area;\n• The non-exclusive right to manufacture, refine, treat, market, sell, transport and export hydrocarbons and their derivatives extracted, recovered, developed, produced, treated, refined, consumed, transported, manufactured, marketed, sold, exported or dealt with in any other way by Aramco or on its behalf pursuant to the rights granted to Aramco in the Concession;\n• The exclusive right to market and distribute hydrocarbons, petroleum products and LPG in the Kingdom, with Aramco’s', 'share capital. In addition, concurrent with the IPO, the Company acquired 117.2 million of its ordinary shares from the\nGovernment for a cash payment of ﷼ 3.75 billion ($1.0 billion), which are being classified as treasury shares. These shares are for use by the\nCompany for its employee share plans. On February 13, 2022, the Government announced the transfer of 4% of the Company’s total share\ncapital to PIF. On April 16, 2023, the Government announced the transfer of an additional 4% of the Company’s ordinary shares to Sanabil\nInvestments, a wholly-owned subsidiary of PIF, and on March 7, 2024, the Government announced the transfer of an additional 8% of the Company’s ordinary shares to PIF’s wholly-owned companies.\nOn June 11, 2024, the Government completed a secondary public offering of the Company’s ordinary shares. In connection with the\noffering, the Government sold an aggregate of approximately 1.7 billion shares, representing 0.7% of the Company’s issued shares. This\nincludes 137.6 million ordinary shares acquired by the Company from the Government for a cash payment of ﷼ 3.75 billion ($1.0 billion),\nwhich have been classified as treasury shares. These treasury shares will be used by the Company for its employee share plans. Following the completion of the offering, the Government remains the Company’s largest shareholder, retaining an 81.48% direct shareholding as of the date of this Annual Report.\nIn May 2022 and May 2023, the Extraordinary General Assembly approved grants of one bonus share for every ten outstanding shares. As a result of the bonus share grants, the Company’s share capital increased by a total of thirty billion Saudi Riyals by capitalizing a portion of its retained earnings. As a result, as at the date of the Report, the share capital of the Company is ninety billion Saudi Riyals, which is fully paid, consisting of two hundred and forty two billion shares with no par value.\nMaterial agreements Aramco has entered into a number of agreements for the purposes of its business. The following is a summary of those agreements that Aramco considers material to its business. Aramco believes that all such agreements, in addition to the key provisions thereunder, have been included in this section and that there are no other agreements that are material in the context of its business. These summaries do not purport to describe all the applicable terms and conditions of such agreements and are qualified in their entirety by the respective agreements.\nThe Concession Background\nThe Arabian American Oil Company Concession Agreement, which was entered into on 4/2/1352H (corresponding to May 29, 1933) was\nratified on 14/3/1352H (corresponding to 7 July 1933) pursuant to Royal Decree No. 1135, pursuant to which the Government granted\nArabian American Oil Company predecessors certain exclusive rights, including the right to explore, drill, recover, and treat crude oil and other hydrocarbons located within certain areas of the Kingdom. Pursuant to Royal Decree No. M/8 dated 4/4/1409H (corresponding to November 13, 1988) approving Aramco’s original articles, Aramco enjoyed all the privileges and rights provided under the Original\nConcession Agreement (the “Original Concession”). Effective 6/4/1439H (corresponding to December 24, 2017), the Government,\nrepresented by the Minister of Energy, and Aramco entered into the Concession Agreement (the “Concession”), which replaced\nand superseded in its entirety the Original Concession on such date (the “Concession Effective Date”). Further, on 20/1/1441H\n(corresponding to September 19, 2019), and in accordance with the Hydrocarbons Law, the Government, represented by the Minister of Energy, and Aramco entered into an amendment to the Concession (the “Concession Amendment”), with effect from January 1, 2020.\n\n5 . O RGANIZATIONAL 6. ADDITIONAL STRUCTURE AND FINANCIAL 7. C ONSOLIDATED\n\nAND STRATEGY PERFORMANCE 3. SUSTAINABILITY 4. RISK GOVERNANCE INFORMATION STATEMENTS All amounts in millions unless otherwise stated Grant of rights The Concession grants Aramco the following rights to be exercised during the term of the Concession:\n• The exclusive right to explore, drill, prospect, appraise, develop, extract, recover, and produce hydrocarbons in the Concession Area;\n• The non-exclusive right to manufacture, refine, treat, market, sell, transport, and export hydrocarbons and their derivatives extracted, recovered, developed, produced, treated, refined, consumed, transported,', 'tradeable shares Total no. Total no. Total no. No. of Country of of authorized of ordinary of preference issued ordinary incorporation shares shares shares shares Par Value\nRabigh Refining and Petrochemical Company Saudi Arabia 876,000,000 876,000,000 – 876,000,000 SAR 10\nS-Oil Corporation South Korea 240,000,000 180,000,000 60,000,000 112,582,792 Won 2,500\nMaterial subsidiaries with tradeable debt instruments Balance as at Country of Debt December 31, All amounts in millions SAR unless otherwise stated incorporation instruments 20191\nMotiva Enterprises LLC USA Debentures 7,680 S-Oil Corporation South Korea Debentures 10,206\nSadara Chemical Company (through its subsidiary Sadara Basic Services Company) Saudi Arabia Sukuk 6,478 Saudi Aramco Sukuk Company Saudi Arabia Sukuk 11,250\nSaudi Aramco Total Refining and Petrochemical Company (through its wholly owned subsidiary Arabian Aramco Total Services) Saudi Arabia Sukuk 2,530 1. Represents 100% of the balance as reported in the respective subsidiaries’ balance sheet.\nGovernment consents, licenses and certificates Saudi Aramco holds several operational and regulatory licenses and certificates from the relevant competent authorities that are periodically renewed. The following table lists the licenses and certificates currently held by Saudi Aramco that Saudi Aramco considers material in the context of its business.\nDetails of material regulatory and operational licenses and certificates obtained by Saudi Aramco Company Issuing authority License Effective date Expiry date\nSaudi Arabian Oil The Government The Concession December 24, 2017 Initial period of 40 years, with expiry date of\nCompany December 24, 2057, which will be extended\nby the Government for 20 years provided Saudi Aramco satisfies certain conditions commensurate with current operating practices. In addition, the Concession may be extended for an additional 40 years beyond\nthe prior 60-year period subject to Saudi Aramco and the Government agreeing on the terms of the extension.\nSATORP The Government SATORP Feedstock Various Ministerial Letters in connection with Allocation letters the supply of gas products to SATORP.\nMaterial agreements Saudi Aramco has entered into a number of agreements for the purposes of its business. The following is a summary of those agreements that Saudi Aramco considers material to its business. Saudi Aramco believes that all such agreements, in addition to the key provisions thereunder, have been included in this Section and that there are no other agreements that are material in the context of its business. These summaries do not purport to describe all the applicable terms and conditions of such agreements and are qualified in their entirety by the respective agreements. In addition, please see also below for details regarding Saudi Aramco’s financing agreements (Financing Agreements and Guarantees).\nThe Concession Background\nThe Arabian American Oil Company Concession Agreement was ratified on 4/2/1352H (corresponding to May 29, 1933) and granted Saudi Aramco’s\npredecessor certain exclusive rights, including the right to explore, drill, recover and treat crude oil and other hydrogen and carbon compounds in liquid or gaseous state within certain areas of the Kingdom (which were revised and grew over time), with limited territorial exceptions. Pursuant to Royal\nDecree No. M/8 dated 4/4/1409H (corresponding to November 13, 1988) approving Saudi Aramco’s original articles, Saudi Aramco enjoyed all the\nprivileges and rights provided under the Arabian American Oil Company Concession Agreement, and all subsequent supplementary documents, agreements, governmental orders and decisions in connection therewith (collectively, the “Original Concession”). Effective 6/4/1439H (corresponding to December 24, 2017), and in accordance with the Hydrocarbons Law, the Government, represented by the Minister of Energy, and Saudi Aramco entered\ninto the revised Concession Agreement (the “Concession”), which was adopted under Royal Decree No. (M/12) dated 18/1/1441H (corresponding\nto September 17, 2019) and replaced and superseded in its entirety the Original Concession on such date (the “Concession Effective Date”). Further, on\n20/1/1441H (corresponding to September 19, 2019), and in accordance with the Hydrocarbons Law, the Government, represented by the Minister of\nEnergy, and Saudi Aramco entered into an amendment to the Concession, with effect from January 1, 2020) (the “Concession Amendment”).\n\nGrant of rights The Government grants Saudi Aramco the following rights to be exercised at Saudi Aramco’s own responsibility during the term of the Concession:', 'ATED\n\nAND STRATEGY PERFORMANCE 3. SUSTAINABILITY 4. RISK GOVERNANCE INFORMATION STATEMENTS All amounts in millions unless otherwise stated Grant of rights The Concession grants Aramco the following rights to be exercised during the term of the Concession:\n• The exclusive right to explore, drill, prospect, appraise, develop, extract, recover, and produce hydrocarbons in the Concession Area;\n• The non-exclusive right to manufacture, refine, treat, market, sell, transport, and export hydrocarbons and their derivatives extracted, recovered, developed, produced, treated, refined, consumed, transported, manufactured, marketed, sold, exported, or dealt with in any other way by Aramco or on its behalf pursuant to the rights granted to Aramco in the Concession;\n• The exclusive right to market and distribute hydrocarbons, petroleum products, and LPG in the Kingdom, with Aramco’s commitment to meeting all the domestic market’s needs for such products in accordance the consumption requirements thereof through domestic production or imports in accordance with laws issued by the Government;\n• The right to build, own, and operate relevant facilities and assets as may be necessary or desirable to perform Aramco’s operations within the Reserved Areas;\n• Certain rights related to lands, such as use of land, easements, water rights, right-of-way, and other suitable rights of any part of the Concession Areas, that are outside the Reserved Area, designated in connection with Aramco’s operations and transportation of products and free access to and use of any part of the Reserved Area;\n• The right to purchase, lease, import or otherwise obtain all materials, equipment, and any other supplies required for Aramco’s operations;\n• The right to conduct such other activity related to the foregoing subject to the provisions of the Concession and applicable law; and,\n• The right to receive Government assistance in securing the rights granted in the Concession, without prejudice to the foregoing, obtaining permits, licenses, and other special approvals and obtaining access, rights of way, and water rights from third parties necessary for Aramco’s operations.\nUnder the Concession, Aramco is required to obtain the necessary licenses, permits, and approvals that may be required pursuant to the Hydrocarbons Law, the Law of Gas Supplies and Pricing (which was superseded by the Energy Supply Law), and the regulations issued pursuant to these laws. All hydrocarbons in the Kingdom are owned by the Kingdom, and upon extraction or recovery of such hydrocarbons by Aramco, title to such hydrocarbons shall automatically pass to Aramco at the ownership transfer point. Aramco has no rights to any natural resources existing in the Concession Area other than hydrocarbons except as otherwise provided in the Concession.\nThe rights granted to Aramco under the Concession are subject to the Hydrocarbons Law and other applicable law and regulation, including production decisions issued by the Government pursuant to its sovereign authority. Aramco may not sell to any entity any hydrocarbons or derivatives therefrom obtained pursuant to the Concession in violation of decisions the Government considers necessary for the protection of supreme security interests for the Kingdom in times of war or other emergency in international relations.\nTerm The Concession will remain effective for 40 years from the Concession Effective Date, unless terminated earlier in accordance with its terms.\nThe Government will issue a decision to extend the Concession for a period of 20 years on the 30th anniversary of the Concession Effective Date, provided it becomes clear to the Government that Aramco has fulfilled the following conditions: (a) Aramco has exerted reasonable efforts to maximize reserves and their recovery in the Concession Area, taking into consideration production decisions and hydrocarbons market conditions; (b) Aramco has conducted its operations in a manner that (i) is economically efficient, (ii) enhances the productivity of the reservoirs in the long-term in the Concession Area, and (iii) supports good management of hydrocarbons, in all cases, according to the Hydrocarbons Law; and, (c) Aramco generally has conducted its activities and operations in the Kingdom in an economically efficient manner thereby enhancing the efficiency of the Kingdom’s economy.\nIf the Concession is extended as described in the previous paragraph, the Concession may be amended and extended for an additional intent to extend the Concession, at any time from the beginning of the 50th anniversary until the end of the 53rd anniversary of the Concession Effective Date, provided that the parties undertake exclusive negotiations for a two-year period (which may be extended or reduced by mutual agreement of the parties), commencing at the end of the 53rd anniversary of the Concession Effective Date, to reach an agreement on the terms and conditions of such amendment and extension. If the Government and Aramco are unable to reach agreement on the amendment and extension during such exclusive negotiation period, and the Government elects to negotiate with any third-party to enter', 'in its entirety the Original Concession on such date (the “Concession Effective Date”). Further, on\n20/1/1441H (corresponding to September 19, 2019), and in accordance with the Hydrocarbons Law, the Government, represented by the Minister of\nEnergy, and Saudi Aramco entered into an amendment to the Concession, with effect from January 1, 2020) (the “Concession Amendment”).\n\nGrant of rights The Government grants Saudi Aramco the following rights to be exercised at Saudi Aramco’s own responsibility during the term of the Concession:\n• the exclusive right to explore, drill, prospect, appraise, develop, extract, recover and produce Hydrocarbons in the Concession Area;\n• the non-exclusive right to manufacture, refine and treat production and to market, sell, transport and export such production;\n• the exclusive right to market and distribute Hydrocarbons, petroleum products and LPG in the Kingdom, with Saudi Aramco’s commitment to meeting all the domestic market’s needs for such products in accordance with the consumption requirements thereof through domestic production or imports in accordance with laws issued by the Government;\n• the right to build, own and operate relevant facilities and assets as may be necessary or desirable to perform Saudi Aramco’s operations within the Reserved Areas;\n• certain rights to acquire and use land, water and other natural products in connection with Saudi Aramco’s operations;\n• the right to purchase, lease, import or otherwise obtain all materials, equipment and any other supplies required for Saudi Aramco’s operations;\n• the right to conduct such other activity related to the foregoing subject to the provisions of the Concession and applicable law; and\n• the right to receive Government assistance in securing the rights granted in the Concession, obtaining permits, licenses and other special approvals and obtaining access, rights of way and water rights from third parties necessary for Saudi Aramco’s operations.\nUnder the Concession, Saudi Aramco is required to obtain the necessary licenses, permits and approvals that may be required pursuant to the Hydrocarbons Law, the Law of Gas Supplies and Pricing and the regulations issued pursuant to these laws. All Hydrocarbons in the Kingdom are owned by the Kingdom, and upon extraction or recovery of such Hydrocarbons by Saudi Aramco, title to such Hydrocarbons shall automatically pass to Saudi Aramco at the ownership transfer point. Saudi Aramco has no rights to any natural resources existing in the Concession Area other than Hydrocarbons except as otherwise provided in the Concession.\nThe rights granted to Saudi Aramco under the Concession are subject to the Hydrocarbons Law and other applicable law, including production decisions issued by the Government pursuant to its sovereign authority. Saudi Aramco may not sell to any entity any Hydrocarbons or derivatives therefrom in violation of decisions the Government considers necessary for the protection of supreme security interests for the Kingdom in times of war or other emergency in international relations.\nTerm The Concession will remain effective for 40 years from the Concession Effective Date, unless terminated earlier in accordance with its terms.\nThe Government will issue a decision to extend the Concession for a period of 20 years on the 30th anniversary of the Concession Effective Date, provided Saudi Aramco has fulfilled the following conditions: (a) Saudi Aramco has exerted reasonable efforts to maximize reserves and their recovery in the Concession Area, taking into consideration production decisions and Hydrocarbons market conditions; (b) Saudi Aramco has conducted its operations in a manner that (i) is economically efficient, (ii) enhances the productivity of the reservoirs in the long term in the Concession Area and (iii) supports good management of Hydrocarbons, in all cases, according to the Hydrocarbons Law; and (c) Saudi Aramco generally has conducted its activities and operations in the Kingdom in an economically efficient manner thereby enhancing the efficiency of the Kingdom’s economy.\nIf the Concession is extended as described in the previous paragraph, the Concession may be amended and extended for an additional 40 years following the 60th anniversary of the Concession Effective Date, if Saudi Aramco provides the Government with notice confirming its intent to extend the Concession, at any time from the beginning of the 50th anniversary until the end of the 53rd anniversary of the Concession Effective Date, provided that the parties undertake exclusive negotiations for a two year period (which may be extended or reduced by the parties), commencing at the end of the 53rd anniversary of the Concession Effective Date, to reach an agreement on the terms and conditions of such amendment and extension. If the Government and Saudi Aramco are unable to reach agreement on the amendment and extension during such exclusive negotiation period, and the Government elects to negotiate with any third party to enter into an agreement with respect to any Hydrocarbons activities or operations in the Concession Area, Saudi Aramco will have a priority right', 'the date of the Report, the share capital of the Company is ninety billion Saudi Riyals, protection of supreme security interests for the Kingdom in times of war or other emergency in international relations.\nwhich is fully paid, consisting of two hundred and forty two billion shares with no par value.\nTerm Material agreements The Concession will remain effective for 40 years from the Concession Effective Date, unless terminated earlier in accordance Aramco has entered into a number of agreements for the purposes of its business. The following is a summary of those agreements that with its terms.\nAramco considers material to its business. Aramco believes that all such agreements, in addition to the key provisions thereunder, have The Government will issue a decision to extend the Concession for a period of 20 years on the 30th anniversary of the Concession been included in this section and that there are no other agreements that are material in the context of its business. These summaries Effective Date, provided it becomes clear to the Government that Aramco has fulfilled the following conditions: (a) Aramco has exerted do not purport to describe all the applicable terms and conditions of such agreements and are qualified in their entirety by the reasonable efforts to maximize reserves and their recovery in the Concession Area, taking into consideration production decisions and respective agreements.\nhydrocarbons market conditions; (b) Aramco has conducted its operations in a manner that (i) is economically efficient, (ii) enhances the The Concession productivity of the reservoirs in the long-term in the Concession Area, and (iii) supports good management of hydrocarbons, in all cases, according to the Hydrocarbons Law; and, (c) Aramco generally has conducted its activities and operations in the Kingdom in an Background economically efficient manner thereby enhancing the efficiency of the Kingdom’s economy.\nThe Arabian American Oil Company Concession Agreement was ratified on 4/2/1352H (corresponding to May 29, 1933) and granted\nArabian American Oil Company certain exclusive rights, including the right to explore, drill, recover, and treat crude oil and other If the Concession is extended as described in the previous paragraph, the Concession may be amended and extended for an additional hydrocarbons located within certain areas of the Kingdom (which were revised and grew over time), with limited territorial exceptions. 40 years following the 60th anniversary of the Concession Effective Date, if Aramco provides the Government with notice confirming its\nPursuant to Royal Decree No. M/8 dated 4/4/1409H (corresponding to November 13, 1988) approving Aramco’s original articles, Aramco intent to extend the Concession, at any time from the beginning of the 50th anniversary until the end of the 53rd anniversary of the\nenjoyed all the privileges and rights provided under the Arabian American Oil Company Concession Agreement, and all subsequent Concession Effective Date, provided that the parties undertake exclusive negotiations for a two-year period (which may be extended or supplementary documents, agreements, Governmental orders and decisions in connection therewith (collectively, the “Original reduced by mutual agreement of the parties), commencing at the end of the 53rd anniversary of the Concession Effective Date, to reach\nConcession”). Effective 6/4/1439H (corresponding to December 24, 2017), and in accordance with the Hydrocarbons Law, the an agreement on the terms and conditions of such amendment and extension. If the Government and Aramco are unable to reach\nGovernment, represented by the Minister of MEIM (predecessor to the Minister of Energy), and Aramco entered into the revised agreement on the amendment and extension during such exclusive negotiation period, and the Government elects to negotiate with\nConcession Agreement (the “Concession”), which was adopted under Royal Decree No. (M/38) dated 6/4/1439H (corresponding to any third party to enter into an agreement with respect to any hydrocarbon activities or operations in the Concession Area, Aramco will\nDecember 24, 2017) and replaced and superseded in its entirety the Original Concession on such date (the “Concession Effective Date”). have a priority right to enter into an agreement with the Government under the same terms and conditions as agreed between the\nFurther, on 20/1/1441H (corresponding to September 19, 2019), and in accordance with the Hydrocarbons Law, the Government, Government and such third party, provided that Aramco notifies the Government of its desire to exercise the priority right within 120\nrepresented by the Minister of Energy, and Aramco entered into an amendment to the Concession, with effect from January 1, 2020 days of its receipt of a written notice from the Government that includes the entire draft agreement with such third', 'made of, the spirit of our people, and the principles that guide us When the definitive history of Saudi Aramco proved negligible. This demonstrated how is written, 2019 will be considered exceptional seriously Saudi Aramco takes its role and for a number of reasons. Through a variety of responsibility in meeting market demands.\ncircumstances both planned and unexpected, it was a year in which the world was offered Notwithstanding bearish signals that global unprecedented insight into what this company economic growth slowed to some degree in is made of, the spirit of our people, and 2019, global demand for crude oil is expected the principles that guide us. And with this, to continue growing for years to come, with I believe the public gained a powerful GDP growth led primarily by non-OECD appreciation not only of how we operate, Asia Pacific. Short-term market uncertainty, but of what Saudi Aramco means to the swings in commodity prices and unclear future of energy. energy policies continue to impact long-term investment in new and traditional energy In December, we completed Saudi Aramco’s sources and production. However, we record-breaking IPO with the listing of shares continue to maintain our commitment to on Tadawul. This followed April’s launch of invest in the future and in March 2020 we In a year of both tests our first-ever global debt offering, which announced an increase in crude oil supply attracted significant investor interest. The beginning April 1, and subsequently and triumphs, 2019 might response to both our IPO and debt offering Saudi Aramco received a directive from can be seen as a testament to what we the Government to increase our maximum best be remembered have worked so hard to achieve over nearly sustainable capacity. Indeed, our work to nine decades of successful operations. build the world’s foremost integrated energy as the year the world Either event alone would have made for and chemicals company moved forward with a banner year; together, they represent resolve, and in significant ways.\ncame to better know a historic transformation.\nSaudi Aramco.” Preeminence Resilience Our preeminence in upstream remains the As Saudi Aramco’s global visibility was cornerstone of our business, positioning increasing, the world witnessed powerful Saudi Aramco as not only the world’s leading examples of our importance to the crude oil crude oil producer by production volume, market and the resilience that defines us but also the lowest cost producer, one of the when, first, our Shaybah NGL facility was most reliable crude oil suppliers, and among attacked in August, and then in September the world’s least carbon intense sources our oil processing facilities at Abqaiq and of crude oil. In 2019, we entered into Khurais were attacked. The damage inflicted agreements that will increase hydrocarbon by the September strikes resulted in a production capacities at the Berri and Marjan temporary shutdown of approximately 54% fields. The Marjan program also includes\nof Saudi Aramco’s crude oil processing capacity, the construction of a gas plant in the Tanajib which caused understandable concern in area. Further, the development of our Fadhili energy markets. Through an inspiring display gas processing facility is on track to deliver of unity across our workforce, production an additional 2.5 bscfd of gas processing was restored to pre-attack levels within capacity upon completion in 2020. And in\n11 days and the impact on the markets February 2020, we received regulatory\n\napproval for the development of the Jafurah Innovation is an important contributor unconventional gas field in the Eastern to our environmental stewardship as we Province, the largest unconventional gas field continue to deliver new value across our We continue to support in the Kingdom to date, which will provide business through research and development the Kingdom’s efforts valuable feedstock for the petrochemical and initiatives, which resulted in a record metallic industries. We expect the field’s 524 U.S. patents being granted.\nto achieve the objectives production to commence in early 2024.\nWe are also deeply committed to supporting of the United Nations Growth the Kingdom’s Vision 2030 by building a stronger, more diverse and competitive Framework Convention In the downstream business, Saudi Aramco energy sector. In 2019, the key measure for continued to make solid progress towards iktva, our local supply chain development on climate change, the its long-term strategic goal of increasing its initiative, continued to show improvement global gross refining capacity. In addition, Paris Agreement, by reaching 56%.\nin March 2019, Saudi Aramco entered into a purchase agreement to acquire a 70% equity the United Nations\nIn a year of both tests and triumphs, 2019 stake in SABIC, which when completed will see Saudi Aramco’s chemicals business might best be remembered as the year the Environment Program world came to better know Saudi Aramco – operating in more than 50 countries.\nand what it came to know could not make as well as other climate Elsewhere, we acquired a 17% equity']","Aramco's state-granted operating rights under the Concession Agreement include the following main privileges:

1. **Exclusive Rights**:
   - Explore, drill, prospect, appraise, develop, extract, recover, and produce hydrocarbons in the Concession Area.
   - Manufacture, refine, treat, market, sell, transport, and export hydrocarbons and their derivatives.
   - Market and distribute hydrocarbons, petroleum products, and LPG in the Kingdom, ensuring domestic needs are met.

2. **Operational Rights**:
   - Build, own, and operate necessary facilities for operations within the Reserved Areas.
   - Acquire and use land and water rights in connection with operations.
   - Purchase, lease, or obtain all materials and equipment required for operations.

3. **Government Assistance**: 
   - Receive assistance in securing the rights granted in the Concession, obtaining permits, licenses, and approvals.

**Time Structure**:
- The Concession is effective for **40 years** from the Concession Effective Date (December 24, 2017).
- It may be extended for an additional **20 years** if certain conditions are satisfied after 30 years.
- There is also a possibility for another extension for **40 years** after the first extension, contingent upon negotiations starting between the 50th and 53rd anniversaries of the Concession (Section on Concession and Grant of Rights).","The Concession Agreement gives Aramco exclusive rights to explore, develop, recover, produce, market, and distribute hydrocarbons and LPG in Saudi Arabia, along with non-exclusive rights for refining and exporting. Its initial term is 40 years, extendable by 20 years, with a possible additional 40-year extension by agreement.",0.8823529411764706,0.8580613302289293,0.9999999999888889,1.0
How did Aramco describe its shareholder payout during the early pandemic downturn?,"['1.1. Risks related to crude oil Sales of crude oil are the largest component (see – Risks related to environmental supply and demand of Saudi Aramco’s consolidated revenue and protection, health and safety laws and other income related to sales. Accordingly, regulations);\nSaudi Aramco’s results of operations and Saudi Aramco’s results of operations • prices of alternative energies, including cash flow are significantly impacted by the and cash flow are significantly renewable energy;\nprice at which it is able to sell crude oil.\nimpacted by international crude oil\n• the electrification of transportation, supply and demand and the price International crude oil supply and demand technological developments in the cost or at which it sells crude oil.\nand the sales price for crude oil are affected endurance of fuel cells for electric vehicles by many factors that are beyond Saudi Aramco’s and changes in transportation-mode control, including: preferences, including ride-sharing;\n• market expectations with respect to • weather conditions affecting supply and future supply of petroleum and petroleum demand;\nproducts, demand and price changes,\n• fluctuations in the value of the U.S. Dollar, including future demand for petroleum the currency in which crude oil is priced products in Asia;\nglobally; and\n• global economic and political conditions\n• trading activities in the crude oil and geopolitical events, including any that commodities market.\nimpact international trade (including trade routes);\nInternational crude oil prices have fluctuated\n• decisions regarding production levels by significantly in the past and may remain the Kingdom or other producing states (the volatile. Brent crude oil prices witnessed a Kingdom is a member country of OPEC) significant decline between mid-2014 and early see Section 3: Results and performance; 2016, with Brent crude oil prices declining from a monthly average of $112.0 per barrel in June\n• the impact of natural disasters and public\n2014 to a monthly average of $31.9 per barrel\nhealth pandemics or epidemics (such as the in January 2016. From January 2016 to early novel strain of coronavirus known as March 2020, Brent crude oil prices generally\nCoronavirus disease 2019 (COVID-19)) on\nfluctuated between $50.0 and $75.0 per\nsupply and demand for crude oil and barrel. However, most recently, the Brent crude general economic conditions;\noil price fell below $37.0 per barrel in mid-\n• the development of new crude oil March 2020, largely in response to concerns exploration, production and transportation about coronavirus, its potential impact on methods or technological advancements worldwide demand for oil and economic in existing methods, including hydraulic activity, a breakdown in relations among some fracturing or “fracking”; of the world’s largest oil producing countries and a decision by the Company to reduce its\n• capital investments of oil and gas companies official selling prices.\nrelating to the exploration, development and production of crude oil reserves;\nFluctuations in the price at which Saudi Aramco\n• the impact of climate change on the sells crude oil could cause Saudi Aramco’s demand for, and price of, hydrocarbons results of operations and cash flow to vary (see – Risks related to climate change); significantly. In addition, decreases in the price at which Saudi Aramco sells its crude oil could\n• changes to environmental or other have a material adverse effect on Saudi regulations or laws applicable to crude oil Aramco’s results of operations and cash flow.\nand related products or the energy industry\n\n1.2. Risks related to economic Saudi Aramco exports a majority of its crude outbreak of the novel strain of coronavirus and political developments oil and refined products to customers in Asia. known as Coronavirus disease 2019 In addition, Saudi Aramco expects to export (COVID-19)), Saudi Aramco may experience\nin Asia additional crude to Asia as new downstream a material reduction in demand for its assets in Asia commence operations. products by its customers located in that Saudi Aramco exports a substantial region. Moreover, any such development in portion of its crude oil and refined Saudi Aramco expects crude exports to other parts of the world (including political products to customers in Asia, and customers in Asia to continue to constitute a and social instability or armed conflict in the adverse economic or political significant percentage of its total export and MENA region) may result in other producers developments in Asia could impact production volumes. Furthermore, the refined, supplying surplus capacity to Asia, thereby Saudi Aramco’s results of operations.\nchemical and petrochemical products that are increasing competition for customers in Asia produced at Saudi Aramco’s joint ventures and and affecting the prices at which Saudi international operations in Asia are generally Aramco sells its products to customers there.\nsold locally and exported to other Asian Any decrease in demand for Saudi Aramco’s countries. If there is a slowdown in economic products in Asia could have a material adverse growth, an economic downturn or recession effect on its business, financial position and or other adverse economic or', 'ABIC\nmakes it a major global producer of petrochemicals and expands its capabilities in procurement, manufacturing, marketing, and sales.\nWith the SABIC acquisition, Aramco’s chemicals business operates in over of chemical products.\nAramco’s Downstream segment includes its crude oil and product sales, distribution and trading operations. These operations support Aramco’s upstream and downstream activities by enabling it to optimize crude oil sales and product placement through its significant infrastructure network of pipelines and terminals and access to shipping and logistics resources.\nSee page 58 for further information.\n\nweivrevo ssenisuB\n\nMarket overview The global economy in 2020 was severely impacted by the COVID-19 pandemic Global Domestic energy demand, essentially unchanged since 2015, is estimated to\nThe global economy in 2020 was severely\nhave dropped by 3.1% in 2020, the\nimpacted by the COVID-19 pandemic and highest year-on-year decline in almost its related lockdowns with subsequent three decades. The drop in demand was recoveries being tamed by recurring caused by lockdowns and other outbreaks of the virus. Accordingly, the containment measures enacted by the global economy contracted by 3.9% in\nGovernment in the wake of the COVID-19\n2020, compared to 2.6% growth in 2019,\npandemic. Transportation fuel demand per IHS Markit estimates.\nwas impacted the most, falling by an\nestimated 15% during 2020, with jet fuel\nThe IHS Markit Global Crude Oil Markets and gasoline hit the hardest reflecting Outlook estimates global oil demand international travel restrictions, curfews,\ndecreased by 10.3 mmbpd in 2020,\nand lockdowns.\ndropping to 91.0 mmbpd with global The sharpest downturn in the energy\n93.9 mmbpd in 2020. Therefore, the\n$ /bbl sector was witnessed in April when\nmarket has been oversupplied for overall demand for transportation fuels the year.\nplunged by 46% year-on-year, with Brent crude oil price averaged $42/bbl\naviation fuels down by 86% and gasoline\nin 2020, approximately 34% lower than Brent crude oil price averaged $42/bbl\ndown by over 60%. Energy demand in the\nthe average of $64/bbl in 2019 in 2020, approximately 34% lower than\npower generation and water desalination\nthe average of $64/bbl in 2019.\nsector on the other hand, dropped by a\nmuch more modest 0.7% to 1.9 mmboed\nDomestic in 2020. In contrast, and despite supply- According to economic data released chain disruptions globally, industrial by the General Authority for Statistics energy demand increased slightly. In line (GSTAT) the Kingdom’s GDP is estimated with the recent trend, the share of sales\nto have contracted by 4.1% in 2020, gas, ethane, and natural gas liquids in the\nvis-à-vis the previous year. This represents Kingdom’s primary energy mix continued\na significant reduction when compared growing, reaching 55% in 2020, up from\nto the 0.3% growth registered in 2019. 53% in 2019.\nIt is expected that all institutional sectors of the Saudi economy (oil and non-oil, consisting of the private and government See Section 3: Results and performance for key factors affecting Aramco’s financial results.\nsectors) registered negative growth rates in 2020.\n\nStrategy Aramco’s strategy aims to reinforce its competitive positions across its upstream and downstream operations Aramco’s vision is to be the world’s preeminent integrated Maintain its position as the world’s largest crude oil producer energy and chemicals company, 1 by production volume and one of the lowest cost producers, operating in a safe, sustainable while providing reliable, low carbon intensity crude oil supply and reliable manner. to customers Aramco strives to provide its shareholders with resilient value creation through crude oil See page 30 for more detail.\nprice cycles by maintaining its preeminence in oil and gas production, capturing additional value across the hydrocarbon Capture value from Expand gas activities value chain and profitably 2 3 further strategic growing its portfolio.\nintegration and diversification Aramco’s strategy aims to of its operations reinforce its competitive positions across its upstream\nand downstream operations. See page 31 for more detail. See page 31 for more detail.\nExpand global Efficiently allocate recognition of capital and maintain Aramco’s brands a prudent and flexible balance sheet\nSee page 32 for more detail. See page 32 for more detail.\nDeliver sustainable Operate sustainably dividends through by leveraging crude oil price cycles technology and innovation\nSee page 33 for more detail. See page 33 for more detail.\n\nweivrevo ssenisuB', 'to be Technical Professional (PTP) roles are happy, healthy, productive, and highly also actively promoted through the engaged — both at work and at home.\ncollege degree sponsorship program.\nEmployee development In the spring of 2020, employee development programs were migrated to the virtual environment in parallel with other COVID-19 risk mitigation measures.\nBetween March and December, more than 1,300 learning and development programs were conducted online, serving approximately 20,000 participants.\nThe Company also deployed courses via the Learning through Interactive Virtual Environment (LIVE) platform for 3,500 users, and leveraged the Harvard Manage Mentor site to reach more than 21,000 unique users for the delivery of\n42,000 online learning modules.\n\nlaicos ,latnemnorivn E\n\nAn Aramco geologist, participating in the company’s STEMania program, encourages female students to study science, technology, engineering, and mathematics.\n\nGrowing societal value Developing local supply chains Since the launch of iktva in 2015, the Company’s suppliers have tripled their Aramco is actively building a world-class local purchases of goods and services.\nsupply chain, through the In-Kingdom There has been a 20-fold increase Total Value Add (iktva) program, to serve in spending by the Company’s main the needs of the Company and its suppliers in developing local sub-suppliers.\npartners, facilitating the development Suppliers are now investing three times of a diverse, sustainable, and a globally the amount on research and development competitive energy sector in the in the Kingdom, and their employment Kingdom. The Company strives to of Saudi nationals is up by 60%, with cultivate local business with the goal female employment increasing by to retain 70% of all procurement spend\nalmost one-third.\nin-Kingdom.\n2020 2019 Iktva’s proven success model has become\nthe cornerstone for the Local Content\niktva1 (%) 57.5 55.8\nand Government Procurement Authority 1. Company. localization model, which will accelerate the maturity of the Kingdom’s industrial Iktva provided tangible benefits to the ecosystem across all sectors. This model Company and Kingdom during the global has attracted more than 450 investments.\npandemic of 2020. Localized supply chains From Jazan Economic City to the King enabled the Company to maintain Salman International Complex for operations with minimal disruption.\nMaritime Industries & Services, iktva has Many of the Company’s supply chain created an ecosystem of integrated value partners continued to build and startup chains to help businesses hit the ground facilities in-Kingdom despite the economic running in Saudi Arabia.\ndownturn, ensuring the provision of supplies and services to the Company The iktva program has demonstrated and retention of Saudis in the workforce.\nthe benefits of creating successful Billions of dollars in economic activity partnerships with business, government, that historically would have left the and academia. It also increases the Kingdom instead remained to serve the Company’s competitiveness, drives interests of the Company and support industry collaboration and brings the local economy.\ninnovation to the Kingdom through research and development. The synergy driven by the iktva program has delivered greater levels of prosperity for the Kingdom, the local business community, and Aramco.\n\nCitizenship COVID-19 Aramco’s citizenship programs throughout the Kingdom support economic and community projects that In response to the COVID-19 procurement processes. This was\nempower people to take the next step pandemic, Aramco adopted measures supported by a supercomputing forward and turn ideas into reality.\nto promote the safety, health and Human Resources data center These initiatives encompass a broad well-being of employees and that provides essential data and spectrum, from high-profile health care communities, while maintaining information to inform day-to-day projects to small business startups and a reliable supply of oil and gas to response efforts, and which has women’s groups.\nglobal markets — including vital been recognized by the World inputs for the chemicals, plastics and Economic Forum as a COVID The King Abdulaziz Center for World pharmaceutical industries — which “Global Best Practice.”\nCulture (Ithra) is Aramco’s flagship have been essential in global corporate citizenship initiative, and one coronavirus response efforts. Johns Hopkins Aramco Healthcare of the largest cultural contributions to (JHAH) is integral to the Company’s the Kingdom. Ithra globally showcases A dedicated internal taskforce was medical preparedness and response Saudi potential, facilitating the established to ensure business to COVID-19. JHAH took proactive generation of new creative content, continuity, safe operations, and measures to roll-out a companywide enabling the growth and talent of the community well-being. Aramco health awareness campaign, including Kingdom’s creative sector and providing implemented numerous measures at weekly updates, and ensured all new global cultural experiences to each operational location, including Company employees have access to Saudi audiences.\nactive prevention programs, detailed accurate and reliable information contingency plans and leading about preventing transmission of Aramco’s initiative to seed micro- medical support services to minimize COVID-19,', 'able to sell crude oil have previously,\n• Markets’ expectations with respect oil and related products or the energy and could in the future, cause Aramco’s to future supply of petroleum and industry (see risk — Aramco’s results of operations and cash flow to vary petroleum products, demand and operations are subject to environmental significantly. In addition, decreases in the price changes; protection, health and safety laws and price at which Aramco is able to sell its\n• Global economic and political conditions regulations, and increased concerns crude oil could have a material adverse and geopolitical events, including any regarding the safe use of chemicals and effect on Aramco’s results of operations that impact international trade plastics and their potential impact on and cash flow.\n(including trade routes); the environment have resulted in more restrictive regulations and could lead\n• Decisions regarding production levels to new regulations);\nby the Kingdom or other producing states (the Kingdom is a member • Prices of alternative energies, including country of OPEC) (see Section 3: Results renewable energy;\nand performance); • The electrification of transportation,\n• The impact of natural disasters and technological developments in the cost public health pandemics or epidemics or endurance of fuel cells for electric (such as COVID-19) on supply and vehicles, and changes in transportation- demand for crude oil, general economic mode preferences, including ride-sharing;\nconditions, and the ability to deliver • Weather conditions affecting supply crude oil; and demand;\n• The development of new crude oil • Fluctuations in the value of the U.S.\nexploration, production and transportation dollar, the currency in which crude oil methods or technological advancements is priced globally; and in existing methods, including hydraulic fracturing or “fracking”; • Crude oil trading activities.\nRisk The COVID-19 pandemic and its impact on business and economic conditions has had, and is expected to continue to have, negative effects on Aramco’s business, financial position, cash flow, results of operations, and price of its securities.\nThe COVID-19 pandemic and measures In addition to its impact on economic Aramco is not able to predict how long the\ntaken to combat it continue to have a activity, COVID-19 has had, and could COVID-19 pandemic will persist, how long\nwidespread impact on business and continue to have, a direct impact on the measures that have been introduced economic conditions, including on the Aramco’s operations. In the Kingdom, to respond to it will be in place, or if demand for crude oil, natural gas, refined public health authorities have taken additional restrictive measures may be products, and petrochemicals. Public various measures to combat the spread reintroduced. Aramco also cannot predict\nhealth authorities and governments at of COVID-19. For example, in March 2020 how long the effects of COVID-19 and the\nlocal, national, and international levels a temporary nationwide curfew was efforts to contain it will continue to impact have, at various times, announced various introduced, which required Aramco to its business after the pandemic is under measures to respond to the pandemic, adjust working hours for some personnel. control or if additional, more restrictive including restrictions on travel, voluntary In addition, the health of some of measures to combat the pandemic will be or mandatory quarantines, workforce Aramco’s employees has been impacted implemented. These impacts could result reductions of personnel who are deemed and some of its personnel have been in a worsening of the effects of the to be nonessential, and the full closure quarantined. If public health authorities pandemic on Aramco’s business, cash of business activities deemed to be determine that persons suspected of flows, results of operations, and price of its\nnonessential. These measures have severely or confirmed to have COVID-19, have securities. The extent to which COVID-19\nimpacted economic activity and led to spent time at any of Aramco’s facilities, could impact Aramco’s business depends lower demand for crude oil, natural gas, Aramco may be required to pause certain on future developments that are highly refined products, and petrochemicals. operations or close certain facilities uncertain and are outside of Aramco’s Moreover, the COVID-19 pandemic has for a considerable time. If a significant control, including new information resulted in volatility in global capital percentage of Aramco’s workforce is which may quickly emerge concerning markets and investor sentiment, which may unable to work, or if Aramco is required the severity of the virus, the scope of the affect the availability, amount, and type of to close facilities because of illness or pandemic, and actions to contain the virus financing available to Aramco in the future. government restrictions in connection or treat its impact and the efficacy of such with the COVID-19 pandemic, Aramco’s actions, among others.\noperations may be negatively impacted.\nAramco operates in a highly competitive environment. Competitive pressure could have a material adverse impact on the price at which it sells crude oil and other', 'aspiration to make a positive difference through their work. At Aramco we give our people the opportunity to do the work they dreamed of doing, and support them in achieving more than they thought possible.\nPioneers and innovators, scientists and engineers, dreamers and thinkers — our people are our most important asset. They drive us forward, every hour of every day, as we aim to lead the way in responsibly producing reliable energy for the world.\nJoin us to help reshape the global energy landscape and set our world on a path towards a lower-carbon energy future.\nOpportunities for all Jobs in regional offices Explore our world of rewarding career options in Asia, Europe, and U.S.\n\nNational talent recruitment We give our people the opportunity to do the work they’ve dreamed of doing.\n\nInternational recruitment Our employees are drawn by the rewarding professional opportunities we offer.\n\nA great place to work Employee reviews See more on Glassdoor Glassdoor rating ""Great pay and benefits, but hot in summer.""\nAccount Manager, April 2026 “Great salary, great people, changing lives and giving opportunities to the youth of the country”\nAdvanced ITC Teacher, March 2025 8+ years “Great career and work life-balance”\nGeologist, June 2024 “Aramco is the Best Company that I have ever worked for. The work environment is the most productive that I have ever worked in”\nIT Consulting Engineer, March 2024 8+ years “Challenging and exciting tasks, solving tomorrows toughest challenges”\nLead Analyst, August 2023 “Good place to work in. Work-life balance is top priority of company and career growth is highly encouraged”\nSenior Business Analyst, August 2023 “Excellent company to work for all around”\nPilot, June 2023 10+ years “Amazing work environment, and great colleagues”\nScience specialist, April 2023 10+ years “Cross cultured, multi-national organization. It’s amazing to work for the company”\nSupply Chain Director, February 2023 Testimonials “As a working mother of three I’ve found that settling in to life at Aramco has been seamless.”\nRosa Peterson — Lead Environmental Scientist\n\n“Moving from Chile to Saudi Arabia was one of the most important decisions of my life and, to be honest, one of the best.”\nMiguel Arias Vasquez — Senior Hydrographer\n\n“I joined Aramco quite early-on in my Career, it felt like a huge leap of faith, but the feeling of community is like nothing I’ve ever experienced.”\nLucy Gadsby — Executive Assistant to Senior Vice President\n\n“I joined Aramco in 2013 and really enjoy the diversity and richness of culture and the people that I work with every day. It’s truly a global network.”\nFahad Rana — Manager Projects Business Support\n\nA diverse workplace Equity and inclusion We are committed to attracting and developing diverse talent in a welcoming and inclusive work environment.\n\nYLAB: Young Leaders Advisory Board Engaging and inspiring our young employees.\n\nWomen in business How we\'re supporting women\'s educational and career aspirations in our workforce and beyond.\n\nStories about our people Show all articles Elements February 05, 2026 How Aramco is driving sporting excellence Elements January 01, 2026\nA day in the life of an OSPAS engineer Elements December 10, 2025 The desert pioneer behind our first oil discovery Elements November 27, 2025\nMeet Aramco\'s divers Latest social posts About us Learn more about Aramco.\n\nSOURCE: Sustainability  | Aramco\nURL: https://www.aramco.com/en/sustainability\nTYPE: Website Content\n\nOur approach to sustainability\n\nRead our 2024 Sustainability Report A sustainable approach is essential to how we operate, as well as to ensuring that Aramco continues to thrive in the long-term, and remains one of the world’s leading integrated energy and chemicals companies.\nIt allows the Company to consider how societal and environmental issues affect our day-to-day business, and is a key driver of our strategy as we navigate a global Energy Transition and the shift towards a lower-carbon economy.\nWe recognize the scale and urgency of the climate challenge. We are leveraging our operational strengths and our business portfolio to play our part in the Energy Transition, underpinned by our ambition to achieve net-zero Scope 1 and Scope 2 greenhouse gas emissions across our wholly-owned operated assets by 2050, and our development of lower-carbon energy solutions.\n\nClimate and energy Our efforts towards GHG emissions reduction and efficient resource utilization across our operations.\n\nPeople and safety We strive to provide a safe and respectful working environment for all.\n\nEnvironment Environmental stewardship is deeply integral to our approach.\n\nSociety Initiatives and programs created to support the communities and the environment in which we operate.\n\nGovernance and oversight Aramco’s internal governance model for sustainability.\n\nSustainability news and stories\n\nNews March 24, 2025 Aramco completes acquisition of 50% stake in Blue Hydrogen Industrial Gases', 'of Saudi Aramco who, while subordinate Sumitomo Chemical Co., Ltd.\nthere were issues that negatively impacted to the Senior Executives, are still involved reliability. Total in the management of Saudi Aramco and Total S.A.\nReserved Areas participate in driving its strategies, decisions The areas reserved for Saudi Aramco’s or operations. Total Recordable Case Frequency operations within the Concession Area. Sum of recordable cases that occurred in Senior Unsecured Notes the workplace per 200,000 work hours.\nSABIC On April 16, 2019, Saudi Aramco issued\nSaudi Basic Industries Corporation. $12.0 billion in aggregate principal amount Unconventional oil and gas of senior unsecured notes under the GMTN Term refers to the oil and gas resources\nProgram comprising five tranches, all of which cannot be explored, developed and Saudi Arabian Drilling Academy.\nwhich are payable semi-annually in arrear: produced by conventional processes just in\nSadara $1.0 billion 2.750% senior notes due 2022; using the natural pressure of the wells and\nSadara Chemical Company, a joint venture $2.0 billion 2.875% senior notes due 2024; pumping or compression operations.\nestablished by Saudi Aramco and Dow Saudi $3.0 billion 3.500% senior notes due 2029;\nArabia B.V. in 2011. $3.0 billion 4.250% senior notes due 2039\nYanbu’ Aramco Sinopec Refinery Company\nand $3.0 billion 4.375% senior notes due 2049.\nSAMREF Limited, a joint venture established by Saudi Saudi Aramco Mobil Refinery Company Shareholder Aramco and Sinopec Century Bright Capital Limited, a joint venture established by the Any holder of shares. Investment (Amsterdam) B.V. in 2010.\nSaudi Arabian Marketing and Refining Shell Company and Mobil Yanbu’ Refining Royal Dutch Shell plc.\nCompany Inc. in 1982.\n\nSOURCE: Saudi Aramco — Annual Report 2020\nTYPE: Annual Report\nURL: https://www.aramco.com/-/media/publications/corporate-reports/annual-reports/saudi-aramco-ara-2020-english.pdf\n\nR esilience and agility Aramco’s exceptional past belongs to its future.\nOur people define our success.\nEnergy has been running in our DNA for generations.\nWe are proud of what we accomplished during 2020.\nOnce again, our resilience shone through.\nWe delivered on our shareholder commitments.\nAnd we continued to deliver an uninterrupted supply of energy to the world.\nOur resilience and agility has built one of the world’s largest integrated energy and chemicals companies.\nAnd we are part of the global effort toward building a low carbon economy.\nOur horizon has never been clearer.\nThis Annual Report covers financial and operational aspects of Aramco from January 1, 2020 to December 31, 2020, and\nis issued in both Arabic and English. The print version is identical to its PDF counterpart, which is available at aramco.com.\nThe Arabic version prevails in the event of any discrepancy. The images in this document are representative of the services provided by Aramco. Some photos may have been taken prior to the COVID-19 pandemic. Wherever possible, sustainable printing techniques were used.\n\nMinimizing environmental impact: 78 Accelerating human potential: 82 statements\nGrowing societal value: 86 Independent auditor’s report: 168\nConsolidated statement of income: 176 Consolidated statement of comprehensive income: 177\nConsolidated balance sheet: 178 Consolidated statement of changes in equity: 179\nConsolidated statement of cash flows: 180 Notes to the consolidated financial statements: 181\nThe information contained in Sections 1 – 7 of this Annual Report constitutes our Board of Directors’ report.\n\nChairman’s message We remain focused on sustaining the strength, scale, and efficiency of our operations and ensuring the continuity of a vital and reliable energy supply to our customers around the world Dear Shareholders, In this respect, Aramco took a major step in 2020 by completing its largest ever acquisition with the $69.1 billion purchase In a time of unprecedented global of a 70% stake in Saudi Basic Industries\neconomic uncertainty due to the Corporation (SABIC). As the integration COVID-19 pandemic, Aramco displayed continues, SABIC offers a complementary exceptional resilience by continuing to presence in terms of geography, projects, deliver value to our shareholders and partners, enhancing Aramco’s throughout 2020.\nposition in the petrochemical sector.\nDespite the volatile and weaker market\n2020 saw significant achievements in our\nenvironment, Aramco once again gas business as we continued to expand reported solid earnings and cash flows for our production and processing capacities.\nthe full year while demonstrating ongoing In', 'of a talented team. And on behalf of the Government of Saudi Arabia in March last time satisfying the world’s growing Board of Directors, I want to take this year. The word “shareek” means partner energy requirements, is the biggest dual opportunity to acknowledge the men and in Arabic, and as the name suggests, the challenge facing our industry. With our women of Aramco for their dedication program is designed to promote increased low upstream carbon intensity and our and commitment. I also want to express public-private partnerships through low-cost oil, as well as our demonstrated our collective appreciation to our a range of finance, funding, tax, and capacity to innovate, we firmly believe customers, partners, suppliers, and regulatory incentives. In alignment Aramco is well positioned for the future. contractors for their ongoing support.\nwith Shareek, we continue to expand our iktva initiative to further develop our Maintaining good governance Finally, to our shareholders, we thank local supply chain, while also launching you for your continued confidence in Aramco Namaat as we seek to make a As we chart our course forward, we our Company.\npositive social and economic impact. also welcomed two new members to our Board of Directors in 2021: Stuart T.\nThe development of the Jafurah Gulliver, former Group CEO of HSBC, and unconventional gas field is another Khalid H. Al-Dabbagh, former Senior H.E. Yasir O. Al-Rumayyan example of our efforts to create value. Vice President, Finance, Strategy and Chairman of the Board of Directors In addition to making Saudi Arabia Development of Aramco. Both were one of the world’s largest natural gas elected to the Board at our Ordinary producers, Jafurah is expected to Annual General Assembly meeting in July, contribute to the Kingdom’s goal of filling seats vacated by H.E. Nabeel M.\nproducing half of its electricity from Al-Amudi and Sir Mark Moody-Stuart.\ngas and half from renewables. On behalf of the Board, I would like to take this opportunity to express our deep appreciation to both Nabeel and Sir Mark for their valuable contributions to Aramco.\n\nPresident and CEO’s message Generating value and providing reliable, cleaner energy Dear Shareholders, With hindsight, there are certain points at certain times that stand out as pivotal, and in 2021 there were several such moments.\nGlobally, we saw economic momentum return in many countries along with growing optimism that rising vaccinations would be a turning point to mark the beginning of the end of the pandemic.\nRelated to our industry, there were signs of energy supply concerns in some parts of the world, which should serve to illustrate the potential consequences of further under-investment in conventional energy production.\nAramco also marked a number of milestones in 2021 that are highlighted in this report. The most significant, by far, was announcing our ambition to achieve net-zero Scope 1 and Scope 2 greenhouse gas emissions across the Company’s wholly-owned operated assets by 2050.\nOther key achievements included two landmark transactions to monetize our pipelines infrastructure. We also moved forward with the development of the Jafurah unconventional gas field, which has the potential to make Saudi Arabia one of the world’s leading gas producers Longer-term, we will continue to position by 2030. In addition to declaring total cash dividends of SAR 281.3 billion\nAramco to be a cornerstone of world energy\n($75.0 billion) for 2021, the Board also\nsecurity, providing reliable and ever-cleaner recommended the granting of bonus shares to shareholders in recognition of energy throughout the global energy transition.” our outstanding operational performance and financial results for the year.\nFrom a personal perspective, I am proud of how well my colleagues adapted to the challenges presented by COVID-19.\nIndeed, their overwhelmingly positive response to a Company-led vaccination campaign was instrumental in our ability to maintain uninterrupted operations.\n\nAramco Building our business Innovation continues to be a priority for Generating value In our Upstream operations, we are Aramco. Early in 2021, we commissioned through partnerships one of the most powerful supercomputers expanding our capability to increase our Aramco has long believed that in the world to run three-dimensional earth crude oil Maximum Sustainable Capacity collaboration is critical to identifying modeling to enhance efficiencies in\nfrom 12.0 mmbpd to 13.0 mmbpd. This sustainable solutions. In 2021, we\nexploration and production. In a fitting additional capacity is expected to come continued working with numerous tribute to the Kingdom’s first commercial oil on-stream by 2027. We have completed partners to generate long-term value.\nwell, our new 55.4-petaflops supercomputer work on crude oil increments at ‘Ain Dar was named “Dammam-7.” Aramco was and Fazran, which will provide access to This included establishing the Altamayyuz also granted 864 U.S. patents last year,\nsecondary reservoirs', 'by international crude oil supply in the price at which Aramco sells its methods, including hydraulic fracturing and demand and the price at which crude oil could have a material adverse or “fracking”;\neffect on Aramco’s results of operations it sells crude oil.\n• capital investments of oil and gas and cash flow.\ncompanies relating to the exploration, Sales of crude oil are the largest development and production of crude International crude oil prices have component of Aramco’s consolidated oil reserves; fluctuated significantly in the past and revenue and other income related to may remain volatile. Between January\nsales, accounting for 56.5%, 56.4% and • the impact of climate change on the 2016 and February 2020, Brent prices\n57.3% for the years ended December 31, demand for, and price of, hydrocarbons generally fluctuated between $40.0 and\n2017, 2018 and 2019, respectively, and (see risk — Climate change concerns $65.0 per barrel. However, most recently,\n49.1% for the year ended December 31, and impacts could reduce global Brent prices fell below $23.0 per barrel in\n2020. Accordingly, Aramco’s results of demand for hydrocarbons and mid-March 2020 and generally fluctuated\noperations and cash flow are significantly hydrocarbon-based products and could between $30.0 and $50.0 per barrel\nimpacted by the price at which it sells cause Aramco to incur costs or invest through December 31, 2020, in response\ncrude oil. additional capital); to the COVID-19 pandemic and its impact\n• changes to environmental or other on worldwide demand for oil and International crude oil supply and regulations or laws applicable to crude economic activity as well as other supply demand and the sales price for crude oil oil and related products or the energy and demand factors. Because the are affected by many factors that are industry (see risk — Aramco’s consequences and duration of these beyond Aramco’s control, including: operations are subject to environmental events are uncertain, Aramco is not able\n• markets’ expectations with respect to protection, health and safety laws and to predict the full extent and impact future supply of petroleum and regulations and increased concerns lower oil prices will have on Aramco’s petroleum products, demand and price regarding the safe use of chemicals and results of operations and cash flow.\nchanges, including future demand for plastics and their potential impact on petroleum products in Asia; the environment have resulted in more restrictive regulations and could lead to new regulations);\n\nThe COVID-19 pandemic and its Aramco is not able to predict how long factors affecting competition for refined impact on business and economic the COVID-19 pandemic will persist or products and chemicals. Accordingly, if\nhow long the measures that have been the operating efficiencies and production conditions could negatively affect introduced to respond to it will be in costs of Aramco’s refineries are not Aramco’s business, financial place. Aramco also cannot predict how sufficiently competitive in the geographies position, cash flow, results of long the effects of COVID-19 and the they serve, Aramco’s business, financial operations and price of its efforts to contain it will continue to position and results of operations could securities. impact its business after the pandemic be materially and adversely impacted.\nis under control or if additional, more restrictive measures to combat the Climate change concerns and The COVID-19 pandemic and measures taken to combat it are having a pandemic will be implemented. These impacts could reduce global impacts could result in a worsening of the widespread impact on business and demand for hydrocarbons and effects of the pandemic on Aramco’s economic conditions, including on the hydrocarbon-based products and business, cash flows, results of operations demand for crude oil, natural gas, refined and price of its securities. The extent to could cause Aramco to incur costs products and petrochemicals. Public which COVID-19 could impact Aramco’s or invest additional capital.\nhealth authorities and governments at business depends on future developments local, national and international levels that are highly uncertain and are outside have announced various measures to Climate change concerns manifested in of Aramco’s control, including new respond to the pandemic, including public sentiment, government policies, information which may quickly emerge restrictions on travel, voluntary or laws and regulations, international concerning the severity of the virus, mandatory quarantines, workforce agreements and treaties and other actions the scope of the pandemic and actions reductions of personnel who are deemed may reduce global demand for to contain the virus or treat its impact to be non-essential and the full closure of hydrocarbons and propel a shift to lower and the efficacy of such actions, business activities deemed to be non- carbon intensity fossil fuels such as gas or among others.\nessential. These measures have severely alternative energy sources. In particular, impacted economic activity and led to increasing pressure on governments to Aramco operates in a highly lower demand for', 'activities was reduced from the 50% rate applicable to qualified domestic oil and hydrocarbon production companies to the general corporate tax rate of 20% applicable to similar domestic downstream companies under the\nSaudi Arabian Income Tax Law of 2004 and its amendments (the “Tax Law”). The new rate is conditioned on the Company separating its\nDownstream activities under the control of one or more separate wholly owned subsidiaries before December 31, 2024, otherwise, the\nCompany’s Downstream activities will be retroactively taxed at 50%. The Company expects to transfer all its Downstream activities into a separate legal entity or entities within the period specified (Note 8).\nDuring the current quarter, the Tax Law was amended whereby shares held directly or indirectly in listed companies on the Tadawul by taxpayers engaged in oil and hydrocarbon activities are exempt from the application of the corporate income tax. As a result, the Company’s ownership interests in SABIC, Rabigh Refining and Petrochemical Company (“Petro Rabigh”), National Shipping Company of Saudi Arabia (“Bahri”) and Saudi Electricity Company (“SEC”) are now subject to zakat (Note 8).\n(b) New or amended standards (i) Saudi Aramco adopted the following IASB pronouncement, as endorsed in the Kingdom, effective for annual periods beginning on or after January 1, 2020:\nIn September 2019, the IASB amended IAS 39, Financial Instruments: Recognition and Measurement, IFRS 7, Financial Instruments: Disclosures,\nand IFRS 9, Financial Instruments, which modify some specific hedge accounting requirements to provide relief from potential effects of the uncertainty caused by the Interbank Offered Rate (“IBOR”) reform in which the London Interbank Offered Rate (“LIBOR”) interest benchmark will cease after 2021. The amendments also require companies to provide additional information about their hedging relationships that are directly affected by these uncertainties. Additionally, the IASB is considering the potential consequences on financial reporting of replacing an existing benchmark with an alternative. IBOR reforms and expectation of cessation of LIBOR will impact Saudi Aramco’s current risk management strategy and possibly accounting for certain financial instruments used for hedging. Saudi Aramco has recognized the following hedging instruments at fair value (Note 3) which are exposed to the impact of LIBOR with a nominal value of SAR 11,745:\n- Financial Liabilities: SAR 1,061 Saudi Aramco uses financial instruments as part of its risk management strategy to manage exposures arising from variation of interest rates that could affect net income or other comprehensive income and applies hedge accounting to these instruments. Saudi Aramco has certain borrowings where the reference rate is linked to LIBOR. Saudi Aramco is establishing a transition plan that follows a risk management approach to ensure a smooth transition to alternative reference rates. There is no material impact on Saudi Aramco’s condensed consolidated interim financial report from adopting these amendments to IAS 39, IFRS 7, and IFRS 9.\nOther standards and amendments did not have any impact on Saudi Aramco’s accounting policies and did not require retrospective adjustments.\n(ii) Saudi Aramco has not early adopted any new accounting standards, interpretations or amendments that are issued but not yet effective.\n(c) Reclassifications Certain comparative amounts in the Condensed Consolidated Statement of Income for the three-month and six-month periods ended June 30, 2019 have been reclassified to conform to the current period presentation. Such reclassifications did not impact the previously reported\nnet income. These include certain sales of crude oil and related purchases of refined products in the amount of SAR 2,849 and SAR 5,385,\nrespectively, which are presented in the Condensed Consolidated Statement of Income as revenue and purchases, reflecting current trading\narrangements, and producing and manufacturing costs in the amount of SAR 1,625 and SAR 3,196, respectively, which are presented in the\nCondensed Consolidated Statement of Income as purchases.\n(d) Inventories\nDuring the three-month and six-month periods ended June 30, 2020, a portion of the inventory purchased from third parties by certain subsidiaries\nwas written-down to its net realizable value.\n3. Fair value estimation Fair value is the price that would be received to sell an asset or paid to transfer a liability in an orderly transaction between market participants at the measurement date. The fair value measurement is based on the presumption that the transaction to sell the asset or transfer the liability takes place either in the principal market for the asset or liability or, in the absence of a principal market, in the most advantageous market for the asset or liability. Management believes that the fair values of Saudi Aramco’s financial assets and liabilities that are measured and recognized at a mortized cost are not materially differen t from their carrying amounts at the end of the reporting period.\n\nSaudi Arabian Oil Company 17 Second quarter and half year interim report 2020 All', '70,331 paid in 2022 relate to 2021 results. Dividends of SAR 70,325 paid in 2021 relate to 2020 results.\n2. Dividends per share of SAR 0.32 and SAR 0.32, declared on May 13, 2022 and August 12, 2022, respectively, reflect the effect of the issuance of the bonus shares as\ndescribed below.\n3. The condensed consolidated interim financial report does not reflect a dividend to shareholders of approximately SAR 70,335, which was declared on August 12,\n2022 (August 6, 2021: SAR 70,327). This dividend will be deducted from unappropriated retained earnings in the year ending December 31, 2022 and relates to\nresults for the three-month period ended June 30, 2022.\nOn May 12, 2022, after obtaining necessary approvals from the competent authorities, the Extraordinary General Assembly\n(“EGA”) approved the increase of the Company’s share capital by SAR 15,000 and the commensurate increase of the number of the Company’s issued ordinary shares by 20 billion without par value. Such increase was effected through capitalization of\nthe Company’s retained earnings. Each shareholder was granted one (1) bonus share for every ten (10) shares owned. The\nCompany’s share capital after the increase is SAR 75,000, is fully paid and is divided into 220 billion ordinary shares with\nequal voting rights without par value.\nAccordingly, earnings per share for the three-month and six-month periods ended June 30, 2022 and 2021 have been calculated by retrospectively adjusting the weighted average number of outstanding shares to reflect the effect of the issuance of the above bonus shares.\n19. Events after the reporting period On August 1, 2022, Saudi Aramco signed an equity purchase agreement to acquire Valvoline Inc.’s global products business\n(“Valvoline Global Products”). Valvoline Global Products is a leading worldwide independent producer and distributor of premium branded automotive, commercial and industrial lubricants, and automotive chemicals. The transaction, with a total\npurchase price of SAR 9,938 ($2,650), is expected to close by early 2023, subject to customary closing conditions and\nregulatory approvals.\n\nSaudi Aramco Second quarter and half year interim report 2022 All amounts in millions unless otherwise stated Non-IFRS measures reconciliations and definitions This Interim Report includes certain to its IFRS-based operating performance results. In addition, other companies, non-IFRS financial measures (ROACE, and financial position. The non-IFRS including those in Aramco’s industry, free cash flow, gearing, and EBIT), financial measures are not defined by, may calculate similarly titled non-IFRS which Aramco uses to make informed or presented in accordance with, IFRS. financial measures differently from decisions about its financial position The non-IFRS financial measures are not Aramco. Because companies do not and operating performance or liquidity. measurements of Aramco’s operating necessarily calculate these non-IFRS These non-IFRS financial measures have performance or liquidity under IFRS financial measures in the same manner, been included in this Interim Report and should not be used instead of, Aramco’s presentation of such non- to facilitate a better understanding of or considered as alternatives to, any IFRS financial measures may not be Aramco’s historical trends of operation measures of performance or liquidity comparable to other similarly titled non- and financial position. under IFRS. The non-IFRS financial IFRS financial measures used by other measures relate to the reporting periods companies.\nAramco uses non-IFRS financial described in this Interim Report and are measures as supplementary information not intended to be predictive of future\nROACE measures the efficiency of the applicable period. Aramco utilizes periods in 2021. The increase in ROACE Aramco’s utilization of capital. Aramco ROACE to evaluate management’s was mainly driven by higher earnings, defines ROACE as net income before performance and demonstrate to its primarily reflecting stronger crude oil finance costs, net of income taxes and shareholders that capital has been used prices and volumes sold, and improved zakat, as a percentage of average capital effectively. Downstream margins. This was partially employed, calculated on a 12-month offset by higher average capital\nrolling basis. Average capital employed ROACE for the second quarter and employed during the period.\nis the average of total borrowings plus half year ended June 30, 2022, was\ntotal equity at the beginning and end of 31.3%, compared to 16.7% for the same\nTwelve months ended June 30 SAR USD* All amounts in millions unless otherwise stated 2022 2021 2022 2021\nNet income 565,160 273,']","During the early pandemic downturn, Aramco described its shareholder payout as continuing to deliver value to its shareholders despite the volatile and weaker market environment. Specifically, it declared total cash dividends of SAR 281.3 billion ($75.0 billion) for 2021, which reflects a strong operational performance and financial results during that challenging period (see ""President and CEO’s message"" section).","Despite weaker demand and lower oil prices, Aramco said it maintained a second-quarter dividend of $18.75 billion to be paid in the third quarter. The CEO attributed the company’s resilience to low production costs, scale, and financial and operational strength.",0.4,0.9125574112613536,0.0,0.0
How does Aramco try to make its purchasing practices ethical and locally beneficial?,"[""rural Indonesia, Saudi Aramco’s programs have served thousands of workers, students, and at-risk citizens in dozens of locations throughout the region.\n)GSE( ecnanrevog\n\nlaicos ,latnemnorivne\n\nSaudi Aramco's procurement supports a diversified energy sector Responsible procurement The Company aims to cultivate local business with a goal of 70% of all expenditures in the Saudi Aramco’s commitment to ethical Kingdom being locally sourced over the next business practices extends to its supply chain three years.\nthrough its Supplier Code of Conduct which outlines mandatory policies on environmental, The Company aims to health and safety issues, fair trade practices, The Company has engaged with its business ethical sourcing, conflicts of interest, bribery, partners and suppliers to support local cultivate local business kickbacks, gifts and fraud, monitoring and community development and recruitment compliance. Saudi Aramco’s Supplier Code of through a model of scholarship and vocation with a goal of 70% of Conduct promotes the Company’s values and training in different industries. The Saudi extends and maintains its ethical standards Arabian Drilling Academy (SADA), a Saudi all expenditures in the across the supplier network, enabling long- Aramco-led collaboration, is working to train term, mutually beneficial partnerships. thousands of skilled exploration, drilling Kingdom being locally This requires that the Company’s vendors and workover talent in alignment with the sourced over the next and suppliers, and those of the Company’s Saudi Vision 2030 workforce development subsidiaries, meet the required standards aims. In September 2018 the first cohort of three years of ethics when it comes to anti-bribery and 132 drillers and service people graduated\nanti-corruption, as well as compliance with from SADA.\nall local legislation around human rights.\nThe Company is a major employer in Saudi Supply chain localization Arabia, and as part of the country’s Vision In support of the Company’s initiative to 2030, which includes goals for increasing develop local supply chains to enhance its female participation in the workforce, the long-term commercial interests and reduce Company has helped develop skilled female procurement costs, in 2015 the Company talent. The Company created the Leading launched its In-Kingdom Total Value Add National Academy (LNA) as a public-private Program (iktva), designed to increase the partnership under the National Specialized use of in-Kingdom suppliers of goods and Partnership Academies (NSPA) focusing on services. In 2019, the iktva metric reached providing women with industrial and\n56%. The Company believes that the scale technical skills training as well as soft skills of the Company’s procurement program can including speaking with impact, emotional support building a diversified energy sector intelligence and business acumen. Since in the Kingdom. In addition, the Company inception, NSPA academies have graduated believes this program not only has a positive over 18,000 trainees and currently have over\nimpact on the Kingdom’s economy but also 5,000 active students in 18 specialized\nsupports the Company’s efforts to improve institutions. LNA provides curricula in supply the efficiency and effectiveness of its supply chain, electrical, instrument, mechanical, chain. The program aims to increase the use laboratory science, and HSE disciplines. As of in-Kingdom suppliers, expand local supply the first female-focused industrial training chain capabilities and capacities, elevate the center in Saudi Arabia, LNA is paving the training and hiring of Saudi nationals, drive way to build inclusion into even the most collaboration in the industry through supplier male-dominated industrial sectors.\ndevelopment, bring new innovations to the Kingdom through R&D and promote the Kingdom as an export hub.\n\nRisk management Risk objectives Enterprise risk management framework Saudi Aramco operates in an industry characterized by price volatility, hazardous operations, and uncertain project outcomes.\nTaking informed risks is an inherent and Board necessary part of doing business. Saudi Aramco manages its strategic, operational, compliance and financial risks by continuously assessing them and undertaking appropriate Risk and HSE Committee Audit Committee responses. Business decisions are made after due consideration of rewards and associated risks.\nRisk management framework The Board of Directors provides risk oversight Executive team as a component of its strategic leadership.\nThe Risk & HSE Committee of the Board oversees the risk management framework and monitors specific major risks. Management Committee The primary role of the Risk and HSE Committee is to monitor overall management of risk and activities relating to health, safety and the environment and to assist the Board The framework is based on the Three Lines of Defense model of Directors with:\n(i) l eadership, direction, and oversight with respect to Saudi Aramco’s risk appetite, First line of defense: Second line of defense: Third line of defense:\nrisk tolerance, risk framework and risk Business assets Risk and control Internal audit strategy; and facilities functions (ii) g overnance and management of strategic and operational risks and sustainability; Identify and manage risk Monitor and report risk, Provide independent assurance and and provide guidance on the effectiveness of internal control systems (iii) f ostering a culture within Saudi Aramco that emphasizes and demonstrates"", 'to achieve the Company’s environmental objectives. Future focus will be on leading in low-carbon intensity, supporting the development of non-fuel applications for crude oil, and targeting the highest impact solutions across the oil and gas value chain.\nSaudi Aramco understands the importance of good governance to any sustainable business and has integrated governance mechanisms across its operations. As it enters a new era of public ownership, it is dedicated to enhancing transparency in public reporting and accountability for its stakeholders.\nSaudi Aramco’s focus will be on leading in low-carbon intensity, supporting the development of non-fuel applications for crude oil, and targeting the highest impact solutions across the oil and gas value chain\n\ngovernance framework Good governance is at the core of how Saudi Aramco operates and is fundamental to sustainable success Saudi Aramco has had the opportunity to preparedness, incident reporting and leverage shared knowledge, expertise and investigation, competency and training, experience since its earliest days, and community awareness, off-job safety, continues to advance its operating platforms risk management and asset integrity. This and governance mechanisms. Committee actively tracks and monitors the health, safety, security, and environmental The Company’s approach to managing performance across the organization to the ESG considerations builds upon this extend accountability and improve safety foundation and has continued to mature performance.\nin parallel with an evolving business context.\nThe Company has established Board and The Company’s Climate Initiatives Steering Company committees, processes and Committee (CISC), made up of leaders from A Board level Risk procedures, and ESG is integrated into its Risk across the business, guides and oversees Register and Enterprise Risk Management management of climate and sustainability and Health, Safety, and (ERM) systems. See Section 5: Risk, for more actions. This includes the carbon footprint of Environment Committee details. operations and assets, and the understanding of future energy, technology and climate provides strategic ESG management is a priority for Saudi change trends. CISC facilitates coordination Aramco at the Senior Executive and Board and collaboration among relevant internal direction and governance levels. Established committees, systems, and external organizations and parties with procedures and programs are in place respect to climate change matters.\non health, safety, and to manage ESG matters and provide the Company with the ability to respond in A Nomination Committee oversees, reviews, environmental matters an orderly manner. and approves changes to the Company’s corporate governance practices and ESG-related initiatives and performance procedures. It also develops and recommends have historically been managed by a variety codes of professional conduct and ethics of operational functions and overseen representing the Company’s values. The by governing bodies across the Company, Nomination Committee advises the Board in alignment with its corporate strategies, regularly with respect to significant and monitored by the Board and associated developments in corporate governance committees. practices.\nThe Board’s Risk and Health, Safety, and An ESG strategy and reporting function Environment (HSE) Committee provides has been established to oversee the ESG strategic direction and governance on health, framework in Saudi Aramco. The function safety, and environmental matters. It is responsible for developing, ensuring oversees the management of the associated implementation, and communicating risks and performance indicators. The Company positions on emerging sustainability Company’s Health, Safety, Security and topics, aligning with Company strategy Environmental (HSSE) Committee establishes and objectives, building awareness, and the Company’s safety policy and standards sustainability reporting.\ncovering key issues, including emergency )GSE( ecnanrevog\n\nlaicos ,latnemnorivne\n\nSaudi Aramco’s performance dashboards All of this is carried out under the auspices include ESG-related Key Performance of the Corporate Compliance Department, Indicators (KPIs), and are reviewed by which is responsible for enterprise-wide management on a regular basis. Corporate compliance-related systems, programs KPIs are used to measure performance and and practices.\nto allocate annual performance bonuses for all employees. Whistleblowing Detailed policies and procedures require Saudi Aramco’s Ethical conduct all employees to report suspected improper performance dashboards behavior, including ethical concerns, through The Company has implemented corporate a dedicated, anonymous General Auditor governance policies and procedures specified include ESG-related Key Hotline. Internal or external subject matter in the Kingdom’s Corporate Governance experts determine whether and how to Performance Indicators Regulations and additional policies and investigate the allegation. The policies and procedures appropriate for a company of procedures also include whistleblower (KPIs), and are reviewed its size, structure and industry. A Code of protections. The existence and purpose of Business Conduct provides guidelines to the hotline is communicated to all employees by management on the Directors, Senior Executives, employees through the Company’s continuous and contract employees of the Company a regular basis compliance training campaigns and initiatives.\nand its controlled affiliates regarding, among other things, integrity, health, safety and\n2019 2018\nenvironmental protection, competition and\nAllegations received 507 462\nantitrust, anti-bribery and anti-corruption, insider trading and compliance with Concerted efforts and a communication applicable law.\nstrategy have increased trust in the', 'year ended December 31, 2024; and ● the consolidated statement of changes in equity for the year ended December 31, 2024;\n● the notes to the consolidated financial statements, comprising material accounting policy information and ● oththe ecro enxspollaidnaatteodr ys tiantfeomrmenatt ioofn c. a sh flows for the year ended December 31, 2024; and ● the notes to the consolidated financial statements, comprising material accounting policy information and Baostihse fro erx polpaninatioorny i nformation.\nBWae sciosn fdourc toepd ionuiro nau dit in accordance with International Standards on Auditing, that are endorsed in the Kingdom of Saudi Arabia. Our responsibilities under those standards are further described in the Auditor’s Wresep coonnsdibuiclitteides o fuorr athued iatu idni ta cocf otrhdea cnocnes owliitdha tIendte frinnaatniocinaall s Statatenmdaerndtss soenc tAiound iotfin ogu, rt hreapt oarrte. endorsed in the Kingdom of Saudi Arabia. Our responsibilities under those standards are further described in the Auditor’s Wresep boenliseibveil itthieast ftohre tahued aiut deviti doef nthcee wcoen hsoalvied aotbetda ifnineadn ics isaul fsftiaciteenmt eanntds saepcptiroonp roifa toeu tro r epproovrti.d e a basis for our opinion.\nW e believe that the audit evidence we have obtained is sufficient and appropriate to provide a basis for our o Inpidneiopne.n dence We are independent of the Group in accordance with the International Code of Ethics for Professional Independence Accountants (including International Independence Standards), endorsed in the Kingdom of Saudi Arabia W(thee a“rCeo dined”)e,p tehnadt eins tr eolfe vtahnet Gtor oouupr ainu daict coofr tdhaen ccoe nwsoitlhid athteed Ifnintearnncaitailo sntaalt eCmoednet so fa nEdt hwices h faovre Pfurolffiellsesdio onuarl Aotchceoru entthainctasl r(ienscploundsiinbgi lIitnietesr inna aticocnoarld aInndcee pweinthd etnhcee C Sotdaen’sd arerdqsu)i,r eemndeonrtsse. d in the Kingdom of Saudi Arabia ( the “Code”), that is relevant to our audit of the consolidated financial statements and we have fulfilled our other ethical responsibilities in accordance with the Code’s requirements.\nPricewaterhouse Coopers, License No. 25, Saudi Aramco, P.O. Box 1659, Dhahran 31311, Kingdom of Saudi Arabia\nT: +966 (13) 873-6800, F: +966 (13) 873-8883, www.pwc.com/middle-east\nPricewaterhouse Coopers, License No. 25, Saudi Aramco, P.O. Box 1659, Dhahran 31311, Kingdom of Saudi Arabia\nT: +966 (13) 873-6800, F: +966 (13) 873-8883, www.pwc.com/middle-east\n\nSTRUCTURE AND FINANCIAL 7. CONSOLIDATED\n\nAND STRATEGY PERFORMANCE 3. SUSTAINABILITY 4. RISK GOVERNANCE INFORMATION STATEMENTS Independent auditor’s report to the shareholders of Saudi Arabian Oil Company (continued)\nOur audit approach Overview ● We determined overall Group materiality taking into account the profit- oriented nature of the Group.\n● Based on a percentage of income before income taxes and zakat of Saudi Arabian Riyal (‘‘SAR’’) 782.0 billion, we determined our overall Group Materiality materiality at SAR 30.0 billion.\n● Our quantitative threshold for reporting misstatements to those charged with governance was set at SAR 2.3 billion.\nBased on their size, complexity and risk:\n● We selected the Company for a full-scope audit; and Group ● We also determined a number of other components to be in scope for the scoping Group audit, in respect of which a full-scope audit or audit procedures over specified financial statement line items were performed.\nOur key audit matters comprise the following:\nKey audit ● Assessment of the recoverability of the goodwill and brand (intangible matters assets) recognised as part of the Saudi Basic Industries Corporation (“SABIC”) acquisition; and ● Assessment of the recoverability of property, plant and equipment.\nAs part of designing our audit, we determined materiality and assessed', 'risk that laws could be enacted in the depend on the laws governing the foreign future that would expressly remove or weaken country to which the applicable products are certain sovereign defenses.\nbeing exported and applicable international trade Also, increasing attention on climate change risks agreements. Foreign countries may take such may result in increased litigation against Aramco measures for political or other reasons, including and its affiliates. Claims relating to climate change reasons unrelated to Aramco actions or matters have been filed against companies in the operations. Because the majority of Aramco’s oil and gas industry by private parties, products are exported, any such measures may shareholders of such companies, public interest have a material adverse effect on Aramco’s organizations, state attorneys general, cities and business, financial position, and results of other localities, especially in the United States and operations.\nEurope. These lawsuits seek a variety of remedies, In addition, the Kingdom is a party to including financial compensation for alleged past international trade agreements, such as World and future damages resulting from climate Trade Organization agreements, that include change and court orders requiring energy commitments by the Kingdom with respect to the companies to reduce GHG emissions.\ncomposition of its laws, regulations, and practices Furthermore, oil and gas companies have been that impact international trade. The Kingdom may subject to a growing number of lawsuits alleging become a party to other such agreements in the damages from the companies’ contributions to future. Compliance by the Kingdom with any such climate change, failure to protect the environment commitments may directly or indirectly impact from the effects of their operations, concealing Aramco and could cause it to alter its operations information about the consequences of the use of in a manner that is costly or otherwise has a their products on climate change and similar material adverse effect on its business, financial matters. Motiva has been named in several of position, or results of operations. If the Kingdom these lawsuits, and Aramco and its affiliates may is deemed to be non-compliant, Aramco’s be named in similar lawsuits in the future.\nbusiness operations could be exposed to scrutiny In addition, oil and gas companies are also and Aramco or its affiliates’ exports could be increasingly subject to lawsuits based on subject to potential remedial measures, such as allegations that certain public statements duties, which could have a material adverse effect regarding ESG matters or net-zero or carbon on Aramco’s business, financial position, and neutrality targets are false and misleading results of operations.\n“greenwashing” campaigns or that climate- related disclosures made by companies are inadequate. Aramco could be subject to, and Motiva has been named in and is defending, this type of lawsuit.\nRISKS RELATED TO THE LEGAL AND REGULATORY ENVIRONMENT\nLitigation Aramco is and has been subject to significant litigation and other actions.\n\nRisk factors continued The oil and gas industry in the Kingdom is a the Concession in whole or in part or adversely Regulatory changes regulated industry. Any change in the Kingdom’s change Aramco’s rights in respect of the Aramco operates in a laws, regulations, policies, or practices relating to Concession, which would have a significant regulated industry and its the oil and gas industry could have a material adverse effect on Aramco’s business, financial business may be affected by adverse effect on Aramco’s business, financial position, and results of operations.\nregulatory changes. position, and results of operations. In addition, Additionally, Aramco’s operations and products although the Concession provides for an initial are subject to a number of laws and regulations in period of 40 years, which will be extended by the jurisdictions in which it operates or sells products.\nGovernment for 20 years provided Aramco These laws and regulations result in an often satisfies certain conditions commensurate with complex, uncertain, and changing legal and current operating practices (and may be amended regulatory environment for Aramco’s global and extended for an additional 40 years\nbusinesses and operations. Changes in laws or thereafter subject to Aramco and the Government regulations, including how they are interpreted agreeing on the terms of the extension), there is and enforced, can and does impact all aspects of no assurance that the Government will not revoke Aramco’s business.\nAramco currently engages in business activities, business. In addition, there can be no assurance Sanctions and and could in the future decide to take part in new that Aramco’s corporate governance, compliance, trade restrictions business activities, involving locations subject to and ethics policies and procedures (including with trade restrictions and where certain parties are respect to sanctions, trade restrictions, anti- Sanctions and trade subject to sanctions, as well as anti-bribery and bribery, and anti-corruption) will protect it from restrictions, as well as anti-corruption laws, imposed by the United the improper conduct of its employees or business anti-bribery and anti- States, the European Union, the United Kingdom, partners, which conduct could result in corruption laws, could and other sanctioning or regulatory bodies. Laws substantial civil or', 'otherwise has a material climate change and similar matters. Motiva has adverse effect on its business, financial position, or been named in several of these lawsuits, and results of operations. If the Kingdom is deemed to Aramco and its affiliates may be named in similar be noncompliant, Aramco’s business operations lawsuits in the future.\ncould be exposed to scrutiny and Aramco or its In addition, oil and gas companies are also affiliates’ exports could be subject to potential increasingly subject to lawsuits based on remedial measures, such as duties, which could allegations that certain public statements have a material adverse effect on Aramco’s regarding ESG matters or net-zero or carbon business, financial position, and results of neutrality targets are false and misleading operations.\n“greenwashing” campaigns or that climate-related disclosures made by companies are inadequate.\nAramco could be subject to this type of lawsuit.\nRisk factors continued The oil and gas industry in the Kingdom is a Concession in whole or in part or adversely change Regulatory changes regulated industry. Any change in the Kingdom’s Aramco’s rights in respect of the Concession, which Aramco operates in a laws, regulations, policies, or practices relating to would have a significant adverse effect on regulated industry and its the oil and gas industry could have a material Aramco’s business, financial position, and results of business may be affected by adverse effect on Aramco’s business, financial operations.\nregulatory changes. position, and results of operations. In addition, Additionally, Aramco’s operations and products are although the Concession provides for an initial subject to a number of laws and regulations in period of 40 years, which will be extended by the jurisdictions in which it operates or sells products.\nGovernment for 20 years provided Aramco satisfies These laws and regulations result in an often certain conditions commensurate with current complex, uncertain, and changing legal and operating practices (and may be amended and regulatory environment for Aramco’s global extended for an additional 40 years thereafter\nbusinesses and operations. Changes in laws or subject to Aramco and the Government agreeing regulations, including how they are interpreted on the terms of the extension), there is no and enforced, can and does impact all aspects of assurance that the Government will not revoke the Aramco’s business.\nAramco currently engages in business activities, that Aramco’s corporate governance, compliance, Sanctions and and could in the future decide to take part in new and ethics policies and procedures (including with trade restrictions business activities, involving locations subject to respect to sanctions, trade restrictions, anti-bribery, trade restrictions and where certain parties are and anti-corruption) will protect it from the Sanctions and trade subject to sanctions, as well as anti-bribery and improper conduct of its employees or business restrictions, as well as anti-corruption laws, imposed by the United States, partners, which could result in substantial civil or anti-bribery and anti- the European Union, the United Kingdom, and criminal penalties, or otherwise have a material corruption laws, could other sanctioning or regulatory bodies. Laws and adverse effect on Aramco’s business. Furthermore, adversely affect Aramco. regulations governing sanctions, trade restrictions, if Aramco were to be sanctioned in the future, as a and bribery and corruption are complex and are result of its transactions with other parties or subject to change. For example, sanctions against otherwise, such sanctions could result in blocking Russia, products therefrom, and Russian individuals measures or asset freezes against Aramco, and entities have increased following the start of restrictions on investors trading securities issued by the Russia-Ukraine conflict and additional Aramco, or other adverse consequences. Such sanctions could be imposed in the future. penalties or sanctions could have a material adverse effect on Aramco’s business, financial Sanctions on parties with which Aramco does position, and results of operations.\nbusiness or trade restrictions affecting its markets could have a material adverse effect on Aramco’s business. In addition, there can be no assurance The rights granted to Aramco under the There can be no assurance that Aramco will Government Concession constitute its licenses, permits, and receive any necessary licenses, permits, or licenses and permits approvals necessary to conduct hydrocarbons approvals. Any failure to obtain or maintain operations and related activities in the Kingdom. required licenses, permits, or approvals, or the Aramco is required to However, Aramco is required to obtain and revocation or termination thereof, may interrupt obtain, maintain, and maintain licenses, permits, and approvals required Aramco’s operations, could result in financial and renew Governmental under the Hydrocarbons Law and the Energy other penalties and could have a material adverse licenses, permits, and Supply Law (which superseded the GSPR and effect on Aramco’s business, financial position, and approvals in order to became effective in March 2023). Additionally, results of operations.\noperate its businesses. Aramco is required to', 'co. Aramco also obtains insurance in certain Aramco can continue to renew its existing levels areas from third-party providers in excess of the of coverage on commercially acceptable terms, coverage provided through Stellar. or at all. As a result, it could incur significant losses from uninsured risks or risks for which Aramco does not insure against all risks and its insurance does not cover the entire loss.\nits insurance may not protect it against Any such losses could have a material adverse liability from all potential events, particularly effect on Aramco’s business, financial position catastrophic events such as major crude oil spills, and results of operations.\nenvironmental disasters, terrorist attacks or acts of war. In addition, it does not maintain business interruption insurance for disruptions to its Aramco’s ability to Aramco’s ability to achieve its strategic growth These challenges have led and could lead to achieve its strategic objectives depends, in part, on the successful, delays in the completion of projects and growth objectives timely and cost-effective delivery of capital increased project costs. If projects are delayed, depends on the projects, which are carried out by Aramco or cost more than expected or do not generate successful delivery by it along with joint ventures or partners and the expected return, Aramco’s operations and of current and future affiliates. Aramco faces numerous challenges expected levels of production could be impacted.\nprojects and achieving in developing such projects, including These occurrences could result in Aramco these objectives the following: recognizing impairments on its projects, may not have the • fluctuations in the prices for hydrocarbons, assuming liabilities of joint ventures or partners anticipated impact. which may impact its ability to finance its and affiliates or other consequences, any of projects from its cash flow from operating which could have a material adverse effect on activities or make projects less economically Aramco’s business, financial position and results feasible or rendered uneconomic; of operations.\n• making economic estimates or assumptions Aramco is pursuing lower carbon intensity based on data or conditions, including demand products and operations to address climate- and price assumptions, which may change; related risks and opportunities, including\n• constraints on the availability and cost of through lowering net carbon emissions. Other skilled labor, contractors, materials, equipment oil and gas companies may benefit from and facilities; governmental incentives, such as financial incentives provided by the U.S. Inflation\n• its ability to obtain funding necessary for the Reduction Act enacted in August 2022 for clean implementation of the relevant project on energy, including hydrogen, energy storage, terms acceptable to it, or at all;\nclean energy vehicles and carbon capture,\n• difficulties in obtaining necessary permits, utilization and storage. If Aramco is unable to complying with applicable regulations and avail itself of similar incentives, its competitive changes to applicable law or regulations; position may be impacted. In addition, Aramco’s\n• difficulties coordinating multiple contractors ability to develop low carbon products and and subcontractors involved in complex solutions will also depend on the market projects; acceptance of and regulatory support for these products.\n• its ability to find major global industry partners and new opportunities for downstream investments globally;\n• market factors outside of its control affecting its ability to fund such projects, including constraints that prevent or limit financing providers’ ability to invest in hydrocarbons- related projects; and\n• undertaking projects or ventures in new lines of business in which Aramco has limited or no prior operating experience.\n\nRisks related to Aramco’s operations and activities continued Continued In addition, the financial impact resulting from Furthermore, many of Aramco’s projects require certain of Aramco’s strategic growth projects significant capital expenditures. If cash flow from Aramco’s ability to and from its ambition to achieve net-zero Scope 1 operating activities and funds from external achieve its strategic and Scope 2 greenhouse gas emissions across its financial resources are not sufficient to cover growth objectives wholly-owned operated assets by 2050 is Aramco’s capital expenditure requirements, depends on the uncertain. There is a risk that even if Aramco Aramco may be required to reallocate available successful delivery is able to achieve its strategic growth objectives, capital among its projects or modify its capital of current and future their impact on its business may not be as expenditure plans, which may result in delays to, projects and achieving profitable or as beneficial as anticipated, or cancellation of, certain projects or deferral these objectives which may have a material adverse effect on of certain capital expenditures. Any change to may not have the its business, financial position and results Aramco’s capital expenditure plans could, in anticipated impact.\nof operations. turn, have a material adverse effect on Aramco’s growth objectives and its business, financial position and results of operations.\nAramco’s historical In recent years, the Government has adopted a necessarily determinative of its likely future cash results of operations number of changes to the fiscal regime under flows, results of operations or rate of growth, may not be directly which Aramco operates. These changes have a and its past performance should not be relied comparable from material', 'component of the in-Kingdom partnerships has contributed to the Company’s overall expenditure across its supply chain\ndevelopment of the labor force in Saudi Arabia, now stands at 65.0%, with a target to grow to 70.0%\nwhile adding robustness to the Company’s supply by 2025. Billions of dollars in economic activity that chain through localization. historically would have left the Kingdom instead remained to serve the interests of the Company Aramco supports the development of new industries and support the local economy. In 2023, Aramco\nin the Kingdom under its Namaat industrial entered into 86 corporate purchase agreements investment program. During the year, the Company\nvalued at SAR 12.2 billion ($3.3 billion) to build\nsigned a shareholders’ agreement to establish an long-term collaborative relationships with strategic integrated steel plate manufacturing complex in local suppliers.\nRas al-Khair Industrial City. Together with Baoshan Iron & Steel Company Limited (Baosteel) and PIF, the The Company also supports the development of joint venture complex will be the first facility of its effective corporate governance practices as one of kind in the region and is expected to create jobs and the founders of the GCC Board Directors Institute contribute to the Kingdom’s economic growth and (GCC BDI). Since its inception, the GCC BDI has grown diversification. By supporting steel plate into one of the leading institutes of directors in the manufacturing in Saudi Arabia, Aramco aims to world, helping to improve Board effectiveness and further localize its supply chain and reduce reliance capabilities across the region by training over 3,500 on imported steel, in line with iktva’s objectives to Board directors and executives, including over 2,400\nmaximize local content and strengthen the local in Saudi Arabia alone.\nsupply chain resilience.\nAramco is further extending its significant citizenship activities through its Global Citizenship Signature iktva1,2 Programs (GSPs). Launched in September 2023, the (%) GSPs serve as platforms to address key societal issues\n2023 65.0 in a way that allows the Company to make a global\nimpact. The programs are expected to draw on the\n2022 63.0 skills of multiple partners across a number of years.\n2021 59.0\nCurrently, there are two GSP programs. The first\n2020 57.5 focuses on STEM (science, technology, engineering,\n2019 55.8 and mathematics) education and includes a\npartnership with Network for Teaching 1. Percentage of total procurement expenditures locally sourced. Entrepreneurship, a nonprofit organization 2. Applies to the Saudi Arabian Oil Company (the Company).\ndedicated to empowering global youth through entrepreneurship education. This is a team-based virtual challenge focused on Saudi Arabia, China, and India, with the intention to expand into new regions in the coming years. The second GSP focuses on energy access, and through a partnership with Envirofit International, a leading social enterprise, more than 18,000 clean cooking stoves were distributed to schools and individual homes in India.\nAdditional Global Citizenship Signature Program initiatives and partnerships are expected to be announced in the future.\n\uf070 In-Kingdom Total Value Add (iktva)\nSaudi Arabia 4. Risk Risk management: 74 Risk factors: 76\nRobust local supply chain Kingdom-1 drilling rig, Marjan field, Arabian Gulf Aramco, to mitigate risks and strengthen its position, continues to invest in the Kingdom’s oil and gas ecosystem to enhance the reliability of the Company’s supply chain, and support Saudi Arabia’s economic development.\nIn 2023, Aramco through ARO Drilling, its joint venture company with Valaris, delivered the first offshore drilling rig built by Saudi Arabia’s International Maritime Industries shipyard.\nThe jack-up rig, named “Kingdom-1,” is equipped with the latest technology to enhance operational excellence and safety.\n\n6. ADDITIONAL FINANCIAL 7. CONSOLIDATED\n\nAND STRATEGY PERFORMANCE 3. SUSTAINABILITY 4. RISK GOVERNANCE INFORMATION STATEMENTS Risk management Enterprise risk management framework Managing risk exposure Board Risk objectives effectiveness of internal control systems. Aramco’s Aramco operates in an industry characterized by price Global ERM Policy requires subsidiaries and volatility, hazardous operations, and uncertain project operationally controlled affiliates to manage risks outcomes. Taking informed risks is an inherent and in a structured manner, overseen by their Boards of Sustainability, Risk and HSE Committee Audit Committee necessary part of doing business. Aramco manages its Directors. Aramco also encourages affiliates to apply strategic, operational, compliance and financial risks ERM principles and practices to their management by continuously assessing them and undertaking of risks.\nappropriate responses. Business decisions are made Management-level oversight of the ERM framework is after due consideration of rewards and associated provided by the Group Executive Committee, chaired risks. by the President and CEO. He also chairs the GHSSE Executive team Risk management framework Committee,', ""innovative solutions to market challenges, industries that, with the right business model and a variety of funding options to energize and support, are ripe for generating entrepreneurs. Since its founding, Wa’ed long-term impact for local communities. Helping beekeepers has created 1,700 new job opportunities, These programs focus on delivering training\nfunded 80 ventures, hosted 70 teams of and training facilities, knowledge, tools and\nIn partnership with the Al-Baha entrepreneurs in its startup lab, and trained technology that remove financial barriers Beekeepers Cooperative Association, more than 400 entrepreneurs. and lay the groundwork for participants and the Company has been helping beneficiaries to succeed in new endeavors beekeepers in Al-Baha improve their Supporting people with disabilities and enterprises.\nhoney yield quantity and quality.\nEstablishing national centers for Since 2016, the program has planted people with disabilities In the Jazan Mountains, Saudi Aramco’s flowering trees and generated Saudi Aramco is committed to improving coffee programs have supported farmers the living conditions of community members with training, farm preparation and water with disabilities and their families. The network system installations, resulting in the\nCompany extends financial and technical planting of over 20,000 seedlings since 2016,\nsupport to autism and Down syndrome replacing other less sustainable crops.\ncenters, rehabilitation centers and centers for individuals with special needs. The Company is working in partnership with the Border Guard, Ministry of Environment, The Company provided the funds to Water and Agriculture, and Nesma Holding construct the Shamah Autism Center in Company to strengthen fishing industries in Dammam. This is the first multidisciplinary Yanbu’ and Jazan, providing expertise and autism center for Saudi children in the equipment to fishermen collectively since 2018.\nEastern Province of the Kingdom. In addition, the Company constructed the Ajyal Center The Company has provided embroidery for Comprehensive Education & Life Skills. training and jobs to hearing-impaired and The center serves children with developmental other under-served women in Dammam disabilities, including autism spectrum since 2017, also in partnership with Nesma disorder, behavioral disorders and intellectual Holding Company.\ndisabilities.\nThese programs seek to make a real difference in people’s lives by equipping community members with the knowledge and skills to establish, manage and grow sustainable businesses.\n\nInternational citizenship initiatives North America Saudi Aramco’s community efforts extend As the base of North American operations beyond the borders of Saudi Arabia with and home to many of its regional affiliates, participation in community outreach and much of Saudi Aramco’s North American development efforts everywhere it operates. community-related efforts focus on or These range from natural disaster relief and originate from the Houston area. In the educational initiatives in China, habitat aftermath of Hurricane Harvey in 2017, preservation programs in Japan and Saudi Aramco volunteers have continually Southeast Asia, to STEM and petrochemical provided assistance to the local community, industry education programs in the U.S. including packing over 300,000 meals for\nand Europe. Saudi Aramco’s international at-risk families and working on Habitat for citizenship efforts are governed by the Humanity crews to rebuild 176 homes.\nCompany’s Citizenship Executive Committee. It is also the title sponsor of the Houston Everywhere Saudi Aramco The committee advises on the Citizenship Half Marathon, and in Houston and across Strategy and overarching position, approves the United States, over 5,000 students operates, it participates in related plans and mobilizes requisite business and educators have participated in support, ensures alignment of activities and Saudi Aramco-sponsored STEM education, community outreach and spending, monitors progress and compliance career awareness, environmental stewardship of related programs and develops citizenship and energy conservation programs.\ndevelopment efforts activity budgets for CEO and Board approval.\nEurope Saudi Aramco’s community outreach programs in Europe seek to motivate people to become more active and engaged members of their communities. In the Netherlands, for example, another location central to its global operations, Saudi Aramco’s supports a range of local philanthropic and recreational opportunities like the Juliana Children’s Hospital; one of the country’s leading pediatric hospitals, and the Aramco Beach Run, the Saudi Aramco’s flagship Citizenship event in Europe.\nAsia Saudi Aramco is committed to making important community and citizenship contributions everywhere it has meaningful operations throughout Asia. Ranging from coral reef conservation in Okinawa, to children’s medical and educational programs in China, Malaysia and Korea, to replacing vulnerable homes in rural Indonesia, Saudi Aramco’s programs have served thousands of workers, students, and at-risk citizens in dozens of locations throughout the region.\n)GSE( ecnanrevog\n\nlaicos ,latnemnorivne\n\nSaudi Aramco's procurement supports a diversified energy sector Responsible procurement The Company aims to cultivate local business with a goal of 70% of all expenditures in the Saudi Aramco’s commitment to ethical Kingdom being locally sourced over the next business practices extends to its supply chain three years.\nthrough its Supplier Code of Conduct which outlines mandatory policies on environmental, The Company aims to health and safety issues, fair"", '0 and its Shareek Alongside iktva and Shareek is Aramco’s Namaat Private Sector Partnership Reinforcement industrial investment program and the Taleed\nProgram (Shareek). In March 2023, the Company SME growth program. At the end of 2022, 61\nsigned a Shareek framework agreement in investments had been made through Namaat support of Aramco’s efforts to localize its supply with an aim to create jobs for Saudis and expand chain and ensure its long-term cost and the Kingdom’s energy and chemicals value productivity leadership, sustainability, and chains. The Taleed program, launched in October resilience, while contributing to the Kingdom’s 2022, aims to accelerate SME growth across economic development. multiple sectors. Taleed strives to deliver SAR 3.0\nbillion ($0.8 billion) in funding and financial The Company’s in-Kingdom Total Value Add solutions to support SME development. Aramco (iktva) program is an ongoing success. Through is partnering with a wide range of entities to the program, the local component of the Company’s overall expenditure across its supply signed with leading public and private partners chain now stands at 63.0%, with a target to grow\nto enable development of the SME ecosystem.\nto 70.0% by 2025. Billions of dollars in economic\nactivity that historically would have left the Kingdom instead remained to serve the interests of the Company and support the local economy.\nIn 2022 alone, Aramco entered into over\nSAR 64.9 billion ($17.3 billion) to build long-term\ncollaborative relationships with strategic local suppliers. In January 2023, Aramco signed over 100 agreements and Memoranda of\nUnderstanding (MoU) to help advance a diverse, sustainable, and globally competitive industrial ecosystem.\n\nFour areas of focus continued\n\nS Abqaiq Plants, Aramco, through a system based on ISO 31000 principles Saudi Arabia and guidelines, integrates managing strategic, operational, compliance and financial risks into its annual planning cycle.\nO perational resilience The Company adds to its operational resilience through localization, and has 63.0% local content across its procurement chain, with a focus on using more sustainable materials.\nDuring 2022, building on its exceptional history for energy supply stability, Aramco achieved 99.9% reliability.\n\nManaging risk exposure Risk objectives Internal Audit, as the third line, provides Aramco operates in an industry characterized management and the Audit Committee with by price volatility, hazardous operations, and independent assurance on the effectiveness of uncertain project outcomes. Taking informed internal control systems. Aramco’s Global ERM risks is an inherent and necessary part of doing Policy requires subsidiaries and operationally business. Aramco manages its strategic, controlled affiliates to manage risks in a operational, compliance and financial risks by structured manner, overseen by their Boards continuously assessing them and undertaking of Directors. Aramco also encourages affiliates appropriate responses. Business decisions are to apply ERM principles and practices to their made after due consideration of rewards management of risks.\nand associated risks.\nManagement-level oversight of the ERM framework is provided by the Management Risk management framework Committee, chaired by the President and CEO.\nThe Board of Directors provides risk oversight He also chairs the HSSE Committee, which as a component of its strategic leadership.\noversees health, safety, security, and The Sustainability, Risk and HSE Committee of environmental risk management; the Strategy the Board oversees the risk management Council, which reviews matters of strategic risk;\nframework and monitors specific risks.\nand the Conflicts of Interest and Business Ethics The primary role of the Sustainability, Risk Committee. Various other management-level and HSE Committee is to monitor overall committees oversee specific risk-related topics, management of risk and activities relating to such as the Sustainability Steering Committee health, safety and the environment and to assist and the Information Security Risk Management the Board of Directors with: Steering Committee.\nI. Leadership, direction, and oversight with Business risk assessment respect to the Company’s risk appetite, risk The process by which individual organizations tolerance, risk framework, and risk strategy;\nidentify, assess, mitigate, monitor and report II. Governance and management of strategic, risks to the achievement of business objectives is operational, sustainability, and integrated into Aramco’s annual planning cycle environmental, social and governance (ESG) through a system based on ISO 31000 principles related risks; and and guidelines. This includes the escalation, as III. Assisting the Board and the Audit Committee appropriate, of risk ownership through Aramco’s to foster a culture within the Company that organizational levels, resulting in a hierarchy emphasizes and demonstrates the benefits of risks from individual departmental risks to of risk management. The Audit Committee corporate risks. Annually, the Management focuses on financial risks, including financial Committee reviews the composition of the top reporting and treasury risks, as well as on risks, taking into consideration risks reported internal and external compliance. from the businesses and a top-down scan for new and', 'the world. In fact, more than 180 patents or serious injuries resulting facilities. These programs and initiatives are have been filed collectively by female designed to promote employee satisfaction, employees at Saudi Aramco and its from traffic accidents development, health and well-being. The subsidiaries globally.\nfollowing table provides the Company’s total associated with company, number of employees for the in-Kingdom The Company is actively investing in wholly owned operated assets in 2018 having greater female representation contractor, and employee and 2019. within its workforce and leadership. As of vehicles in the Eastern\n31 December 2019, 4.9% of the workforce\n2019 2018\nconsisted of women and the Company\nCompany employees 69,867 67,947 Province of Saudi Arabia\nnow has one female Board member.\n\nThe following table provides the share of quality childcare. The Company has taken female employees for the in-Kingdom wholly a leading role in promoting and supporting owned operated assets in 2018 and 2019. the right of women to drive in the Kingdom following changes to applicable laws in 2018.\n2019 2018 The Company opened a driving center to\nFemale employees 4.9% 4.7% train the Company’s female employees and\nemployees’ female family members, as well To further increase the To further increase the percentage of women as to encourage a safer and friendlier driving employed by the Company and to broaden environment on the Kingdom’s roadways.\npercentage of women the pool of qualified female employees in employed by the Company the energy sector generally, the Company Employee development and conducts Science, Technology, Engineering, capacity building and to broaden the pool and Math (STEM) programming in The Company’s employees and workplace elementary schools to encourage future culture are important to its success. The of qualified female careers in these fields. The Company also Company invests in its personnel and has sponsors young Saudi women pursuing implemented a number of training and skills employees in the energy degrees in STEM subjects through various development programs. The Company training institutes, academies and a university believes these programs allow it to shape sector generally, the scholarship program. Other programs include its workforce for the future.\nCompany conducts STEM the Gulf Regional Organization for Women initiative, Leadership Excellence for Women Saudi Aramco’s training and development programming in elementary Awards & Symposium, STEMania program organizations collaborate with top local and for school-age girls, and targeted university international universities to provide robust schools to encourage scholarships. Specifically, the Company has career development programs.\nbeen actively promoting women in Petro- future careers in these fields Technical Professional (PTP) jobs through Saudi Aramco engages with top universities, the Company’s college degree sponsorship such as Harvard Business School, London program. More than 170 PTP graduate Business School, and Wharton School of the female students are part of Saudi Aramco’s University of Pennsylvania. In 2019, over\ncore operations today. 140 selected employees attended programs custom-designed for Saudi Aramco by these Complementary to the Government’s business schools. Additionally, the Company’s childcare program (Qurrah) provided to Leadership Center in Ras Tanura trains over working mothers, the Company also provides 21,000 employees each year in key leadership\ndaycare services at its Dhahran headquarters capabilities.\nto ensure working mothers have access to )GSE( ecnanrevog\n\nlaicos ,latnemnorivne\n\nLabor practices Saudi Aramco programs and institutions provide employees and their families with a safe, comfortable and rewarding work environment.\nA designated team conducts monthly analysis to measure construction contractor and sub-contractor well-being in all departments, with a focus on living conditions, medical care, work efficiency, salary, and training and development.\nMedical care The Company provides employees with access to high-quality medical care through its Employee Medical Program. In 2013, the Company engaged in a joint venture with Johns Hopkins Medicine to enhance health services for Saudi Aramco employees and their families. In 2018, Saudi Aramco\nexpanded its medical care offering for employees, retirees and their families through Employees a partnership with BUPA. volunteer in a range of Human well-being community The Company established a Human Energy projects Management (HEM) program to energize Local and global citizenship employees and encourage well-being through research-based workshops that The Company engages in a range of deliver resources on the science and art of corporate social responsibility projects and human well-being. In 2019, HEM delivered initiatives to support the communities and management, workplace ergonomics, leverages its know-how and operational nutrition and wellness, and provided different capabilities to further advance these projects.\ncertifications and events Company-wide, The Company strives to make a positive benefiting over 6,500 employees in total. impact across the two central pillars of its Citizenship strategy by supporting the Employee rights and fair representation intellectual, creative and economic Saudi Aramco follows all relevant laws and development of its people, and protecting practices of the jurisdictions that apply to and sustaining the unique environment and its']","Saudi Aramco ensures ethical and locally beneficial purchasing practices through the following key initiatives:

1. **Supplier Code of Conduct**: This outlines mandatory policies on environmental, health, and safety issues, fair trade practices, ethical sourcing, and anti-corruption, ensuring that suppliers adhere to ethical business practices.

2. **Local Sourcing Goal**: The Company aims for 70% of all its expenditures to be locally sourced within the Kingdom over the next three years, thereby supporting local businesses and enhancing the economy.

3. **Engagement with Suppliers**: Aramco collaborates with business partners to foster community development and recruit skilled talent, facilitating local economic growth.

4. **In-Kingdom Total Value Add (iktva) Program**: This initiative promotes the use of in-Kingdom suppliers and aims to increase local supply chain capabilities, enhancing job creation and sustaining local industries.

5. **Leading National Academy (LNA)**: Part of the efforts to develop local talent includes training programs that focus on sectors relevant to Aramco's operations, which supports the Kingdom's workforce development goals aligned with Vision 2030. 

These practices reflect Aramco’s commitment to ethical business operations while simultaneously fostering the development of the local economy (sections on Responsible procurement and Supply chain localization).","Aramco uses a Supplier Code of Conduct covering environmental, health and safety, fair trade, ethical sourcing, conflicts of interest, anti-bribery, and compliance standards. It also uses the iktva localization program and aims for 70% of its Kingdom expenditures to be locally sourced over the next three years.",1.0,0.9390275244162715,0.5262896825265253,1.0
