user_input,retrieved_contexts,response,reference,faithfulness,answer_relevancy,context_precision,context_recall
What business activities is the Saudi Arabian Oil Company engaged in?,"['activities 698,152 522,601 186,174 139,360\nCapital expenditures 4 (141,161) (119,645) (37,643) (31,905)\nAcquisition of affiliates, net of cash acquired (1,708) – (455) –\nDistributions from joint ventures and associates 7 4,535 4,651 1,210 1,240\nAdditional investments in joint ventures and associates 7 (1,489) (557) (397) (149)\nProceeds from sale of equity interest in an associate 34(a) 1,651 – 440 –\nDividends from investments in securities 27 390 369 104 99\nInterest received 5,950 1,232 1,587 329\nNet investments in securities (3,035) (1,519) (810) (406)\nNet purchases of short-term investments (254,142) (20,272) (67,772) (5,405)\nNet cash used in investing activities (389,009) (135,741) (103,736) (36,197)\nDividends paid to shareholders of the Company 36 (281,318) (281,305) (75,018) (75,015)\nDividends paid to non-controlling interests in subsidiaries (14,417) (7,112) (3,845) (1,896)\nProceeds from sale of non-controlling equity interest\nin a subsidiary 58,125 46,547 15,500 12,412\nAcquisition of non-controlling interests in certain subsidiaries (230) – (62) –\nProceeds from issue of treasury shares 16 550 384 146 103\nProceeds from borrowings 9,082 42,213 2,422 11,256\nRepayments of borrowings (132,514) (73,563) (35,337) (19,617)\nPrincipal portion of lease payments (12,114) (12,143) (3,230) (3,238)\nInterest paid (9,839) (9,534) (2,623) (2,542)\nNet cash used in financing activities (382,675) (294,513) (102,047) (78,537)\nNet (decrease) increase in cash and cash equivalents (73,532) 92,347 (19,609) 24,626\nCash and cash equivalents at beginning of the year 299,579 207,232 79,888 55,262\nCash and cash equivalents at end of the year 226,047 299,579 60,279 79,888\n* This supplementary information is converted at a fixed rate of U.S. dollar 1.00 = SAR 3.75 for convenience only, and is presented in millions of U.S. dollars.\nH.E. Yasir O. Al-Rumayyan Amin H. Nasser Ziad T. Al Murshed Chairman of the Board President & Chief Executive Officer Executive Vice President 160 & Chief Financial Officer\n\nConsolidated statement of cash flows All amounts in millions of Saudi Riyals unless otherwise stated 1. General information The Saudi Arabian Oil Company (the “Company”), with headquarters located in Dhahran, Kingdom of Saudi Arabia (the “Kingdom”), is engaged in prospecting, exploring, drilling and extracting hydrocarbon substances (“Upstream”) and processing, manufacturing, refining and marketing these hydrocarbon substances (“Downstream”). The Company was formed on November\n13, 1988, by Royal Decree No. M/8; however, its history dates back to May 29, 1933, when the Saudi Arabian Government (the\n“Government”) granted a concession to the Company’s predecessor for the right to, among other things, explore the Kingdom for hydrocarbons.\nOn December 20, 2017, Royal Decree No. M/37 dated 2/4/1439H was issued approving the Hydrocarbons Law, which applies to\nthe Kingdom’s hydrocarbons and hydrocarbon operations. Under the Hydrocarbons Law, all hydrocarbon deposits, hydrocarbons and hydrocarbon resources are the property of the Kingdom until ownership is transferred at the well head or when extracted.\nFurther, the Hydrocarbons Law codifies the Government’s sole authority to set the maximum amount of hydrocarbons production by the Company and the maximum sustainable capacity that the Company must maintain.\nAll natural resources within the Kingdom, including hydrocarbons, are owned by the Kingdom. Through a concession in 1933, the Government granted the Company the exclusive right to explore, develop and produce the Kingdom’s hydrocarbon\nresources, except in certain areas. As of December 24, 2017, the Company’s original concession agreement was replaced and\nsuperseded by an amended concession agreement (the', ',074 120,987\nCapital expenditures 4 (122,882) (131,766) (32,769) (35,138)\nAcquisition of affiliates, net of cash acquired 7, 33 (13,628) (8,571) (3,634) (2,285)\nDistributions from joint ventures and associates 7 778 1,073 207 286\nAdditional investments in joint ventures and associates 7, 25 (341) (401) (91) (106)\nDividends from investments in securities 24 509 143 136 38\nInterest received 4,561 2,942 1,216 784\nNet investments in securities (868) (615) (231) (164)\nNet (purchases) maturities of short-term investments (45,273) 5,990 (12,073) 1,597\nNet cash used in investing activities (177,144) (131,205) (47,239) (34,988)\nDividends 31,34 (274,388) (217,500) (73,170) (58,000)\nDividends paid to non-controlling interests (36) (902) (10) (240)\nInterest paid (5,715) (2,748) (1,524) (733)\nAcquisition of treasury shares 16 (3,750) – (1,000) –\nProceeds from borrowings 51,960 11,660 13,856 3,109\nRepayments of borrowings (12,902) (11,096) (3,440) (2,959)\nNet cash used in financing activities (244,831) (220,586) (65,288) (58,823)\nNet (decrease) increase in cash and cash equivalents (5,446) 101,910 (1,453) 27,176\nCash and cash equivalents at beginning of the year 183,152 81,242 48,841 21,665\nCash and cash equivalents at end of the year 177,706 183,152 47,388 48,841\n* Supplementary information is converted at a fixed rate of U.S. dollar 1.00 = SAR 3.75 for convenience only.\nH.E. Yasir O. Al-Rumayyan Amin H. Nasser Khalid H. Al-Dabbagh Chairman of the Board President & Chief Executive Officer Senior Vice President, Finance, Strategy & Development stnemetats laicnanfi detadilosnoc All amounts in millions of Saudi Riyals unless otherwise stated 141 Notes to the consolidated financial statements 1. General information The Saudi Arabian Oil Company (the “Company”), with headquarters located in Dhahran, Kingdom of Saudi Arabia (the “Kingdom”), is engaged in prospecting, exploring, drilling and extracting hydrocarbon substances (“Upstream”) and processing, manufacturing, refining and marketing these hydrocarbon substances (“Downstream”). The Company was formed on November 13, 1988 by Royal Decree No. M/8; however, its history\ndates back to May 29, 1933 when the Saudi Arabian Government (the “Government”) granted a concession to the Company’s predecessor the right to, among other things, explore the Kingdom for hydrocarbons.\nOn December 20, 2017, Royal Decree No. M/37 dated 2/4/1439H was issued approving the Hydrocarbons Law which applies to the Kingdom’s\nhydrocarbons and hydrocarbon operations. Under the Hydrocarbons Law, all hydrocarbon deposits, hydrocarbons and hydrocarbon resources are the property of the Kingdom until ownership is transferred at the well head or when extracted. Further, the Hydrocarbons Law codifies the Government’s sole authority to set the maximum amount of hydrocarbons production by the Company and the maximum sustainable capacity that the Company must maintain.\nAll natural resources within the Kingdom, including hydrocarbons, are owned by the Kingdom. Through a concession in 1933, the Government granted the Company the exclusive right to explore, develop and produce the Kingdom’s hydrocarbon resources, except in certain areas. As of\nDecember 24, 2017, the Company’s original concession agreement was replaced and superseded by an amended concession agreement (the\n“Concession Agreement”) which provides the Company the exclusive right to explore, drill, prospect, appraise, develop, extract, recover, and produce hydrocarbons in the concession area. The Company is also provided the exclusive right to market and distribute hydrocarbons, petroleum products and liquid petroleum gas (“LPG”) in the Kingdom along with the non-exclusive right to manufacture, refine, and treat production and to market, sell, transport and export such production.\nThe initial term of the Concession Agreement is for 40 years which shall be extended by the Government for 20 years', '42,215)\nAcquisition of affiliates, net of cash acquired 35(a) (1,533) (9,878) (409) (2,634)\nAdditional investments in joint ventures and associates 7 (4,736) (3,607) (1,263) (962)\nProceeds from sale of subsidiaries 34 1,583 – 422 –\nDistributions from joint ventures and associates 7 3,165 3,545 844 945\nDividends from investments in securities 27 463 411 124 110\nInterest received 22,735 25,628 6,063 6,834\nInvestments in securities – net 35(c) (6,805) (8,682) (1,815) (2,316)\nNet maturities of short-term investments 171,157 96,872 45,642 25,833\nNet cash used in investing activities (2,861) (54,019) (763) (14,405)\nDividends paid to shareholders of the Company 36 (465,918) (366,674) (124,245) (97,780)\nDividends paid to non-controlling interests in subsidiaries (11,935) (14,428) (3,182) (3,848)\nAcquisition of treasury shares 16 (3,750) – (1,000) –\nProceeds from issuance of treasury shares 16 788 662 210 176\nProceeds from borrowings 54,398 32,057 14,506 8,549\nRepayments of borrowings (31,482) (134,495) (8,395) (35,865)\nPrincipal portion of lease payments (15,344) (13,639) (4,092) (3,637)\nInterest paid (15,115) (14,352) (4,031) (3,827)\nNet cash used in financing activities (488,358) (510,869) (130,229) (136,232)\nNet increase (decrease) in cash and cash equivalents 17,669 (27,074) 4,712 (7,220)\nCash and cash equivalents at beginning of the year 198,973 226,047 53,059 60,279\nCash and cash equivalents at end of the year 216,642 198,973 57,771 53,059\n* This supplementary information is converted at a fixed rate of U.S. dollar 1.00 = SAR 3.75 for convenience only, and is presented in millions of U.S. dollars.\nH.E. Yasir O. Al-Rumayyan Amin H. Nasser Ziad T. Al Murshed Chairman of the Board President & Chief Executive Officer Executive Vice President & Chief Financial Officer STRUCTURE AND FINANCIAL 7. CONSOLIDATED\n\nAND STRATEGY PERFORMANCE 3. SUSTAINABILITY 4. RISK GOVERNANCE INFORMATION STATEMENTS Notes to the consolidated financial statements All amounts in millions of Saudi Riyals unless otherwise stated 1. General information The Saudi Arabian Oil Company (the “Company”), with headquarters located in Dhahran, Kingdom of Saudi Arabia (the “Kingdom”), is engaged in prospecting, exploring, drilling and extracting hydrocarbon substances (“Upstream”) and processing, manufacturing, refining\nand marketing these hydrocarbon substances (“Downstream”). The Company was formed on November 13, 1988, by Royal Decree No.\nM/8; however, its history dates back to May 29, 1933, when the Saudi Arabian Government (the “Government”) granted a concession to\nthe Company’s predecessor for the right to, among other things, explore the Kingdom for hydrocarbons.\nOn December 20, 2017, Royal Decree No. M/37 dated 2/4/1439H was issued approving the Hydrocarbons Law, which applies to the\nKingdom’s hydrocarbons and hydrocarbon operations. Under the Hydrocarbons Law, all hydrocarbon deposits, hydrocarbons and hydrocarbon resources are the property of the Kingdom until ownership is transferred at the well head or when extracted. Further, the Hydrocarbons Law codifies the Government’s sole authority to set the maximum amount of hydrocarbons production by the Company and the maximum sustainable capacity that the Company must maintain.\nAll natural resources within the Kingdom, including hydrocarbons, are owned by the Kingdom. Through a concession in 1933, the Government granted the Company’s predecessor the exclusive right to explore, develop and produce the Kingdom’s hydrocarbon\nresources, except in certain areas. As of December 24, 2017, the original concession agreement was replaced and superseded by an\namended concession agreement (the “Concession Agreement”) which provides the Company the exclusive right to explore, drill, prospect, appraise,', 'Net (purchases) maturities of short-term investments (1,457) 171,157 (389) 45,642\nNet cash used in investing activities (203,902) (2,861) (54,374) (763)\nDividends paid to shareholders of the Company 37 (320,447) (465,918) (85,453) (124,245)\nDividends paid to non-controlling interests in subsidiaries (12,206) (11,935) (3,255) (3,182)\nProceeds from sale of non-controlling equity interest in a subsidiary 34 41,802 – 11,147 –\nAcquisition of treasury shares 16 – (3,750) – (1,000)\nProceeds from issuance of treasury shares 16 850 788 227 210\nNet proceeds from short-term borrowings 6,573 1,413 1,753 377\nProceeds from long-term borrowings 51,552 54,398 13,747 14,506\nRepayments of long-term borrowings (16,683) (32,895) (4,449) (8,772)\nPrincipal portion of lease payments (13,498) (15,344) (3,599) (4,092)\nInterest paid (18,382) (15,115) (4,902) (4,031)\nNet cash used in financing activities (280,439) (488,358) (74,784) (130,229)\nNet increase in cash and cash equivalents 26,457 17,669 7,055 4,712\nCash and cash equivalents at beginning of the year 216,642 198,973 57,771 53,059\nCash and cash equivalents at end of the year 243,099 216,642 64,826 57,771\n* This supplementary information is converted at a fixed rate of U.S. dollar 1.00 = SAR 3.75 for convenience only, and is presented in millions of U.S. dollars.\nH.E. Yasir O. Al-Rumayyan Amin H. Nasser Ziad T. Al Murshed Chairman of the Board President & Chief Executive Officer Executive Vice President & Chief Financial Officer Aramco overview Results and Sustainability Risk Organizational structure Additional financial Consolidated and strategy performance and corporate governance and legal information financial statements Notes to the consolidated financial statements All amounts in millions of Saudi Riyals unless otherwise stated 1. General information The Saudi Arabian Oil Company (the “Company”), with headquarters located in Dhahran, Kingdom of Saudi Arabia (the “Kingdom”), is engaged in prospecting, exploring, drilling and extracting hydrocarbon substances (“Upstream”) and processing, manufacturing, refining\nand marketing these hydrocarbon substances (“Downstream”). The Company was formed on November 13, 1988, by Royal Decree No. M/8;\nhowever, its history dates back to May 29, 1933, when the Saudi Arabian Government (the “Government”) granted a concession to the\nCompany’s predecessor for the right to, among other things, explore the Kingdom for hydrocarbons.\nOn December 20, 2017, Royal Decree No. M/37 dated 2/4/1439H was issued approving the Hydrocarbons Law, which applies to the\nKingdom’s hydrocarbons and hydrocarbon operations. Under the Hydrocarbons Law, all hydrocarbon deposits, hydrocarbons and hydrocarbon resources are the property of the Kingdom until ownership is transferred at the well head or when extracted. Further, the Hydrocarbons Law codifies the Government’s sole authority to set the maximum amount of hydrocarbons production by the Company and the maximum sustainable capacity that the Company must maintain.\nAll natural resources within the Kingdom, including hydrocarbons, are owned by the Kingdom. Through a concession in 1933, the Government granted the Company’s predecessor the exclusive right to explore, develop and produce the Kingdom’s hydrocarbon resources,\nexcept in certain areas. As of December 24, 2017, the original concession agreement was replaced and superseded by an amended\nconcession agreement (the “Concession Agreement”) which provides the Company the exclusive right to explore, drill, prospect, appraise, develop, extract, recover, and produce hydrocarbons in the concession area. The Company is also provided the exclusive right to market and distribute hydrocarbons, petroleum products and liquid petroleum gas (“LPG”) in the Kingdom along with the non-exclusive right to manufacture, refine, and treat production and to market, sell, transport and export such production.\nThe initial term of the Concession Agreement is for 40 years, which shall be extended by the Government for 20 years unless the Company\ndoes not satisfy certain conditions commensurate with its then current operating practices. In addition, the Concession Agreement may be\namended and', '27,515 – 7,337 –\nAcquisition of affiliates, net of cash acquired 8,35 – (13,628) – (3,634)\nDistributions from joint ventures and associates 8 2,601 778 694 207\nAdditional investments in joint ventures and associates 8,32 (537) (341) (143) (91)\nDividends from investments in securities 28 382 509 102 136\nInterest received 3,698 4,561 987 1,216\nNet investments in securities (599) (868) (160) (231)\nNet maturities (purchases) of short-term investments 47,071 (45,273) 12,552 (12,073)\nNet cash used in investing activities (20,899) (177,144) (5,573) (47,239)\nDividends paid to shareholders of the Company 36 (261,184) (274,388) (69,649) (73,170)\nDividends paid to non-controlling interests in subsidiaries (718) (36) (191) (10)\nAcquisition of treasury shares 17 – (3,750) – (1,000)\nProceeds from borrowings 87,520 51,960 23,339 13,856\nRepayments of borrowings (42,125) (5,162) (11,233) (1,376)\nPrincipal portion of lease payments (10,868) (7,740) (2,898) (2,064)\nInterest paid (7,497) (5,715) (2,000) (1,524)\nNet cash used in financing activities (234,872) (244,831) (62,632) (65,288)\nNet increase (decrease) in cash and cash equivalents 29,526 (5,446) 7,874 (1,453)\nCash and cash equivalents at beginning of the year 177,706 183,152 47,388 48,841\nCash and cash equivalents at end of the year 207,232 177,706 55,262 47,388\n* Supplementary information is converted at a fixed rate of U.S. dollar 1.00 = SAR 3.75 for convenience only.\nH.E. Yasir O. Al-Rumayyan Amin H. Nasser Khalid H. Al-Dabbagh Chairman of the Board President & Chief Executive Officer Senior Vice President, Finance, Strategy & Development\n\n,13 rebmeceD dedne\n\nstnemetats laicnanfi detadilosno C | ynapmoC\n\nNotes to the consolidated financial statements 1. General information The Saudi Arabian Oil Company (the “Company”), with headquarters located in Dhahran, Kingdom of Saudi Arabia (the “Kingdom”), is engaged in prospecting, exploring, drilling and extracting hydrocarbon substances (“Upstream”) and processing, manufacturing, refining and marketing these hydrocarbon substances (“Downstream”). The Company was formed on November 13, 1988 by Royal Decree No. M/8; however, its history dates back to May 29, 1933 when the Saudi Arabian Government (the “Government”) granted\na concession to the Company’s predecessor the right to, among other things, explore the Kingdom for hydrocarbons.\nOn December 20, 2017, Royal Decree No. M/37 dated 2/4/1439H was issued approving the Hydrocarbons Law which applies to the\nKingdom’s hydrocarbons and hydrocarbon operations. Under the Hydrocarbons Law, all hydrocarbon deposits, hydrocarbons and hydrocarbon resources are the property of the Kingdom until ownership is transferred at the well head or when extracted. Further, the Hydrocarbons Law codifies the Government’s sole authority to set the maximum amount of hydrocarbons production by the Company and the maximum sustainable capacity that the Company must maintain.\nAll natural resources within the Kingdom, including hydrocarbons, are owned by the Kingdom. Through a concession in 1933, the Government granted the Company the exclusive right to explore, develop and produce the Kingdom’s hydrocarbon resources,\nexcept in certain areas. As of December 24, 2017, the Company’s original concession agreement was replaced and superseded by\nan amended concession agreement (the “Concession Agreement”) which provides the Company the exclusive right to explore, drill, prospect, appraise, develop, extract, recover, and produce hydrocarbons in the concession area. The Company is also provided the exclusive right to market and distribute hydrocarbons, petroleum products and liquid petroleum gas (“LPG”) in the Kingdom along with the non-exclusive right to manufacture, refine, and treat production and to market, sell, transport and export such production.\nThe initial term of the Concession Agreement is for 40 years which shall be extended by the Government for']","The Saudi Arabian Oil Company is engaged in prospecting, exploring, drilling, and extracting hydrocarbon substances (referred to as ""Upstream"") as well as processing, manufacturing, refining, and marketing these hydrocarbon substances (referred to as ""Downstream"").","Saudi Aramco is engaged in prospecting, exploring, drilling, and extracting hydrocarbons upstream, as well as processing, manufacturing, refining, and marketing them downstream.",1.0,0.9370431004262173,0.99999999998,1.0
When was Saudi Aramco converted into a Saudi Joint Stock Company?,"['set the maximum amount of hydrocarbons production by the Company and the maximum sustainable capacity that the Company must maintain.\nAll natural resources within the Kingdom, including hydrocarbons, are owned by the Kingdom. Through a concession in 1933, the Government granted the Company’s predecessor the exclusive right to explore, develop and produce the Kingdom’s hydrocarbon\nresources, except in certain areas. As of December 24, 2017, the original concession agreement was replaced and superseded by an\namended concession agreement (the “Concession Agreement”) which provides the Company the exclusive right to explore, drill, prospect, appraise, develop, extract, recover, and produce hydrocarbons in the concession area. The Company is also provided the exclusive right to market and distribute hydrocarbons, petroleum products and liquid petroleum gas (“LPG”) in the Kingdom along with the non-exclusive right to manufacture, refine, and treat production and to market, sell, transport and export such production.\nThe initial term of the Concession Agreement is for 40 years, which shall be extended by the Government for 20 years unless the Company\ndoes not satisfy certain conditions commensurate with its then current operating practices. In addition, the Concession Agreement may be\namended and extended for an additional 40 years beyond the original 60-year period, subject to the Company and the Government\nagreeing on the terms of such extension.\nEffective January 1, 2018, Council of Ministers Resolution No. 180, dated 1/4/1439H (December 19, 2017) converted the Company to a Saudi\nJoint Stock Company with new Bylaws. The Company’s 1988 Articles were cancelled as of January 1, 2018, pursuant to Royal Decree No.\nM/36, dated 2/4/1439H (December 20, 2017). The Company’s Commercial Registration Number is 2052101150. The Company’s share capital\nwas set at Saudi Riyals (“SAR” or “﷼”) 60,000, divided into 200 billion fully paid ordinary shares with equal voting rights without par value.\nOn May 12, 2022 and May 8, 2023, after obtaining necessary approvals from the competent authorities in relation to the issuance of bonus\nshares, the Extraordinary General Assembly (“EGA”) approved the increases in the Company’s share capital by ﷼ 15,000 and ﷼ 15,000,\nrespectively, and the commensurate increase in the number of the Company’s issued ordinary shares by 20 billion and 22 billion,\nrespectively. The Company’s share capital after these increases is ﷼ 90,000, divided into 242 billion fully paid ordinary shares with equal\nvoting rights without par value (Note 36).\nOn December 11, 2019, the Company completed its Initial Public Offering (“IPO”) and its ordinary shares were listed on the Saudi\nExchange. In connection with the IPO, the Government, being the sole owner of the Company’s shares at such time, sold an aggregate\nof 3.45 billion ordinary shares, or 1.73% of the Company’s share capital. In addition, concurrent with the IPO, the Company acquired\n117.2 million of its ordinary shares from the Government for a cash payment of ﷼ 3,750, and classified them as treasury shares (Note 16).\nThese shares are being used by the Company for its employee share plans (Note 17).\nOn February 13, 2022, the Government transferred 4% of the Company\'s issued shares to the Public Investment Fund (""PIF""), the sovereign\nwealth fund of the Kingdom, followed by another transfer of 4% on April 16, 2023 to Saudi Arabian Investment Company (""Sanabil Investments""), a wholly-owned company of PIF. Further, on March 7, 2024, the Government transferred an additional 8% of the Company\'s\nissued shares to PIF’s wholly-owned companies.\nOn June 11, 2024, the Government completed a secondary public offering of the Company’s ordinary shares. In connection with the\noffering, the Government sold an aggregate of approximately 1.7 billion shares, representing 0.7% of the Company’s issued shares.\nThis includes 137.6 million ordinary shares acquired by the Company from the Government for a cash payment of ﷼ 3,750, which have\nbeen classified as treasury shares. These treasury shares will be used by the Company for its employee share plans. Following the completion of the offering, the Government remains the Company’s largest shareholder, retaining an 81.48% direct shareholding.\nThe consolidated financial statements of the Company and its subsidiaries (together “Saudi Aramco”) were approved by the Board of Directors on March 3, 2025.\nSAUDI ARAMCO | CONSOSLAIDUADTI E', '”), with headquarters located in Dhahran, Kingdom of Saudi Arabia (the “Kingdom”), is engaged in prospecting, exploring, drilling and extracting hydrocarbon substances (“Upstream”) and processing, manufacturing, refining and marketing these hydrocarbon substances (“Downstream”). The Company was formed on November 13, 1988 by Royal Decree No. M/8; however, its history dates back to May 29, 1933 when the Saudi Arabian Government (the “Government”) granted\na concession to the Company’s predecessor the right to, among other things, explore the Kingdom for hydrocarbons.\nOn December 20, 2017, Royal Decree No. M/37 dated 2/4/1439H was issued approving the Hydrocarbons Law which applies to the\nKingdom’s hydrocarbons and hydrocarbon operations. Under the Hydrocarbons Law, all hydrocarbon deposits, hydrocarbons and hydrocarbon resources are the property of the Kingdom until ownership is transferred at the well head or when extracted. Further, the Hydrocarbons Law codifies the Government’s sole authority to set the maximum amount of hydrocarbons production by the Company and the maximum sustainable capacity that the Company must maintain.\nAll natural resources within the Kingdom, including hydrocarbons, are owned by the Kingdom. Through a concession in 1933, the Government granted the Company the exclusive right to explore, develop and produce the Kingdom’s hydrocarbon resources,\nexcept in certain areas. As of December 24, 2017, the Company’s original concession agreement was replaced and superseded by\nan amended concession agreement (the “Concession Agreement”) which provides the Company the exclusive right to explore, drill, prospect, appraise, develop, extract, recover, and produce hydrocarbons in the concession area. The Company is also provided the exclusive right to market and distribute hydrocarbons, petroleum products and liquid petroleum gas (“LPG”) in the Kingdom along with the non-exclusive right to manufacture, refine, and treat production and to market, sell, transport and export such production.\nThe initial term of the Concession Agreement is for 40 years which shall be extended by the Government for 20 years unless the\nCompany does not satisfy certain conditions commensurate with its then current operating practices. In addition, the Concession\nAgreement may be amended and extended for an additional 40 years beyond the original 60-year period subject to the Company\nand the Government agreeing on the terms of such extension.\nEffective January 1, 2018, Council of Minister’s Resolution No. 180, dated 1/4/1439H (December 19, 2017) converted the Company to\na Saudi Joint Stock Company with new Bylaws. The Company’s 1988 Articles were cancelled as of January 1, 2018 pursuant to Royal\nDecree No. M/36, dated 2/4/1439H (December 20, 2017). The Company’s share capital has been set at Saudi Riyal (“SAR”) 60,000,\nis fully paid and is divided into 200 billion ordinary shares with equal voting rights without par value. The Company’s Commercial Registration Number is 2052101150.\nOn December 11, 2019, the Company completed its Initial Public Offering (“IPO”) and its ordinary shares were listed on the Saudi\nStock Exchange (“Tadawul”). In connection with the IPO, the Government, being the sole owner of the Company’s shares at such time,\nsold an aggregate of 3.45 billion ordinary shares, or 1.73% of the Company’s share capital. In addition, concurrent with the IPO, the\nCompany acquired 117.2 million of its ordinary shares from the Government for a cash payment of SAR 3,750, and classified them as\ntreasury shares (Note 16). These shares are being used by the Company for its employee share plans (Note 17).\nOn February 13, 2022, the Government transferred 8 billion ordinary shares, or 4% of the Company’s share capital, to the Public\nInvestment Fund (“PIF”), the sovereign wealth fund of the Kingdom. Following the transfer, the Government remains the Company’s largest shareholder, retaining a 94.19% direct shareholding.\nThe consolidated financial statements of the Company and its subsidiaries (together “Saudi Aramco”) were approved by the Board\nof Directors on March 18, 2022.\n2. Summary of significant accounting policies, judgments and estimates The principal accounting policies applied in the preparation of these consolidated financial statements are set out below. The consolidated financial statements provide comparative information in respect of the previous period.\n(a) Basis of preparation The consolidated financial statements have been prepared in accordance with International Financial Reporting Standards (“IFRS”), that are endorsed in the Kingdom, and other standards and pronouncements issued by the Saudi Organization for Chartered and Professional Accountants (“SOCPA”). The consolidated financial statements are also', 'located within the Royal Commission areas and contractors operating therein (i.e., the Jubail Industrial City Royal Commission Environmental Regulations of September 1999). Saudi Aramco separately requires compliance with environmental standards in certain circumstances. For example, Saudi Aramco administers the oil loading terminals at Ras Tanura, Ju’aymah and several smaller terminals independently of the Saudi Ports Authority.\nSaudization The Kingdom has promulgated a Saudization policy (Saudization) implemented by the Ministry of Human Resources and Social Development.\nSaudization requires Saudi companies to ensure that a certain percentage of their workforce comprises Saudi nationals. Further, investors in the energy sector are encouraged to abide by the Kingdom’s broad policies of ensuring a commitment to the training and employment of Saudis.\nThe Nitaqat Saudization Program (the Nitaqat Program) was approved pursuant to the Ministry of Labor and Social Development Resolution\nNo. 4040, dated 12/10/1432H (corresponding to September 10, 2011), based on Council of Ministers Resolution No. 50, dated 21/5/1415H\n(corresponding to October 27, 1994), which was applied as at 12/10/1432H (corresponding to September 10, 2011). The Ministry of Human\nResources and Social Development established the Nitaqat Program to encourage establishments to hire Saudi nationals. The Nitaqat Program assesses an establishment’s Saudization performance based on specific ranges of compliance, which are platinum, green (which is further divided into low, medium and high ranges), yellow and red. Saudi Aramco has been classified under the “High Green” category, which means that Saudi Aramco complies with the current Saudization requirements, which accordingly allow the compliant companies to secure work visas.\nMoreover, the Ministry of Human Resources and Social Development has approved a new amendment to the Nitaqat Program under the “Nitaqat Mawzon” Program in order to improve the market’s performance and development and to eliminate non-productive nationalization.\nIt was intended to come into effect on 12/3/1438H (corresponding to December 11, 2016), but in response to private sector demands for\nadditional time to achieve the nationalization rate, the Ministry of Human Resources and Social Development postponed the program until further notice and no new implementation date has been set. Under the “Nitaqat Mawzon” program, points would be calculated based on five factors: (i) the nationalization rate; (ii) the average wage for Saudi workers; (iii) the percentage of female nationalization; (iv) job sustainability for Saudi nationals; and (v) the percentage of Saudi nationals with high wages. Currently, entities continue to be ranked on the basis of a system of rolling averages which calculate average weekly “Saudization” over a 26 week period.\n\nAdditional legal information Saudi Aramco The Company was established in the Kingdom as a company with limited liability by virtue of Royal Decree No. M/8 dated 4/4/1409H (corresponding to November 13, 1988) to assume the privileges and rights of its predecessor. It became a Saudi joint stock company as at\n14/4/1439H (corresponding to January 1, 2018) pursuant to Council of Ministers Resolution No. 180 dated 1/4/1439H (corresponding to\nDecember 19, 2017). Saudi Aramco’s registered head office is located at P.O. Box 5000, Dhahran 31311, Kingdom of Saudi Arabia. Its share\ncapital is sixty billion Saudi Riyals (SAR 60,000,000,000), consisting of two hundred billion (200,000,000,000) fully paid ordinary shares with\nno par value. Saudi Aramco’s principal activities consist of two primary operating segments, Upstream and Downstream, which are supported by its corporate activities (for further details please refer to Section 3: Results and performance).\nOn December 11, 2019, the Company completed its IPO and its ordinary shares were listed on Tadawul. In connection with the IPO the\nGovernment sold 3.45 billion ordinary shares, or 1.73% of the Company’s share capital. In addition, concurrent with the IPO, the Company\nacquired 117.2 million of its ordinary shares from the Government for a cash payment of SAR 3,750 million. These shares are held by the\nCompany as treasury shares for the purposes of issuing them to the Company’s employees upon the vesting of the grant award and any other employee share plans that the Company may adopt in the future.\nSubsidiaries Saudi Aramco holds direct and indirect ownership interests in 141 domestic and foreign subsidiaries.\nMaterial subsidiaries The Company holds, directly or indirectly, ownership interests in the', 'to September 27, 2005), as amended, and Part 5 of the Social Insurance Law, enacted by Royal Decree No. M/22 dated 6/9/1389H\n(corresponding to October 15, 1969) as amended by Royal Decree No. M/33 dated 3/9/1421H (corresponding to November 29, 2000).\nEnvironmental regulations\nThe Kingdom introduced a new Environmental Law enacted by Royal Decree No. M/165 dated 19/11/1441H corresponding to July 10,\n2020, and repealing the General Environmental Law, enacted by Royal Decree No. M/34, dated 28/7/1422H (corresponding to October\n16, 2001). This law sets out wide-ranging prohibitions of pollution and contamination of environmental mediums and water resources along with broad protections for plant covered lands, marine and coastal environments, wildlife and reservations. Additionally, the Environmental Law addresses emergencies and environmental disasters, and details violation and penalties.\nApart from national environmental legislation, other regulations are applicable in certain areas of the Kingdom. The Royal Commission for Jubail and Yanbu’ has issued detailed local environmental regulations applicable to facilities located within the Royal Commission areas and contractors operating therein (i.e., the Jubail Industrial City Royal Commission Environmental Regulations of September 1999).\nAramco separately requires compliance with environmental standards in certain circumstances. For example, Aramco administers the oil loading terminals at Ras Tanura, Ju’aymah and several smaller terminals independently of the Saudi Ports Authority.\nnotiamrofni lagel\n\nlaicnanfi lanotiiddA\n\nSaudization The Kingdom has promulgated a Saudization policy (Saudization) implemented by the Ministry of Human Resources and Social Development. Saudization requires Saudi companies to ensure that a certain percentage of their workforce comprises Saudi nationals.\nFurther, investors in the energy sector are encouraged to abide by the Kingdom’s broad policies of ensuring a commitment to the training and employment of Saudi nationals. The Nitaqat Saudization Program (the Nitaqat Program) was approved pursuant to the Ministry of Labor and Social Development (predecessor to the Ministry of Human Resources and Social Development) Resolution\nNo. 4040, dated 12/10/1432H (corresponding to September 10, 2011), based on Council of Ministers Resolution No. 50, dated\n21/5/1415H (corresponding to October 27, 1994), which was applied as at 12/10/1432H (corresponding to September 10, 2011).\nThe Ministry of Human Resources and Social Development established the Nitaqat Program to encourage establishments to hire Saudi nationals. The Nitaqat Program assesses an establishment’s Saudization performance based on specific ranges of compliance, which are platinum, green (which is further divided into low, medium and high ranges), yellow and red. Aramco has been classified under the “High Green” category, which means that Aramco complies with the current Saudization requirements, which accordingly allow the compliant companies to secure work visas.\nMoreover, the Ministry of Human Resources and Social Development has approved a new amendment to the Nitaqat Program under the “Nitaqat Mawzon” Program in order to improve the market’s performance and development and to eliminate\nnon-productive nationalization. It was intended to come into effect on 12/3/1438H (corresponding to December 11, 2016), but\nin response to private sector demands for additional time to achieve the nationalization rate, the Ministry of Human Resources and Social Development postponed the program until further notice and no new implementation date has been set. Under the “Nitaqat Mawzon” program, points would be calculated based on five factors: (i) the nationalization rate; (ii) the average wage for Saudi workers; (iii) the percentage of female nationalization; (iv) job sustainability for Saudi nationals; and (v) the percentage of Saudi nationals with high wages. Currently, entities continue to be ranked on the basis of a system of rolling averages which calculate average weekly “Saudization” over a 26-week period.\n\nAdditional legal information Aramco The Company was established in the Kingdom as a company with limited liability by virtue of Royal Decree No. M/8 dated 4/4/1409H\n(corresponding to November 13, 1988) to assume the privileges and rights of its predecessor. On January 1, 2018, the Company was\nconverted into a joint stock company pursuant to Council of Ministers Resolution No. 180 dated 1/4/1439H (corresponding to December\n19, 2017) and registered in the city of Dhahran under commercial registration No. 2052101150 dated 11/', 'the prudent stewardship of its hydrocarbon resources. Aramco has historically replaced reserves on an organic basis through revisions of reserve estimates at existing fields and through delineation and exploration to identify new fields. As a result, the Kingdom’s estimated proved reserves at the largest oil fields operated by Aramco have increased since the time of original production.\nThe following table sets forth Aramco’s estimates of its proved reserves based on the term of the Concession as at December 31, 2024 and 2023.\nCrude Oil and Condensate Natural Gas NGL Combined (mmbbl) (bscf) (mmboe) (mmbbl) (mmboe)\nReserves as at December 31, 2024 189,782 209,769 34,189 26,058 250,029\nReserves as at December 31, 2023 191,349 207,450 33,822 26,024 251,195\nThe following table sets forth the Kingdom’s estimates of its proved reserves in the fields Aramco operates as at December 31,\n2024 and 2023.\nCrude Oil and Condensate Natural Gas NGL Combined (mmbbl) (bscf) (mmboe) (mmbbl) (mmboe)\nReserves as at December 31, 2024 261,682 255,117 42,101 37,496 341,279\nReserves as at December 31, 2023 261,677 252,567 41,696 37,395 340,768\nAramco’s reserve estimates conform to the SPE-PRMS definitions and guidelines, which are the internationally recognized industry standard sponsored by the Society of Petroleum Engineers, the American Association of Petroleum Geologists, the World Petroleum Council, the Society of Petroleum Evaluation Engineers, the Society of Exploration Geophysicists, the Society of Petrophysicists and Well Log Analysts, and the European Association of Geoscientists and Engineers. To estimate or update Aramco’s reserve estimates, the Upstream segment employees responsible for reserves calculations perform technical analyses that are reviewed internally by progressively higher levels of management until finalized at year-end. Aramco annually updates its estimates as it acquires and interprets new data. For reservoirs that have been producing and have established certain performance trends, Aramco is typically able to reliably forecast the reservoir’s future production. For reservoirs that have little to no production history and new discoveries, Aramco undertakes further analysis in addition to multidisciplinary evaluation to formulate production forecasts.\nAdditional legal information All amounts in millions unless otherwise stated Aramco The Company was established in the Kingdom as a company with limited liability by virtue of Royal Decree No. M/8 dated 4/4/1409H\n(corresponding to November 13, 1988) to assume the privileges and rights of the Arabian American Oil Company. On January 1, 2018,\nthe Company was converted into a Saudi joint stock company pursuant to Council of Ministers Resolution No. 180 dated 1/4/1439H\n(corresponding to December 19, 2017) and registered in the city of Dhahran under commercial registration No. 2052101150 dated\n11/07/1439H (corresponding to March 28, 2018) with Saudi Arabian Oil Company as its official name. Its registered head office is located\nat P.O. Box 5000, Dhahran 31311, Kingdom of Saudi Arabia. Its share capital is ninety billion Saudi Riyals (﷼ 90,000,000,000), consisting of\ntwo hundred and forty two billion (242,000,000,000) fully paid ordinary shares with no par value. Aramco’s primary operating segments are Upstream and Downstream, which are supported by corporate activities (for further details refer to Section 2: Results and performance).\nOn December 11, 2019, the Company completed its IPO and its ordinary shares were listed on the Saudi Exchange. In connection with the\nIPO, the Government, being the sole owner of the Company’s shares at such time, sold 3.45 billion ordinary shares, or 1.73% of the\nCompany’s share capital. In addition, concurrent with the IPO, the Company acquired 117.2 million of its ordinary shares from the\nGovernment for a cash payment of ﷼ 3.75 billion ($1.0 billion), which are being classified as treasury shares. These shares are for use by the\nCompany for its employee share plans. On February 13, 2022, the Government announced the transfer of 4% of the Company’s total share\ncapital to PIF. On April 16, 2023, the Government announced the transfer of an additional 4% of the Company’s ordinary shares to Sanabil']","Saudi Aramco was converted into a Saudi Joint Stock Company on January 1, 2018.","The company was converted into a Saudi Joint Stock Company effective January 1, 2018. This change was made under Council of Ministers Resolution No. 180.",1.0,0.9999996795324225,0.99999999998,1.0
How much of Saudi Aramco did the Government sell in the IPO?,"['| 236,463\n52,031 | 63,566\n6,494\n\n(162)\n(1,837)\n\n(362)\n(4,019)\n(7,020)\n(5,107)\n(1,004)\n6,307 2,246\n(2,867)\n\n(128)\n(26,799) | 162,596\n\n7,559 | | 20,512\n260 | | 538\n205 | | 478\n\n39 | | 240\n269 | | 701\n(1,486) | | (4,978)\n603 | | 2,032\n\n(58) | | (83)\n\n527 | | 400\n\n987 | | (864)\n1,385 | | (1,537)\n(895) | | 259\n(161) | | (444)\n1,321 | | 1,060\n(847) | | (496)\n\n(964) | | (3,155)\n(283) | | (147)\n533 | | 921\n(25,836) | | (78,279)\n35,215 | 31,369 | 99,897\n| (11,028)\n(272‑)\n1‑ 1,750 (1,944)\n(4,009) |\n(13,225) | | (36,188)\n| | (409)\n\n(401‑) | | (899)\n112 | | 422\n144 | | 576\n| | 110\n1,427 | | 4,807\n(745‑) | | (1,174)\n22,589 | | 43,193\n9,901 | (15,382) | 10,438\n| (29,382)\n(692)\n\n642‑ (423)\n(924)\n(687) |\n(31,052) | | (93,191)\n\n(1,203) | | (2,838)\n| | (1,000)\n56 | | 160\n7,356‑ | | 9,230\n(1,301) | | (7,029)\n(1,012) | | (3,026)\n(451) | | (2,643)\n(27,607) | (31,419) | (100,337)\n| (15,432)\n66,371 |\n17,509 | | 9,998\n45,548 | | 53,059\n63,057 | 50,939 | 63,057\n\nSaudi Aramco Third quarter and nine months interim report 2024 All amounts in millions of Saudi Riyals unless otherwise stated Notes to the condensed consolidated interim financial report 1. General information The Saudi Arabian Oil Company (the “Company”), with headquarters located in Dhahran, Kingdom of Saudi Arabia (the “Kingdom”), is engaged in prospecting, exploring, drilling and extracting hydrocarbon substances (“Upstream”) and processing, manufacturing, refining and marketing these hydrocarbon substances (“Downstream”). The Company was formed on November 13, 1988 by Royal Decree No. M/8; however, its history dates back to May 29, 1933 when the Saudi Arabian Government (the “Government”) granted a concession to the Company’s predecessor for the right\nto, among other things, explore the Kingdom for hydrocarbons. Effective January 1, 2018, the Council of Ministers Resolution No. 180, dated\n1/4/1439H (December 19, 2017), converted the Company to a Saudi Joint Stock Company with new Bylaws.\nOn December 11, 2019, the Company completed its Initial Public Offering (“IPO”) and its ordinary shares were listed on the Saudi Exchange. In\nconnection with the IPO, the Government, being the sole owner of the Company’s shares at such time, sold an aggregate of 3.45 billion ordinary shares, or 1.73% of the Company’s share capital.\nOn February 13, 2022, the Government transferred 4% of the Company\'s issued shares to the Public Investment Fund (""PIF""), the sovereign\nwealth fund of the Kingdom, followed by another transfer of 4% on April 16, 2023 to Saudi Arabian Investment Company (""Sanabil Investments""), a wholly-owned company of PIF. Further, on March 7, 2024, the Government announced the transfer of an additional 8% of the Company’s\nissued shares to PIF’s wholly-owned companies.\nOn June 11, 2024, the Government completed a secondary public offering of the Company’s ordinary shares. In connection with the offering, the\nGovernment sold an aggregate of approximately 1.7 billion shares, representing 0.7% of the Company’s issued shares. This includes 137.6 million\nordinary shares acquired by the Company from the Government for a cash payment of SAR 3,750, which have', 'set the maximum amount of hydrocarbons production by the Company and the maximum sustainable capacity that the Company must maintain.\nAll natural resources within the Kingdom, including hydrocarbons, are owned by the Kingdom. Through a concession in 1933, the Government granted the Company’s predecessor the exclusive right to explore, develop and produce the Kingdom’s hydrocarbon\nresources, except in certain areas. As of December 24, 2017, the original concession agreement was replaced and superseded by an\namended concession agreement (the “Concession Agreement”) which provides the Company the exclusive right to explore, drill, prospect, appraise, develop, extract, recover, and produce hydrocarbons in the concession area. The Company is also provided the exclusive right to market and distribute hydrocarbons, petroleum products and liquid petroleum gas (“LPG”) in the Kingdom along with the non-exclusive right to manufacture, refine, and treat production and to market, sell, transport and export such production.\nThe initial term of the Concession Agreement is for 40 years, which shall be extended by the Government for 20 years unless the Company\ndoes not satisfy certain conditions commensurate with its then current operating practices. In addition, the Concession Agreement may be\namended and extended for an additional 40 years beyond the original 60-year period, subject to the Company and the Government\nagreeing on the terms of such extension.\nEffective January 1, 2018, Council of Ministers Resolution No. 180, dated 1/4/1439H (December 19, 2017) converted the Company to a Saudi\nJoint Stock Company with new Bylaws. The Company’s 1988 Articles were cancelled as of January 1, 2018, pursuant to Royal Decree No.\nM/36, dated 2/4/1439H (December 20, 2017). The Company’s Commercial Registration Number is 2052101150. The Company’s share capital\nwas set at Saudi Riyals (“SAR” or “﷼”) 60,000, divided into 200 billion fully paid ordinary shares with equal voting rights without par value.\nOn May 12, 2022 and May 8, 2023, after obtaining necessary approvals from the competent authorities in relation to the issuance of bonus\nshares, the Extraordinary General Assembly (“EGA”) approved the increases in the Company’s share capital by ﷼ 15,000 and ﷼ 15,000,\nrespectively, and the commensurate increase in the number of the Company’s issued ordinary shares by 20 billion and 22 billion,\nrespectively. The Company’s share capital after these increases is ﷼ 90,000, divided into 242 billion fully paid ordinary shares with equal\nvoting rights without par value (Note 36).\nOn December 11, 2019, the Company completed its Initial Public Offering (“IPO”) and its ordinary shares were listed on the Saudi\nExchange. In connection with the IPO, the Government, being the sole owner of the Company’s shares at such time, sold an aggregate\nof 3.45 billion ordinary shares, or 1.73% of the Company’s share capital. In addition, concurrent with the IPO, the Company acquired\n117.2 million of its ordinary shares from the Government for a cash payment of ﷼ 3,750, and classified them as treasury shares (Note 16).\nThese shares are being used by the Company for its employee share plans (Note 17).\nOn February 13, 2022, the Government transferred 4% of the Company\'s issued shares to the Public Investment Fund (""PIF""), the sovereign\nwealth fund of the Kingdom, followed by another transfer of 4% on April 16, 2023 to Saudi Arabian Investment Company (""Sanabil Investments""), a wholly-owned company of PIF. Further, on March 7, 2024, the Government transferred an additional 8% of the Company\'s\nissued shares to PIF’s wholly-owned companies.\nOn June 11, 2024, the Government completed a secondary public offering of the Company’s ordinary shares. In connection with the\noffering, the Government sold an aggregate of approximately 1.7 billion shares, representing 0.7% of the Company’s issued shares.\nThis includes 137.6 million ordinary shares acquired by the Company from the Government for a cash payment of ﷼ 3,750, which have\nbeen classified as treasury shares. These treasury shares will be used by the Company for its employee share plans. Following the completion of the offering, the Government remains the Company’s largest shareholder, retaining an 81.48% direct shareholding.\nThe consolidated financial statements of the Company and its subsidiaries (together “Saudi Aramco”) were approved by the Board of Directors on March 3, 2025.\nSAUDI ARAMCO | CONSOSLAIDUADTI E', ""ging the SAR to the U.S. Dollar were to change cash to fund its SAR denominated dividends. Such in the future and the SAR were to become changes could have a material adverse effect on stronger relative to the U.S. Dollar, Aramco may Aramco’s financial position.\nexperience an increase in the SAR denominated\n\n5 . O RGANIZATIONAL 6. A DDITIONAL STRUCTURE AND FINANCIAL 7. C ONSOLIDATED\n\nAND STRATEGY PERFORMANCE 3. SUSTAINABILITY 4. RISK GOVERNANCE INFORMATION STATEMENTS The Government has directed, and may in the commercial basis and, on September 5, 2019, Government projects future direct, Aramco to undertake projects or Aramco and the Government entered into a The Government may direct provide assistance for initiatives outside Aramco’s framework agreement to govern the furnishing of Aramco to undertake core business in furtherance of the Government’s services by Aramco to the Government. While projects or provide assistance macroeconomic, social or other objectives, these projects and initiatives have generally been for initiatives outside leveraging Aramco’s know-how, resources, and of national importance to the Kingdom and in Aramco’s core business, operational capabilities. For instance, the Aramco’s long-term commercial interests, they which may not be consistent Government has previously directed Aramco to have often been outside of Aramco’s core with Aramco’s immediate develop and construct large infrastructure businesses and have not always been consistent commercial objectives. projects and provide management, logistical, and with its immediate commercial objectives. If the other technical assistance for certain Government Government directs Aramco to undertake future initiatives. The Concession requires that all projects other than on a commercial basis, Aramco contracts with any Government agency or Aramco’s financial position and results of any arrangement for the furnishing of operation may be materially and adversely hydrocarbons, services, or otherwise shall be on a affected.\n\n5 . O RGANIZATIONAL 6. A DDITIONAL STRUCTURE AND FINANCIAL 7. C ONSOLIDATED\n\nAND STRATEGY PERFORMANCE 3. SUSTAINABILITY 4. RISK GOVERNANCE INFORMATION STATEMENTS structure and corporate governance Organizational structure: 88 Board of Directors: 90\nSenior Executives: 98 Board structure: 102\nAudit Committee report: 107 Sustainability, Risk and HSE Committee report: 109\nNomination Committee statement: 110 Compensation Committee statement: 111\nCompensation and other interests: 112 Governance, risk and compliance: 116\nStrategic integration Qatif Bulk Plant, Qatif, Saudi Arabia Aramco's Board of Directors provide strategic leadership and oversight to Company management, ensuring the CEO and Senior Executives pursue the Company's strategic goals while aligning with its vision, mission, and values.\nThrough its dedicated system of domestic and international refineries and petrochemical complexes, the Company strategically integrates its Upstream and Downstream businesses, capturing additional value across the hydrocarbon value chain.\nSenior Executives: 98\n\nAudit Committee report: 107 | | | | | | | | | | | | Sustainability, Risk and HSE Committee report: 109\nNomination Committee statement: 110\n\nCompensation and other interests: 112 | | | | | | | | | | | | Governance, risk and compliance: 116\n\nAramco's Board of | | | ti Di | f, Saudi Arabia rectors provide strategic leadership |\n\nand Senior Executiv | | | m\n\n| | | | | | | while aligning with Through its dedicat | | | it\n\nhydrocarbon value | | | | ng\n\nOrganizational structure Evolving shareholder profile\nShareholding structure1 On June 11, 2024, the Government completed a secondary public\nThe Company completed its IPO on December 11, 2019, listing its offering, selling approximately 1.7 billion shares, representing 0.7%\nordinary shares on the Saudi Exchange, with the Government selling of the Company’s issued shares. Following these transactions, the\n3.45 billion ordinary shares, or 1.73% of the Company's share Government continues to remain the Company’s largest shareholder,\ncapital. Subsequent share transfers include 4% to PIF on February holding an 81.48% direct shareholding.\n13, 2022, 4% to Sanabil Investments Company on April 16, 2023,\nand an additional 8% to PIF's wholly-owned companies on March 7, 2024.\nNo. of Shares Percent Share capital Shareholder (millions) ownership amount (millions)\nGovernment 197,191 81.48% 73,332\nPublic 5,944 2.46% 2,214\nCompany Treasury2 145 0.06% 54\nOther3 38,720 16.00%"", 'the prudent stewardship of its hydrocarbon resources. Aramco has historically replaced reserves on an organic basis through revisions of reserve estimates at existing fields and through delineation and exploration to identify new fields. As a result, the Kingdom’s estimated proved reserves at the largest oil fields operated by Aramco have increased since the time of original production.\nThe following table sets forth Aramco’s estimates of its proved reserves based on the term of the Concession as at December 31, 2024 and 2023.\nCrude Oil and Condensate Natural Gas NGL Combined (mmbbl) (bscf) (mmboe) (mmbbl) (mmboe)\nReserves as at December 31, 2024 189,782 209,769 34,189 26,058 250,029\nReserves as at December 31, 2023 191,349 207,450 33,822 26,024 251,195\nThe following table sets forth the Kingdom’s estimates of its proved reserves in the fields Aramco operates as at December 31,\n2024 and 2023.\nCrude Oil and Condensate Natural Gas NGL Combined (mmbbl) (bscf) (mmboe) (mmbbl) (mmboe)\nReserves as at December 31, 2024 261,682 255,117 42,101 37,496 341,279\nReserves as at December 31, 2023 261,677 252,567 41,696 37,395 340,768\nAramco’s reserve estimates conform to the SPE-PRMS definitions and guidelines, which are the internationally recognized industry standard sponsored by the Society of Petroleum Engineers, the American Association of Petroleum Geologists, the World Petroleum Council, the Society of Petroleum Evaluation Engineers, the Society of Exploration Geophysicists, the Society of Petrophysicists and Well Log Analysts, and the European Association of Geoscientists and Engineers. To estimate or update Aramco’s reserve estimates, the Upstream segment employees responsible for reserves calculations perform technical analyses that are reviewed internally by progressively higher levels of management until finalized at year-end. Aramco annually updates its estimates as it acquires and interprets new data. For reservoirs that have been producing and have established certain performance trends, Aramco is typically able to reliably forecast the reservoir’s future production. For reservoirs that have little to no production history and new discoveries, Aramco undertakes further analysis in addition to multidisciplinary evaluation to formulate production forecasts.\nAdditional legal information All amounts in millions unless otherwise stated Aramco The Company was established in the Kingdom as a company with limited liability by virtue of Royal Decree No. M/8 dated 4/4/1409H\n(corresponding to November 13, 1988) to assume the privileges and rights of the Arabian American Oil Company. On January 1, 2018,\nthe Company was converted into a Saudi joint stock company pursuant to Council of Ministers Resolution No. 180 dated 1/4/1439H\n(corresponding to December 19, 2017) and registered in the city of Dhahran under commercial registration No. 2052101150 dated\n11/07/1439H (corresponding to March 28, 2018) with Saudi Arabian Oil Company as its official name. Its registered head office is located\nat P.O. Box 5000, Dhahran 31311, Kingdom of Saudi Arabia. Its share capital is ninety billion Saudi Riyals (﷼ 90,000,000,000), consisting of\ntwo hundred and forty two billion (242,000,000,000) fully paid ordinary shares with no par value. Aramco’s primary operating segments are Upstream and Downstream, which are supported by corporate activities (for further details refer to Section 2: Results and performance).\nOn December 11, 2019, the Company completed its IPO and its ordinary shares were listed on the Saudi Exchange. In connection with the\nIPO, the Government, being the sole owner of the Company’s shares at such time, sold 3.45 billion ordinary shares, or 1.73% of the\nCompany’s share capital. In addition, concurrent with the IPO, the Company acquired 117.2 million of its ordinary shares from the\nGovernment for a cash payment of ﷼ 3.75 billion ($1.0 billion), which are being classified as treasury shares. These shares are for use by the\nCompany for its employee share plans. On February 13, 2022, the Government announced the transfer of 4% of the Company’s total share\ncapital to PIF. On April 16, 2023, the Government announced the transfer of an additional 4% of the Company’s ordinary shares to Sanabil', '491)\n\n(2,596) | | (10,108)\n\n177‑ | | 497‑\n2,406‑ | | 20,203‑\n(1,585) | | (122,494)\n(3,465) | | (9,690)\n(2,575) | | (9,654)\n(117,819) | (81,157) | (387,737)\n| 13,735 260,975 |\n(57,869) | | (35,025)\n248,891 | | 226,047\n191,022 | 274,710 | 191,022\n63,566 | 80,607\n5,998\n\n(17)\n(34‑)\n(1,069)\n\n(56)\n2,257 7,009\n3,737 (4,622)\n(5,360)\n(75)\n(37,381) | 182,677\n\n6,494 | | 18,406\n208 | | 628\n85 | | 372\n\n858 | | 858\n(162) | | 177\n270 | | 678\n(1,837) | | (6,848)\n520 | | 1,942\n\n11 | | (29)\n\n23 | | (29)\n(362) | | (274)\n\n(4,019) | | 426\n(7,020) | | (5,178)\n(5,107) | | (3,001)\n(1,004) | | (1,011)\n6,307 | | 5,440\n2,246 | | 1,872\n\n(2,867) | | (4,345)\n86 | | 302\n(128) | | (9)\n(26,799) | | (88,425)\n31,369 | 54,003 | 104,629\n| (9,038)\n\n(79)\n\n(240)\n(20,171) |\n(11,028) | | (30,237)\n| | (2,636)\n120 | | 740\n\n(272) | | (847)\n\n1,750 | | 5,162\n(1,944) | | (2,200)\n(4,009) | | 19,349\n(15,382) | (28,699) | (10,572)\n| (18,754)\n(749)\n(14)\n39‑\n\n(870)\n(822)\n(538) |\n(29,382) | | (68,398)\n\n(692) | | (2,695)\n\n47‑ | | 132‑\n642‑ | | 5,387‑\n(423) | | (32,665)\n(924) | | (2,584)\n(687) | | (2,574)\n(31,419) | (21,641) | (103,397)\n| 3,663 69,593 |\n(15,432) | | (9,340)\n66,371 | | 60,279\n50,939 | 73,256 | 50,939\n\nSaudi Aramco Third quarter and nine months interim report 2023 All amounts in millions of Saudi Riyals unless otherwise stated Notes to the condensed consolidated interim financial report 1. General information The Saudi Arabian Oil Company (the “Company”), with headquarters located in Dhahran, Kingdom of Saudi Arabia (the “Kingdom”), is engaged in prospecting, exploring, drilling and extracting hydrocarbon substances (“Upstream”) and processing, manufacturing, refining and marketing these hydrocarbon substances (“Downstream”). The Company was formed on November 13, 1988 by Royal Decree No. M/8; however, its history dates back to May 29, 1933 when the Saudi Arabian Government (the “Government”) granted a concession to the Company’s predecessor for the right\nto, among other things, explore the Kingdom for hydrocarbons. Effective January 1, 2018, Council of Ministers Resolution No. 180, dated\n1/4/1439H (December 19, 2017), converted the Company to a Saudi Joint Stock Company with new Bylaws.\nOn December 11, 2019, the Company completed its Initial Public Offering (“IPO”) and its ordinary shares were listed on the Saudi Exchange. In\nconnection with the IPO, the Government, being the sole owner of the Company’s shares at such time, sold an aggregate of 3.45 billion ordinary shares, or 1.73% of the Company’s share capital.\nOn February 13, 2022, the Government transferred 4% of the Company’s issued shares to the Public Investment Fund (“PIF”), the sovereign\nwealth fund of the Kingdom. Subsequently, the Government announced on April 16, 2023, the transfer of 4% of the Company’s issued shares to']","The Government sold an aggregate of 3.45 billion ordinary shares, or 1.73% of the Company’s share capital, in the IPO.","In the IPO completed on December 11, 2019, the Government sold 3.45 billion ordinary shares. That represented 1.73% of the company's share capital.",1.0,0.7190805687856267,0.99999999998,1.0
What are the main assumptions used in Saudi Aramco's impairment tests for non-financial assets?,"['recognized as a separate asset only when it is probable that future economic benefits associated with the item will flow to Saudi Aramco and the cost of the item can be measured reliably. The carrying amount of the replaced item is derecognized. All other repair and maintenance expenditures are expensed as incurred. The present value of the expected cost for the decommissioning of an asset after its use is included in the cost of the respective asset if the recognition criteria for a provision are met (Note 2(v)).\nWhere the life of expected hydrocarbon reserves substantially exceeds the economic or technical lives of the underlying assets, the straight- line method of depreciation is used. The unit of production method is used for fields where the expected reserve life is approximately equal to or less than the estimated useful lives of the underlying assets. Depletion rates are calculated on the basis of a group of wells or fields with similar characteristics based on proved developed reserves. The estimation of expected reserve lives reflects management’s assessment of proved developed reserves and the related depletion strategy on a field-by-field basis. Depreciation expense on all other assets is calculated using the straight-line method to allocate the cost less residual values over the estimated useful lives. Depreciation expense is recorded in the consolidated statement of income.\nDepreciation expense is calculated after determining an estimate of an asset’s expected useful life and the expected residual value at the end of its useful life. The useful lives and residual values are determined by management at the time the asset is initially recognized and are reviewed annually for appropriateness or when events or conditions occur that impact capitalized costs, hydrocarbon reserves, residual values or estimated useful lives.\n\nNotes to the consolidated financial statements continued All amounts in millions of Saudi Riyals unless otherwise stated 2. Material accounting policy information and significant judgments and estimates continued (g) Property, plant and equipment continued The estimated useful lives or, for right-of-use assets the lease term, if shorter (Note 2(i)), in years, of principal groups of depreciable assets is as follows:\nLand and land improvements 3 to 54 Buildings 5 to 50\nOil and gas properties 15 to 35\nPlant, machinery and equipment 2 to 52 Depots, storage tanks and pipelines 4 to 30\nFixtures, IT and office equipment 2 to 20 Gains and losses on disposals of depreciable assets are recognized in net income.\n(h) Impairment of non-financial assets At each reporting date, Saudi Aramco assesses, whether there are any indications that a non-financial asset with a definite life might be impaired. Assets with indefinite useful lives, such as goodwill and brands acquired on acquisition of certain subsidiaries, are reviewed for impairment on an annual basis. If an indication of impairment exists, or when annual impairment testing for an asset is required, the asset’s recoverable amount is estimated. An impairment loss is recognized for the amount by which the asset’s carrying amount exceeds its recoverable amount. The recoverable amount is the higher of an asset’s fair value less costs of disposal or value in use (“VIU”). The fair value less costs of disposal calculation is based on either, post-tax discounted cash flow models or available data from binding arm’s length sales transactions for similar assets, or observable market prices less incremental costs of disposing of the asset. The VIU calculation is based on a post-tax risk adjusted discounted cash flow model. The use of post-tax discount rates in determining VIU does not result in a materially different determination of the need for, or the amount of, impairment that would be required if pre-tax discount rates had been used.\nImpairment losses are recognized as a component of net income and are presented within impairment and held for sale remeasurement losses in the consolidated statement of income. Impairment losses for 2024, previously recognized within depreciation and amortization, have been reclassified to conform to the current year presentation. If, in a subsequent period, the amount of a non-goodwill impairment loss decreases, a reversal of the previously recognized impairment loss is recognized in net income.\nSignificant accounting judgments and estimates Impairment tests are undertaken on the basis of the smallest identifiable group of assets (cash-generating unit), or individual assets, for which there are largely independent cash inflows. The key assumptions used to determine the different cash-generating units involves significant judgment by management.\nFor the purposes of determining whether impairment of non-financial assets has occurred, and the extent of any impairment or its reversal, the key assumptions management uses in estimating future cash flows for its VIU calculations are forecasted future oil, gas, refined product and chemical prices, expected production volumes, future operating and development costs, refining and petrochemical margins and changes to the discount rate used for the discounted cash flow model. There is an inherent uncertainty over forecasted information and assumptions. Changes in these assumptions and forecasts could impact the recoverable amounts of assets and any calculated impairment and reversals thereof.\n(i) Leases Saudi Aramco’s portfolio of leased assets mainly comprises land', '2(s)). Land and construction- in-progress are not depreciated. When a construction-in-progress asset is deemed available for use as intended by management, depreciation commences.\nSubsequent expenditures including major renovations are included in an asset’s carrying amount, or recognized as a separate asset only when it is probable that future economic benefits associated with the item will flow to Saudi Aramco and the cost of the item can be measured reliably. The carrying amount of the replaced item is derecognized. All other repair and maintenance expenditures are expensed as incurred. The present value of the expected cost for the decommissioning of an asset after its use is included in the cost of the respective asset if the recognition criteria for a provision are met (Note 2(v)).\nWhere the life of expected hydrocarbon reserves substantially exceeds the economic or technical lives of the underlying assets, the straight-line method of depreciation is used. The unit of production method is used for fields where the expected reserve life is approximately equal to or less than the estimated useful lives of the underlying assets. Depletion rates are calculated on the basis of a group of wells or fields with similar characteristics based on proved developed reserves. The estimation of expected reserve lives reflects management’s assessment of proved developed reserves and the related depletion strategy on a field-by-field basis. Depreciation expense on all other assets is calculated using the straight-line method to allocate the cost less residual values over the estimated useful lives.\nDepreciation expense is recorded in the consolidated statement of income.\nDepreciation expense is calculated after determining an estimate of an asset’s expected useful life and the expected residual value at the end of its useful life. The useful lives and residual values are determined by management at the time the asset is initially recognized and are reviewed annually for appropriateness or when events or conditions occur that impact capitalized costs, hydrocarbon reserves, residual values or estimated useful lives.\nSAUDI ARAMCO | CONSOSLAIDUADTI EADR AFIMNACNOC | IAANL NSTUAATLE RMEEPNOTRST 2 2002244 1 8171\n\nNotes to the consolidated financial statements continued All amounts in millions of Saudi Riyals unless otherwise stated 2. Material accounting policy information and significant judgments and estimates continued (g) Property, plant and equipment continued The estimated useful lives or, for right-of-use assets the lease term, if shorter (Note 2(i)), in years, of principal groups of depreciable assets is as follows:\nLand and land improvements 3 to 54 Buildings 5 to 50\nOil and gas properties 15 to 30\nPlant, machinery and equipment 2 to 52 Depots, storage tanks and pipelines 4 to 30\nFixtures, IT and office equipment 2 to 20 Gains and losses on disposals of depreciable assets are recognized in net income.\n(h) Impairment of non-financial assets At each reporting date, Saudi Aramco assesses, whether there are any indications that a non-financial asset with a definite life might be impaired. Assets with indefinite useful lives, such as goodwill and brands acquired on acquisition of certain subsidiaries, are reviewed for impairment on an annual basis. If an indication of impairment exists, or when annual impairment testing for an asset is required, the asset’s recoverable amount is estimated. An impairment loss is recognized for the amount by which the asset’s carrying amount exceeds its recoverable amount. The recoverable amount is the higher of an asset’s fair value less costs of disposal or value in use (“VIU”). The fair value less costs of disposal calculation is based on either, post-tax discounted cash flow models or available data from binding arm’s length sales transactions for similar assets, or observable market prices less incremental costs of disposing of the asset. The VIU calculation is based on a post-tax risk adjusted discounted cash flow model. The use of post-tax discount rates in determining VIU does not result in a materially different determination of the need for, or the amount of, impairment that would be required if pre-tax discount rates had been used.\nImpairment losses are recognized as a component of net income and are presented within depreciation and amortization in the consolidated statement of income. If, in a subsequent period, the amount of a non-goodwill impairment loss decreases, a reversal of the previously recognized impairment loss is recognized in net income.\nSignificant accounting judgments and estimates Impairment tests are undertaken on the basis of the smallest identifiable group of assets (cash-generating unit), or individual assets, for which there are largely independent cash inflows. The key assumptions used to determine the different cash-generating units involves significant judgment by management.\nFor the purposes of determining whether impairment of non-financial assets has occurred, and the extent of any impairment or its reversal, the key assumptions management uses in estimating future cash flows for its VIU calculations are forecasted future oil, gas, refined product and chemical prices, expected production volumes, future operating and development costs, refining and petrochemical margins and changes to', 'directly attributable to the construction and/or acquisition of the asset (Note 2(s)). Land and construction-in-progress are not depreciated. When a construction-in-progress asset is deemed ready for use as intended by management, depreciation commences.\nSubsequent expenditures including major renovations are included in an asset’s carrying amount, or recognized as a separate asset only when it is probable that future economic benefits associated with the item will flow to Saudi Aramco and the cost of the item can be measured reliably. The carrying amount of the replaced item is derecognized. All other repair and maintenance expenditures are expensed as incurred. The present value of the expected cost for the decommissioning of an asset after its use is included in the cost of the respective asset if the recognition criteria for a provision are met (Note 2(v)).\nWhere the life of expected hydrocarbon reserves substantially exceeds the economic or technical lives of the underlying assets, the straight-line method of depreciation is used on a field-by-field basis. The unit of production method is used for fields where the expected reserve life is approximately equal to or less than the estimated useful lives of the underlying assets. Depletion rates are calculated on the basis of a group of wells or fields with similar characteristics based on proved developed reserves. The estimation of expected reserve lives reflects management’s assessment of proved developed reserves and the related depletion strategy on a field-by-field basis. Depreciation expense on all other assets is calculated using the straight-line method to allocate the cost less residual values over the estimated useful lives. Depreciation expense is recorded in the Consolidated Statement of Income.\nDepreciation expense is calculated after determining an estimate of an asset’s expected useful life and the expected residual value at the end of its useful life. The useful lives and residual values are determined by management at the time the asset is initially recognized and reviewed annually for appropriateness or when events or conditions occur that impact capitalized costs, hydrocarbon reserves or estimated useful lives.\n\nAll amounts in millions of Saudi Riyals unless otherwise stated 187 2. Summary of significant accounting policies, judgments and estimates continued The following table sets forth estimated useful lives or, the lease term, if shorter, for right-of-use assets (Note 2(j)), in years of the principal groups of depreciable assets:\nCrude oil facilities:\nPipelines and storage tanks 12 to 23\nDrilling and construction equipment 5 to 25\nOil and gas properties 15 to 30\nMarine equipment 13 to 30\nRefinery and petrochemical facilities 2 to 50 Gas and Natural Gas Liquids (“NGL”) facilities 2 to 30\nGeneral service plant:\nPermanent buildings 20 to 40\nRoads and walkways 10 to 20\nAircraft 8 to 17 Autos and trucks 3 to 20\nOffice furniture and equipment 6 to 8 Computer equipment 3 to 5 Net gains and losses on disposals of depreciable assets are recognized in net income. Right of use assets are depreciated over the life of the asset or the lease term, if shorter (Note 2(j)).\n(i) Impairment of non-financial assets Saudi Aramco assesses, at each reporting date, whether there is an indication that a non-financial asset may be impaired except that assets with indefinite useful lives such as goodwill and brand acquired on acquisition of SABIC (Note 4) are reviewed for impairment on an annual basis. If an indication exists, or when annual impairment testing for an asset is required, the asset’s recoverable amount is estimated. An impairment loss is recognized for the amount by which the asset’s carrying amount exceeds its recoverable amount.\nThe recoverable amount is the higher of an asset’s fair value less costs of disposal or value in use (“VIU”). The fair value less costs of disposal calculation is based on either, post-tax discounted cash flow models or available data from binding arm’s length sales transactions for similar assets, or observable market prices less incremental costs for disposing of the asset. The VIU calculation is based on a post-tax risk adjusted discounted cash flow model. The use of post-tax discount rates in determining value in use does not result in a materially different determination of the need for, or the amount of, impairment that would be required if pre-tax discount rates had been used.\nImpairment losses are recognized as a component of net income. If, in a subsequent period, the amount of a non-goodwill impairment loss decreases, a reversal of the previously recognized impairment loss is recognized in net income.\nSignificant accounting judgments and estimates Impairment tests are undertaken on the basis of the smallest identifiable group of assets (cash-generating unit), or individual assets, for which there are largely independent cash inflows. The key assumptions used to determine the different cash-generating units involves significant judgment from management.\nFor the purposes of determining whether impairment of oil, refining and petrochemical, gas and NGL, general service plant or construction-in-progress assets has occurred, and the extent', 'reserves. The estimation of expected reserve lives reflects management’s assessment of proved developed reserves and the related depletion strategy on a field-by-field basis.\nDepreciation expense on all other assets is calculated using the straight-line method to allocate the cost less residual values over the estimated useful lives. Depreciation expense is recorded in the Consolidated Statement of Income.\nDepreciation expense is calculated after determining an estimate of an asset’s expected useful life and the expected residual value at the end of its useful life. The useful lives and residual values are determined by management at the time the asset is initially recognized and are reviewed annually for appropriateness or when events or conditions occur that impact capitalized costs, hydrocarbon reserves or estimated useful lives.\nAs of January 1, 2021, Saudi Aramco changed the presentation of the groups of assets under property, plant and equipment. The new presentation is consistent with the generally accepted practice of presenting assets based on their nature as compared to the business function where they are used in the company’s operations. This change has no current or future impact on the total reported carrying values, estimated useful lives or depreciation expense.\n\nNotes to the consolidated financial statements continued All amounts in millions of Saudi Riyals unless otherwise stated 2. Summary of significant accounting policies, judgments and estimates continued The estimated useful lives or, the lease term, if shorter, for right of use assets (Note 2(i)) in years of principal groups of depreciable assets based on the revised presentation is as follows:\nLand and land improvements 3 to 30 Buildings 5 to 50\nOil and gas properties 15 to 30\nPlant, machinery and equipment 2 to 50 Depots, storage tanks and pipelines 4 to 30\nFixtures, IT and office equipment 2 to 20 The estimated useful lives or, the lease term, if shorter, for right-of-use assets (Note 2(i)), in years of the principal groups of depreciable assets for the previous presentation is set forth below:\nCrude oil facilities:\nPipelines and storage tanks 12 to 23\nDrilling and construction equipment 5 to 25\nOil and gas properties 15 to 30\nMarine equipment 13 to 30\nRefinery and petrochemical facilities 2 to 50 Gas and Natural Gas Liquids (“NGL”) facilities 2 to 30\nGeneral service plant:\nPermanent buildings 20 to 40\nRoads and walkways 10 to 20\nAircraft 8 to 17 Autos and trucks 3 to 20\nOffice furniture and equipment 6 to 8 Computer equipment 3 to 5 Right of use assets are depreciated over the life of the asset or the lease term, if shorter (Note 2(i)).\nGains and losses on disposals of depreciable assets are recognized in net income.\n(h) Impairment of non-financial assets Saudi Aramco assesses, at each reporting date, whether there is an indication that a non-financial asset may be impaired except that assets with indefinite useful lives such as goodwill and brand acquired on acquisition of SABIC (Note 35) are reviewed for impairment on an annual basis. If an indication exists, or when annual impairment testing for an asset is required, the asset’s recoverable amount is estimated. An impairment loss is recognized for the amount by which the asset’s carrying amount exceeds its recoverable amount.\nThe recoverable amount is the higher of an asset’s fair value less costs of disposal or value in use (“VIU”). The fair value less costs of disposal calculation is based on either, post-tax discounted cash flow models or available data from binding arm’s length sales transactions for similar assets, or observable market prices less incremental costs for disposing of the asset. The VIU calculation is based on a post-tax risk adjusted discounted cash flow model. The use of post-tax discount rates in determining VIU does not result in a materially different determination of the need for, or the amount of, impairment that would be required if pre-tax discount rates had been used.\nImpairment losses are recognized as a component of net income. If, in a subsequent period, the amount of a non-goodwill impairment loss decreases, a reversal of the previously recognized impairment loss is recognized in net income.\nSignificant accounting judgments and estimates Impairment tests are undertaken on the basis of the smallest identifiable group of assets (cash-generating unit), or individual assets, for which there are largely independent cash inflows. The key assumptions used to determine the different cash-generating units involves significant judgment from management.\n\nConsolidated financial statements All amounts in millions of Saudi Riyals unless otherwise stated 2. Summary of significant accounting policies, judgments and estimates continued For the purposes of determining whether impairment of items of property, plant and equipment has occurred, and the extent of any impairment or its reversal, the key assumptions management uses in estimating future cash flows for its VIU calculations are forecasted future oil, gas, refined product and chemical prices, expected production volumes, future', 'its use is included in the cost of the respective asset if the recognition criteria for a provision are met (Note 2(u)).\nWhere the life of expected hydrocarbon reserves substantially exceeds the economic or technical lives of the underlying assets, the straight-line method of depreciation is used on a field by field basis. The unit of production method is used for fields where the expected reserve life is approximately equal to or less than the estimated useful lives of the underlying assets. Depletion rates are calculated on the basis of a group of wells or fields with similar characteristics based on proved developed reserves. The estimation of expected reserve lives reflects management’s assessment of proved developed reserves and the related depletion strategy on a field-by-field basis. Depreciation expense on all other assets is calculated using the straight-line method to allocate the cost less residual values over the estimated useful lives. Depreciation expense is recorded in the Consolidated Statement of Income.\nDepreciation expense is calculated after determining an estimate of an asset’s expected useful life and the expected residual value at the end of its useful life. The useful lives and residual values are determined by management at the time the asset is initially recognized and reviewed annually for appropriateness or when events or conditions occur that impact capitalized costs, hydrocarbon reserves or estimated useful lives.\n\n2. Summary of significant accounting policies, judgments and estimates continued The following table sets forth estimated useful lives or, the lease term, if shorter, for right-of-use assets (Note 2(i)), in years of the principal groups of depreciable assets:\nCrude oil facilities:\nPipelines and storage tanks 12 to 23\nDrilling and construction equipment 5 to 25\nOil and gas properties 15 to 30\nMarine equipment 13 to 30\nRefinery and petrochemical facilities 5 to 40 Gas and Natural Gas Liquids (“NGL”) facilities 2 to 30\nGeneral service plant:\nPermanent buildings 20 to 40\nRoads and walkways 10 to 20\nAircraft 8 to 17 Autos and trucks 3 to 20\nOffice furniture and equipment 6 to 8 Computer equipment 3 to 5 Net gains and losses on disposals of depreciable assets are recognized in net income. Property, plant and equipment held under a finance lease is depreciated over the life of the asset or the lease term, if shorter.\n(h) Impairment of non-financial assets Saudi Aramco assesses, at each reporting date, whether there is an indication that a non-financial asset may be impaired except that goodwill is reviewed for impairment on an annual basis. If an indication exists, or when annual impairment testing for an asset is required, the asset’s recoverable amount is estimated. An impairment loss is recognized for the amount by which the asset’s carrying amount exceeds its recoverable amount. The recoverable amount is the higher of an asset’s fair value less costs of disposal or value in use (“VIU”). The fair value less costs of disposal calculation is based on either post-tax discounted cash flow models or available data from binding arm’s length sales transactions for similar assets or observable market prices less incremental costs for disposing of the asset. The VIU calculation is based on a post-tax risk adjusted discounted cash flow model. The use of post-tax discount rates in determining value in use does not result in a materially different determination of the need for, or the amount of, impairment that would be required if pre-tax discount rates had been used.\nImpairment losses are recognized as a component of net income. If, in a subsequent period, the amount of a non-goodwill impairment loss decreases, a reversal of the previously recognized impairment loss is recognized in net income.\nSignificant accounting judgments and estimates Impairment tests are undertaken on the basis of the smallest identifiable group of assets (cash-generating unit), or individual assets, for which there are largely independent cash inflows. The key assumptions used to determine the different cash-generating units involves significant judgment from management.\nFor the purposes of determining whether impairment of oil, gas, refining or petrochemical assets has occurred, and the extent of any impairment or its reversal, the key assumptions management uses in estimating future cash flows for its VIU calculations are forecasted future oil and gas and chemical prices, expected production volumes, future operating and development costs, refining and petrochemical margins and changes to the discount rate used for the discounted cash flow model. There is an inherent uncertainty over forecasted information and assumptions.\nChanges in these assumptions and forecasts could impact the recoverable amounts of assets and any calculated impairment and reversals thereof.\nstnemetats laicnanfi detadilosnoc Notes to the consolidated financial statements continued\n\nAll amounts in millions of Saudi Riyals unless otherwise stated 147 2. Summary of significant accounting policies, judgments and estimates continued (i) Leases Saudi Aramco’s portfolio of leased assets mainly comprises drilling rigs, marine vessels, industrial facilities, equipment, aircraft and vehicles. The determination of whether the contract is, or contains, a']","The main assumptions used in Saudi Aramco's impairment tests for non-financial assets include:

1. Forecasted future oil, gas, refined product, and chemical prices.
2. Expected production volumes.
3. Future operating and development costs.
4. Refining and petrochemical margins.
5. Changes to the discount rate used for the discounted cash flow model. 

These assumptions are critical for estimating future cash flows for value in use (VIU) calculations.","The key assumptions include forecasted oil, gas, refined product and chemical prices, expected production volumes, future operating and development costs, refining and petrochemical margins, and discount rates. These assumptions affect recoverable amounts and any impairment calculations.",1.0,0.9999996448645309,0.99999999998,1.0
What does Saudi Aramco's lease accounting policy say about right-of-use assets?,"['ABIC in 2020 are reviewed for impairment on an annual basis. If an indication exists, or when annual impairment testing for an asset is required, the asset’s recoverable amount is estimated. An impairment loss is recognized for the amount by which the asset’s carrying amount exceeds its recoverable amount. The recoverable amount is the higher of an asset’s fair value less costs of disposal or value in use (“VIU”).\nThe fair value less costs of disposal calculation is based on either, post-tax discounted cash flow models or available data from binding arm’s length sales transactions for similar assets, or observable market prices less incremental costs for disposing of the asset. The VIU calculation is based on a post-tax risk adjusted discounted cash flow model. The use of post-tax discount rates in determining VIU does not result in a materially different determination of the need for, or the amount of, impairment that would be required if pre-tax discount rates had been used.\nImpairment losses are recognized as a component of net income. If, in a subsequent period, the amount of a non-goodwill impairment loss decreases, a reversal of the previously recognized impairment loss is recognized in net income.\nSignificant accounting judgments and estimates Impairment tests are undertaken on the basis of the smallest identifiable group of assets (cash-generating unit), or individual assets, for which there are largely independent cash inflows. The key assumptions used to determine the different cash- generating units involves significant judgment from management.\nFor the purposes of determining whether impairment of items of property, plant and equipment has occurred, and the extent of any impairment or its reversal, the key assumptions management uses in estimating future cash flows for its VIU calculations are forecasted future oil, gas, refined product and chemical prices, expected production volumes, future operating and development costs, refining and petrochemical margins and changes to the discount rate used for the discounted cash flow model. There is an inherent uncertainty over forecasted information and assumptions. Changes in these assumptions and forecasts could impact the recoverable amounts of assets and any calculated impairment and reversals thereof.\n(j) Leases Saudi Aramco’s portfolio of leased assets mainly comprises land and buildings, drilling rigs, marine vessels, industrial facilities, equipment, storage and tanks, aircraft and vehicles. The determination of whether the contract is, or contains, a lease is based on the substance of the contract at the inception of the lease. A contract is, or contains, a lease if the contract conveys the right to control the use of an identified asset for a period of time in exchange for consideration.\nSaudi Aramco recognizes right-of-use assets and lease liabilities at the lease commencement date. Right-of-use assets are initially measured at cost, which comprises lease liabilities at initial measurement, any initial direct costs incurred, any lease payments made at or before the commencement date, and restoration costs less any lease incentives received. Subsequent to initial recognition the right-of-use assets are measured at cost less accumulated depreciation and accumulated impairment losses, if any, and adjusted for any remeasurement of the lease liability. Right-of-use assets are depreciated over the shorter of the asset’s useful life and the lease term on a straight-line basis unless the lease transfers ownership of the underlying asset by the end of the lease term or if the cost of the asset reflects the exercise of the purchase option, in which case right-of-use assets are depreciated over the useful life of the underlying asset. Depreciation expense is recorded in the consolidated statement of income. Right-of-use assets are included under property, plant and equipment (Note 5).\n\nAll amounts in millions of Saudi Riyals unless otherwise stated 2. Summary of significant accounting policies, judgments and estimates continued (j) Leases continued Lease liabilities are initially measured at the present value of lease payments. Lease payments include fixed lease payments, variable lease payments that depend on an index or rate, amounts payable for guaranteed residual values and payments to be made under extension or purchase or termination options, where applicable. The lease payments are discounted using the interest rate implicit in the lease. If that rate cannot be readily determined, which is generally the case, the lessee’s incremental borrowing rate is used, being the rate that the individual lessee would have to pay to borrow the funds necessary to obtain an asset of similar value to the right-of-use asset in a similar economic environment with similar terms, security and conditions.\nSubsequent to initial recognition, the lease liabilities are measured by increasing the carrying amount to reflect interest on the lease liability, reducing the carrying amount to reflect the lease payments made and adjusted for remeasurement to reflect any reassessments or lease modifications. Lease liabilities are included under borrowings (Note 20). Lease payments are allocated between the principal and finance costs. Finance costs are recorded as an expense in the consolidated statement of income over the lease period so as to produce a constant periodic rate of interest on the remaining balance of the liability.\nSaudi Aramco has elected not to recognize right-of-use assets and lease liabilities for short-term and low-value leases. Lease payments under short', ""15 to 30\nPlant, machinery and equipment 2 to 50 Depots, storage tanks and pipelines 4 to 30\nFixtures, IT and office equipment 2 to 20 The estimated useful lives or, the lease term, if shorter, for right-of-use assets (Note 2(i)), in years of the principal groups of depreciable assets for the previous presentation is set forth below:\nCrude oil facilities:\nPipelines and storage tanks 12 to 23\nDrilling and construction equipment 5 to 25\nOil and gas properties 15 to 30\nMarine equipment 13 to 30\nRefinery and petrochemical facilities 2 to 50 Gas and Natural Gas Liquids (“NGL”) facilities 2 to 30\nGeneral service plant:\nPermanent buildings 20 to 40\nRoads and walkways 10 to 20\nAircraft 8 to 17 Autos and trucks 3 to 20\nOffice furniture and equipment 6 to 8 Computer equipment 3 to 5 Right of use assets are depreciated over the life of the asset or the lease term, if shorter (Note 2(i)).\nGains and losses on disposals of depreciable assets are recognized in net income.\n(h) Impairment of non-financial assets Saudi Aramco assesses, at each reporting date, whether there is an indication that a non-financial asset may be impaired except that assets with indefinite useful lives such as goodwill and brand acquired on acquisition of SABIC (Note 35) are reviewed for impairment on an annual basis. If an indication exists, or when annual impairment testing for an asset is required, the asset’s recoverable amount is estimated. An impairment loss is recognized for the amount by which the asset’s carrying amount exceeds its recoverable amount.\nThe recoverable amount is the higher of an asset’s fair value less costs of disposal or value in use (“VIU”). The fair value less costs of disposal calculation is based on either, post-tax discounted cash flow models or available data from binding arm’s length sales transactions for similar assets, or observable market prices less incremental costs for disposing of the asset. The VIU calculation is based on a post-tax risk adjusted discounted cash flow model. The use of post-tax discount rates in determining VIU does not result in a materially different determination of the need for, or the amount of, impairment that would be required if pre-tax discount rates had been used.\nImpairment losses are recognized as a component of net income. If, in a subsequent period, the amount of a non-goodwill impairment loss decreases, a reversal of the previously recognized impairment loss is recognized in net income.\nSignificant accounting judgments and estimates Impairment tests are undertaken on the basis of the smallest identifiable group of assets (cash-generating unit), or individual assets, for which there are largely independent cash inflows. The key assumptions used to determine the different cash-generating units involves significant judgment from management.\n19 Saudi Arabian Oil Company | Consolidated financial statements for the year ended December 31, 2021\n\nAll amounts in millions of Saudi Riyals unless otherwise stated 2. Summary of significant accounting policies, judgments and estimates continued For the purposes of determining whether impairment of items of property, plant and equipment has occurred, and the extent of any impairment or its reversal, the key assumptions management uses in estimating future cash flows for its VIU calculations are forecasted future oil, gas, refined product and chemical prices, expected production volumes, future operating and development costs, refining and petrochemical margins and changes to the discount rate used for the discounted cash flow model. There is an inherent uncertainty over forecasted information and assumptions. Changes in these assumptions and forecasts could impact the recoverable amounts of assets and any calculated impairment and reversals thereof.\n(i) Leases Saudi Aramco’s portfolio of leased assets mainly comprises land and buildings, drilling rigs, marine vessels, industrial facilities, equipment, storage and tanks, aircraft and vehicles. The determination of whether the contract is, or contains, a lease is based on the substance of the contract at the inception of the lease. A contract is, or contains, a lease if the contract conveys the right to control the use of an identified asset for a period of time in exchange for consideration.\nSaudi Aramco recognizes right-of-use assets and lease liabilities at the lease commencement date. Right-of-use assets are initially measured at cost, which comprises lease liabilities at initial measurement, any initial direct costs incurred, any lease payments made at or before the commencement date, and restoration costs less any lease incentives received. Subsequent to initial recognition the right-of-use assets are measured at cost less accumulated depreciation and accumulated impairment losses, if any, and adjusted for any remeasurement of the lease liability. Right-of-use assets are depreciated over the shorter of the asset's useful life and the lease term on a straight-line basis unless the lease transfers ownership of the underlying asset by the end of the lease term or if the cost of the asset"", 'able amount is the higher of an asset’s fair value less costs of disposal or value in use (“VIU”).\nThe fair value less costs of disposal calculation is based on either, post-tax discounted cash flow models or available data from binding arm’s length sales transactions for similar assets, or observable market prices less incremental costs for disposing of the asset. The VIU calculation is based on a post-tax risk adjusted discounted cash flow model. The use of post-tax discount rates in determining VIU does not result in a materially different determination of the need for, or the amount of, impairment that would be required if pre-tax discount rates had been used.\nImpairment losses are recognized as a component of net income. If, in a subsequent period, the amount of a non-goodwill impairment loss decreases, a reversal of the previously recognized impairment loss is recognized in net income.\nSignificant accounting judgments and estimates Impairment tests are undertaken on the basis of the smallest identifiable group of assets (cash-generating unit), or individual assets, for which there are largely independent cash inflows. The key assumptions used to determine the different cash- generating units involves significant judgment from management.\nFor the purposes of determining whether impairment of items of property, plant and equipment has occurred, and the extent of any impairment or its reversal, the key assumptions management uses in estimating future cash flows for its VIU calculations are forecasted future oil, gas, refined product and chemical prices, expected production volumes, future operating and development costs, refining and petrochemical margins and changes to the discount rate used for the discounted cash flow model. There is an inherent uncertainty over forecasted information and assumptions. Changes in these assumptions and forecasts could impact the recoverable amounts of assets and any calculated impairment and reversals thereof.\n(j) Leases Saudi Aramco’s portfolio of leased assets mainly comprises land and buildings, drilling rigs, marine vessels, industrial facilities, equipment, storage and tanks, aircraft and vehicles. The determination of whether the contract is, or contains, a lease is based on the substance of the contract at the inception of the lease. A contract is, or contains, a lease if the contract conveys the right to control the use of an identified asset for a period of time in exchange for consideration.\nSaudi Aramco recognizes right-of-use assets and lease liabilities at the lease commencement date. Right-of-use assets are initially measured at cost, which comprises lease liabilities at initial measurement, any initial direct costs incurred, any lease payments made at or before the commencement date, and restoration costs less any lease incentives received. Subsequent to initial recognition the right-of-use assets are measured at cost less accumulated depreciation and accumulated impairment losses, if any, and adjusted for any remeasurement of the lease liability. Right-of-use assets are depreciated over the shorter of the asset’s useful life and the lease term on a straight-line basis unless the lease transfers ownership of the underlying asset by the end of the lease term or if the cost of the asset reflects the exercise of the purchase option, in which case right-of-use assets are depreciated over the useful life of the underlying asset. Depreciation expense is recorded in the consolidated statement of income. Right-of-use assets are included under property, plant and equipment (Note 5).\n\nNotes to the consolidated financial statements continued All amounts in millions of Saudi Riyals unless otherwise stated\n\n2. Summary of significant accounting policies, judgments and estimates continued (j) Leases continued Lease liabilities are initially measured at the present value of lease payments. Lease payments include fixed lease payments, variable lease payments that depend on an index or rate, amounts payable for guaranteed residual values and payments to be made under extension or purchase or termination options, where applicable. The lease payments are discounted using the interest rate implicit in the lease. If that rate cannot be readily determined, which is generally the case, the lessee’s incremental borrowing rate is used, being the rate that the individual lessee would have to pay to borrow the funds necessary to obtain an asset of similar value to the right-of-use asset in a similar economic environment with similar terms, security and conditions.\nSubsequent to initial recognition, the lease liabilities are measured by increasing the carrying amount to reflect interest on the lease liability, reducing the carrying amount to reflect the lease payments made and adjusted for remeasurement to reflect any reassessments or lease modifications. Lease liabilities are included under borrowings (Note 20). Lease payments are allocated between the principal and finance costs. Finance costs are recorded as an expense in the consolidated statement of income over the lease period so as to produce a constant periodic rate of interest on the remaining balance of the liability.\nSaudi Aramco has elected not to recognize right-of-use assets and lease liabilities for short-term and low-value leases. Lease payments under short-term and low-value leases are recorded as an expense in the consolidated statement of income on a straight-line basis over the lease term.\nSignificant accounting judgments and estimates In determining the lease term, management considers all facts and circumstances that create an economic incentive to exercise an extension option, or', 'the estimated useful lives. Depreciation expense is recorded in the Consolidated Statement of Income.\nDepreciation expense is calculated after determining an estimate of an asset’s expected useful life and the expected residual value at the end of its useful life. The useful lives and residual values are determined by management at the time the asset is initially recognized and reviewed annually for appropriateness or when events or conditions occur that impact capitalized costs, hydrocarbon reserves or estimated useful lives.\n\n,13 rebmeceD dedne\n\nstnemetats laicnanfi detadilosno C\n\n2. Summary of significant accounting policies, judgments and estimates continued The following table sets forth estimated useful lives or, the lease term, if shorter, for right-of-use assets (Note 2(j)), in years of the principal groups of depreciable assets:\nCrude oil facilities:\nPipelines and storage tanks 12 to 23\nDrilling and construction equipment 5 to 25\nOil and gas properties 15 to 30\nMarine equipment 13 to 30\nRefinery and petrochemical facilities 2 to 50 Gas and Natural Gas Liquids (“NGL”) facilities 2 to 30\nGeneral service plant:\nPermanent buildings 20 to 40\nRoads and walkways 10 to 20\nAircraft 8 to 17 Autos and trucks 3 to 20\nOffice furniture and equipment 6 to 8 Computer equipment 3 to 5 Net gains and losses on disposals of depreciable assets are recognized in net income. Right of use assets are depreciated over the life of the asset or the lease term, if shorter (Note 2(j)).\n(i) Impairment of non-financial assets Saudi Aramco assesses, at each reporting date, whether there is an indication that a non-financial asset may be impaired except that assets with indefinite useful lives such as goodwill and brand acquired on acquisition of SABIC (Note 4) are reviewed for impairment on an annual basis. If an indication exists, or when annual impairment testing for an asset is required, the asset’s recoverable amount is estimated. An impairment loss is recognized for the amount by which the asset’s carrying amount exceeds its recoverable amount.\nThe recoverable amount is the higher of an asset’s fair value less costs of disposal or value in use (“VIU”). The fair value less costs of disposal calculation is based on either, post-tax discounted cash flow models or available data from binding arm’s length sales transactions for similar assets, or observable market prices less incremental costs for disposing of the asset. The VIU calculation is based on a post-tax risk adjusted discounted cash flow model. The use of post-tax discount rates in determining value in use does not result in a materially different determination of the need for, or the amount of, impairment that would be required if pre-tax discount rates had been used.\nImpairment losses are recognized as a component of net income. If, in a subsequent period, the amount of a non-goodwill impairment loss decreases, a reversal of the previously recognized impairment loss is recognized in net income.\nSignificant accounting judgments and estimates Impairment tests are undertaken on the basis of the smallest identifiable group of assets (cash-generating unit), or individual assets, for which there are largely independent cash inflows. The key assumptions used to determine the different cash-generating units involves significant judgment from management.\nFor the purposes of determining whether impairment of oil, refining and petrochemical, gas and NGL, general service plant or construction-in-progress assets has occurred, and the extent of any impairment or its reversal, the key assumptions management uses in estimating future cash flows for its VIU calculations are forecasted future oil and gas and chemical prices, expected production volumes, future operating and development costs, refining and petrochemical margins and changes to the discount rate used for the discounted cash flow model. There is an inherent uncertainty over forecasted information and assumptions. Changes in these assumptions and forecasts could impact the recoverable amounts of assets and any calculated impairment and reversals thereof.\n\n,13 rebmeceD dedne\n\nstnemetats laicnanfi detadilosno C\n\n2. Summary of significant accounting policies, judgments and estimates continued (j) Leases Saudi Aramco’s portfolio of leased assets mainly comprises land and buildings, drilling rigs, marine vessels, industrial facilities, equipment, storage and tanks, aircraft and vehicles. The determination of whether the contract is, or contains, a lease is based on the substance of the contract at the inception of the lease. A contract is, or contains, a lease if the contract conveys the right to control the use of an identified asset for a period of time in exchange for consideration.\nSaudi Aramco recognizes right-of-use assets and lease liabilities at the lease commencement date. Right-of-use assets are initially measured at cost, which comprises lease liabilities at initial measurement, any initial direct costs incurred, any lease payments made at or before the commencement date, and restoration costs less any lease incentives received', ""recognized for the amount by which the asset’s carrying amount exceeds its recoverable amount. The recoverable amount is the higher of an asset’s fair value less costs of disposal or value in use (“VIU”). The fair value less costs of disposal calculation is based on either, post-tax discounted cash flow models or available data from binding arm’s length sales transactions for similar assets, or observable market prices less incremental costs of disposing of the asset. The VIU calculation is based on a post-tax risk adjusted discounted cash flow model. The use of post-tax discount rates in determining VIU does not result in a materially different determination of the need for, or the amount of, impairment that would be required if pre-tax discount rates had been used.\nImpairment losses are recognized as a component of net income and are presented within depreciation and amortization in the consolidated statement of income. If, in a subsequent period, the amount of a non-goodwill impairment loss decreases, a reversal of the previously recognized impairment loss is recognized in net income.\nSignificant accounting judgments and estimates Impairment tests are undertaken on the basis of the smallest identifiable group of assets (cash-generating unit), or individual assets, for which there are largely independent cash inflows. The key assumptions used to determine the different cash-generating units involves significant judgment by management.\nFor the purposes of determining whether impairment of non-financial assets has occurred, and the extent of any impairment or its reversal, the key assumptions management uses in estimating future cash flows for its VIU calculations are forecasted future oil, gas, refined product and chemical prices, expected production volumes, future operating and development costs, refining and petrochemical margins and changes to the discount rate used for the discounted cash flow model. There is an inherent uncertainty over forecasted information and assumptions. Changes in these assumptions and forecasts could impact the recoverable amounts of assets and any calculated impairment and reversals thereof.\n(i) Leases Saudi Aramco’s portfolio of leased assets mainly comprises land and buildings, drilling rigs, marine vessels, industrial facilities, equipment, storage and tanks, aircraft and vehicles. The determination of whether the contract is, or contains, a lease is based on the substance of the contract at the inception of the lease. A contract is, or contains, a lease if the contract conveys the right to control the use of an identified asset for a period of time in exchange for consideration.\nSaudi Aramco recognizes right-of-use assets and lease liabilities at the lease commencement date. Right-of-use assets are initially measured at cost, which comprises lease liabilities at initial measurement, any initial direct costs incurred, any lease payments made at or before the commencement date, and restoration costs less any lease incentives received. Subsequent to initial recognition the right-of-use assets are measured at cost less accumulated depreciation and accumulated impairment losses, if any, and adjusted for any remeasurement of the lease liability. Right-of-use assets are depreciated over the shorter of the asset's useful life and the lease term on a straight-line basis unless the lease transfers ownership of the underlying asset by the end of the lease term or if the cost of the asset reflects the exercise of the purchase option, in which case right-of-use assets are depreciated over the useful life of the underlying asset. Depreciation expense is recorded in the consolidated statement of income. Right-of-use assets are included under property, plant and equipment (Note 5).\n\n5 . O RGANIZATIONAL 6. A DDITIONAL STRUCTURE AND FINANCIAL 7. CONSOLIDATED\n\nAND STRATEGY PERFORMANCE 3. SUSTAINABILITY 4. RISK GOVERNANCE INFORMATION STATEMENTS All amounts in millions of Saudi Riyals unless otherwise stated 2. Material accounting policy information and significant judgments and estimates continued (i) Leases continued Lease liabilities are initially measured at the present value of lease payments. Lease payments include fixed lease payments, variable lease payments that depend on an index or rate, amounts payable for guaranteed residual values and payments to be made under extension or purchase or termination options, where applicable. The lease payments are discounted using the interest rate implicit in the lease. If that rate cannot be readily determined, which is generally the case, the lessee’s incremental borrowing rate is used, being the rate that the individual lessee would have to pay to borrow the funds necessary to obtain an asset of similar value to the right-of-use asset in a similar economic environment with similar terms, security and conditions. Subsequent to initial recognition, the lease liabilities are measured by increasing the carrying amount to reflect interest on the lease liability, reducing the carrying amount to reflect the lease payments made and adjusted for remeasurement to reflect any reassessments or lease modifications. Lease liabilities are included under borrowings (Note 20). Lease payments are allocated between the principal and finance costs. Finance costs are recorded as an expense in the consolidated statement of income over the lease period so as to produce a constant periodic rate of interest on the remaining balance of the liability.\nSaudi Aramco has elected not to recognize right-of-use assets""]","Saudi Aramco's lease accounting policy states that right-of-use assets are recognized at the lease commencement date and are initially measured at cost. This cost includes lease liabilities at initial measurement, any initial direct costs incurred, any lease payments made at or before the commencement date, and restoration costs less any lease incentives received. After initial recognition, right-of-use assets are measured at cost less accumulated depreciation and accumulated impairment losses, if any, and adjusted for any remeasurement of the lease liability. Right-of-use assets are depreciated over the shorter of the asset's useful life and the lease term on a straight-line basis, unless the lease transfers ownership of the underlying asset by the end of the lease term or if the cost of the asset reflects the exercise of the purchase option, in which case they are depreciated over the useful life of the underlying asset. Depreciation expense is recorded in the consolidated statement of income, and right-of-use assets are included under property, plant, and equipment.","Right-of-use assets are recognized at lease commencement and initially measured at cost. They are later depreciated over the shorter of the asset's useful life and the lease term, unless ownership transfers or a purchase option is effectively certain.",1.0,0.9952800856352194,0.99999999998,1.0
What was Saudi Aramco's target for sales gas production capacity by 2030?,"['co’s East-West\n6.2 mmbpd (2018: 6.4 mmbpd) were sold to\npipeline is critical in linking oil production third-party customers. Also, Saudi Aramco’s facilities in the Eastern Province with Yanbu’ downstream business is the single largest on the west coast, and providing flexibility customer of Upstream’s crude oil, consuming to export from the east and west coasts of approximately 38% of its crude oil production the Kingdom.\nin both 2019 and 2018.\nReservoir modeling\n\nMSC Performance and achievements • The Dammam project with a total Saudi Aramco continued to support the production capacity of 75 mbpd is 1 2.0\nKingdom’s role as a reliable supplier of expected to commence operations in energy. Accordingly, spare capacity was two phases. The preparation for phase mmbpd maintained to respond to changes in global one has commenced and is planned to crude oil supply and demand and to be completed in 2022 with an expected supplement operational and supply reliability. capacity of 25 mbpd, while the remaining spare capacity was maintained to help capacity is planned to commence stabilize the market when needed The swift and effective restoration of the operations in 2026.\nAbqaiq and Khurais capacity after the attacks\nin September 2019 enabled Upstream to On September 14, 2019, Saudi Aramco’s\nmaintain the MSC at 12.0 mmbpd during 2019. Abqaiq and Khurais facilities were attacked,\nwhich resulted in explosions, fires and Maintaining MSC requires crude increments, significant damage to equipment at each development and maintain potential drilling facility. As a result of these attacks, as well as support programs such as well Saudi Aramco’s crude oil production was intervention and reservoir pressure maintenance. temporarily reduced by approximately 54%.\nSignificant work has been undertaken to Saudi Aramco took a number of actions progress key increment projects. Highlights to minimize the impact on its customers, of the status of these projects are listed below: including tapping into its crude oil inventories located outside the Kingdom, swapping\n• The Harmaliyah increment was completed grades of deliveries and curtailing NGL and commenced operations in January deliveries to some customers and increasing\n2019, adding 25 mbpd to reach a total\nproduction from other fields. As at of 100 mbpd capacity;\nSeptember 25, 2019, Saudi Aramco’s\n• The ‘Ain Dar and Fazran increments are production had recovered to the same progressing in the construction activities. level as that prior to the attacks. The related Both increments are expected to restoration and construction work is currently commence operations in 2020 with a total on-going and the estimated cost of repairs production capacity of 175 mbpd; of those facilities is not expected to have a material impact on the Company’s financial\n• The engineering design phase and the position or results of operations.\nprocurement work have commenced for both the Marjan and Berri field increment programs. These projects are expected\nto contribute 300 mbpd and 250 mbpd\nof crude oil, respectively, and are expected to commence operations in 2023; and Khurais plant ecnamrofrep\n\nWasit Gas Plant Gas and NGLs Pursuant to the Concession, Saudi Aramco is the exclusive supplier of natural gas in the Overview Kingdom. Saudi Aramco sells natural gas to Saudi Aramco’s non-associated gas fields power generation plants primarily pursuant vary widely in reservoir properties, depths, to long-term contracts and to customers in pressures and compositions. In general, the the Kingdom’s industrial sector. The supply southern area around the Ghawar field has of natural gas to domestic customers is rich gas at moderate depths and permeability, regulated by the GSPR and the prices paid while the northern offshore fields (Karan, by domestic customers are set by resolutions Arabiyah and Hasbah) have leaner gas in issued from time to time by the Council deeper reservoirs with high permeability.\nof Ministers. Saudi Aramco also exports Additionally, Saudi Aramco’s crude oil a portion of its NGLs production.\nproduction provides a base load of associated gas, which is rich in liquids.\nIn-line with its strategy, Saudi Aramco seeks over time to develop an integrated global Saudi Aramco’s primary natural gas gas portfolio and is pursuing investment processing and fractionation facilities are and joint venture opportunities outside the located in three geographical regions: Jubail, Kingdom in natural gas and LNG projects.\nGhawar and the Kingdom’s western area.\nThe facilities are strategically located near its In 2019, Saudi Aramco produced fields to reduce transportation and pipeline approximately 9.0 bscfd of natural gas\ncompression costs, as well as the time\n(2018: 8.9 bscfd), 1.0 bscfd of ethane\nrequired to deliver gas products to', 'lers see page 27 | | Saudi Aramco | Annual Report 2025 23\n\nm pree | minence |\n\neam in | tegration |\n\nd grow | th businesses |\n\neliver v to deliver fitability inforcing i eam and d ilience operation rectors to a view to ncludes p gh crude g investm wth in its tradi businesses tainabil core elem\n\nStrategy continued Three strategic themes Upstream preeminence Oil The Company is also looking to preserve its Gas Aramco intends to maintain its position as position as one of the world’s lowest Aramco plans to further expand its gas the world’s largest crude oil company by average upstream carbon intensive crude oil business to meet the expected substantial production volume. Its reserves, operational producers. Aramco’s lower per barrel gas growth in domestic demand for gas, driven capabilities, and spare capacity allow it to flaring rates, low depletion rate operational by continued economic and industrial increase production in response to demand. model, and a focus on reducing the quantity development and the Government’s plans to of produced water contribute to its lower substitute liquids burning with gas in the Aramco believes that substantial investments average upstream carbon intensity utility sector. Accordingly, as sole supplier of in the oil industry continue to be required in production. gas to the Kingdom, Aramco aims to increase the near- to medium-term to meet future its gas production by approximately 80% by global demand. The Company intends to The Government determines the level of\n2030 from 2021 production levels, subject to\ncontinue to invest in crude oil exploration MSC maintained by the Company and the domestic demand and inclusive of pre-FID and production through oil price cycles in Kingdom’s maximum level of crude oil projects not yet announced. To satisfy these order to meet this expected continued production in the exercise of its sovereign production targets, Aramco intends to further global demand, and believes that its low prerogative in accordance with the increase the capacity of the MGS and expand lifting costs, low capital intensity and low Hydrocarbons Law. MSC is currently set at its natural gas reserves through new field upstream carbon intensity uniquely position 12.0 million barrels of crude oil per day. The discoveries, new reservoir additions in it to benefit from these investments. Aramco spare capacity afforded by maintaining an existing fields, and the delineation and produces one of the least carbon intensive MSC provides operational flexibility to reassessment of existing reservoirs and fields.\nsources of crude oil, which competitively increase its production. The spare capacity positions it to benefit from continued afforded by maintaining MSC enables the Expanding the gas business enables Aramco pressure on the oil and gas industry to Company to increase its crude oil production to meet the energy needs of the Kingdom reduce the environmental impact of the above planned levels rapidly in response to and continue to replace liquids with gas for industry’s operations. changes in global crude oil supply and the Kingdom’s power generation, thereby demand. The Company also uses this spare lowering the carbon intensity of domestic The Company maintains its level of crude oil capacity as an alternative supply option in energy production and availing more liquids production by balancing production case of unplanned production outages at for export. Gas production also yields NGL between maturing areas and newer any field and to maintain its production and condensate, which supplement the production sources, tapping into new levels during routine field maintenance. Company’s crude oil production and provide reservoirs when required to optimize the feedstock to its refining and petrochemical depletion rate of its fields. It also maintains operations. In addition, liquids produced with its low-cost position due to its low depletion associated and nonassociated gas can be rate operational model, the unique nature utilized in Aramco’s liquids-to-chemicals of the Kingdom’s geological formations, business. In addition to domestic gas, Aramco favorable onshore and shallow water is also opportunistically assessing LNG offshore environments in which its reservoirs investments internationally.\nare located, synergies from its use of its large infrastructure and logistics networks, and its scaled application of technology. Strategy in action\n\nAramco plans to increase its sales gas production Aramco seeks to maintain its position as one capacity by approximately 80% by 2030 compared of the world’s most reliable crude oil to 2021 production levels.\nsuppliers. The Company utilizes term agreements for selling crude oil to major consumers globally, providing supply approximately predictability to customers by standardizing price and delivery terms to major regional 80 % increase demand centers. Aramco continues to invest in its sophisticated and extensive crude oil distribution and dispatch system to maintain its supply reliability.\n\nOil The Company is also looking to preserve its Gas Aramco intends to maintain its position as position as one of the world’s lowest Aramco plans to further expand its gas the world’s largest crude oil company by average upstream carbon intensive crude oil business to meet the expected substantial production volume. Its reserves, operational producers. Aramco’s lower per barrel gas growth in domestic demand for gas, driven capabilities', 'largest liquids-rich shale\n\nnatural gas in the Kingdom and its gas gas play in the Middle East. 17,000km portfolio is rich in liquids, demonstrated by the production of both NGL and unblended condensate. \uf098 Gas field Bahrain Expected high-value liquids \uf098 Oil field and condensates by 2030 Aramco’s nonassociated gas fields vary widely in reservoir properties, depths, pressures, and w ar Qatar 630 mbpd\ncompositions. In general, the southern area Saudi Arabia h a Jafurah around the Ghawar field has rich gas at G moderate depths and permeability, while the Expected sales gas production by 2030 northern offshore fields (Karan, Arabiyah, and Hasbah) have leaner gas in deeper reservoirs with high permeability. In support of its plan to develop its unconventional resources, the Company is developing the Jafurah field, which began production in\n2025 and will gradually increase gas\ndeliveries through 2030, while adding incremental high-value liquid and condensate Highlights and developments production. Additionally, Aramco’s crude oil production provides a base load of associated Jafurah Gas Plant Jafurah Midstream Gas Company gas, which is rich in liquids. Aramco’s primary Phase one of the Jafurah Gas Plant, part The Company closed a transaction to natural gas processing and fractionation of the Jafurah unconventional gas field lease and lease back the development facilities are located in Ghawar and the development, was completed and began and usage rights to the Jafurah Field Gas northern and western areas of the Kingdom. production in December. Jafurah is the Plant and the Riyas NGL Fractionation The Company’s facilities are strategically largest nonassociated gas field in the Plant to its subsidiary, JMGC, for a period located near its fields to reduce transportation Kingdom and the largest liquids-rich of 20 years. As part of the transaction,\nand pipeline compression costs, as well as the shale gas play in the Middle East. Spread Aramco sold a 49% equity interest in the time required to deliver gas products to over 17,000 km2, it is estimated to contain subsidiary to a consortium of\nmarket. 229 tscf of raw gas and 75 bstb of international investors led by funds\ncondensate. Production is expected to managed by Global Infrastructure In 2025, Aramco’s average gas production progressively ramp up to 2 bscfd of sales Partners, a part of BlackRock, for\nwas approximately 11.4 bscfd (2024: 10.8\ngas, 420 mmscfd of ethane, and 630 upfront sale proceeds of ﷼ 41.8 billion\nbscfd) of natural gas and ethane. As at\nmbpd of high-value liquids and ($11.1 billion) in cash. During the 20-year\nDecember 31, 2025, the total conventional\ncondensates by 2030. lease period, the subsidiary will receive and unconventional raw gas processing quarterly volume-based tariff payments\ncapacity was 19.6 bscfd (2024: 19.1 bscfd), Fadhili Gas Plant\nfrom Aramco, backed by minimum which primarily feeds into the MGS, an The Fadhili Gas Plant expansion volume commitments. Aramco will at all extensive network of pipelines that connects completed engineering and progressed times retain title and full operational the Company’s key gas production and construction activities. The plant is control of the facilities, and the processing sites with demand centers expected to provide additional raw gas transaction will not impose any throughout the Kingdom and is currently processing capacity of 1.5 bscfd restrictions on its production volumes.\nundergoing expansion. Aramco has increased (approximately 1.15 bscfd of sales gas its sales gas production capacity target to production capacity) by 2027. Tanajib Gas Plant\napproximately 80% by 2030 from 2021 The Tanajib Gas Plant, part of the Marjan production levels, subject to domestic development program, commenced demand and inclusive of pre-FID projects 1.5 bscfd operations in December. It is expected to\nnot yet announced. Fadhili Gas Plant expected raw gas provide 2.6 bscfd of raw gas processing processing capacity capacity (approximately 0.65 bscfd of\nThe Company sells natural gas to power sales gas production capacity) from the generation plants primarily pursuant to LNG offtake agreement Marjan and Zuluf fields.\nlong-term contracts and to customers in the Aramco signed a 20-year SPA with Kingdom’s industrial sector. The supply of NextDecade for offtake of 1.2 mmtpa of\nnatural gas to domestic customers is 2.6 bscfd LNG from liquefaction Train 4 of its Rio regulated by the Energy Supply', 'consistent with the Company’s strategy to further unplanned production outages and to maintain its right to explore, develop, and produce the Kingdom’s expand its gas business, Aramco will aim to increase production levels.\nhydrocarbon resources, except in the Excluded Areas, gas production by more than 60% by 2030 compared for an initial period of 40 years, which will be extended Aramco maintained its position as one of the world’s to 2021 production levels, subject to domestic demand.\nby the Government for 20 years provided Aramco largest producers of crude oil and condensate with an With this anticipated increase in gas production, satisfies certain conditions commensurate with current average total daily hydrocarbon production of 12.8 Aramco expects an increase of up to one mmbpd in\noperating practices. For more information, see Section mmboed (2022: 13.6 mmboed). For the year ended high value associated liquids production, and\n6: Additional financial and legal information – The December 31, 2023, approximately 84% (2022: 85%) of approximately one mmbpd additional liquids released\nConcession. the aggregate hydrocarbon production consisted of from the substitution of liquids burning with gas in the liquids, which generally command a higher margin. utility sector.\nAs at December 31, 2023, Aramco’s reserves under the\nConcession agreement were 251.2 billion boe (2022: Average upstream lifting costs in 2023 were SAR 11.96 Aramco announced its first international investment in\nUpstream successfully commissioned long-term projects, 258.8 billion boe), including 191.3 billion barrels of ($3.19) per boe produced (2022: SAR 11.44 ($3.05)), LNG by signing definitive agreements to acquire a\ncrude oil and condensate (2022: 200.8 billion barrels), while upstream capital expenditures averaged SAR strategic minority stake in MidOcean Energy. This\nprogressed multiple growth projects including the 26.0 billion barrels of NGL (2022: 25.2 billion barrels), 23.7 ($6.3) per boe produced (2022: SAR 20.3 ($5.4)). investment provides the ability to capitalize on\nMiddle East’s largest shale gas development, made multiple and 207.5 tscf of natural gas (2022: 201.9 tscf). This competitive advantage is a result of the Company’s demand-led growth for LNG.\ndiscoveries, and initiated our first global liquefied natural gas robust fiscal discipline, its low depletion rate The Government sets the Kingdom’s maximum level of investment, while delivering safe and reliable operations. crude oil production in the exercise of its sovereign operational model, the unique nature of the Kingdom’s geological formations, favorable onshore and shallow Nasir K. Al-Naimi prerogative and requires Aramco to maintain MSC in Upstream President Key events in 2023 Outlook for 2024\n\n12.0 mmbpd 800 mmscfd 9 plants Aramco’s Upstream segment\nwill continue its investments MSC maintained Hawiyah Gas Plant expansion Gas compression projects onstream in future growth projects Progressed engineering, procurement, and The Hawiyah Gas Plant expansion was successfully Nine plants placed onstream completing including crude increments to construction activities to support the Government commissioned and brought onstream, increasing the the gas compression projects at the maintain MSC at 12.0 mmbpd,\nmandated MSC of 12.0 mmbpd ensuring spare plant’s raw gas processing capacity by 800 mmscfd Haradh and Hawiyah fields. as well as growing gas\ncapacity and operational flexibility to maintain including approximately 750 mmscfd of natural gas production consistent with production levels. capacity. the goal of a greater than 60% increase over 2021\nproduction levels by 2030,\n$0.5 Gas discoveries subject to domestic demand.\nUnconventional gas bn Exploration activities resulted in development the discovery of two natural gas Jafurah Progressed with the International LNG investment fields in the Empty Quarter.\ndevelopment of the Announced first international investment in LNG Jafurah unconventional by signing definitive agreements to acquire a gas field, which is strategic minority stake in MidOcean Energy for\nexpected to commence SAR 1.88 billion ($0.5 billion).\nproduction in 2025.\nFirst unconventional gas production First unconventional tight gas produced from 1.5 the South Ghawar operational area two bscfd months ahead of schedule, marking a milestone in the gas expansion strategy.\nHawiyah Unayzah Gas Reservoir Storage Hawiyah Unayzah Gas Reservoir Storage, the first underground natural gas storage in the Kingdom, achieved its maximum injection target of 1.5 bscfd.\nKey events in 2023\n12.0 800\nm', '2019, accounting for almost 36%\n$ per the IEA. Thus markets were roughly in of the overall primary energy mix and around\n/bbl\nbalance in 2019. 55% of the power generation and desalination\nsectors’ fuel mix.\nBrent crude oil price averaged $64/bbl Brent crude oil price averaged $64/bbl in\nin 2019, approximately 11% lower than 2019, approximately 11% lower than the\nthe average of $72/bbl in 2018 average of $72/bbl in 2018.\n\nweivrevo ssenisub\n\nSaudi Aramco’s vision is to be the world’s preeminent integrated energy Maintain its position as the world’s leading crude oil and chemicals company, operating in producer by production volume and the lowest a safe, sustainable and reliable manner. cost producer, while providing reliable, low carbon Saudi Aramco strives to provide its intensity crude oil supply to customers shareholders with resilient value creation through crude oil price cycles by maintaining its preeminence in oil and gas production, capturing additional value across the hydrocarbon value chain See page 30 for more detail.\nand profitably growing its portfolio.\nSaudi Aramco’s strategy aims to reinforce 2 3 its competitive positions across its upstream and downstream operations. Capture value from Expand gas activities further strategic in the Kingdom and integration and internationally diversification of its operations\nSee page 31 for more detail. See page 31 for more detail.\nExpand global Efficiently allocate recognition of Saudi capital and maintain Aramco’s brands a prudent and flexible balance sheet\nSee page 32 for more detail. See page 32 for more detail.\nOperate sustainably Deliver sustainable by leveraging and growing dividends technology and through crude oil innovation price cycles\nSee page 33 for more detail. See page 33 for more detail.\n\nStrategy Maintain its position as the world’s leading crude oil producer by production volume and the lowest cost producer, while providing reliable, low carbon intensity crude oil supply to customers Saudi Aramco intends to maintain its position The spare capacity afforded by maintaining as the world’s leading crude oil producer by MSC provides operational flexibility to production volume. Its reserves, operational respond rapidly to changes in global crude oil capabilities and spare capacity allow it to supply and demand. Though Saudi Aramco increase production in response to demand. has a robust field maintenance philosophy Saudi Aramco maintains its desired level of that emphasizes the reliability of its upstream crude oil production by balancing production operations, MSC also provides an alternative between maturing areas and newer supply option in the event of unplanned Saudi Aramco’s vision production sources, tapping into new production outages at any field.\nreservoirs when required to optimize the is to be the world’s depletion rate of its fields. Saudi Aramco also Moreover, Saudi Aramco utilizes term preeminent integrated maintains its low cost position due to the agreements for selling crude oil to major unique nature of the Kingdom’s geological consumers globally. These agreements energy and chemicals formations, favorable onshore and shallow provide supply predictability to customers water offshore environments in which Saudi by standardizing price and delivery terms company, operating Aramco’s reservoirs are located, synergies to major regional demand centers. Saudi available from Saudi Aramco’s use of its large Aramco continues to invest in and develop in a safe, sustainable infrastructure and logistics networks, low a sophisticated and extensive crude oil depletion rate operational model and scaled distribution and dispatch system, which and reliable manner application of technology. maintains Saudi Aramco’s supply reliability.\nIn addition, Saudi Aramco seeks to maintain Moreover, Saudi Aramco seeks to preserve its position as one of the world’s most the low carbon intensity of its crude oil reliable crude oil suppliers. The Saudi Arabian production, which places it among the Government determines the Kingdom’s world’s least carbon intense sources of maximum level of crude oil production in crude oil.\nthe exercise of its sovereign prerogative and requires Saudi Aramco to maintain MSC in accordance with the Hydrocarbons Law.\n\nweivrevo ssenisub\n\nCapture value from further Expand gas activities in the strategic integration and Kingdom and internationally diversification of its operations Saudi Aramco intends to continue the Saudi Aramco plans to expand its gas strategic integration of its upstream and business to meet large and growing downstream businesses to facilitate the domestic demand for low-cost clean energy placement of its crude oil in larger offtake by increasing production and investing volumes through a dedicated system of in additional infrastructure. This demand domestic and international wholly owned is driven by power generation, water and affiliated refineries. This integration also desalination, petrochemical production and allows Saudi Aramco to capture additional other industrial consumption in the Kingdom.\nvalue across the hydrocarbon chain, expand Saudi Aramco’s gas production also yields its sources of earnings and provide resilience NGLs (including ethane) and condensate, to oil price volatility. For example, the which supplement its crude oil production proposed acquisition of a']",Saudi Aramco's target for sales gas production capacity by 2030 is to increase it by approximately 80% compared to 2021 production levels.,Aramco plans to increase its sales gas production capacity by more than 60% by 2030 compared with 2021 levels. The plan also includes expanding unconventional gas resources and related infrastructure.,1.0,0.9903086286634033,0.6388888888675925,1.0
What was the recoverable amount approach used for the SABIC goodwill impairment test?,"['an indefinite useful life)\nrecognised as part of the SABIC acquisition. The carrying amounts of these assets were SAR 99.1 billion and SAR 18.1 billion, respectively, at\nDecember 31, 2022.\nGoodwill has been allocated to the Downstream operating segment. Therefore, the goodwill impairment test was performed at the Downstream operating segment level. The brand test was performed based on an aggregation of the relevant cash-generating units.\nThe recoverable amounts were determined based on value-in-use calculations derived using discounted cash flow models. The models were based on the most recent financial plans and included 10-year projection periods with terminal values assumed thereafter.\nThe exercise performed by management supported the goodwill and brand carrying values and did not identify the need for any impairment charges to be recognised.\nWe considered this to be a key audit matter given the significant judgment and estimates involved in determining recoverable amounts and the uncertainty inherent in the underlying forecasts and assumptions. The key inputs and assumptions in determining the recoverable amounts included the:\n● Cash flows during the 10-year periods including commodity prices and margins;\n● Terminal values; and ● Pre-tax discount rates.\nRefer to Note 2(f), Note 2(i) and Note 6 to the consolidated financial statements for further information. | | | | |\n\n| | | | Our procedures included the following: | | | | | ● We evaluated the appropriateness of management’s | | | | | allocation of goodwill to the Downstream operating | | | | | segment and brand to the aggregation of the | | | | | relevant cash-generating units, based on the | | | | | requirements of IAS 36 ‘Impairment of Assets’, that | | | | | is endorsed in the Kingdom of Saudi Arabia. | | | | | ● We assessed the completeness of the carrying values | | | | | of the assets and liabilities considered as part of the | | | | | impairment tests for the goodwill and brand in light | | | | | of the requirements of IAS 36 ‘Impairment of |\n| | | | Assets’, that is endorsed in the Kingdom of Saudi | | | | | Arabia. | | | | | ● With input from internal valuation experts, where | | | | | considered necessary, we performed the following | | | | | procedures on management’s value-in-use | | | | | calculations, as deemed appropriate: | | | | | - Considered the consistency of certain | | | | | unobservable inputs underlying the 10-year cash | | | | | flows such as expected product volumes and | | | | | future costs with approved financial plans; | | | | | - Compared a sample of forecast commodity prices | | | | | and margins underlying the 10-year cash flows to |\n| | | | market data points; | | | | | - Evaluated the reasonableness of approved | | | | | financial plans by comparison to historical results; | | | | | - Assessed the reasonableness of the approach and | | | | | inputs used to determine the terminal values by | | | | | benchmarking to observable market practice and | | | | | information; | | | | | - Evaluated the reasonableness of the pre-tax | | | | | discount rates used by cross-checking the | | | | | underlying assumptions against observable | | | | | market data; | | | | | - Tested the mathematical accuracy and logical | | | | | integrity of the models; and | | | | | - Tested management’s sensitivity analyses that | | | | | considered the impact of changes in assumptions | | | | | on the outcome of the impairment assessments. | | | | | ● We considered the reasonableness of the movement | | | | | in the recoverable amounts at December 31, 2022 | | | | | compared to the prior year in light of changes in the | | | | | underlying inputs and assumptions. | | | | | ● We considered the appropriateness of the related | | | | | accounting policies and disclosures in the | | | | | consolidated financial statements. |\n\nAssessment of recoverability of the goodwill | | and brand recognised as part of the SABIC | | acquisition | |\n\nInternational Accounting Standard (“IAS”) 36 | | ‘Impairment of Assets’, that is endorsed in the | | Kingdom of Saudi Arabia, requires goodwill and | | intangible assets that have indefinite useful lives to | | be tested annually for impairment, irrespective of | | whether there is any indication of impairment. | | Management performed an assessment of | | recoverability of the goodwill and brand | | (determined to have an indefinite useful life) | | recognised as part of the SABIC acquisition. The | | carrying amounts of these assets were SAR 99.1 | |\nbillion and SAR 18.1 billion, respectively, at | |\nDecember 31, 2022.', 'test was performed at the Downstream other audit firms operating under our instructions. Where the work was performed by component auditors, calculations, as deemed appropriate:\noperating segment level. The brand test was we determined the level of involvement we needed to have in the audit work at those components to be able performed based on an aggregation of the relevant - Considered the consistency of certain to conclude whether sufficient appropriate audit evidence had been obtained as a basis for our opinion on cash-generating units. unobservable inputs underlying the 10-year cash the Group’s consolidated financial statements as a whole.\nflows such as expected product volumes and The recoverable amounts were determined based on future costs with approved financial plans;\nThe most significant component within the Group is the Company itself and most of the audit effort was spent value-in-use calculations derived using discounted - Compared a sample of forecast commodity prices by the Group engagement team based in Dhahran, Kingdom of Saudi Arabia. We identified five additional cash flow models. The models were based on the and margins underlying the 10-year cash flows to components where a full-scope audit on the respective components’ financial information was performed most recent financial plans and included 10-year market data points;\nunder our instructions. Members of the Group engagement team performed the full-scope audit of the projection periods with terminal values assumed - Evaluated the reasonableness of approved financial plans by comparison to historical results;\ncomponent located in Dhahran, Kingdom of Saudi Arabia. Component teams in Riyadh, Kingdom of Saudi thereafter.\n- Assessed the reasonableness of the approach and Arabia, the United States of America, the Republic of Korea and Malaysia performed full-scope audits of the The exercise performed by management supported inputs used to determine the terminal values by components at those locations based on our instructions. We also instructed certain other component teams the goodwill and brand carrying values and did not benchmarking to observable market practice and to perform an audit or specified procedures on material consolidated financial statement line items as part identify the need for any impairment charges to be information;\nof our overall Group audit scoping strategy. The selection of these components was based on qualitative and recognised. - Evaluated the reasonableness of the pre-tax discount rates used by cross-checking the quantitative considerations, including whether the component accounted for a significant proportion of We considered this to be a key audit matter given the underlying assumptions against observable individual consolidated financial statement line items. significant judgment and estimates involved in market data;\ndetermining recoverable amounts and the\n- Tested the mathematical accuracy and logical The Group engagement team’s involvement in the audit work performed by component teams considered the uncertainty inherent in the underlying forecasts and integrity of the models; and relative significance and complexity of the individual component. This included allocating materiality to the assumptions. The key inputs and assumptions in - Tested management’s sensitivity analyses that different components, sending formal instructions, obtaining regular updates on progress and results of determining the recoverable amounts included the: considered the impact of changes in assumptions on the outcome of the impairment assessments. procedures as well as reviewing deliverables and the relevant underlying working papers. ● Cash flows during the 10-year periods including commodity prices and margins; ● We considered the reasonableness of the movement Key audit matters ● Terminal values; and in the recoverable amounts at December 31, 2022 ● Pre-tax discount rates. compared to the prior year in light of changes in the Key audit matters are those matters that, in our professional judgment, were of most significance in our audit underlying inputs and assumptions.\nof the consolidated financial statements of the current period. These matters were addressed in the context Refer to Note 2(f), Note 2(i) and Note 6 to the ● We considered the appropriateness of the related of our audit of the consolidated financial statements as a whole, and in forming our opinion thereon, and we consolidated financial statements for further accounting policies and disclosures in the information.\ndo not provide a separate opinion on these matters. consolidated financial statements.\n\nIndependent auditor’s report continued Assessment of recoverability of the goodwill and brand recognised as part of the SABIC acquisition International Accounting Standard (“IAS”) 36 ‘Impairment of Assets’, that is endorsed in the Kingdom of Saudi Arabia, requires goodwill and intangible assets that have indefinite useful lives to be tested annually for impairment, irrespective of whether there is any indication of impairment.\nManagement performed an assessment of recoverability of the goodwill and brand (determined to have an indefinite useful life)\nrecognised as part of the SABIC acquisition. The carrying amounts of these assets were SAR 99.1 billion and SAR 18.1 billion, respectively, at\nDecember 31, 2022.\nGoodwill has been allocated to the Downstream operating segment. Therefore, the goodwill impairment test was performed at the Downstream operating segment level. The brand test was performed based on an aggregation of the relevant cash-generating units.\nThe recoverable amounts were determined based on value-in-use calculations derived using discounted cash flow models. The models were based on the most recent financial plans and included 10-year', '”) 36 ‘Impairment of Assets’, that is endorsed in the Kingdom of Saudi Arabia, requires goodwill and intangible assets that have indefinite useful lives to be tested annually for impairment, irrespective of whether there is any indication of impairment.\nManagement performed an assessment of recoverability of the goodwill and brand (determined to have an indefinite useful life)\nrecognised as part of the SABIC acquisition. The carrying amounts of these assets were SAR 99.1 billion and SAR 18.1 billion, respectively, at\nDecember 31, 2022.\nGoodwill has been allocated to the Downstream operating segment. Therefore, the goodwill impairment test was performed at the Downstream operating segment level. The brand test was performed based on an aggregation of the relevant cash-generating units.\nThe recoverable amounts were determined based on value-in-use calculations derived using discounted cash flow models. The models were based on the most recent financial plans and included 10-year projection periods with terminal values assumed thereafter.\nThe exercise performed by management supported the goodwill and brand carrying values and did not identify the need for any impairment charges to be recognised.\nWe considered this to be a key audit matter given the significant judgment and estimates involved in determining recoverable amounts and the uncertainty inherent in the underlying forecasts and assumptions. The key inputs and assumptions in determining the recoverable amounts included the:\n● Cash flows during the 10-year periods including commodity prices and margins;\n● Terminal values; and ● Pre-tax discount rates.\nRefer to Note 2(f), Note 2(i) and Note 6 to the consolidated financial statements for further information. | | | | |\n\n| | | | Our procedures included the following: | | | | | ● We evaluated the appropriateness of management’s | | | | | allocation of goodwill to the Downstream operating | | | | | segment and brand to the aggregation of the | | | | | relevant cash-generating units, based on the | | | | | requirements of IAS 36 ‘Impairment of Assets’, that | | | | | is endorsed in the Kingdom of Saudi Arabia. | | | | | ● We assessed the completeness of the carrying values | | | | | of the assets and liabilities considered as part of the | | | | | impairment tests for the goodwill and brand in light | | | | | of the requirements of IAS 36 ‘Impairment of |\n| | | | Assets’, that is endorsed in the Kingdom of Saudi | | | | | Arabia. | | | | | ● With input from internal valuation experts, where | | | | | considered necessary, we performed the following | | | | | procedures on management’s value-in-use | | | | | calculations, as deemed appropriate: | | | | | - Considered the consistency of certain | | | | | unobservable inputs underlying the 10-year cash | | | | | flows such as expected product volumes and | | | | | future costs with approved financial plans; | | | | | - Compared a sample of forecast commodity prices | | | | | and margins underlying the 10-year cash flows to |\n| | | | market data points; | | | | | - Evaluated the reasonableness of approved | | | | | financial plans by comparison to historical results; | | | | | - Assessed the reasonableness of the approach and | | | | | inputs used to determine the terminal values by | | | | | benchmarking to observable market practice and | | | | | information; | | | | | - Evaluated the reasonableness of the pre-tax | | | | | discount rates used by cross-checking the | | | | | underlying assumptions against observable | | | | | market data; | | | | | - Tested the mathematical accuracy and logical | | | | | integrity of the models; and | | | | | - Tested management’s sensitivity analyses that | | | | | considered the impact of changes in assumptions | | | | | on the outcome of the impairment assessments. | | | | | ● We considered the reasonableness of the movement | | | | | in the recoverable amounts at December 31, 2022 | | | | | compared to the prior year in light of changes in the | | | | | underlying inputs and assumptions. | | | | | ● We considered the appropriateness of the related | | | | | accounting policies and disclosures in the | | | | | consolidated financial statements. |\n\nAssessment of recoverability of the goodwill | | and brand recognised as part of the SABIC | | acquisition | |\n\nInternational Accounting Standard (“IAS”) 36 | | ‘Impairment of Assets’, that is endorsed in the | | Kingdom of Saudi Arabia, requires goodwill and | | intangible assets that have indefinite useful lives to | | be tested annually for impairment, irrespective of | | whether there is any indication of impairment. | | Management performed an assessment of | | recoverability of the goodwill', 'the Group audit, we determined the type of work that needed to be Goodwill has been allocated to the Downstream considered necessary, we performed the following performed by us, as the Group engagement team, or component auditors from other PwC network firms or operating segment. Therefore, the goodwill procedures on management’s value-in-use impairment test was performed at the Downstream other audit firms operating under our instructions. Where the work was performed by component auditors, calculations, as deemed appropriate:\noperating segment level. The brand test was we determined the level of involvement we needed to have in the audit work at those components to be able performed based on an aggregation of the relevant - Considered the consistency of certain to conclude whether sufficient appropriate audit evidence had been obtained as a basis for our opinion on cash-generating units. unobservable inputs underlying the 10-year cash the Group’s consolidated financial statements as a whole.\nflows such as expected product volumes and The recoverable amounts were determined based on future costs with approved financial plans;\nThe most significant component within the Group is the Company itself and most of the audit effort was spent value-in-use calculations derived using discounted - Compared a sample of forecast commodity prices by the Group engagement team based in Dhahran, Kingdom of Saudi Arabia. We identified five additional cash flow models. The models were based on the and margins underlying the 10-year cash flows to components where a full-scope audit on the respective components’ financial information was performed most recent financial plans and included 10-year market data points;\nunder our instructions. Members of the Group engagement team performed the full-scope audit of the projection periods with terminal values assumed - Evaluated the reasonableness of approved financial plans by comparison to historical results;\ncomponent located in Dhahran, Kingdom of Saudi Arabia. Component teams in Riyadh, Kingdom of Saudi thereafter.\n- Assessed the reasonableness of the approach and Arabia, the United States of America, the Republic of Korea and Malaysia performed full-scope audits of the The exercise performed by management supported inputs used to determine the terminal values by components at those locations based on our instructions. We also instructed certain other component teams the goodwill and brand carrying values and did not benchmarking to observable market practice and to perform an audit or specified procedures on material consolidated financial statement line items as part identify the need for any impairment charges to be information;\nof our overall Group audit scoping strategy. The selection of these components was based on qualitative and recognised. - Evaluated the reasonableness of the pre-tax discount rates used by cross-checking the quantitative considerations, including whether the component accounted for a significant proportion of We considered this to be a key audit matter given the underlying assumptions against observable individual consolidated financial statement line items. significant judgment and estimates involved in market data;\ndetermining recoverable amounts and the\n- Tested the mathematical accuracy and logical The Group engagement team’s involvement in the audit work performed by component teams considered the uncertainty inherent in the underlying forecasts and integrity of the models; and relative significance and complexity of the individual component. This included allocating materiality to the assumptions. The key inputs and assumptions in - Tested management’s sensitivity analyses that different components, sending formal instructions, obtaining regular updates on progress and results of determining the recoverable amounts included the: considered the impact of changes in assumptions on the outcome of the impairment assessments.\nprocedures as well as reviewing deliverables and the relevant underlying working papers. ● Cash flows during the 10-year periods including commodity prices and margins; ● We considered the reasonableness of the movement Key audit matters ● Terminal values; and in the recoverable amounts at December 31, 2022\n● Pre-tax discount rates. compared to the prior year in light of changes in the Key audit matters are those matters that, in our professional judgment, were of most significance in our audit underlying inputs and assumptions.\nof the consolidated financial statements of the current period. These matters were addressed in the context Refer to Note 2(f), Note 2(i) and Note 6 to the ● We considered the appropriateness of the related of our audit of the consolidated financial statements as a whole, and in forming our opinion thereon, and we consolidated financial statements for further accounting policies and disclosures in the information.\ndo not provide a separate opinion on these matters. consolidated financial statements.\n\nAssessment of recoverability of the goodwill and brand recognised as part of the SABIC acquisition International Accounting Standard (“IAS”) 36 ‘Impairment of Assets’, that is endorsed in the Kingdom of Saudi Arabia, requires goodwill and intangible assets that have indefinite useful lives to be tested annually for impairment, irrespective of whether there is any indication of impairment.\nManagement performed an assessment of recoverability of the goodwill and brand (determined to have an indefinite useful life)\nrecognised as part of the SABIC acquisition. The carrying amounts of these assets were SAR 99.1 billion and SAR 18.1 billion, respectively, at\nDecember 31, 2022.\nGoodwill has been allocated to the Downstream operating segment. Therefore,', 'of Assets’, that is endorsed in the | | Kingdom of Saudi Arabia, requires goodwill and | | intangible assets that have indefinite useful lives to | | be tested annually for impairment, irrespective of | | whether there is any indication of impairment. | | Management performed an assessment of | | recoverability of the goodwill and brand | | (determined to have an indefinite useful life) | | recognised as part of the SABIC acquisition. The | | carrying amounts of these assets were SAR 99.1 | |\nbillion and SAR 18.1 billion, respectively, at | |\nDecember 31, 2022. | |\n\nGoodwill has been allocated to the Downstream | | operating segment. Therefore, the goodwill | | impairment test was performed at the Downstream | | operating segment level. The brand test was | | performed based on an aggregation of the relevant | | cash-generating units. | |\n\nThe recoverable amounts were determined based on | | value-in-use calculations derived using discounted | | cash flow models. The models were based on the | | most recent financial plans and included 10-year | | projection periods with terminal values assumed | | thereafter. | | Rationale for the materiality benchmark applied Income before income taxes and zakat is an important benchmark for the Group’s stakeholders and is a generally accepted benchmark for profit- oriented groups.\nThe exercise performed by management supported the goodwill and brand carrying values and did not identify the need for any impairment charges to be recognised.\nWe considered this to be a key audit matter given the significant judgment and estimates involved in determining recoverable amounts and the uncertainty inherent in the underlying forecasts and assumptions. The key inputs and assumptions in determining the recoverable amounts included the:\n● Cash flows during the 10-year periods including | | | | | commodity prices and margins; | | | ● Terminal values; and | | | | ● Pre-tax discount rates. | | | |\n\nRefer to Note 2(f), Note 2(i) and Note 6 to the | | | | consolidated financial statements for further | | | | information. | | | |\n\nIndependent auditor’s report to the shareholders of Saudi Arabian Oil Company (continued)\nKey audit matter How our audit addressed the key audit matter Assessment of recoverability of the goodwill and brand recognised as part of the SABIC acquisition ‘Impairment of Assets’, that is endorsed in the ● We evaluated the appropriateness of management’s Kingdom of Saudi Arabia, requires goodwill and allocation of goodwill to the Downstream operating intangible assets that have indefinite useful lives to segment and brand to the aggregation of the be tested annually for impairment, irrespective of relevant cash-generating units, based on the whether there is any indication of impairment.\nrequirements of IAS 36 ‘Impairment of Assets’, that is endorsed in the Kingdom of Saudi Arabia.\nManagement performed an assessment of recoverability of the goodwill and brand ● We assessed the completeness of the carrying values (determined to have an indefinite useful life) of the assets and liabilities considered as part of the recognised as part of the SABIC acquisition. The impairment tests for the goodwill and brand in light\ncarrying amounts of these assets were SAR 99.1 of the requirements of IAS 36 ‘Impairment of\nbillion and SAR 18.1 billion, respectively, at Assets’, that is endorsed in the Kingdom of Saudi\nDecember 31, 2022. Arabia.\n● With input from internal valuation experts, where Goodwill has been allocated to the Downstream considered necessary, we performed the following operating segment. Therefore, the goodwill procedures on management’s value-in-use impairment test was performed at the Downstream calculations, as deemed appropriate:\noperating segment level. The brand test was performed based on an aggregation of the relevant - Considered the consistency of certain cash-generating units. unobservable inputs underlying the 10-year cash flows such as expected product volumes and The recoverable amounts were determined based on future costs with approved financial plans;\nvalue-in-use calculations derived using discounted - Compared a sample of forecast commodity prices cash flow models. The models were based on the and margins underlying the 10-year cash flows to most recent financial plans and included 10-year market data points;\nprojection periods with terminal values assumed - Evaluated the reasonableness of approved financial plans by comparison to historical results;\nthereafter.\n- Assessed the reasonableness of the approach and The exercise performed by management supported inputs used to determine the terminal values by the goodwill and brand carrying values and did not benchmarking to observable market practice and identify the need for any impairment charges to be information;\nrecognised. - Evaluated the reasonableness of the pre-tax discount rates used by cross-checking the We considered this to be a key audit matter given the underlying assumptions against observable significant judgment and estimates involved in market data;\ndetermining recoverable amounts and the\n- Tested the mathematical accuracy and logical uncertainty inherent in the underlying forecasts and integrity of the models; and assumptions. The key inputs and assumptions in - Tested management’s sensitivity']",The recoverable amounts for the SABIC goodwill impairment test were determined based on value-in-use calculations derived using discounted cash flow models. These models were based on the most recent financial plans and included 10-year projection periods with terminal values assumed thereafter.,"The recoverable amount was determined using value-in-use calculations based on discounted cash flow models. The models used 10-year financial plans and terminal values, and no impairment was identified.",1.0,0.9384174837556013,0.99999999998,1.0
How many proved reserves did Aramco estimate for the Kingdom's fields it operates at the end of 2023?,"['50 years (618) 104,425 2021-2070\nDeferred consideration 259,125 8 years (26,249) 235,867 2028\nLease liabilities – – (10,868) 53,575 Not defined\n614,303 (52,993) 536,077\n\nReserves information Reserves as at December 31, 2020\nAs at December 31, 2020, the Kingdom’s reserves in the fields Aramco operates consisted of 336.9 billion boe (2019: 336.7 billion boe),\nincluding 261.6 billion barrels (2019: 261.5 billion barrels) of crude oil and condensate, 36.0 billion barrels (2019: 36.0 billion barrels)\nof NGL and 238.8 tscf (2019: 237.4 tscf) of natural gas, including 150.2 tscf (2019: 146.8 tscf) of non-associated gas.\nUnder the Original Concession, which was in effect until December 24, 2017, Aramco’s rights with respect to hydrocarbons in the\nKingdom were not limited to a particular term. Accordingly, until such date, the Kingdom’s reserves in the fields Aramco operated\nwere the same as Aramco’s reserves. Effective December 24, 2017, the Concession limited Aramco’s exclusive right to explore,\ndevelop and produce the Kingdom’s hydrocarbon resources, except in the Excluded Areas, to an initial period of 40 years, which will be extended by the Government for 20 years provided Aramco satisfies certain conditions commensurate with current operating\npractices. In addition, the Concession may be extended for an additional 40 years beyond the prior 60-year period subject to Aramco\nand the Government agreeing on the terms of the extension (see Additional legal information — the Concession). The provision of a specified term in the Concession impacts the calculation of Aramco’s reserves as compared to the Kingdom’s reserves in the fields Aramco operates. The Concession also requires Aramco to meet domestic demand for certain hydrocarbons, petroleum products and LPGs through domestic production or imports.\nBased on the initial 40-year period and 20-year extension of the Concession, as at December 31, 2020, Aramco’s reserves were\n255.2 billion boe (2019: 258.6 billion boe). Aramco’s oil equivalent reserves consisted of 198.8 billion barrels (2019: 201.9 billion\nbarrels) of crude oil and condensate, 25.2 billion barrels (2019: 25.7 billion barrels) of NGL and 191.6 tscf (2019: 190.6 tscf) of\nnatural gas. As at December 31, 2020, Aramco’s portfolio included 517 (2019: 510) reservoirs within 137 (2019: 138) fields distributed\nthroughout the Kingdom and its territorial waters. Based on Aramco’s reserves data, as at December 31, 2020, Aramco’s oil equivalent\nreserves were sufficient for proved reserves life of 56 years.\nAramco manages the Kingdom’s unique reserves and resources base to optimize production and maximize long-term value pursuant to the Hydrocarbons Law, which mandates that Aramco’s hydrocarbon operations promote long-term productivity of the Kingdom’s reservoirs and support the prudent stewardship of its hydrocarbon resources. Aramco has historically replaced reserves on an organic basis through revisions of reserve estimates at existing fields and through delineation and exploration to identify new fields.\nAs a result, the Kingdom’s estimated proved reserves at the largest oil fields operated by Aramco have increased since the time of original production.\nThe following table sets forth Aramco’s estimates of its proved reserves based on the term of the Concession as at December 31, 2020 and 2019.\nNatural gas Crude oil Condensate NGL Combined (mmbbl) (mmbbl) (bscf) (mmboe) (mmbbl) (mmboe)\nReserves as at December 31, 2020 195,444 3,399 191,573 31,086 25,226 255,155\nReserves as at December 31, 2019 198,569 3,338 190,575 30,933 25,723 258,563\nThe following table sets forth the Kingdom’s estimates of its proved reserves in the fields Aramco operates as at December 31, 2020 and 2019.\nNatural gas Crude oil Condensate NGL Combined (mmbbl) (mmbbl) (', 'Kingdom’s reserves in the fields Aramco operated were the same as\nAramco’s reserves. Effective December 24, 2017, the Concession limited Aramco’s exclusive right to explore, develop, and produce the\nKingdom’s hydrocarbon resources, except in the Excluded Areas, to an initial period of 40 years, which will be extended by the Government for 20 years provided Aramco satisfies certain conditions commensurate with current operating practices. In addition, the Concession may be\nextended for an additional 40 years beyond the prior 60-year period subject to Aramco and the Government agreeing on the terms of the\nextension (see Section 6: Additional financial and legal information – The Concession). The provision of a specified term in the Concession impacts the calculation of Aramco’s reserves as compared to the Kingdom’s reserves in the fields Aramco operates. The Concession also requires Aramco to meet domestic demand for certain hydrocarbons, petroleum products, and LPGs through domestic production or imports.\nBased on the initial 40-year period and 20-year extension of the Concession, as at December 31, 2025, Aramco’s reserves were 247.2 billion\nboe (2024: 250.0 billion boe). Aramco’s oil equivalent reserves consisted of 186.5 billion barrels (2024: 189.8 billion barrels) of crude oil and\ncondensate, 26.2 billion barrels (2024: 26.1 billion barrels) of NGL and 211.7 tscf (2024: 209.8 tscf) of natural gas.\nAramco manages the Kingdom’s unique reserves and resources base to optimize production and maximize long-term value pursuant to the Hydrocarbons Law, which mandates that Aramco’s hydrocarbon operations promote long-term productivity of the Kingdom’s reservoirs and support the prudent stewardship of its hydrocarbon resources. Aramco has historically replaced reserves on an organic basis through revisions of reserve estimates at existing fields and through delineation and exploration to identify new fields. As a result, the Kingdom’s estimated proved reserves at the largest oil fields operated by Aramco have increased since the time of original production.\nThe following table sets forth Aramco’s estimates of its proved reserves based on the term of the Concession as at December 31, 2025 and 2024.\nCrude Oil and Condensate Natural Gas NGL Combined (mmbbl) (bscf) (mmboe) (mmbbl) (mmboe)\nReserves as at December 31, 2025 186,542 211,659 34,508 26,186 247,236\nReserves as at December 31, 2024 189,782 209,769 34,189 26,058 250,029\nThe following table sets forth the Kingdom’s estimates of its proved reserves in the fields Aramco operates as at December 31, 2025 and 2024.\nCrude Oil and Condensate Natural Gas NGL Combined (mmbbl) (bscf) (mmboe) (mmbbl) (mmboe)\nReserves as at December 31, 2025 261,743 256,940 42,429 37,873 342,045\nReserves as at December 31, 2024 261,682 255,117 42,101 37,496 341,279\nAramco’s reserve estimates conform to the SPE-PRMS definitions and guidelines, which are the internationally recognized industry standard sponsored by the Society of Petroleum Engineers, the American Association of Petroleum Geologists, the World Petroleum Council, the Society of Petroleum Evaluation Engineers, the Society of Exploration Geophysicists, the Society of Petrophysicists and Well Log Analysts, and the European Association of Geoscientists and Engineers. To estimate or update Aramco’s reserve estimates, the Upstream segment employees responsible for reserves calculations perform technical analyses that are reviewed internally by progressively higher levels of management until finalized at year-end. Aramco annually updates its estimates as it acquires and interprets new data. For reservoirs that have been producing and have established certain performance trends, Aramco is typically able to reliably forecast the reservoir’s future production. For reservoirs that have little to no production history and new discoveries, Aramco undertakes further analysis in addition to multidisciplinary evaluation to formulate production forecasts.\nAdditional legal information All amounts in millions SAR unless otherwise stated Aramco The Company was established in the Kingdom as a company with limited liability by virtue of Royal Decree No. M/8 dated 4/4/1409H\n(corresponding to November 13, 1988) to assume the privileges and rights of the Arabian American Oil Company. On January 1, 201', ""(Shari'a compliant) and other Islamic financing 2,460 7 to 16 years – 1,255 2028-2038\nRevolving Credit Facilities 36,880 1 to 5 years (534) 703 2025-2029\nShort-term borrowings 37,487 Under 1 year (5,787) 21,242 2025\nDebentures 106,283 10 to 50 years (9,552) 106,283 2025-2070\nLease liabilities – – (15,344) 62,483 Not defined\nOther financing arrangements 35,982 11 to 25 years – 35,982 2028 - 2046\n347,524 (46,826) 319,290\n1. Includes total facility amounts and carrying amounts for certain long-term loans being repaid in installments.\n5 . O RGANIZATIONAL 6. ADDITIONAL STRUCTURE AND FINANCIAL 7. C ONSOLIDATED\n\nAND STRATEGY PERFORMANCE 3. SUSTAINABILITY 4. RISK GOVERNANCE INFORMATION STATEMENTS Reserves information All amounts in millions unless otherwise stated Reserves as at December 31, 2024\nAs at December 31, 2024, the Kingdom’s reserves in the fields Aramco operates consisted of 341.3 billion boe (2023: 340.8 billion boe),\nincluding 261.7 billion barrels (2023: 261.7 billion barrels) of crude oil and condensate, 37.5 billion barrels (2023: 37.4 billion barrels)\nof NGL and 255.1 tscf (2023: 252.6 tscf) of natural gas, including 167.8 tscf (2023: 164.8 tscf) of nonassociated gas.\nUnder the Original Concession, which was in effect until December 24, 2017, Aramco’s rights with respect to hydrocarbons in the Kingdom\nwere not limited to a particular term. Accordingly, until such date, the Kingdom’s reserves in the fields Aramco operated were the same as\nAramco’s reserves. Effective December 24, 2017, the Concession limited Aramco’s exclusive right to explore, develop and produce the\nKingdom’s hydrocarbon resources, except in the Excluded Areas, to an initial period of 40 years, which will be extended by the Government for 20 years provided Aramco satisfies certain conditions commensurate with current operating practices. In addition, the\nConcession may be extended for an additional 40 years beyond the prior 60-year period subject to Aramco and the Government agreeing\non the terms of the extension (see Section 6: Additional financial and legal information – The Concession). The provision of a specified term in the Concession impacts the calculation of Aramco’s reserves as compared to the Kingdom’s reserves in the fields Aramco operates. The Concession also requires Aramco to meet domestic demand for certain hydrocarbons, petroleum products, and LPGs through domestic production or imports.\nBased on the initial 40-year period and 20-year extension of the Concession, as at December 31, 2024, Aramco’s reserves were 250.0 billion\nboe (2023: 251.2 billion boe). Aramco’s oil equivalent reserves consisted of 189.8 billion barrels (2023: 191.3 billion barrels) of crude oil and\ncondensate, 26.1 billion barrels (2023: 26.0 billion barrels) of NGL and 209.8 tscf (2023: 207.5 tscf) of natural gas. As at December 31, 2024,\nAramco’s portfolio included 548 (2023: 541) reservoirs within 148 (2023: 144) fields distributed throughout the Kingdom and its territorial\nwaters.\nAramco manages the Kingdom’s unique reserves and resources base to optimize production and maximize long-term value pursuant to the Hydrocarbons Law, which mandates that Aramco’s hydrocarbon operations promote long-term productivity of the Kingdom’s reservoirs and support the prudent stewardship of its hydrocarbon resources. Aramco has historically replaced reserves on an organic basis through revisions of reserve estimates at existing fields and through delineation and exploration to identify new fields. As a result, the Kingdom’s estimated proved reserves at the largest oil fields operated by Aramco have increased since the time of original production.\nThe following table sets forth Aramco’s estimates of its proved reserves based on the term of the Concession as at December 31, 2024 and 2023.\nCrude Oil and Condensate Natural Gas NGL Combined (mmbbl) (bscf) (mm"", ""(Shari’a compliant) 3,784 11 to 17 years (885) 3,736 2025-2035\nIjarah / Procurement (Shari'a compliant) 3,304 5 to 23 years (614) 2,701 2026-2039\nMurabaha (Shari'a compliant) 28,173 7 to 24 years (4,203) 18,293 2028-2032\nWakala (Shari'a compliant) and other\nIslamic financing 1,294 7 to 16 years (43) 1,023 2028-2036\nRevolving Credit Facilities 47,708 1 to 5 years (5,370) – 2023-2027\nShort-term borrowings 27,000 Under 1 year (1,779) 10,205 2023\nDebentures 97,212 3 to 50 years (6,551) 97,212 2023-2070\nDeferred consideration2 122,163 8 years (100,520) 122,163 2028\nLease Liabilities – – (12,114) 52,664 Not defined\nOther financing arrangements 23,978 11 to 25 years (923) 23,978 2028-2046\n418,044 (144,628) 393,144\n1. Includes total facility amounts and carrying amounts for certain long-term loans being repaid in installments.\n2. On March 7, 2023, the Company signed an agreement with PIF to make a third partial prepayment of $15.7 billion on or before March 15, 2023, which will fully or partially reduce\nthe outstanding amounts of the promissory notes payable between 2024 and 2028. Accordingly, the remaining amount of the deferred consideration will mature in 2026.\n\nAdditional financial information continued Reserves as at December 31, 2022\nAs at December 31, 2022, the Kingdom’s reserves in the fields Aramco operates consisted of 338.4 billion boe (2021: 337.3 billion\nboe), including 261.6 billion barrels (2021: 261.6 billion barrels) of crude oil and condensate, 36.1 billion barrels (2021: 36.0 billion\nbarrels) of NGL and 246.7 tscf (2021: 241.5 tscf) of natural gas, including 156.9 tscf (2021: 153.7 tscf) of nonassociated gas.\nUnder the Original Concession, which was in effect until December 24, 2017, Aramco’s rights with respect to hydrocarbons\nin the Kingdom were not limited to a particular term. Accordingly, until such date, the Kingdom’s reserves in the fields Aramco\noperated were the same as Aramco’s reserves. Effective December 24, 2017, the Concession limited Aramco’s exclusive right to\nexplore, develop and produce the Kingdom’s hydrocarbon resources, except in the Excluded Areas, to an initial period of 40 years, which will be extended by the Government for 20 years provided Aramco satisfies certain conditions commensurate with\ncurrent operating practices. In addition, the Concession may be extended for an additional 40 years beyond the prior 60-year\nperiod subject to Aramco and the Government agreeing on the terms of the extension (see Section 6: Additional legal information — the Concession). The provision of a specified term in the Concession impacts the calculation of Aramco’s reserves as compared to the Kingdom’s reserves in the fields Aramco operates. The Concession also requires Aramco to meet domestic demand for certain hydrocarbons, petroleum products and LPGs through domestic production or imports.\nBased on the initial 40-year period and 20-year extension of the Concession, as at December 31, 2022, Aramco’s reserves were\n258.8 billion boe (2021: 253.6 billion boe). Aramco’s oil equivalent reserves consisted of 200.8 billion barrels (2021: 196.9 billion\nbarrels) of crude oil and condensate, 25.2 billion barrels (2021: 25.2 billion barrels) of NGL and 201.9 tscf (2021: 194.5 tscf) of\nnatural gas. As at December 31, 2022, Aramco’s portfolio included 535 (2021: 530) reservoirs within 142 (2021: 142) fields\ndistributed throughout the Kingdom and its territorial waters.\nAramco manages the Kingdom’s unique reserves and resources base"", 'billion barrels (2021: 196.9 billion\nbarrels) of crude oil and condensate, 25.2 billion barrels (2021: 25.2 billion barrels) of NGL and 201.9 tscf (2021: 194.5 tscf) of\nnatural gas. As at December 31, 2022, Aramco’s portfolio included 535 (2021: 530) reservoirs within 142 (2021: 142) fields\ndistributed throughout the Kingdom and its territorial waters.\nAramco manages the Kingdom’s unique reserves and resources base to optimize production and maximize long-term value pursuant to the Hydrocarbons Law, which mandates that Aramco’s hydrocarbon operations promote long-term productivity of the Kingdom’s reservoirs and support the prudent stewardship of its hydrocarbon resources. Aramco has historically replaced reserves on an organic basis through revisions of reserve estimates at existing fields and through delineation and exploration to identify new fields. As a result, the Kingdom’s estimated proved reserves at the largest oil fields operated by Aramco have increased since the time of original production.\nThe following table sets forth Aramco’s estimates of its proved reserves based on the term of the Concession as at December 31,\n2022 and 2021.\nNatural Gas Crude Oil Condensate NGL Combined (mmbbl) (mmbbl) (bscf) (mmboe) (mmbbl) (mmboe)\nReserves as at December 31, 2022 197,410 3,393 201,905 32,826 25,153 258,782\nReserves as at December 31, 2021 193,195 3,676 194,453 31,549 25,188 253,608\nThe following table sets forth the Kingdom’s estimates of its proved reserves in the fields Aramco operates as at December 31,\n2022 and 2021.\nNatural Gas Crude Oil Condensate NGL Combined (mmbbl) (mmbbl) (bscf) (mmboe) (mmbbl) (mmboe)\nReserves as at December 31, 2022 257,143 4,480 246,738 40,665 36,146 338,434\nReserves as at December 31, 2021 256,826 4,766 241,529 39,783 35,956 337,331\nAramco’s reserve estimates conform to the SPE-PRMS definitions and guidelines, which is the internationally recognized industry standard sponsored by the Society of Petroleum Engineers, the American Association of Petroleum Geologists, the World Petroleum Council, the Society of Petroleum Evaluation Engineers, the Society of Exploration Geophysicists, the Society of Petrophysicists and Well Log Analysts and the European Association of Geoscientists and Engineers. To estimate or update Aramco’s reserve estimates, the Upstream segment employees responsible for reserves calculations perform technical analyses that are reviewed internally by progressively higher levels of management until finalized at year-end. Aramco annually updates its estimates as it acquires and interprets new data. For reservoirs that have been producing and have established certain performance trends, Aramco is typically able to reliably forecast the reservoir’s future production. For reservoirs that have little to no production history and new discoveries, Aramco undertakes further analysis in addition to multidisciplinary evaluation to formulate production forecasts.\n\nReserves information Aramco The Company was established in the Kingdom as a company with limited liability by virtue of Royal Decree No. M/8 dated\n4/4/1409H (corresponding to November 13, 1988) to assume the privileges and rights of the Arabian American Oil Company.\nOn January 1, 2018, the Company was converted into a Saudi joint stock company pursuant to Council of Ministers Resolution\nNo. 180 dated 1/4/1439H (corresponding to December 19, 2017) and registered in the city of Dhahran under commercial\nregistration No. 2052101150 dated 11/07/1439H (corresponding to March 28, 2018) with Saudi Arabian Oil Company as its official\nname. Its registered head office is located at P.O. Box 5000, Dhahran 31311, Kingdom of Saudi Arabia. Its share capital is seventy\nfive billion Saudi Riyals (SAR 75,000,000,000), consisting of two hundred and twenty billion (220,000,000,000) fully paid ordinary\nshares with no par value. Aramco’s primary operating segments are Upstream and Downstream, which are supported by corporate activities (for further details refer to Section 2: Results and performance).\nOn December 11, 2019, the Company completed its IPO']",The context does not provide information about Aramco's estimated proved reserves for the Kingdom's fields it operates at the end of 2023.,"At December 31, 2023, the Kingdom's estimated proved reserves in the fields Aramco operates were 261,677 million barrels of crude oil and condensate, 252,567 billion cubic feet of natural gas, and 340,768 million barrels of oil equivalent combined. These estimates are based on SPE-PRMS definitions.",0.3333333333333333,0.0,0.3333333333,0.0
What happened to the deferred consideration for the SABIC acquisition in 2023?,"[') Deferred consideration Deferred consideration represented the amount payable to PIF for the SABIC acquisition in 2020. The amount was payable over several\ninstallments, in the form of promissory notes, from August 2020 to April 2028. During the year ended December 31, 2023, the Company\nmade the following repayments:\n(i) On March 13, 2023, the Company, in agreement with PIF, made a partial prepayment of SAR 59,040 ($15,744), which resulted in a\ngain of SAR 4,634 ($1,236).\n(ii) On April 7, 2023, the Company repaid the outstanding amounts of the promissory notes due on or before April 7, 2023, aggregating\nto SAR 41,250 ($11,000).\n(iii) On May 2, 2023, the Company, in agreement with PIF, made a final prepayment of SAR 16,691 ($4,451), which resulted in a gain of\nSAR 1,141 ($304).\nFollowing the above repayments, the outstanding amount of deferred consideration was fully settled.\n(b) Debentures\n(i) In October 2018, SABIC issued five-year and 10-year USD denominated $1,000 bonds each, equivalent to a total of\nSAR 7,500 ($2,000). These bonds are unsecured and carry coupon rates of 4% and 4.5%, respectively. The bonds are issued\nin accordance with the Rule 144A/Regulation S offering requirements under the U.S. Securities Act of 1933, as amended. The\nbonds are listed on the Irish Stock Exchange (“Euronext Dublin”) and the proceeds were used for refinancing maturing debt. In\n2023, bonds with five-year maturities, aggregating to a principal amount of SAR 3,750 ($1,000) and carrying a coupon rate of 4%,\nwere repaid.\nIn September 2020, SABIC issued 10-year and 30-year USD denominated $500 bonds each, equivalent to a total of SAR 3,750\n($1,000). These bonds are unsecured and carry coupon rates of 2.15% and 3%, respectively. Both bonds are issued in accordance\nwith Rule 144A/Regulation S offering requirements under the U.S. Securities Act of 1933, as amended. These bonds are listed on\nthe Euronext Dublin and the 30-year bond is dual listed on the Taipei Exchange in Taiwan, China. The proceeds were used for general purposes and refinancing maturing debt.\n(ii) On April 16, 2019, the Company issued five tranches of USD denominated unsecured notes aggregating to an equivalent of\nSAR 45,000 ($12,000) and consisting of three-year maturities for SAR 3,750 ($1,000) with a coupon rate of 2.75%, five-year\nmaturities for SAR 7,500 ($2,000) with a coupon rate of 2.875%, 10-year maturities for SAR 11,250 ($3,000) with a coupon rate of\n3.5%, 20-year maturities for SAR 11,250 ($3,000) with a coupon rate of 4.25%, and 30-year maturities for SAR 11,250 ($3,000) with a\ncoupon rate of 4.375%. The notes were issued and sold in accordance with Rule 144A/Regulation S under the U.S. Securities Act of\n1933, as amended. Interest is payable semi-annually in arrears on April 16 and October 16. The notes are listed on the London Stock\nExchange’s Regulated Market and the proceeds were for general corporate purposes. At initial recognition, the Company recorded\nan amount of SAR 44,460 ($11,856) for the issuance proceeds, net of discounts and estimated transaction costs. On April 16, 2022,\nnotes with three-year maturities, aggregating to a principal amount of SAR 3,750 ($1,000) and carrying a coupon rate of 2.75%,\nwere repaid.\nOn November 24, 2020, the Company issued another series of USD denominated unsecured notes, aggregating to an equivalent\nof SAR 30,000 ($8,000), consisting of maturity dates of three years to 50 years paid at the end of the maturity date with coupon\nrates ranging from 1.25% to 3.50%. At initial recognition, the Company recorded an amount of SAR 29,625 ($7,900) for the\nissuance proceeds, net of discounts. On November 24, 2023, notes with three-year m', '79); and (d) equity awards issued to employees of ﷼ 151 (March 31, 2025:\n﷼ 207). In addition, investing activities for the three-month period ended March 31, 2025 included an increase in the carrying amount of the\ninvestment in Rabigh Refining and Petrochemical Company (Petro Rabigh) due to the waiver of a non-current shareholder loan receivable of\n﷼ 938.\n12. Commitments Capital commitments\nCapital expenditures contracted for but not yet incurred were ﷼ 164,686 and ﷼ 174,551 at March 31, 2026 and December 31, 2025,\nrespectively. In addition, leases contracted for but not yet commenced were ﷼ 25,105 and ﷼ 25,357 at March 31, 2026 and December 31, 2025,\nrespectively.\nAll amounts in millions of Saudi Riyals unless otherwise stated 13. Contingencies Saudi Aramco has contingent assets and liabilities with respect to certain disputed matters, including claims by and against contractors and lawsuits and arbitrations involving a variety of issues. These contingencies arise in the ordinary course of business. It is not anticipated that any material adjustments will result from these contingencies.\n14. Payments to the Government by Saudi Arabian Oil Company 1st quarter 1st quarter\n2026 2025\nIncome taxes (Note 7(c)) 43,892 43,782\nRoyalties 32,505 39,200\nDividends 66,907 65,310\n15. Related party transactions and balances (a) Transactions 1st quarter 1st quarter\n2026 2025\nJoint ventures:\nRevenue from sales 6,330 6,150\nOther revenue 15 19\nInterest income 64 45\nPurchases 4,995 6,521\nService expenses – 4 Associates:\nRevenue from sales 25,883 23,434\nOther revenue 41 34\nInterest income 60 49\nPurchases 23,411 15,435\nService expenses 30 34\nGovernment, semi-Government and other entities with Government ownership or control:\nRevenue from sales 9,739 8,175\nOther income related to sales 34,135 23,966\nOther revenue 567 237\nPurchases 1,913 2,355\nService expenses 180 131\n(b) Balances\nAt March 31, At December 31,\n2026 2025\nJoint ventures:\nOther assets and receivables 1,871 1,941\nTrade receivables 7,099 7,024\nTrade payables and other liabilities 3,960 4,245\nBorrowings 919 926\nOther assets and receivables 4,860 3,830\nTrade receivables 24,101 20,201\nTrade payables and other liabilities 7,241 4,823\nGovernment, semi-Government and other entities with Government ownership or control:\nOther assets and receivables 3,578 3,218\nTrade receivables 6,731 4,864\nDue from the Government 35,614 29,315\nShort-term investments with banks 9,750 4,928\nCash and cash equivalents held with banks 40,714 42,236\nTrade payables and other liabilities 1,279 1,140\nBorrowings 30,829 28,523\n(c) Compensation of key management personnel Compensation policies for and composition of key management personnel remain consistent with 2025.\nAll amounts in millions of Saudi Riyals unless otherwise stated 16. Assets classified as held for sale Divestment of SABIC Europe B.V. and Engineering Thermoplastics Business (i) SABIC Europe B.V.\nAEQUITA SE & Co. KGaA (“AEQUITA”), to sell its entire shareholding in SABIC Europe B.V. (“EP”), which owns SABIC’s European petrochemicals business. The sale will enable SABIC, which is part of the Downstream segment, to optimize its portfolio and focus on higher-growth markets. The sale consideration is based on an enterprise value of ﷼ 1,875, and includes deferred and contingent proceeds in the form of two vendor loan notes with a combined principal amount of ﷼ 1,875. The repayment of these notes is linked to\nthe post-disposal free cash flow of the business and other defined European Olefins and Polyolefins assets of AEQUITA. Completion of the transaction remains contingent upon the fulfilment of standard conditions and receipt of necessary approvals, and is expected in the fourth quarter of 2026.\nThe signing of the agreement follows the authorization by SABIC’s board on December 16', '. SABIC manufactures on a global scale in the Americas, Europe, Middle East, and Asia Pacific, making different products, including chemicals, commodity and high-performance plastics, specialties, agri-nutrients and metals. The acquisition of the equity interest in SABIC is consistent with Saudi Aramco’s long-term Downstream strategy to grow its integrated refining and petrochemicals capacity and create value from integration across the hydrocarbon value chain.\nThe transaction resulted in the Company obtaining control of SABIC. The Company accounts for acquisitions of subsidiaries using the acquisition method of accounting, including those acquisitions under common control and having commercial substance. This requires recognition of the assets acquired and liabilities assumed at fair value as of the acquisition date.\n71 Saudi Arabian Oil Company | Consolidated financial statements for the year ended December 31, 2021\n\nAll amounts in millions of Saudi Riyals unless otherwise stated 35. Investments in affiliates continued Saudi Aramco engaged an independent valuer in order to determine the fair values of the assets and liabilities of SABIC as part of the purchase price allocation. The fair values of the identifiable assets and liabilities are as follows:\nCash and cash equivalents 27,515 Trade receivables 13,829\nInventories 24,919 Other current assets and receivables 4,803\nShort-term investments 8,405 Property, plant and equipment (Note 5) 179,313\nIntangible assets (Note 6) 37,079 Investments in joint ventures and associates 51,864\nOther non-current assets 11,598 Trade and other payables (23,460)\nIncome tax and zakat payable (4,178)\nCurrent borrowings (8,149)\nNon-current borrowings (37,174)\nPost-employment benefit obligations (16,549)\nOther non-current liabilities (9,067)\nTotal identified net assets at fair value 260,748 Non-controlling interests (100,739)\nGoodwill (Note 6) 99,116 Purchase consideration in the form of promissory notes 259,125\nNon-controlling interests which result from both the Company’s partial ownership of SABIC, as well as SABIC’s partial ownership of a number of its subsidiaries, were measured at their proportionate share of recognized net assets.\nThe purchase price amount is to be paid over several installments pursuant to a seller loan provided by PIF. Loan payments, which are represented by promissory notes denominated in USD, are as follows:\nPrincipal loan amount Loan charge On or before August 2, 2020 26,250 – On or before April 7, 2021 18,750 –\nOn or before April 7, 2022 31,875 1,875\nOn or before April 7, 2023 39,375 1,875\nOn or before April 7, 2024 39,375 2,250\nOn or before April 7, 2025 39,375 3,000\nOn or before April 7, 2026 64,125 5,625\nOn or before April 7, 2027 – 3,750 On or before April 7, 2028 – 3,750\nTotal purchase price and loan charges 259,125 22,125\nPayments to date (45,000) –\nTotal amount of outstanding installments 214,125 22,125\nThe combined fair value of the principal loan amounts and loan charges on the date of acquisition amounted to SAR 259,125 ($69,100).\nThis is subsequently measured at amortized cost using the effective interest method and is presented on a combined basis as ‘Deferred consideration’ within ‘Borrowings’ (Note 20).\nSaudi Aramco had agreed to make an accelerated payment of SAR 11,250 ($3,000) in April 2022 based on the occurrence of certain\nmarket conditions in 2021. At December 31, 2021, it was determined that the relevant conditions were not met during 2021 and, as a\nresult, no accelerated payment will be required in April 2022. If the accelerated payment would have been required, it would have\nreduced the principal amount that would otherwise be payable on or before April 2026 by SAR 11,250 ($3,000) and the loan charge in\nApril 2022 would have been reduced from SAR 1,875 ($500) to SAR 750 ($200).\nSaudi Arabian Oil Company | Consolidated financial statements for the year ended December 31, 2021 72\nNotes to the consolidated financial statements continued All amounts in millions of Saudi Riyals unless otherwise stated 35. Investments in affiliates continued The goodwill of SAR 99,116 arising from the transaction includes synergies expected from the transaction, representing value\nchain capture through downstream integration, procurement, supply chain, manufacturing, marketing and sales, future', 'PC for a 20-year period. Concurrently, AGPC granted the Company the exclusive right to use, operate and maintain the pipelines network during the 20-year period in exchange for a quarterly, volume-based tariff payable by the Company to AGPC. The tariff is backed\nby minimum volume commitments. The Company will at all times retain title to, and operational control of, the pipelines.\n35. Investments in affiliates (a) Investments in subsidiaries (i) Saudi Basic Industries Corporation (""SABIC"")\nOn June 16, 2020, the Company acquired a 70% equity interest in SABIC from the Public Investment Fund (""PIF""), for SAR 259,125\n($69,100). This equates to SAR 123.39 ($32.90) per share.\nSABIC is a global diversified chemicals company headquartered in Riyadh, Saudi Arabia. SABIC manufactures on a global scale in the Americas, Europe, Middle East, and Asia Pacific, making different products, including chemicals, commodity and high-performance plastics, specialties, agri-nutrients and metals. The acquisition of the equity interest in SABIC is consistent with Saudi Aramco’s long-term Downstream strategy to grow its integrated refining and petrochemicals capacity and create value from integration across the hydrocarbon value chain.\nThe transaction resulted in the Company obtaining control of SABIC. The Company accounts for acquisitions of subsidiaries using the acquisition method of accounting, including those acquisitions under common control and having commercial substance. This requires recognition of the assets acquired and liabilities assumed at fair value as of the acquisition date.\n\nConsolidated financial statements All amounts in millions of Saudi Riyals unless otherwise stated 35. Investments in affiliates continued Saudi Aramco engaged an independent valuer in order to determine the fair values of the assets and liabilities of SABIC as part of the purchase price allocation. The fair values of the identifiable assets and liabilities are as follows:\nCash and cash equivalents 27,515 Trade receivables 13,829\nInventories 24,919 Other current assets and receivables 4,803\nShort-term investments 8,405 Property, plant and equipment (Note 5) 179,313\nIntangible assets (Note 6) 37,079 Investments in joint ventures and associates 51,864\nOther non-current assets 11,598 Trade and other payables (23,460)\nIncome tax and zakat payable (4,178)\nCurrent borrowings (8,149)\nNon-current borrowings (37,174)\nPost-employment benefit obligations (16,549)\nOther non-current liabilities (9,067)\nTotal identified net assets at fair value 260,748 Non-controlling interests (100,739)\nGoodwill (Note 6) 99,116 Purchase consideration in the form of promissory notes 259,125\nNon-controlling interests which result from both the Company’s partial ownership of SABIC, as well as SABIC’s partial ownership of a number of its subsidiaries, were measured at their proportionate share of recognized net assets.\nThe purchase price amount is to be paid over several installments pursuant to a seller loan provided by PIF. Loan payments, which are represented by promissory notes denominated in USD, are as follows:\nPrincipal loan amount Loan charge On or before August 2, 2020 26,250 – On or before April 7, 2021 18,750 –\nOn or before April 7, 2022 31,875 1,875\nOn or before April 7, 2023 39,375 1,875\nOn or before April 7, 2024 39,375 2,250\nOn or before April 7, 2025 39,375 3,000\nOn or before April 7, 2026 64,125 5,625\nOn or before April 7, 2027 – 3,750 On or before April 7, 2028 – 3,750\nTotal purchase price and loan charges 259,125 22,125\nPayments to date (45,000) –\nTotal amount of outstanding installments 214,125 22,125\nThe combined fair value of the principal loan amounts and loan charges on the date of acquisition amounted to SAR 259,125 ($69,100).\nThis is subsequently measured at amortized cost using the effective interest method and is presented on a combined basis as ‘Deferred consideration’ within ‘Borrowings’ (Note 20).\nSaudi Aramco had agreed to make an accelerated payment of SAR 11,250 ($3,000) in April 2022 based on the occurrence of certain\nmarket conditions in 2021. At December 31, 2021, it was determined that the relevant conditions were not met during 2021 and, as a\nresult, no accelerated payment will be required in April 2022.', 'corresponding to September 17, 2019), which extends the period for which the\nCompany will not be obligated to pay royalties on condensate production after the current five-year period for an additional\n10-year period, which may be further extended for subsequent 10-year periods, unless the Government determines the\neconomics impacting gas field development do not warrant such an extension.\nThe Government has the option to take all or part of the royalty in-kind from the produced hydrocarbons.\nAcquisition of 70% equity interest in SABIC\nOn June 16, 2020, Aramco acquired the PIF’s 70% equity interest in SABIC for total consideration of $69.1 billion. SABIC\noperates in over 50 countries and produces a range of chemicals. Aramco believes that purchasing this majority interest in SABIC advances its strategy to increase the proportion of petrochemicals production in its downstream portfolio and supports Aramco’s downstream growth ambitions. In addition, Aramco believes that the acquisition facilitates the application of SABIC’s expertise in the chemicals industry to Aramco’s existing and future integrated downstream facilities.\nThe March 27, 2019, purchase agreement provided that the purchase price for the acquisition would be paid on the closing date\nin the form of a cash payment equal to 50% of the purchase price (to be adjusted for certain expenses) and a seller loan in an\namount equal to 50% of the purchase price with the last payment due on or before December 31, 2021. On October 6, 2019,\nAramco and the PIF agreed to amend the payment terms to provide that, on the closing date, 36% of the purchase price (to be adjusted for certain expenses) would be paid in cash and 64% would be paid in the form of a seller loan with the last payment\ndue on or before September 30, 2025.\nOn June 16, 2020, Aramco and the PIF agreed to further amend the payment terms to provide that the entire purchase price\nwould be paid over several installments pursuant to a seller loan provided by the PIF (deferred consideration).\nOn January 24, 2022, the Company, in agreement with PIF, made a partial prepayment of $7.6 billion, which reduced the\nprincipal amounts of two promissory notes payable on or before April 7, 2024 and April 7, 2026, by $7.0 billion and $1.0 billion,\nrespectively. In addition, on June 30, 2022, the Company made a second partial prepayment of $10.2 billion, which reduced the\nprincipal amount of a promissory note payable on or before April 7, 2025 by $2.5 billion and further reduced the principal amount of the promissory note payable on or before April 7, 2026 by $9.5 billion.\nAfter taking these payments into account, as at December 31, 2022, future loan payments, which are represented by promissory\nnotes, are payable between April 7, 2023 and April 7, 2028 (the last payment), as follows:\n1. On or before April 7, 2023, an amount equal to $10.5 billion plus a loan charge of $500 million;\n2. On or before April 7, 2024, an amount equal to $3.5 billion plus a loan charge of $600 million;\n3. On or before April 7, 2025, an amount equal to $8.0 billion plus a loan charge of $800 million;\n4. On or before April 7, 2026, an amount equal to $6.6 billion plus a loan charge of $1.5 billion;\n5. On or before April 7, 2027, a loan charge of $1.0 billion; and\n6. On or before April 7, 2028, a loan charge of $1.0 billion.\nOn March 7, 2023, the Company agreed with PIF to make a third partial prepayment of $15.7 billion on or before March 15, 2023.\nThis partial prepayment will fully reduce the outstanding principal amount of $3.5 billion of the promissory note payable on or before April 7, 2024, and will partially reduce the outstanding principal amounts of the promissory notes payable on or before\nApril 7, 2025, and April 7, 2026, by $3.8 billion and $5.7 billion, respectively. The outstanding amounts of the loan charge\npromissory notes payable between 2024 and 2028, aggregating to $4.9 billion, will also be fully reduced. After taking this\nprepayment']","In 2023, the deferred consideration for the SABIC acquisition was fully settled. The Company made several repayments, including a partial prepayment of SAR 59,040 ($15,744) on March 13, 2023, which resulted in a gain of SAR 4,634 ($1,236), a repayment of SAR 41,250 ($11,000) on April 7, 2023, and a final prepayment of SAR 16,691 ($4,451) on May 2, 2023, which resulted in a gain of SAR 1,141 ($304). After these repayments, the outstanding amount of deferred consideration was completely paid off.","Aramco made three payments in 2023 totaling SAR 116.9 billion, including a partial prepayment, repayment of promissory notes, and a final prepayment. As a result, the deferred consideration payable to PIF was fully settled.",1.0,0.9336458806717859,0.8041666666465626,1.0
What is the purpose of Aramco's Supplier Code of Conduct and iktva program?,"['Aramco’s iktva program continues to serve as a cornerstone of supply chain localization and innovators through STEM competitions like known as Ithra, is Aramco’s flagship citizenship in-Kingdom value creation. Through sustained the World Robot Olympiad and FIRST initiative. Ithra’s volunteering program stands investment in training, skills development, and Championship, to advancing sustainability as a testament to the power of giving, strategic partnerships, the program strengthens through coral reef restoration, solar-powered leadership, and community spirit, with the national capabilities while enhancing the clinics, and youth-led environmental programs, total number of hours volunteered exceeding resilience of the Company’s supply chain.\nAramco’s global citizenship initiatives are one million in 2025. This million-hour In 2025, Aramco achieved its iktva milestone of shaping a more equitable and sustainable milestone demonstrates a strong commitment\n70% local content and set a new target of 75% future, wherever it operates. to national development, with each hour of\nby 2030. This ambition reinforces supply chain service contributing to the Kingdom’s progress Aramco continues to invest in education and resilience, drives industrial growth, and ensures and future growth.\nvocational training to empower Saudi youth that greater economic value is retained within and build a competitive national workforce. In the Kingdom. In the same year, Aramco entered\n2025, the Company supported 160 schools\ninto over 140 corporate purchase agreements across the Kingdom, including modernizing\nwith an estimated value of ﷼ 60.0 billion ($16.0\naging facilities and delivering programs that billion), further advancing long-term enhance student readiness in health, localization and industrial development.\nsustainability, and STEM fields.\nCommunity and society Through the National Training Centers (NTC)\nSince its inception more than 90 years ago, initiative, over 7,400 participants enrolled in\nAramco has been instrumental in the core programs, while over 11,000 joined Kingdom’s progress. From the 1930s\nshort-term programs to meet immediate through the 1970s, the Company focused market needs. To date, over 85,000 students\non establishing infrastructure and driving have been trained by the NTCs in more than industrial expansion to support commercial\n100 disciplines, with over 10% of students\ngrowth. Over the years, Aramco has iktva1,2 being female. This initiative reflects Aramco’s increasingly engaged in voluntary citizenship (%)\ncommitment to fostering lifelong learning, initiatives, aligning with the Kingdom’s vision of supporting Saudi Vision 2030 and ensuring a fostering a knowledge-driven society.\nsustainable pipeline of skilled talent for the Citizenship initiatives Kingdom’s evolving economy. 70.0 67.0\nAramco’s Corporate Donation Program is 65.0\ndedicated to enhancing the social and economic Volunteering 59.0 63.0\nAramco remains committed to fostering a wellbeing of communities across Saudi Arabia.\nculture of volunteerism that delivers meaningful In 2025, the program directed support toward impact across its global operations. In 2025, the\neducation, healthcare, and social initiatives.\nCompany contributed over 55,000 volunteer Over 7,600 individuals benefited from\nhours with efforts spanning education, educational programs that provide access to environmental sustainability, community quality learning and skill development. In development, and youth empowerment.\nhealthcare, critical support including medical During the year, Aramco launched the equipment and specialized programs were Professional Volunteer Program through which provided for people with disabilities. Social employees provided technical expertise in IT, [•] initiatives focused on home renovations for safety, and finance to more than 80 nonprofit families affected by natural disasters and 2021 2022 2023 2024 2025 organizations, enhancing their capacity and support for specialized centers serving people effectiveness. The Company was also with disabilities. Through strategic partnerships, recognized as one of the first 10 private sector 1. Percentage of total procurement expenditures locally sourced.\nAramco ensures long-term, meaningful impact 2. Applies to the Saudi Arabian Oil Company (the Company).\n\nRisk management Managing risk exposure Risk objectives (i) Leadership, direction, and oversight with Prevention, Environmental Protection, Aramco operates in an industry characterized respect to the Company’s risk appetite, risk Information Security, Corporate Emergency by market volatility, hazardous operations, tolerance, risk framework, and risk strategy; Management and Continuity, Corporate and uncertain project outcomes. Taking Compliance, and Financial Risk Management (ii) Governance and management of informed risks is an inherent and necessary organizations, as well as the Group Risk strategic, operational, sustainability, and part of doing business. Aramco manages its Management function. Internal Audit, as the ESG related risks; and, strategic, operational, compliance, and third line, provides management and the financial risks by continuously assessing (iii) Fostering a culture within the Company Audit Committee with independent them and undertaking appropriate that emphasizes and demonstrates the assurance on', ""seeks to support local content and develop Aramco extended the reach of its STEM education initiatives to innovative opportunities for the future. Europe, the Americas, and Asia through programs that aimed to, among others, develop the capability of STEM educators and iktva and national champions enhance access to resources needed to support effective STEM Aramco believes its commitment and investment in training, skills education, including infrastructure and teaching materials, development, and nurturing of in-Kingdom partnerships has involving teachers especially from predominately low-income and contributed to the development of the labor force in Saudi Arabia, underserved school districts and schools in less developed areas.\nwhile adding robustness to the Company’s supply chain through localization. Aramco’s citizenship initiatives in 2024 demonstrated a deep commitment to community engagement and societal development.\nDuring 2024, Aramco continued to play a role in the localization of Key highlights include employee donation campaigns, such as the the supply chain and developing a Saudi-based energy ecosystem.\nBlueBox Campaign and Ramadan Donation Campaign that provided The Company’s iktva program is an ongoing success, and through food, along with social, educational, and medical support to it the local component of the Company’s overall expenditure across underprivileged families. The Company also led impactful micro- its supply chain now stands at 67.0%, with a target to grow to industry projects like the Saudi Coffee Development Center,\n70.0% by the end of 2025. This program retained billions of dollars\nfostering local economic growth. Aramco’s outreach efforts in economic activity within Saudi Arabia, thereby serving the celebrated cultural milestones like the Saudi National Day Company’s interest while supporting the local economy. In 2024, with orphans and people with disabilities, while educational partnerships like the STEM Challenge and World Robotics Olympiad\nestimated value of ﷼ 65.7 billion ($17.5 billion) to strengthen the\nempowered future innovators. Aramco's Energy Access Program local supply chain ecosystem for strategic commodities and enhance distributed over 20,000 cooking stoves, benefiting more than the manufacturing landscape within the Kingdom. In addition, 153,000 people in India. Volunteering activities, such as blood\nAramco signed 145 agreements and Memoranda of Understanding donation campaigns, home renovation projects, and collaborations\nvalued at around ﷼ 33.75 billion ($9.0 billion) at the 2025 iktva\nwith people with disabilities care centers showcased Aramco's Forum and Exhibition. The Company has also launched the Supplier dedication to inclusion and community welfare.\nESG Program, aimed at embedding ESG principles across its supply chain.\niktva1,2\n\n63.0 65.0 67.0\n57.5 59.0\n2020 2021 2022 2023 2024\n1. Percentage of total procurement expenditures locally sourced.\n2. Applies to the Saudi Arabian Oil Company (the Company).\n\n5 . O RGANIZATIONAL 6. A DDITIONAL STRUCTURE AND FINANCIAL 7. C ONSOLIDATED\n\nAND STRATEGY PERFORMANCE 3. SUSTAINABILITY 4. RISK GOVERNANCE INFORMATION STATEMENTS Ithra, Aramco’s flagship citizenship initiative, has grown to be a Aramco also fosters a culture of volunteerism among both leading stakeholder in the Kingdom’s arts and culture sector by employees and community members. In 2024, it introduced a driving engaging and relevant programs for cultural sector unified global volunteer program called “Energy for You” uniting development, innovation, education, and entrepreneurship. Since employees across local and international offices under a shared opening, Ithra has welcomed around five million visitors who have mission and brand. Aramco has also significantly expanded its engaged in thousands of offerings. School visits and special visits, employee volunteer program while facilitating a well-established organized as part of Ithra's community engagement efforts, volunteer program for the public at Ithra. Further reinforcing its continue to enrich children's cultural knowledge, benefiting more efforts on impactful and innovative community service, Aramco,\nthan 120,000 children over the years. In 2024, there was a together with its partners, also offers training and certification for\ncompelling series of programs, exhibitions, performances, volunteer practitioners and leaders in public education with the aim workshops, events, and other various initiatives. These world-class of enhancing the curation of volunteer activities. Additionally, the experiences bring together culture, innovation, and knowledge, Company provides volunteering impact awareness sessions and and are carefully designed to engage diverse communities. curated courses for public education students.\nKing Abdulaziz Center for World Culture (Ithra), Dhahran, Saudi Arabia\n\n5 . O RGANIZATIONAL 6. A DDITIONAL STRUCTURE AND FINANCIAL 7. C ONSOLIDATED\n\nAND STRATEGY PERFORMANCE 3. SUSTAINABILITY 4. RISK GOVERNANCE INFORMATION STATEMENTS Risk management:"", 'effectively mitigated to water-efficient practices, maximizing support in-Kingdom wholly-owned operated eliminate environmental impacts.\nwastewater reuse, and minimizing water assets that are located in a water-stressed losses at operating facilities and region, with the remaining freshwater communities. consumed by out of Kingdom wholly-owned operated assets.\nAramco produces wastewater and recognizes the need to responsibly manage Spills to the environment and treat wastewater prior to returning it to Aramco operates across a vast geographic the environment. Its approach to wastewater area with many remote sites. This introduces management is governed by relevant challenges to early detection of potential national and international frameworks or spills, particularly across the Kingdom’s standards, including Saudi Arabian Executive enormous deserts. To meet its target of zero Regulations for the Protection of Aqueous spills, Aramco employs rigorous inspection Media from Pollution, Royal Commission programs to assess the integrity of assets, Environmental Regulations, and Ipieca’s oil putting fail-safe measures in place, training and gas industry guidance on voluntary employees, and utilizing advanced sustainability reporting – discharges to technologies to predict possible failures water. for rapid decision making and action.\nFreshwater consumption1,2 Number of hydrocarbon spills3,4,5 Volume of hydrocarbon spills3,5 (million cubic meters) (barrels)\n\n94.6 93.6 142,885\n89.9\n\n83.0\n78.5 12 12\n\n14,447\n[•] 8,566 34 149\n2021 2022 2023 2024 2025 2021 2022 2023 2024 2025 2021 2022 2023 2024 2025\n1. The 2025 figure applies to the Saudi Arabian Oil Company and its operationally controlled entities. Figures from 2021 to 2024 apply to the Saudi Arabian Oil Company and its operationally controlled entities, excluding ATC, ASC, AOC, and SAAC.\n2. The 2025 figure for freshwater consumption has undergone ISAE3000 (revised) limited assurance. Assurance results will be published on the Aramco website in Q2 2026. Figures from 2022 to 2024 have also undergone external limited assurance\nwhich can be viewed online at www.aramco.com/en/sustainability/sustainability-report.\n3. Applies to the Saudi Arabian Oil Company and its operationally controlled entities.\n4. Oil spill incidents with volume greater than one barrel.\n5. The 2025 figures for the number of hydrocarbon spills and the volume of hydrocarbon spills have undergone ISAE3000 (revised) limited assurance. Assurance results will be published on the Aramco website in Q2 2026. The volume of\nhydrocarbon spills figure for 2022 to 2024 have also undergone external limited assurance and can be viewed online at www.aramco.com/en/sustainability/sustainability-report.\n\nFour focus areas continued Growing societal value From the signing of the crude oil Concession that aligns with national development goals entities in Saudi Arabia to receive accreditation agreement in 1933, Aramco has sought to and community needs. under the National Volunteerism Standards for create more sustainable opportunities for the the Private Sector, affirming its leadership in In 2025, Aramco continued to drive change\nwelfare of the Kingdom and the global structured, high-impact volunteering.\nthrough various citizenship initiatives with a communities where it operates. Citizenship, focus on education, healthcare, and community During Ramadan, employees supported the and contributing to growing societal value, is resilience. From modernizing schools to Blue Box Campaign, distributing 19,300 food a firmly established principle toward which launching cutting-edge training centers, boxes and contributing 9,200 volunteer hours\nAramco dedicates resources and capabilities.\nAramco’s efforts have helped thousands and through partnerships with 61 charities, Informed by Saudi Vision 2030 and relevant advanced inclusive growth in alignment with benefiting more than 96,500 individuals.\nUN SDGs, Aramco seeks to support local Saudi Vision 2030. Aramco’s ongoing support for community-led content and develop innovative opportunities initiatives reflects its broader commitment to for the future. Education and training inclusive development, social cohesion, and Across the globe, Aramco expanded its iktva creating sustainable value for all stakeholders.\nreach through transformative projects in over Aramco’s iktva program continues to serve as a cornerstone of supply chain localization and innovators through STEM competitions like known as Ithra, is Aramco’s flagship citizenship in-Kingdom value creation. Through sustained the World Robot Olympiad and FIRST initiative. Ithra’s volunteering program stands investment in training, skills development, and Championship, to advancing sustainability as a testament to the power of giving, strategic partnerships, the program strengthens through coral reef restoration, solar-powered leadership, and community spirit, with the national capabilities while enhancing the clinics, and youth-led environmental programs, total number of hours volunteered exceeding resilience of the', ""rural Indonesia, Saudi Aramco’s programs have served thousands of workers, students, and at-risk citizens in dozens of locations throughout the region.\n)GSE( ecnanrevog\n\nlaicos ,latnemnorivne\n\nSaudi Aramco's procurement supports a diversified energy sector Responsible procurement The Company aims to cultivate local business with a goal of 70% of all expenditures in the Saudi Aramco’s commitment to ethical Kingdom being locally sourced over the next business practices extends to its supply chain three years.\nthrough its Supplier Code of Conduct which outlines mandatory policies on environmental, The Company aims to health and safety issues, fair trade practices, The Company has engaged with its business ethical sourcing, conflicts of interest, bribery, partners and suppliers to support local cultivate local business kickbacks, gifts and fraud, monitoring and community development and recruitment compliance. Saudi Aramco’s Supplier Code of through a model of scholarship and vocation with a goal of 70% of Conduct promotes the Company’s values and training in different industries. The Saudi extends and maintains its ethical standards Arabian Drilling Academy (SADA), a Saudi all expenditures in the across the supplier network, enabling long- Aramco-led collaboration, is working to train term, mutually beneficial partnerships. thousands of skilled exploration, drilling Kingdom being locally This requires that the Company’s vendors and workover talent in alignment with the sourced over the next and suppliers, and those of the Company’s Saudi Vision 2030 workforce development subsidiaries, meet the required standards aims. In September 2018 the first cohort of three years of ethics when it comes to anti-bribery and 132 drillers and service people graduated\nanti-corruption, as well as compliance with from SADA.\nall local legislation around human rights.\nThe Company is a major employer in Saudi Supply chain localization Arabia, and as part of the country’s Vision In support of the Company’s initiative to 2030, which includes goals for increasing develop local supply chains to enhance its female participation in the workforce, the long-term commercial interests and reduce Company has helped develop skilled female procurement costs, in 2015 the Company talent. The Company created the Leading launched its In-Kingdom Total Value Add National Academy (LNA) as a public-private Program (iktva), designed to increase the partnership under the National Specialized use of in-Kingdom suppliers of goods and Partnership Academies (NSPA) focusing on services. In 2019, the iktva metric reached providing women with industrial and\n56%. The Company believes that the scale technical skills training as well as soft skills of the Company’s procurement program can including speaking with impact, emotional support building a diversified energy sector intelligence and business acumen. Since in the Kingdom. In addition, the Company inception, NSPA academies have graduated believes this program not only has a positive over 18,000 trainees and currently have over\nimpact on the Kingdom’s economy but also 5,000 active students in 18 specialized\nsupports the Company’s efforts to improve institutions. LNA provides curricula in supply the efficiency and effectiveness of its supply chain, electrical, instrument, mechanical, chain. The program aims to increase the use laboratory science, and HSE disciplines. As of in-Kingdom suppliers, expand local supply the first female-focused industrial training chain capabilities and capacities, elevate the center in Saudi Arabia, LNA is paving the training and hiring of Saudi nationals, drive way to build inclusion into even the most collaboration in the industry through supplier male-dominated industrial sectors.\ndevelopment, bring new innovations to the Kingdom through R&D and promote the Kingdom as an export hub.\n\nRisk management Risk objectives Enterprise risk management framework Saudi Aramco operates in an industry characterized by price volatility, hazardous operations, and uncertain project outcomes.\nTaking informed risks is an inherent and Board necessary part of doing business. Saudi Aramco manages its strategic, operational, compliance and financial risks by continuously assessing them and undertaking appropriate Risk and HSE Committee Audit Committee responses. Business decisions are made after due consideration of rewards and associated risks.\nRisk management framework The Board of Directors provides risk oversight Executive team as a component of its strategic leadership.\nThe Risk & HSE Committee of the Board oversees the risk management framework and monitors specific major risks. Management Committee The primary role of the Risk and HSE Committee is to monitor overall management of risk and activities relating to health, safety and the environment and to assist the Board The framework is based on the Three Lines of Defense model of Directors with:\n(i) l eadership, direction, and oversight with respect to Saudi Aramco’s risk appetite, First line of defense: Second line of defense: Third line of defense:\nrisk tolerance, risk framework and risk Business assets Risk and control Internal audit strategy; and facilities functions (ii) g overnance and management of strategic and operational risks and sustainability; Identify and manage risk Monitor and report risk, Provide independent assurance and and provide guidance on the effectiveness of internal control systems (iii) f ostering a culture within Saudi Aramco that emphasizes and demonstrates"", 'and industry. A Code of protections. The existence and purpose of Business Conduct provides guidelines to the hotline is communicated to all employees by management on the Directors, Senior Executives, employees through the Company’s continuous and contract employees of the Company a regular basis compliance training campaigns and initiatives.\nand its controlled affiliates regarding, among other things, integrity, health, safety and\n2019 2018\nenvironmental protection, competition and\nAllegations received 507 462\nantitrust, anti-bribery and anti-corruption, insider trading and compliance with Concerted efforts and a communication applicable law.\nstrategy have increased trust in the system and expanded awareness and use of the Suppliers and contractors are held to the hotline across the Company’s operations.\nCompany’s standard of ethics through a All allegations have been reviewed and dedicated Supplier Code of Conduct. For investigated. In 2019, 9% of received each of these policies, the Company has allegations have resulted in cases whereby operating guidelines and instructions irregular activities were substantiated and addressing record-keeping, approval for which corrective actions were applied.\nprocedures, appropriate behavior, stakeholder responsibilities, governance, process flows, Grievance mechanisms workflow interfaces and audits.\nIn addition to the anonymous hotline, a channel exists for employees to raise To promote the adoption of the Company’s formal complaints. The Company has ethics and compliance principles into its engaged employees to promote a culture corporate culture, regular training is provided of psychological safety, where it is safe to employees across business lines, as well as to speak up.\nsuppliers and contractors, in connection with Anti-Bribery and Anti-Corruption, Conflict of Interest, and Business Ethics policies.\n\nBusiness resilience and The Company’s Operational Excellence continuity planning management system enables continuous improvement and operational discipline With its operations in the Kingdom of Saudi through management of its various systems.\nArabia, and across the globe, Saudi Aramco It comprises processes, procedures, rules recognizes the risks associated with political The Company carefully and standards that work together to govern and social instability, terrorism, and armed operations of all operating assets throughout manages security concerns conflict. The Company takes these ongoing the asset lifecycle. Examples include the risks seriously as part of its continuity Safety Management System, Environmental that could have a material planning and has demonstrated the ability Management System, Asset Integrity to recover expeditiously from even significant Management System, Energy Management effect on its business, physical attacks on its facilities. The Company Program, Business Continuity Management, carefully manages security concerns that financial position and Data Protection Program, Inspection could have a material effect on the safety Programs, Knowledge Management of its staff, contractors, its business, financial operations Program and others.\nposition, or assets.\nRefer to Section 5: Risk for more details.\n)GSE( ecnanrevog\n\nlaicos ,latnemnorivne\n\nInformation security Cybersecurity Saudi Aramco recognizes cybersecurity as The Company works to protect Company a risk-management imperative in today’s data and systems, ensure business continuity increasingly digital business, political, and and operational recovery, and repel intrusion technological landscape. The Company attempts.\naddresses cybersecurity at senior levels, including Board consideration and oversight Data privacy of the Company’s cybersecurity and assessment Data privacy compliance is important to the of risks. Cybersecurity is a top corporate risk Company and enshrined in a Board approved and is regularly reviewed by the Risk and enterprise-wide data privacy and protection HSE Committee.\npolicy, developed to protect the personal data of all employees, contractors, shareholders, customers, vendors, job Refer to Section 5: Risk for more details.\napplicants, and website users. The data privacy and protection policy obligates The Company works to The Company has programs, controls employees to ensure compliance with the and processes in place designed to protect applicable data privacy and protection laws protect Company data and Company data and systems, to ensure and regulations.\nbusiness continuity and operational recovery systems, ensure business and to repel intrusion attempts. To respond The Company’s Code of Business Conduct to an ever-changing cyber threat landscape, continuity and operational outlines expectations with respect to the Chief Information Security Officer leads maintaining the privacy of employee the cybersecurity governance management recovery, and repel personal data and the data of customers model for Saudi Aramco’s operations in and business partners. intrusion attempts the Kingdom, to establish and maintain cybersecurity policies, direct the cybersecurity programs, and mandate relevant processes, capabilities and technologies.\nIn addition, the Company has established a Supply Chain Cybersecurity Program to combat cyber risks originating from third parties.\n\nenvironmental stewardship Saudi Aramco understands the importance of managing precious natural resources Grow sustainably The Company celebrates its role in global Climate change economic development by extracting, Saudi Aramco understands that no single processing and delivering its products safely, Saudi Aramco’s “Grow Sustainably” solution is sufficient to solve the climate reliably, and efficiently.\napproach to addressing climate-related challenge. The Company’s approach risks and opportunities is based on leverages a diverse and balanced portfolio, As a company founded and operating in key commitments: champions technological innovation, and a desert']","The purpose of Aramco's Supplier Code of Conduct is to outline mandatory policies on environmental, health and safety issues, fair trade practices, ethical sourcing, and compliance with local legislation, ensuring that the Company's vendors and suppliers adhere to its ethical standards. This promotes long-term, mutually beneficial partnerships and supports local community development.

The iktva program (In-Kingdom Total Value Add Program) aims to increase the use of in-Kingdom suppliers of goods and services, enhance local supply chain capabilities, elevate the training and hiring of Saudi nationals, and drive collaboration in the industry. It is designed to support the Kingdom's economic growth and improve the efficiency and effectiveness of Aramco's supply chain.","The Supplier Code of Conduct sets mandatory standards for ethics, environmental and safety issues, and compliance across the supply chain. The iktva program aims to increase the use of in-Kingdom suppliers and build local supply chain capabilities.",0.8571428571428571,0.9942819944366236,0.99999999998,1.0
